train,stations
train_1,"[Castricum, Alkmaar, Hoorn, Zaandam, Amsterdam Sloterdijk]"
train_2,"[Dordrecht, Rotterdam Centraal, Rotterdam Alexander, Gouda, Den Haag Centraal]"
train_3,"[Zaandam, Hoorn, Amsterdam Sloterdijk, Amsterdam Zuid, Haarlem, Beverwijk]"
train_4,"[Amsterdam Amstel, Amsterdam Zuid, Amsterdam Centraal, Amsterdam Sloterdijk]"
train_5,"[Amsterdam Sloterdijk, Haarlem, Beverwijk, Zaandam]"
train_6,"[Amsterdam Amstel, Amsterdam Zuid, Amsterdam Centraal, Amsterdam Sloterdijk, Zaandam, Hoorn]"
train_7,"[Amsterdam Amstel, Amsterdam Centraal, Amsterdam Zuid, Schiphol Airport, Leiden Centraal, Amsterdam Sloterdijk, Haarlem]"
score,1352.0
