train,stations
train_1,"[Amsterdam Amstel, Amsterdam Centraal, Amsterdam Zuid, Amsterdam Sloterdijk, Schiphol Airport, Leiden Centraal, Den Haag Centraal]"
train_2,"[Haarlem, Beverwijk, Amsterdam Sloterdijk, Amsterdam Zuid, Amsterdam Amstel, Amsterdam Centraal, Zaandam]"
train_3,"[Schiedam Centrum, Delft, Rotterdam Centraal, Dordrecht, Rotterdam Alexander]"
train_4,"[Leiden Centraal, Alphen a/d Rijn, Schiphol Airport, Den Haag Centraal, Delft, Schiedam Centrum]"
train_5,"[Alkmaar, Den Helder, Castricum, Zaandam, Hoorn]"
train_6,"[Castricum, Alkmaar, Beverwijk, Haarlem, Zaandam, Amsterdam Sloterdijk, Amsterdam Centraal, Amsterdam Amstel, Amsterdam Zuid]"
train_7,"[Amsterdam Centraal, Amsterdam Sloterdijk, Amsterdam Amstel, Amsterdam Zuid, Schiphol Airport]"
score,1334.0
