train,stations
train_1,"[Beverwijk, Castricum, Alkmaar, Den Helder]"
train_2,"[Den Haag Centraal, Leiden Centraal, Alphen a/d Rijn, Schiphol Airport]"
train_3,"[Zaandam, Hoorn]"
train_4,"[Amsterdam Amstel, Amsterdam Zuid, Amsterdam Sloterdijk]"
train_5,"[Amsterdam Centraal, Amsterdam Sloterdijk, Haarlem, Beverwijk, Heemstede-Aerdenhout]"
train_6,"[Rotterdam Alexander, Gouda, Rotterdam Centraal, Schiedam Centrum, Dordrecht]"
train_7,"[Heemstede-Aerdenhout, Haarlem, Amsterdam Sloterdijk, Leiden Centraal, Den Haag Centraal, Gouda, Alphen a/d Rijn]"
score,1491.0
