train,stations
train_1,"[Amsterdam Amstel, Amsterdam Centraal, Amsterdam Sloterdijk, Zaandam, Beverwijk]"
train_2,"[Amsterdam Amstel, Amsterdam Centraal, Amsterdam Sloterdijk, Zaandam, Hoorn]"
train_3,"[Amsterdam Amstel, Amsterdam Zuid, Amsterdam Centraal]"
train_4,"[Dordrecht, Rotterdam Centraal, Schiedam Centrum, Delft]"
train_5,"[Haarlem, Beverwijk, Heemstede-Aerdenhout, Leiden Centraal, Alphen a/d Rijn]"
train_6,"[Amsterdam Amstel, Amsterdam Zuid, Amsterdam Sloterdijk, Amsterdam Centraal]"
train_7,"[Leiden Centraal, Alphen a/d Rijn, Schiphol Airport, Amsterdam Zuid, Amsterdam Sloterdijk, Zaandam]"
score,1522.0
