train,stations
train_1,"[Leiden Centraal, Alphen a/d Rijn, Heemstede-Aerdenhout, Schiphol Airport, Amsterdam Zuid, Amsterdam Sloterdijk]"
train_2,"[Rotterdam Centraal, Schiedam Centrum, Delft, Den Haag Centraal, Rotterdam Alexander, Gouda, Alphen a/d Rijn, Leiden Centraal]"
train_3,"[Beverwijk, Castricum, Alkmaar, Zaandam]"
train_4,"[Beverwijk, Castricum, Zaandam, Amsterdam Sloterdijk, Haarlem, Heemstede-Aerdenhout, Leiden Centraal, Amsterdam Zuid, Schiphol Airport]"
train_5,"[Schiedam Centrum, Delft, Den Haag Centraal, Leiden Centraal, Alphen a/d Rijn, Schiphol Airport]"
train_6,"[Amsterdam Centraal, Amsterdam Sloterdijk, Amsterdam Zuid, Haarlem, Schiphol Airport]"
train_7,"[Leiden Centraal, Schiphol Airport, Alphen a/d Rijn, Gouda, Den Haag Centraal, Delft]"
score,1327.0
