train,stations
train_1,"[Heemstede-Aerdenhout, Haarlem, Amsterdam Sloterdijk, Beverwijk, Zaandam, Hoorn]"
train_2,"[Rotterdam Alexander, Gouda, Den Haag Centraal, Leiden Centraal]"
train_3,"[Den Haag Centraal, Leiden Centraal, Gouda, Delft]"
train_4,"[Alkmaar, Hoorn]"
train_5,"[Rotterdam Centraal, Schiedam Centrum, Rotterdam Alexander, Gouda, Alphen a/d Rijn]"
train_6,"[Amsterdam Sloterdijk, Zaandam, Haarlem, Amsterdam Centraal, Amsterdam Amstel, Heemstede-Aerdenhout, Beverwijk]"
train_7,"[Zaandam, Hoorn, Alkmaar, Castricum]"
score,1462.0
