train,stations
train_1,"[Amsterdam Amstel, Amsterdam Centraal, Amsterdam Zuid, Amsterdam Sloterdijk]"
train_2,"[Delft, Den Haag Centraal, Gouda, Alphen a/d Rijn, Leiden Centraal]"
train_3,"[Leiden Centraal, Alphen a/d Rijn, Den Haag Centraal, Gouda, Rotterdam Alexander]"
train_4,"[Amsterdam Amstel, Amsterdam Centraal, Amsterdam Zuid, Schiphol Airport, Leiden Centraal, Alphen a/d Rijn, Gouda]"
train_5,"[Rotterdam Alexander, Gouda, Alphen a/d Rijn, Leiden Centraal, Heemstede-Aerdenhout, Haarlem, Amsterdam Sloterdijk, Amsterdam Zuid, Amsterdam Amstel, Amsterdam Centraal]"
train_6,"[Amsterdam Amstel, Amsterdam Zuid, Schiphol Airport, Leiden Centraal, Den Haag Centraal, Gouda]"
train_7,"[Beverwijk, Castricum, Haarlem, Heemstede-Aerdenhout, Leiden Centraal, Schiphol Airport, Den Haag Centraal, Gouda, Rotterdam Alexander]"
score,1278.0
