train,stations
train_1,"[Amsterdam Amstel, Amsterdam Zuid, Amsterdam Sloterdijk, Schiphol Airport, Amsterdam Centraal]"
train_2,"[Heemstede-Aerdenhout, Haarlem, Beverwijk, Castricum, Alkmaar, Den Helder]"
train_3,"[Den Haag Centraal, Leiden Centraal, Alphen a/d Rijn, Gouda]"
train_4,"[Amsterdam Amstel, Amsterdam Centraal, Amsterdam Zuid, Amsterdam Sloterdijk, Schiphol Airport]"
train_5,"[Rotterdam Centraal, Rotterdam Alexander, Schiedam Centrum, Gouda]"
train_6,"[Rotterdam Alexander, Gouda, Rotterdam Centraal, Alphen a/d Rijn]"
train_7,"[Amsterdam Sloterdijk, Haarlem, Heemstede-Aerdenhout, Beverwijk]"
score,1496.0
