train,stations
train_1,"[Gouda, Alphen a/d Rijn, Leiden Centraal, Den Haag Centraal, Delft]"
train_2,"[Amsterdam Sloterdijk, Zaandam, Amsterdam Zuid, Schiphol Airport, Leiden Centraal, Alphen a/d Rijn]"
train_3,"[Leiden Centraal, Alphen a/d Rijn, Schiphol Airport, Amsterdam Zuid, Amsterdam Sloterdijk, Zaandam, Beverwijk]"
train_4,"[Leiden Centraal, Alphen a/d Rijn, Gouda, Rotterdam Alexander, Den Haag Centraal, Schiphol Airport, Amsterdam Zuid]"
train_5,"[Heemstede-Aerdenhout, Haarlem, Amsterdam Sloterdijk, Zaandam, Castricum, Hoorn, Alkmaar]"
train_6,"[Amsterdam Sloterdijk, Zaandam, Amsterdam Zuid, Schiphol Airport, Amsterdam Amstel]"
train_7,"[Heemstede-Aerdenhout, Haarlem, Leiden Centraal, Schiphol Airport, Den Haag Centraal, Alphen a/d Rijn, Gouda]"
score,1298.0
