train,stations
train_1,"[Delft, Den Haag Centraal, Schiedam Centrum, Rotterdam Centraal, Rotterdam Alexander, Gouda, Alphen a/d Rijn]"
train_2,"[Zaandam, Hoorn, Amsterdam Sloterdijk, Amsterdam Centraal, Amsterdam Zuid, Haarlem]"
train_3,"[Heemstede-Aerdenhout, Haarlem, Beverwijk, Zaandam, Castricum, Alkmaar, Hoorn]"
train_4,"[Leiden Centraal, Alphen a/d Rijn, Den Haag Centraal, Delft, Gouda, Rotterdam Alexander]"
train_5,"[Alkmaar, Hoorn, Den Helder]"
train_6,"[Zaandam, Beverwijk, Castricum, Amsterdam Sloterdijk, Amsterdam Centraal, Amsterdam Amstel, Amsterdam Zuid]"
train_7,"[Delft, Den Haag Centraal, Leiden Centraal, Heemstede-Aerdenhout, Haarlem, Amsterdam Sloterdijk, Amsterdam Zuid]"
score,1250.0
