train,stations
train_1,"[Leiden Centraal, Heemstede-Aerdenhout, Haarlem, Amsterdam Sloterdijk, Beverwijk, Castricum]"
train_2,"[Amsterdam Centraal, Amsterdam Sloterdijk, Haarlem, Beverwijk, Amsterdam Zuid, Schiphol Airport]"
train_3,"[Alkmaar, Den Helder, Castricum, Hoorn]"
train_4,"[Castricum, Alkmaar, Den Helder]"
train_5,"[Delft, Den Haag Centraal, Gouda, Alphen a/d Rijn]"
train_6,"[Rotterdam Centraal, Schiedam Centrum, Dordrecht, Rotterdam Alexander, Gouda, Alphen a/d Rijn]"
train_7,"[Zaandam, Hoorn, Castricum, Amsterdam Sloterdijk, Amsterdam Zuid, Schiphol Airport, Amsterdam Amstel, Amsterdam Centraal, Haarlem]"
score,1362.0
