train,stations
train_1,"[Schiedam Centrum, Delft, Rotterdam Centraal, Dordrecht]"
train_2,"[Schiedam Centrum, Delft, Rotterdam Centraal, Dordrecht, Rotterdam Alexander, Gouda, Alphen a/d Rijn]"
train_3,"[Rotterdam Alexander, Gouda, Rotterdam Centraal, Schiedam Centrum, Delft, Den Haag Centraal, Leiden Centraal]"
train_4,"[Rotterdam Alexander, Gouda, Rotterdam Centraal, Dordrecht]"
train_5,"[Amsterdam Amstel, Amsterdam Centraal, Amsterdam Sloterdijk, Haarlem, Beverwijk, Castricum]"
train_6,"[Schiedam Centrum, Delft, Den Haag Centraal, Gouda]"
train_7,"[Rotterdam Centraal, Rotterdam Alexander, Dordrecht]"
score,1498.0
