train,stations
train_1,"[Haarlem, Beverwijk, Castricum, Alkmaar, Den Helder]"
train_2,"[Rotterdam Centraal, Rotterdam Alexander, Dordrecht, Gouda, Den Haag Centraal, Delft, Schiedam Centrum]"
train_3,"[Rotterdam Centraal, Schiedam Centrum, Delft, Den Haag Centraal, Leiden Centraal]"
train_4,"[Heemstede-Aerdenhout, Haarlem, Leiden Centraal, Alphen a/d Rijn, Schiphol Airport]"
train_5,"[Amsterdam Sloterdijk, Zaandam, Castricum, Alkmaar, Hoorn]"
train_6,"[Rotterdam Centraal, Schiedam Centrum, Dordrecht]"
train_7,"[Zaandam, Castricum, Beverwijk, Amsterdam Sloterdijk]"
score,1445.0
