train,stations
train_1,"[Leiden Centraal, Alphen a/d Rijn, Schiphol Airport, Den Haag Centraal, Gouda]"
train_2,"[Heemstede-Aerdenhout, Haarlem, Leiden Centraal, Alphen a/d Rijn, Gouda, Den Haag Centraal]"
train_3,"[Amsterdam Zuid, Schiphol Airport, Amsterdam Amstel, Amsterdam Centraal, Amsterdam Sloterdijk, Zaandam]"
train_4,"[Rotterdam Alexander, Gouda]"
train_5,"[Rotterdam Centraal, Schiedam Centrum, Delft, Rotterdam Alexander, Gouda]"
train_6,"[Amsterdam Zuid, Amsterdam Sloterdijk, Haarlem, Beverwijk, Castricum, Alkmaar]"
train_7,"[Dordrecht, Rotterdam Centraal, Rotterdam Alexander, Gouda]"
score,1466.0
