train,stations
train_1,"[Amsterdam Sloterdijk, Zaandam, Amsterdam Centraal, Amsterdam Amstel, Amsterdam Zuid, Schiphol Airport, Leiden Centraal, Heemstede-Aerdenhout]"
train_2,"[Castricum, Alkmaar, Hoorn, Zaandam, Beverwijk, Haarlem, Amsterdam Sloterdijk, Amsterdam Centraal]"
train_3,"[Amsterdam Zuid, Schiphol Airport, Amsterdam Amstel, Amsterdam Centraal]"
train_4,"[Amsterdam Zuid, Schiphol Airport, Amsterdam Sloterdijk, Haarlem, Amsterdam Amstel, Amsterdam Centraal]"
train_5,"[Amsterdam Centraal, Amsterdam Sloterdijk, Amsterdam Zuid, Schiphol Airport, Leiden Centraal, Alphen a/d Rijn, Gouda]"
train_6,"[Den Haag Centraal, Leiden Centraal, Delft, Schiedam Centrum, Rotterdam Centraal]"
train_7,"[Delft, Den Haag Centraal, Schiedam Centrum, Gouda]"
score,1387.0
