train,stations
train_1,"[Rotterdam Centraal, Rotterdam Alexander, Schiedam Centrum, Dordrecht, Gouda, Alphen a/d Rijn]"
train_2,"[Amsterdam Centraal, Amsterdam Sloterdijk, Zaandam, Beverwijk, Hoorn, Alkmaar]"
train_3,"[Beverwijk, Castricum, Zaandam, Hoorn]"
train_4,"[Alkmaar, Den Helder, Hoorn, Zaandam, Castricum, Beverwijk]"
train_5,"[Zaandam, Hoorn, Amsterdam Sloterdijk, Amsterdam Zuid, Amsterdam Amstel, Schiphol Airport, Leiden Centraal, Alphen a/d Rijn]"
train_6,"[Leiden Centraal, Alphen a/d Rijn, Den Haag Centraal, Gouda, Rotterdam Alexander]"
train_7,"[Heemstede-Aerdenhout, Haarlem, Amsterdam Sloterdijk, Amsterdam Zuid, Zaandam, Hoorn, Alkmaar]"
score,1212.0
