train,stations
train_1,"[Rotterdam Centraal, Rotterdam Alexander, Dordrecht]"
train_2,"[Rotterdam Centraal, Rotterdam Alexander, Gouda, Den Haag Centraal, Alphen a/d Rijn]"
train_3,"[Dordrecht, Rotterdam Centraal, Rotterdam Alexander, Schiedam Centrum, Delft]"
train_4,"[Amsterdam Amstel, Amsterdam Zuid, Amsterdam Centraal, Amsterdam Sloterdijk]"
train_5,"[Leiden Centraal, Schiphol Airport, Alphen a/d Rijn, Amsterdam Zuid, Amsterdam Amstel, Amsterdam Centraal]"
train_6,"[Gouda, Alphen a/d Rijn, Den Haag Centraal, Leiden Centraal]"
train_7,"[Leiden Centraal, Heemstede-Aerdenhout, Haarlem, Beverwijk, Alphen a/d Rijn]"
score,1508.0
