train,stations
train_1,"[Leiden Centraal, Heemstede-Aerdenhout, Schiphol Airport, Amsterdam Zuid, Amsterdam Amstel, Amsterdam Centraal]"
train_2,"[Leiden Centraal, Schiphol Airport, Heemstede-Aerdenhout, Alphen a/d Rijn]"
train_3,"[Rotterdam Alexander, Gouda, Rotterdam Centraal, Dordrecht]"
train_4,"[Amsterdam Amstel, Amsterdam Centraal, Amsterdam Zuid, Schiphol Airport, Amsterdam Sloterdijk, Zaandam]"
train_5,"[Amsterdam Zuid, Schiphol Airport, Amsterdam Amstel, Amsterdam Centraal, Amsterdam Sloterdijk, Zaandam, Hoorn, Castricum]"
train_6,"[Amsterdam Amstel, Amsterdam Zuid, Schiphol Airport, Leiden Centraal, Den Haag Centraal, Alphen a/d Rijn]"
train_7,"[Castricum, Alkmaar, Den Helder, Zaandam]"
score,1437.0
