train,stations
train_1,"[Amsterdam Sloterdijk, Zaandam, Amsterdam Zuid, Haarlem, Heemstede-Aerdenhout]"
train_2,"[Amsterdam Zuid, Amsterdam Sloterdijk, Zaandam]"
train_3,"[Den Haag Centraal, Leiden Centraal, Heemstede-Aerdenhout, Gouda]"
train_4,"[Den Haag Centraal, Gouda, Rotterdam Alexander, Rotterdam Centraal, Schiedam Centrum, Delft, Dordrecht]"
train_5,"[Beverwijk, Castricum, Zaandam]"
train_6,"[Leiden Centraal, Alphen a/d Rijn, Gouda]"
train_7,"[Rotterdam Centraal, Schiedam Centrum, Delft, Den Haag Centraal]"
score,1523.0
