train,stations
train_1,"[Amsterdam Sloterdijk, Haarlem, Amsterdam Centraal, Amsterdam Amstel, Beverwijk, Zaandam]"
train_2,"[Amsterdam Centraal, Amsterdam Sloterdijk, Haarlem, Amsterdam Zuid, Schiphol Airport, Leiden Centraal]"
train_3,"[Den Haag Centraal, Leiden Centraal, Schiphol Airport, Amsterdam Zuid, Amsterdam Sloterdijk, Amsterdam Centraal, Amsterdam Amstel]"
train_4,"[Amsterdam Amstel, Amsterdam Zuid, Schiphol Airport, Leiden Centraal, Alphen a/d Rijn, Gouda]"
train_5,"[Alkmaar, Den Helder, Hoorn, Zaandam, Beverwijk]"
train_6,"[Dordrecht, Rotterdam Centraal, Schiedam Centrum, Delft, Den Haag Centraal, Leiden Centraal, Schiphol Airport]"
train_7,"[Dordrecht, Rotterdam Centraal, Schiedam Centrum, Delft, Den Haag Centraal]"
score,1321.0
