train,stations
train_1,"[Amsterdam Amstel, Amsterdam Centraal, Amsterdam Sloterdijk, Amsterdam Zuid, Schiphol Airport, Leiden Centraal, Alphen a/d Rijn, Gouda, Den Haag Centraal]"
train_2,"[Delft, Den Haag Centraal, Leiden Centraal, Alphen a/d Rijn, Gouda]"
train_3,"[Rotterdam Centraal, Rotterdam Alexander, Gouda, Alphen a/d Rijn]"
train_4,"[Zaandam, Hoorn, Castricum, Beverwijk, Alkmaar]"
train_5,"[Leiden Centraal, Schiphol Airport, Amsterdam Zuid, Amsterdam Amstel, Amsterdam Sloterdijk, Amsterdam Centraal]"
train_6,"[Zaandam, Beverwijk, Castricum, Alkmaar]"
train_7,"[Zaandam, Beverwijk, Hoorn, Castricum, Alkmaar]"
score,1316.0
