train,stations
train_1,"[Castricum, Alkmaar, Hoorn, Zaandam]"
train_2,"[Dordrecht, Rotterdam Centraal, Rotterdam Alexander, Schiedam Centrum, Delft, Den Haag Centraal]"
train_3,"[Amsterdam Centraal, Amsterdam Sloterdijk, Zaandam, Castricum, Beverwijk, Haarlem, Heemstede-Aerdenhout]"
train_4,"[Amsterdam Centraal, Amsterdam Sloterdijk, Amsterdam Amstel, Amsterdam Zuid]"
train_5,"[Amsterdam Sloterdijk, Zaandam, Beverwijk, Castricum, Haarlem]"
train_6,"[Haarlem, Beverwijk, Castricum, Zaandam, Hoorn, Alkmaar]"
train_7,"[Leiden Centraal, Heemstede-Aerdenhout, Den Haag Centraal, Gouda, Alphen a/d Rijn]"
score,1359.0
