train,stations
train_1,"[Heemstede-Aerdenhout, Haarlem, Beverwijk, Zaandam, Castricum]"
train_2,"[Rotterdam Alexander, Gouda, Alphen a/d Rijn, Leiden Centraal, Den Haag Centraal, Delft]"
train_3,"[Gouda, Alphen a/d Rijn, Den Haag Centraal, Delft, Schiedam Centrum, Rotterdam Centraal]"
train_4,"[Leiden Centraal, Schiphol Airport, Amsterdam Zuid, Amsterdam Sloterdijk, Zaandam, Beverwijk, Haarlem]"
train_5,"[Zaandam, Beverwijk, Haarlem, Castricum]"
train_6,"[Rotterdam Centraal, Rotterdam Alexander, Gouda, Alphen a/d Rijn, Den Haag Centraal, Schiedam Centrum]"
train_7,"[Beverwijk, Castricum, Zaandam, Alkmaar, Den Helder]"
score,1277.0
