train,stations
train_1,"[Amsterdam Zuid, Schiphol Airport, Leiden Centraal, Alphen a/d Rijn, Gouda, Den Haag Centraal]"
train_2,"[Alkmaar, Den Helder, Hoorn, Castricum, Zaandam, Amsterdam Sloterdijk]"
train_3,"[Den Haag Centraal, Leiden Centraal, Heemstede-Aerdenhout, Haarlem, Beverwijk, Castricum, Zaandam, Hoorn]"
train_4,"[Amsterdam Amstel, Amsterdam Centraal, Amsterdam Sloterdijk, Amsterdam Zuid, Zaandam, Hoorn, Alkmaar]"
train_5,"[Zaandam, Beverwijk, Hoorn, Alkmaar, Castricum]"
train_6,"[Rotterdam Centraal, Schiedam Centrum, Delft, Rotterdam Alexander, Gouda, Alphen a/d Rijn, Leiden Centraal, Heemstede-Aerdenhout]"
train_7,"[Rotterdam Alexander, Gouda, Rotterdam Centraal, Schiedam Centrum, Delft, Den Haag Centraal, Alphen a/d Rijn, Leiden Centraal]"
score,1197.0
