train,stations
train_1,"[Dordrecht, Rotterdam Centraal, Schiedam Centrum, Delft, Rotterdam Alexander, Gouda, Alphen a/d Rijn]"
train_2,"[Heemstede-Aerdenhout, Haarlem, Leiden Centraal, Den Haag Centraal, Delft, Gouda, Alphen a/d Rijn]"
train_3,"[Dordrecht, Rotterdam Centraal, Rotterdam Alexander, Gouda, Alphen a/d Rijn, Den Haag Centraal, Leiden Centraal, Heemstede-Aerdenhout]"
train_4,"[Dordrecht, Rotterdam Centraal, Rotterdam Alexander, Gouda, Alphen a/d Rijn, Leiden Centraal, Den Haag Centraal]"
train_5,"[Zaandam, Beverwijk, Haarlem, Heemstede-Aerdenhout, Amsterdam Sloterdijk]"
train_6,"[Beverwijk, Castricum, Haarlem, Heemstede-Aerdenhout, Leiden Centraal, Den Haag Centraal, Alphen a/d Rijn]"
train_7,"[Rotterdam Centraal, Schiedam Centrum, Delft, Den Haag Centraal, Gouda, Alphen a/d Rijn, Leiden Centraal, Schiphol Airport, Amsterdam Zuid, Amsterdam Amstel]"
score,1217.0
