train,stations
train_1,"[Heemstede-Aerdenhout, Haarlem, Leiden Centraal, Den Haag Centraal, Delft]"
train_2,"[Leiden Centraal, Heemstede-Aerdenhout, Haarlem, Amsterdam Sloterdijk, Zaandam, Castricum, Alkmaar, Den Helder]"
train_3,"[Rotterdam Alexander, Gouda, Den Haag Centraal, Delft, Leiden Centraal, Alphen a/d Rijn]"
train_4,"[Heemstede-Aerdenhout, Haarlem, Leiden Centraal, Alphen a/d Rijn, Gouda, Rotterdam Alexander, Rotterdam Centraal, Schiedam Centrum, Delft]"
train_5,"[Rotterdam Centraal, Schiedam Centrum, Rotterdam Alexander, Dordrecht]"
train_6,"[Amsterdam Centraal, Amsterdam Sloterdijk, Haarlem, Heemstede-Aerdenhout, Amsterdam Amstel, Amsterdam Zuid]"
train_7,"[Dordrecht, Rotterdam Centraal, Schiedam Centrum, Rotterdam Alexander, Gouda]"
score,1403.0
