train,stations
train_1,"[Dordrecht, Rotterdam Centraal, Schiedam Centrum, Delft, Den Haag Centraal, Gouda, Rotterdam Alexander]"
train_2,"[Zaandam, Beverwijk, Castricum]"
train_3,"[Amsterdam Amstel, Amsterdam Zuid, Amsterdam Sloterdijk, Amsterdam Centraal]"
train_4,"[Leiden Centraal, Alphen a/d Rijn, Gouda]"
train_5,"[Rotterdam Centraal, Schiedam Centrum, Dordrecht, Rotterdam Alexander, Gouda]"
train_6,"[Rotterdam Alexander, Gouda, Den Haag Centraal, Alphen a/d Rijn, Leiden Centraal, Heemstede-Aerdenhout]"
train_7,"[Amsterdam Zuid, Amsterdam Sloterdijk, Zaandam, Beverwijk, Castricum, Alkmaar, Hoorn]"
score,1413.0
