train,stations
train_1,"[Alkmaar, Den Helder, Castricum, Zaandam, Amsterdam Sloterdijk, Haarlem, Heemstede-Aerdenhout]"
train_2,"[Leiden Centraal, Schiphol Airport, Amsterdam Zuid, Heemstede-Aerdenhout, Haarlem, Beverwijk, Castricum]"
train_3,"[Beverwijk, Castricum, Zaandam, Hoorn, Alkmaar]"
train_4,"[Alkmaar, Den Helder, Hoorn, Zaandam, Amsterdam Sloterdijk, Amsterdam Centraal, Amsterdam Amstel, Amsterdam Zuid]"
train_5,"[Dordrecht, Rotterdam Centraal, Schiedam Centrum, Delft]"
train_6,"[Haarlem, Beverwijk, Zaandam, Castricum, Hoorn]"
train_7,"[Beverwijk, Castricum, Zaandam, Amsterdam Sloterdijk, Haarlem, Alkmaar]"
score,1259.0
