train,stations
train_1,"[Schiedam Centrum, Delft, Rotterdam Centraal, Rotterdam Alexander, Gouda, Alphen a/d Rijn]"
train_2,"[Schiedam Centrum, Delft, Den Haag Centraal, Leiden Centraal, Alphen a/d Rijn]"
train_3,"[Haarlem, Beverwijk, Castricum, Zaandam, Amsterdam Sloterdijk, Amsterdam Zuid, Amsterdam Amstel, Schiphol Airport]"
train_4,"[Heemstede-Aerdenhout, Haarlem, Amsterdam Sloterdijk, Amsterdam Centraal, Amsterdam Zuid, Schiphol Airport, Leiden Centraal]"
train_5,"[Den Haag Centraal, Gouda, Leiden Centraal, Delft, Schiedam Centrum, Rotterdam Centraal, Dordrecht]"
train_6,"[Leiden Centraal, Alphen a/d Rijn, Schiphol Airport, Amsterdam Zuid, Amsterdam Sloterdijk, Amsterdam Amstel, Haarlem]"
train_7,"[Leiden Centraal, Heemstede-Aerdenhout, Schiphol Airport, Amsterdam Zuid, Amsterdam Sloterdijk, Haarlem, Beverwijk, Castricum]"
score,1332.0
