train,stations
train_1,"[Amsterdam Zuid, Schiphol Airport, Leiden Centraal, Amsterdam Amstel, Den Haag Centraal]"
train_2,"[Dordrecht, Rotterdam Centraal, Schiedam Centrum, Rotterdam Alexander]"
train_3,"[Alkmaar, Den Helder]"
train_4,"[Alkmaar, Den Helder]"
train_5,"[Schiedam Centrum, Delft, Den Haag Centraal, Gouda, Alphen a/d Rijn, Leiden Centraal]"
train_6,"[Den Haag Centraal, Gouda, Rotterdam Alexander, Rotterdam Centraal]"
train_7,"[Amsterdam Zuid, Amsterdam Sloterdijk, Amsterdam Amstel, Haarlem, Heemstede-Aerdenhout, Leiden Centraal]"
score,1492.0
