train,stations
train_1,"[Rotterdam Blaak, Rotterdam Alexander, Rotterdam Centraal, Schiedam Centrum, Rotterdam Centraal, Schiedam Centrum, Rotterdam Centraal, Schiedam Centrum, Rotterdam Centraal, Schiedam Centrum, Rotterdam Centraal, Schiedam Centrum, Rotterdam Centraal, Schiedam Centrum, Rotterdam Centraal, Schiedam Centrum, Rotterdam Centraal, Schiedam Centrum, Rotterdam Centraal, Schiedam Centrum, Rotterdam Centraal, Schiedam Centrum, Rotterdam Centraal, Schiedam Centrum, Rotterdam Centraal, Schiedam Centrum, Rotterdam Centraal, Schiedam Centrum, Rotterdam Centraal, Schiedam Centrum, Rotterdam Centraal, Schiedam Centrum, Rotterdam Centraal, Schiedam Centrum, Rotterdam Centraal]"
train_2,"[Dordrecht, Rotterdam Blaak, Rotterdam Alexander, Rotterdam Centraal, Schiedam Centrum, Rotterdam Centraal, Schiedam Centrum, Rotterdam Centraal, Schiedam Centrum, Rotterdam Centraal, Schiedam Centrum, Rotterdam Centraal, Schiedam Centrum, Rotterdam Centraal, Schiedam Centrum, Rotterdam Centraal, Schiedam Centrum, Rotterdam Centraal, Schiedam Centrum, Rotterdam Centraal, Schiedam Centrum, Rotterdam Centraal, Schiedam Centrum, Rotterdam Centraal, Schiedam Centrum, Rotterdam Centraal, Schiedam Centrum, Rotterdam Centraal, Schiedam Centrum, Rotterdam Centraal, Schiedam Centrum, Rotterdam Centraal, Schiedam Centrum]"
train_3,"[Heemstede-Aerdenhout, Haarlem, Heemstede-Aerdenhout, Haarlem, Heemstede-Aerdenhout, Haarlem, Heemstede-Aerdenhout, Haarlem, Heemstede-Aerdenhout, Haarlem, Heemstede-Aerdenhout, Haarlem, Heemstede-Aerdenhout, Haarlem, Heemstede-Aerdenhout, Haarlem, Heemstede-Aerdenhout, Haarlem, Heemstede-Aerdenhout, Haarlem, Heemstede-Aerdenhout, Haarlem, Heemstede-Aerdenhout, Haarlem, Heemstede-Aerdenhout, Haarlem, Heemstede-Aerdenhout, Haarlem, Heemstede-Aerdenhout, Haarlem]"
train_4,"[Schiedam Centrum, Rotterdam Centraal, Schiedam Centrum, Rotterdam Centraal, Schiedam Centrum, Rotterdam Centraal, Schiedam Centrum, Rotterdam Centraal, Schiedam Centrum, Rotterdam Centraal, Schiedam Centrum, Rotterdam Centraal, Schiedam Centrum, Rotterdam Centraal, Schiedam Centrum, Rotterdam Centraal, Schiedam Centrum, Rotterdam Centraal, Schiedam Centrum, Rotterdam Centraal, Schiedam Centrum, Rotterdam Centraal, Schiedam Centrum, Rotterdam Centraal, Schiedam Centrum, Rotterdam Centraal, Schiedam Centrum, Rotterdam Centraal, Schiedam Centrum, Rotterdam Centraal, Schiedam Centrum, Rotterdam Centraal, Schiedam Centrum, Rotterdam Centraal, Schiedam Centrum, Rotterdam Centraal]"
train_5,"[Nijmegen, Arnhem Centraal, Ede-Wageningen, Arnhem Centraal, Ede-Wageningen, Arnhem Centraal, Ede-Wageningen, Arnhem Centraal, Ede-Wageningen, Arnhem Centraal, Ede-Wageningen, Arnhem Centraal, Ede-Wageningen, Arnhem Centraal, Ede-Wageningen, Arnhem Centraal, Ede-Wageningen, Arnhem Centraal]"
train_6,"[Den Haag HS, Delft, Schiedam Centrum, Rotterdam Centraal, Schiedam Centrum, Rotterdam Centraal, Schiedam Centrum, Rotterdam Centraal, Schiedam Centrum, Rotterdam Centraal, Schiedam Centrum, Rotterdam Centraal, Schiedam Centrum, Rotterdam Centraal, Schiedam Centrum, Rotterdam Centraal, Schiedam Centrum, Rotterdam Centraal, Schiedam Centrum, Rotterdam Centraal, Schiedam Centrum, Rotterdam Centraal, Schiedam Centrum, Rotterdam Centraal, Schiedam Centrum, Rotterdam Centraal, Schiedam Centrum, Rotterdam Centraal, Schiedam Centrum, Rotterdam Centraal, Schiedam Centrum, Rotterdam Centraal, Schiedam Centrum, Rotterdam Centraal, Schiedam Centrum]"
train_7,"[Leiden Centraal, Den Haag Laan v NOI, Leiden Centraal, Den Haag Laan v NOI, Leiden Centraal, Den Haag Laan v NOI, Leiden Centraal, Den Haag Laan v NOI, Leiden Centraal, Den Haag Laan v NOI, Leiden Centraal, Den Haag Laan v NOI, Leiden Centraal, Den Haag Laan v NOI, Leiden Centraal, Den Haag Laan v NOI, Leiden Centraal, Den Haag Laan v NOI, Leiden Centraal, Den Haag Laan v NOI]"
train_8,"[Zaandam, Amsterdam Sloterdijk, Amsterdam Centraal, Amsterdam Sloterdijk, Amsterdam Centraal, Amsterdam Sloterdijk, Amsterdam Centraal, Amsterdam Sloterdijk, Amsterdam Centraal, Amsterdam Sloterdijk, Amsterdam Centraal, Amsterdam Sloterdijk, Amsterdam Centraal, Amsterdam Sloterdijk, Amsterdam Centraal, Amsterdam Sloterdijk, Amsterdam Centraal, Amsterdam Sloterdijk, Amsterdam Centraal, Amsterdam Sloterdijk, Amsterdam Centraal, Amsterdam Sloterdijk, Amsterdam Centraal, Amsterdam Sloterdijk, Amsterdam Centraal, Amsterdam Sloterdijk, Amsterdam Centraal, Amsterdam Sloterdijk, Amsterdam Centraal, Amsterdam Sloterdijk]"
train_9,"[Heerlen, Sittard, Maastricht, Sittard, Maastricht, Sittard, Maastricht, Sittard, Maastricht, Sittard, Maastricht, Sittard]"
train_10,"[Den Haag Centraal, Leiden Centraal, Den Haag Laan v NOI, Leiden Centraal, Den Haag Laan v NOI, Leiden Centraal, Den Haag Laan v NOI, Leiden Centraal, Den Haag Laan v NOI, Leiden Centraal, Den Haag Laan v NOI, Leiden Centraal, Den Haag Laan v NOI, Leiden Centraal, Den Haag Laan v NOI, Leiden Centraal, Den Haag Laan v NOI, Leiden Centraal, Den Haag Laan v NOI, Leiden Centraal]"
train_11,"[Oss, s-Hertogenbosch, Oss, s-Hertogenbosch, Oss, s-Hertogenbosch, Oss, s-Hertogenbosch, Oss, s-Hertogenbosch, Oss, s-Hertogenbosch, Oss, s-Hertogenbosch, Oss, s-Hertogenbosch, Oss]"
train_12,"[Utrecht Centraal, Amersfoort, Utrecht Centraal, Amersfoort, Utrecht Centraal, Amersfoort, Utrecht Centraal, Amersfoort, Utrecht Centraal, Amersfoort, Utrecht Centraal, Amersfoort, Utrecht Centraal]"
train_13,"[Den Helder, Alkmaar, Castricum, Alkmaar, Castricum, Alkmaar, Castricum, Alkmaar, Castricum, Alkmaar, Castricum, Alkmaar, Castricum, Alkmaar, Castricum, Alkmaar, Castricum]"
train_14,"[Ede-Wageningen, Arnhem Centraal, Ede-Wageningen, Arnhem Centraal, Ede-Wageningen, Arnhem Centraal, Ede-Wageningen, Arnhem Centraal, Ede-Wageningen, Arnhem Centraal, Ede-Wageningen, Arnhem Centraal, Ede-Wageningen, Arnhem Centraal, Ede-Wageningen, Arnhem Centraal, Ede-Wageningen, Arnhem Centraal]"
train_15,"[Leeuwarden, Heerenveen, Steenwijk, Heerenveen, Steenwijk, Heerenveen, Steenwijk, Heerenveen, Steenwijk, Heerenveen, Steenwijk, Heerenveen, Steenwijk]"
train_16,"[Hoorn, Alkmaar, Castricum, Alkmaar, Castricum, Alkmaar, Castricum, Alkmaar, Castricum, Alkmaar, Castricum, Alkmaar, Castricum, Alkmaar, Castricum, Alkmaar, Castricum, Alkmaar, Castricum]"
train_17,"[Dordrecht, Rotterdam Blaak, Rotterdam Alexander, Rotterdam Centraal, Schiedam Centrum, Rotterdam Centraal, Schiedam Centrum, Rotterdam Centraal, Schiedam Centrum, Rotterdam Centraal, Schiedam Centrum, Rotterdam Centraal, Schiedam Centrum, Rotterdam Centraal, Schiedam Centrum, Rotterdam Centraal, Schiedam Centrum, Rotterdam Centraal, Schiedam Centrum, Rotterdam Centraal, Schiedam Centrum, Rotterdam Centraal, Schiedam Centrum, Rotterdam Centraal, Schiedam Centrum, Rotterdam Centraal, Schiedam Centrum, Rotterdam Centraal, Schiedam Centrum, Rotterdam Centraal, Schiedam Centrum, Rotterdam Centraal, Schiedam Centrum]"
train_18,"[Heerlen, Sittard, Maastricht, Sittard, Maastricht, Sittard, Maastricht, Sittard, Maastricht, Sittard, Maastricht, Sittard]"
train_19,"[Ede-Wageningen, Arnhem Centraal, Ede-Wageningen, Arnhem Centraal, Ede-Wageningen, Arnhem Centraal, Ede-Wageningen, Arnhem Centraal, Ede-Wageningen, Arnhem Centraal, Ede-Wageningen, Arnhem Centraal, Ede-Wageningen, Arnhem Centraal, Ede-Wageningen, Arnhem Centraal, Ede-Wageningen, Arnhem Centraal]"
train_20,"[Apeldoorn, Deventer, Apeldoorn, Deventer, Apeldoorn, Deventer, Apeldoorn, Deventer, Apeldoorn, Deventer, Apeldoorn, Deventer, Apeldoorn, Deventer, Apeldoorn, Deventer, Apeldoorn, Deventer]"
score,-2961.7303370786517
