train,stations
train_1,"[Eindhoven, Helmond, Eindhoven, Helmond, Eindhoven, Helmond, Eindhoven, Helmond, Eindhoven, Helmond, Eindhoven, Helmond, Eindhoven, Helmond, Eindhoven, Helmond, Eindhoven, Helmond, Eindhoven, Helmond]"
train_2,"[Alphen a/d Rijn, Leiden Centraal, Den Haag Laan v NOI, Leiden Centraal, Den Haag Laan v NOI, Leiden Centraal, Den Haag Laan v NOI, Leiden Centraal, Den Haag Laan v NOI, Leiden Centraal, Den Haag Laan v NOI, Leiden Centraal, Den Haag Laan v NOI, Leiden Centraal, Den Haag Laan v NOI, Leiden Centraal, Den Haag Laan v NOI, Leiden Centraal, Den Haag Laan v NOI, Leiden Centraal]"
train_3,"[Den Haag HS, Delft, Schiedam Centrum, Rotterdam Centraal, Schiedam Centrum, Rotterdam Centraal, Schiedam Centrum, Rotterdam Centraal, Schiedam Centrum, Rotterdam Centraal, Schiedam Centrum, Rotterdam Centraal, Schiedam Centrum, Rotterdam Centraal, Schiedam Centrum, Rotterdam Centraal, Schiedam Centrum, Rotterdam Centraal, Schiedam Centrum, Rotterdam Centraal, Schiedam Centrum, Rotterdam Centraal, Schiedam Centrum, Rotterdam Centraal, Schiedam Centrum, Rotterdam Centraal, Schiedam Centrum, Rotterdam Centraal, Schiedam Centrum, Rotterdam Centraal, Schiedam Centrum, Rotterdam Centraal, Schiedam Centrum, Rotterdam Centraal, Schiedam Centrum]"
train_4,"[Rotterdam Centraal, Schiedam Centrum, Rotterdam Centraal, Schiedam Centrum, Rotterdam Centraal, Schiedam Centrum, Rotterdam Centraal, Schiedam Centrum, Rotterdam Centraal, Schiedam Centrum, Rotterdam Centraal, Schiedam Centrum, Rotterdam Centraal, Schiedam Centrum, Rotterdam Centraal, Schiedam Centrum, Rotterdam Centraal, Schiedam Centrum, Rotterdam Centraal, Schiedam Centrum, Rotterdam Centraal, Schiedam Centrum, Rotterdam Centraal, Schiedam Centrum, Rotterdam Centraal, Schiedam Centrum, Rotterdam Centraal, Schiedam Centrum, Rotterdam Centraal, Schiedam Centrum, Rotterdam Centraal, Schiedam Centrum, Rotterdam Centraal, Schiedam Centrum, Rotterdam Centraal, Schiedam Centrum]"
train_5,"[Haarlem, Heemstede-Aerdenhout, Haarlem, Heemstede-Aerdenhout, Haarlem, Heemstede-Aerdenhout, Haarlem, Heemstede-Aerdenhout, Haarlem, Heemstede-Aerdenhout, Haarlem, Heemstede-Aerdenhout, Haarlem, Heemstede-Aerdenhout, Haarlem, Heemstede-Aerdenhout, Haarlem, Heemstede-Aerdenhout, Haarlem, Heemstede-Aerdenhout, Haarlem, Heemstede-Aerdenhout, Haarlem, Heemstede-Aerdenhout, Haarlem, Heemstede-Aerdenhout, Haarlem, Heemstede-Aerdenhout, Haarlem, Heemstede-Aerdenhout]"
train_6,"[Nijmegen, Arnhem Centraal, Ede-Wageningen, Arnhem Centraal, Ede-Wageningen, Arnhem Centraal, Ede-Wageningen, Arnhem Centraal, Ede-Wageningen, Arnhem Centraal, Ede-Wageningen, Arnhem Centraal, Ede-Wageningen, Arnhem Centraal, Ede-Wageningen, Arnhem Centraal, Ede-Wageningen, Arnhem Centraal]"
train_7,"[Hilversum, Utrecht Centraal, Amersfoort, Utrecht Centraal, Amersfoort, Utrecht Centraal, Amersfoort, Utrecht Centraal, Amersfoort, Utrecht Centraal, Amersfoort, Utrecht Centraal, Amersfoort]"
train_8,"[Gouda, Rotterdam Alexander, Rotterdam Centraal, Schiedam Centrum, Rotterdam Centraal, Schiedam Centrum, Rotterdam Centraal, Schiedam Centrum, Rotterdam Centraal, Schiedam Centrum, Rotterdam Centraal, Schiedam Centrum, Rotterdam Centraal, Schiedam Centrum, Rotterdam Centraal, Schiedam Centrum, Rotterdam Centraal, Schiedam Centrum, Rotterdam Centraal, Schiedam Centrum, Rotterdam Centraal, Schiedam Centrum, Rotterdam Centraal, Schiedam Centrum, Rotterdam Centraal, Schiedam Centrum, Rotterdam Centraal, Schiedam Centrum, Rotterdam Centraal, Schiedam Centrum, Rotterdam Centraal, Schiedam Centrum, Rotterdam Centraal, Schiedam Centrum, Rotterdam Centraal]"
train_9,"[Amersfoort, Utrecht Centraal, Amersfoort, Utrecht Centraal, Amersfoort, Utrecht Centraal, Amersfoort, Utrecht Centraal, Amersfoort, Utrecht Centraal, Amersfoort, Utrecht Centraal, Amersfoort]"
train_10,"[Amsterdam Sloterdijk, Amsterdam Centraal, Amsterdam Sloterdijk, Amsterdam Centraal, Amsterdam Sloterdijk, Amsterdam Centraal, Amsterdam Sloterdijk, Amsterdam Centraal, Amsterdam Sloterdijk, Amsterdam Centraal, Amsterdam Sloterdijk, Amsterdam Centraal, Amsterdam Sloterdijk, Amsterdam Centraal, Amsterdam Sloterdijk, Amsterdam Centraal, Amsterdam Sloterdijk, Amsterdam Centraal, Amsterdam Sloterdijk, Amsterdam Centraal, Amsterdam Sloterdijk, Amsterdam Centraal, Amsterdam Sloterdijk, Amsterdam Centraal, Amsterdam Sloterdijk, Amsterdam Centraal, Amsterdam Sloterdijk, Amsterdam Centraal, Amsterdam Sloterdijk, Amsterdam Centraal]"
train_11,"[Maastricht, Sittard, Maastricht, Sittard, Maastricht, Sittard, Maastricht, Sittard, Maastricht, Sittard, Maastricht, Sittard]"
train_12,"[Amsterdam Amstel, Amsterdam Centraal, Amsterdam Sloterdijk, Amsterdam Centraal, Amsterdam Sloterdijk, Amsterdam Centraal, Amsterdam Sloterdijk, Amsterdam Centraal, Amsterdam Sloterdijk, Amsterdam Centraal, Amsterdam Sloterdijk, Amsterdam Centraal, Amsterdam Sloterdijk, Amsterdam Centraal, Amsterdam Sloterdijk, Amsterdam Centraal, Amsterdam Sloterdijk, Amsterdam Centraal, Amsterdam Sloterdijk, Amsterdam Centraal, Amsterdam Sloterdijk, Amsterdam Centraal, Amsterdam Sloterdijk, Amsterdam Centraal, Amsterdam Sloterdijk, Amsterdam Centraal, Amsterdam Sloterdijk, Amsterdam Centraal, Amsterdam Sloterdijk, Amsterdam Centraal]"
train_13,"[Amsterdam Amstel, Amsterdam Centraal, Amsterdam Sloterdijk, Amsterdam Centraal, Amsterdam Sloterdijk, Amsterdam Centraal, Amsterdam Sloterdijk, Amsterdam Centraal, Amsterdam Sloterdijk, Amsterdam Centraal, Amsterdam Sloterdijk, Amsterdam Centraal, Amsterdam Sloterdijk, Amsterdam Centraal, Amsterdam Sloterdijk, Amsterdam Centraal, Amsterdam Sloterdijk, Amsterdam Centraal, Amsterdam Sloterdijk, Amsterdam Centraal, Amsterdam Sloterdijk, Amsterdam Centraal, Amsterdam Sloterdijk, Amsterdam Centraal, Amsterdam Sloterdijk, Amsterdam Centraal, Amsterdam Sloterdijk, Amsterdam Centraal, Amsterdam Sloterdijk, Amsterdam Centraal]"
train_14,"[Gouda, Rotterdam Alexander, Rotterdam Centraal, Schiedam Centrum, Rotterdam Centraal, Schiedam Centrum, Rotterdam Centraal, Schiedam Centrum, Rotterdam Centraal, Schiedam Centrum, Rotterdam Centraal, Schiedam Centrum, Rotterdam Centraal, Schiedam Centrum, Rotterdam Centraal, Schiedam Centrum, Rotterdam Centraal, Schiedam Centrum, Rotterdam Centraal, Schiedam Centrum, Rotterdam Centraal, Schiedam Centrum, Rotterdam Centraal, Schiedam Centrum, Rotterdam Centraal, Schiedam Centrum, Rotterdam Centraal, Schiedam Centrum, Rotterdam Centraal, Schiedam Centrum, Rotterdam Centraal, Schiedam Centrum, Rotterdam Centraal, Schiedam Centrum, Rotterdam Centraal]"
train_15,"[Heerenveen, Steenwijk, Heerenveen, Steenwijk, Heerenveen, Steenwijk, Heerenveen, Steenwijk, Heerenveen, Steenwijk, Heerenveen, Steenwijk, Heerenveen]"
train_16,"[Schiedam Centrum, Rotterdam Centraal, Schiedam Centrum, Rotterdam Centraal, Schiedam Centrum, Rotterdam Centraal, Schiedam Centrum, Rotterdam Centraal, Schiedam Centrum, Rotterdam Centraal, Schiedam Centrum, Rotterdam Centraal, Schiedam Centrum, Rotterdam Centraal, Schiedam Centrum, Rotterdam Centraal, Schiedam Centrum, Rotterdam Centraal, Schiedam Centrum, Rotterdam Centraal, Schiedam Centrum, Rotterdam Centraal, Schiedam Centrum, Rotterdam Centraal, Schiedam Centrum, Rotterdam Centraal, Schiedam Centrum, Rotterdam Centraal, Schiedam Centrum, Rotterdam Centraal, Schiedam Centrum, Rotterdam Centraal, Schiedam Centrum, Rotterdam Centraal, Schiedam Centrum, Rotterdam Centraal]"
train_17,"[Leeuwarden, Heerenveen, Steenwijk, Heerenveen, Steenwijk, Heerenveen, Steenwijk, Heerenveen, Steenwijk, Heerenveen, Steenwijk, Heerenveen, Steenwijk]"
train_18,"[Alkmaar, Castricum, Alkmaar, Castricum, Alkmaar, Castricum, Alkmaar, Castricum, Alkmaar, Castricum, Alkmaar, Castricum, Alkmaar, Castricum, Alkmaar, Castricum, Alkmaar, Castricum, Alkmaar, Castricum]"
train_19,"[Zaandam, Amsterdam Sloterdijk, Amsterdam Centraal, Amsterdam Sloterdijk, Amsterdam Centraal, Amsterdam Sloterdijk, Amsterdam Centraal, Amsterdam Sloterdijk, Amsterdam Centraal, Amsterdam Sloterdijk, Amsterdam Centraal, Amsterdam Sloterdijk, Amsterdam Centraal, Amsterdam Sloterdijk, Amsterdam Centraal, Amsterdam Sloterdijk, Amsterdam Centraal, Amsterdam Sloterdijk, Amsterdam Centraal, Amsterdam Sloterdijk, Amsterdam Centraal, Amsterdam Sloterdijk, Amsterdam Centraal, Amsterdam Sloterdijk, Amsterdam Centraal, Amsterdam Sloterdijk, Amsterdam Centraal, Amsterdam Sloterdijk, Amsterdam Centraal, Amsterdam Sloterdijk]"
train_20,"[Den Haag HS, Delft, Schiedam Centrum, Rotterdam Centraal, Schiedam Centrum, Rotterdam Centraal, Schiedam Centrum, Rotterdam Centraal, Schiedam Centrum, Rotterdam Centraal, Schiedam Centrum, Rotterdam Centraal, Schiedam Centrum, Rotterdam Centraal, Schiedam Centrum, Rotterdam Centraal, Schiedam Centrum, Rotterdam Centraal, Schiedam Centrum, Rotterdam Centraal, Schiedam Centrum, Rotterdam Centraal, Schiedam Centrum, Rotterdam Centraal, Schiedam Centrum, Rotterdam Centraal, Schiedam Centrum, Rotterdam Centraal, Schiedam Centrum, Rotterdam Centraal, Schiedam Centrum, Rotterdam Centraal, Schiedam Centrum, Rotterdam Centraal, Schiedam Centrum]"
score,-3283.808988764045
