train,stations
train_1,"[Alkmaar, Den Helder]"
train_2,"[Delft, Den Haag Centraal, Leiden Centraal, Heemstede-Aerdenhout, Haarlem, Beverwijk, Castricum]"
train_3,"[Dordrecht, Rotterdam Centraal, Rotterdam Alexander, Schiedam Centrum]"
train_4,"[Rotterdam Alexander, Gouda, Den Haag Centraal, Delft, Schiedam Centrum]"
train_5,"[Rotterdam Centraal, Rotterdam Alexander, Schiedam Centrum, Dordrecht]"
train_6,"[Rotterdam Alexander, Gouda, Rotterdam Centraal, Dordrecht, Schiedam Centrum, Delft]"
train_7,"[Rotterdam Centraal, Schiedam Centrum, Dordrecht]"
score,1514.0
