train,stations
train_1,"[Heemstede-Aerdenhout, Haarlem, Beverwijk, Castricum, Zaandam, Amsterdam Sloterdijk, Amsterdam Zuid, Amsterdam Amstel, Amsterdam Centraal, Schiphol Airport]"
train_2,"[Rotterdam Centraal, Schiedam Centrum, Rotterdam Alexander, Dordrecht, Delft, Den Haag Centraal, Gouda]"
train_3,"[Schiedam Centrum, Delft, Den Haag Centraal, Leiden Centraal, Heemstede-Aerdenhout]"
train_4,"[Amsterdam Centraal, Amsterdam Sloterdijk, Amsterdam Zuid, Schiphol Airport, Leiden Centraal, Den Haag Centraal, Delft]"
train_5,"[Heemstede-Aerdenhout, Haarlem, Beverwijk, Castricum, Alkmaar, Hoorn, Zaandam]"
train_6,"[Heemstede-Aerdenhout, Haarlem, Beverwijk, Castricum, Zaandam, Amsterdam Sloterdijk, Amsterdam Centraal, Amsterdam Zuid]"
train_7,"[Delft, Den Haag Centraal, Schiedam Centrum, Leiden Centraal, Heemstede-Aerdenhout, Haarlem, Beverwijk, Castricum, Zaandam, Amsterdam Sloterdijk]"
score,1234.0
