train,stations
train_1,"[Amsterdam Amstel, Amsterdam Zuid, Amsterdam Sloterdijk, Haarlem, Heemstede-Aerdenhout, Beverwijk, Castricum]"
train_2,"[Alkmaar, Den Helder, Castricum, Beverwijk, Zaandam, Amsterdam Sloterdijk, Haarlem, Heemstede-Aerdenhout]"
train_3,"[Haarlem, Beverwijk, Zaandam, Hoorn, Alkmaar, Castricum]"
train_4,"[Amsterdam Sloterdijk, Zaandam, Castricum, Hoorn, Alkmaar, Den Helder]"
train_5,"[Alkmaar, Den Helder, Castricum]"
train_6,"[Alkmaar, Den Helder, Castricum, Beverwijk, Haarlem, Heemstede-Aerdenhout, Leiden Centraal, Den Haag Centraal]"
train_7,"[Leiden Centraal, Alphen a/d Rijn, Gouda, Den Haag Centraal, Delft, Schiedam Centrum, Rotterdam Centraal, Dordrecht]"
score,1175.0
