train,stations
train_1,"[Amsterdam Amstel, Amsterdam Centraal, Amsterdam Sloterdijk, Zaandam, Castricum, Alkmaar, Den Helder]"
train_2,"[Rotterdam Centraal, Rotterdam Alexander, Gouda, Den Haag Centraal, Leiden Centraal, Schiphol Airport, Amsterdam Zuid, Amsterdam Sloterdijk, Zaandam, Haarlem]"
train_3,"[Beverwijk, Castricum, Zaandam, Hoorn, Alkmaar]"
train_4,"[Amsterdam Sloterdijk, Haarlem, Zaandam, Hoorn, Alkmaar, Den Helder]"
train_5,"[Rotterdam Centraal, Schiedam Centrum, Rotterdam Alexander, Dordrecht, Gouda, Den Haag Centraal, Leiden Centraal]"
train_6,"[Heemstede-Aerdenhout, Haarlem, Beverwijk, Zaandam, Castricum, Alkmaar]"
train_7,"[Rotterdam Centraal, Schiedam Centrum, Rotterdam Alexander, Gouda, Den Haag Centraal, Leiden Centraal, Alphen a/d Rijn]"
score,1203.0
