train,stations
train_1,"[Zaandam, Castricum, Alkmaar, Hoorn, Beverwijk]"
train_2,"[Delft, Den Haag Centraal, Leiden Centraal, Alphen a/d Rijn, Gouda]"
train_3,"[Zaandam, Beverwijk, Castricum, Alkmaar, Den Helder]"
train_4,"[Leiden Centraal, Heemstede-Aerdenhout, Schiphol Airport, Amsterdam Zuid, Alphen a/d Rijn, Gouda]"
train_5,"[Heemstede-Aerdenhout, Haarlem, Leiden Centraal, Alphen a/d Rijn, Amsterdam Sloterdijk]"
train_6,"[Gouda, Alphen a/d Rijn, Den Haag Centraal, Delft, Leiden Centraal]"
train_7,"[Rotterdam Alexander, Gouda, Den Haag Centraal, Delft, Schiedam Centrum, Rotterdam Centraal]"
score,1317.0
