train,stations
train_1,"[Alkmaar, Den Helder, Hoorn, Castricum, Beverwijk]"
train_2,"[Leiden Centraal, Alphen a/d Rijn, Gouda, Den Haag Centraal]"
train_3,"[Delft, Den Haag Centraal, Leiden Centraal, Schiphol Airport, Alphen a/d Rijn, Gouda, Rotterdam Alexander, Rotterdam Centraal]"
train_4,"[Amsterdam Amstel, Amsterdam Centraal, Amsterdam Zuid, Amsterdam Sloterdijk, Haarlem, Beverwijk, Heemstede-Aerdenhout, Leiden Centraal, Alphen a/d Rijn]"
train_5,"[Heemstede-Aerdenhout, Haarlem, Leiden Centraal, Alphen a/d Rijn, Den Haag Centraal, Delft, Schiedam Centrum, Rotterdam Centraal, Dordrecht]"
train_6,"[Den Haag Centraal, Gouda, Alphen a/d Rijn, Leiden Centraal, Schiphol Airport, Amsterdam Zuid, Amsterdam Amstel, Amsterdam Centraal]"
train_7,"[Leiden Centraal, Alphen a/d Rijn, Schiphol Airport, Amsterdam Zuid, Amsterdam Sloterdijk, Haarlem, Zaandam, Beverwijk]"
score,1222.0
