train,stations
train_1,"[Amsterdam Amstel, Amsterdam Centraal, Amsterdam Zuid, Amsterdam Sloterdijk, Zaandam, Hoorn]"
train_2,"[Amsterdam Centraal, Amsterdam Sloterdijk, Haarlem, Heemstede-Aerdenhout, Leiden Centraal]"
train_3,"[Schiedam Centrum, Delft, Den Haag Centraal, Rotterdam Centraal]"
train_4,"[Amsterdam Amstel, Amsterdam Centraal, Amsterdam Zuid, Amsterdam Sloterdijk, Haarlem, Zaandam, Beverwijk]"
train_5,"[Schiedam Centrum, Delft, Rotterdam Centraal, Dordrecht]"
train_6,"[Dordrecht, Rotterdam Centraal, Rotterdam Alexander, Gouda, Den Haag Centraal, Leiden Centraal, Delft]"
train_7,"[Amsterdam Amstel, Amsterdam Centraal, Amsterdam Zuid, Schiphol Airport, Leiden Centraal, Heemstede-Aerdenhout, Haarlem]"
score,1436.0
