train,stations
train_1,"[Alkmaar, Den Helder, Castricum, Zaandam, Hoorn]"
train_2,"[Leiden Centraal, Heemstede-Aerdenhout, Den Haag Centraal, Delft, Schiedam Centrum, Rotterdam Centraal, Rotterdam Alexander, Gouda]"
train_3,"[Rotterdam Centraal, Schiedam Centrum, Rotterdam Alexander, Gouda, Den Haag Centraal, Leiden Centraal, Heemstede-Aerdenhout]"
train_4,"[Amsterdam Amstel, Amsterdam Centraal, Amsterdam Zuid, Amsterdam Sloterdijk, Zaandam, Beverwijk, Haarlem, Heemstede-Aerdenhout, Leiden Centraal, Schiphol Airport]"
train_5,"[Zaandam, Castricum, Beverwijk, Haarlem, Amsterdam Sloterdijk, Heemstede-Aerdenhout, Leiden Centraal]"
train_6,"[Zaandam, Castricum, Hoorn, Alkmaar]"
train_7,"[Zaandam, Hoorn, Castricum, Beverwijk, Amsterdam Sloterdijk]"
score,1247.0
