train,stations
train_1,"[Haarlem, Beverwijk, Castricum, Alkmaar, Hoorn, Zaandam, Amsterdam Sloterdijk, Heemstede-Aerdenhout]"
train_2,"[Amsterdam Sloterdijk, Haarlem, Amsterdam Zuid, Schiphol Airport, Leiden Centraal, Heemstede-Aerdenhout]"
train_3,"[Delft, Den Haag Centraal, Gouda, Alphen a/d Rijn, Leiden Centraal, Schiphol Airport, Amsterdam Zuid, Amsterdam Sloterdijk, Zaandam]"
train_4,"[Alkmaar, Den Helder, Hoorn, Zaandam, Amsterdam Sloterdijk, Amsterdam Zuid, Schiphol Airport]"
train_5,"[Amsterdam Zuid, Schiphol Airport, Amsterdam Sloterdijk, Haarlem, Heemstede-Aerdenhout, Amsterdam Centraal, Amsterdam Amstel, Zaandam, Hoorn]"
train_6,"[Dordrecht, Rotterdam Centraal, Schiedam Centrum, Delft, Den Haag Centraal, Gouda, Rotterdam Alexander]"
train_7,"[Zaandam, Beverwijk, Hoorn, Alkmaar, Den Helder]"
score,1127.0
