train,stations
train_1,"[Den Haag Centraal, Gouda, Delft, Schiedam Centrum, Leiden Centraal, Alphen a/d Rijn]"
train_2,"[Delft, Den Haag Centraal, Leiden Centraal, Alphen a/d Rijn, Gouda, Heemstede-Aerdenhout]"
train_3,"[Schiedam Centrum, Delft, Den Haag Centraal, Gouda, Rotterdam Alexander, Alphen a/d Rijn]"
train_4,"[Rotterdam Alexander, Gouda, Rotterdam Centraal, Dordrecht, Den Haag Centraal]"
train_5,"[Rotterdam Alexander, Gouda, Den Haag Centraal, Leiden Centraal, Heemstede-Aerdenhout, Haarlem, Amsterdam Sloterdijk, Amsterdam Centraal, Amsterdam Zuid, Schiphol Airport]"
train_6,"[Delft, Den Haag Centraal, Gouda, Alphen a/d Rijn]"
train_7,"[Amsterdam Centraal, Amsterdam Sloterdijk, Amsterdam Zuid, Schiphol Airport, Leiden Centraal, Den Haag Centraal, Gouda, Delft, Schiedam Centrum]"
score,1304.0
