train,stations
train_1,"[Amsterdam Amstel, Amsterdam Centraal, Amsterdam Zuid, Schiphol Airport, Leiden Centraal, Den Haag Centraal, Delft, Gouda, Alphen a/d Rijn]"
train_2,"[Leiden Centraal, Schiphol Airport, Heemstede-Aerdenhout, Haarlem, Amsterdam Sloterdijk, Zaandam, Beverwijk]"
train_3,"[Leiden Centraal, Heemstede-Aerdenhout, Schiphol Airport, Haarlem, Beverwijk, Castricum]"
train_4,"[Rotterdam Alexander, Gouda, Rotterdam Centraal, Dordrecht, Schiedam Centrum]"
train_5,"[Amsterdam Zuid, Schiphol Airport, Amsterdam Sloterdijk, Amsterdam Centraal, Amsterdam Amstel, Haarlem, Beverwijk, Zaandam]"
train_6,"[Dordrecht, Rotterdam Centraal, Rotterdam Alexander, Schiedam Centrum, Delft, Gouda]"
train_7,"[Rotterdam Centraal, Rotterdam Alexander, Gouda, Dordrecht, Schiedam Centrum, Delft]"
score,1322.0
