train,stations
train_1,"[Rotterdam Alexander, Gouda, Rotterdam Centraal, Schiedam Centrum, Delft, Den Haag Centraal, Leiden Centraal, Heemstede-Aerdenhout, Haarlem, Beverwijk, Amsterdam Sloterdijk]"
train_2,"[Leiden Centraal, Heemstede-Aerdenhout, Den Haag Centraal, Alphen a/d Rijn, Gouda, Rotterdam Alexander]"
train_3,"[Den Haag Centraal, Leiden Centraal, Alphen a/d Rijn, Gouda]"
train_4,"[Amsterdam Amstel, Amsterdam Centraal, Amsterdam Sloterdijk, Zaandam, Hoorn, Castricum, Beverwijk, Haarlem, Heemstede-Aerdenhout]"
train_5,"[Amsterdam Sloterdijk, Haarlem, Beverwijk, Zaandam, Castricum, Alkmaar, Hoorn]"
train_6,"[Den Haag Centraal, Leiden Centraal, Alphen a/d Rijn, Heemstede-Aerdenhout, Haarlem, Amsterdam Sloterdijk, Zaandam]"
train_7,"[Schiedam Centrum, Delft, Den Haag Centraal, Gouda, Rotterdam Alexander, Rotterdam Centraal, Dordrecht]"
score,1225.0
