train,stations
train_1,"[Castricum, Alkmaar, Den Helder, Beverwijk, Haarlem]"
train_2,"[Amsterdam Sloterdijk, Haarlem, Heemstede-Aerdenhout, Beverwijk, Zaandam, Castricum]"
train_3,"[Schiedam Centrum, Delft, Den Haag Centraal, Gouda]"
train_4,"[Rotterdam Centraal, Rotterdam Alexander, Gouda, Dordrecht]"
train_5,"[Amsterdam Zuid, Schiphol Airport, Leiden Centraal, Heemstede-Aerdenhout, Alphen a/d Rijn, Gouda, Rotterdam Alexander]"
train_6,"[Den Haag Centraal, Gouda, Delft, Schiedam Centrum, Rotterdam Centraal]"
train_7,"[Alkmaar, Den Helder]"
score,1426.0
