train,stations
train_1,"[Alkmaar, Den Helder, Castricum, Beverwijk, Zaandam]"
train_2,"[Gouda, Alphen a/d Rijn, Rotterdam Alexander, Rotterdam Centraal, Dordrecht, Schiedam Centrum]"
train_3,"[Alkmaar, Hoorn, Den Helder]"
train_4,"[Rotterdam Alexander, Gouda, Rotterdam Centraal, Dordrecht]"
train_5,"[Haarlem, Beverwijk, Amsterdam Sloterdijk, Zaandam, Amsterdam Zuid, Schiphol Airport, Leiden Centraal, Heemstede-Aerdenhout]"
train_6,"[Zaandam, Hoorn, Castricum, Beverwijk]"
train_7,"[Leiden Centraal, Heemstede-Aerdenhout, Haarlem, Beverwijk, Castricum, Alkmaar, Den Helder]"
score,1311.0
