train,stations
train_1,"[Dordrecht, Rotterdam Centraal, Schiedam Centrum, Rotterdam Alexander]"
train_2,"[Rotterdam Alexander, Gouda, Alphen a/d Rijn, Den Haag Centraal, Delft]"
train_3,"[Castricum, Alkmaar, Hoorn, Beverwijk, Haarlem]"
train_4,"[Amsterdam Amstel, Amsterdam Centraal, Amsterdam Sloterdijk, Amsterdam Zuid]"
train_5,"[Amsterdam Sloterdijk, Zaandam, Amsterdam Zuid, Amsterdam Amstel, Amsterdam Centraal]"
train_6,"[Dordrecht, Rotterdam Centraal]"
train_7,"[Leiden Centraal, Heemstede-Aerdenhout, Den Haag Centraal, Alphen a/d Rijn]"
score,1506.0
