train,stations
train_1,"[Amsterdam Centraal, Amsterdam Sloterdijk, Amsterdam Amstel, Amsterdam Zuid]"
train_2,"[Leiden Centraal, Alphen a/d Rijn, Den Haag Centraal, Delft, Schiedam Centrum, Rotterdam Centraal]"
train_3,"[Zaandam, Beverwijk, Haarlem, Amsterdam Sloterdijk, Heemstede-Aerdenhout]"
train_4,"[Amsterdam Sloterdijk, Zaandam, Castricum, Alkmaar, Den Helder]"
train_5,"[Alkmaar, Den Helder, Hoorn]"
train_6,"[Beverwijk, Castricum, Haarlem, Heemstede-Aerdenhout, Leiden Centraal]"
train_7,"[Dordrecht, Rotterdam Centraal, Schiedam Centrum]"
score,1458.0
