train,stations
train_1,"[Haarlem, Beverwijk, Heemstede-Aerdenhout, Leiden Centraal, Amsterdam Sloterdijk, Zaandam, Amsterdam Centraal, Amsterdam Amstel, Amsterdam Zuid]"
train_2,"[Dordrecht, Rotterdam Centraal, Schiedam Centrum, Rotterdam Alexander, Gouda, Alphen a/d Rijn, Leiden Centraal]"
train_3,"[Rotterdam Centraal, Schiedam Centrum, Delft, Den Haag Centraal, Leiden Centraal, Schiphol Airport, Amsterdam Zuid, Amsterdam Sloterdijk, Haarlem, Beverwijk, Castricum]"
train_4,"[Gouda, Alphen a/d Rijn, Den Haag Centraal, Leiden Centraal, Heemstede-Aerdenhout, Haarlem, Beverwijk]"
train_5,"[Castricum, Alkmaar, Hoorn, Zaandam, Amsterdam Sloterdijk, Haarlem, Beverwijk]"
train_6,"[Den Haag Centraal, Leiden Centraal, Alphen a/d Rijn, Schiphol Airport]"
train_7,"[Zaandam, Castricum, Hoorn, Alkmaar, Den Helder]"
score,1183.0
