train,stations
train_1,"[Eindhoven, Helmond, Eindhoven, Helmond, Eindhoven, Helmond, Eindhoven, Helmond, Eindhoven, Helmond, Eindhoven, Helmond, Eindhoven, Helmond, Eindhoven, Helmond, Eindhoven, Helmond, Eindhoven, Helmond]"
train_2,"[Nijmegen, Arnhem Centraal, Ede-Wageningen, Arnhem Centraal, Ede-Wageningen, Arnhem Centraal, Ede-Wageningen, Arnhem Centraal, Ede-Wageningen, Arnhem Centraal, Ede-Wageningen, Arnhem Centraal, Ede-Wageningen, Arnhem Centraal, Ede-Wageningen, Arnhem Centraal, Ede-Wageningen, Arnhem Centraal]"
train_3,"[Eindhoven, Helmond, Eindhoven, Helmond, Eindhoven, Helmond, Eindhoven, Helmond, Eindhoven, Helmond, Eindhoven, Helmond, Eindhoven, Helmond, Eindhoven, Helmond, Eindhoven, Helmond, Eindhoven, Helmond]"
train_4,"[Vlissingen, Roosendaal, Etten-Leur, Breda, Etten-Leur, Breda, Etten-Leur, Breda, Etten-Leur, Breda, Etten-Leur, Breda, Etten-Leur, Breda, Etten-Leur, Breda, Etten-Leur, Breda]"
train_5,"[Zwolle, Steenwijk, Heerenveen, Steenwijk, Heerenveen, Steenwijk, Heerenveen, Steenwijk, Heerenveen, Steenwijk, Heerenveen, Steenwijk, Heerenveen]"
train_6,"[Amsterdam Amstel, Amsterdam Centraal, Amsterdam Sloterdijk, Amsterdam Centraal, Amsterdam Sloterdijk, Amsterdam Centraal, Amsterdam Sloterdijk, Amsterdam Centraal, Amsterdam Sloterdijk, Amsterdam Centraal, Amsterdam Sloterdijk, Amsterdam Centraal, Amsterdam Sloterdijk, Amsterdam Centraal, Amsterdam Sloterdijk, Amsterdam Centraal, Amsterdam Sloterdijk, Amsterdam Centraal, Amsterdam Sloterdijk, Amsterdam Centraal, Amsterdam Sloterdijk, Amsterdam Centraal, Amsterdam Sloterdijk, Amsterdam Centraal, Amsterdam Sloterdijk, Amsterdam Centraal, Amsterdam Sloterdijk, Amsterdam Centraal, Amsterdam Sloterdijk, Amsterdam Centraal]"
train_7,"[Rotterdam Centraal, Schiedam Centrum, Rotterdam Centraal, Schiedam Centrum, Rotterdam Centraal, Schiedam Centrum, Rotterdam Centraal, Schiedam Centrum, Rotterdam Centraal, Schiedam Centrum, Rotterdam Centraal, Schiedam Centrum, Rotterdam Centraal, Schiedam Centrum, Rotterdam Centraal, Schiedam Centrum, Rotterdam Centraal, Schiedam Centrum, Rotterdam Centraal, Schiedam Centrum, Rotterdam Centraal, Schiedam Centrum, Rotterdam Centraal, Schiedam Centrum, Rotterdam Centraal, Schiedam Centrum, Rotterdam Centraal, Schiedam Centrum, Rotterdam Centraal, Schiedam Centrum, Rotterdam Centraal, Schiedam Centrum, Rotterdam Centraal, Schiedam Centrum, Rotterdam Centraal, Schiedam Centrum]"
train_8,"[Nijmegen, Arnhem Centraal, Ede-Wageningen, Arnhem Centraal, Ede-Wageningen, Arnhem Centraal, Ede-Wageningen, Arnhem Centraal, Ede-Wageningen, Arnhem Centraal, Ede-Wageningen, Arnhem Centraal, Ede-Wageningen, Arnhem Centraal, Ede-Wageningen, Arnhem Centraal, Ede-Wageningen, Arnhem Centraal]"
train_9,"[Den Haag Laan v NOI, Leiden Centraal, Den Haag Laan v NOI, Leiden Centraal, Den Haag Laan v NOI, Leiden Centraal, Den Haag Laan v NOI, Leiden Centraal, Den Haag Laan v NOI, Leiden Centraal, Den Haag Laan v NOI, Leiden Centraal, Den Haag Laan v NOI, Leiden Centraal, Den Haag Laan v NOI, Leiden Centraal, Den Haag Laan v NOI, Leiden Centraal, Den Haag Laan v NOI, Leiden Centraal]"
train_10,"[Amsterdam Amstel, Amsterdam Centraal, Amsterdam Sloterdijk, Amsterdam Centraal, Amsterdam Sloterdijk, Amsterdam Centraal, Amsterdam Sloterdijk, Amsterdam Centraal, Amsterdam Sloterdijk, Amsterdam Centraal, Amsterdam Sloterdijk, Amsterdam Centraal, Amsterdam Sloterdijk, Amsterdam Centraal, Amsterdam Sloterdijk, Amsterdam Centraal, Amsterdam Sloterdijk, Amsterdam Centraal, Amsterdam Sloterdijk, Amsterdam Centraal, Amsterdam Sloterdijk, Amsterdam Centraal, Amsterdam Sloterdijk, Amsterdam Centraal, Amsterdam Sloterdijk, Amsterdam Centraal, Amsterdam Sloterdijk, Amsterdam Centraal, Amsterdam Sloterdijk, Amsterdam Centraal]"
train_11,"[Helmond, Eindhoven, Helmond, Eindhoven, Helmond, Eindhoven, Helmond, Eindhoven, Helmond, Eindhoven, Helmond, Eindhoven, Helmond, Eindhoven, Helmond, Eindhoven, Helmond, Eindhoven, Helmond, Eindhoven]"
train_12,"[Helmond, Eindhoven, Helmond, Eindhoven, Helmond, Eindhoven, Helmond, Eindhoven, Helmond, Eindhoven, Helmond, Eindhoven, Helmond, Eindhoven, Helmond, Eindhoven, Helmond, Eindhoven, Helmond, Eindhoven]"
train_13,"[Nijmegen, Arnhem Centraal, Ede-Wageningen, Arnhem Centraal, Ede-Wageningen, Arnhem Centraal, Ede-Wageningen, Arnhem Centraal, Ede-Wageningen, Arnhem Centraal, Ede-Wageningen, Arnhem Centraal, Ede-Wageningen, Arnhem Centraal, Ede-Wageningen, Arnhem Centraal, Ede-Wageningen, Arnhem Centraal]"
train_14,"[Dordrecht, Rotterdam Blaak, Rotterdam Alexander, Rotterdam Centraal, Schiedam Centrum, Rotterdam Centraal, Schiedam Centrum, Rotterdam Centraal, Schiedam Centrum, Rotterdam Centraal, Schiedam Centrum, Rotterdam Centraal, Schiedam Centrum, Rotterdam Centraal, Schiedam Centrum, Rotterdam Centraal, Schiedam Centrum, Rotterdam Centraal, Schiedam Centrum, Rotterdam Centraal, Schiedam Centrum, Rotterdam Centraal, Schiedam Centrum, Rotterdam Centraal, Schiedam Centrum, Rotterdam Centraal, Schiedam Centrum, Rotterdam Centraal, Schiedam Centrum, Rotterdam Centraal, Schiedam Centrum, Rotterdam Centraal, Schiedam Centrum]"
train_15,"[Deventer, Apeldoorn, Deventer, Apeldoorn, Deventer, Apeldoorn, Deventer, Apeldoorn, Deventer, Apeldoorn, Deventer, Apeldoorn, Deventer, Apeldoorn, Deventer, Apeldoorn, Deventer, Apeldoorn]"
train_16,"[Den Haag Laan v NOI, Leiden Centraal, Den Haag Laan v NOI, Leiden Centraal, Den Haag Laan v NOI, Leiden Centraal, Den Haag Laan v NOI, Leiden Centraal, Den Haag Laan v NOI, Leiden Centraal, Den Haag Laan v NOI, Leiden Centraal, Den Haag Laan v NOI, Leiden Centraal, Den Haag Laan v NOI, Leiden Centraal, Den Haag Laan v NOI, Leiden Centraal, Den Haag Laan v NOI, Leiden Centraal]"
train_17,"[Haarlem, Heemstede-Aerdenhout, Haarlem, Heemstede-Aerdenhout, Haarlem, Heemstede-Aerdenhout, Haarlem, Heemstede-Aerdenhout, Haarlem, Heemstede-Aerdenhout, Haarlem, Heemstede-Aerdenhout, Haarlem, Heemstede-Aerdenhout, Haarlem, Heemstede-Aerdenhout, Haarlem, Heemstede-Aerdenhout, Haarlem, Heemstede-Aerdenhout, Haarlem, Heemstede-Aerdenhout, Haarlem, Heemstede-Aerdenhout, Haarlem, Heemstede-Aerdenhout, Haarlem, Heemstede-Aerdenhout, Haarlem, Heemstede-Aerdenhout]"
train_18,"[Utrecht Centraal, Amersfoort, Utrecht Centraal, Amersfoort, Utrecht Centraal, Amersfoort, Utrecht Centraal, Amersfoort, Utrecht Centraal, Amersfoort, Utrecht Centraal, Amersfoort, Utrecht Centraal]"
train_19,"[Rotterdam Alexander, Rotterdam Centraal, Schiedam Centrum, Rotterdam Centraal, Schiedam Centrum, Rotterdam Centraal, Schiedam Centrum, Rotterdam Centraal, Schiedam Centrum, Rotterdam Centraal, Schiedam Centrum, Rotterdam Centraal, Schiedam Centrum, Rotterdam Centraal, Schiedam Centrum, Rotterdam Centraal, Schiedam Centrum, Rotterdam Centraal, Schiedam Centrum, Rotterdam Centraal, Schiedam Centrum, Rotterdam Centraal, Schiedam Centrum, Rotterdam Centraal, Schiedam Centrum, Rotterdam Centraal, Schiedam Centrum, Rotterdam Centraal, Schiedam Centrum, Rotterdam Centraal, Schiedam Centrum, Rotterdam Centraal, Schiedam Centrum, Rotterdam Centraal, Schiedam Centrum, Rotterdam Centraal]"
train_20,"[Amsterdam Amstel, Amsterdam Centraal, Amsterdam Sloterdijk, Amsterdam Centraal, Amsterdam Sloterdijk, Amsterdam Centraal, Amsterdam Sloterdijk, Amsterdam Centraal, Amsterdam Sloterdijk, Amsterdam Centraal, Amsterdam Sloterdijk, Amsterdam Centraal, Amsterdam Sloterdijk, Amsterdam Centraal, Amsterdam Sloterdijk, Amsterdam Centraal, Amsterdam Sloterdijk, Amsterdam Centraal, Amsterdam Sloterdijk, Amsterdam Centraal, Amsterdam Sloterdijk, Amsterdam Centraal, Amsterdam Sloterdijk, Amsterdam Centraal, Amsterdam Sloterdijk, Amsterdam Centraal, Amsterdam Sloterdijk, Amsterdam Centraal, Amsterdam Sloterdijk, Amsterdam Centraal]"
score,-3520.528089887641
