train,stations
train_1,"[Hoorn, Alkmaar, Castricum, Beverwijk, Haarlem, Beverwijk, Castricum, Beverwijk]"
train_2,"[Gouda, Rotterdam Alexander, Gouda, Den Haag Centraal, Delft, Den Haag Centraal, Delft, Den Haag Centraal, Delft, Schiedam Centrum, Rotterdam Centraal]"
train_3,"[Haarlem, Beverwijk, Castricum, Beverwijk, Castricum, Beverwijk, Zaandam, Beverwijk]"
train_4,"[Alkmaar, Hoorn, Alkmaar, Hoorn, Alkmaar]"
train_5,"[Leiden Centraal, Heemstede-Aerdenhout, Leiden Centraal, Alphen a/d Rijn, Leiden Centraal, Schiphol Airport, Leiden Centraal, Den Haag Centraal, Gouda]"
train_6,"[Hoorn, Zaandam, Castricum, Alkmaar, Castricum, Alkmaar, Hoorn, Alkmaar]"
train_7,"[Amsterdam Centraal, Amsterdam Amstel, Amsterdam Centraal, Amsterdam Sloterdijk, Haarlem, Amsterdam Sloterdijk, Zaandam, Hoorn, Alkmaar]"
score,5661.857142857143
