train,stations
train_1,"[Den Haag Centraal, Gouda, Den Haag Centraal, Delft, Den Haag Centraal, Delft, Schiedam Centrum, Rotterdam Centraal, Rotterdam Alexander, Gouda]"
train_2,"[Den Haag Centraal, Gouda, Den Haag Centraal, Leiden Centraal, Den Haag Centraal, Delft, Schiedam Centrum, Rotterdam Centraal, Schiedam Centrum, Rotterdam Centraal, Rotterdam Alexander, Rotterdam Centraal, Schiedam Centrum]"
train_3,"[Amsterdam Centraal, Amsterdam Sloterdijk, Amsterdam Zuid, Amsterdam Sloterdijk, Amsterdam Zuid, Amsterdam Sloterdijk, Zaandam, Beverwijk]"
train_4,"[Den Haag Centraal, Leiden Centraal, Schiphol Airport, Amsterdam Zuid, Amsterdam Sloterdijk, Haarlem, Amsterdam Sloterdijk, Zaandam, Castricum, Zaandam]"
train_5,"[Schiedam Centrum, Delft, Schiedam Centrum, Rotterdam Centraal, Dordrecht, Rotterdam Centraal, Dordrecht, Rotterdam Centraal, Dordrecht]"
train_6,"[Alkmaar, Castricum, Zaandam, Hoorn, Zaandam, Beverwijk]"
train_7,"[Castricum, Zaandam, Hoorn, Zaandam, Amsterdam Sloterdijk, Haarlem, Beverwijk]"
score,5363.714285714286
