train,stations
train_1,"[Dordrecht, Rotterdam Centraal, Rotterdam Alexander, Rotterdam Centraal, Dordrecht, Rotterdam Centraal, Rotterdam Alexander, Gouda, Den Haag Centraal, Delft]"
train_2,"[Heemstede-Aerdenhout, Leiden Centraal, Den Haag Centraal, Delft, Schiedam Centrum, Delft, Schiedam Centrum, Delft, Den Haag Centraal, Gouda, Den Haag Centraal]"
train_3,"[Den Haag Centraal, Delft, Schiedam Centrum, Delft, Den Haag Centraal, Gouda, Rotterdam Alexander, Gouda, Den Haag Centraal, Delft]"
train_4,"[Delft, Den Haag Centraal, Leiden Centraal, Den Haag Centraal, Leiden Centraal, Alphen a/d Rijn, Leiden Centraal, Alphen a/d Rijn, Gouda]"
train_5,"[Alkmaar, Hoorn, Alkmaar, Den Helder]"
train_6,"[Schiedam Centrum, Delft, Den Haag Centraal, Leiden Centraal, Den Haag Centraal, Gouda, Den Haag Centraal, Gouda, Den Haag Centraal]"
train_7,"[Rotterdam Centraal, Dordrecht, Rotterdam Centraal, Dordrecht, Rotterdam Centraal, Schiedam Centrum, Rotterdam Centraal, Dordrecht, Rotterdam Centraal]"
score,3126.857142857143
