train,stations
train_1,"[Gouda, Den Haag Centraal, Delft, Den Haag Centraal, Leiden Centraal, Heemstede-Aerdenhout, Leiden Centraal, Den Haag Centraal, Leiden Centraal, Den Haag Centraal]"
train_2,"[Dordrecht, Rotterdam Centraal, Rotterdam Alexander, Gouda, Den Haag Centraal, Delft, Den Haag Centraal, Delft, Schiedam Centrum, Delft, Schiedam Centrum, Rotterdam Centraal]"
train_3,"[Beverwijk, Castricum, Zaandam, Amsterdam Sloterdijk, Zaandam, Hoorn, Zaandam, Hoorn]"
train_4,"[Haarlem, Amsterdam Sloterdijk, Zaandam, Amsterdam Sloterdijk, Haarlem, Amsterdam Sloterdijk, Zaandam, Hoorn, Alkmaar]"
train_5,"[Rotterdam Centraal, Rotterdam Alexander, Gouda, Alphen a/d Rijn, Leiden Centraal, Schiphol Airport, Amsterdam Zuid, Amsterdam Sloterdijk, Amsterdam Centraal, Amsterdam Amstel, Amsterdam Centraal, Amsterdam Amstel]"
train_6,"[Beverwijk, Haarlem, Beverwijk, Castricum, Alkmaar, Den Helder]"
train_7,"[Den Haag Centraal, Leiden Centraal, Heemstede-Aerdenhout, Leiden Centraal, Heemstede-Aerdenhout, Haarlem, Heemstede-Aerdenhout, Haarlem, Heemstede-Aerdenhout, Haarlem, Heemstede-Aerdenhout, Leiden Centraal, Schiphol Airport]"
score,7810.714285714286
