train,stations
train_1,"[Zaandam, Hoorn, Alkmaar, Hoorn, Zaandam]"
train_2,"[Amsterdam Sloterdijk, Zaandam, Beverwijk, Castricum, Alkmaar, Den Helder]"
train_3,"[Haarlem, Beverwijk, Zaandam, Hoorn, Zaandam, Hoorn]"
train_4,"[Dordrecht, Rotterdam Centraal, Schiedam Centrum, Rotterdam Centraal, Schiedam Centrum, Delft, Den Haag Centraal, Gouda, Rotterdam Alexander, Gouda, Rotterdam Alexander, Gouda]"
train_5,"[Amsterdam Centraal, Amsterdam Amstel, Amsterdam Centraal, Amsterdam Amstel, Amsterdam Zuid, Amsterdam Sloterdijk, Amsterdam Zuid, Schiphol Airport, Amsterdam Zuid, Amsterdam Amstel, Amsterdam Zuid, Amsterdam Amstel, Amsterdam Centraal]"
train_6,"[Den Helder, Alkmaar, Castricum, Beverwijk, Zaandam, Amsterdam Sloterdijk, Zaandam]"
train_7,"[Beverwijk, Castricum, Beverwijk, Castricum, Alkmaar, Hoorn, Alkmaar]"
score,4978.571428571429
