train,stations
train_1,"[Beverwijk, Zaandam, Hoorn, Zaandam, Hoorn]"
train_2,"[Zaandam, Beverwijk, Zaandam, Hoorn, Alkmaar]"
train_3,"[Gouda, Rotterdam Alexander, Rotterdam Centraal, Dordrecht, Rotterdam Centraal, Schiedam Centrum, Rotterdam Centraal, Schiedam Centrum, Delft, Schiedam Centrum, Rotterdam Centraal, Dordrecht]"
train_4,"[Schiphol Airport, Leiden Centraal, Heemstede-Aerdenhout, Haarlem, Amsterdam Sloterdijk, Amsterdam Zuid, Amsterdam Amstel, Amsterdam Zuid, Schiphol Airport, Leiden Centraal, Schiphol Airport]"
train_5,"[Delft, Den Haag Centraal, Delft, Schiedam Centrum, Delft, Schiedam Centrum, Delft, Den Haag Centraal, Delft, Den Haag Centraal, Gouda]"
train_6,"[Castricum, Zaandam, Castricum, Zaandam, Castricum, Alkmaar, Castricum, Zaandam, Beverwijk]"
train_7,"[Amsterdam Zuid, Amsterdam Amstel, Amsterdam Centraal, Amsterdam Amstel, Amsterdam Centraal, Amsterdam Sloterdijk, Zaandam, Amsterdam Sloterdijk, Amsterdam Centraal, Amsterdam Sloterdijk, Haarlem, Amsterdam Sloterdijk, Haarlem, Beverwijk]"
score,6747.285714285714
