train,stations
train_1,"[Schiphol Airport, Leiden Centraal, Schiphol Airport, Leiden Centraal, Den Haag Centraal, Delft, Den Haag Centraal, Leiden Centraal, Heemstede-Aerdenhout]"
train_2,"[Amsterdam Centraal, Amsterdam Sloterdijk, Amsterdam Zuid, Schiphol Airport, Leiden Centraal, Heemstede-Aerdenhout, Leiden Centraal, Schiphol Airport, Leiden Centraal, Den Haag Centraal]"
train_3,"[Hoorn, Alkmaar, Den Helder, Alkmaar, Castricum, Alkmaar]"
train_4,"[Alkmaar, Castricum, Alkmaar, Hoorn, Zaandam, Castricum, Zaandam, Castricum, Zaandam]"
train_5,"[Dordrecht, Rotterdam Centraal, Dordrecht, Rotterdam Centraal, Schiedam Centrum, Delft, Schiedam Centrum, Rotterdam Centraal, Dordrecht, Rotterdam Centraal, Rotterdam Alexander]"
train_6,"[Alkmaar, Hoorn, Alkmaar, Den Helder]"
train_7,"[Haarlem, Heemstede-Aerdenhout, Haarlem, Beverwijk, Haarlem, Heemstede-Aerdenhout, Haarlem, Beverwijk, Castricum, Zaandam]"
score,5302.714285714286
