train,stations
train_1,"[Heemstede-Aerdenhout, Leiden Centraal, Heemstede-Aerdenhout, Leiden Centraal, Alphen a/d Rijn, Gouda, Den Haag Centraal, Gouda]"
train_2,"[Alkmaar, Castricum, Zaandam, Hoorn, Alkmaar, Hoorn]"
train_3,"[Zaandam, Hoorn, Alkmaar, Den Helder]"
train_4,"[Heemstede-Aerdenhout, Haarlem, Beverwijk, Haarlem, Heemstede-Aerdenhout, Leiden Centraal, Schiphol Airport, Amsterdam Zuid, Amsterdam Amstel, Amsterdam Zuid, Amsterdam Amstel, Amsterdam Zuid]"
train_5,"[Amsterdam Centraal, Amsterdam Amstel, Amsterdam Centraal, Amsterdam Amstel, Amsterdam Centraal, Amsterdam Sloterdijk, Amsterdam Centraal, Amsterdam Sloterdijk, Amsterdam Centraal, Amsterdam Sloterdijk, Haarlem, Beverwijk, Castricum, Alkmaar]"
train_6,"[Castricum, Alkmaar, Den Helder, Alkmaar, Hoorn]"
train_7,"[Castricum, Beverwijk, Zaandam, Hoorn, Alkmaar]"
score,5374.714285714286
