train,stations
train_1,"[Dordrecht, Rotterdam Centraal, Dordrecht, Rotterdam Centraal, Dordrecht, Rotterdam Centraal, Rotterdam Alexander, Rotterdam Centraal, Schiedam Centrum, Delft]"
train_2,"[Heemstede-Aerdenhout, Leiden Centraal, Alphen a/d Rijn, Leiden Centraal, Heemstede-Aerdenhout, Leiden Centraal, Alphen a/d Rijn, Leiden Centraal, Den Haag Centraal]"
train_3,"[Amsterdam Sloterdijk, Zaandam, Castricum, Alkmaar, Hoorn, Alkmaar, Castricum, Beverwijk]"
train_4,"[Zaandam, Castricum, Beverwijk, Castricum, Beverwijk, Zaandam, Beverwijk]"
train_5,"[Rotterdam Centraal, Schiedam Centrum, Delft, Schiedam Centrum, Delft, Den Haag Centraal, Leiden Centraal, Den Haag Centraal, Delft, Schiedam Centrum, Delft, Schiedam Centrum, Delft, Den Haag Centraal]"
train_6,"[Alkmaar, Castricum, Beverwijk, Zaandam, Hoorn, Zaandam, Castricum]"
train_7,"[Den Haag Centraal, Delft, Den Haag Centraal, Leiden Centraal, Heemstede-Aerdenhout, Leiden Centraal, Schiphol Airport, Leiden Centraal, Alphen a/d Rijn]"
score,4240.285714285714
