train,stations
train_1,"[Schiphol Airport, Amsterdam Zuid, Amsterdam Sloterdijk, Zaandam, Amsterdam Sloterdijk, Amsterdam Centraal, Amsterdam Sloterdijk, Zaandam, Beverwijk, Castricum, Beverwijk, Haarlem]"
train_2,"[Alkmaar, Den Helder, Alkmaar, Castricum, Alkmaar, Hoorn]"
train_3,"[Den Haag Centraal, Leiden Centraal, Heemstede-Aerdenhout, Leiden Centraal, Alphen a/d Rijn, Gouda, Rotterdam Alexander, Rotterdam Centraal, Dordrecht]"
train_4,"[Beverwijk, Haarlem, Heemstede-Aerdenhout, Haarlem, Amsterdam Sloterdijk, Zaandam, Hoorn, Alkmaar]"
train_5,"[Schiedam Centrum, Rotterdam Centraal, Schiedam Centrum, Rotterdam Centraal, Rotterdam Alexander, Rotterdam Centraal, Dordrecht, Rotterdam Centraal, Schiedam Centrum, Delft, Den Haag Centraal, Delft, Den Haag Centraal]"
train_6,"[Heemstede-Aerdenhout, Haarlem, Beverwijk, Haarlem, Beverwijk, Castricum, Alkmaar, Castricum, Beverwijk, Haarlem]"
train_7,"[Hoorn, Alkmaar, Hoorn, Alkmaar, Castricum, Alkmaar]"
score,6760.285714285714
