train,stations
train_1,"[Leiden Centraal, Alphen a/d Rijn, Gouda, Den Haag Centraal, Gouda, Alphen a/d Rijn, Gouda, Rotterdam Alexander]"
train_2,"[Zaandam, Hoorn, Zaandam, Hoorn, Zaandam, Castricum]"
train_3,"[Dordrecht, Rotterdam Centraal, Dordrecht, Rotterdam Centraal, Dordrecht, Rotterdam Centraal, Rotterdam Alexander, Gouda, Rotterdam Alexander]"
train_4,"[Rotterdam Alexander, Gouda, Rotterdam Alexander, Rotterdam Centraal, Rotterdam Alexander, Rotterdam Centraal, Rotterdam Alexander, Gouda, Rotterdam Alexander, Gouda, Den Haag Centraal, Gouda]"
train_5,"[Gouda, Rotterdam Alexander, Rotterdam Centraal, Dordrecht, Rotterdam Centraal, Rotterdam Alexander, Gouda, Den Haag Centraal, Gouda]"
train_6,"[Castricum, Beverwijk, Zaandam, Castricum, Beverwijk, Zaandam, Amsterdam Sloterdijk, Haarlem]"
train_7,"[Hoorn, Zaandam, Castricum, Zaandam, Beverwijk, Castricum, Zaandam, Castricum]"
score,2798.7142857142853
