train,stations
train_1,"[Rotterdam Alexander, Gouda, Alphen a/d Rijn, Gouda, Rotterdam Alexander, Rotterdam Centraal, Dordrecht, Rotterdam Centraal, Dordrecht]"
train_2,"[Alkmaar, Den Helder, Alkmaar, Hoorn]"
train_3,"[Beverwijk, Zaandam, Beverwijk, Zaandam, Castricum, Zaandam, Castricum]"
train_4,"[Hoorn, Zaandam, Hoorn, Zaandam, Hoorn]"
train_5,"[Castricum, Zaandam, Hoorn, Zaandam, Beverwijk, Castricum, Beverwijk]"
train_6,"[Rotterdam Centraal, Rotterdam Alexander, Gouda, Rotterdam Alexander, Rotterdam Centraal, Rotterdam Alexander, Rotterdam Centraal, Dordrecht, Rotterdam Centraal, Rotterdam Alexander, Gouda]"
train_7,"[Gouda, Alphen a/d Rijn, Gouda, Alphen a/d Rijn, Gouda, Alphen a/d Rijn, Gouda]"
score,2110.4285714285716
