train,stations
train_1,"[Den Helder, Alkmaar, Castricum, Alkmaar, Hoorn, Zaandam, Amsterdam Sloterdijk, Amsterdam Centraal]"
train_2,"[Alphen a/d Rijn, Gouda, Den Haag Centraal, Delft, Den Haag Centraal, Delft, Den Haag Centraal, Delft, Den Haag Centraal]"
train_3,"[Schiphol Airport, Leiden Centraal, Schiphol Airport, Amsterdam Zuid, Schiphol Airport, Amsterdam Zuid, Schiphol Airport, Amsterdam Zuid, Schiphol Airport, Leiden Centraal, Heemstede-Aerdenhout, Leiden Centraal]"
train_4,"[Gouda, Alphen a/d Rijn, Gouda, Rotterdam Alexander, Gouda, Alphen a/d Rijn, Leiden Centraal, Alphen a/d Rijn, Leiden Centraal]"
train_5,"[Rotterdam Alexander, Gouda, Alphen a/d Rijn, Gouda, Rotterdam Alexander, Rotterdam Centraal, Dordrecht, Rotterdam Centraal, Rotterdam Alexander, Gouda]"
train_6,"[Beverwijk, Haarlem, Beverwijk, Castricum, Alkmaar, Den Helder]"
train_7,"[Rotterdam Alexander, Gouda, Den Haag Centraal, Delft, Schiedam Centrum, Delft, Den Haag Centraal, Gouda, Alphen a/d Rijn]"
score,5302.714285714286
