train,stations
train_1,"[Delft, Schiedam Centrum, Delft, Den Haag Centraal, Delft, Den Haag Centraal, Gouda, Den Haag Centraal, Leiden Centraal, Heemstede-Aerdenhout]"
train_2,"[Delft, Den Haag Centraal, Gouda, Alphen a/d Rijn, Leiden Centraal, Schiphol Airport, Amsterdam Zuid, Amsterdam Amstel, Amsterdam Zuid]"
train_3,"[Alkmaar, Hoorn, Zaandam, Beverwijk, Castricum, Alkmaar]"
train_4,"[Zaandam, Beverwijk, Zaandam, Amsterdam Sloterdijk, Amsterdam Centraal, Amsterdam Sloterdijk, Zaandam, Hoorn]"
train_5,"[Castricum, Alkmaar, Hoorn, Alkmaar, Castricum, Zaandam, Hoorn]"
train_6,"[Haarlem, Amsterdam Sloterdijk, Zaandam, Hoorn, Zaandam, Castricum, Alkmaar]"
train_7,"[Hoorn, Zaandam, Amsterdam Sloterdijk, Amsterdam Zuid, Amsterdam Sloterdijk, Amsterdam Zuid, Schiphol Airport, Amsterdam Zuid, Amsterdam Sloterdijk, Zaandam]"
score,6070.0
