train,stations
train_1,"[Rotterdam Centraal, Dordrecht, Rotterdam Centraal, Dordrecht, Rotterdam Centraal, Rotterdam Alexander, Gouda, Den Haag Centraal, Leiden Centraal]"
train_2,"[Alphen a/d Rijn, Leiden Centraal, Den Haag Centraal, Leiden Centraal, Schiphol Airport, Leiden Centraal, Heemstede-Aerdenhout, Haarlem, Heemstede-Aerdenhout, Leiden Centraal]"
train_3,"[Den Haag Centraal, Delft, Schiedam Centrum, Rotterdam Centraal, Dordrecht, Rotterdam Centraal, Rotterdam Alexander, Rotterdam Centraal, Schiedam Centrum, Delft, Schiedam Centrum, Rotterdam Centraal, Dordrecht]"
train_4,"[Dordrecht, Rotterdam Centraal, Rotterdam Alexander, Rotterdam Centraal, Rotterdam Alexander, Rotterdam Centraal, Dordrecht, Rotterdam Centraal, Rotterdam Alexander, Rotterdam Centraal, Schiedam Centrum, Rotterdam Centraal, Schiedam Centrum]"
train_5,"[Gouda, Rotterdam Alexander, Rotterdam Centraal, Dordrecht, Rotterdam Centraal, Rotterdam Alexander, Gouda, Den Haag Centraal, Gouda, Rotterdam Alexander]"
train_6,"[Rotterdam Alexander, Gouda, Den Haag Centraal, Delft, Den Haag Centraal, Delft, Schiedam Centrum, Delft, Den Haag Centraal, Leiden Centraal, Heemstede-Aerdenhout]"
train_7,"[Amsterdam Sloterdijk, Amsterdam Zuid, Amsterdam Sloterdijk, Haarlem, Heemstede-Aerdenhout, Leiden Centraal, Alphen a/d Rijn, Leiden Centraal, Alphen a/d Rijn]"
score,3495.0
