train,stations
train_1,"[Rotterdam Alexander, Gouda, Alphen a/d Rijn, Gouda, Den Haag Centraal, Leiden Centraal, Den Haag Centraal, Delft, Schiedam Centrum, Delft]"
train_2,"[Gouda, Rotterdam Alexander, Rotterdam Centraal, Dordrecht, Rotterdam Centraal, Rotterdam Alexander, Rotterdam Centraal, Schiedam Centrum, Delft, Schiedam Centrum, Delft, Den Haag Centraal, Leiden Centraal]"
train_3,"[Den Haag Centraal, Delft, Den Haag Centraal, Delft, Den Haag Centraal, Delft, Den Haag Centraal, Delft, Den Haag Centraal, Delft]"
train_4,"[Schiedam Centrum, Rotterdam Centraal, Schiedam Centrum, Rotterdam Centraal, Dordrecht, Rotterdam Centraal, Rotterdam Alexander, Gouda, Rotterdam Alexander, Gouda, Rotterdam Alexander, Gouda, Rotterdam Alexander]"
train_5,"[Amsterdam Amstel, Amsterdam Zuid, Amsterdam Amstel, Amsterdam Centraal, Amsterdam Amstel, Amsterdam Zuid, Schiphol Airport, Amsterdam Zuid, Amsterdam Amstel, Amsterdam Centraal, Amsterdam Amstel, Amsterdam Centraal, Amsterdam Sloterdijk, Amsterdam Zuid]"
train_6,"[Hoorn, Zaandam, Hoorn, Alkmaar, Hoorn]"
train_7,"[Alphen a/d Rijn, Leiden Centraal, Alphen a/d Rijn, Gouda, Rotterdam Alexander, Gouda, Den Haag Centraal, Delft, Schiedam Centrum, Delft]"
score,4569.428571428571
