train,stations
train_1,"[Delft, Den Haag Centraal, Delft, Den Haag Centraal, Delft, Den Haag Centraal, Leiden Centraal, Den Haag Centraal, Gouda]"
train_2,"[Amsterdam Sloterdijk, Zaandam, Beverwijk, Castricum, Alkmaar, Den Helder]"
train_3,"[Leiden Centraal, Schiphol Airport, Leiden Centraal, Heemstede-Aerdenhout, Leiden Centraal, Schiphol Airport, Amsterdam Zuid, Amsterdam Sloterdijk, Zaandam]"
train_4,"[Castricum, Alkmaar, Castricum, Beverwijk, Zaandam, Amsterdam Sloterdijk, Haarlem, Beverwijk, Zaandam]"
train_5,"[Leiden Centraal, Den Haag Centraal, Delft, Schiedam Centrum, Rotterdam Centraal, Rotterdam Alexander, Rotterdam Centraal, Schiedam Centrum, Delft, Schiedam Centrum, Delft, Den Haag Centraal, Delft, Schiedam Centrum, Rotterdam Centraal]"
train_6,"[Dordrecht, Rotterdam Centraal, Dordrecht, Rotterdam Centraal, Rotterdam Alexander, Rotterdam Centraal, Rotterdam Alexander, Gouda, Den Haag Centraal]"
train_7,"[Delft, Schiedam Centrum, Delft, Den Haag Centraal, Delft, Schiedam Centrum, Rotterdam Centraal, Schiedam Centrum, Delft, Den Haag Centraal, Delft, Den Haag Centraal]"
score,5353.714285714286
