train,stations
train_1,"[Castricum, Zaandam, Hoorn, Alkmaar, Den Helder]"
train_2,"[Beverwijk, Zaandam, Beverwijk, Zaandam, Hoorn]"
train_3,"[Delft, Schiedam Centrum, Rotterdam Centraal, Schiedam Centrum, Rotterdam Centraal, Dordrecht, Rotterdam Centraal, Dordrecht, Rotterdam Centraal, Schiedam Centrum, Delft, Den Haag Centraal]"
train_4,"[Haarlem, Beverwijk, Castricum, Alkmaar, Hoorn, Alkmaar]"
train_5,"[Den Helder, Alkmaar, Den Helder, Alkmaar, Castricum]"
train_6,"[Den Helder, Alkmaar, Castricum, Alkmaar, Hoorn, Alkmaar]"
train_7,"[Heemstede-Aerdenhout, Leiden Centraal, Alphen a/d Rijn, Gouda, Alphen a/d Rijn, Gouda, Alphen a/d Rijn]"
score,3935.142857142857
