train,stations
train_1,"[Schiphol Airport, Amsterdam Zuid, Amsterdam Sloterdijk, Zaandam, Castricum, Alkmaar, Den Helder]"
train_2,"[Zaandam, Hoorn, Alkmaar, Hoorn, Alkmaar]"
train_3,"[Schiedam Centrum, Rotterdam Centraal, Dordrecht, Rotterdam Centraal, Schiedam Centrum, Delft, Den Haag Centraal, Delft, Den Haag Centraal, Leiden Centraal, Schiphol Airport]"
train_4,"[Den Helder, Alkmaar, Castricum, Beverwijk, Castricum, Zaandam, Beverwijk]"
train_5,"[Castricum, Zaandam, Amsterdam Sloterdijk, Amsterdam Centraal, Amsterdam Amstel, Amsterdam Zuid, Amsterdam Amstel, Amsterdam Centraal, Amsterdam Sloterdijk, Zaandam, Beverwijk]"
train_6,"[Haarlem, Beverwijk, Haarlem, Heemstede-Aerdenhout, Haarlem, Amsterdam Sloterdijk, Zaandam, Beverwijk, Castricum, Beverwijk]"
train_7,"[Rotterdam Alexander, Gouda, Alphen a/d Rijn, Gouda, Den Haag Centraal, Delft, Den Haag Centraal, Leiden Centraal, Alphen a/d Rijn]"
score,7850.714285714286
