train,stations
train_1,"[Castricum, Alkmaar, Den Helder, Alkmaar, Castricum, Beverwijk]"
train_2,"[Zaandam, Amsterdam Sloterdijk, Haarlem, Beverwijk, Zaandam, Amsterdam Sloterdijk, Zaandam, Castricum, Alkmaar, Hoorn]"
train_3,"[Amsterdam Sloterdijk, Zaandam, Hoorn, Alkmaar, Den Helder]"
train_4,"[Beverwijk, Castricum, Zaandam, Beverwijk, Castricum, Beverwijk, Haarlem, Beverwijk]"
train_5,"[Den Helder, Alkmaar, Castricum, Alkmaar, Den Helder]"
train_6,"[Castricum, Alkmaar, Hoorn, Alkmaar, Den Helder]"
train_7,"[Alkmaar, Den Helder, Alkmaar, Hoorn]"
score,2174.4285714285716
