train,stations
train_1,"[Schiedam Centrum, Rotterdam Centraal, Rotterdam Alexander, Rotterdam Centraal, Schiedam Centrum, Rotterdam Centraal, Dordrecht, Rotterdam Centraal, Rotterdam Alexander, Gouda, Rotterdam Alexander, Gouda]"
train_2,"[Leiden Centraal, Heemstede-Aerdenhout, Haarlem, Beverwijk, Castricum, Zaandam, Amsterdam Sloterdijk, Amsterdam Zuid, Schiphol Airport, Amsterdam Zuid, Amsterdam Amstel, Amsterdam Centraal]"
train_3,"[Alkmaar, Hoorn, Alkmaar, Den Helder]"
train_4,"[Amsterdam Centraal, Amsterdam Sloterdijk, Haarlem, Amsterdam Sloterdijk, Zaandam, Amsterdam Sloterdijk, Zaandam, Castricum, Alkmaar, Castricum, Alkmaar]"
train_5,"[Amsterdam Sloterdijk, Haarlem, Beverwijk, Castricum, Alkmaar, Hoorn, Zaandam, Amsterdam Sloterdijk, Haarlem]"
train_6,"[Hoorn, Alkmaar, Hoorn, Zaandam, Beverwijk, Castricum]"
train_7,"[Den Haag Centraal, Delft, Den Haag Centraal, Leiden Centraal, Schiphol Airport, Leiden Centraal, Alphen a/d Rijn, Leiden Centraal, Den Haag Centraal]"
score,7464.571428571429
