train,stations
train_1,"[Rotterdam Centraal, Schiedam Centrum, Delft, Den Haag Centraal, Gouda, Den Haag Centraal, Gouda, Rotterdam Alexander, Gouda, Den Haag Centraal]"
train_2,"[Amsterdam Centraal, Amsterdam Amstel, Amsterdam Zuid, Amsterdam Amstel, Amsterdam Zuid, Schiphol Airport, Leiden Centraal, Heemstede-Aerdenhout, Haarlem, Heemstede-Aerdenhout, Leiden Centraal, Heemstede-Aerdenhout, Haarlem]"
train_3,"[Beverwijk, Castricum, Alkmaar, Castricum, Alkmaar, Den Helder, Alkmaar]"
train_4,"[Hoorn, Zaandam, Castricum, Zaandam, Beverwijk, Castricum, Beverwijk, Haarlem]"
train_5,"[Rotterdam Alexander, Gouda, Den Haag Centraal, Gouda, Den Haag Centraal, Leiden Centraal, Schiphol Airport, Leiden Centraal, Heemstede-Aerdenhout]"
train_6,"[Zaandam, Amsterdam Sloterdijk, Amsterdam Centraal, Amsterdam Amstel, Amsterdam Zuid, Amsterdam Amstel, Amsterdam Centraal, Amsterdam Amstel, Amsterdam Centraal, Amsterdam Amstel, Amsterdam Centraal, Amsterdam Sloterdijk, Zaandam, Amsterdam Sloterdijk, Amsterdam Zuid]"
train_7,"[Rotterdam Centraal, Rotterdam Alexander, Gouda, Den Haag Centraal, Gouda, Den Haag Centraal, Delft, Schiedam Centrum, Delft, Schiedam Centrum, Delft]"
score,6699.285714285714
