train,stations
train_1,"[Beverwijk, Castricum, Alkmaar, Castricum, Alkmaar, Castricum, Beverwijk, Zaandam, Hoorn]"
train_2,"[Rotterdam Centraal, Schiedam Centrum, Delft, Den Haag Centraal, Delft, Den Haag Centraal, Gouda, Alphen a/d Rijn, Gouda]"
train_3,"[Beverwijk, Castricum, Alkmaar, Den Helder, Alkmaar]"
train_4,"[Heemstede-Aerdenhout, Leiden Centraal, Den Haag Centraal, Delft, Schiedam Centrum, Rotterdam Centraal, Dordrecht, Rotterdam Centraal, Dordrecht, Rotterdam Centraal]"
train_5,"[Alkmaar, Hoorn, Alkmaar, Den Helder]"
train_6,"[Castricum, Alkmaar, Den Helder, Alkmaar, Den Helder]"
train_7,"[Rotterdam Centraal, Dordrecht, Rotterdam Centraal, Dordrecht, Rotterdam Centraal, Dordrecht, Rotterdam Centraal, Dordrecht]"
score,3512.0
