train,stations
train_1,"[Amsterdam Sloterdijk, Amsterdam Zuid, Amsterdam Sloterdijk, Amsterdam Zuid, Amsterdam Amstel, Amsterdam Zuid, Amsterdam Amstel, Amsterdam Centraal, Amsterdam Sloterdijk, Zaandam]"
train_2,"[Rotterdam Alexander, Gouda, Den Haag Centraal, Delft, Den Haag Centraal, Delft, Schiedam Centrum, Delft, Den Haag Centraal, Leiden Centraal]"
train_3,"[Hoorn, Zaandam, Hoorn, Zaandam, Beverwijk]"
train_4,"[Dordrecht, Rotterdam Centraal, Rotterdam Alexander, Gouda, Rotterdam Alexander, Gouda, Rotterdam Alexander, Gouda, Alphen a/d Rijn, Leiden Centraal]"
train_5,"[Amsterdam Amstel, Amsterdam Zuid, Schiphol Airport, Amsterdam Zuid, Amsterdam Amstel, Amsterdam Zuid, Amsterdam Sloterdijk, Amsterdam Centraal, Amsterdam Sloterdijk, Zaandam, Castricum, Alkmaar]"
train_6,"[Alphen a/d Rijn, Leiden Centraal, Schiphol Airport, Leiden Centraal, Alphen a/d Rijn, Gouda, Rotterdam Alexander, Gouda, Den Haag Centraal]"
train_7,"[Rotterdam Centraal, Rotterdam Alexander, Gouda, Rotterdam Alexander, Rotterdam Centraal, Schiedam Centrum, Rotterdam Centraal, Dordrecht, Rotterdam Centraal, Dordrecht, Rotterdam Centraal, Schiedam Centrum]"
score,6054.0
