train,stations
train_1,"[Gouda, Alphen a/d Rijn, Leiden Centraal, Schiphol Airport, Leiden Centraal, Heemstede-Aerdenhout, Haarlem, Heemstede-Aerdenhout, Leiden Centraal, Heemstede-Aerdenhout]"
train_2,"[Zaandam, Hoorn, Alkmaar, Hoorn, Zaandam, Amsterdam Sloterdijk]"
train_3,"[Haarlem, Beverwijk, Haarlem, Amsterdam Sloterdijk, Zaandam, Castricum, Alkmaar, Den Helder]"
train_4,"[Delft, Den Haag Centraal, Delft, Den Haag Centraal, Leiden Centraal, Den Haag Centraal, Leiden Centraal, Heemstede-Aerdenhout, Leiden Centraal, Den Haag Centraal]"
train_5,"[Dordrecht, Rotterdam Centraal, Schiedam Centrum, Delft, Schiedam Centrum, Rotterdam Centraal, Rotterdam Alexander, Gouda, Den Haag Centraal, Gouda, Den Haag Centraal]"
train_6,"[Zaandam, Beverwijk, Zaandam, Beverwijk, Castricum, Alkmaar]"
train_7,"[Schiphol Airport, Amsterdam Zuid, Amsterdam Amstel, Amsterdam Centraal, Amsterdam Amstel, Amsterdam Centraal, Amsterdam Sloterdijk]"
score,8589.0
