train,stations
train_1,"[Rotterdam Centraal, Dordrecht, Rotterdam Centraal, Schiedam Centrum, Delft, Den Haag Centraal, Delft, Den Haag Centraal, Delft, Schiedam Centrum, Rotterdam Centraal, Rotterdam Alexander]"
train_2,"[Delft, Den Haag Centraal, Gouda, Alphen a/d Rijn, Gouda, Alphen a/d Rijn, Leiden Centraal, Schiphol Airport]"
train_3,"[Gouda, Rotterdam Alexander, Gouda, Alphen a/d Rijn, Gouda, Alphen a/d Rijn, Gouda, Den Haag Centraal]"
train_4,"[Dordrecht, Rotterdam Centraal, Schiedam Centrum, Delft, Schiedam Centrum, Rotterdam Centraal, Schiedam Centrum, Rotterdam Centraal, Schiedam Centrum, Rotterdam Centraal, Schiedam Centrum, Delft, Schiedam Centrum, Rotterdam Centraal, Schiedam Centrum, Delft, Schiedam Centrum, Delft]"
train_5,"[Rotterdam Centraal, Dordrecht, Rotterdam Centraal, Schiedam Centrum, Delft, Den Haag Centraal, Leiden Centraal, Schiphol Airport, Leiden Centraal, Alphen a/d Rijn]"
train_6,"[Gouda, Alphen a/d Rijn, Leiden Centraal, Den Haag Centraal, Gouda, Alphen a/d Rijn, Leiden Centraal, Alphen a/d Rijn]"
train_7,"[Alphen a/d Rijn, Gouda, Rotterdam Alexander, Gouda, Rotterdam Alexander, Gouda, Alphen a/d Rijn, Gouda, Alphen a/d Rijn]"
score,2427.5714285714284
