train,stations
train_1,"[Heemstede-Aerdenhout, Leiden Centraal, Heemstede-Aerdenhout, Leiden Centraal, Den Haag Centraal, Gouda, Den Haag Centraal, Delft, Den Haag Centraal]"
train_2,"[Rotterdam Alexander, Rotterdam Centraal, Dordrecht, Rotterdam Centraal, Schiedam Centrum, Delft, Schiedam Centrum, Delft, Schiedam Centrum, Delft, Schiedam Centrum, Rotterdam Centraal, Dordrecht]"
train_3,"[Amsterdam Amstel, Amsterdam Zuid, Amsterdam Sloterdijk, Haarlem, Heemstede-Aerdenhout, Leiden Centraal, Den Haag Centraal, Leiden Centraal, Alphen a/d Rijn, Leiden Centraal]"
train_4,"[Hoorn, Alkmaar, Castricum, Beverwijk, Zaandam, Hoorn]"
train_5,"[Alkmaar, Den Helder, Alkmaar, Castricum, Alkmaar]"
train_6,"[Den Haag Centraal, Leiden Centraal, Alphen a/d Rijn, Gouda, Rotterdam Alexander, Rotterdam Centraal, Rotterdam Alexander, Rotterdam Centraal, Dordrecht, Rotterdam Centraal]"
train_7,"[Leiden Centraal, Schiphol Airport, Amsterdam Zuid, Amsterdam Amstel, Amsterdam Centraal, Amsterdam Sloterdijk, Zaandam, Castricum, Beverwijk, Zaandam]"
score,8197.857142857143
