train,stations
train_1,"[Den Haag Centraal, Gouda, Rotterdam Alexander, Gouda, Den Haag Centraal, Gouda, Alphen a/d Rijn, Leiden Centraal]"
train_2,"[Alkmaar, Castricum, Alkmaar, Hoorn, Alkmaar, Castricum, Zaandam, Castricum, Beverwijk]"
train_3,"[Heemstede-Aerdenhout, Haarlem, Heemstede-Aerdenhout, Haarlem, Heemstede-Aerdenhout, Haarlem, Amsterdam Sloterdijk, Haarlem, Amsterdam Sloterdijk, Zaandam, Amsterdam Sloterdijk, Amsterdam Zuid, Amsterdam Sloterdijk, Zaandam]"
train_4,"[Zaandam, Castricum, Zaandam, Hoorn, Zaandam, Castricum, Beverwijk, Haarlem]"
train_5,"[Leiden Centraal, Den Haag Centraal, Leiden Centraal, Alphen a/d Rijn, Gouda, Rotterdam Alexander, Rotterdam Centraal, Schiedam Centrum, Rotterdam Centraal, Dordrecht, Rotterdam Centraal]"
train_6,"[Rotterdam Alexander, Rotterdam Centraal, Schiedam Centrum, Delft, Den Haag Centraal, Leiden Centraal, Schiphol Airport, Leiden Centraal, Den Haag Centraal, Gouda]"
train_7,"[Amsterdam Sloterdijk, Amsterdam Zuid, Amsterdam Sloterdijk, Amsterdam Centraal, Amsterdam Sloterdijk, Zaandam, Beverwijk, Haarlem, Beverwijk]"
score,6721.285714285714
