train,stations
train_1,"[Rotterdam Centraal, Rotterdam Alexander, Rotterdam Centraal, Dordrecht, Rotterdam Centraal, Dordrecht, Rotterdam Centraal, Rotterdam Alexander, Rotterdam Centraal, Dordrecht]"
train_2,"[Schiphol Airport, Amsterdam Zuid, Schiphol Airport, Leiden Centraal, Schiphol Airport, Leiden Centraal, Alphen a/d Rijn, Gouda, Den Haag Centraal]"
train_3,"[Beverwijk, Castricum, Beverwijk, Haarlem, Beverwijk, Castricum, Beverwijk, Zaandam]"
train_4,"[Hoorn, Zaandam, Hoorn, Zaandam, Castricum, Zaandam, Amsterdam Sloterdijk, Haarlem]"
train_5,"[Zaandam, Amsterdam Sloterdijk, Zaandam, Hoorn, Zaandam, Amsterdam Sloterdijk, Zaandam, Beverwijk, Castricum]"
train_6,"[Castricum, Zaandam, Amsterdam Sloterdijk, Haarlem, Beverwijk, Castricum, Alkmaar, Castricum, Alkmaar, Castricum, Alkmaar]"
train_7,"[Zaandam, Amsterdam Sloterdijk, Haarlem, Beverwijk, Castricum, Beverwijk, Castricum, Beverwijk, Zaandam]"
score,3877.142857142857
