train,stations
train_1,"[Haarlem, Beverwijk, Castricum, Alkmaar, Castricum, Zaandam, Amsterdam Sloterdijk, Haarlem, Beverwijk, Haarlem, Heemstede-Aerdenhout]"
train_2,"[Haarlem, Amsterdam Sloterdijk, Zaandam, Hoorn, Zaandam, Hoorn]"
train_3,"[Hoorn, Zaandam, Castricum, Beverwijk, Zaandam, Castricum, Zaandam]"
train_4,"[Castricum, Zaandam, Castricum, Zaandam, Hoorn, Zaandam, Beverwijk]"
train_5,"[Beverwijk, Zaandam, Hoorn, Alkmaar, Hoorn]"
train_6,"[Gouda, Alphen a/d Rijn, Leiden Centraal, Den Haag Centraal, Leiden Centraal, Alphen a/d Rijn, Gouda, Alphen a/d Rijn]"
train_7,"[Amsterdam Zuid, Amsterdam Sloterdijk, Amsterdam Centraal, Amsterdam Sloterdijk, Haarlem, Heemstede-Aerdenhout, Haarlem, Amsterdam Sloterdijk, Zaandam, Amsterdam Sloterdijk, Zaandam, Amsterdam Sloterdijk, Zaandam, Hoorn]"
score,3909.142857142857
