train,stations
train_1,"[Den Haag Centraal, Delft, Schiedam Centrum, Rotterdam Centraal, Schiedam Centrum, Rotterdam Centraal, Dordrecht, Rotterdam Centraal, Rotterdam Alexander, Gouda, Alphen a/d Rijn]"
train_2,"[Beverwijk, Castricum, Beverwijk, Haarlem, Beverwijk, Haarlem, Heemstede-Aerdenhout, Leiden Centraal, Alphen a/d Rijn]"
train_3,"[Amsterdam Sloterdijk, Amsterdam Centraal, Amsterdam Sloterdijk, Haarlem, Amsterdam Sloterdijk, Amsterdam Centraal, Amsterdam Sloterdijk, Amsterdam Centraal, Amsterdam Sloterdijk, Amsterdam Centraal, Amsterdam Amstel, Amsterdam Zuid, Schiphol Airport, Leiden Centraal, Alphen a/d Rijn]"
train_4,"[Haarlem, Amsterdam Sloterdijk, Amsterdam Centraal, Amsterdam Sloterdijk, Haarlem, Amsterdam Sloterdijk, Zaandam, Beverwijk, Castricum, Alkmaar, Castricum]"
train_5,"[Haarlem, Beverwijk, Zaandam, Amsterdam Sloterdijk, Amsterdam Centraal, Amsterdam Amstel, Amsterdam Centraal, Amsterdam Sloterdijk, Amsterdam Zuid, Schiphol Airport, Leiden Centraal]"
train_6,"[Alphen a/d Rijn, Gouda, Den Haag Centraal, Gouda, Alphen a/d Rijn, Leiden Centraal, Alphen a/d Rijn, Leiden Centraal]"
train_7,"[Beverwijk, Castricum, Zaandam, Castricum, Alkmaar, Hoorn, Alkmaar, Hoorn]"
score,7418.571428571429
