train,stations
train_1,"[Dordrecht, Rotterdam Centraal, Dordrecht, Rotterdam Centraal, Rotterdam Alexander, Gouda, Rotterdam Alexander, Rotterdam Centraal, Schiedam Centrum, Rotterdam Centraal, Rotterdam Alexander, Gouda]"
train_2,"[Delft, Den Haag Centraal, Delft, Schiedam Centrum, Rotterdam Centraal, Dordrecht, Rotterdam Centraal, Dordrecht, Rotterdam Centraal, Schiedam Centrum, Delft]"
train_3,"[Leiden Centraal, Schiphol Airport, Leiden Centraal, Alphen a/d Rijn, Gouda, Alphen a/d Rijn, Leiden Centraal, Schiphol Airport]"
train_4,"[Castricum, Beverwijk, Haarlem, Beverwijk, Haarlem, Amsterdam Sloterdijk, Haarlem, Beverwijk, Haarlem]"
train_5,"[Schiedam Centrum, Rotterdam Centraal, Dordrecht, Rotterdam Centraal, Dordrecht, Rotterdam Centraal, Schiedam Centrum, Delft, Den Haag Centraal, Delft, Schiedam Centrum]"
train_6,"[Den Haag Centraal, Delft, Schiedam Centrum, Delft, Schiedam Centrum, Delft, Den Haag Centraal, Delft, Schiedam Centrum, Delft, Den Haag Centraal, Delft, Schiedam Centrum]"
train_7,"[Schiphol Airport, Leiden Centraal, Alphen a/d Rijn, Gouda, Den Haag Centraal, Delft, Den Haag Centraal, Gouda]"
score,3141.857142857143
