train,stations
train_1,"[Amsterdam Amstel, Amsterdam Zuid, Amsterdam Amstel, Amsterdam Zuid, Amsterdam Sloterdijk, Haarlem, Beverwijk, Haarlem, Amsterdam Sloterdijk, Zaandam]"
train_2,"[Heemstede-Aerdenhout, Leiden Centraal, Den Haag Centraal, Gouda, Rotterdam Alexander, Rotterdam Centraal, Rotterdam Alexander, Rotterdam Centraal, Schiedam Centrum, Rotterdam Centraal, Dordrecht]"
train_3,"[Rotterdam Alexander, Rotterdam Centraal, Rotterdam Alexander, Rotterdam Centraal, Rotterdam Alexander, Rotterdam Centraal, Schiedam Centrum, Rotterdam Centraal, Dordrecht, Rotterdam Centraal, Schiedam Centrum, Delft, Den Haag Centraal]"
train_4,"[Heemstede-Aerdenhout, Haarlem, Heemstede-Aerdenhout, Leiden Centraal, Alphen a/d Rijn, Leiden Centraal, Alphen a/d Rijn, Gouda, Alphen a/d Rijn]"
train_5,"[Leiden Centraal, Alphen a/d Rijn, Gouda, Rotterdam Alexander, Gouda, Den Haag Centraal, Gouda, Alphen a/d Rijn]"
train_6,"[Amsterdam Centraal, Amsterdam Sloterdijk, Haarlem, Amsterdam Sloterdijk, Zaandam, Hoorn, Alkmaar]"
train_7,"[Castricum, Beverwijk, Haarlem, Heemstede-Aerdenhout, Haarlem, Beverwijk, Zaandam, Beverwijk]"
score,6755.285714285714
