train,stations
train_1,"[Castricum, Alkmaar, Hoorn, Alkmaar, Den Helder]"
train_2,"[Hoorn, Zaandam, Castricum, Alkmaar, Hoorn, Alkmaar]"
train_3,"[Heemstede-Aerdenhout, Haarlem, Amsterdam Sloterdijk, Haarlem, Beverwijk, Zaandam, Hoorn, Alkmaar]"
train_4,"[Delft, Den Haag Centraal, Gouda, Den Haag Centraal, Delft, Den Haag Centraal, Delft, Schiedam Centrum, Delft, Den Haag Centraal]"
train_5,"[Haarlem, Beverwijk, Haarlem, Beverwijk, Zaandam, Hoorn]"
train_6,"[Delft, Den Haag Centraal, Leiden Centraal, Den Haag Centraal, Leiden Centraal, Heemstede-Aerdenhout, Haarlem, Amsterdam Sloterdijk, Amsterdam Centraal, Amsterdam Sloterdijk, Zaandam]"
train_7,"[Delft, Den Haag Centraal, Leiden Centraal, Heemstede-Aerdenhout, Leiden Centraal, Heemstede-Aerdenhout, Leiden Centraal, Heemstede-Aerdenhout, Haarlem, Amsterdam Sloterdijk, Zaandam]"
score,4283.285714285714
