train,stations
train_1,"[Delft, Schiedam Centrum, Delft, Den Haag Centraal, Delft, Den Haag Centraal, Delft, Schiedam Centrum, Delft, Schiedam Centrum, Delft, Den Haag Centraal]"
train_2,"[Amsterdam Amstel, Amsterdam Zuid, Schiphol Airport, Leiden Centraal, Heemstede-Aerdenhout, Haarlem, Amsterdam Sloterdijk, Amsterdam Centraal, Amsterdam Amstel, Amsterdam Centraal, Amsterdam Amstel, Amsterdam Centraal, Amsterdam Sloterdijk, Amsterdam Centraal, Amsterdam Sloterdijk]"
train_3,"[Schiphol Airport, Leiden Centraal, Schiphol Airport, Leiden Centraal, Schiphol Airport, Leiden Centraal, Heemstede-Aerdenhout, Leiden Centraal, Schiphol Airport]"
train_4,"[Haarlem, Heemstede-Aerdenhout, Haarlem, Heemstede-Aerdenhout, Haarlem, Heemstede-Aerdenhout, Haarlem, Amsterdam Sloterdijk, Haarlem, Amsterdam Sloterdijk, Haarlem, Heemstede-Aerdenhout, Haarlem, Heemstede-Aerdenhout, Leiden Centraal]"
train_5,"[Den Helder, Alkmaar, Den Helder, Alkmaar, Castricum]"
train_6,"[Den Haag Centraal, Delft, Den Haag Centraal, Leiden Centraal, Den Haag Centraal, Delft, Den Haag Centraal, Delft, Den Haag Centraal, Leiden Centraal]"
train_7,"[Amsterdam Sloterdijk, Haarlem, Heemstede-Aerdenhout, Haarlem, Amsterdam Sloterdijk, Haarlem, Heemstede-Aerdenhout, Leiden Centraal, Schiphol Airport, Leiden Centraal, Alphen a/d Rijn]"
score,3497.0
