train,stations
train_1,"[Leiden Centraal, Den Haag Centraal, Gouda, Alphen a/d Rijn, Gouda, Rotterdam Alexander, Gouda, Alphen a/d Rijn]"
train_2,"[Den Helder, Alkmaar, Den Helder, Alkmaar]"
train_3,"[Schiphol Airport, Amsterdam Zuid, Amsterdam Amstel, Amsterdam Zuid, Amsterdam Sloterdijk, Haarlem, Beverwijk, Haarlem, Heemstede-Aerdenhout, Haarlem, Beverwijk]"
train_4,"[Amsterdam Zuid, Amsterdam Amstel, Amsterdam Zuid, Amsterdam Amstel, Amsterdam Zuid, Amsterdam Sloterdijk, Amsterdam Centraal, Amsterdam Sloterdijk, Zaandam, Hoorn]"
train_5,"[Alphen a/d Rijn, Gouda, Alphen a/d Rijn, Gouda, Alphen a/d Rijn, Gouda, Den Haag Centraal]"
train_6,"[Amsterdam Sloterdijk, Zaandam, Beverwijk, Haarlem, Beverwijk, Haarlem, Beverwijk, Castricum]"
train_7,"[Heemstede-Aerdenhout, Haarlem, Beverwijk, Zaandam, Beverwijk, Castricum, Beverwijk, Haarlem]"
score,4251.285714285714
