train,stations
train_1,"[Den Haag Centraal, Leiden Centraal, Den Haag Centraal, Gouda, Den Haag Centraal, Leiden Centraal, Alphen a/d Rijn, Gouda]"
train_2,"[Leiden Centraal, Den Haag Centraal, Gouda, Den Haag Centraal, Leiden Centraal, Heemstede-Aerdenhout, Leiden Centraal, Heemstede-Aerdenhout, Leiden Centraal]"
train_3,"[Den Haag Centraal, Gouda, Rotterdam Alexander, Rotterdam Centraal, Rotterdam Alexander, Rotterdam Centraal, Schiedam Centrum, Rotterdam Centraal, Schiedam Centrum, Rotterdam Centraal, Rotterdam Alexander, Gouda, Den Haag Centraal]"
train_4,"[Zaandam, Hoorn, Alkmaar, Den Helder]"
train_5,"[Amsterdam Sloterdijk, Haarlem, Heemstede-Aerdenhout, Haarlem, Heemstede-Aerdenhout, Haarlem, Heemstede-Aerdenhout, Haarlem, Beverwijk, Castricum, Alkmaar, Hoorn]"
train_6,"[Schiedam Centrum, Rotterdam Centraal, Schiedam Centrum, Delft, Den Haag Centraal, Leiden Centraal, Schiphol Airport, Amsterdam Zuid, Amsterdam Sloterdijk, Amsterdam Centraal, Amsterdam Amstel, Amsterdam Centraal, Amsterdam Amstel, Amsterdam Centraal]"
train_7,"[Dordrecht, Rotterdam Centraal, Schiedam Centrum, Delft, Den Haag Centraal, Delft, Schiedam Centrum, Delft, Schiedam Centrum, Rotterdam Centraal, Dordrecht, Rotterdam Centraal]"
score,7119.428571428571
