train,stations
train_1,"[Amsterdam Amstel, Amsterdam Zuid, Schiphol Airport, Leiden Centraal, Heemstede-Aerdenhout, Leiden Centraal, Alphen a/d Rijn, Leiden Centraal, Alphen a/d Rijn, Leiden Centraal]"
train_2,"[Amsterdam Centraal, Amsterdam Amstel, Amsterdam Centraal, Amsterdam Sloterdijk, Zaandam, Beverwijk, Haarlem, Amsterdam Sloterdijk, Zaandam, Castricum, Beverwijk]"
train_3,"[Beverwijk, Castricum, Beverwijk, Haarlem, Heemstede-Aerdenhout, Leiden Centraal, Schiphol Airport, Leiden Centraal, Alphen a/d Rijn, Leiden Centraal]"
train_4,"[Hoorn, Zaandam, Castricum, Beverwijk, Haarlem, Heemstede-Aerdenhout, Leiden Centraal, Heemstede-Aerdenhout, Leiden Centraal]"
train_5,"[Zaandam, Beverwijk, Haarlem, Amsterdam Sloterdijk, Haarlem, Amsterdam Sloterdijk, Amsterdam Zuid, Schiphol Airport, Leiden Centraal]"
train_6,"[Beverwijk, Haarlem, Heemstede-Aerdenhout, Haarlem, Beverwijk, Haarlem, Amsterdam Sloterdijk, Haarlem, Heemstede-Aerdenhout, Leiden Centraal, Heemstede-Aerdenhout]"
train_7,"[Haarlem, Beverwijk, Castricum, Zaandam, Beverwijk, Zaandam, Amsterdam Sloterdijk, Zaandam, Castricum]"
score,4219.285714285714
