train,stations
train_1,"[Rotterdam Centraal, Rotterdam Alexander, Gouda, Alphen a/d Rijn, Leiden Centraal, Alphen a/d Rijn, Gouda, Alphen a/d Rijn]"
train_2,"[Zaandam, Castricum, Zaandam, Hoorn, Alkmaar, Den Helder]"
train_3,"[Leiden Centraal, Den Haag Centraal, Leiden Centraal, Alphen a/d Rijn, Leiden Centraal, Schiphol Airport, Leiden Centraal, Heemstede-Aerdenhout, Haarlem, Beverwijk]"
train_4,"[Alphen a/d Rijn, Leiden Centraal, Schiphol Airport, Amsterdam Zuid, Amsterdam Sloterdijk, Haarlem, Beverwijk, Haarlem, Amsterdam Sloterdijk]"
train_5,"[Amsterdam Amstel, Amsterdam Centraal, Amsterdam Sloterdijk, Zaandam, Amsterdam Sloterdijk, Amsterdam Zuid, Amsterdam Amstel, Amsterdam Centraal, Amsterdam Amstel, Amsterdam Zuid, Amsterdam Amstel, Amsterdam Zuid, Schiphol Airport, Leiden Centraal]"
train_6,"[Amsterdam Sloterdijk, Zaandam, Amsterdam Sloterdijk, Amsterdam Zuid, Amsterdam Sloterdijk, Amsterdam Zuid, Schiphol Airport, Amsterdam Zuid, Schiphol Airport, Amsterdam Zuid, Schiphol Airport, Amsterdam Zuid, Amsterdam Sloterdijk, Zaandam]"
train_7,"[Amsterdam Amstel, Amsterdam Zuid, Amsterdam Amstel, Amsterdam Centraal, Amsterdam Sloterdijk, Amsterdam Zuid, Amsterdam Amstel, Amsterdam Centraal, Amsterdam Sloterdijk, Zaandam, Amsterdam Sloterdijk, Amsterdam Centraal, Amsterdam Amstel, Amsterdam Centraal, Amsterdam Sloterdijk]"
score,5656.857142857143
