train,stations
train_1,"[Amsterdam Sloterdijk, Amsterdam Zuid, Amsterdam Sloterdijk, Zaandam, Beverwijk, Castricum, Alkmaar]"
train_2,"[Alkmaar, Hoorn, Zaandam, Hoorn, Zaandam]"
train_3,"[Alkmaar, Den Helder, Alkmaar, Hoorn]"
train_4,"[Delft, Schiedam Centrum, Delft, Schiedam Centrum, Rotterdam Centraal, Schiedam Centrum, Rotterdam Centraal, Schiedam Centrum, Delft, Den Haag Centraal, Delft, Schiedam Centrum, Delft, Den Haag Centraal, Gouda]"
train_5,"[Castricum, Alkmaar, Den Helder, Alkmaar, Hoorn]"
train_6,"[Castricum, Beverwijk, Castricum, Beverwijk, Zaandam, Hoorn, Zaandam]"
train_7,"[Castricum, Alkmaar, Hoorn, Alkmaar, Den Helder]"
score,2869.7142857142853
