train,stations
train_1,"[Alkmaar, Den Helder, Alkmaar, Hoorn]"
train_2,"[Den Helder, Alkmaar, Hoorn, Alkmaar, Castricum, Beverwijk]"
train_3,"[Delft, Den Haag Centraal, Gouda, Den Haag Centraal, Delft, Den Haag Centraal, Delft, Den Haag Centraal, Leiden Centraal]"
train_4,"[Heemstede-Aerdenhout, Leiden Centraal, Den Haag Centraal, Delft, Schiedam Centrum, Rotterdam Centraal, Schiedam Centrum, Delft, Schiedam Centrum, Delft, Schiedam Centrum, Delft, Den Haag Centraal]"
train_5,"[Hoorn, Alkmaar, Hoorn, Alkmaar, Castricum, Alkmaar, Hoorn]"
train_6,"[Den Helder, Alkmaar, Den Helder, Alkmaar, Castricum]"
train_7,"[Den Helder, Alkmaar, Hoorn, Alkmaar, Castricum, Beverwijk]"
score,2116.4285714285716
