train,stations
train_1,"[Castricum, Zaandam, Hoorn, Zaandam, Hoorn, Alkmaar]"
train_2,"[Castricum, Alkmaar, Hoorn, Zaandam, Castricum, Alkmaar, Castricum, Zaandam]"
train_3,"[Rotterdam Centraal, Dordrecht, Rotterdam Centraal, Dordrecht, Rotterdam Centraal, Schiedam Centrum, Rotterdam Centraal, Schiedam Centrum, Delft, Den Haag Centraal]"
train_4,"[Castricum, Zaandam, Amsterdam Sloterdijk, Amsterdam Zuid, Schiphol Airport, Amsterdam Zuid, Amsterdam Amstel, Amsterdam Centraal, Amsterdam Sloterdijk, Zaandam, Castricum, Beverwijk]"
train_5,"[Hoorn, Alkmaar, Castricum, Beverwijk, Castricum, Zaandam, Hoorn]"
train_6,"[Heemstede-Aerdenhout, Haarlem, Beverwijk, Castricum, Alkmaar, Den Helder, Alkmaar]"
train_7,"[Rotterdam Centraal, Rotterdam Alexander, Gouda, Den Haag Centraal, Delft, Schiedam Centrum, Delft, Schiedam Centrum, Rotterdam Centraal, Rotterdam Alexander, Gouda, Den Haag Centraal]"
score,6057.0
