train,stations
train_1,"[Den Helder, Alkmaar, Den Helder, Alkmaar]"
train_2,"[Dordrecht, Rotterdam Centraal, Dordrecht, Rotterdam Centraal, Schiedam Centrum, Delft, Schiedam Centrum, Delft, Den Haag Centraal, Gouda]"
train_3,"[Amsterdam Amstel, Amsterdam Zuid, Schiphol Airport, Amsterdam Zuid, Amsterdam Sloterdijk, Amsterdam Centraal, Amsterdam Amstel, Amsterdam Zuid, Schiphol Airport, Leiden Centraal, Heemstede-Aerdenhout, Leiden Centraal]"
train_4,"[Den Helder, Alkmaar, Castricum, Alkmaar, Den Helder]"
train_5,"[Beverwijk, Zaandam, Hoorn, Zaandam, Hoorn]"
train_6,"[Leiden Centraal, Den Haag Centraal, Leiden Centraal, Heemstede-Aerdenhout, Leiden Centraal, Heemstede-Aerdenhout, Leiden Centraal, Den Haag Centraal, Leiden Centraal, Schiphol Airport]"
train_7,"[Schiedam Centrum, Rotterdam Centraal, Dordrecht, Rotterdam Centraal, Dordrecht, Rotterdam Centraal, Dordrecht, Rotterdam Centraal]"
score,4631.428571428571
