train,stations
train_1,"[Den Helder, Alkmaar, Castricum, Alkmaar, Den Helder]"
train_2,"[Amsterdam Sloterdijk, Amsterdam Zuid, Schiphol Airport, Amsterdam Zuid, Amsterdam Amstel, Amsterdam Centraal, Amsterdam Sloterdijk, Zaandam, Castricum, Alkmaar, Hoorn]"
train_3,"[Alkmaar, Castricum, Beverwijk, Castricum, Beverwijk, Castricum, Zaandam, Beverwijk]"
train_4,"[Alkmaar, Hoorn, Alkmaar, Castricum, Zaandam, Hoorn]"
train_5,"[Amsterdam Sloterdijk, Zaandam, Amsterdam Sloterdijk, Zaandam, Castricum, Zaandam, Amsterdam Sloterdijk, Zaandam, Castricum, Beverwijk, Haarlem, Heemstede-Aerdenhout, Leiden Centraal]"
train_6,"[Dordrecht, Rotterdam Centraal, Rotterdam Alexander, Rotterdam Centraal, Schiedam Centrum, Rotterdam Centraal, Dordrecht, Rotterdam Centraal, Dordrecht, Rotterdam Centraal, Rotterdam Alexander]"
train_7,"[Delft, Schiedam Centrum, Rotterdam Centraal, Dordrecht, Rotterdam Centraal, Rotterdam Alexander, Gouda, Den Haag Centraal, Delft, Schiedam Centrum, Delft]"
score,6786.285714285714
