train,stations
train_1,"[Alkmaar, Hoorn, Zaandam, Castricum, Alkmaar, Den Helder]"
train_2,"[Gouda, Alphen a/d Rijn, Gouda, Alphen a/d Rijn, Leiden Centraal, Den Haag Centraal, Delft, Den Haag Centraal]"
train_3,"[Haarlem, Heemstede-Aerdenhout, Leiden Centraal, Heemstede-Aerdenhout, Haarlem, Amsterdam Sloterdijk, Amsterdam Centraal, Amsterdam Sloterdijk, Amsterdam Zuid, Amsterdam Amstel, Amsterdam Zuid, Schiphol Airport, Amsterdam Zuid, Amsterdam Amstel]"
train_4,"[Schiphol Airport, Leiden Centraal, Den Haag Centraal, Gouda, Rotterdam Alexander, Gouda, Alphen a/d Rijn, Gouda]"
train_5,"[Alkmaar, Den Helder, Alkmaar, Hoorn]"
train_6,"[Rotterdam Alexander, Rotterdam Centraal, Schiedam Centrum, Rotterdam Centraal, Schiedam Centrum, Rotterdam Centraal, Schiedam Centrum, Delft, Schiedam Centrum, Rotterdam Centraal, Rotterdam Alexander, Rotterdam Centraal, Dordrecht, Rotterdam Centraal, Schiedam Centrum, Rotterdam Centraal, Schiedam Centrum]"
train_7,"[Hoorn, Alkmaar, Castricum, Zaandam, Beverwijk, Haarlem, Amsterdam Sloterdijk, Zaandam, Amsterdam Sloterdijk]"
score,7825.714285714286
