train,stations
train_1,"[Hoorn, Zaandam, Castricum, Beverwijk, Zaandam, Castricum, Alkmaar]"
train_2,"[Alkmaar, Hoorn, Zaandam, Beverwijk, Haarlem, Heemstede-Aerdenhout, Leiden Centraal]"
train_3,"[Amsterdam Centraal, Amsterdam Sloterdijk, Amsterdam Zuid, Schiphol Airport, Amsterdam Zuid, Amsterdam Amstel, Amsterdam Centraal, Amsterdam Sloterdijk, Zaandam, Castricum, Alkmaar]"
train_4,"[Castricum, Alkmaar, Den Helder, Alkmaar, Hoorn]"
train_5,"[Castricum, Alkmaar, Castricum, Beverwijk, Castricum, Zaandam, Hoorn, Zaandam, Amsterdam Sloterdijk]"
train_6,"[Hoorn, Zaandam, Castricum, Beverwijk, Haarlem, Beverwijk, Haarlem, Amsterdam Sloterdijk, Zaandam]"
train_7,"[Heemstede-Aerdenhout, Leiden Centraal, Den Haag Centraal, Gouda, Den Haag Centraal, Leiden Centraal, Heemstede-Aerdenhout, Haarlem, Beverwijk]"
score,5350.714285714286
