train,stations
train_1,"[Alkmaar, Hoorn, Zaandam, Hoorn, Alkmaar]"
train_2,"[Amsterdam Centraal, Amsterdam Amstel, Amsterdam Centraal, Amsterdam Amstel, Amsterdam Centraal, Amsterdam Amstel, Amsterdam Centraal, Amsterdam Amstel, Amsterdam Centraal, Amsterdam Sloterdijk, Haarlem, Beverwijk]"
train_3,"[Alkmaar, Hoorn, Zaandam, Amsterdam Sloterdijk, Zaandam, Castricum, Alkmaar, Hoorn]"
train_4,"[Castricum, Beverwijk, Castricum, Zaandam, Castricum, Alkmaar, Den Helder]"
train_5,"[Rotterdam Alexander, Rotterdam Centraal, Dordrecht, Rotterdam Centraal, Dordrecht, Rotterdam Centraal, Schiedam Centrum, Rotterdam Centraal, Rotterdam Alexander, Rotterdam Centraal, Dordrecht]"
train_6,"[Heemstede-Aerdenhout, Haarlem, Beverwijk, Zaandam, Castricum, Beverwijk, Zaandam]"
train_7,"[Zaandam, Beverwijk, Zaandam, Amsterdam Sloterdijk, Amsterdam Centraal, Amsterdam Sloterdijk, Amsterdam Zuid, Amsterdam Sloterdijk, Haarlem]"
score,4645.428571428571
