train,stations
train_1,"[Dordrecht, Rotterdam Centraal, Rotterdam Alexander, Rotterdam Centraal, Dordrecht, Rotterdam Centraal, Dordrecht, Rotterdam Centraal, Rotterdam Alexander, Rotterdam Centraal]"
train_2,"[Rotterdam Centraal, Dordrecht, Rotterdam Centraal, Dordrecht, Rotterdam Centraal, Schiedam Centrum, Rotterdam Centraal, Schiedam Centrum, Delft, Den Haag Centraal]"
train_3,"[Delft, Schiedam Centrum, Delft, Schiedam Centrum, Delft, Schiedam Centrum, Delft, Den Haag Centraal, Delft, Den Haag Centraal, Gouda, Den Haag Centraal]"
train_4,"[Den Helder, Alkmaar, Den Helder, Alkmaar]"
train_5,"[Castricum, Zaandam, Castricum, Alkmaar, Castricum, Beverwijk, Castricum, Zaandam, Castricum, Alkmaar]"
train_6,"[Den Helder, Alkmaar, Hoorn, Zaandam, Castricum, Alkmaar]"
train_7,"[Hoorn, Alkmaar, Den Helder, Alkmaar]"
score,2836.7142857142853
