train,stations
train_1,"[Rotterdam Centraal, Schiedam Centrum, Delft, Den Haag Centraal, Gouda, Rotterdam Alexander, Gouda, Alphen a/d Rijn, Gouda, Rotterdam Alexander]"
train_2,"[Amsterdam Sloterdijk, Amsterdam Zuid, Amsterdam Amstel, Amsterdam Zuid, Amsterdam Sloterdijk, Zaandam, Castricum, Alkmaar, Hoorn]"
train_3,"[Leiden Centraal, Heemstede-Aerdenhout, Leiden Centraal, Schiphol Airport, Amsterdam Zuid, Amsterdam Sloterdijk, Zaandam, Beverwijk, Castricum, Alkmaar]"
train_4,"[Gouda, Alphen a/d Rijn, Leiden Centraal, Alphen a/d Rijn, Leiden Centraal, Alphen a/d Rijn, Gouda, Rotterdam Alexander, Gouda]"
train_5,"[Haarlem, Heemstede-Aerdenhout, Leiden Centraal, Den Haag Centraal, Gouda, Rotterdam Alexander, Rotterdam Centraal, Schiedam Centrum, Delft, Schiedam Centrum, Delft, Den Haag Centraal]"
train_6,"[Hoorn, Zaandam, Amsterdam Sloterdijk, Haarlem, Beverwijk, Zaandam, Amsterdam Sloterdijk, Amsterdam Centraal, Amsterdam Amstel, Amsterdam Centraal]"
train_7,"[Den Helder, Alkmaar, Castricum, Beverwijk, Castricum, Alkmaar, Hoorn]"
score,8168.857142857143
