train,stations
train_1,"[Dordrecht, Rotterdam Centraal, Schiedam Centrum, Rotterdam Centraal, Schiedam Centrum, Delft, Schiedam Centrum, Rotterdam Centraal, Rotterdam Alexander, Gouda, Rotterdam Alexander, Rotterdam Centraal, Dordrecht]"
train_2,"[Zaandam, Hoorn, Alkmaar, Hoorn, Alkmaar]"
train_3,"[Alkmaar, Den Helder, Alkmaar, Castricum, Alkmaar]"
train_4,"[Amsterdam Amstel, Amsterdam Zuid, Amsterdam Amstel, Amsterdam Zuid, Schiphol Airport, Amsterdam Zuid, Amsterdam Amstel, Amsterdam Centraal, Amsterdam Sloterdijk, Amsterdam Zuid, Amsterdam Sloterdijk, Haarlem, Heemstede-Aerdenhout]"
train_5,"[Hoorn, Alkmaar, Castricum, Beverwijk, Zaandam, Amsterdam Sloterdijk, Zaandam, Hoorn]"
train_6,"[Haarlem, Beverwijk, Castricum, Zaandam, Hoorn, Zaandam, Hoorn]"
train_7,"[Den Haag Centraal, Leiden Centraal, Heemstede-Aerdenhout, Leiden Centraal, Schiphol Airport, Leiden Centraal, Alphen a/d Rijn, Gouda]"
score,7830.714285714286
