train,stations
train_1,"[Den Haag Centraal, Delft, Den Haag Centraal, Delft, Den Haag Centraal, Gouda, Rotterdam Alexander, Gouda, Rotterdam Alexander, Gouda]"
train_2,"[Alkmaar, Den Helder, Alkmaar, Hoorn]"
train_3,"[Rotterdam Alexander, Rotterdam Centraal, Rotterdam Alexander, Rotterdam Centraal, Schiedam Centrum, Delft, Den Haag Centraal, Gouda, Rotterdam Alexander, Rotterdam Centraal, Schiedam Centrum, Delft, Den Haag Centraal]"
train_4,"[Delft, Den Haag Centraal, Gouda, Alphen a/d Rijn, Leiden Centraal, Alphen a/d Rijn, Gouda, Rotterdam Alexander, Gouda]"
train_5,"[Delft, Schiedam Centrum, Rotterdam Centraal, Schiedam Centrum, Rotterdam Centraal, Rotterdam Alexander, Rotterdam Centraal, Dordrecht, Rotterdam Centraal, Dordrecht, Rotterdam Centraal, Schiedam Centrum, Delft]"
train_6,"[Hoorn, Alkmaar, Castricum, Zaandam, Castricum, Alkmaar, Castricum, Zaandam, Castricum, Alkmaar]"
train_7,"[Castricum, Alkmaar, Hoorn, Alkmaar, Den Helder]"
score,3166.857142857143
