train,stations
train_1,"[Leiden Centraal, Schiphol Airport, Amsterdam Zuid, Schiphol Airport, Amsterdam Zuid, Amsterdam Sloterdijk, Amsterdam Zuid, Schiphol Airport, Amsterdam Zuid, Amsterdam Amstel, Amsterdam Zuid, Schiphol Airport, Amsterdam Zuid]"
train_2,"[Amsterdam Sloterdijk, Zaandam, Hoorn, Alkmaar, Hoorn, Zaandam, Amsterdam Sloterdijk]"
train_3,"[Schiedam Centrum, Delft, Schiedam Centrum, Delft, Den Haag Centraal, Leiden Centraal, Schiphol Airport, Amsterdam Zuid, Schiphol Airport, Amsterdam Zuid, Amsterdam Sloterdijk, Amsterdam Zuid, Schiphol Airport]"
train_4,"[Alkmaar, Castricum, Alkmaar, Hoorn, Alkmaar, Den Helder]"
train_5,"[Hoorn, Alkmaar, Hoorn, Zaandam, Amsterdam Sloterdijk, Zaandam, Hoorn]"
train_6,"[Haarlem, Amsterdam Sloterdijk, Haarlem, Beverwijk, Haarlem, Amsterdam Sloterdijk, Amsterdam Zuid, Amsterdam Sloterdijk, Haarlem, Amsterdam Sloterdijk]"
train_7,"[Castricum, Alkmaar, Den Helder, Alkmaar, Den Helder]"
score,3512.0
