train,stations
train_1,"[Den Helder, Alkmaar, Den Helder, Alkmaar]"
train_2,"[Zaandam, Amsterdam Sloterdijk, Haarlem, Beverwijk, Haarlem, Heemstede-Aerdenhout, Haarlem, Beverwijk, Haarlem, Amsterdam Sloterdijk]"
train_3,"[Den Helder, Alkmaar, Hoorn, Zaandam, Hoorn]"
train_4,"[Hoorn, Zaandam, Amsterdam Sloterdijk, Zaandam, Beverwijk, Castricum, Alkmaar]"
train_5,"[Den Haag Centraal, Delft, Den Haag Centraal, Gouda, Den Haag Centraal, Delft, Den Haag Centraal, Delft, Den Haag Centraal]"
train_6,"[Alphen a/d Rijn, Leiden Centraal, Heemstede-Aerdenhout, Haarlem, Heemstede-Aerdenhout, Haarlem, Beverwijk, Zaandam, Amsterdam Sloterdijk, Zaandam, Amsterdam Sloterdijk]"
train_7,"[Amsterdam Sloterdijk, Zaandam, Castricum, Alkmaar, Hoorn, Alkmaar, Hoorn]"
score,4256.285714285714
