train,stations
train_1,"[Zaandam, Beverwijk, Castricum, Zaandam, Beverwijk, Castricum, Zaandam, Amsterdam Sloterdijk, Amsterdam Centraal]"
train_2,"[Heemstede-Aerdenhout, Haarlem, Beverwijk, Castricum, Beverwijk, Castricum, Beverwijk, Castricum, Zaandam]"
train_3,"[Hoorn, Zaandam, Beverwijk, Zaandam, Castricum, Beverwijk]"
train_4,"[Beverwijk, Castricum, Zaandam, Hoorn, Zaandam, Beverwijk]"
train_5,"[Beverwijk, Castricum, Zaandam, Castricum, Beverwijk, Castricum, Zaandam, Hoorn]"
train_6,"[Beverwijk, Castricum, Zaandam, Castricum, Zaandam, Hoorn, Zaandam]"
train_7,"[Alphen a/d Rijn, Gouda, Rotterdam Alexander, Rotterdam Centraal, Dordrecht, Rotterdam Centraal, Dordrecht, Rotterdam Centraal, Rotterdam Alexander]"
score,3205.857142857143
