train,stations
train_1,"[Alkmaar, Castricum, Zaandam, Castricum, Alkmaar, Hoorn, Alkmaar]"
train_2,"[Rotterdam Centraal, Rotterdam Alexander, Gouda, Den Haag Centraal, Delft, Schiedam Centrum, Delft, Schiedam Centrum, Delft, Den Haag Centraal, Gouda]"
train_3,"[Schiphol Airport, Amsterdam Zuid, Schiphol Airport, Leiden Centraal, Schiphol Airport, Amsterdam Zuid, Amsterdam Amstel, Amsterdam Centraal, Amsterdam Sloterdijk, Amsterdam Centraal, Amsterdam Sloterdijk, Amsterdam Centraal, Amsterdam Sloterdijk, Zaandam]"
train_4,"[Leiden Centraal, Schiphol Airport, Leiden Centraal, Alphen a/d Rijn, Leiden Centraal, Heemstede-Aerdenhout, Haarlem, Beverwijk, Haarlem]"
train_5,"[Alkmaar, Castricum, Beverwijk, Castricum, Zaandam, Beverwijk, Haarlem, Beverwijk]"
train_6,"[Den Helder, Alkmaar, Hoorn, Zaandam, Amsterdam Sloterdijk, Zaandam, Amsterdam Sloterdijk, Haarlem]"
train_7,"[Rotterdam Alexander, Gouda, Rotterdam Alexander, Rotterdam Centraal, Dordrecht, Rotterdam Centraal, Rotterdam Alexander, Gouda, Den Haag Centraal, Leiden Centraal]"
score,7490.571428571429
