train,stations
train_1,"[Den Helder, Alkmaar, Hoorn, Alkmaar, Castricum, Zaandam]"
train_2,"[Den Helder, Alkmaar, Castricum, Beverwijk, Castricum, Zaandam, Amsterdam Sloterdijk, Zaandam]"
train_3,"[Delft, Schiedam Centrum, Delft, Schiedam Centrum, Rotterdam Centraal, Schiedam Centrum, Delft, Den Haag Centraal, Gouda, Alphen a/d Rijn, Gouda, Rotterdam Alexander]"
train_4,"[Hoorn, Zaandam, Castricum, Alkmaar, Hoorn, Zaandam]"
train_5,"[Castricum, Beverwijk, Haarlem, Amsterdam Sloterdijk, Zaandam, Beverwijk, Castricum, Alkmaar]"
train_6,"[Haarlem, Heemstede-Aerdenhout, Leiden Centraal, Schiphol Airport, Amsterdam Zuid, Amsterdam Amstel, Amsterdam Zuid, Amsterdam Amstel, Amsterdam Centraal, Amsterdam Sloterdijk, Haarlem, Beverwijk]"
train_7,"[Schiedam Centrum, Delft, Den Haag Centraal, Delft, Schiedam Centrum, Rotterdam Centraal, Rotterdam Alexander, Rotterdam Centraal, Rotterdam Alexander, Gouda, Alphen a/d Rijn, Leiden Centraal]"
score,7498.571428571429
