train,stations
train_1,"[Leiden Centraal, Heemstede-Aerdenhout, Den Haag Centraal, Schiphol Airport, Alphen a/d Rijn]"
train_2,"[Zaandam, Hoorn, Beverwijk, Castricum, Amsterdam Sloterdijk]"
train_3,"[Zaandam, Castricum, Amsterdam Sloterdijk, Hoorn, Beverwijk]"
train_4,"[Den Haag Centraal, Gouda, Rotterdam Alexander, Alphen a/d Rijn]"
train_5,"[Amsterdam Centraal, Amsterdam Sloterdijk, Amsterdam Zuid, Zaandam, Haarlem]"
train_6,"[Beverwijk, Castricum, Zaandam, Haarlem]"
train_7,"[Zaandam, Hoorn, Alkmaar]"
score,1418.0
