train,stations
train_1,"[Alkmaar, Hoorn, Alkmaar, Den Helder]"
train_2,"[Zaandam, Beverwijk, Castricum, Zaandam, Beverwijk, Zaandam]"
train_3,"[Amsterdam Centraal, Amsterdam Amstel, Amsterdam Zuid, Schiphol Airport, Amsterdam Zuid, Amsterdam Sloterdijk, Haarlem, Beverwijk, Haarlem, Heemstede-Aerdenhout, Leiden Centraal]"
train_4,"[Rotterdam Centraal, Schiedam Centrum, Delft, Schiedam Centrum, Rotterdam Centraal, Rotterdam Alexander, Gouda, Alphen a/d Rijn, Leiden Centraal, Den Haag Centraal, Delft, Schiedam Centrum, Rotterdam Centraal]"
train_5,"[Alphen a/d Rijn, Leiden Centraal, Alphen a/d Rijn, Gouda, Rotterdam Alexander, Gouda, Den Haag Centraal, Delft, Den Haag Centraal]"
train_6,"[Alphen a/d Rijn, Leiden Centraal, Heemstede-Aerdenhout, Leiden Centraal, Schiphol Airport, Leiden Centraal, Heemstede-Aerdenhout, Haarlem, Beverwijk]"
train_7,"[Castricum, Beverwijk, Haarlem, Heemstede-Aerdenhout, Haarlem, Amsterdam Sloterdijk, Zaandam, Amsterdam Sloterdijk, Zaandam, Castricum, Alkmaar]"
score,7601.571428571429
