train,stations
train_1,"[Schiphol Airport, Amsterdam Zuid, Amsterdam Sloterdijk, Amsterdam Centraal, Amsterdam Amstel, Amsterdam Centraal, Amsterdam Sloterdijk, Haarlem, Beverwijk, Zaandam, Amsterdam Sloterdijk, Haarlem]"
train_2,"[Heemstede-Aerdenhout, Haarlem, Beverwijk, Castricum, Alkmaar, Castricum, Zaandam, Hoorn, Alkmaar]"
train_3,"[Castricum, Alkmaar, Den Helder, Alkmaar, Hoorn]"
train_4,"[Alphen a/d Rijn, Leiden Centraal, Schiphol Airport, Amsterdam Zuid, Schiphol Airport, Amsterdam Zuid, Amsterdam Amstel, Amsterdam Centraal, Amsterdam Amstel, Amsterdam Zuid, Schiphol Airport, Leiden Centraal, Heemstede-Aerdenhout]"
train_5,"[Den Haag Centraal, Delft, Den Haag Centraal, Delft, Den Haag Centraal, Delft, Den Haag Centraal, Leiden Centraal, Den Haag Centraal, Leiden Centraal]"
train_6,"[Alphen a/d Rijn, Gouda, Rotterdam Alexander, Gouda, Rotterdam Alexander, Rotterdam Centraal, Schiedam Centrum, Delft, Den Haag Centraal, Gouda, Den Haag Centraal]"
train_7,"[Gouda, Alphen a/d Rijn, Gouda, Alphen a/d Rijn, Gouda, Alphen a/d Rijn, Leiden Centraal]"
score,8145.857142857143
