train,stations
train_1,"[Castricum, Alkmaar, Castricum, Beverwijk, Haarlem, Beverwijk, Haarlem, Amsterdam Sloterdijk, Zaandam]"
train_2,"[Alkmaar, Castricum, Alkmaar, Den Helder, Alkmaar]"
train_3,"[Dordrecht, Rotterdam Centraal, Dordrecht, Rotterdam Centraal, Rotterdam Alexander, Gouda, Rotterdam Alexander, Gouda, Alphen a/d Rijn]"
train_4,"[Zaandam, Hoorn, Alkmaar, Castricum, Alkmaar, Castricum, Beverwijk, Castricum, Alkmaar]"
train_5,"[Beverwijk, Haarlem, Heemstede-Aerdenhout, Haarlem, Beverwijk, Castricum, Beverwijk, Castricum, Zaandam]"
train_6,"[Amsterdam Sloterdijk, Amsterdam Zuid, Schiphol Airport, Leiden Centraal, Schiphol Airport, Amsterdam Zuid, Schiphol Airport, Amsterdam Zuid, Amsterdam Sloterdijk, Haarlem, Heemstede-Aerdenhout, Haarlem]"
train_7,"[Amsterdam Amstel, Amsterdam Zuid, Amsterdam Sloterdijk, Amsterdam Zuid, Amsterdam Amstel, Amsterdam Zuid, Amsterdam Amstel, Amsterdam Centraal, Amsterdam Sloterdijk, Amsterdam Centraal, Amsterdam Amstel, Amsterdam Zuid, Schiphol Airport]"
score,5825.857142857143
