train,stations
train_1,"[Rotterdam Centraal, Schiedam Centrum, Delft, Schiedam Centrum, Delft, Schiedam Centrum, Delft, Schiedam Centrum, Rotterdam Centraal, Rotterdam Alexander, Rotterdam Centraal, Dordrecht, Rotterdam Centraal, Dordrecht]"
train_2,"[Schiedam Centrum, Delft, Schiedam Centrum, Delft, Den Haag Centraal, Leiden Centraal, Den Haag Centraal, Gouda, Rotterdam Alexander, Gouda, Rotterdam Alexander, Gouda]"
train_3,"[Castricum, Beverwijk, Castricum, Zaandam, Amsterdam Sloterdijk, Amsterdam Centraal, Amsterdam Sloterdijk, Zaandam, Hoorn, Alkmaar]"
train_4,"[Rotterdam Centraal, Rotterdam Alexander, Rotterdam Centraal, Rotterdam Alexander, Rotterdam Centraal, Rotterdam Alexander, Rotterdam Centraal, Schiedam Centrum, Rotterdam Centraal, Rotterdam Alexander, Gouda, Alphen a/d Rijn, Leiden Centraal]"
train_5,"[Beverwijk, Castricum, Zaandam, Amsterdam Sloterdijk, Amsterdam Centraal, Amsterdam Sloterdijk, Haarlem, Heemstede-Aerdenhout, Haarlem, Heemstede-Aerdenhout, Haarlem, Heemstede-Aerdenhout, Haarlem, Amsterdam Sloterdijk, Amsterdam Zuid]"
train_6,"[Den Haag Centraal, Delft, Schiedam Centrum, Rotterdam Centraal, Dordrecht, Rotterdam Centraal, Dordrecht, Rotterdam Centraal, Rotterdam Alexander, Gouda]"
train_7,"[Haarlem, Heemstede-Aerdenhout, Haarlem, Amsterdam Sloterdijk, Amsterdam Zuid, Amsterdam Sloterdijk, Zaandam, Castricum, Zaandam, Castricum, Alkmaar, Castricum]"
score,5643.857142857143
