train,stations
train_1,"[Delft, Den Haag Centraal, Delft, Den Haag Centraal, Gouda, Den Haag Centraal, Leiden Centraal, Heemstede-Aerdenhout, Leiden Centraal]"
train_2,"[Haarlem, Beverwijk, Castricum, Zaandam, Castricum, Alkmaar, Hoorn, Alkmaar]"
train_3,"[Amsterdam Centraal, Amsterdam Sloterdijk, Zaandam, Beverwijk, Haarlem, Beverwijk, Castricum, Zaandam]"
train_4,"[Amsterdam Sloterdijk, Zaandam, Castricum, Zaandam, Hoorn, Zaandam, Amsterdam Sloterdijk, Zaandam, Castricum, Beverwijk]"
train_5,"[Beverwijk, Haarlem, Beverwijk, Zaandam, Amsterdam Sloterdijk, Haarlem, Heemstede-Aerdenhout, Leiden Centraal, Schiphol Airport]"
train_6,"[Amsterdam Centraal, Amsterdam Sloterdijk, Zaandam, Amsterdam Sloterdijk, Amsterdam Centraal, Amsterdam Sloterdijk, Haarlem, Amsterdam Sloterdijk, Zaandam, Castricum, Alkmaar, Castricum, Beverwijk, Castricum]"
train_7,"[Alkmaar, Den Helder, Alkmaar, Hoorn]"
score,4807.428571428571
