train,stations
train_1,"[Beverwijk, Castricum, Zaandam, Castricum, Alkmaar, Castricum, Beverwijk, Castricum, Beverwijk, Castricum, Zaandam]"
train_2,"[Schiphol Airport, Leiden Centraal, Alphen a/d Rijn, Leiden Centraal, Schiphol Airport, Leiden Centraal, Heemstede-Aerdenhout, Leiden Centraal, Alphen a/d Rijn]"
train_3,"[Schiedam Centrum, Delft, Schiedam Centrum, Delft, Den Haag Centraal, Delft, Schiedam Centrum, Rotterdam Centraal, Dordrecht, Rotterdam Centraal, Dordrecht]"
train_4,"[Leiden Centraal, Den Haag Centraal, Delft, Den Haag Centraal, Delft, Den Haag Centraal, Gouda, Alphen a/d Rijn]"
train_5,"[Beverwijk, Zaandam, Castricum, Alkmaar, Castricum, Beverwijk, Haarlem, Heemstede-Aerdenhout, Leiden Centraal, Schiphol Airport]"
train_6,"[Alkmaar, Castricum, Beverwijk, Haarlem, Heemstede-Aerdenhout, Haarlem, Beverwijk, Zaandam, Beverwijk]"
train_7,"[Den Haag Centraal, Gouda, Den Haag Centraal, Delft, Den Haag Centraal, Gouda, Alphen a/d Rijn, Gouda]"
score,4320.285714285714
