train,stations
train_1,"[Amsterdam Zuid, Schiphol Airport, Amsterdam Zuid, Schiphol Airport, Leiden Centraal, Schiphol Airport, Leiden Centraal, Heemstede-Aerdenhout, Leiden Centraal, Alphen a/d Rijn]"
train_2,"[Zaandam, Amsterdam Sloterdijk, Haarlem, Amsterdam Sloterdijk, Amsterdam Centraal, Amsterdam Sloterdijk, Amsterdam Centraal, Amsterdam Sloterdijk, Zaandam, Amsterdam Sloterdijk, Amsterdam Centraal, Amsterdam Amstel, Amsterdam Centraal, Amsterdam Amstel, Amsterdam Zuid]"
train_3,"[Amsterdam Sloterdijk, Zaandam, Hoorn, Alkmaar, Den Helder]"
train_4,"[Beverwijk, Zaandam, Castricum, Zaandam, Castricum, Alkmaar, Castricum, Beverwijk, Zaandam]"
train_5,"[Beverwijk, Castricum, Beverwijk, Zaandam, Castricum, Zaandam, Amsterdam Sloterdijk, Amsterdam Centraal, Amsterdam Amstel, Amsterdam Centraal, Amsterdam Sloterdijk]"
train_6,"[Delft, Den Haag Centraal, Delft, Den Haag Centraal, Leiden Centraal, Schiphol Airport, Amsterdam Zuid, Amsterdam Sloterdijk, Zaandam]"
train_7,"[Amsterdam Centraal, Amsterdam Amstel, Amsterdam Centraal, Amsterdam Amstel, Amsterdam Zuid, Schiphol Airport, Amsterdam Zuid, Amsterdam Amstel, Amsterdam Centraal, Amsterdam Sloterdijk, Haarlem, Heemstede-Aerdenhout, Leiden Centraal, Schiphol Airport]"
score,6015.857142857143
