train,stations
train_1,"[Alphen a/d Rijn, Gouda, Rotterdam Alexander, Rotterdam Centraal, Dordrecht, Rotterdam Centraal, Dordrecht, Rotterdam Centraal, Rotterdam Alexander]"
train_2,"[Den Helder, Alkmaar, Hoorn, Alkmaar, Castricum, Zaandam, Amsterdam Sloterdijk, Zaandam]"
train_3,"[Beverwijk, Haarlem, Beverwijk, Zaandam, Hoorn, Zaandam]"
train_4,"[Castricum, Zaandam, Beverwijk, Haarlem, Beverwijk, Zaandam, Beverwijk]"
train_5,"[Hoorn, Zaandam, Hoorn, Zaandam, Amsterdam Sloterdijk, Zaandam, Castricum, Zaandam]"
train_6,"[Den Helder, Alkmaar, Hoorn, Alkmaar, Hoorn]"
train_7,"[Schiedam Centrum, Delft, Den Haag Centraal, Leiden Centraal, Den Haag Centraal, Gouda, Rotterdam Alexander, Gouda, Rotterdam Alexander, Rotterdam Centraal, Rotterdam Alexander, Rotterdam Centraal]"
score,4218.285714285714
