train,stations
train_1,"[Rotterdam Centraal, Schiedam Centrum, Delft, Den Haag Centraal, Delft, Schiedam Centrum, Rotterdam Centraal, Schiedam Centrum, Rotterdam Centraal, Dordrecht, Rotterdam Centraal, Dordrecht]"
train_2,"[Amsterdam Sloterdijk, Amsterdam Centraal, Amsterdam Sloterdijk, Amsterdam Zuid, Schiphol Airport, Amsterdam Zuid, Amsterdam Sloterdijk, Amsterdam Centraal, Amsterdam Sloterdijk, Zaandam, Hoorn]"
train_3,"[Alkmaar, Castricum, Beverwijk, Haarlem, Heemstede-Aerdenhout, Leiden Centraal, Schiphol Airport, Amsterdam Zuid, Amsterdam Sloterdijk, Haarlem, Heemstede-Aerdenhout]"
train_4,"[Hoorn, Zaandam, Castricum, Beverwijk, Zaandam, Castricum, Beverwijk]"
train_5,"[Castricum, Zaandam, Beverwijk, Castricum, Beverwijk, Castricum, Beverwijk, Castricum, Beverwijk]"
train_6,"[Amsterdam Zuid, Amsterdam Amstel, Amsterdam Zuid, Amsterdam Amstel, Amsterdam Centraal, Amsterdam Amstel, Amsterdam Zuid, Amsterdam Amstel, Amsterdam Centraal, Amsterdam Amstel, Amsterdam Centraal, Amsterdam Amstel, Amsterdam Zuid]"
train_7,"[Rotterdam Alexander, Gouda, Rotterdam Alexander, Rotterdam Centraal, Schiedam Centrum, Delft, Schiedam Centrum, Rotterdam Centraal, Rotterdam Alexander, Rotterdam Centraal, Schiedam Centrum, Delft, Den Haag Centraal, Gouda]"
score,6757.285714285714
