train,stations
train_1,"[Alphen a/d Rijn, Leiden Centraal, Den Haag Centraal, Delft, Schiedam Centrum, Delft, Den Haag Centraal, Delft, Schiedam Centrum, Rotterdam Centraal, Rotterdam Alexander, Gouda]"
train_2,"[Amsterdam Amstel, Amsterdam Zuid, Amsterdam Sloterdijk, Zaandam, Castricum, Alkmaar, Hoorn, Zaandam]"
train_3,"[Den Haag Centraal, Gouda, Den Haag Centraal, Gouda, Rotterdam Alexander, Rotterdam Centraal, Schiedam Centrum, Rotterdam Centraal, Schiedam Centrum, Rotterdam Centraal, Dordrecht]"
train_4,"[Heemstede-Aerdenhout, Haarlem, Amsterdam Sloterdijk, Amsterdam Zuid, Schiphol Airport, Leiden Centraal, Alphen a/d Rijn, Gouda, Alphen a/d Rijn]"
train_5,"[Beverwijk, Castricum, Beverwijk, Castricum, Zaandam, Beverwijk, Haarlem, Heemstede-Aerdenhout, Leiden Centraal]"
train_6,"[Amsterdam Centraal, Amsterdam Sloterdijk, Amsterdam Zuid, Schiphol Airport, Leiden Centraal, Alphen a/d Rijn, Gouda, Den Haag Centraal, Gouda]"
train_7,"[Den Haag Centraal, Leiden Centraal, Schiphol Airport, Amsterdam Zuid, Schiphol Airport, Leiden Centraal, Schiphol Airport, Leiden Centraal, Alphen a/d Rijn, Gouda]"
score,7818.714285714286
