train,stations
train_1,"[Castricum, Beverwijk, Zaandam, Hoorn, Alkmaar]"
train_2,"[Den Helder, Alkmaar, Hoorn, Alkmaar, Castricum, Beverwijk]"
train_3,"[Alkmaar, Den Helder, Alkmaar, Den Helder]"
train_4,"[Alphen a/d Rijn, Leiden Centraal, Schiphol Airport, Amsterdam Zuid, Amsterdam Amstel, Amsterdam Zuid, Schiphol Airport, Leiden Centraal, Den Haag Centraal, Delft, Schiedam Centrum, Rotterdam Centraal]"
train_5,"[Delft, Den Haag Centraal, Gouda, Rotterdam Alexander, Gouda, Den Haag Centraal, Leiden Centraal, Heemstede-Aerdenhout, Haarlem, Heemstede-Aerdenhout, Haarlem, Heemstede-Aerdenhout]"
train_6,"[Leiden Centraal, Heemstede-Aerdenhout, Haarlem, Amsterdam Sloterdijk, Amsterdam Zuid, Amsterdam Amstel, Amsterdam Zuid, Amsterdam Amstel, Amsterdam Zuid, Schiphol Airport, Leiden Centraal]"
train_7,"[Castricum, Alkmaar, Den Helder, Alkmaar, Castricum, Zaandam]"
score,6058.0
