train,stations
train_1,"[Beverwijk, Haarlem, Amsterdam Sloterdijk, Haarlem, Heemstede-Aerdenhout, Leiden Centraal, Heemstede-Aerdenhout, Leiden Centraal, Den Haag Centraal, Gouda]"
train_2,"[Beverwijk, Castricum, Beverwijk, Zaandam, Castricum, Beverwijk, Zaandam]"
train_3,"[Castricum, Zaandam, Hoorn, Zaandam, Castricum, Alkmaar, Castricum, Zaandam]"
train_4,"[Zaandam, Beverwijk, Zaandam, Castricum, Zaandam, Hoorn]"
train_5,"[Heemstede-Aerdenhout, Haarlem, Heemstede-Aerdenhout, Leiden Centraal, Heemstede-Aerdenhout, Leiden Centraal, Heemstede-Aerdenhout, Haarlem, Heemstede-Aerdenhout, Haarlem, Amsterdam Sloterdijk, Zaandam]"
train_6,"[Alphen a/d Rijn, Leiden Centraal, Heemstede-Aerdenhout, Haarlem, Heemstede-Aerdenhout, Haarlem, Beverwijk, Zaandam, Hoorn]"
train_7,"[Amsterdam Sloterdijk, Haarlem, Amsterdam Sloterdijk, Haarlem, Amsterdam Sloterdijk, Haarlem, Amsterdam Sloterdijk, Amsterdam Zuid, Amsterdam Sloterdijk, Zaandam]"
score,3565.0
