train,stations
train_1,"[Schiedam Centrum, Delft, Den Haag Centraal, Leiden Centraal, Den Haag Centraal, Leiden Centraal, Den Haag Centraal, Delft, Schiedam Centrum, Rotterdam Centraal, Schiedam Centrum, Rotterdam Centraal]"
train_2,"[Gouda, Rotterdam Alexander, Rotterdam Centraal, Dordrecht, Rotterdam Centraal, Dordrecht, Rotterdam Centraal, Schiedam Centrum, Rotterdam Centraal, Schiedam Centrum, Delft]"
train_3,"[Amsterdam Sloterdijk, Haarlem, Heemstede-Aerdenhout, Haarlem, Beverwijk, Castricum, Zaandam, Amsterdam Sloterdijk, Amsterdam Centraal, Amsterdam Sloterdijk, Haarlem, Beverwijk]"
train_4,"[Heemstede-Aerdenhout, Leiden Centraal, Schiphol Airport, Amsterdam Zuid, Amsterdam Amstel, Amsterdam Zuid, Schiphol Airport, Amsterdam Zuid, Amsterdam Sloterdijk, Zaandam, Castricum, Alkmaar]"
train_5,"[Castricum, Zaandam, Hoorn, Alkmaar, Hoorn, Zaandam]"
train_6,"[Rotterdam Alexander, Gouda, Den Haag Centraal, Gouda, Den Haag Centraal, Leiden Centraal, Alphen a/d Rijn, Leiden Centraal, Schiphol Airport]"
train_7,"[Beverwijk, Haarlem, Beverwijk, Haarlem, Amsterdam Sloterdijk, Zaandam, Beverwijk, Zaandam]"
score,7556.571428571429
