train,stations
train_1,"[Rotterdam Alexander, Rotterdam Centraal, Dordrecht, Rotterdam Centraal, Schiedam Centrum, Delft, Schiedam Centrum, Delft, Schiedam Centrum, Rotterdam Centraal, Rotterdam Alexander, Rotterdam Centraal, Schiedam Centrum, Delft, Schiedam Centrum]"
train_2,"[Beverwijk, Haarlem, Beverwijk, Castricum, Zaandam, Amsterdam Sloterdijk, Amsterdam Zuid, Amsterdam Sloterdijk, Amsterdam Zuid, Schiphol Airport]"
train_3,"[Haarlem, Beverwijk, Zaandam, Castricum, Beverwijk, Castricum, Beverwijk, Zaandam]"
train_4,"[Castricum, Zaandam, Castricum, Zaandam, Hoorn, Zaandam, Amsterdam Sloterdijk, Amsterdam Zuid, Schiphol Airport]"
train_5,"[Rotterdam Centraal, Dordrecht, Rotterdam Centraal, Schiedam Centrum, Rotterdam Centraal, Schiedam Centrum, Rotterdam Centraal, Rotterdam Alexander, Rotterdam Centraal, Schiedam Centrum, Delft, Den Haag Centraal, Gouda]"
train_6,"[Hoorn, Alkmaar, Castricum, Beverwijk, Zaandam, Beverwijk, Haarlem, Heemstede-Aerdenhout]"
train_7,"[Castricum, Alkmaar, Hoorn, Alkmaar, Hoorn, Zaandam, Castricum]"
score,4556.428571428571
