train,stations
train_1,"[Castricum, Zaandam, Beverwijk, Haarlem, Heemstede-Aerdenhout, Haarlem, Heemstede-Aerdenhout, Haarlem, Heemstede-Aerdenhout, Haarlem, Amsterdam Sloterdijk, Haarlem]"
train_2,"[Amsterdam Centraal, Amsterdam Sloterdijk, Haarlem, Beverwijk, Haarlem, Amsterdam Sloterdijk, Amsterdam Zuid, Schiphol Airport, Amsterdam Zuid, Amsterdam Sloterdijk, Haarlem]"
train_3,"[Dordrecht, Rotterdam Centraal, Dordrecht, Rotterdam Centraal, Dordrecht, Rotterdam Centraal, Dordrecht, Rotterdam Centraal]"
train_4,"[Alkmaar, Hoorn, Alkmaar, Hoorn, Zaandam, Castricum]"
train_5,"[Haarlem, Amsterdam Sloterdijk, Haarlem, Beverwijk, Castricum, Alkmaar, Hoorn, Alkmaar]"
train_6,"[Amsterdam Centraal, Amsterdam Sloterdijk, Amsterdam Centraal, Amsterdam Amstel, Amsterdam Centraal, Amsterdam Amstel, Amsterdam Zuid, Amsterdam Sloterdijk, Amsterdam Centraal, Amsterdam Amstel, Amsterdam Centraal, Amsterdam Amstel, Amsterdam Zuid, Amsterdam Sloterdijk]"
train_7,"[Den Haag Centraal, Gouda, Alphen a/d Rijn, Gouda, Rotterdam Alexander, Gouda, Alphen a/d Rijn, Gouda]"
score,4933.571428571429
