train,stations
train_1,"[Leiden Centraal, Den Haag Centraal, Gouda, Rotterdam Alexander, Rotterdam Centraal, Rotterdam Alexander, Gouda, Den Haag Centraal, Delft, Schiedam Centrum, Rotterdam Centraal, Rotterdam Alexander]"
train_2,"[Zaandam, Castricum, Beverwijk, Castricum, Zaandam, Castricum, Beverwijk, Castricum, Zaandam]"
train_3,"[Hoorn, Zaandam, Castricum, Alkmaar, Den Helder, Alkmaar]"
train_4,"[Alphen a/d Rijn, Leiden Centraal, Alphen a/d Rijn, Gouda, Rotterdam Alexander, Rotterdam Centraal, Rotterdam Alexander, Rotterdam Centraal, Dordrecht, Rotterdam Centraal]"
train_5,"[Beverwijk, Zaandam, Beverwijk, Castricum, Alkmaar, Hoorn]"
train_6,"[Schiphol Airport, Amsterdam Zuid, Schiphol Airport, Leiden Centraal, Schiphol Airport, Amsterdam Zuid, Amsterdam Sloterdijk, Amsterdam Centraal, Amsterdam Sloterdijk, Zaandam, Beverwijk]"
train_7,"[Amsterdam Sloterdijk, Zaandam, Hoorn, Zaandam, Castricum, Alkmaar, Hoorn]"
score,6515.142857142857
