train,stations
train_1,"[Schiedam Centrum, Rotterdam Centraal, Schiedam Centrum, Rotterdam Centraal, Rotterdam Alexander, Gouda, Den Haag Centraal, Leiden Centraal, Schiphol Airport, Amsterdam Zuid, Schiphol Airport, Leiden Centraal]"
train_2,"[Alphen a/d Rijn, Leiden Centraal, Alphen a/d Rijn, Gouda, Rotterdam Alexander, Gouda, Den Haag Centraal, Leiden Centraal, Schiphol Airport]"
train_3,"[Zaandam, Amsterdam Sloterdijk, Zaandam, Amsterdam Sloterdijk, Amsterdam Zuid, Schiphol Airport, Amsterdam Zuid, Amsterdam Amstel, Amsterdam Centraal, Amsterdam Sloterdijk, Amsterdam Centraal, Amsterdam Sloterdijk, Amsterdam Zuid, Amsterdam Amstel, Amsterdam Zuid]"
train_4,"[Den Helder, Alkmaar, Castricum, Beverwijk, Haarlem, Beverwijk, Haarlem, Heemstede-Aerdenhout, Haarlem]"
train_5,"[Amsterdam Sloterdijk, Haarlem, Amsterdam Sloterdijk, Zaandam, Castricum, Beverwijk, Castricum, Zaandam, Castricum, Alkmaar]"
train_6,"[Beverwijk, Castricum, Alkmaar, Den Helder, Alkmaar, Castricum, Zaandam]"
train_7,"[Dordrecht, Rotterdam Centraal, Rotterdam Alexander, Rotterdam Centraal, Schiedam Centrum, Delft, Schiedam Centrum, Delft, Schiedam Centrum, Delft, Schiedam Centrum, Delft, Den Haag Centraal, Gouda]"
score,7191.428571428571
