train,stations
train_1,"[Heemstede-Aerdenhout, Haarlem, Beverwijk, Zaandam, Castricum, Beverwijk, Zaandam]"
train_2,"[Amsterdam Zuid, Amsterdam Amstel, Amsterdam Centraal, Amsterdam Sloterdijk, Haarlem, Amsterdam Sloterdijk, Amsterdam Centraal, Amsterdam Amstel, Amsterdam Centraal, Amsterdam Amstel, Amsterdam Zuid, Amsterdam Amstel, Amsterdam Zuid]"
train_3,"[Hoorn, Alkmaar, Castricum, Beverwijk, Haarlem, Beverwijk, Castricum, Beverwijk]"
train_4,"[Alphen a/d Rijn, Leiden Centraal, Heemstede-Aerdenhout, Haarlem, Amsterdam Sloterdijk, Amsterdam Centraal, Amsterdam Amstel, Amsterdam Centraal, Amsterdam Amstel, Amsterdam Zuid, Amsterdam Sloterdijk, Amsterdam Zuid]"
train_5,"[Schiphol Airport, Leiden Centraal, Den Haag Centraal, Leiden Centraal, Alphen a/d Rijn, Gouda, Alphen a/d Rijn, Leiden Centraal]"
train_6,"[Den Haag Centraal, Leiden Centraal, Den Haag Centraal, Delft, Den Haag Centraal, Leiden Centraal, Den Haag Centraal, Gouda, Rotterdam Alexander, Gouda]"
train_7,"[Hoorn, Alkmaar, Hoorn, Zaandam, Beverwijk, Castricum]"
score,6257.0
