train,stations
train_1,"[Hoorn, Zaandam, Amsterdam Sloterdijk, Amsterdam Zuid, Amsterdam Amstel, Amsterdam Centraal, Amsterdam Sloterdijk, Zaandam, Amsterdam Sloterdijk, Haarlem, Beverwijk]"
train_2,"[Zaandam, Hoorn, Alkmaar, Hoorn, Alkmaar]"
train_3,"[Gouda, Rotterdam Alexander, Rotterdam Centraal, Rotterdam Alexander, Gouda, Den Haag Centraal, Gouda, Den Haag Centraal, Leiden Centraal, Alphen a/d Rijn]"
train_4,"[Alphen a/d Rijn, Gouda, Den Haag Centraal, Delft, Schiedam Centrum, Rotterdam Centraal, Schiedam Centrum, Delft, Schiedam Centrum, Rotterdam Centraal, Schiedam Centrum, Delft, Den Haag Centraal]"
train_5,"[Alkmaar, Hoorn, Zaandam, Castricum, Zaandam, Hoorn]"
train_6,"[Beverwijk, Castricum, Beverwijk, Zaandam, Hoorn, Zaandam]"
train_7,"[Rotterdam Alexander, Gouda, Alphen a/d Rijn, Gouda, Alphen a/d Rijn, Gouda, Alphen a/d Rijn]"
score,6056.0
