train,stations
train_1,"[Alkmaar, Den Helder, Alkmaar, Hoorn]"
train_2,"[Leiden Centraal, Den Haag Centraal, Gouda, Den Haag Centraal, Delft, Schiedam Centrum, Rotterdam Centraal, Rotterdam Alexander, Rotterdam Centraal, Rotterdam Alexander, Rotterdam Centraal, Schiedam Centrum, Rotterdam Centraal]"
train_3,"[Amsterdam Sloterdijk, Zaandam, Amsterdam Sloterdijk, Amsterdam Centraal, Amsterdam Sloterdijk, Zaandam, Castricum, Alkmaar, Hoorn, Alkmaar, Castricum]"
train_4,"[Leiden Centraal, Heemstede-Aerdenhout, Leiden Centraal, Alphen a/d Rijn, Leiden Centraal, Schiphol Airport, Amsterdam Zuid, Amsterdam Sloterdijk, Haarlem, Beverwijk]"
train_5,"[Amsterdam Centraal, Amsterdam Amstel, Amsterdam Zuid, Amsterdam Amstel, Amsterdam Zuid, Amsterdam Sloterdijk, Amsterdam Zuid, Schiphol Airport, Leiden Centraal, Heemstede-Aerdenhout, Haarlem]"
train_6,"[Rotterdam Alexander, Rotterdam Centraal, Dordrecht, Rotterdam Centraal, Rotterdam Alexander, Rotterdam Centraal, Dordrecht, Rotterdam Centraal, Schiedam Centrum, Delft, Den Haag Centraal]"
train_7,"[Den Haag Centraal, Delft, Den Haag Centraal, Gouda, Den Haag Centraal, Leiden Centraal, Schiphol Airport, Leiden Centraal, Schiphol Airport]"
score,6827.285714285714
