train,stations
train_1,"[Beverwijk, Haarlem, Heemstede-Aerdenhout, Haarlem, Amsterdam Sloterdijk, Amsterdam Centraal, Amsterdam Amstel, Amsterdam Zuid, Amsterdam Amstel, Amsterdam Centraal, Amsterdam Sloterdijk, Amsterdam Zuid, Amsterdam Sloterdijk]"
train_2,"[Heemstede-Aerdenhout, Leiden Centraal, Den Haag Centraal, Leiden Centraal, Heemstede-Aerdenhout, Haarlem, Beverwijk, Haarlem, Heemstede-Aerdenhout, Haarlem, Amsterdam Sloterdijk]"
train_3,"[Dordrecht, Rotterdam Centraal, Dordrecht, Rotterdam Centraal, Rotterdam Alexander, Rotterdam Centraal, Rotterdam Alexander, Rotterdam Centraal, Dordrecht, Rotterdam Centraal]"
train_4,"[Den Helder, Alkmaar, Den Helder, Alkmaar, Castricum]"
train_5,"[Schiphol Airport, Leiden Centraal, Heemstede-Aerdenhout, Leiden Centraal, Den Haag Centraal, Delft, Schiedam Centrum, Delft, Schiedam Centrum, Delft, Den Haag Centraal]"
train_6,"[Leiden Centraal, Den Haag Centraal, Leiden Centraal, Heemstede-Aerdenhout, Haarlem, Heemstede-Aerdenhout, Leiden Centraal, Den Haag Centraal, Delft, Schiedam Centrum, Delft, Den Haag Centraal]"
train_7,"[Leiden Centraal, Heemstede-Aerdenhout, Leiden Centraal, Heemstede-Aerdenhout, Haarlem, Heemstede-Aerdenhout, Haarlem, Beverwijk, Haarlem, Heemstede-Aerdenhout, Haarlem, Amsterdam Sloterdijk, Amsterdam Centraal]"
score,4318.285714285714
