train,stations
train_1,"[Heemstede-Aerdenhout, Haarlem, Beverwijk, Castricum, Beverwijk, Castricum, Zaandam, Castricum, Alkmaar, Hoorn]"
train_2,"[Schiedam Centrum, Rotterdam Centraal, Dordrecht, Rotterdam Centraal, Rotterdam Alexander, Gouda, Rotterdam Alexander, Gouda, Den Haag Centraal, Leiden Centraal]"
train_3,"[Den Helder, Alkmaar, Hoorn, Zaandam, Castricum, Beverwijk]"
train_4,"[Delft, Schiedam Centrum, Delft, Den Haag Centraal, Leiden Centraal, Heemstede-Aerdenhout, Leiden Centraal, Heemstede-Aerdenhout, Leiden Centraal, Schiphol Airport, Amsterdam Zuid]"
train_5,"[Delft, Den Haag Centraal, Leiden Centraal, Alphen a/d Rijn, Gouda, Alphen a/d Rijn, Gouda, Rotterdam Alexander, Gouda]"
train_6,"[Schiphol Airport, Leiden Centraal, Den Haag Centraal, Gouda, Rotterdam Alexander, Rotterdam Centraal, Rotterdam Alexander, Rotterdam Centraal, Rotterdam Alexander, Rotterdam Centraal, Rotterdam Alexander, Rotterdam Centraal, Schiedam Centrum]"
train_7,"[Rotterdam Centraal, Rotterdam Alexander, Rotterdam Centraal, Dordrecht, Rotterdam Centraal, Schiedam Centrum, Rotterdam Centraal, Rotterdam Alexander, Rotterdam Centraal, Rotterdam Alexander, Gouda, Alphen a/d Rijn]"
score,6007.0
