train,stations
train_1,"[Schiphol Airport, Amsterdam Zuid, Amsterdam Sloterdijk, Haarlem, Heemstede-Aerdenhout, Haarlem, Heemstede-Aerdenhout, Leiden Centraal, Schiphol Airport, Leiden Centraal, Heemstede-Aerdenhout]"
train_2,"[Schiphol Airport, Leiden Centraal, Alphen a/d Rijn, Leiden Centraal, Heemstede-Aerdenhout, Leiden Centraal, Den Haag Centraal, Gouda, Den Haag Centraal]"
train_3,"[Den Helder, Alkmaar, Hoorn, Alkmaar, Hoorn]"
train_4,"[Amsterdam Sloterdijk, Haarlem, Amsterdam Sloterdijk, Amsterdam Centraal, Amsterdam Amstel, Amsterdam Centraal, Amsterdam Amstel, Amsterdam Centraal, Amsterdam Sloterdijk, Zaandam, Castricum, Zaandam, Castricum]"
train_5,"[Castricum, Alkmaar, Den Helder, Alkmaar, Castricum, Alkmaar, Castricum]"
train_6,"[Haarlem, Beverwijk, Zaandam, Beverwijk, Castricum, Beverwijk, Castricum, Beverwijk]"
train_7,"[Hoorn, Zaandam, Castricum, Beverwijk, Haarlem, Heemstede-Aerdenhout, Haarlem, Beverwijk]"
score,5991.857142857143
