train,stations
train_1,"[Den Haag Centraal, Gouda, Rotterdam Alexander, Rotterdam Centraal, Schiedam Centrum, Rotterdam Centraal, Dordrecht, Rotterdam Centraal, Rotterdam Alexander, Gouda, Rotterdam Alexander, Rotterdam Centraal]"
train_2,"[Alphen a/d Rijn, Gouda, Den Haag Centraal, Leiden Centraal, Alphen a/d Rijn, Gouda, Rotterdam Alexander, Rotterdam Centraal, Schiedam Centrum, Delft]"
train_3,"[Hoorn, Alkmaar, Castricum, Alkmaar, Hoorn, Alkmaar, Hoorn]"
train_4,"[Den Helder, Alkmaar, Den Helder, Alkmaar]"
train_5,"[Castricum, Zaandam, Castricum, Alkmaar, Hoorn, Zaandam, Hoorn]"
train_6,"[Schiedam Centrum, Delft, Schiedam Centrum, Rotterdam Centraal, Rotterdam Alexander, Rotterdam Centraal, Rotterdam Alexander, Rotterdam Centraal, Rotterdam Alexander, Rotterdam Centraal, Dordrecht, Rotterdam Centraal, Dordrecht]"
train_7,"[Rotterdam Centraal, Schiedam Centrum, Rotterdam Centraal, Rotterdam Alexander, Gouda, Alphen a/d Rijn, Gouda, Den Haag Centraal, Gouda, Rotterdam Alexander]"
score,3623.0
