train,stations
train_1,"[Gouda, Alphen a/d Rijn, Gouda, Den Haag Centraal, Gouda, Den Haag Centraal, Delft, Den Haag Centraal]"
train_2,"[Amsterdam Sloterdijk, Zaandam, Beverwijk, Zaandam, Amsterdam Sloterdijk, Zaandam, Hoorn]"
train_3,"[Castricum, Alkmaar, Hoorn, Zaandam, Beverwijk, Haarlem, Amsterdam Sloterdijk]"
train_4,"[Alkmaar, Den Helder, Alkmaar, Castricum, Alkmaar, Hoorn]"
train_5,"[Beverwijk, Zaandam, Beverwijk, Haarlem, Amsterdam Sloterdijk, Haarlem, Amsterdam Sloterdijk, Haarlem]"
train_6,"[Alkmaar, Hoorn, Zaandam, Hoorn, Zaandam]"
train_7,"[Schiphol Airport, Amsterdam Zuid, Amsterdam Sloterdijk, Zaandam, Hoorn, Zaandam, Hoorn]"
score,3281.857142857143
