train,stations
train_1,"[Delft, Schiedam Centrum, Rotterdam Centraal, Rotterdam Alexander, Rotterdam Centraal, Schiedam Centrum, Delft, Den Haag Centraal, Delft, Schiedam Centrum, Rotterdam Centraal, Dordrecht, Rotterdam Centraal]"
train_2,"[Castricum, Beverwijk, Haarlem, Beverwijk, Zaandam, Amsterdam Sloterdijk, Haarlem, Beverwijk, Haarlem]"
train_3,"[Amsterdam Centraal, Amsterdam Amstel, Amsterdam Centraal, Amsterdam Sloterdijk, Zaandam, Hoorn, Zaandam, Amsterdam Sloterdijk, Haarlem, Beverwijk]"
train_4,"[Delft, Den Haag Centraal, Delft, Den Haag Centraal, Leiden Centraal, Heemstede-Aerdenhout, Haarlem, Beverwijk, Castricum, Zaandam]"
train_5,"[Den Helder, Alkmaar, Den Helder, Alkmaar, Castricum]"
train_6,"[Amsterdam Amstel, Amsterdam Zuid, Schiphol Airport, Leiden Centraal, Alphen a/d Rijn, Gouda, Rotterdam Alexander, Rotterdam Centraal, Schiedam Centrum, Rotterdam Centraal, Dordrecht]"
train_7,"[Hoorn, Alkmaar, Den Helder, Alkmaar]"
score,7920.714285714286
