train,stations
train_1,"[Amsterdam Sloterdijk, Zaandam, Beverwijk, Castricum, Zaandam, Beverwijk, Zaandam, Castricum]"
train_2,"[Dordrecht, Rotterdam Centraal, Dordrecht, Rotterdam Centraal, Schiedam Centrum, Delft, Schiedam Centrum, Rotterdam Centraal, Rotterdam Alexander, Gouda, Alphen a/d Rijn]"
train_3,"[Haarlem, Heemstede-Aerdenhout, Haarlem, Amsterdam Sloterdijk, Zaandam, Hoorn, Zaandam, Hoorn]"
train_4,"[Den Haag Centraal, Delft, Den Haag Centraal, Gouda, Rotterdam Alexander, Rotterdam Centraal, Schiedam Centrum, Rotterdam Centraal, Schiedam Centrum, Delft, Schiedam Centrum, Rotterdam Centraal, Schiedam Centrum, Rotterdam Centraal, Rotterdam Alexander]"
train_5,"[Den Helder, Alkmaar, Castricum, Alkmaar, Hoorn, Alkmaar, Castricum]"
train_6,"[Schiedam Centrum, Delft, Den Haag Centraal, Delft, Den Haag Centraal, Leiden Centraal, Alphen a/d Rijn, Leiden Centraal, Den Haag Centraal, Delft]"
train_7,"[Amsterdam Amstel, Amsterdam Zuid, Schiphol Airport, Leiden Centraal, Alphen a/d Rijn, Leiden Centraal, Schiphol Airport, Leiden Centraal, Schiphol Airport, Leiden Centraal]"
score,6722.285714285714
