train,stations
train_1,"[Alkmaar, Castricum, Beverwijk, Haarlem, Beverwijk, Castricum, Beverwijk, Castricum, Alkmaar]"
train_2,"[Schiedam Centrum, Delft, Den Haag Centraal, Delft, Schiedam Centrum, Rotterdam Centraal, Rotterdam Alexander, Gouda, Alphen a/d Rijn, Leiden Centraal, Den Haag Centraal]"
train_3,"[Dordrecht, Rotterdam Centraal, Dordrecht, Rotterdam Centraal, Rotterdam Alexander, Rotterdam Centraal, Rotterdam Alexander, Rotterdam Centraal, Rotterdam Alexander, Gouda]"
train_4,"[Hoorn, Alkmaar, Den Helder, Alkmaar]"
train_5,"[Schiphol Airport, Leiden Centraal, Schiphol Airport, Amsterdam Zuid, Amsterdam Sloterdijk, Amsterdam Centraal, Amsterdam Sloterdijk, Amsterdam Zuid, Amsterdam Sloterdijk, Amsterdam Centraal, Amsterdam Sloterdijk]"
train_6,"[Castricum, Zaandam, Hoorn, Alkmaar, Hoorn, Zaandam, Amsterdam Sloterdijk]"
train_7,"[Delft, Schiedam Centrum, Delft, Schiedam Centrum, Delft, Den Haag Centraal, Gouda, Alphen a/d Rijn, Leiden Centraal, Alphen a/d Rijn]"
score,6733.142857142857
