train,stations
train_1,"[Zaandam, Castricum, Zaandam, Beverwijk, Castricum, Beverwijk, Haarlem, Beverwijk]"
train_2,"[Leiden Centraal, Alphen a/d Rijn, Leiden Centraal, Heemstede-Aerdenhout, Leiden Centraal, Den Haag Centraal, Gouda, Rotterdam Alexander, Gouda]"
train_3,"[Haarlem, Heemstede-Aerdenhout, Haarlem, Heemstede-Aerdenhout, Leiden Centraal, Schiphol Airport, Leiden Centraal, Heemstede-Aerdenhout, Haarlem, Amsterdam Sloterdijk, Haarlem, Amsterdam Sloterdijk]"
train_4,"[Beverwijk, Zaandam, Castricum, Zaandam, Amsterdam Sloterdijk, Haarlem, Beverwijk, Zaandam]"
train_5,"[Haarlem, Amsterdam Sloterdijk, Amsterdam Centraal, Amsterdam Amstel, Amsterdam Centraal, Amsterdam Sloterdijk, Amsterdam Zuid, Amsterdam Sloterdijk, Haarlem, Beverwijk, Castricum]"
train_6,"[Alkmaar, Hoorn, Alkmaar, Castricum, Zaandam, Castricum, Alkmaar]"
train_7,"[Dordrecht, Rotterdam Centraal, Rotterdam Alexander, Gouda, Rotterdam Alexander, Rotterdam Centraal, Rotterdam Alexander, Gouda, Den Haag Centraal, Leiden Centraal, Den Haag Centraal]"
score,5804.857142857143
