train,stations
train_1,"[Dordrecht, Rotterdam Centraal, Schiedam Centrum, Delft, Schiedam Centrum, Delft, Schiedam Centrum, Rotterdam Centraal, Schiedam Centrum, Delft, Schiedam Centrum, Delft, Den Haag Centraal, Delft]"
train_2,"[Amsterdam Amstel, Amsterdam Zuid, Amsterdam Amstel, Amsterdam Zuid, Amsterdam Sloterdijk, Zaandam, Hoorn, Alkmaar]"
train_3,"[Amsterdam Centraal, Amsterdam Sloterdijk, Zaandam, Hoorn, Alkmaar, Castricum, Zaandam, Beverwijk]"
train_4,"[Zaandam, Hoorn, Alkmaar, Castricum, Alkmaar, Castricum, Alkmaar]"
train_5,"[Gouda, Den Haag Centraal, Leiden Centraal, Alphen a/d Rijn, Leiden Centraal, Alphen a/d Rijn, Leiden Centraal, Schiphol Airport, Leiden Centraal]"
train_6,"[Rotterdam Alexander, Gouda, Alphen a/d Rijn, Leiden Centraal, Schiphol Airport, Amsterdam Zuid, Amsterdam Sloterdijk, Zaandam, Castricum, Beverwijk]"
train_7,"[Amsterdam Zuid, Amsterdam Sloterdijk, Zaandam, Beverwijk, Castricum, Zaandam, Beverwijk, Haarlem]"
score,6521.142857142857
