train,stations
train_1,"[Amsterdam Centraal, Amsterdam Amstel, Amsterdam Zuid, Amsterdam Amstel, Amsterdam Zuid, Schiphol Airport, Leiden Centraal, Heemstede-Aerdenhout, Leiden Centraal, Den Haag Centraal, Gouda]"
train_2,"[Zaandam, Amsterdam Sloterdijk, Amsterdam Centraal, Amsterdam Amstel, Amsterdam Zuid, Amsterdam Amstel, Amsterdam Zuid, Amsterdam Sloterdijk, Zaandam, Castricum, Alkmaar]"
train_3,"[Castricum, Zaandam, Beverwijk, Castricum, Zaandam, Amsterdam Sloterdijk, Zaandam, Hoorn]"
train_4,"[Schiphol Airport, Amsterdam Zuid, Amsterdam Sloterdijk, Zaandam, Hoorn, Zaandam, Castricum, Zaandam]"
train_5,"[Delft, Den Haag Centraal, Gouda, Rotterdam Alexander, Rotterdam Centraal, Dordrecht, Rotterdam Centraal, Dordrecht, Rotterdam Centraal]"
train_6,"[Amsterdam Amstel, Amsterdam Centraal, Amsterdam Sloterdijk, Amsterdam Centraal, Amsterdam Sloterdijk, Zaandam, Castricum, Zaandam, Hoorn, Zaandam]"
train_7,"[Hoorn, Zaandam, Amsterdam Sloterdijk, Haarlem, Amsterdam Sloterdijk, Amsterdam Zuid, Schiphol Airport, Amsterdam Zuid, Schiphol Airport, Amsterdam Zuid, Amsterdam Amstel, Amsterdam Centraal]"
score,5913.857142857143
