train,stations
train_1,"[Amsterdam Amstel, Amsterdam Centraal, Amsterdam Sloterdijk, Haarlem, Amsterdam Sloterdijk, Haarlem, Heemstede-Aerdenhout, Leiden Centraal, Heemstede-Aerdenhout, Leiden Centraal, Alphen a/d Rijn]"
train_2,"[Amsterdam Zuid, Amsterdam Amstel, Amsterdam Zuid, Schiphol Airport, Leiden Centraal, Den Haag Centraal, Gouda, Alphen a/d Rijn, Leiden Centraal, Heemstede-Aerdenhout]"
train_3,"[Heemstede-Aerdenhout, Haarlem, Heemstede-Aerdenhout, Leiden Centraal, Alphen a/d Rijn, Leiden Centraal, Schiphol Airport, Amsterdam Zuid, Schiphol Airport, Amsterdam Zuid, Schiphol Airport, Leiden Centraal, Den Haag Centraal]"
train_4,"[Amsterdam Sloterdijk, Amsterdam Zuid, Schiphol Airport, Leiden Centraal, Alphen a/d Rijn, Gouda, Den Haag Centraal, Leiden Centraal, Heemstede-Aerdenhout, Haarlem]"
train_5,"[Amsterdam Centraal, Amsterdam Sloterdijk, Zaandam, Amsterdam Sloterdijk, Amsterdam Zuid, Amsterdam Amstel, Amsterdam Centraal, Amsterdam Sloterdijk, Haarlem, Amsterdam Sloterdijk, Amsterdam Zuid, Schiphol Airport, Leiden Centraal]"
train_6,"[Amsterdam Zuid, Amsterdam Sloterdijk, Amsterdam Centraal, Amsterdam Amstel, Amsterdam Centraal, Amsterdam Sloterdijk, Amsterdam Zuid, Amsterdam Sloterdijk, Zaandam, Amsterdam Sloterdijk, Amsterdam Zuid, Amsterdam Amstel]"
train_7,"[Den Haag Centraal, Delft, Den Haag Centraal, Delft, Den Haag Centraal, Leiden Centraal, Heemstede-Aerdenhout, Haarlem, Amsterdam Sloterdijk, Amsterdam Zuid]"
score,4071.142857142857
