train,stations
train_1,"[Hoorn, Alkmaar, Hoorn, Alkmaar, Hoorn]"
train_2,"[Amsterdam Centraal, Amsterdam Sloterdijk, Amsterdam Centraal, Amsterdam Sloterdijk, Amsterdam Centraal, Amsterdam Sloterdijk, Amsterdam Zuid, Amsterdam Amstel, Amsterdam Zuid, Amsterdam Sloterdijk, Amsterdam Zuid, Schiphol Airport, Amsterdam Zuid]"
train_3,"[Delft, Schiedam Centrum, Delft, Schiedam Centrum, Delft, Schiedam Centrum, Delft, Den Haag Centraal, Delft, Schiedam Centrum, Rotterdam Centraal, Rotterdam Alexander, Rotterdam Centraal, Dordrecht]"
train_4,"[Beverwijk, Castricum, Alkmaar, Den Helder, Alkmaar, Hoorn]"
train_5,"[Rotterdam Centraal, Rotterdam Alexander, Gouda, Rotterdam Alexander, Gouda, Alphen a/d Rijn, Leiden Centraal, Alphen a/d Rijn, Gouda, Rotterdam Alexander]"
train_6,"[Leiden Centraal, Alphen a/d Rijn, Leiden Centraal, Den Haag Centraal, Delft, Schiedam Centrum, Rotterdam Centraal, Rotterdam Alexander, Rotterdam Centraal, Schiedam Centrum, Delft, Schiedam Centrum, Delft]"
train_7,"[Den Haag Centraal, Delft, Schiedam Centrum, Delft, Den Haag Centraal, Gouda, Den Haag Centraal, Gouda, Alphen a/d Rijn]"
score,5270.571428571429
