train,stations
train_1,"[Amsterdam Zuid, Amsterdam Amstel, Amsterdam Zuid, Schiphol Airport, Leiden Centraal, Alphen a/d Rijn, Gouda, Den Haag Centraal, Gouda]"
train_2,"[Alkmaar, Hoorn, Alkmaar, Den Helder]"
train_3,"[Den Haag Centraal, Gouda, Alphen a/d Rijn, Gouda, Den Haag Centraal, Delft, Den Haag Centraal, Leiden Centraal]"
train_4,"[Rotterdam Centraal, Rotterdam Alexander, Rotterdam Centraal, Rotterdam Alexander, Gouda, Den Haag Centraal, Leiden Centraal, Schiphol Airport, Leiden Centraal, Heemstede-Aerdenhout]"
train_5,"[Heemstede-Aerdenhout, Leiden Centraal, Heemstede-Aerdenhout, Haarlem, Heemstede-Aerdenhout, Haarlem, Amsterdam Sloterdijk, Zaandam, Castricum, Alkmaar, Castricum, Beverwijk]"
train_6,"[Leiden Centraal, Schiphol Airport, Leiden Centraal, Den Haag Centraal, Delft, Den Haag Centraal, Leiden Centraal, Den Haag Centraal, Gouda]"
train_7,"[Amsterdam Zuid, Amsterdam Amstel, Amsterdam Zuid, Amsterdam Sloterdijk, Zaandam, Hoorn, Zaandam, Amsterdam Sloterdijk, Haarlem]"
score,6363.0
