train,stations
train_1,"[Zaandam, Castricum, Beverwijk, Zaandam, Castricum, Beverwijk, Castricum, Zaandam]"
train_2,"[Dordrecht, Rotterdam Centraal, Dordrecht, Rotterdam Centraal, Schiedam Centrum, Delft, Den Haag Centraal, Delft, Den Haag Centraal, Leiden Centraal]"
train_3,"[Dordrecht, Rotterdam Centraal, Schiedam Centrum, Delft, Schiedam Centrum, Delft, Den Haag Centraal, Delft, Den Haag Centraal, Leiden Centraal, Heemstede-Aerdenhout]"
train_4,"[Zaandam, Castricum, Zaandam, Beverwijk, Haarlem, Heemstede-Aerdenhout, Haarlem, Heemstede-Aerdenhout, Leiden Centraal, Den Haag Centraal]"
train_5,"[Hoorn, Alkmaar, Castricum, Beverwijk, Haarlem, Beverwijk, Castricum, Alkmaar]"
train_6,"[Den Haag Centraal, Gouda, Alphen a/d Rijn, Leiden Centraal, Alphen a/d Rijn, Gouda, Den Haag Centraal, Delft]"
train_7,"[Alkmaar, Hoorn, Alkmaar, Castricum, Alkmaar, Den Helder]"
score,4732.428571428571
