train,stations
train_1,"[Delft, Schiedam Centrum, Delft, Den Haag Centraal, Delft, Den Haag Centraal, Leiden Centraal, Den Haag Centraal, Leiden Centraal, Schiphol Airport, Amsterdam Zuid]"
train_2,"[Amsterdam Sloterdijk, Amsterdam Centraal, Amsterdam Sloterdijk, Haarlem, Heemstede-Aerdenhout, Leiden Centraal, Heemstede-Aerdenhout, Leiden Centraal, Alphen a/d Rijn, Leiden Centraal, Alphen a/d Rijn]"
train_3,"[Heemstede-Aerdenhout, Leiden Centraal, Heemstede-Aerdenhout, Haarlem, Heemstede-Aerdenhout, Leiden Centraal, Alphen a/d Rijn, Gouda, Den Haag Centraal]"
train_4,"[Den Helder, Alkmaar, Den Helder, Alkmaar]"
train_5,"[Dordrecht, Rotterdam Centraal, Rotterdam Alexander, Gouda, Alphen a/d Rijn, Gouda, Den Haag Centraal, Gouda]"
train_6,"[Heemstede-Aerdenhout, Leiden Centraal, Den Haag Centraal, Leiden Centraal, Den Haag Centraal, Leiden Centraal, Schiphol Airport, Amsterdam Zuid, Amsterdam Sloterdijk, Amsterdam Zuid]"
train_7,"[Leiden Centraal, Den Haag Centraal, Leiden Centraal, Alphen a/d Rijn, Gouda, Den Haag Centraal, Leiden Centraal, Heemstede-Aerdenhout, Haarlem]"
score,4714.428571428571
