train,stations
train_1,"[Rotterdam Alexander, Rotterdam Centraal, Schiedam Centrum, Rotterdam Centraal, Schiedam Centrum, Delft, Schiedam Centrum, Delft, Den Haag Centraal, Leiden Centraal, Den Haag Centraal, Leiden Centraal, Den Haag Centraal]"
train_2,"[Rotterdam Centraal, Rotterdam Alexander, Gouda, Den Haag Centraal, Delft, Schiedam Centrum, Rotterdam Centraal, Dordrecht, Rotterdam Centraal, Dordrecht]"
train_3,"[Beverwijk, Castricum, Zaandam, Castricum, Beverwijk, Castricum, Alkmaar, Hoorn]"
train_4,"[Haarlem, Beverwijk, Zaandam, Beverwijk, Castricum, Beverwijk, Zaandam]"
train_5,"[Rotterdam Centraal, Rotterdam Alexander, Gouda, Den Haag Centraal, Delft, Den Haag Centraal, Gouda, Den Haag Centraal, Delft, Schiedam Centrum]"
train_6,"[Hoorn, Alkmaar, Hoorn, Alkmaar, Castricum, Beverwijk, Haarlem, Heemstede-Aerdenhout]"
train_7,"[Dordrecht, Rotterdam Centraal, Dordrecht, Rotterdam Centraal, Rotterdam Alexander, Gouda, Den Haag Centraal, Leiden Centraal, Schiphol Airport]"
score,4332.285714285714
