train,stations
train_1,"[Leiden Centraal, Den Haag Centraal, Gouda, Rotterdam Alexander, Gouda, Rotterdam Alexander, Gouda, Rotterdam Alexander, Gouda, Rotterdam Alexander, Gouda]"
train_2,"[Alphen a/d Rijn, Gouda, Alphen a/d Rijn, Gouda, Den Haag Centraal, Leiden Centraal, Schiphol Airport, Leiden Centraal]"
train_3,"[Dordrecht, Rotterdam Centraal, Schiedam Centrum, Delft, Den Haag Centraal, Gouda, Den Haag Centraal, Delft, Den Haag Centraal, Leiden Centraal]"
train_4,"[Rotterdam Alexander, Rotterdam Centraal, Dordrecht, Rotterdam Centraal, Dordrecht, Rotterdam Centraal, Rotterdam Alexander, Rotterdam Centraal, Rotterdam Alexander, Rotterdam Centraal, Schiedam Centrum]"
train_5,"[Rotterdam Alexander, Rotterdam Centraal, Rotterdam Alexander, Gouda, Den Haag Centraal, Gouda, Rotterdam Alexander, Gouda, Rotterdam Alexander, Rotterdam Centraal, Schiedam Centrum, Rotterdam Centraal]"
train_6,"[Schiedam Centrum, Rotterdam Centraal, Schiedam Centrum, Rotterdam Centraal, Rotterdam Alexander, Gouda, Den Haag Centraal, Leiden Centraal, Den Haag Centraal, Leiden Centraal, Alphen a/d Rijn]"
train_7,"[Castricum, Zaandam, Castricum, Zaandam, Castricum, Alkmaar, Hoorn, Zaandam]"
score,4207.142857142857
