train,stations
train_1,"[Haarlem, Amsterdam Sloterdijk, Amsterdam Centraal, Amsterdam Amstel, Amsterdam Centraal, Amsterdam Sloterdijk, Amsterdam Centraal, Amsterdam Amstel, Amsterdam Zuid, Amsterdam Sloterdijk, Amsterdam Zuid, Amsterdam Sloterdijk, Amsterdam Centraal]"
train_2,"[Den Haag Centraal, Gouda, Den Haag Centraal, Leiden Centraal, Schiphol Airport, Leiden Centraal, Schiphol Airport, Amsterdam Zuid, Schiphol Airport]"
train_3,"[Castricum, Zaandam, Beverwijk, Castricum, Alkmaar, Den Helder]"
train_4,"[Delft, Schiedam Centrum, Rotterdam Centraal, Dordrecht, Rotterdam Centraal, Rotterdam Alexander, Gouda, Alphen a/d Rijn, Leiden Centraal, Den Haag Centraal]"
train_5,"[Haarlem, Amsterdam Sloterdijk, Haarlem, Heemstede-Aerdenhout, Haarlem, Heemstede-Aerdenhout, Leiden Centraal, Heemstede-Aerdenhout, Haarlem, Amsterdam Sloterdijk, Haarlem, Amsterdam Sloterdijk, Zaandam]"
train_6,"[Schiedam Centrum, Delft, Schiedam Centrum, Delft, Den Haag Centraal, Delft, Den Haag Centraal, Gouda, Rotterdam Alexander, Gouda, Den Haag Centraal]"
train_7,"[Hoorn, Zaandam, Hoorn, Alkmaar, Den Helder]"
score,8282.857142857143
