train,stations
train_1,"[Heemstede-Aerdenhout, Leiden Centraal, Schiphol Airport, Amsterdam Zuid, Amsterdam Amstel, Amsterdam Zuid, Amsterdam Sloterdijk, Amsterdam Zuid, Amsterdam Amstel, Amsterdam Centraal, Amsterdam Sloterdijk]"
train_2,"[Heemstede-Aerdenhout, Haarlem, Heemstede-Aerdenhout, Haarlem, Beverwijk, Castricum, Beverwijk, Zaandam, Amsterdam Sloterdijk, Haarlem, Heemstede-Aerdenhout, Haarlem]"
train_3,"[Castricum, Beverwijk, Castricum, Alkmaar, Den Helder, Alkmaar, Castricum]"
train_4,"[Heemstede-Aerdenhout, Leiden Centraal, Den Haag Centraal, Gouda, Den Haag Centraal, Leiden Centraal, Alphen a/d Rijn, Leiden Centraal, Den Haag Centraal]"
train_5,"[Amsterdam Sloterdijk, Amsterdam Centraal, Amsterdam Amstel, Amsterdam Centraal, Amsterdam Amstel, Amsterdam Centraal, Amsterdam Amstel, Amsterdam Centraal, Amsterdam Amstel, Amsterdam Zuid, Amsterdam Amstel, Amsterdam Zuid, Amsterdam Amstel, Amsterdam Centraal, Amsterdam Amstel]"
train_6,"[Leiden Centraal, Alphen a/d Rijn, Gouda, Rotterdam Alexander, Rotterdam Centraal, Rotterdam Alexander, Gouda, Den Haag Centraal, Delft, Schiedam Centrum, Rotterdam Centraal]"
train_7,"[Amsterdam Centraal, Amsterdam Amstel, Amsterdam Zuid, Schiphol Airport, Leiden Centraal, Schiphol Airport, Leiden Centraal, Alphen a/d Rijn, Gouda]"
score,7414.428571428571
