train,stations
train_1,"[Castricum, Beverwijk, Castricum, Beverwijk, Zaandam, Castricum, Zaandam, Castricum, Alkmaar, Castricum]"
train_2,"[Heemstede-Aerdenhout, Haarlem, Amsterdam Sloterdijk, Haarlem, Heemstede-Aerdenhout, Haarlem, Beverwijk, Castricum, Alkmaar, Castricum, Beverwijk]"
train_3,"[Castricum, Zaandam, Beverwijk, Castricum, Beverwijk, Castricum, Zaandam, Amsterdam Sloterdijk, Amsterdam Zuid]"
train_4,"[Alkmaar, Hoorn, Alkmaar, Den Helder]"
train_5,"[Gouda, Rotterdam Alexander, Rotterdam Centraal, Schiedam Centrum, Delft, Schiedam Centrum, Delft, Schiedam Centrum, Rotterdam Centraal, Rotterdam Alexander, Gouda, Den Haag Centraal, Gouda]"
train_6,"[Den Helder, Alkmaar, Castricum, Zaandam, Amsterdam Sloterdijk, Amsterdam Zuid, Amsterdam Sloterdijk, Amsterdam Centraal, Amsterdam Sloterdijk]"
train_7,"[Den Helder, Alkmaar, Hoorn, Alkmaar]"
score,5403.571428571429
