train,stations
train_1,"[Den Haag Centraal, Delft, Schiedam Centrum, Rotterdam Centraal, Dordrecht, Rotterdam Centraal, Schiedam Centrum, Delft, Schiedam Centrum, Rotterdam Centraal, Schiedam Centrum, Delft, Den Haag Centraal]"
train_2,"[Alkmaar, Castricum, Alkmaar, Castricum, Beverwijk, Haarlem, Heemstede-Aerdenhout, Haarlem, Amsterdam Sloterdijk, Amsterdam Centraal, Amsterdam Amstel, Amsterdam Zuid, Schiphol Airport, Amsterdam Zuid]"
train_3,"[Rotterdam Alexander, Rotterdam Centraal, Schiedam Centrum, Delft, Schiedam Centrum, Rotterdam Centraal, Rotterdam Alexander, Gouda, Den Haag Centraal, Delft, Schiedam Centrum, Rotterdam Centraal, Dordrecht]"
train_4,"[Den Haag Centraal, Leiden Centraal, Schiphol Airport, Leiden Centraal, Den Haag Centraal, Leiden Centraal, Schiphol Airport, Leiden Centraal, Heemstede-Aerdenhout, Haarlem]"
train_5,"[Delft, Den Haag Centraal, Gouda, Den Haag Centraal, Gouda, Alphen a/d Rijn, Leiden Centraal, Schiphol Airport]"
train_6,"[Den Haag Centraal, Leiden Centraal, Heemstede-Aerdenhout, Haarlem, Amsterdam Sloterdijk, Zaandam, Beverwijk, Haarlem, Heemstede-Aerdenhout, Leiden Centraal]"
train_7,"[Zaandam, Hoorn, Alkmaar, Hoorn, Alkmaar]"
score,7567.571428571429
