train,stations
train_1,"[Den Haag Centraal, Delft, Schiedam Centrum, Rotterdam Centraal, Rotterdam Alexander, Gouda, Den Haag Centraal, Delft, Schiedam Centrum, Delft, Schiedam Centrum, Delft, Den Haag Centraal]"
train_2,"[Schiedam Centrum, Delft, Den Haag Centraal, Delft, Den Haag Centraal, Leiden Centraal, Heemstede-Aerdenhout, Haarlem, Heemstede-Aerdenhout, Leiden Centraal, Heemstede-Aerdenhout]"
train_3,"[Schiphol Airport, Amsterdam Zuid, Amsterdam Amstel, Amsterdam Centraal, Amsterdam Sloterdijk, Amsterdam Zuid, Amsterdam Sloterdijk, Zaandam, Castricum, Beverwijk, Castricum, Alkmaar]"
train_4,"[Beverwijk, Castricum, Alkmaar, Hoorn, Zaandam, Beverwijk]"
train_5,"[Haarlem, Beverwijk, Haarlem, Heemstede-Aerdenhout, Leiden Centraal, Den Haag Centraal, Gouda, Alphen a/d Rijn, Gouda]"
train_6,"[Amsterdam Zuid, Schiphol Airport, Leiden Centraal, Alphen a/d Rijn, Leiden Centraal, Schiphol Airport, Leiden Centraal, Heemstede-Aerdenhout, Haarlem, Beverwijk]"
train_7,"[Heemstede-Aerdenhout, Leiden Centraal, Heemstede-Aerdenhout, Leiden Centraal, Den Haag Centraal, Gouda, Rotterdam Alexander, Rotterdam Centraal, Dordrecht]"
score,7812.714285714286
