train,stations
train_1,"[Amsterdam Zuid, Amsterdam Sloterdijk, Amsterdam Zuid, Amsterdam Amstel, Amsterdam Zuid, Amsterdam Sloterdijk, Amsterdam Centraal, Amsterdam Sloterdijk, Haarlem, Heemstede-Aerdenhout, Haarlem, Heemstede-Aerdenhout]"
train_2,"[Dordrecht, Rotterdam Centraal, Schiedam Centrum, Delft, Schiedam Centrum, Rotterdam Centraal, Rotterdam Alexander, Gouda, Den Haag Centraal, Leiden Centraal, Heemstede-Aerdenhout, Haarlem, Heemstede-Aerdenhout]"
train_3,"[Heemstede-Aerdenhout, Leiden Centraal, Den Haag Centraal, Gouda, Alphen a/d Rijn, Leiden Centraal, Den Haag Centraal, Leiden Centraal, Den Haag Centraal]"
train_4,"[Den Helder, Alkmaar, Castricum, Beverwijk, Zaandam, Amsterdam Sloterdijk, Amsterdam Centraal, Amsterdam Amstel, Amsterdam Centraal, Amsterdam Amstel]"
train_5,"[Heemstede-Aerdenhout, Haarlem, Amsterdam Sloterdijk, Haarlem, Amsterdam Sloterdijk, Zaandam, Beverwijk, Zaandam, Castricum, Alkmaar]"
train_6,"[Amsterdam Centraal, Amsterdam Amstel, Amsterdam Centraal, Amsterdam Sloterdijk, Amsterdam Centraal, Amsterdam Sloterdijk, Haarlem, Amsterdam Sloterdijk, Zaandam, Castricum, Zaandam, Castricum, Beverwijk]"
train_7,"[Leiden Centraal, Heemstede-Aerdenhout, Haarlem, Amsterdam Sloterdijk, Zaandam, Hoorn, Alkmaar, Castricum, Beverwijk]"
score,7196.428571428571
