train,stations
train_1,"[Amsterdam Sloterdijk, Zaandam, Amsterdam Sloterdijk, Haarlem, Heemstede-Aerdenhout, Leiden Centraal, Heemstede-Aerdenhout, Haarlem, Beverwijk, Zaandam, Amsterdam Sloterdijk]"
train_2,"[Schiphol Airport, Leiden Centraal, Alphen a/d Rijn, Leiden Centraal, Alphen a/d Rijn, Gouda, Rotterdam Alexander, Rotterdam Centraal, Schiedam Centrum, Delft, Schiedam Centrum, Rotterdam Centraal]"
train_3,"[Leiden Centraal, Alphen a/d Rijn, Leiden Centraal, Alphen a/d Rijn, Leiden Centraal, Den Haag Centraal, Leiden Centraal, Alphen a/d Rijn, Leiden Centraal]"
train_4,"[Schiphol Airport, Leiden Centraal, Schiphol Airport, Leiden Centraal, Den Haag Centraal, Leiden Centraal, Den Haag Centraal, Leiden Centraal, Heemstede-Aerdenhout, Leiden Centraal]"
train_5,"[Den Haag Centraal, Delft, Den Haag Centraal, Delft, Schiedam Centrum, Rotterdam Centraal, Rotterdam Alexander, Gouda, Den Haag Centraal, Gouda, Rotterdam Alexander]"
train_6,"[Den Haag Centraal, Delft, Schiedam Centrum, Delft, Schiedam Centrum, Rotterdam Centraal, Schiedam Centrum, Rotterdam Centraal, Rotterdam Alexander, Rotterdam Centraal, Dordrecht, Rotterdam Centraal, Schiedam Centrum, Delft, Schiedam Centrum]"
train_7,"[Delft, Den Haag Centraal, Gouda, Rotterdam Alexander, Gouda, Alphen a/d Rijn, Gouda, Alphen a/d Rijn]"
score,4577.428571428571
