train,stations
train_1,"[Alkmaar, Den Helder, Alkmaar, Hoorn]"
train_2,"[Amsterdam Amstel, Amsterdam Zuid, Schiphol Airport, Leiden Centraal, Den Haag Centraal, Gouda, Alphen a/d Rijn, Gouda, Den Haag Centraal]"
train_3,"[Den Haag Centraal, Gouda, Den Haag Centraal, Delft, Schiedam Centrum, Delft, Den Haag Centraal, Gouda, Alphen a/d Rijn]"
train_4,"[Den Haag Centraal, Delft, Schiedam Centrum, Rotterdam Centraal, Rotterdam Alexander, Gouda, Den Haag Centraal, Leiden Centraal, Alphen a/d Rijn, Leiden Centraal, Heemstede-Aerdenhout]"
train_5,"[Alkmaar, Den Helder, Alkmaar, Den Helder]"
train_6,"[Amsterdam Amstel, Amsterdam Centraal, Amsterdam Sloterdijk, Zaandam, Castricum, Zaandam, Castricum, Zaandam, Castricum, Beverwijk, Haarlem]"
train_7,"[Rotterdam Alexander, Rotterdam Centraal, Schiedam Centrum, Rotterdam Centraal, Dordrecht, Rotterdam Centraal, Dordrecht, Rotterdam Centraal, Dordrecht]"
score,7067.285714285714
