train,stations
train_1,"[Zaandam, Hoorn, Alkmaar, Castricum, Alkmaar, Hoorn, Zaandam]"
train_2,"[Rotterdam Centraal, Dordrecht, Rotterdam Centraal, Rotterdam Alexander, Gouda, Rotterdam Alexander, Rotterdam Centraal, Dordrecht, Rotterdam Centraal]"
train_3,"[Rotterdam Alexander, Gouda, Den Haag Centraal, Leiden Centraal, Heemstede-Aerdenhout, Leiden Centraal, Heemstede-Aerdenhout, Leiden Centraal, Alphen a/d Rijn]"
train_4,"[Alkmaar, Hoorn, Alkmaar, Den Helder]"
train_5,"[Delft, Den Haag Centraal, Leiden Centraal, Schiphol Airport, Leiden Centraal, Alphen a/d Rijn, Leiden Centraal, Den Haag Centraal, Leiden Centraal]"
train_6,"[Gouda, Rotterdam Alexander, Gouda, Den Haag Centraal, Delft, Den Haag Centraal, Gouda, Rotterdam Alexander, Gouda, Rotterdam Alexander]"
train_7,"[Den Haag Centraal, Leiden Centraal, Alphen a/d Rijn, Leiden Centraal, Heemstede-Aerdenhout, Leiden Centraal, Heemstede-Aerdenhout, Leiden Centraal, Alphen a/d Rijn]"
score,3613.857142857143
