train,stations
train_1,"[Amsterdam Amstel, Amsterdam Centraal, Amsterdam Sloterdijk, Amsterdam Centraal, Amsterdam Amstel, Amsterdam Zuid, Amsterdam Amstel, Amsterdam Zuid, Amsterdam Sloterdijk, Zaandam, Beverwijk, Castricum]"
train_2,"[Leiden Centraal, Den Haag Centraal, Leiden Centraal, Heemstede-Aerdenhout, Haarlem, Beverwijk, Castricum, Zaandam, Hoorn]"
train_3,"[Amsterdam Sloterdijk, Zaandam, Castricum, Beverwijk, Castricum, Alkmaar, Hoorn, Zaandam]"
train_4,"[Hoorn, Alkmaar, Castricum, Beverwijk, Zaandam, Hoorn]"
train_5,"[Hoorn, Alkmaar, Den Helder, Alkmaar]"
train_6,"[Castricum, Alkmaar, Den Helder, Alkmaar, Hoorn]"
train_7,"[Schiphol Airport, Amsterdam Zuid, Amsterdam Amstel, Amsterdam Centraal, Amsterdam Sloterdijk, Amsterdam Centraal, Amsterdam Amstel, Amsterdam Centraal, Amsterdam Sloterdijk, Zaandam, Castricum, Beverwijk, Zaandam]"
score,4838.428571428571
