train,stations
train_1,"[Castricum, Zaandam, Hoorn, Zaandam, Amsterdam Sloterdijk, Haarlem, Amsterdam Sloterdijk, Zaandam]"
train_2,"[Alkmaar, Hoorn, Alkmaar, Hoorn, Zaandam]"
train_3,"[Delft, Schiedam Centrum, Rotterdam Centraal, Dordrecht, Rotterdam Centraal, Rotterdam Alexander, Rotterdam Centraal, Rotterdam Alexander, Gouda, Den Haag Centraal, Gouda]"
train_4,"[Heemstede-Aerdenhout, Haarlem, Heemstede-Aerdenhout, Haarlem, Amsterdam Sloterdijk, Amsterdam Zuid, Amsterdam Amstel, Amsterdam Centraal, Amsterdam Sloterdijk, Zaandam, Castricum, Zaandam]"
train_5,"[Schiphol Airport, Leiden Centraal, Den Haag Centraal, Gouda, Den Haag Centraal, Gouda, Den Haag Centraal, Delft]"
train_6,"[Den Helder, Alkmaar, Castricum, Beverwijk, Haarlem, Amsterdam Sloterdijk, Zaandam, Castricum, Beverwijk]"
train_7,"[Hoorn, Zaandam, Castricum, Zaandam, Castricum, Zaandam, Hoorn]"
score,6775.285714285714
