train,stations
train_1,"[Amsterdam Sloterdijk, Haarlem, Heemstede-Aerdenhout, Leiden Centraal, Schiphol Airport, Amsterdam Zuid, Amsterdam Amstel, Amsterdam Centraal, Amsterdam Sloterdijk, Zaandam, Beverwijk]"
train_2,"[Rotterdam Alexander, Rotterdam Centraal, Rotterdam Alexander, Gouda, Alphen a/d Rijn, Leiden Centraal, Alphen a/d Rijn, Gouda, Rotterdam Alexander, Rotterdam Centraal]"
train_3,"[Gouda, Alphen a/d Rijn, Leiden Centraal, Alphen a/d Rijn, Gouda, Alphen a/d Rijn, Leiden Centraal, Schiphol Airport]"
train_4,"[Den Helder, Alkmaar, Den Helder, Alkmaar]"
train_5,"[Amsterdam Sloterdijk, Amsterdam Zuid, Amsterdam Amstel, Amsterdam Zuid, Amsterdam Amstel, Amsterdam Zuid, Amsterdam Sloterdijk, Haarlem, Beverwijk, Haarlem]"
train_6,"[Zaandam, Hoorn, Zaandam, Hoorn, Zaandam, Castricum]"
train_7,"[Haarlem, Beverwijk, Zaandam, Castricum, Beverwijk, Haarlem, Heemstede-Aerdenhout, Haarlem, Beverwijk]"
score,5663.857142857143
