train,stations
train_1,"[Den Haag Centraal, Gouda, Rotterdam Alexander, Gouda, Rotterdam Alexander, Gouda, Rotterdam Alexander, Rotterdam Centraal, Schiedam Centrum, Delft, Schiedam Centrum, Delft, Schiedam Centrum, Rotterdam Centraal]"
train_2,"[Schiedam Centrum, Delft, Schiedam Centrum, Rotterdam Centraal, Rotterdam Alexander, Rotterdam Centraal, Rotterdam Alexander, Gouda, Den Haag Centraal, Gouda, Alphen a/d Rijn]"
train_3,"[Rotterdam Alexander, Rotterdam Centraal, Dordrecht, Rotterdam Centraal, Dordrecht, Rotterdam Centraal, Schiedam Centrum, Rotterdam Centraal, Dordrecht]"
train_4,"[Gouda, Rotterdam Alexander, Rotterdam Centraal, Schiedam Centrum, Delft, Den Haag Centraal, Delft, Den Haag Centraal, Delft, Schiedam Centrum, Rotterdam Centraal, Rotterdam Alexander, Rotterdam Centraal, Schiedam Centrum]"
train_5,"[Den Helder, Alkmaar, Den Helder, Alkmaar]"
train_6,"[Leiden Centraal, Alphen a/d Rijn, Gouda, Rotterdam Alexander, Rotterdam Centraal, Schiedam Centrum, Delft, Den Haag Centraal, Delft, Den Haag Centraal, Delft]"
train_7,"[Leiden Centraal, Schiphol Airport, Leiden Centraal, Alphen a/d Rijn, Gouda, Den Haag Centraal, Leiden Centraal, Alphen a/d Rijn]"
score,3033.7142857142853
