train,stations
train_1,"[Amsterdam Zuid, Amsterdam Amstel, Amsterdam Centraal, Amsterdam Amstel, Amsterdam Zuid, Schiphol Airport, Amsterdam Zuid, Amsterdam Sloterdijk, Haarlem, Amsterdam Sloterdijk, Amsterdam Centraal, Amsterdam Amstel, Amsterdam Zuid, Schiphol Airport]"
train_2,"[Schiphol Airport, Leiden Centraal, Alphen a/d Rijn, Gouda, Den Haag Centraal, Delft, Schiedam Centrum, Delft, Schiedam Centrum, Rotterdam Centraal, Schiedam Centrum, Delft]"
train_3,"[Gouda, Den Haag Centraal, Gouda, Alphen a/d Rijn, Leiden Centraal, Heemstede-Aerdenhout, Leiden Centraal, Alphen a/d Rijn]"
train_4,"[Den Helder, Alkmaar, Castricum, Alkmaar, Hoorn, Zaandam, Castricum]"
train_5,"[Schiedam Centrum, Rotterdam Centraal, Dordrecht, Rotterdam Centraal, Dordrecht, Rotterdam Centraal, Dordrecht, Rotterdam Centraal]"
train_6,"[Hoorn, Zaandam, Castricum, Beverwijk, Haarlem, Heemstede-Aerdenhout, Haarlem, Beverwijk]"
train_7,"[Dordrecht, Rotterdam Centraal, Rotterdam Alexander, Rotterdam Centraal, Schiedam Centrum, Delft, Schiedam Centrum, Delft, Den Haag Centraal, Gouda, Den Haag Centraal]"
score,8020.714285714286
