train,stations
train_1,"[Dordrecht, Rotterdam Centraal, Dordrecht, Rotterdam Centraal, Schiedam Centrum, Rotterdam Centraal, Rotterdam Alexander, Gouda, Rotterdam Alexander, Rotterdam Centraal, Dordrecht]"
train_2,"[Zaandam, Hoorn, Alkmaar, Den Helder]"
train_3,"[Den Helder, Alkmaar, Hoorn, Alkmaar]"
train_4,"[Den Haag Centraal, Gouda, Den Haag Centraal, Gouda, Den Haag Centraal, Leiden Centraal, Den Haag Centraal, Gouda]"
train_5,"[Alkmaar, Den Helder, Alkmaar, Hoorn]"
train_6,"[Leiden Centraal, Heemstede-Aerdenhout, Haarlem, Heemstede-Aerdenhout, Leiden Centraal, Heemstede-Aerdenhout, Haarlem, Beverwijk, Zaandam]"
train_7,"[Alphen a/d Rijn, Leiden Centraal, Alphen a/d Rijn, Gouda, Den Haag Centraal, Gouda, Alphen a/d Rijn]"
score,4143.142857142857
