train,stations
train_1,"[Gouda, Rotterdam Alexander, Rotterdam Centraal, Schiedam Centrum, Delft, Den Haag Centraal, Delft, Den Haag Centraal, Delft, Schiedam Centrum, Delft, Schiedam Centrum, Delft, Schiedam Centrum]"
train_2,"[Schiphol Airport, Leiden Centraal, Heemstede-Aerdenhout, Haarlem, Beverwijk, Haarlem, Beverwijk, Zaandam, Amsterdam Sloterdijk, Zaandam]"
train_3,"[Amsterdam Centraal, Amsterdam Sloterdijk, Zaandam, Castricum, Beverwijk, Castricum, Beverwijk, Castricum, Zaandam, Hoorn]"
train_4,"[Beverwijk, Haarlem, Heemstede-Aerdenhout, Haarlem, Heemstede-Aerdenhout, Leiden Centraal, Heemstede-Aerdenhout, Leiden Centraal, Heemstede-Aerdenhout, Leiden Centraal, Heemstede-Aerdenhout, Haarlem]"
train_5,"[Beverwijk, Haarlem, Amsterdam Sloterdijk, Amsterdam Zuid, Amsterdam Sloterdijk, Amsterdam Zuid, Amsterdam Amstel, Amsterdam Centraal, Amsterdam Amstel, Amsterdam Centraal, Amsterdam Amstel]"
train_6,"[Amsterdam Amstel, Amsterdam Centraal, Amsterdam Amstel, Amsterdam Zuid, Amsterdam Sloterdijk, Zaandam, Amsterdam Sloterdijk, Zaandam, Beverwijk, Castricum, Zaandam]"
train_7,"[Amsterdam Amstel, Amsterdam Centraal, Amsterdam Sloterdijk, Haarlem, Beverwijk, Castricum, Beverwijk, Zaandam, Castricum, Zaandam]"
score,5274.714285714286
