train,stations
train_1,"[Amsterdam Centraal, Amsterdam Amstel, Amsterdam Centraal, Amsterdam Sloterdijk, Amsterdam Zuid, Amsterdam Sloterdijk, Zaandam, Amsterdam Sloterdijk, Zaandam, Beverwijk, Castricum]"
train_2,"[Zaandam, Beverwijk, Zaandam, Hoorn, Alkmaar]"
train_3,"[Alkmaar, Den Helder, Alkmaar, Castricum, Zaandam, Beverwijk]"
train_4,"[Schiphol Airport, Amsterdam Zuid, Amsterdam Sloterdijk, Amsterdam Centraal, Amsterdam Amstel, Amsterdam Zuid, Amsterdam Amstel, Amsterdam Centraal, Amsterdam Amstel, Amsterdam Centraal, Amsterdam Sloterdijk, Zaandam, Amsterdam Sloterdijk, Amsterdam Centraal, Amsterdam Amstel]"
train_5,"[Gouda, Rotterdam Alexander, Rotterdam Centraal, Rotterdam Alexander, Gouda, Den Haag Centraal, Gouda, Alphen a/d Rijn, Gouda]"
train_6,"[Den Helder, Alkmaar, Den Helder, Alkmaar]"
train_7,"[Alkmaar, Den Helder, Alkmaar, Hoorn]"
score,4935.428571428571
