train,stations
train_1,"[Haarlem, Heemstede-Aerdenhout, Leiden Centraal, Schiphol Airport, Amsterdam Zuid, Amsterdam Amstel, Amsterdam Zuid, Amsterdam Sloterdijk, Haarlem, Beverwijk]"
train_2,"[Heemstede-Aerdenhout, Leiden Centraal, Heemstede-Aerdenhout, Haarlem, Heemstede-Aerdenhout, Leiden Centraal, Alphen a/d Rijn, Gouda, Rotterdam Alexander, Rotterdam Centraal, Rotterdam Alexander, Rotterdam Centraal]"
train_3,"[Heemstede-Aerdenhout, Haarlem, Amsterdam Sloterdijk, Amsterdam Centraal, Amsterdam Sloterdijk, Zaandam, Hoorn, Alkmaar]"
train_4,"[Zaandam, Hoorn, Alkmaar, Den Helder]"
train_5,"[Den Helder, Alkmaar, Den Helder, Alkmaar, Castricum]"
train_6,"[Amsterdam Zuid, Amsterdam Sloterdijk, Zaandam, Beverwijk, Castricum, Alkmaar, Den Helder]"
train_7,"[Amsterdam Amstel, Amsterdam Zuid, Schiphol Airport, Amsterdam Zuid, Amsterdam Sloterdijk, Haarlem, Beverwijk, Castricum, Beverwijk, Haarlem]"
score,5721.857142857143
