train,stations
train_1,"[Heemstede-Aerdenhout, Haarlem, Beverwijk, Haarlem, Beverwijk, Zaandam, Beverwijk]"
train_2,"[Schiphol Airport, Amsterdam Zuid, Amsterdam Sloterdijk, Zaandam, Beverwijk, Castricum, Alkmaar, Hoorn]"
train_3,"[Leiden Centraal, Schiphol Airport, Amsterdam Zuid, Amsterdam Sloterdijk, Zaandam, Castricum, Beverwijk, Zaandam, Amsterdam Sloterdijk, Amsterdam Zuid]"
train_4,"[Castricum, Zaandam, Hoorn, Zaandam, Castricum, Alkmaar]"
train_5,"[Hoorn, Zaandam, Beverwijk, Haarlem, Heemstede-Aerdenhout, Haarlem, Heemstede-Aerdenhout, Haarlem, Amsterdam Sloterdijk, Amsterdam Zuid]"
train_6,"[Amsterdam Sloterdijk, Haarlem, Beverwijk, Haarlem, Heemstede-Aerdenhout, Haarlem, Amsterdam Sloterdijk, Zaandam, Hoorn]"
train_7,"[Amsterdam Zuid, Amsterdam Amstel, Amsterdam Centraal, Amsterdam Sloterdijk, Zaandam, Hoorn, Zaandam, Beverwijk]"
score,4395.285714285714
