train,stations
train_1,"[Den Haag Centraal, Gouda, Den Haag Centraal, Gouda, Alphen a/d Rijn, Leiden Centraal, Alphen a/d Rijn]"
train_2,"[Haarlem, Heemstede-Aerdenhout, Leiden Centraal, Den Haag Centraal, Leiden Centraal, Heemstede-Aerdenhout, Leiden Centraal, Heemstede-Aerdenhout, Leiden Centraal, Den Haag Centraal]"
train_3,"[Leiden Centraal, Alphen a/d Rijn, Leiden Centraal, Den Haag Centraal, Gouda, Den Haag Centraal, Gouda, Alphen a/d Rijn]"
train_4,"[Delft, Den Haag Centraal, Gouda, Den Haag Centraal, Delft, Schiedam Centrum, Rotterdam Centraal, Rotterdam Alexander, Rotterdam Centraal, Dordrecht]"
train_5,"[Schiedam Centrum, Delft, Den Haag Centraal, Leiden Centraal, Schiphol Airport, Leiden Centraal, Alphen a/d Rijn, Gouda, Alphen a/d Rijn]"
train_6,"[Alphen a/d Rijn, Gouda, Alphen a/d Rijn, Leiden Centraal, Den Haag Centraal, Delft, Den Haag Centraal, Gouda, Rotterdam Alexander]"
train_7,"[Gouda, Rotterdam Alexander, Gouda, Alphen a/d Rijn, Gouda, Rotterdam Alexander, Rotterdam Centraal, Rotterdam Alexander, Rotterdam Centraal, Schiedam Centrum, Rotterdam Centraal, Dordrecht]"
score,3264.857142857143
