train,stations
train_1,"[Hoorn, Alkmaar, Castricum, Zaandam, Hoorn, Alkmaar, Castricum, Alkmaar]"
train_2,"[Rotterdam Centraal, Rotterdam Alexander, Gouda, Rotterdam Alexander, Gouda, Rotterdam Alexander, Gouda, Den Haag Centraal, Leiden Centraal, Alphen a/d Rijn]"
train_3,"[Castricum, Beverwijk, Castricum, Beverwijk, Zaandam, Beverwijk, Zaandam]"
train_4,"[Alphen a/d Rijn, Gouda, Rotterdam Alexander, Rotterdam Centraal, Schiedam Centrum, Delft, Den Haag Centraal, Leiden Centraal, Schiphol Airport, Leiden Centraal, Den Haag Centraal]"
train_5,"[Amsterdam Sloterdijk, Amsterdam Centraal, Amsterdam Sloterdijk, Amsterdam Centraal, Amsterdam Amstel, Amsterdam Zuid, Schiphol Airport, Leiden Centraal, Schiphol Airport, Amsterdam Zuid, Amsterdam Sloterdijk, Amsterdam Zuid]"
train_6,"[Amsterdam Sloterdijk, Haarlem, Beverwijk, Castricum, Alkmaar, Hoorn, Zaandam, Amsterdam Sloterdijk]"
train_7,"[Castricum, Alkmaar, Castricum, Beverwijk, Castricum, Alkmaar, Hoorn, Alkmaar]"
score,7220.428571428571
