train,stations
train_1,"[Den Helder, Alkmaar, Hoorn, Zaandam, Amsterdam Sloterdijk, Haarlem, Beverwijk]"
train_2,"[Amsterdam Sloterdijk, Haarlem, Beverwijk, Castricum, Beverwijk, Haarlem, Heemstede-Aerdenhout, Leiden Centraal, Heemstede-Aerdenhout, Haarlem, Heemstede-Aerdenhout]"
train_3,"[Rotterdam Centraal, Schiedam Centrum, Rotterdam Centraal, Dordrecht, Rotterdam Centraal, Schiedam Centrum, Delft, Den Haag Centraal, Leiden Centraal, Schiphol Airport, Leiden Centraal]"
train_4,"[Zaandam, Beverwijk, Zaandam, Castricum, Alkmaar, Castricum, Zaandam, Amsterdam Sloterdijk, Haarlem]"
train_5,"[Den Haag Centraal, Delft, Schiedam Centrum, Rotterdam Centraal, Dordrecht, Rotterdam Centraal, Rotterdam Alexander, Rotterdam Centraal, Dordrecht, Rotterdam Centraal, Rotterdam Alexander]"
train_6,"[Amsterdam Amstel, Amsterdam Zuid, Schiphol Airport, Amsterdam Zuid, Schiphol Airport, Amsterdam Zuid, Amsterdam Sloterdijk, Haarlem, Heemstede-Aerdenhout, Haarlem, Beverwijk, Zaandam]"
train_7,"[Hoorn, Alkmaar, Den Helder, Alkmaar]"
score,6697.142857142857
