train,stations
train_1,"[Amsterdam Amstel, Amsterdam Zuid, Amsterdam Sloterdijk, Amsterdam Centraal, Amsterdam Amstel, Amsterdam Centraal, Amsterdam Sloterdijk, Amsterdam Zuid, Amsterdam Amstel, Amsterdam Zuid, Amsterdam Sloterdijk, Zaandam]"
train_2,"[Alkmaar, Hoorn, Zaandam, Beverwijk, Haarlem, Heemstede-Aerdenhout, Haarlem, Beverwijk]"
train_3,"[Heemstede-Aerdenhout, Leiden Centraal, Heemstede-Aerdenhout, Leiden Centraal, Heemstede-Aerdenhout, Haarlem, Heemstede-Aerdenhout, Leiden Centraal, Schiphol Airport, Leiden Centraal, Den Haag Centraal]"
train_4,"[Hoorn, Zaandam, Amsterdam Sloterdijk, Amsterdam Centraal, Amsterdam Amstel, Amsterdam Centraal, Amsterdam Sloterdijk, Haarlem, Beverwijk, Zaandam]"
train_5,"[Den Helder, Alkmaar, Den Helder, Alkmaar]"
train_6,"[Heemstede-Aerdenhout, Leiden Centraal, Den Haag Centraal, Gouda, Rotterdam Alexander, Gouda, Rotterdam Alexander, Rotterdam Centraal, Rotterdam Alexander, Gouda, Rotterdam Alexander, Gouda]"
train_7,"[Den Helder, Alkmaar, Hoorn, Alkmaar]"
score,5039.571428571429
