train,stations
train_1,"[Delft, Schiedam Centrum, Delft, Den Haag Centraal, Delft, Schiedam Centrum, Rotterdam Centraal, Schiedam Centrum, Delft, Schiedam Centrum, Rotterdam Centraal, Dordrecht, Rotterdam Centraal]"
train_2,"[Haarlem, Amsterdam Sloterdijk, Amsterdam Centraal, Amsterdam Amstel, Amsterdam Centraal, Amsterdam Amstel, Amsterdam Centraal, Amsterdam Sloterdijk, Amsterdam Zuid, Amsterdam Sloterdijk, Zaandam, Castricum, Alkmaar]"
train_3,"[Haarlem, Beverwijk, Castricum, Alkmaar, Castricum, Zaandam, Beverwijk, Zaandam]"
train_4,"[Zaandam, Beverwijk, Zaandam, Castricum, Alkmaar, Hoorn]"
train_5,"[Heemstede-Aerdenhout, Haarlem, Heemstede-Aerdenhout, Haarlem, Beverwijk, Castricum, Alkmaar, Den Helder]"
train_6,"[Schiphol Airport, Leiden Centraal, Den Haag Centraal, Gouda, Alphen a/d Rijn, Gouda, Alphen a/d Rijn, Leiden Centraal]"
train_7,"[Schiphol Airport, Leiden Centraal, Schiphol Airport, Amsterdam Zuid, Amsterdam Amstel, Amsterdam Centraal, Amsterdam Amstel, Amsterdam Centraal, Amsterdam Sloterdijk, Amsterdam Zuid, Amsterdam Sloterdijk, Haarlem]"
score,7116.428571428571
