train,stations
train_1,"[Leiden Centraal, Schiphol Airport, Leiden Centraal, Alphen a/d Rijn, Gouda, Rotterdam Alexander, Gouda, Rotterdam Alexander, Gouda]"
train_2,"[Amsterdam Sloterdijk, Haarlem, Beverwijk, Haarlem, Beverwijk, Haarlem, Beverwijk, Castricum, Alkmaar]"
train_3,"[Hoorn, Zaandam, Beverwijk, Zaandam, Beverwijk, Castricum]"
train_4,"[Amsterdam Amstel, Amsterdam Centraal, Amsterdam Amstel, Amsterdam Zuid, Schiphol Airport, Amsterdam Zuid, Schiphol Airport, Leiden Centraal, Alphen a/d Rijn, Leiden Centraal, Alphen a/d Rijn]"
train_5,"[Leiden Centraal, Schiphol Airport, Leiden Centraal, Den Haag Centraal, Delft, Schiedam Centrum, Delft, Den Haag Centraal, Gouda, Rotterdam Alexander]"
train_6,"[Leiden Centraal, Heemstede-Aerdenhout, Leiden Centraal, Schiphol Airport, Leiden Centraal, Den Haag Centraal, Delft, Schiedam Centrum, Rotterdam Centraal, Rotterdam Alexander, Gouda]"
train_7,"[Alphen a/d Rijn, Leiden Centraal, Den Haag Centraal, Gouda, Alphen a/d Rijn, Gouda, Den Haag Centraal, Gouda]"
score,5883.857142857143
