train,stations
train_1,"[Beverwijk, Haarlem, Heemstede-Aerdenhout, Leiden Centraal, Den Haag Centraal, Gouda, Alphen a/d Rijn, Leiden Centraal, Alphen a/d Rijn]"
train_2,"[Schiphol Airport, Leiden Centraal, Heemstede-Aerdenhout, Haarlem, Beverwijk, Castricum, Beverwijk, Zaandam, Castricum]"
train_3,"[Gouda, Rotterdam Alexander, Rotterdam Centraal, Rotterdam Alexander, Gouda, Rotterdam Alexander, Rotterdam Centraal, Dordrecht, Rotterdam Centraal, Schiedam Centrum, Rotterdam Centraal, Dordrecht]"
train_4,"[Dordrecht, Rotterdam Centraal, Schiedam Centrum, Rotterdam Centraal, Dordrecht, Rotterdam Centraal, Dordrecht, Rotterdam Centraal, Rotterdam Alexander, Rotterdam Centraal]"
train_5,"[Delft, Schiedam Centrum, Delft, Den Haag Centraal, Delft, Den Haag Centraal, Leiden Centraal, Alphen a/d Rijn, Gouda, Rotterdam Alexander, Rotterdam Centraal]"
train_6,"[Leiden Centraal, Schiphol Airport, Leiden Centraal, Den Haag Centraal, Leiden Centraal, Den Haag Centraal, Leiden Centraal, Heemstede-Aerdenhout, Haarlem, Amsterdam Sloterdijk, Amsterdam Centraal]"
train_7,"[Schiedam Centrum, Rotterdam Centraal, Rotterdam Alexander, Rotterdam Centraal, Rotterdam Alexander, Rotterdam Centraal, Dordrecht, Rotterdam Centraal, Rotterdam Alexander, Rotterdam Centraal, Dordrecht]"
score,5300.714285714286
