train,stations
train_1,"[Amsterdam Sloterdijk, Zaandam, Beverwijk, Zaandam, Beverwijk, Haarlem, Beverwijk]"
train_2,"[Amsterdam Centraal, Amsterdam Amstel, Amsterdam Zuid, Amsterdam Sloterdijk, Amsterdam Centraal, Amsterdam Amstel, Amsterdam Zuid, Amsterdam Sloterdijk, Amsterdam Zuid, Amsterdam Amstel, Amsterdam Zuid]"
train_3,"[Beverwijk, Castricum, Beverwijk, Castricum, Alkmaar, Hoorn, Alkmaar]"
train_4,"[Alkmaar, Hoorn, Zaandam, Castricum, Beverwijk, Zaandam, Castricum]"
train_5,"[Dordrecht, Rotterdam Centraal, Rotterdam Alexander, Gouda, Alphen a/d Rijn, Gouda, Den Haag Centraal, Gouda, Rotterdam Alexander]"
train_6,"[Amsterdam Amstel, Amsterdam Zuid, Amsterdam Sloterdijk, Amsterdam Centraal, Amsterdam Amstel, Amsterdam Centraal, Amsterdam Amstel, Amsterdam Centraal, Amsterdam Amstel, Amsterdam Centraal, Amsterdam Amstel, Amsterdam Zuid, Amsterdam Sloterdijk]"
train_7,"[Amsterdam Zuid, Amsterdam Sloterdijk, Haarlem, Beverwijk, Haarlem, Heemstede-Aerdenhout, Haarlem, Heemstede-Aerdenhout, Haarlem, Amsterdam Sloterdijk, Amsterdam Zuid]"
score,5645.714285714286
