train,stations
train_1,"[Amsterdam Centraal, Amsterdam Sloterdijk, Haarlem, Heemstede-Aerdenhout, Haarlem, Beverwijk, Castricum, Alkmaar, Castricum, Alkmaar]"
train_2,"[Rotterdam Alexander, Gouda, Alphen a/d Rijn, Leiden Centraal, Heemstede-Aerdenhout, Leiden Centraal, Heemstede-Aerdenhout, Leiden Centraal, Alphen a/d Rijn]"
train_3,"[Alkmaar, Hoorn, Zaandam, Hoorn, Zaandam, Amsterdam Sloterdijk, Amsterdam Centraal]"
train_4,"[Zaandam, Beverwijk, Castricum, Zaandam, Castricum, Beverwijk, Castricum, Alkmaar]"
train_5,"[Alphen a/d Rijn, Gouda, Den Haag Centraal, Delft, Den Haag Centraal, Gouda, Den Haag Centraal, Leiden Centraal]"
train_6,"[Rotterdam Centraal, Dordrecht, Rotterdam Centraal, Dordrecht, Rotterdam Centraal, Rotterdam Alexander, Gouda, Den Haag Centraal]"
train_7,"[Zaandam, Hoorn, Alkmaar, Hoorn, Alkmaar]"
score,5724.857142857143
