train,stations
train_1,"[Alphen a/d Rijn, Gouda, Rotterdam Alexander, Rotterdam Centraal, Dordrecht, Rotterdam Centraal, Dordrecht, Rotterdam Centraal]"
train_2,"[Zaandam, Beverwijk, Haarlem, Amsterdam Sloterdijk, Amsterdam Centraal, Amsterdam Sloterdijk, Haarlem, Amsterdam Sloterdijk, Haarlem, Beverwijk]"
train_3,"[Zaandam, Beverwijk, Haarlem, Beverwijk, Haarlem, Beverwijk, Castricum, Beverwijk]"
train_4,"[Delft, Schiedam Centrum, Rotterdam Centraal, Schiedam Centrum, Rotterdam Centraal, Dordrecht, Rotterdam Centraal, Dordrecht, Rotterdam Centraal, Schiedam Centrum, Rotterdam Centraal, Dordrecht]"
train_5,"[Haarlem, Amsterdam Sloterdijk, Amsterdam Zuid, Amsterdam Sloterdijk, Zaandam, Beverwijk, Zaandam, Castricum]"
train_6,"[Leiden Centraal, Alphen a/d Rijn, Gouda, Den Haag Centraal, Gouda, Rotterdam Alexander, Rotterdam Centraal, Schiedam Centrum, Delft, Den Haag Centraal]"
train_7,"[Alkmaar, Den Helder, Alkmaar, Castricum, Alkmaar, Hoorn]"
score,5655.857142857143
