train,stations
train_1,"[Rotterdam Centraal, Dordrecht, Rotterdam Centraal, Dordrecht, Rotterdam Centraal, Dordrecht, Rotterdam Centraal, Dordrecht]"
train_2,"[Den Helder, Alkmaar, Castricum, Beverwijk, Castricum, Alkmaar, Hoorn]"
train_3,"[Amsterdam Sloterdijk, Zaandam, Hoorn, Zaandam, Beverwijk, Haarlem, Heemstede-Aerdenhout, Leiden Centraal]"
train_4,"[Rotterdam Alexander, Gouda, Den Haag Centraal, Delft, Den Haag Centraal, Delft, Schiedam Centrum, Rotterdam Centraal, Dordrecht, Rotterdam Centraal]"
train_5,"[Castricum, Alkmaar, Den Helder, Alkmaar, Castricum, Alkmaar]"
train_6,"[Beverwijk, Haarlem, Amsterdam Sloterdijk, Haarlem, Beverwijk, Castricum, Beverwijk, Zaandam]"
train_7,"[Heemstede-Aerdenhout, Haarlem, Amsterdam Sloterdijk, Amsterdam Centraal, Amsterdam Amstel, Amsterdam Zuid, Schiphol Airport, Leiden Centraal, Schiphol Airport, Amsterdam Zuid, Schiphol Airport, Amsterdam Zuid, Schiphol Airport, Amsterdam Zuid]"
score,6392.142857142857
