train,stations
train_1,"[Alkmaar, Den Helder, Alkmaar, Den Helder]"
train_2,"[Heemstede-Aerdenhout, Leiden Centraal, Alphen a/d Rijn, Gouda, Rotterdam Alexander, Gouda, Den Haag Centraal, Delft, Den Haag Centraal]"
train_3,"[Alkmaar, Hoorn, Zaandam, Hoorn, Zaandam]"
train_4,"[Zaandam, Hoorn, Alkmaar, Hoorn, Alkmaar]"
train_5,"[Dordrecht, Rotterdam Centraal, Schiedam Centrum, Rotterdam Centraal, Dordrecht, Rotterdam Centraal, Schiedam Centrum, Delft, Schiedam Centrum, Delft, Schiedam Centrum, Delft, Den Haag Centraal]"
train_6,"[Zaandam, Hoorn, Alkmaar, Hoorn, Zaandam]"
train_7,"[Haarlem, Beverwijk, Haarlem, Amsterdam Sloterdijk, Haarlem, Beverwijk, Haarlem, Amsterdam Sloterdijk, Amsterdam Centraal, Amsterdam Sloterdijk, Amsterdam Centraal]"
score,3910.142857142857
