train,stations
train_1,"[Den Helder, Alkmaar, Hoorn, Zaandam, Amsterdam Sloterdijk, Zaandam, Amsterdam Sloterdijk, Haarlem]"
train_2,"[Hoorn, Alkmaar, Den Helder, Alkmaar]"
train_3,"[Dordrecht, Rotterdam Centraal, Dordrecht, Rotterdam Centraal, Schiedam Centrum, Rotterdam Centraal, Rotterdam Alexander, Gouda, Rotterdam Alexander, Rotterdam Centraal, Rotterdam Alexander, Rotterdam Centraal]"
train_4,"[Hoorn, Zaandam, Beverwijk, Castricum, Alkmaar, Hoorn]"
train_5,"[Den Helder, Alkmaar, Hoorn, Alkmaar, Castricum, Alkmaar]"
train_6,"[Zaandam, Castricum, Beverwijk, Haarlem, Amsterdam Sloterdijk, Amsterdam Centraal, Amsterdam Amstel, Amsterdam Zuid, Amsterdam Sloterdijk, Amsterdam Centraal, Amsterdam Sloterdijk, Zaandam]"
train_7,"[Den Haag Centraal, Delft, Schiedam Centrum, Rotterdam Centraal, Dordrecht, Rotterdam Centraal, Schiedam Centrum, Delft, Den Haag Centraal, Gouda]"
score,6161.0
