train,stations
train_1,"[Schiphol Airport, Leiden Centraal, Heemstede-Aerdenhout, Haarlem, Beverwijk, Castricum, Zaandam, Hoorn]"
train_2,"[Castricum, Zaandam, Amsterdam Sloterdijk, Amsterdam Centraal, Amsterdam Amstel, Amsterdam Zuid, Amsterdam Sloterdijk, Zaandam, Amsterdam Sloterdijk, Haarlem, Heemstede-Aerdenhout, Haarlem, Amsterdam Sloterdijk, Zaandam]"
train_3,"[Delft, Den Haag Centraal, Leiden Centraal, Den Haag Centraal, Gouda, Den Haag Centraal, Leiden Centraal, Schiphol Airport, Leiden Centraal]"
train_4,"[Hoorn, Zaandam, Castricum, Zaandam, Castricum, Zaandam, Castricum, Alkmaar]"
train_5,"[Delft, Den Haag Centraal, Gouda, Rotterdam Alexander, Rotterdam Centraal, Rotterdam Alexander, Gouda, Rotterdam Alexander, Gouda, Rotterdam Alexander, Rotterdam Centraal]"
train_6,"[Alkmaar, Castricum, Zaandam, Castricum, Alkmaar, Den Helder, Alkmaar]"
train_7,"[Den Helder, Alkmaar, Castricum, Zaandam, Castricum, Alkmaar, Castricum, Zaandam]"
score,5703.857142857143
