train,stations
train_1,"[Den Helder, Alkmaar, Hoorn, Alkmaar, Castricum, Beverwijk, Castricum]"
train_2,"[Beverwijk, Zaandam, Castricum, Zaandam, Hoorn, Zaandam]"
train_3,"[Alkmaar, Den Helder, Alkmaar, Castricum, Alkmaar]"
train_4,"[Alkmaar, Hoorn, Alkmaar, Den Helder]"
train_5,"[Haarlem, Amsterdam Sloterdijk, Amsterdam Zuid, Schiphol Airport, Leiden Centraal, Schiphol Airport, Amsterdam Zuid, Amsterdam Amstel, Amsterdam Zuid, Schiphol Airport, Leiden Centraal]"
train_6,"[Schiphol Airport, Amsterdam Zuid, Amsterdam Sloterdijk, Zaandam, Hoorn, Alkmaar, Hoorn]"
train_7,"[Zaandam, Amsterdam Sloterdijk, Haarlem, Amsterdam Sloterdijk, Amsterdam Zuid, Schiphol Airport, Amsterdam Zuid, Amsterdam Sloterdijk, Amsterdam Centraal, Amsterdam Amstel, Amsterdam Zuid, Amsterdam Sloterdijk, Amsterdam Centraal]"
score,4017.142857142857
