train,stations
train_1,"[Dordrecht, Rotterdam Centraal, Schiedam Centrum, Delft, Schiedam Centrum, Rotterdam Centraal, Dordrecht, Rotterdam Centraal, Schiedam Centrum, Rotterdam Centraal, Dordrecht, Rotterdam Centraal]"
train_2,"[Dordrecht, Rotterdam Centraal, Dordrecht, Rotterdam Centraal, Dordrecht, Rotterdam Centraal, Schiedam Centrum, Delft, Den Haag Centraal]"
train_3,"[Hoorn, Alkmaar, Castricum, Alkmaar, Den Helder, Alkmaar]"
train_4,"[Den Helder, Alkmaar, Den Helder, Alkmaar]"
train_5,"[Beverwijk, Zaandam, Castricum, Beverwijk, Castricum, Alkmaar, Hoorn]"
train_6,"[Rotterdam Centraal, Rotterdam Alexander, Rotterdam Centraal, Schiedam Centrum, Delft, Schiedam Centrum, Rotterdam Centraal, Dordrecht, Rotterdam Centraal, Dordrecht, Rotterdam Centraal, Schiedam Centrum]"
train_7,"[Alphen a/d Rijn, Leiden Centraal, Schiphol Airport, Leiden Centraal, Alphen a/d Rijn, Gouda, Alphen a/d Rijn, Gouda]"
score,3734.0
