train,stations
train_1,"[Rotterdam Centraal, Dordrecht, Rotterdam Centraal, Dordrecht, Rotterdam Centraal, Schiedam Centrum, Delft, Schiedam Centrum, Rotterdam Centraal, Dordrecht]"
train_2,"[Beverwijk, Zaandam, Beverwijk, Castricum, Alkmaar, Hoorn]"
train_3,"[Rotterdam Alexander, Rotterdam Centraal, Dordrecht, Rotterdam Centraal, Rotterdam Alexander, Rotterdam Centraal, Rotterdam Alexander, Gouda, Alphen a/d Rijn, Leiden Centraal]"
train_4,"[Rotterdam Centraal, Dordrecht, Rotterdam Centraal, Rotterdam Alexander, Rotterdam Centraal, Dordrecht, Rotterdam Centraal, Schiedam Centrum, Rotterdam Centraal, Schiedam Centrum, Delft, Den Haag Centraal]"
train_5,"[Rotterdam Centraal, Dordrecht, Rotterdam Centraal, Rotterdam Alexander, Gouda, Rotterdam Alexander, Gouda, Alphen a/d Rijn, Leiden Centraal, Alphen a/d Rijn]"
train_6,"[Delft, Den Haag Centraal, Delft, Schiedam Centrum, Delft, Schiedam Centrum, Rotterdam Centraal, Dordrecht, Rotterdam Centraal, Dordrecht]"
train_7,"[Gouda, Rotterdam Alexander, Rotterdam Centraal, Schiedam Centrum, Delft, Schiedam Centrum, Rotterdam Centraal, Rotterdam Alexander, Gouda, Den Haag Centraal, Gouda, Alphen a/d Rijn]"
score,3275.857142857143
