train,stations
train_1,"[Rotterdam Centraal, Schiedam Centrum, Delft, Schiedam Centrum, Delft, Den Haag Centraal, Gouda, Den Haag Centraal, Delft, Den Haag Centraal, Delft]"
train_2,"[Den Haag Centraal, Leiden Centraal, Heemstede-Aerdenhout, Leiden Centraal, Alphen a/d Rijn, Leiden Centraal, Heemstede-Aerdenhout, Leiden Centraal, Schiphol Airport, Amsterdam Zuid]"
train_3,"[Amsterdam Amstel, Amsterdam Zuid, Amsterdam Sloterdijk, Haarlem, Beverwijk, Zaandam, Amsterdam Sloterdijk, Amsterdam Centraal, Amsterdam Sloterdijk, Amsterdam Centraal, Amsterdam Amstel]"
train_4,"[Castricum, Alkmaar, Castricum, Alkmaar, Hoorn, Alkmaar, Castricum, Alkmaar, Castricum, Beverwijk]"
train_5,"[Dordrecht, Rotterdam Centraal, Rotterdam Alexander, Rotterdam Centraal, Rotterdam Alexander, Gouda, Rotterdam Alexander, Rotterdam Centraal, Dordrecht, Rotterdam Centraal]"
train_6,"[Hoorn, Zaandam, Hoorn, Alkmaar, Hoorn]"
train_7,"[Zaandam, Castricum, Zaandam, Castricum, Alkmaar, Den Helder, Alkmaar]"
score,8026.714285714286
