train,stations
train_1,"[Haarlem, Heemstede-Aerdenhout, Haarlem, Beverwijk, Haarlem, Heemstede-Aerdenhout, Leiden Centraal, Schiphol Airport, Leiden Centraal, Alphen a/d Rijn]"
train_2,"[Zaandam, Hoorn, Alkmaar, Castricum, Zaandam, Amsterdam Sloterdijk, Amsterdam Zuid, Schiphol Airport, Leiden Centraal]"
train_3,"[Delft, Schiedam Centrum, Rotterdam Centraal, Dordrecht, Rotterdam Centraal, Schiedam Centrum, Delft, Den Haag Centraal, Gouda, Rotterdam Alexander, Gouda]"
train_4,"[Beverwijk, Castricum, Beverwijk, Castricum, Beverwijk, Zaandam, Beverwijk, Haarlem]"
train_5,"[Amsterdam Centraal, Amsterdam Amstel, Amsterdam Centraal, Amsterdam Sloterdijk, Zaandam, Castricum, Alkmaar, Den Helder]"
train_6,"[Gouda, Rotterdam Alexander, Gouda, Rotterdam Alexander, Rotterdam Centraal, Rotterdam Alexander, Gouda, Alphen a/d Rijn, Leiden Centraal, Heemstede-Aerdenhout, Haarlem]"
train_7,"[Amsterdam Sloterdijk, Amsterdam Centraal, Amsterdam Sloterdijk, Haarlem, Heemstede-Aerdenhout, Leiden Centraal, Alphen a/d Rijn, Leiden Centraal, Den Haag Centraal, Delft, Den Haag Centraal]"
score,8193.857142857143
