train,stations
train_1,"[Den Haag Centraal, Delft, Den Haag Centraal, Leiden Centraal, Alphen a/d Rijn, Leiden Centraal, Alphen a/d Rijn, Gouda, Alphen a/d Rijn]"
train_2,"[Gouda, Alphen a/d Rijn, Gouda, Rotterdam Alexander, Rotterdam Centraal, Dordrecht, Rotterdam Centraal, Rotterdam Alexander, Rotterdam Centraal, Schiedam Centrum, Delft]"
train_3,"[Castricum, Beverwijk, Zaandam, Castricum, Zaandam, Beverwijk, Castricum, Alkmaar]"
train_4,"[Schiedam Centrum, Rotterdam Centraal, Schiedam Centrum, Rotterdam Centraal, Rotterdam Alexander, Rotterdam Centraal, Dordrecht, Rotterdam Centraal, Schiedam Centrum, Rotterdam Centraal, Rotterdam Alexander, Rotterdam Centraal, Dordrecht]"
train_5,"[Alphen a/d Rijn, Leiden Centraal, Heemstede-Aerdenhout, Haarlem, Beverwijk, Haarlem, Beverwijk, Zaandam, Castricum]"
train_6,"[Alphen a/d Rijn, Leiden Centraal, Den Haag Centraal, Gouda, Rotterdam Alexander, Gouda, Den Haag Centraal, Gouda, Rotterdam Alexander, Rotterdam Centraal]"
train_7,"[Dordrecht, Rotterdam Centraal, Schiedam Centrum, Rotterdam Centraal, Rotterdam Alexander, Gouda, Den Haag Centraal, Leiden Centraal, Heemstede-Aerdenhout, Haarlem, Amsterdam Sloterdijk, Haarlem]"
score,4923.571428571429
