train,stations
train_1,"[Leiden Centraal, Schiphol Airport, Leiden Centraal, Den Haag Centraal, Delft, Schiedam Centrum, Rotterdam Centraal, Rotterdam Alexander, Gouda, Alphen a/d Rijn]"
train_2,"[Delft, Schiedam Centrum, Rotterdam Centraal, Dordrecht, Rotterdam Centraal, Dordrecht, Rotterdam Centraal, Rotterdam Alexander, Rotterdam Centraal, Rotterdam Alexander, Gouda]"
train_3,"[Amsterdam Centraal, Amsterdam Sloterdijk, Haarlem, Beverwijk, Haarlem, Heemstede-Aerdenhout, Leiden Centraal, Schiphol Airport, Amsterdam Zuid, Amsterdam Sloterdijk]"
train_4,"[Haarlem, Amsterdam Sloterdijk, Zaandam, Hoorn, Zaandam, Amsterdam Sloterdijk, Amsterdam Centraal, Amsterdam Amstel, Amsterdam Zuid, Amsterdam Amstel, Amsterdam Zuid]"
train_5,"[Castricum, Beverwijk, Zaandam, Beverwijk, Zaandam, Amsterdam Sloterdijk, Amsterdam Zuid]"
train_6,"[Hoorn, Alkmaar, Den Helder, Alkmaar, Castricum, Zaandam]"
train_7,"[Den Haag Centraal, Delft, Den Haag Centraal, Gouda, Alphen a/d Rijn, Gouda, Rotterdam Alexander, Rotterdam Centraal, Dordrecht]"
score,8156.857142857143
