train,stations
train_1,"[Schiphol Airport, Leiden Centraal, Den Haag Centraal, Gouda, Alphen a/d Rijn, Leiden Centraal, Schiphol Airport, Leiden Centraal]"
train_2,"[Haarlem, Heemstede-Aerdenhout, Haarlem, Heemstede-Aerdenhout, Leiden Centraal, Den Haag Centraal, Delft, Den Haag Centraal, Gouda, Alphen a/d Rijn]"
train_3,"[Amsterdam Sloterdijk, Zaandam, Castricum, Beverwijk, Castricum, Alkmaar, Hoorn, Alkmaar]"
train_4,"[Delft, Den Haag Centraal, Gouda, Alphen a/d Rijn, Gouda, Alphen a/d Rijn, Gouda]"
train_5,"[Den Haag Centraal, Delft, Den Haag Centraal, Gouda, Alphen a/d Rijn, Gouda, Alphen a/d Rijn]"
train_6,"[Heemstede-Aerdenhout, Leiden Centraal, Schiphol Airport, Leiden Centraal, Alphen a/d Rijn, Gouda, Den Haag Centraal, Delft]"
train_7,"[Alphen a/d Rijn, Leiden Centraal, Schiphol Airport, Amsterdam Zuid, Schiphol Airport, Amsterdam Zuid, Amsterdam Amstel, Amsterdam Centraal, Amsterdam Amstel, Amsterdam Zuid, Amsterdam Sloterdijk, Zaandam, Castricum]"
score,4832.428571428571
