train,stations
train_1,"[Haarlem, Heemstede-Aerdenhout, Haarlem, Beverwijk, Zaandam, Hoorn, Alkmaar]"
train_2,"[Zaandam, Beverwijk, Zaandam, Amsterdam Sloterdijk, Amsterdam Centraal, Amsterdam Amstel, Amsterdam Centraal, Amsterdam Sloterdijk, Zaandam, Amsterdam Sloterdijk, Amsterdam Centraal, Amsterdam Sloterdijk, Zaandam]"
train_3,"[Castricum, Beverwijk, Castricum, Alkmaar, Castricum, Zaandam, Hoorn, Alkmaar]"
train_4,"[Alkmaar, Den Helder, Alkmaar, Hoorn]"
train_5,"[Den Helder, Alkmaar, Den Helder, Alkmaar, Castricum]"
train_6,"[Den Helder, Alkmaar, Hoorn, Alkmaar]"
train_7,"[Schiedam Centrum, Delft, Schiedam Centrum, Rotterdam Centraal, Schiedam Centrum, Rotterdam Centraal, Dordrecht, Rotterdam Centraal, Dordrecht, Rotterdam Centraal, Rotterdam Alexander, Rotterdam Centraal, Schiedam Centrum]"
score,4474.285714285714
