train,stations
train_1,"[Alphen a/d Rijn, Gouda, Alphen a/d Rijn, Leiden Centraal, Den Haag Centraal, Delft, Den Haag Centraal, Leiden Centraal, Den Haag Centraal]"
train_2,"[Alkmaar, Castricum, Alkmaar, Castricum, Beverwijk, Zaandam, Amsterdam Sloterdijk, Zaandam, Castricum, Beverwijk]"
train_3,"[Haarlem, Beverwijk, Zaandam, Beverwijk, Castricum, Alkmaar, Castricum, Beverwijk]"
train_4,"[Amsterdam Centraal, Amsterdam Sloterdijk, Haarlem, Heemstede-Aerdenhout, Haarlem, Heemstede-Aerdenhout, Haarlem, Amsterdam Sloterdijk, Amsterdam Centraal, Amsterdam Amstel, Amsterdam Zuid, Schiphol Airport, Amsterdam Zuid, Schiphol Airport, Leiden Centraal]"
train_5,"[Den Helder, Alkmaar, Castricum, Alkmaar, Den Helder]"
train_6,"[Amsterdam Zuid, Schiphol Airport, Leiden Centraal, Schiphol Airport, Leiden Centraal, Den Haag Centraal, Delft, Den Haag Centraal, Delft, Schiedam Centrum, Delft]"
train_7,"[Hoorn, Alkmaar, Castricum, Zaandam, Castricum, Zaandam, Hoorn]"
score,6064.0
