train,stations
train_1,"[Delft, Schiedam Centrum, Delft, Den Haag Centraal, Delft, Den Haag Centraal, Delft, Schiedam Centrum, Delft, Den Haag Centraal, Leiden Centraal]"
train_2,"[Zaandam, Beverwijk, Haarlem, Heemstede-Aerdenhout, Leiden Centraal, Alphen a/d Rijn, Gouda, Alphen a/d Rijn]"
train_3,"[Alphen a/d Rijn, Gouda, Rotterdam Alexander, Gouda, Rotterdam Alexander, Rotterdam Centraal, Schiedam Centrum, Rotterdam Centraal, Dordrecht, Rotterdam Centraal, Schiedam Centrum, Delft]"
train_4,"[Leiden Centraal, Schiphol Airport, Amsterdam Zuid, Amsterdam Sloterdijk, Amsterdam Zuid, Amsterdam Amstel, Amsterdam Centraal, Amsterdam Sloterdijk, Amsterdam Zuid, Amsterdam Sloterdijk]"
train_5,"[Schiedam Centrum, Delft, Schiedam Centrum, Rotterdam Centraal, Dordrecht, Rotterdam Centraal, Schiedam Centrum, Delft, Den Haag Centraal, Gouda, Den Haag Centraal]"
train_6,"[Schiedam Centrum, Rotterdam Centraal, Rotterdam Alexander, Gouda, Rotterdam Alexander, Gouda, Alphen a/d Rijn, Leiden Centraal, Schiphol Airport, Leiden Centraal]"
train_7,"[Amsterdam Sloterdijk, Amsterdam Centraal, Amsterdam Sloterdijk, Zaandam, Beverwijk, Zaandam, Beverwijk, Haarlem]"
score,6818.142857142857
