train,stations
train_1,"[Den Helder, Alkmaar, Castricum, Zaandam, Beverwijk, Haarlem, Amsterdam Sloterdijk, Zaandam]"
train_2,"[Alkmaar, Hoorn, Alkmaar, Den Helder]"
train_3,"[Castricum, Alkmaar, Hoorn, Zaandam, Amsterdam Sloterdijk, Amsterdam Zuid, Schiphol Airport, Amsterdam Zuid, Schiphol Airport, Leiden Centraal]"
train_4,"[Gouda, Alphen a/d Rijn, Leiden Centraal, Heemstede-Aerdenhout, Leiden Centraal, Schiphol Airport, Amsterdam Zuid, Amsterdam Amstel, Amsterdam Zuid, Amsterdam Amstel]"
train_5,"[Den Haag Centraal, Gouda, Rotterdam Alexander, Rotterdam Centraal, Dordrecht, Rotterdam Centraal, Rotterdam Alexander, Rotterdam Centraal, Schiedam Centrum, Delft, Den Haag Centraal]"
train_6,"[Schiphol Airport, Amsterdam Zuid, Amsterdam Sloterdijk, Amsterdam Centraal, Amsterdam Sloterdijk, Haarlem, Heemstede-Aerdenhout, Leiden Centraal, Den Haag Centraal, Delft, Schiedam Centrum, Rotterdam Centraal, Dordrecht]"
train_7,"[Zaandam, Castricum, Beverwijk, Castricum, Alkmaar, Castricum, Alkmaar, Hoorn, Zaandam]"
score,8369.857142857143
