train,stations
train_1,"[Amsterdam Centraal, Amsterdam Amstel, Amsterdam Zuid, Amsterdam Amstel, Amsterdam Zuid, Amsterdam Sloterdijk, Zaandam, Hoorn, Alkmaar, Castricum]"
train_2,"[Alphen a/d Rijn, Gouda, Alphen a/d Rijn, Leiden Centraal, Den Haag Centraal, Delft, Schiedam Centrum, Delft, Schiedam Centrum, Rotterdam Centraal, Rotterdam Alexander, Rotterdam Centraal]"
train_3,"[Amsterdam Amstel, Amsterdam Centraal, Amsterdam Amstel, Amsterdam Centraal, Amsterdam Amstel, Amsterdam Zuid, Amsterdam Sloterdijk, Amsterdam Zuid, Amsterdam Sloterdijk, Amsterdam Centraal, Amsterdam Amstel, Amsterdam Centraal]"
train_4,"[Gouda, Rotterdam Alexander, Gouda, Rotterdam Alexander, Gouda, Rotterdam Alexander, Rotterdam Centraal, Dordrecht, Rotterdam Centraal, Dordrecht]"
train_5,"[Delft, Den Haag Centraal, Gouda, Rotterdam Alexander, Gouda, Den Haag Centraal, Delft, Schiedam Centrum, Rotterdam Centraal, Dordrecht]"
train_6,"[Amsterdam Sloterdijk, Haarlem, Heemstede-Aerdenhout, Haarlem, Beverwijk, Zaandam, Castricum, Beverwijk, Zaandam]"
train_7,"[Alkmaar, Den Helder, Alkmaar, Den Helder]"
score,7548.571428571429
