train,stations
train_1,"[Beverwijk, Castricum, Beverwijk, Zaandam, Beverwijk, Haarlem, Amsterdam Sloterdijk, Haarlem]"
train_2,"[Haarlem, Heemstede-Aerdenhout, Leiden Centraal, Heemstede-Aerdenhout, Leiden Centraal, Den Haag Centraal, Delft, Schiedam Centrum, Delft, Den Haag Centraal, Leiden Centraal]"
train_3,"[Hoorn, Zaandam, Beverwijk, Zaandam, Beverwijk, Castricum]"
train_4,"[Schiedam Centrum, Delft, Schiedam Centrum, Delft, Schiedam Centrum, Rotterdam Centraal, Dordrecht, Rotterdam Centraal, Schiedam Centrum, Delft, Schiedam Centrum, Rotterdam Centraal, Rotterdam Alexander, Rotterdam Centraal, Schiedam Centrum, Rotterdam Centraal]"
train_5,"[Schiphol Airport, Amsterdam Zuid, Amsterdam Sloterdijk, Amsterdam Centraal, Amsterdam Sloterdijk, Zaandam, Hoorn, Zaandam, Hoorn]"
train_6,"[Zaandam, Hoorn, Alkmaar, Den Helder]"
train_7,"[Den Haag Centraal, Gouda, Den Haag Centraal, Leiden Centraal, Heemstede-Aerdenhout, Haarlem, Heemstede-Aerdenhout, Haarlem, Beverwijk]"
score,5898.857142857143
