train,stations
train_1,"[Schiphol Airport, Amsterdam Zuid, Amsterdam Sloterdijk, Amsterdam Zuid, Amsterdam Amstel, Amsterdam Zuid, Schiphol Airport, Amsterdam Zuid, Amsterdam Sloterdijk, Haarlem, Amsterdam Sloterdijk, Amsterdam Centraal]"
train_2,"[Beverwijk, Haarlem, Beverwijk, Zaandam, Beverwijk, Zaandam]"
train_3,"[Rotterdam Alexander, Rotterdam Centraal, Rotterdam Alexander, Rotterdam Centraal, Schiedam Centrum, Delft, Schiedam Centrum, Delft, Den Haag Centraal, Gouda, Den Haag Centraal, Delft]"
train_4,"[Rotterdam Centraal, Dordrecht, Rotterdam Centraal, Dordrecht, Rotterdam Centraal, Schiedam Centrum, Rotterdam Centraal, Schiedam Centrum, Delft, Schiedam Centrum, Rotterdam Centraal, Rotterdam Alexander]"
train_5,"[Castricum, Zaandam, Amsterdam Sloterdijk, Zaandam, Castricum, Zaandam, Castricum, Beverwijk, Zaandam]"
train_6,"[Zaandam, Castricum, Zaandam, Castricum, Alkmaar, Castricum, Beverwijk, Castricum, Alkmaar, Hoorn]"
train_7,"[Schiedam Centrum, Delft, Schiedam Centrum, Rotterdam Centraal, Schiedam Centrum, Rotterdam Centraal, Schiedam Centrum, Delft, Schiedam Centrum, Delft, Den Haag Centraal, Gouda, Den Haag Centraal]"
score,5551.714285714286
