train,stations
train_1,"[Den Helder, Alkmaar, Castricum, Beverwijk, Haarlem, Amsterdam Sloterdijk, Haarlem, Beverwijk]"
train_2,"[Castricum, Alkmaar, Hoorn, Alkmaar, Castricum, Beverwijk, Castricum, Beverwijk]"
train_3,"[Alkmaar, Den Helder, Alkmaar, Hoorn]"
train_4,"[Schiphol Airport, Leiden Centraal, Schiphol Airport, Amsterdam Zuid, Schiphol Airport, Amsterdam Zuid, Amsterdam Amstel, Amsterdam Centraal, Amsterdam Amstel, Amsterdam Centraal, Amsterdam Sloterdijk, Haarlem, Beverwijk]"
train_5,"[Zaandam, Amsterdam Sloterdijk, Amsterdam Centraal, Amsterdam Amstel, Amsterdam Centraal, Amsterdam Amstel, Amsterdam Centraal, Amsterdam Sloterdijk, Amsterdam Zuid, Amsterdam Sloterdijk, Amsterdam Centraal, Amsterdam Sloterdijk, Zaandam]"
train_6,"[Zaandam, Beverwijk, Zaandam, Hoorn, Zaandam, Amsterdam Sloterdijk, Zaandam]"
train_7,"[Amsterdam Centraal, Amsterdam Sloterdijk, Zaandam, Amsterdam Sloterdijk, Amsterdam Centraal, Amsterdam Sloterdijk, Haarlem, Beverwijk, Castricum, Alkmaar, Castricum, Alkmaar]"
score,3918.142857142857
