train,stations
train_1,"[Rotterdam Alexander, Rotterdam Centraal, Schiedam Centrum, Delft, Schiedam Centrum, Rotterdam Centraal, Dordrecht, Rotterdam Centraal, Schiedam Centrum, Rotterdam Centraal, Dordrecht, Rotterdam Centraal, Schiedam Centrum]"
train_2,"[Den Haag Centraal, Leiden Centraal, Heemstede-Aerdenhout, Leiden Centraal, Den Haag Centraal, Delft, Schiedam Centrum, Delft, Den Haag Centraal, Delft, Schiedam Centrum, Rotterdam Centraal]"
train_3,"[Dordrecht, Rotterdam Centraal, Dordrecht, Rotterdam Centraal, Dordrecht, Rotterdam Centraal, Schiedam Centrum, Rotterdam Centraal, Schiedam Centrum, Rotterdam Centraal, Schiedam Centrum, Rotterdam Centraal]"
train_4,"[Alphen a/d Rijn, Gouda, Alphen a/d Rijn, Gouda, Den Haag Centraal, Delft, Schiedam Centrum, Delft, Schiedam Centrum, Delft]"
train_5,"[Dordrecht, Rotterdam Centraal, Schiedam Centrum, Delft, Den Haag Centraal, Gouda, Alphen a/d Rijn, Gouda, Alphen a/d Rijn]"
train_6,"[Rotterdam Centraal, Schiedam Centrum, Delft, Schiedam Centrum, Rotterdam Centraal, Rotterdam Alexander, Gouda, Alphen a/d Rijn, Gouda, Alphen a/d Rijn, Gouda]"
train_7,"[Amsterdam Zuid, Amsterdam Sloterdijk, Amsterdam Zuid, Amsterdam Sloterdijk, Zaandam, Castricum, Beverwijk, Zaandam, Castricum]"
score,3960.142857142857
