train,stations
train_1,"[Schiedam Centrum, Delft, Den Haag Centraal, Leiden Centraal, Schiphol Airport, Leiden Centraal, Den Haag Centraal, Delft, Den Haag Centraal, Delft]"
train_2,"[Alphen a/d Rijn, Leiden Centraal, Heemstede-Aerdenhout, Leiden Centraal, Alphen a/d Rijn, Leiden Centraal, Den Haag Centraal, Delft, Den Haag Centraal, Leiden Centraal]"
train_3,"[Heemstede-Aerdenhout, Leiden Centraal, Heemstede-Aerdenhout, Leiden Centraal, Den Haag Centraal, Gouda, Alphen a/d Rijn, Leiden Centraal, Den Haag Centraal]"
train_4,"[Alphen a/d Rijn, Leiden Centraal, Alphen a/d Rijn, Gouda, Alphen a/d Rijn, Leiden Centraal, Heemstede-Aerdenhout, Leiden Centraal]"
train_5,"[Alkmaar, Den Helder, Alkmaar, Castricum, Beverwijk, Haarlem]"
train_6,"[Hoorn, Zaandam, Beverwijk, Castricum, Beverwijk, Zaandam]"
train_7,"[Alphen a/d Rijn, Gouda, Den Haag Centraal, Gouda, Rotterdam Alexander, Gouda, Den Haag Centraal, Delft, Schiedam Centrum]"
score,4213.142857142857
