train,stations
train_1,"[Rotterdam Alexander, Gouda, Den Haag Centraal, Delft, Schiedam Centrum, Rotterdam Centraal, Dordrecht, Rotterdam Centraal, Rotterdam Alexander, Gouda]"
train_2,"[Den Helder, Alkmaar, Den Helder, Alkmaar]"
train_3,"[Alphen a/d Rijn, Gouda, Den Haag Centraal, Delft, Den Haag Centraal, Delft, Schiedam Centrum, Rotterdam Centraal, Dordrecht]"
train_4,"[Delft, Den Haag Centraal, Delft, Schiedam Centrum, Rotterdam Centraal, Schiedam Centrum, Delft, Den Haag Centraal, Leiden Centraal, Heemstede-Aerdenhout, Leiden Centraal, Alphen a/d Rijn]"
train_5,"[Heemstede-Aerdenhout, Leiden Centraal, Alphen a/d Rijn, Leiden Centraal, Alphen a/d Rijn, Leiden Centraal, Den Haag Centraal, Leiden Centraal, Alphen a/d Rijn]"
train_6,"[Delft, Schiedam Centrum, Delft, Den Haag Centraal, Delft, Den Haag Centraal, Leiden Centraal, Alphen a/d Rijn, Leiden Centraal, Schiphol Airport]"
train_7,"[Heemstede-Aerdenhout, Leiden Centraal, Alphen a/d Rijn, Gouda, Alphen a/d Rijn, Leiden Centraal, Den Haag Centraal, Gouda]"
score,3185.857142857143
