train,stations
train_1,"[Haarlem, Beverwijk, Zaandam, Hoorn, Alkmaar, Hoorn]"
train_2,"[Den Helder, Alkmaar, Hoorn, Alkmaar, Castricum, Alkmaar]"
train_3,"[Amsterdam Sloterdijk, Zaandam, Hoorn, Alkmaar, Den Helder]"
train_4,"[Hoorn, Alkmaar, Hoorn, Alkmaar, Den Helder]"
train_5,"[Heemstede-Aerdenhout, Haarlem, Heemstede-Aerdenhout, Leiden Centraal, Heemstede-Aerdenhout, Haarlem, Beverwijk, Zaandam, Hoorn]"
train_6,"[Amsterdam Zuid, Amsterdam Amstel, Amsterdam Zuid, Amsterdam Sloterdijk, Haarlem, Beverwijk, Haarlem, Beverwijk, Castricum]"
train_7,"[Castricum, Beverwijk, Haarlem, Heemstede-Aerdenhout, Leiden Centraal, Schiphol Airport, Amsterdam Zuid, Amsterdam Sloterdijk, Amsterdam Centraal, Amsterdam Sloterdijk, Haarlem]"
score,4735.428571428571
