train,stations
train_1,"[Dordrecht, Rotterdam Centraal, Dordrecht, Rotterdam Centraal, Dordrecht, Rotterdam Centraal, Schiedam Centrum, Delft, Den Haag Centraal]"
train_2,"[Zaandam, Hoorn, Alkmaar, Den Helder]"
train_3,"[Delft, Schiedam Centrum, Delft, Schiedam Centrum, Rotterdam Centraal, Schiedam Centrum, Rotterdam Centraal, Schiedam Centrum, Rotterdam Centraal, Schiedam Centrum, Rotterdam Centraal, Dordrecht, Rotterdam Centraal, Rotterdam Alexander, Gouda]"
train_4,"[Amsterdam Zuid, Schiphol Airport, Amsterdam Zuid, Amsterdam Sloterdijk, Amsterdam Zuid, Amsterdam Amstel, Amsterdam Zuid, Schiphol Airport, Amsterdam Zuid, Schiphol Airport, Leiden Centraal, Alphen a/d Rijn]"
train_5,"[Alphen a/d Rijn, Gouda, Den Haag Centraal, Gouda, Den Haag Centraal, Delft, Den Haag Centraal, Leiden Centraal]"
train_6,"[Zaandam, Amsterdam Sloterdijk, Haarlem, Amsterdam Sloterdijk, Amsterdam Centraal, Amsterdam Sloterdijk, Zaandam, Hoorn, Alkmaar, Castricum, Beverwijk]"
train_7,"[Castricum, Alkmaar, Den Helder, Alkmaar, Hoorn]"
score,6408.142857142857
