train,stations
train_1,"[Rotterdam Alexander, Gouda, Alphen a/d Rijn, Gouda, Alphen a/d Rijn, Gouda, Rotterdam Alexander, Rotterdam Centraal]"
train_2,"[Alkmaar, Hoorn, Alkmaar, Den Helder]"
train_3,"[Delft, Den Haag Centraal, Gouda, Den Haag Centraal, Leiden Centraal, Alphen a/d Rijn, Gouda, Den Haag Centraal]"
train_4,"[Beverwijk, Zaandam, Castricum, Zaandam, Hoorn, Alkmaar]"
train_5,"[Leiden Centraal, Den Haag Centraal, Gouda, Rotterdam Alexander, Rotterdam Centraal, Dordrecht, Rotterdam Centraal, Schiedam Centrum, Delft, Schiedam Centrum, Delft, Schiedam Centrum]"
train_6,"[Gouda, Alphen a/d Rijn, Gouda, Rotterdam Alexander, Rotterdam Centraal, Rotterdam Alexander, Rotterdam Centraal, Dordrecht, Rotterdam Centraal]"
train_7,"[Alkmaar, Castricum, Alkmaar, Den Helder, Alkmaar]"
score,4388.285714285714
