train,stations
train_1,"[Castricum, Beverwijk, Zaandam, Hoorn, Zaandam, Castricum, Alkmaar]"
train_2,"[Den Helder, Alkmaar, Den Helder, Alkmaar, Castricum]"
train_3,"[Castricum, Beverwijk, Haarlem, Beverwijk, Haarlem, Beverwijk, Castricum, Beverwijk, Haarlem]"
train_4,"[Schiphol Airport, Leiden Centraal, Heemstede-Aerdenhout, Haarlem, Beverwijk, Castricum, Beverwijk, Haarlem, Heemstede-Aerdenhout, Leiden Centraal]"
train_5,"[Amsterdam Centraal, Amsterdam Amstel, Amsterdam Zuid, Amsterdam Amstel, Amsterdam Zuid, Amsterdam Amstel, Amsterdam Zuid, Amsterdam Sloterdijk, Amsterdam Centraal, Amsterdam Sloterdijk, Haarlem, Amsterdam Sloterdijk, Amsterdam Centraal]"
train_6,"[Amsterdam Amstel, Amsterdam Centraal, Amsterdam Amstel, Amsterdam Centraal, Amsterdam Amstel, Amsterdam Zuid, Amsterdam Sloterdijk, Amsterdam Zuid, Schiphol Airport, Amsterdam Zuid, Amsterdam Amstel, Amsterdam Centraal, Amsterdam Sloterdijk, Amsterdam Centraal]"
train_7,"[Den Helder, Alkmaar, Hoorn, Zaandam, Amsterdam Sloterdijk, Haarlem, Beverwijk]"
score,5146.571428571429
