train,stations
train_1,"[Schiedam Centrum, Rotterdam Centraal, Rotterdam Alexander, Rotterdam Centraal, Rotterdam Alexander, Rotterdam Centraal, Dordrecht, Rotterdam Centraal, Schiedam Centrum, Rotterdam Centraal, Schiedam Centrum, Rotterdam Centraal, Dordrecht]"
train_2,"[Hoorn, Zaandam, Beverwijk, Zaandam, Castricum, Zaandam, Amsterdam Sloterdijk, Haarlem]"
train_3,"[Castricum, Zaandam, Hoorn, Alkmaar, Hoorn, Alkmaar, Castricum]"
train_4,"[Amsterdam Zuid, Amsterdam Sloterdijk, Amsterdam Centraal, Amsterdam Sloterdijk, Amsterdam Zuid, Schiphol Airport, Leiden Centraal, Heemstede-Aerdenhout, Leiden Centraal, Schiphol Airport]"
train_5,"[Alkmaar, Hoorn, Zaandam, Beverwijk, Castricum, Zaandam, Castricum]"
train_6,"[Castricum, Alkmaar, Hoorn, Alkmaar, Hoorn, Zaandam, Castricum]"
train_7,"[Gouda, Rotterdam Alexander, Rotterdam Centraal, Dordrecht, Rotterdam Centraal, Rotterdam Alexander, Rotterdam Centraal, Rotterdam Alexander, Rotterdam Centraal, Dordrecht, Rotterdam Centraal]"
score,4572.428571428571
