train,stations
train_1,"[Den Helder, Alkmaar, Den Helder, Alkmaar]"
train_2,"[Beverwijk, Zaandam, Hoorn, Zaandam, Castricum, Alkmaar]"
train_3,"[Den Helder, Alkmaar, Hoorn, Zaandam, Hoorn]"
train_4,"[Amsterdam Amstel, Amsterdam Zuid, Amsterdam Sloterdijk, Haarlem, Amsterdam Sloterdijk, Haarlem, Heemstede-Aerdenhout, Haarlem, Heemstede-Aerdenhout, Haarlem, Amsterdam Sloterdijk, Amsterdam Zuid, Schiphol Airport]"
train_5,"[Beverwijk, Castricum, Beverwijk, Haarlem, Amsterdam Sloterdijk, Zaandam, Hoorn, Zaandam]"
train_6,"[Castricum, Zaandam, Amsterdam Sloterdijk, Amsterdam Zuid, Amsterdam Amstel, Amsterdam Zuid, Schiphol Airport, Leiden Centraal, Den Haag Centraal, Gouda]"
train_7,"[Zaandam, Beverwijk, Haarlem, Heemstede-Aerdenhout, Haarlem, Amsterdam Sloterdijk, Haarlem, Amsterdam Sloterdijk, Haarlem, Heemstede-Aerdenhout, Haarlem]"
score,4721.428571428571
