train,stations
train_1,"[Leiden Centraal, Den Haag Centraal, Leiden Centraal, Heemstede-Aerdenhout, Leiden Centraal, Alphen a/d Rijn, Leiden Centraal, Alphen a/d Rijn, Leiden Centraal, Den Haag Centraal]"
train_2,"[Gouda, Alphen a/d Rijn, Leiden Centraal, Den Haag Centraal, Delft, Den Haag Centraal, Leiden Centraal, Heemstede-Aerdenhout, Haarlem, Heemstede-Aerdenhout, Haarlem]"
train_3,"[Zaandam, Beverwijk, Haarlem, Beverwijk, Haarlem, Heemstede-Aerdenhout, Leiden Centraal, Alphen a/d Rijn]"
train_4,"[Alkmaar, Den Helder, Alkmaar, Hoorn]"
train_5,"[Amsterdam Amstel, Amsterdam Zuid, Amsterdam Sloterdijk, Amsterdam Centraal, Amsterdam Sloterdijk, Zaandam, Amsterdam Sloterdijk, Amsterdam Zuid, Amsterdam Sloterdijk, Amsterdam Centraal, Amsterdam Sloterdijk, Zaandam]"
train_6,"[Castricum, Beverwijk, Zaandam, Amsterdam Sloterdijk, Haarlem, Beverwijk, Zaandam]"
train_7,"[Den Helder, Alkmaar, Castricum, Alkmaar, Castricum, Beverwijk, Castricum, Beverwijk, Haarlem]"
score,4729.428571428571
