train,stations
train_1,"[Den Helder, Alkmaar, Den Helder, Alkmaar]"
train_2,"[Amsterdam Centraal, Amsterdam Amstel, Amsterdam Zuid, Schiphol Airport, Leiden Centraal, Alphen a/d Rijn, Leiden Centraal, Den Haag Centraal, Delft, Den Haag Centraal]"
train_3,"[Rotterdam Alexander, Gouda, Alphen a/d Rijn, Leiden Centraal, Den Haag Centraal, Leiden Centraal, Heemstede-Aerdenhout, Haarlem, Beverwijk, Haarlem]"
train_4,"[Den Helder, Alkmaar, Castricum, Alkmaar, Den Helder]"
train_5,"[Haarlem, Heemstede-Aerdenhout, Haarlem, Amsterdam Sloterdijk, Amsterdam Centraal, Amsterdam Sloterdijk, Zaandam, Castricum, Alkmaar, Den Helder]"
train_6,"[Alkmaar, Den Helder, Alkmaar, Hoorn]"
train_7,"[Alkmaar, Castricum, Alkmaar, Den Helder, Alkmaar, Hoorn]"
score,5452.714285714286
