train,stations
train_1,"[Hoorn, Alkmaar, Castricum, Alkmaar, Castricum, Alkmaar, Castricum, Alkmaar, Castricum, Alkmaar, Castricum, Alkmaar, Castricum, Alkmaar, Castricum, Alkmaar, Castricum, Alkmaar, Castricum]"
train_2,"[Steenwijk, Heerenveen, Steenwijk, Heerenveen, Steenwijk, Heerenveen, Steenwijk, Heerenveen, Steenwijk, Heerenveen, Steenwijk, Heerenveen, Steenwijk]"
train_3,"[Ede-Wageningen, Arnhem Centraal, Ede-Wageningen, Arnhem Centraal, Ede-Wageningen, Arnhem Centraal, Ede-Wageningen, Arnhem Centraal, Ede-Wageningen, Arnhem Centraal, Ede-Wageningen, Arnhem Centraal, Ede-Wageningen, Arnhem Centraal, Ede-Wageningen, Arnhem Centraal, Ede-Wageningen, Arnhem Centraal]"
train_4,"[s-Hertogenbosch, Oss, s-Hertogenbosch, Oss, s-Hertogenbosch, Oss, s-Hertogenbosch, Oss, s-Hertogenbosch, Oss, s-Hertogenbosch, Oss, s-Hertogenbosch, Oss, s-Hertogenbosch, Oss, s-Hertogenbosch]"
train_5,"[Heerlen, Sittard, Maastricht, Sittard, Maastricht, Sittard, Maastricht, Sittard, Maastricht, Sittard, Maastricht, Sittard]"
train_6,"[Leeuwarden, Heerenveen, Steenwijk, Heerenveen, Steenwijk, Heerenveen, Steenwijk, Heerenveen, Steenwijk, Heerenveen, Steenwijk, Heerenveen, Steenwijk]"
train_7,"[Lelystad Centrum, Almere Centrum, Lelystad Centrum, Almere Centrum, Lelystad Centrum, Almere Centrum, Lelystad Centrum, Almere Centrum, Lelystad Centrum, Almere Centrum, Lelystad Centrum, Almere Centrum, Lelystad Centrum]"
train_8,"[Nijmegen, Arnhem Centraal, Ede-Wageningen, Arnhem Centraal, Ede-Wageningen, Arnhem Centraal, Ede-Wageningen, Arnhem Centraal, Ede-Wageningen, Arnhem Centraal, Ede-Wageningen, Arnhem Centraal, Ede-Wageningen, Arnhem Centraal, Ede-Wageningen, Arnhem Centraal, Ede-Wageningen, Arnhem Centraal]"
train_9,"[Rotterdam Blaak, Rotterdam Alexander, Rotterdam Centraal, Schiedam Centrum, Rotterdam Centraal, Schiedam Centrum, Rotterdam Centraal, Schiedam Centrum, Rotterdam Centraal, Schiedam Centrum, Rotterdam Centraal, Schiedam Centrum, Rotterdam Centraal, Schiedam Centrum, Rotterdam Centraal, Schiedam Centrum, Rotterdam Centraal, Schiedam Centrum, Rotterdam Centraal, Schiedam Centrum, Rotterdam Centraal, Schiedam Centrum, Rotterdam Centraal, Schiedam Centrum, Rotterdam Centraal, Schiedam Centrum, Rotterdam Centraal, Schiedam Centrum, Rotterdam Centraal, Schiedam Centrum, Rotterdam Centraal, Schiedam Centrum, Rotterdam Centraal, Schiedam Centrum, Rotterdam Centraal]"
train_10,"[Dieren, Zutphen, Dieren, Zutphen, Dieren, Zutphen, Dieren, Zutphen, Dieren, Zutphen, Dieren, Zutphen, Dieren, Zutphen, Dieren, Zutphen, Dieren, Zutphen, Dieren, Zutphen, Dieren, Zutphen, Dieren]"
train_11,"[Groningen, Assen, Groningen, Assen, Groningen, Assen, Groningen, Assen, Groningen, Assen, Groningen]"
train_12,"[Heerlen, Sittard, Maastricht, Sittard, Maastricht, Sittard, Maastricht, Sittard, Maastricht, Sittard, Maastricht, Sittard]"
train_13,"[Enschede, Hengelo, Enschede, Hengelo, Enschede, Hengelo, Enschede, Hengelo, Enschede, Hengelo, Enschede, Hengelo, Enschede, Hengelo, Enschede, Hengelo, Enschede, Hengelo, Enschede, Hengelo, Enschede, Hengelo, Enschede, Hengelo, Enschede, Hengelo]"
train_14,"[Nijmegen, Arnhem Centraal, Ede-Wageningen, Arnhem Centraal, Ede-Wageningen, Arnhem Centraal, Ede-Wageningen, Arnhem Centraal, Ede-Wageningen, Arnhem Centraal, Ede-Wageningen, Arnhem Centraal, Ede-Wageningen, Arnhem Centraal, Ede-Wageningen, Arnhem Centraal, Ede-Wageningen, Arnhem Centraal]"
train_15,"[Arnhem Centraal, Ede-Wageningen, Arnhem Centraal, Ede-Wageningen, Arnhem Centraal, Ede-Wageningen, Arnhem Centraal, Ede-Wageningen, Arnhem Centraal, Ede-Wageningen, Arnhem Centraal, Ede-Wageningen, Arnhem Centraal, Ede-Wageningen, Arnhem Centraal, Ede-Wageningen, Arnhem Centraal, Ede-Wageningen]"
train_16,"[Dieren, Zutphen, Dieren, Zutphen, Dieren, Zutphen, Dieren, Zutphen, Dieren, Zutphen, Dieren, Zutphen, Dieren, Zutphen, Dieren, Zutphen, Dieren, Zutphen, Dieren, Zutphen, Dieren, Zutphen, Dieren]"
train_17,"[Oss, s-Hertogenbosch, Oss, s-Hertogenbosch, Oss, s-Hertogenbosch, Oss, s-Hertogenbosch, Oss, s-Hertogenbosch, Oss, s-Hertogenbosch, Oss, s-Hertogenbosch, Oss, s-Hertogenbosch, Oss]"
train_18,"[Hilversum, Utrecht Centraal, Amersfoort, Utrecht Centraal, Amersfoort, Utrecht Centraal, Amersfoort, Utrecht Centraal, Amersfoort, Utrecht Centraal, Amersfoort, Utrecht Centraal, Amersfoort]"
train_19,"[Amsterdam Sloterdijk, Amsterdam Centraal, Amsterdam Sloterdijk, Amsterdam Centraal, Amsterdam Sloterdijk, Amsterdam Centraal, Amsterdam Sloterdijk, Amsterdam Centraal, Amsterdam Sloterdijk, Amsterdam Centraal, Amsterdam Sloterdijk, Amsterdam Centraal, Amsterdam Sloterdijk, Amsterdam Centraal, Amsterdam Sloterdijk, Amsterdam Centraal, Amsterdam Sloterdijk, Amsterdam Centraal, Amsterdam Sloterdijk, Amsterdam Centraal, Amsterdam Sloterdijk, Amsterdam Centraal, Amsterdam Sloterdijk, Amsterdam Centraal, Amsterdam Sloterdijk, Amsterdam Centraal, Amsterdam Sloterdijk, Amsterdam Centraal, Amsterdam Sloterdijk, Amsterdam Centraal]"
train_20,"[Amersfoort, Utrecht Centraal, Amersfoort, Utrecht Centraal, Amersfoort, Utrecht Centraal, Amersfoort, Utrecht Centraal, Amersfoort, Utrecht Centraal, Amersfoort, Utrecht Centraal, Amersfoort]"
score,-3355.1685393258426
