train,stations
train_1,"[Assen, Groningen, Assen, Groningen, Assen, Groningen, Assen, Groningen, Assen, Groningen, Assen]"
train_2,"[Utrecht Centraal, Amersfoort, Utrecht Centraal, Amersfoort, Utrecht Centraal, Amersfoort, Utrecht Centraal, Amersfoort, Utrecht Centraal, Amersfoort, Utrecht Centraal, Amersfoort, Utrecht Centraal]"
train_3,"[Zaandam, Amsterdam Sloterdijk, Amsterdam Centraal, Amsterdam Sloterdijk, Amsterdam Centraal, Amsterdam Sloterdijk, Amsterdam Centraal, Amsterdam Sloterdijk, Amsterdam Centraal, Amsterdam Sloterdijk, Amsterdam Centraal, Amsterdam Sloterdijk, Amsterdam Centraal, Amsterdam Sloterdijk, Amsterdam Centraal, Amsterdam Sloterdijk, Amsterdam Centraal, Amsterdam Sloterdijk, Amsterdam Centraal, Amsterdam Sloterdijk, Amsterdam Centraal, Amsterdam Sloterdijk, Amsterdam Centraal, Amsterdam Sloterdijk, Amsterdam Centraal, Amsterdam Sloterdijk, Amsterdam Centraal, Amsterdam Sloterdijk, Amsterdam Centraal, Amsterdam Sloterdijk]"
train_4,"[Schiedam Centrum, Rotterdam Centraal, Schiedam Centrum, Rotterdam Centraal, Schiedam Centrum, Rotterdam Centraal, Schiedam Centrum, Rotterdam Centraal, Schiedam Centrum, Rotterdam Centraal, Schiedam Centrum, Rotterdam Centraal, Schiedam Centrum, Rotterdam Centraal, Schiedam Centrum, Rotterdam Centraal, Schiedam Centrum, Rotterdam Centraal, Schiedam Centrum, Rotterdam Centraal, Schiedam Centrum, Rotterdam Centraal, Schiedam Centrum, Rotterdam Centraal, Schiedam Centrum, Rotterdam Centraal, Schiedam Centrum, Rotterdam Centraal, Schiedam Centrum, Rotterdam Centraal, Schiedam Centrum, Rotterdam Centraal, Schiedam Centrum, Rotterdam Centraal, Schiedam Centrum, Rotterdam Centraal]"
train_5,"[Amsterdam Zuid, Schiphol Airport, Amsterdam Zuid, Schiphol Airport, Amsterdam Zuid, Schiphol Airport, Amsterdam Zuid, Schiphol Airport, Amsterdam Zuid, Schiphol Airport, Amsterdam Zuid, Schiphol Airport, Amsterdam Zuid, Schiphol Airport, Amsterdam Zuid, Schiphol Airport, Amsterdam Zuid, Schiphol Airport, Amsterdam Zuid, Schiphol Airport, Amsterdam Zuid, Schiphol Airport, Amsterdam Zuid, Schiphol Airport, Amsterdam Zuid, Schiphol Airport, Amsterdam Zuid, Schiphol Airport, Amsterdam Zuid, Schiphol Airport]"
train_6,"[Assen, Groningen, Assen, Groningen, Assen, Groningen, Assen, Groningen, Assen, Groningen, Assen]"
train_7,"[Groningen, Assen, Groningen, Assen, Groningen, Assen, Groningen, Assen, Groningen, Assen, Groningen]"
train_8,"[Roosendaal, Etten-Leur, Breda, Etten-Leur, Breda, Etten-Leur, Breda, Etten-Leur, Breda, Etten-Leur, Breda, Etten-Leur, Breda, Etten-Leur, Breda, Etten-Leur, Breda, Etten-Leur, Breda, Etten-Leur, Breda, Etten-Leur, Breda, Etten-Leur, Breda, Etten-Leur]"
train_9,"[Weert, Roermond, Weert, Roermond, Weert, Roermond, Weert, Roermond, Weert, Roermond, Weert, Roermond, Weert]"
train_10,"[Den Haag HS, Delft, Schiedam Centrum, Rotterdam Centraal, Schiedam Centrum, Rotterdam Centraal, Schiedam Centrum, Rotterdam Centraal, Schiedam Centrum, Rotterdam Centraal, Schiedam Centrum, Rotterdam Centraal, Schiedam Centrum, Rotterdam Centraal, Schiedam Centrum, Rotterdam Centraal, Schiedam Centrum, Rotterdam Centraal, Schiedam Centrum, Rotterdam Centraal, Schiedam Centrum, Rotterdam Centraal, Schiedam Centrum, Rotterdam Centraal, Schiedam Centrum, Rotterdam Centraal, Schiedam Centrum, Rotterdam Centraal, Schiedam Centrum, Rotterdam Centraal, Schiedam Centrum, Rotterdam Centraal, Schiedam Centrum, Rotterdam Centraal, Schiedam Centrum]"
train_11,"[Enschede, Hengelo, Enschede, Hengelo, Enschede, Hengelo, Enschede, Hengelo, Enschede, Hengelo, Enschede, Hengelo, Enschede, Hengelo, Enschede, Hengelo, Enschede, Hengelo, Enschede, Hengelo, Enschede, Hengelo, Enschede, Hengelo, Enschede, Hengelo]"
train_12,"[Hilversum, Utrecht Centraal, Amersfoort, Utrecht Centraal, Amersfoort, Utrecht Centraal, Amersfoort, Utrecht Centraal, Amersfoort, Utrecht Centraal, Amersfoort, Utrecht Centraal, Amersfoort]"
train_13,"[Etten-Leur, Breda, Etten-Leur, Breda, Etten-Leur, Breda, Etten-Leur, Breda, Etten-Leur, Breda, Etten-Leur, Breda, Etten-Leur, Breda, Etten-Leur, Breda, Etten-Leur, Breda, Etten-Leur, Breda, Etten-Leur, Breda, Etten-Leur, Breda, Etten-Leur, Breda]"
train_14,"[Alkmaar, Castricum, Alkmaar, Castricum, Alkmaar, Castricum, Alkmaar, Castricum, Alkmaar, Castricum, Alkmaar, Castricum, Alkmaar, Castricum, Alkmaar, Castricum, Alkmaar, Castricum, Alkmaar, Castricum]"
train_15,"[Zaandam, Amsterdam Sloterdijk, Amsterdam Centraal, Amsterdam Sloterdijk, Amsterdam Centraal, Amsterdam Sloterdijk, Amsterdam Centraal, Amsterdam Sloterdijk, Amsterdam Centraal, Amsterdam Sloterdijk, Amsterdam Centraal, Amsterdam Sloterdijk, Amsterdam Centraal, Amsterdam Sloterdijk, Amsterdam Centraal, Amsterdam Sloterdijk, Amsterdam Centraal, Amsterdam Sloterdijk, Amsterdam Centraal, Amsterdam Sloterdijk, Amsterdam Centraal, Amsterdam Sloterdijk, Amsterdam Centraal, Amsterdam Sloterdijk, Amsterdam Centraal, Amsterdam Sloterdijk, Amsterdam Centraal, Amsterdam Sloterdijk, Amsterdam Centraal, Amsterdam Sloterdijk]"
train_16,"[Zaandam, Amsterdam Sloterdijk, Amsterdam Centraal, Amsterdam Sloterdijk, Amsterdam Centraal, Amsterdam Sloterdijk, Amsterdam Centraal, Amsterdam Sloterdijk, Amsterdam Centraal, Amsterdam Sloterdijk, Amsterdam Centraal, Amsterdam Sloterdijk, Amsterdam Centraal, Amsterdam Sloterdijk, Amsterdam Centraal, Amsterdam Sloterdijk, Amsterdam Centraal, Amsterdam Sloterdijk, Amsterdam Centraal, Amsterdam Sloterdijk, Amsterdam Centraal, Amsterdam Sloterdijk, Amsterdam Centraal, Amsterdam Sloterdijk, Amsterdam Centraal, Amsterdam Sloterdijk, Amsterdam Centraal, Amsterdam Sloterdijk, Amsterdam Centraal, Amsterdam Sloterdijk]"
train_17,"[Maastricht, Sittard, Maastricht, Sittard, Maastricht, Sittard, Maastricht, Sittard, Maastricht, Sittard, Maastricht, Sittard]"
train_18,"[s-Hertogenbosch, Oss, s-Hertogenbosch, Oss, s-Hertogenbosch, Oss, s-Hertogenbosch, Oss, s-Hertogenbosch, Oss, s-Hertogenbosch, Oss, s-Hertogenbosch, Oss, s-Hertogenbosch, Oss, s-Hertogenbosch]"
train_19,"[Maastricht, Sittard, Maastricht, Sittard, Maastricht, Sittard, Maastricht, Sittard, Maastricht, Sittard, Maastricht, Sittard]"
train_20,"[Hilversum, Utrecht Centraal, Amersfoort, Utrecht Centraal, Amersfoort, Utrecht Centraal, Amersfoort, Utrecht Centraal, Amersfoort, Utrecht Centraal, Amersfoort, Utrecht Centraal, Amersfoort]"
score,-3711.2471910112363
