train,stations
train_1,"[Hengelo, Almelo, Zwolle, Amersfoort, Apeldoorn, Zutphen, Apeldoorn, Amersfoort]"
train_2,"[Helmond, Venlo, Helmond, Eindhoven, s-Hertogenbosch, Utrecht Centraal, Amsterdam Amstel, Utrecht Centraal, Amsterdam Centraal]"
train_3,"[Almere Centrum, Amsterdam Centraal, Almere Centrum, Amsterdam Amstel, Hilversum, Amsterdam Amstel, Almere Centrum, Amsterdam Amstel]"
train_4,"[Sittard, Roermond, Sittard, Heerlen, Sittard, Heerlen, Sittard, Roermond, Weert, Roermond, Sittard, Heerlen, Sittard]"
train_5,"[Maastricht, Sittard, Roermond, Sittard, Heerlen, Sittard, Maastricht, Sittard, Heerlen, Sittard, Roermond, Sittard]"
train_6,"[Heerenveen, Leeuwarden, Groningen, Assen, Groningen, Leeuwarden, Heerenveen, Steenwijk, Zwolle]"
train_7,"[Hengelo, Almelo, Hengelo, Almelo, Deventer, Almelo, Deventer, Apeldoorn, Zutphen, Deventer, Almelo]"
train_8,"[Den Haag Laan v NOI, Gouda, Den Haag HS, Delft, Schiedam Centrum, Rotterdam Blaak, Rotterdam Alexander, Rotterdam Blaak, Dordrecht, Roosendaal]"
train_9,"[Steenwijk, Zwolle, Almelo, Deventer, Zutphen, Dieren, Zutphen, Apeldoorn, Deventer, Zwolle]"
train_10,"[Zwolle, Steenwijk, Zwolle, Assen, Zwolle, Steenwijk, Zwolle]"
train_11,"[Steenwijk, Zwolle, Assen, Groningen, Leeuwarden, Groningen, Assen]"
train_12,"[Hoorn, Alkmaar, Hoorn, Alkmaar, Hoorn, Alkmaar, Castricum, Zaandam, Hoorn]"
train_13,"[Amersfoort, Apeldoorn, Zutphen, Deventer, Zwolle, Assen, Zwolle]"
train_14,"[Utrecht Centraal, Amersfoort, Apeldoorn, Deventer, Zwolle, Almelo, Hengelo, Enschede, Hengelo, Enschede, Hengelo, Almelo]"
train_15,"[Rotterdam Alexander, Gouda, Den Haag Laan v NOI, Delft, Den Haag Laan v NOI, Delft, Den Haag HS, Delft, Den Haag HS, Delft, Den Haag Centraal, Leiden Centraal, Heemstede-Aerdenhout, Leiden Centraal, Den Haag Laan v NOI, Leiden Centraal]"
train_16,"[Lelystad Centrum, Almere Centrum, Hilversum, Amsterdam Amstel, Hilversum, Almere Centrum, Lelystad Centrum, Almere Centrum, Lelystad Centrum, Almere Centrum]"
train_17,"[Heerlen, Sittard, Heerlen, Sittard, Heerlen, Sittard, Heerlen, Sittard, Maastricht, Sittard, Roermond, Sittard]"
train_18,"[Zwolle, Assen, Zwolle, Deventer, Apeldoorn, Amersfoort, Utrecht Centraal, Ede-Wageningen]"
train_19,"[Heerlen, Sittard, Heerlen, Sittard, Maastricht, Sittard, Maastricht, Sittard, Heerlen, Sittard, Maastricht, Sittard]"
train_20,"[Deventer, Almelo, Zwolle, Deventer, Almelo, Hengelo, Enschede, Hengelo, Enschede, Hengelo, Almelo]"
score,426.696629213483
