train,stations
train_1,"[Groningen, Leeuwarden, Heerenveen, Leeuwarden, Heerenveen, Steenwijk, Heerenveen, Leeuwarden, Heerenveen, Leeuwarden]"
train_2,"[Arnhem Centraal, Dieren, Zutphen, Apeldoorn, Amersfoort, Apeldoorn, Amersfoort, Zwolle]"
train_3,"[Haarlem, Amsterdam Sloterdijk, Amsterdam Centraal, Amsterdam Amstel, Amsterdam Zuid, Amsterdam Amstel, Amsterdam Zuid, Schiphol Airport, Amsterdam Zuid, Schiphol Airport, Utrecht Centraal, Amersfoort, Zwolle]"
train_4,"[Zaandam, Beverwijk, Castricum, Beverwijk, Haarlem, Heemstede-Aerdenhout, Haarlem, Amsterdam Sloterdijk, Zaandam, Hoorn, Alkmaar]"
train_5,"[Leeuwarden, Heerenveen, Steenwijk, Heerenveen, Steenwijk, Heerenveen, Leeuwarden, Groningen, Assen, Groningen]"
train_6,"[Den Helder, Alkmaar, Hoorn, Zaandam, Beverwijk, Castricum, Beverwijk, Haarlem, Heemstede-Aerdenhout, Leiden Centraal]"
train_7,"[Eindhoven, Tilburg, s-Hertogenbosch, Tilburg, s-Hertogenbosch, Oss, s-Hertogenbosch, Utrecht Centraal, Amersfoort, Apeldoorn, Amersfoort]"
train_8,"[Hoorn, Zaandam, Hoorn, Alkmaar, Castricum, Beverwijk, Zaandam, Castricum, Zaandam, Beverwijk]"
train_9,"[Roosendaal, Etten-Leur, Roosendaal, Vlissingen, Roosendaal, Dordrecht]"
train_10,"[Zutphen, Apeldoorn, Deventer, Apeldoorn, Amersfoort, Zwolle, Deventer, Zutphen, Deventer, Apeldoorn, Deventer, Apeldoorn]"
train_11,"[Heemstede-Aerdenhout, Leiden Centraal, Schiphol Airport, Amsterdam Zuid, Schiphol Airport, Amsterdam Zuid, Schiphol Airport, Amsterdam Zuid, Amsterdam Sloterdijk, Haarlem, Heemstede-Aerdenhout, Haarlem, Heemstede-Aerdenhout, Leiden Centraal, Den Haag Laan v NOI, Leiden Centraal, Den Haag Laan v NOI, Delft, Den Haag Laan v NOI, Leiden Centraal]"
train_12,"[Amsterdam Amstel, Amsterdam Zuid, Amsterdam Sloterdijk, Amsterdam Zuid, Amsterdam Amstel, Amsterdam Centraal, Amsterdam Sloterdijk, Haarlem, Beverwijk, Zaandam, Beverwijk, Castricum, Beverwijk]"
train_13,"[Amsterdam Amstel, Amsterdam Centraal, Amsterdam Amstel, Hilversum, Amsterdam Amstel, Hilversum, Almere Centrum, Amsterdam Amstel, Amsterdam Centraal]"
train_14,"[Apeldoorn, Zutphen, Deventer, Apeldoorn, Zutphen, Deventer, Almelo, Zwolle]"
train_15,"[Amersfoort, Apeldoorn, Amersfoort, Apeldoorn, Amersfoort, Utrecht Centraal, Gouda, Alphen a/d Rijn, Gouda]"
train_16,"[Lelystad Centrum, Almere Centrum, Amsterdam Centraal, Amsterdam Sloterdijk, Haarlem, Heemstede-Aerdenhout, Leiden Centraal, Schiphol Airport, Leiden Centraal, Heemstede-Aerdenhout, Leiden Centraal, Heemstede-Aerdenhout, Leiden Centraal, Den Haag Centraal, Leiden Centraal]"
train_17,"[Almelo, Hengelo, Enschede, Hengelo, Almelo, Zwolle, Steenwijk, Zwolle, Almelo]"
train_18,"[Vlissingen, Roosendaal, Vlissingen]"
train_19,"[Alkmaar, Den Helder, Alkmaar, Den Helder, Alkmaar]"
train_20,"[Ede-Wageningen, Arnhem Centraal, Nijmegen, Oss, s-Hertogenbosch, Tilburg, s-Hertogenbosch, Oss, Nijmegen, Arnhem Centraal, Nijmegen, Oss, Nijmegen, Arnhem Centraal]"
score,1138.4943820224717
