train,stations
train_1,"[Hilversum, Almere Centrum, Amsterdam Centraal, Utrecht Centraal, Schiphol Airport, Leiden Centraal, Heemstede-Aerdenhout, Leiden Centraal, Den Haag Centraal, Leiden Centraal]"
train_2,"[Almelo, Deventer, Almelo, Zwolle, Assen, Zwolle]"
train_3,"[Den Helder, Alkmaar, Den Helder, Alkmaar, Hoorn, Alkmaar]"
train_4,"[Rotterdam Alexander, Gouda, Utrecht Centraal, Hilversum, Amsterdam Amstel, Amsterdam Centraal, Almere Centrum, Amsterdam Amstel, Utrecht Centraal, Hilversum]"
train_5,"[Almelo, Zwolle, Amersfoort, Apeldoorn, Deventer, Almelo, Zwolle]"
train_6,"[Apeldoorn, Zutphen, Dieren, Zutphen, Dieren, Arnhem Centraal, Nijmegen, Oss, Nijmegen, Oss, s-Hertogenbosch, Oss, Nijmegen, Arnhem Centraal, Dieren]"
train_7,"[Tilburg, s-Hertogenbosch, Tilburg, Breda, Tilburg, Breda, Etten-Leur, Roosendaal, Etten-Leur, Breda, Etten-Leur, Roosendaal]"
train_8,"[Gouda, Rotterdam Alexander, Rotterdam Blaak, Dordrecht, Roosendaal, Dordrecht, Rotterdam Blaak, Rotterdam Alexander, Rotterdam Centraal, Rotterdam Alexander, Rotterdam Blaak, Dordrecht, Breda, Etten-Leur, Roosendaal]"
train_9,"[Amsterdam Zuid, Schiphol Airport, Utrecht Centraal, Amersfoort, Utrecht Centraal, s-Hertogenbosch, Eindhoven, Helmond, Venlo]"
train_10,"[Amersfoort, Zwolle, Steenwijk, Zwolle, Assen, Zwolle]"
train_11,"[Den Haag Centraal, Delft, Schiedam Centrum, Delft, Den Haag Centraal, Leiden Centraal, Den Haag HS, Delft, Den Haag Laan v NOI, Delft, Den Haag Centraal, Delft, Den Haag HS, Delft, Den Haag Laan v NOI, Delft, Schiedam Centrum]"
train_12,"[Den Haag Laan v NOI, Gouda, Den Haag Laan v NOI, Delft, Den Haag Laan v NOI, Leiden Centraal, Den Haag Centraal, Leiden Centraal, Den Haag Laan v NOI, Delft, Den Haag HS, Leiden Centraal, Alphen a/d Rijn]"
train_13,"[Amersfoort, Utrecht Centraal, Ede-Wageningen, Arnhem Centraal, Ede-Wageningen, Utrecht Centraal, Amsterdam Centraal, Amsterdam Amstel, Amsterdam Centraal, Utrecht Centraal]"
train_14,"[Apeldoorn, Zutphen, Apeldoorn, Zutphen, Apeldoorn, Deventer, Zutphen, Dieren, Zutphen, Deventer, Zutphen, Deventer, Zutphen, Deventer]"
train_15,"[Amsterdam Centraal, Amsterdam Sloterdijk, Zaandam, Beverwijk, Zaandam, Hoorn, Alkmaar, Hoorn, Alkmaar]"
train_16,"[Dieren, Arnhem Centraal, Nijmegen, Oss, s-Hertogenbosch, Utrecht Centraal, Ede-Wageningen, Utrecht Centraal, s-Hertogenbosch]"
train_17,"[Almere Centrum, Amsterdam Centraal, Amsterdam Amstel, Amsterdam Zuid, Amsterdam Amstel, Utrecht Centraal, Ede-Wageningen, Arnhem Centraal, Nijmegen, Arnhem Centraal, Ede-Wageningen, Arnhem Centraal, Dieren, Zutphen, Dieren]"
train_18,"[Den Helder, Alkmaar, Castricum, Alkmaar, Hoorn, Alkmaar, Den Helder, Alkmaar]"
train_19,"[Den Haag Laan v NOI, Gouda, Utrecht Centraal, Alphen a/d Rijn, Leiden Centraal, Den Haag Laan v NOI, Gouda, Den Haag HS, Gouda]"
train_20,"[Etten-Leur, Roosendaal, Etten-Leur, Roosendaal, Dordrecht, Rotterdam Centraal, Dordrecht, Rotterdam Centraal, Dordrecht, Rotterdam Blaak, Schiedam Centrum, Rotterdam Centraal, Dordrecht]"
score,2089.730337078652
