train,stations
train_1,"[Assen, Zwolle, Assen, Zwolle, Steenwijk, Heerenveen, Leeuwarden]"
train_2,"[Enschede, Hengelo, Almelo, Hengelo, Enschede, Hengelo, Almelo, Zwolle, Steenwijk, Heerenveen, Leeuwarden]"
train_3,"[Assen, Zwolle, Steenwijk, Zwolle, Almelo, Deventer, Zutphen, Deventer]"
train_4,"[Heerlen, Sittard, Heerlen, Sittard, Maastricht, Sittard, Roermond, Sittard, Roermond, Weert, Roermond, Sittard, Maastricht]"
train_5,"[Vlissingen, Roosendaal, Vlissingen]"
train_6,"[Amsterdam Amstel, Amsterdam Zuid, Amsterdam Amstel, Hilversum, Amsterdam Amstel, Almere Centrum, Amsterdam Amstel, Hilversum, Utrecht Centraal]"
train_7,"[Eindhoven, Tilburg, Eindhoven, Tilburg, Eindhoven, Helmond, Eindhoven, Tilburg, s-Hertogenbosch, Utrecht Centraal]"
train_8,"[Hoorn, Alkmaar, Den Helder, Alkmaar, Den Helder, Alkmaar]"
train_9,"[Venlo, Helmond, Venlo, Helmond, Venlo, Helmond]"
train_10,"[Amsterdam Zuid, Amsterdam Amstel, Amsterdam Centraal, Amsterdam Amstel, Amsterdam Centraal, Utrecht Centraal, Amsterdam Amstel, Utrecht Centraal, Amsterdam Centraal, Utrecht Centraal, Amersfoort]"
train_11,"[Haarlem, Beverwijk, Zaandam, Castricum, Zaandam, Castricum, Alkmaar, Hoorn, Zaandam, Castricum, Alkmaar]"
train_12,"[Heemstede-Aerdenhout, Haarlem, Amsterdam Sloterdijk, Amsterdam Zuid, Amsterdam Amstel, Utrecht Centraal, s-Hertogenbosch, Tilburg, s-Hertogenbosch, Eindhoven, Helmond, Venlo]"
train_13,"[Alphen a/d Rijn, Leiden Centraal, Den Haag Laan v NOI, Delft, Schiedam Centrum, Rotterdam Centraal, Schiedam Centrum, Rotterdam Centraal, Rotterdam Alexander, Gouda, Den Haag HS, Delft, Den Haag Centraal, Leiden Centraal, Heemstede-Aerdenhout, Haarlem, Heemstede-Aerdenhout, Leiden Centraal]"
train_14,"[Leiden Centraal, Den Haag Laan v NOI, Delft, Schiedam Centrum, Rotterdam Centraal, Rotterdam Alexander, Rotterdam Blaak, Rotterdam Alexander, Rotterdam Blaak, Dordrecht, Breda, Tilburg, Breda, Dordrecht, Roosendaal]"
train_15,"[Heemstede-Aerdenhout, Haarlem, Heemstede-Aerdenhout, Haarlem, Amsterdam Sloterdijk, Amsterdam Zuid, Schiphol Airport, Amsterdam Zuid, Schiphol Airport, Amsterdam Zuid, Schiphol Airport, Leiden Centraal, Alphen a/d Rijn, Utrecht Centraal, Alphen a/d Rijn]"
train_16,"[Roermond, Sittard, Heerlen, Sittard, Heerlen, Sittard, Roermond, Sittard, Heerlen, Sittard, Roermond, Weert]"
train_17,"[Gouda, Den Haag HS, Delft, Den Haag Laan v NOI, Gouda, Rotterdam Alexander, Gouda, Alphen a/d Rijn, Gouda, Utrecht Centraal, Schiphol Airport]"
train_18,"[Den Haag Laan v NOI, Delft, Den Haag Laan v NOI, Delft, Den Haag Laan v NOI, Leiden Centraal, Heemstede-Aerdenhout, Haarlem, Amsterdam Sloterdijk, Zaandam, Beverwijk, Haarlem, Amsterdam Sloterdijk, Haarlem, Heemstede-Aerdenhout, Leiden Centraal]"
train_19,"[Utrecht Centraal, Amsterdam Amstel, Amsterdam Centraal, Almere Centrum, Hilversum, Almere Centrum, Amsterdam Centraal, Almere Centrum, Hilversum]"
train_20,"[Roosendaal, Etten-Leur, Roosendaal, Etten-Leur, Breda, Dordrecht, Rotterdam Blaak, Rotterdam Alexander, Rotterdam Blaak, Schiedam Centrum, Delft, Den Haag Laan v NOI, Gouda, Utrecht Centraal]"
score,2297.4494382022467
