train,stations
train_1,"[Breda, Dordrecht, Roosendaal, Etten-Leur, Roosendaal, Etten-Leur, Breda, Etten-Leur, Roosendaal, Etten-Leur, Roosendaal]"
train_2,"[Beverwijk, Castricum, Zaandam, Amsterdam Sloterdijk, Haarlem, Beverwijk, Zaandam, Castricum, Zaandam, Castricum, Zaandam, Beverwijk]"
train_3,"[Rotterdam Blaak, Rotterdam Alexander, Gouda, Den Haag Centraal, Gouda, Alphen a/d Rijn, Leiden Centraal, Heemstede-Aerdenhout, Haarlem, Amsterdam Sloterdijk, Haarlem, Heemstede-Aerdenhout, Leiden Centraal, Den Haag HS, Delft, Schiedam Centrum]"
train_4,"[Rotterdam Centraal, Schiedam Centrum, Rotterdam Blaak, Schiedam Centrum, Rotterdam Centraal, Rotterdam Alexander, Gouda, Den Haag Laan v NOI, Gouda, Rotterdam Alexander, Rotterdam Blaak, Schiedam Centrum, Rotterdam Blaak, Schiedam Centrum, Delft, Schiedam Centrum, Delft]"
train_5,"[Den Haag Centraal, Leiden Centraal, Den Haag HS, Delft, Den Haag HS, Delft, Den Haag Centraal, Gouda, Utrecht Centraal, Ede-Wageningen, Arnhem Centraal, Ede-Wageningen, Utrecht Centraal]"
train_6,"[Beverwijk, Castricum, Zaandam, Beverwijk, Haarlem, Beverwijk, Castricum, Alkmaar, Den Helder, Alkmaar]"
train_7,"[Enschede, Hengelo, Enschede, Hengelo, Enschede, Hengelo, Almelo, Deventer, Zwolle, Assen, Zwolle]"
train_8,"[Den Haag Laan v NOI, Gouda, Den Haag HS, Leiden Centraal, Den Haag Centraal, Delft, Den Haag HS, Gouda, Den Haag Centraal, Leiden Centraal, Den Haag HS, Leiden Centraal]"
train_9,"[Arnhem Centraal, Ede-Wageningen, Arnhem Centraal, Dieren, Arnhem Centraal, Nijmegen, Arnhem Centraal, Dieren, Arnhem Centraal, Ede-Wageningen, Arnhem Centraal, Dieren, Zutphen, Deventer, Apeldoorn, Deventer, Apeldoorn]"
train_10,"[Heemstede-Aerdenhout, Leiden Centraal, Alphen a/d Rijn, Leiden Centraal, Den Haag Laan v NOI, Gouda, Rotterdam Alexander, Rotterdam Centraal, Dordrecht, Roosendaal]"
train_11,"[Leeuwarden, Heerenveen, Steenwijk, Zwolle, Almelo, Deventer, Zutphen, Dieren, Zutphen, Dieren, Zutphen]"
train_12,"[Heerenveen, Leeuwarden, Heerenveen, Leeuwarden, Groningen, Leeuwarden, Groningen, Assen]"
train_13,"[Den Haag Centraal, Delft, Schiedam Centrum, Rotterdam Centraal, Schiedam Centrum, Rotterdam Blaak, Dordrecht, Breda, Dordrecht, Rotterdam Blaak, Dordrecht, Breda, Dordrecht, Rotterdam Blaak]"
train_14,"[Leeuwarden, Heerenveen, Leeuwarden, Groningen, Leeuwarden, Groningen, Leeuwarden]"
train_15,"[Amsterdam Zuid, Schiphol Airport, Utrecht Centraal, Hilversum, Almere Centrum, Amsterdam Amstel, Amsterdam Centraal, Amsterdam Amstel, Amsterdam Zuid, Amsterdam Amstel, Utrecht Centraal]"
train_16,"[Roosendaal, Vlissingen, Roosendaal]"
train_17,"[Nijmegen, Arnhem Centraal, Nijmegen, Oss, s-Hertogenbosch, Oss, s-Hertogenbosch, Tilburg, s-Hertogenbosch, Eindhoven, Tilburg, Eindhoven, Helmond]"
train_18,"[Vlissingen, Roosendaal, Dordrecht, Rotterdam Centraal, Schiedam Centrum, Rotterdam Blaak, Dordrecht, Breda, Dordrecht]"
train_19,"[Zwolle, Assen, Groningen, Assen, Groningen, Leeuwarden, Heerenveen, Leeuwarden]"
train_20,"[Apeldoorn, Amersfoort, Zwolle, Almelo, Zwolle]"
score,2403.4494382022467
