train,stations
train_1,"[Den Haag Centraal, Delft, Den Haag HS, Delft, Den Haag HS, Gouda, Den Haag Laan v NOI, Delft, Den Haag Centraal, Delft, Den Haag HS, Gouda]"
train_2,"[Helmond, Eindhoven, Helmond, Venlo, Helmond, Eindhoven, Helmond, Eindhoven, Weert, Eindhoven, Helmond, Eindhoven, Helmond]"
train_3,"[Steenwijk, Heerenveen, Steenwijk, Heerenveen, Leeuwarden, Heerenveen, Steenwijk, Heerenveen, Leeuwarden, Heerenveen, Leeuwarden, Heerenveen]"
train_4,"[Eindhoven, s-Hertogenbosch, Utrecht Centraal, Amsterdam Centraal, Almere Centrum, Amsterdam Centraal, Amsterdam Sloterdijk, Zaandam, Amsterdam Sloterdijk, Haarlem, Amsterdam Sloterdijk, Zaandam, Amsterdam Sloterdijk, Zaandam]"
train_5,"[Utrecht Centraal, Amsterdam Centraal, Utrecht Centraal, Ede-Wageningen, Arnhem Centraal, Dieren, Arnhem Centraal, Ede-Wageningen, Utrecht Centraal, Amsterdam Amstel]"
train_6,"[Oss, s-Hertogenbosch, Tilburg, Eindhoven, s-Hertogenbosch, Oss, s-Hertogenbosch, Oss, Nijmegen, Oss, s-Hertogenbosch, Tilburg, Breda]"
train_7,"[Nijmegen, Oss, s-Hertogenbosch, Tilburg, Eindhoven, s-Hertogenbosch, Utrecht Centraal, Schiphol Airport, Leiden Centraal, Den Haag Centraal]"
train_8,"[Dieren, Arnhem Centraal, Nijmegen, Arnhem Centraal, Nijmegen, Oss, Nijmegen, Oss, Nijmegen, Oss, s-Hertogenbosch, Tilburg, Eindhoven]"
train_9,"[Venlo, Helmond, Venlo, Helmond, Eindhoven, Helmond, Venlo, Helmond, Eindhoven]"
train_10,"[Den Helder, Alkmaar, Den Helder, Alkmaar, Hoorn, Alkmaar]"
train_11,"[Amsterdam Centraal, Utrecht Centraal, Gouda, Utrecht Centraal, Ede-Wageningen, Utrecht Centraal, Alphen a/d Rijn, Gouda, Den Haag HS]"
train_12,"[Beverwijk, Castricum, Zaandam, Beverwijk, Haarlem, Amsterdam Sloterdijk, Zaandam, Hoorn, Zaandam, Hoorn]"
train_13,"[Schiedam Centrum, Delft, Den Haag Laan v NOI, Leiden Centraal, Alphen a/d Rijn, Utrecht Centraal, Schiphol Airport, Utrecht Centraal, Amersfoort, Apeldoorn]"
train_14,"[Schiphol Airport, Leiden Centraal, Den Haag Laan v NOI, Leiden Centraal, Alphen a/d Rijn, Leiden Centraal, Schiphol Airport, Utrecht Centraal, Amsterdam Amstel, Amsterdam Centraal, Utrecht Centraal]"
train_15,"[Haarlem, Beverwijk, Zaandam, Castricum, Beverwijk, Haarlem, Beverwijk, Haarlem, Heemstede-Aerdenhout, Haarlem, Amsterdam Sloterdijk, Amsterdam Zuid, Amsterdam Amstel, Amsterdam Zuid]"
train_16,"[Hoorn, Alkmaar, Hoorn, Alkmaar, Castricum, Alkmaar, Hoorn, Alkmaar, Hoorn]"
train_17,"[Enschede, Hengelo, Almelo, Hengelo, Enschede, Hengelo, Enschede, Hengelo, Enschede, Hengelo, Enschede, Hengelo, Almelo, Deventer, Almelo, Hengelo, Enschede, Hengelo, Almelo]"
train_18,"[Enschede, Hengelo, Almelo, Hengelo, Enschede, Hengelo, Almelo, Hengelo, Enschede, Hengelo, Almelo, Deventer, Almelo, Zwolle]"
train_19,"[Zutphen, Deventer, Zwolle, Assen, Groningen, Assen, Groningen, Leeuwarden]"
train_20,"[Schiedam Centrum, Rotterdam Blaak, Dordrecht, Rotterdam Centraal, Rotterdam Alexander, Rotterdam Centraal, Rotterdam Alexander, Gouda, Alphen a/d Rijn, Gouda, Utrecht Centraal, Gouda, Rotterdam Alexander, Rotterdam Blaak]"
score,1945.3707865168544
