train,stations
train_1,"[Apeldoorn, Amersfoort, Zwolle, Assen, Zwolle, Assen]"
train_2,"[Hoorn, Alkmaar, Castricum, Zaandam, Amsterdam Sloterdijk, Amsterdam Centraal, Amsterdam Amstel, Utrecht Centraal, Gouda, Den Haag Centraal, Delft, Den Haag Laan v NOI, Delft, Den Haag Laan v NOI]"
train_3,"[Hengelo, Almelo, Deventer, Almelo, Hengelo, Almelo, Hengelo, Enschede, Hengelo, Almelo, Zwolle]"
train_4,"[Utrecht Centraal, Amsterdam Centraal, Amsterdam Amstel, Hilversum, Almere Centrum, Hilversum, Almere Centrum, Hilversum]"
train_5,"[Amsterdam Centraal, Utrecht Centraal, Gouda, Den Haag Laan v NOI, Gouda, Utrecht Centraal, s-Hertogenbosch, Oss, Nijmegen]"
train_6,"[Rotterdam Alexander, Rotterdam Centraal, Dordrecht, Roosendaal, Vlissingen, Roosendaal]"
train_7,"[Roosendaal, Dordrecht, Rotterdam Blaak, Schiedam Centrum, Rotterdam Blaak, Schiedam Centrum, Rotterdam Centraal, Dordrecht, Rotterdam Blaak, Dordrecht, Breda, Etten-Leur, Roosendaal]"
train_8,"[Vlissingen, Roosendaal, Etten-Leur, Breda, Tilburg, Eindhoven, Helmond, Venlo]"
train_9,"[Den Haag Laan v NOI, Delft, Den Haag HS, Delft, Schiedam Centrum, Rotterdam Centraal, Schiedam Centrum, Delft, Schiedam Centrum, Rotterdam Blaak, Rotterdam Alexander, Rotterdam Centraal, Rotterdam Alexander, Rotterdam Centraal, Dordrecht, Breda, Dordrecht, Breda]"
train_10,"[Den Helder, Alkmaar, Den Helder, Alkmaar, Hoorn, Alkmaar]"
train_11,"[Schiphol Airport, Amsterdam Zuid, Amsterdam Amstel, Amsterdam Zuid, Amsterdam Amstel, Hilversum, Almere Centrum, Hilversum, Almere Centrum, Hilversum]"
train_12,"[Zwolle, Deventer, Apeldoorn, Amersfoort, Zwolle, Steenwijk, Heerenveen, Steenwijk, Zwolle]"
train_13,"[Heerenveen, Leeuwarden, Heerenveen, Steenwijk, Zwolle, Deventer, Zwolle, Deventer, Zutphen, Dieren, Zutphen]"
train_14,"[Haarlem, Amsterdam Sloterdijk, Zaandam, Beverwijk, Castricum, Zaandam, Castricum, Beverwijk, Haarlem, Heemstede-Aerdenhout, Leiden Centraal, Alphen a/d Rijn, Utrecht Centraal]"
train_15,"[Zutphen, Dieren, Zutphen, Dieren, Arnhem Centraal, Ede-Wageningen, Utrecht Centraal, Schiphol Airport, Utrecht Centraal, Hilversum, Utrecht Centraal]"
train_16,"[Maastricht, Sittard, Roermond, Weert, Roermond, Sittard, Roermond, Sittard, Heerlen, Sittard, Heerlen, Sittard, Maastricht]"
train_17,"[Hilversum, Almere Centrum, Hilversum, Almere Centrum, Lelystad Centrum, Almere Centrum, Amsterdam Centraal, Amsterdam Amstel, Amsterdam Zuid, Amsterdam Amstel]"
train_18,"[Schiedam Centrum, Delft, Den Haag HS, Gouda, Den Haag Laan v NOI, Leiden Centraal, Heemstede-Aerdenhout, Leiden Centraal, Alphen a/d Rijn, Gouda, Rotterdam Alexander, Rotterdam Blaak, Schiedam Centrum, Rotterdam Blaak]"
train_19,"[Dieren, Arnhem Centraal, Nijmegen, Oss, s-Hertogenbosch, Utrecht Centraal, s-Hertogenbosch, Eindhoven, Tilburg, s-Hertogenbosch]"
train_20,"[Heemstede-Aerdenhout, Haarlem, Amsterdam Sloterdijk, Amsterdam Centraal, Utrecht Centraal, Schiphol Airport, Amsterdam Zuid, Amsterdam Amstel, Almere Centrum, Hilversum, Almere Centrum]"
score,3538.4044943820227
