train,stations
train_1,"[Heerenveen, Leeuwarden, Groningen, Leeuwarden, Groningen, Leeuwarden]"
train_2,"[Alphen a/d Rijn, Utrecht Centraal, Schiphol Airport, Amsterdam Zuid, Schiphol Airport, Leiden Centraal, Alphen a/d Rijn, Gouda, Den Haag Centraal, Gouda, Den Haag HS]"
train_3,"[Den Haag Laan v NOI, Leiden Centraal, Den Haag Laan v NOI, Delft, Den Haag Centraal, Gouda, Den Haag HS, Gouda, Rotterdam Alexander, Rotterdam Blaak, Rotterdam Alexander, Gouda, Rotterdam Alexander, Rotterdam Centraal, Rotterdam Alexander, Rotterdam Blaak]"
train_4,"[Schiedam Centrum, Rotterdam Blaak, Rotterdam Alexander, Rotterdam Blaak, Rotterdam Alexander, Gouda, Den Haag Centraal, Gouda, Rotterdam Alexander, Rotterdam Centraal, Dordrecht, Breda, Etten-Leur, Roosendaal, Dordrecht]"
train_5,"[Weert, Roermond, Weert, Roermond, Weert, Eindhoven, Tilburg, Eindhoven, Weert, Roermond, Weert, Eindhoven]"
train_6,"[Beverwijk, Castricum, Beverwijk, Zaandam, Hoorn, Zaandam, Castricum, Beverwijk, Zaandam, Hoorn]"
train_7,"[Oss, s-Hertogenbosch, Utrecht Centraal, Amsterdam Centraal, Utrecht Centraal, Ede-Wageningen, Arnhem Centraal, Nijmegen, Arnhem Centraal, Ede-Wageningen, Arnhem Centraal]"
train_8,"[Castricum, Beverwijk, Castricum, Beverwijk, Haarlem, Heemstede-Aerdenhout, Leiden Centraal, Heemstede-Aerdenhout, Leiden Centraal, Schiphol Airport, Amsterdam Zuid, Amsterdam Sloterdijk, Amsterdam Zuid, Amsterdam Amstel]"
train_9,"[Zaandam, Hoorn, Alkmaar, Castricum, Zaandam, Hoorn, Zaandam, Castricum, Beverwijk, Zaandam, Amsterdam Sloterdijk]"
train_10,"[Den Haag Laan v NOI, Delft, Den Haag HS, Leiden Centraal, Heemstede-Aerdenhout, Leiden Centraal, Den Haag HS, Leiden Centraal, Den Haag Centraal, Leiden Centraal, Alphen a/d Rijn, Utrecht Centraal, s-Hertogenbosch]"
train_11,"[Ede-Wageningen, Utrecht Centraal, Alphen a/d Rijn, Leiden Centraal, Heemstede-Aerdenhout, Leiden Centraal, Heemstede-Aerdenhout, Leiden Centraal, Schiphol Airport, Amsterdam Zuid, Amsterdam Sloterdijk, Zaandam, Amsterdam Sloterdijk, Haarlem]"
train_12,"[Rotterdam Centraal, Schiedam Centrum, Rotterdam Blaak, Schiedam Centrum, Rotterdam Centraal, Rotterdam Alexander, Rotterdam Blaak, Schiedam Centrum, Rotterdam Centraal, Rotterdam Alexander, Rotterdam Centraal, Rotterdam Alexander, Gouda, Rotterdam Alexander, Rotterdam Centraal, Dordrecht, Breda, Tilburg]"
train_13,"[Heemstede-Aerdenhout, Haarlem, Beverwijk, Zaandam, Castricum, Beverwijk, Castricum, Zaandam, Castricum, Alkmaar, Castricum, Beverwijk, Castricum, Beverwijk, Castricum]"
train_14,"[Arnhem Centraal, Nijmegen, Oss, s-Hertogenbosch, Tilburg, s-Hertogenbosch, Tilburg, Eindhoven, s-Hertogenbosch, Tilburg, Breda, Tilburg, Breda]"
train_15,"[Den Haag Centraal, Delft, Den Haag Laan v NOI, Delft, Den Haag Centraal, Leiden Centraal, Schiphol Airport, Amsterdam Zuid, Amsterdam Sloterdijk, Zaandam, Beverwijk, Zaandam, Amsterdam Sloterdijk, Amsterdam Centraal, Amsterdam Amstel]"
train_16,"[Amsterdam Amstel, Amsterdam Zuid, Amsterdam Sloterdijk, Zaandam, Hoorn, Alkmaar, Castricum, Alkmaar, Castricum, Zaandam, Castricum, Alkmaar, Den Helder]"
train_17,"[Almelo, Deventer, Almelo, Hengelo, Almelo, Deventer, Almelo, Hengelo, Enschede, Hengelo, Enschede, Hengelo, Enschede, Hengelo, Almelo]"
train_18,"[Den Haag HS, Leiden Centraal, Schiphol Airport, Amsterdam Zuid, Amsterdam Amstel, Utrecht Centraal, Alphen a/d Rijn, Utrecht Centraal, Amsterdam Centraal, Almere Centrum]"
train_19,"[Amsterdam Sloterdijk, Haarlem, Beverwijk, Zaandam, Beverwijk, Haarlem, Heemstede-Aerdenhout, Leiden Centraal, Schiphol Airport, Amsterdam Zuid, Amsterdam Amstel, Almere Centrum]"
train_20,"[Alphen a/d Rijn, Leiden Centraal, Schiphol Airport, Amsterdam Zuid, Amsterdam Sloterdijk, Haarlem, Amsterdam Sloterdijk, Haarlem, Heemstede-Aerdenhout, Leiden Centraal, Den Haag Centraal, Delft, Den Haag Centraal, Leiden Centraal, Heemstede-Aerdenhout, Leiden Centraal]"
score,1364.9325842696626
