train,stations
train_1,"[Castricum, Zaandam, Amsterdam Sloterdijk, Zaandam, Hoorn, Alkmaar, Castricum, Alkmaar, Den Helder, Alkmaar]"
train_2,"[Helmond, Venlo, Helmond, Eindhoven, Weert, Eindhoven, Weert, Eindhoven, Tilburg, Breda]"
train_3,"[Zwolle, Amersfoort, Zwolle, Steenwijk, Heerenveen, Steenwijk, Zwolle, Steenwijk]"
train_4,"[Heerenveen, Leeuwarden, Heerenveen, Steenwijk, Heerenveen, Steenwijk, Heerenveen, Leeuwarden, Heerenveen, Steenwijk, Heerenveen, Steenwijk]"
train_5,"[Alkmaar, Castricum, Alkmaar, Castricum, Beverwijk, Haarlem, Heemstede-Aerdenhout, Leiden Centraal, Alphen a/d Rijn, Gouda, Den Haag Centraal, Leiden Centraal, Den Haag Centraal, Leiden Centraal, Den Haag Centraal]"
train_6,"[Groningen, Leeuwarden, Heerenveen, Leeuwarden, Groningen, Assen, Zwolle]"
train_7,"[Helmond, Eindhoven, Tilburg, Breda, Etten-Leur, Breda, Etten-Leur, Breda, Dordrecht, Breda, Tilburg, Eindhoven, Helmond, Eindhoven]"
train_8,"[Heemstede-Aerdenhout, Leiden Centraal, Schiphol Airport, Leiden Centraal, Den Haag Centraal, Leiden Centraal, Schiphol Airport, Amsterdam Zuid, Amsterdam Amstel, Utrecht Centraal, Alphen a/d Rijn, Gouda]"
train_9,"[Steenwijk, Heerenveen, Leeuwarden, Heerenveen, Steenwijk, Heerenveen, Leeuwarden, Heerenveen, Leeuwarden, Groningen]"
train_10,"[Weert, Roermond, Weert, Roermond, Weert, Roermond, Weert, Eindhoven, Tilburg, Breda, Etten-Leur, Roosendaal, Etten-Leur, Breda]"
train_11,"[Zwolle, Amersfoort, Zwolle, Assen, Zwolle]"
train_12,"[s-Hertogenbosch, Eindhoven, s-Hertogenbosch, Eindhoven, Weert, Roermond, Weert, Roermond, Weert, Roermond, Weert, Roermond]"
train_13,"[Alkmaar, Castricum, Alkmaar, Castricum, Alkmaar, Den Helder, Alkmaar, Den Helder]"
train_14,"[Nijmegen, Arnhem Centraal, Ede-Wageningen, Utrecht Centraal, Amsterdam Amstel, Amsterdam Zuid, Amsterdam Amstel, Amsterdam Centraal, Amsterdam Sloterdijk, Haarlem, Beverwijk, Haarlem, Amsterdam Sloterdijk, Amsterdam Centraal, Amsterdam Amstel, Amsterdam Zuid]"
train_15,"[Alphen a/d Rijn, Utrecht Centraal, Ede-Wageningen, Utrecht Centraal, s-Hertogenbosch, Tilburg, Eindhoven, Weert, Eindhoven]"
train_16,"[Dordrecht, Rotterdam Blaak, Dordrecht, Rotterdam Blaak, Dordrecht, Breda, Tilburg, Breda, Tilburg, Breda, Dordrecht, Rotterdam Blaak, Rotterdam Alexander, Gouda]"
train_17,"[Dordrecht, Breda, Tilburg, Eindhoven, Helmond, Eindhoven, s-Hertogenbosch, Eindhoven, Weert, Roermond, Sittard, Maastricht]"
train_18,"[Haarlem, Heemstede-Aerdenhout, Haarlem, Amsterdam Sloterdijk, Haarlem, Amsterdam Sloterdijk, Amsterdam Centraal, Utrecht Centraal, Amsterdam Centraal, Amsterdam Amstel, Almere Centrum, Amsterdam Amstel]"
train_19,"[Lelystad Centrum, Almere Centrum, Amsterdam Amstel, Almere Centrum, Hilversum, Utrecht Centraal, Amsterdam Centraal, Utrecht Centraal]"
train_20,"[Leeuwarden, Heerenveen, Steenwijk, Zwolle, Steenwijk, Heerenveen, Steenwijk, Zwolle, Assen]"
score,702.4157303370794
