train,stations
train_1,"[Rotterdam Centraal, Dordrecht, Roosendaal, Vlissingen, Roosendaal]"
train_2,"[Rotterdam Blaak, Dordrecht, Rotterdam Centraal, Rotterdam Alexander, Gouda, Den Haag Centraal, Delft, Den Haag HS, Gouda, Rotterdam Alexander, Rotterdam Blaak, Dordrecht, Roosendaal]"
train_3,"[Eindhoven, Tilburg, s-Hertogenbosch, Utrecht Centraal, Ede-Wageningen, Utrecht Centraal, Amersfoort, Utrecht Centraal, Hilversum, Utrecht Centraal]"
train_4,"[Heerlen, Sittard, Maastricht, Sittard, Heerlen, Sittard, Roermond, Weert, Eindhoven, Tilburg, Eindhoven]"
train_5,"[Almelo, Zwolle, Deventer, Almelo, Hengelo, Almelo, Deventer, Zutphen, Dieren, Zutphen, Deventer]"
train_6,"[Weert, Eindhoven, s-Hertogenbosch, Oss, Nijmegen, Arnhem Centraal, Nijmegen, Arnhem Centraal, Nijmegen, Oss, Nijmegen, Oss, Nijmegen]"
train_7,"[Etten-Leur, Breda, Tilburg, s-Hertogenbosch, Tilburg, Breda, Tilburg, Breda, Tilburg, Eindhoven, Helmond, Venlo]"
train_8,"[Lelystad Centrum, Almere Centrum, Amsterdam Centraal, Amsterdam Amstel, Amsterdam Zuid, Schiphol Airport, Amsterdam Zuid, Schiphol Airport, Leiden Centraal, Den Haag Laan v NOI, Delft, Den Haag Laan v NOI, Leiden Centraal, Den Haag Laan v NOI, Gouda]"
train_9,"[Deventer, Apeldoorn, Amersfoort, Zwolle, Almelo, Deventer, Zutphen, Dieren, Arnhem Centraal, Dieren]"
train_10,"[Amsterdam Sloterdijk, Haarlem, Beverwijk, Haarlem, Beverwijk, Castricum, Zaandam, Hoorn, Alkmaar, Den Helder]"
train_11,"[Maastricht, Sittard, Maastricht, Sittard, Heerlen, Sittard, Roermond, Sittard, Maastricht, Sittard, Roermond, Sittard]"
train_12,"[Leeuwarden, Groningen, Assen, Zwolle, Assen, Groningen, Assen]"
train_13,"[Almelo, Hengelo, Enschede, Hengelo, Enschede, Hengelo, Almelo, Deventer, Zwolle, Amersfoort, Utrecht Centraal, Schiphol Airport]"
train_14,"[Hengelo, Enschede, Hengelo, Enschede, Hengelo, Almelo, Hengelo, Almelo, Deventer, Zutphen, Dieren, Arnhem Centraal, Ede-Wageningen, Utrecht Centraal]"
train_15,"[Leiden Centraal, Den Haag Laan v NOI, Leiden Centraal, Den Haag HS, Gouda, Utrecht Centraal, Hilversum, Utrecht Centraal, Amsterdam Centraal, Utrecht Centraal, Hilversum]"
train_16,"[Amsterdam Amstel, Amsterdam Zuid, Amsterdam Sloterdijk, Amsterdam Zuid, Schiphol Airport, Amsterdam Zuid, Amsterdam Sloterdijk, Haarlem, Heemstede-Aerdenhout, Haarlem, Beverwijk, Zaandam, Castricum, Zaandam, Amsterdam Sloterdijk, Amsterdam Centraal]"
train_17,"[s-Hertogenbosch, Oss, Nijmegen, Oss, s-Hertogenbosch, Utrecht Centraal, Amsterdam Centraal, Almere Centrum, Amsterdam Amstel, Amsterdam Centraal, Amsterdam Sloterdijk]"
train_18,"[Steenwijk, Zwolle, Amersfoort, Apeldoorn, Amersfoort, Zwolle]"
train_19,"[Den Helder, Alkmaar, Castricum, Zaandam, Amsterdam Sloterdijk, Amsterdam Zuid, Amsterdam Sloterdijk, Haarlem, Beverwijk, Zaandam, Hoorn]"
train_20,"[Sittard, Maastricht, Sittard, Maastricht, Sittard, Maastricht, Sittard, Heerlen, Sittard, Roermond, Weert, Eindhoven]"
score,2847.2471910112363
