train,stations
train_1,"[Almelo, Deventer, Almelo, Zwolle, Almelo, Deventer, Apeldoorn]"
train_2,"[Amsterdam Amstel, Almere Centrum, Amsterdam Centraal, Utrecht Centraal, Amsterdam Amstel, Hilversum, Amsterdam Amstel, Utrecht Centraal]"
train_3,"[Steenwijk, Zwolle, Deventer, Zwolle, Amersfoort, Zwolle]"
train_4,"[Roermond, Weert, Eindhoven, Weert, Eindhoven, Tilburg, s-Hertogenbosch, Utrecht Centraal, Alphen a/d Rijn]"
train_5,"[Nijmegen, Arnhem Centraal, Nijmegen, Oss, s-Hertogenbosch, Tilburg, Breda, Tilburg, Breda, Tilburg, Eindhoven, s-Hertogenbosch, Oss, s-Hertogenbosch]"
train_6,"[Beverwijk, Zaandam, Hoorn, Alkmaar, Den Helder, Alkmaar, Hoorn]"
train_7,"[Den Haag Laan v NOI, Leiden Centraal, Alphen a/d Rijn, Leiden Centraal, Den Haag Centraal, Gouda, Den Haag Laan v NOI, Delft, Den Haag Laan v NOI, Delft, Schiedam Centrum, Delft, Den Haag Laan v NOI, Leiden Centraal, Heemstede-Aerdenhout]"
train_8,"[Zwolle, Deventer, Apeldoorn, Deventer, Zutphen, Apeldoorn, Deventer, Apeldoorn, Deventer, Zutphen, Apeldoorn, Deventer, Zwolle]"
train_9,"[s-Hertogenbosch, Tilburg, Breda, Etten-Leur, Roosendaal, Dordrecht, Breda, Tilburg, Eindhoven, Weert, Eindhoven, Helmond]"
train_10,"[Groningen, Leeuwarden, Groningen, Assen, Zwolle, Assen]"
train_11,"[Etten-Leur, Breda, Tilburg, Eindhoven, Helmond, Eindhoven, Weert, Roermond, Sittard, Maastricht, Sittard, Heerlen, Sittard]"
train_12,"[Heerenveen, Steenwijk, Heerenveen, Steenwijk, Zwolle, Amersfoort, Utrecht Centraal, Alphen a/d Rijn, Leiden Centraal, Den Haag Centraal]"
train_13,"[Den Haag HS, Gouda, Den Haag Laan v NOI, Gouda, Utrecht Centraal, Schiphol Airport, Amsterdam Zuid, Schiphol Airport, Utrecht Centraal]"
train_14,"[Delft, Den Haag HS, Delft, Den Haag HS, Gouda, Utrecht Centraal, Hilversum, Amsterdam Amstel, Utrecht Centraal, Amersfoort, Zwolle]"
train_15,"[Haarlem, Beverwijk, Castricum, Beverwijk, Haarlem, Beverwijk, Haarlem, Amsterdam Sloterdijk, Amsterdam Centraal, Amsterdam Sloterdijk, Haarlem, Beverwijk, Zaandam]"
train_16,"[Eindhoven, Helmond, Eindhoven, s-Hertogenbosch, Eindhoven, Tilburg, Breda, Dordrecht, Roosendaal]"
train_17,"[Leiden Centraal, Den Haag HS, Delft, Den Haag HS, Leiden Centraal, Den Haag HS, Delft, Schiedam Centrum, Delft, Schiedam Centrum, Rotterdam Blaak, Dordrecht, Roosendaal]"
train_18,"[Nijmegen, Oss, Nijmegen, Oss, s-Hertogenbosch, Eindhoven, Tilburg, Breda, Dordrecht, Rotterdam Centraal, Rotterdam Alexander, Rotterdam Blaak, Rotterdam Alexander]"
train_19,"[Schiphol Airport, Utrecht Centraal, Amsterdam Centraal, Amsterdam Amstel, Almere Centrum, Amsterdam Centraal, Amsterdam Sloterdijk, Haarlem, Amsterdam Sloterdijk, Haarlem, Amsterdam Sloterdijk, Amsterdam Centraal, Amsterdam Amstel]"
train_20,"[Almere Centrum, Amsterdam Centraal, Utrecht Centraal, Gouda, Utrecht Centraal, Amsterdam Amstel, Hilversum, Utrecht Centraal, Gouda, Rotterdam Alexander]"
score,2224.089887640449
