train,stations
train_1,"[Gouda, Den Haag Centraal, Leiden Centraal, Den Haag Laan v NOI, Gouda, Den Haag HS, Gouda, Den Haag Laan v NOI, Delft, Den Haag HS, Delft, Den Haag Laan v NOI]"
train_2,"[Beverwijk, Zaandam, Castricum, Alkmaar, Den Helder, Alkmaar, Castricum, Zaandam, Castricum, Beverwijk]"
train_3,"[Den Haag HS, Delft, Den Haag Centraal, Gouda, Den Haag Centraal, Leiden Centraal, Den Haag Centraal, Gouda, Utrecht Centraal, Gouda, Alphen a/d Rijn, Leiden Centraal]"
train_4,"[Schiedam Centrum, Rotterdam Centraal, Schiedam Centrum, Delft, Den Haag HS, Leiden Centraal, Den Haag Centraal, Leiden Centraal, Den Haag Laan v NOI, Delft, Den Haag HS, Delft, Den Haag HS, Delft, Den Haag Laan v NOI, Delft, Den Haag HS, Leiden Centraal, Den Haag HS, Delft]"
train_5,"[Apeldoorn, Deventer, Zwolle, Steenwijk, Zwolle, Almelo, Hengelo, Enschede, Hengelo, Almelo, Hengelo, Enschede]"
train_6,"[Assen, Zwolle, Assen, Zwolle, Deventer, Zwolle]"
train_7,"[Lelystad Centrum, Almere Centrum, Lelystad Centrum, Almere Centrum, Amsterdam Centraal, Almere Centrum, Lelystad Centrum, Almere Centrum, Hilversum, Amsterdam Amstel, Amsterdam Centraal]"
train_8,"[Hoorn, Alkmaar, Hoorn, Alkmaar, Den Helder, Alkmaar]"
train_9,"[Oss, Nijmegen, Oss, s-Hertogenbosch, Eindhoven, Helmond, Venlo, Helmond, Venlo]"
train_10,"[Nijmegen, Arnhem Centraal, Nijmegen, Oss, Nijmegen, Arnhem Centraal, Nijmegen, Oss, Nijmegen, Arnhem Centraal, Nijmegen, Oss, s-Hertogenbosch, Oss]"
train_11,"[Steenwijk, Heerenveen, Leeuwarden, Heerenveen, Leeuwarden, Heerenveen, Leeuwarden, Heerenveen, Leeuwarden, Heerenveen, Steenwijk]"
train_12,"[Heemstede-Aerdenhout, Leiden Centraal, Den Haag Centraal, Delft, Den Haag Laan v NOI, Gouda, Utrecht Centraal, Alphen a/d Rijn, Gouda, Utrecht Centraal]"
train_13,"[s-Hertogenbosch, Eindhoven, Weert, Eindhoven, Helmond, Eindhoven, Helmond, Venlo, Helmond, Venlo]"
train_14,"[Groningen, Assen, Groningen, Leeuwarden, Groningen, Leeuwarden, Heerenveen, Leeuwarden]"
train_15,"[Alphen a/d Rijn, Utrecht Centraal, s-Hertogenbosch, Tilburg, Eindhoven, s-Hertogenbosch, Utrecht Centraal, Gouda, Den Haag HS]"
train_16,"[Tilburg, Breda, Tilburg, Eindhoven, Helmond, Eindhoven, Tilburg, s-Hertogenbosch, Utrecht Centraal, Hilversum, Utrecht Centraal]"
train_17,"[Schiphol Airport, Amsterdam Zuid, Amsterdam Sloterdijk, Haarlem, Heemstede-Aerdenhout, Leiden Centraal, Den Haag Centraal, Leiden Centraal, Den Haag Centraal, Delft, Den Haag HS, Leiden Centraal, Den Haag HS, Gouda]"
train_18,"[Tilburg, Breda, Etten-Leur, Breda, Etten-Leur, Breda, Tilburg, Eindhoven, Helmond, Venlo, Helmond, Venlo]"
train_19,"[Hengelo, Almelo, Zwolle, Almelo, Hengelo, Almelo, Hengelo, Almelo, Zwolle]"
train_20,"[Amsterdam Sloterdijk, Zaandam, Amsterdam Sloterdijk, Amsterdam Zuid, Amsterdam Sloterdijk, Amsterdam Zuid, Schiphol Airport, Amsterdam Zuid, Amsterdam Sloterdijk, Zaandam, Castricum, Beverwijk, Zaandam, Beverwijk]"
score,877.1348314606739
