train,stations
train_1,"[Amsterdam Sloterdijk, Zaandam, Hoorn, Alkmaar, Den Helder, Alkmaar, Castricum, Alkmaar]"
train_2,"[Zaandam, Beverwijk, Castricum, Alkmaar, Hoorn, Zaandam, Castricum, Alkmaar, Den Helder]"
train_3,"[Heemstede-Aerdenhout, Leiden Centraal, Schiphol Airport, Leiden Centraal, Den Haag HS, Gouda, Utrecht Centraal, Amersfoort, Apeldoorn, Zutphen, Deventer, Zutphen]"
train_4,"[Enschede, Hengelo, Enschede, Hengelo, Almelo, Hengelo, Enschede, Hengelo, Almelo, Deventer, Zwolle, Amersfoort]"
train_5,"[Den Haag Centraal, Leiden Centraal, Den Haag Laan v NOI, Leiden Centraal, Alphen a/d Rijn, Gouda, Rotterdam Alexander, Gouda, Den Haag Laan v NOI, Gouda, Utrecht Centraal]"
train_6,"[Etten-Leur, Breda, Etten-Leur, Breda, Dordrecht, Rotterdam Centraal, Schiedam Centrum, Rotterdam Blaak, Rotterdam Alexander, Rotterdam Blaak, Dordrecht, Rotterdam Blaak, Schiedam Centrum, Delft, Den Haag Centraal, Gouda]"
train_7,"[Haarlem, Beverwijk, Haarlem, Heemstede-Aerdenhout, Haarlem, Heemstede-Aerdenhout, Haarlem, Heemstede-Aerdenhout, Leiden Centraal, Den Haag Laan v NOI, Delft, Den Haag Laan v NOI, Delft, Den Haag Laan v NOI, Delft, Den Haag Centraal, Gouda]"
train_8,"[Arnhem Centraal, Nijmegen, Oss, s-Hertogenbosch, Oss, Nijmegen, Oss, s-Hertogenbosch, Tilburg, Breda, Etten-Leur, Breda, Dordrecht, Rotterdam Blaak]"
train_9,"[Deventer, Apeldoorn, Deventer, Almelo, Hengelo, Almelo, Zwolle, Assen]"
train_10,"[Zutphen, Apeldoorn, Amersfoort, Apeldoorn, Amersfoort, Zwolle, Assen]"
train_11,"[Breda, Dordrecht, Roosendaal, Vlissingen, Roosendaal]"
train_12,"[Amsterdam Centraal, Amsterdam Amstel, Almere Centrum, Amsterdam Centraal, Amsterdam Amstel, Amsterdam Centraal, Almere Centrum, Lelystad Centrum, Almere Centrum, Amsterdam Amstel, Amsterdam Centraal, Almere Centrum]"
train_13,"[Amsterdam Amstel, Amsterdam Centraal, Almere Centrum, Amsterdam Amstel, Amsterdam Centraal, Amsterdam Amstel, Amsterdam Centraal, Amsterdam Sloterdijk, Amsterdam Zuid, Schiphol Airport, Amsterdam Zuid, Schiphol Airport, Leiden Centraal, Schiphol Airport, Leiden Centraal, Den Haag HS]"
train_14,"[Amsterdam Amstel, Utrecht Centraal, Amsterdam Centraal, Amsterdam Amstel, Amsterdam Centraal, Amsterdam Amstel, Almere Centrum, Amsterdam Centraal, Utrecht Centraal, Amsterdam Centraal, Amsterdam Sloterdijk]"
train_15,"[Leeuwarden, Groningen, Leeuwarden, Heerenveen, Leeuwarden, Heerenveen, Steenwijk, Zwolle]"
train_16,"[Beverwijk, Haarlem, Amsterdam Sloterdijk, Amsterdam Zuid, Amsterdam Amstel, Hilversum, Almere Centrum, Amsterdam Centraal, Amsterdam Amstel, Amsterdam Zuid, Schiphol Airport]"
train_17,"[Heerlen, Sittard, Maastricht, Sittard, Roermond, Weert, Roermond, Sittard, Heerlen, Sittard, Roermond, Sittard, Roermond]"
train_18,"[Den Haag HS, Gouda, Den Haag Laan v NOI, Leiden Centraal, Den Haag Laan v NOI, Delft, Schiedam Centrum, Rotterdam Centraal, Schiedam Centrum, Rotterdam Blaak, Dordrecht, Rotterdam Blaak, Schiedam Centrum, Delft, Den Haag HS, Leiden Centraal]"
train_19,"[Nijmegen, Oss, s-Hertogenbosch, Tilburg, s-Hertogenbosch, Tilburg, Breda, Tilburg, s-Hertogenbosch, Eindhoven, Helmond, Eindhoven, s-Hertogenbosch]"
train_20,"[Eindhoven, s-Hertogenbosch, Tilburg, s-Hertogenbosch, Utrecht Centraal, Amsterdam Amstel, Hilversum, Utrecht Centraal, Hilversum]"
score,3350.685393258427
