train,stations
train_1,"[Den Haag HS, Delft, Schiedam Centrum, Rotterdam Blaak, Dordrecht, Rotterdam Blaak, Schiedam Centrum, Rotterdam Centraal, Schiedam Centrum, Rotterdam Blaak, Dordrecht, Rotterdam Blaak, Rotterdam Alexander, Gouda, Den Haag Laan v NOI, Leiden Centraal]"
train_2,"[Tilburg, s-Hertogenbosch, Tilburg, s-Hertogenbosch, Utrecht Centraal, Amsterdam Centraal, Amsterdam Sloterdijk, Zaandam, Beverwijk, Haarlem, Amsterdam Sloterdijk, Haarlem]"
train_3,"[Utrecht Centraal, Gouda, Den Haag Centraal, Gouda, Den Haag Centraal, Delft, Den Haag HS, Leiden Centraal, Heemstede-Aerdenhout, Leiden Centraal, Heemstede-Aerdenhout, Haarlem, Amsterdam Sloterdijk, Zaandam]"
train_4,"[Den Haag HS, Leiden Centraal, Den Haag HS, Gouda, Alphen a/d Rijn, Utrecht Centraal, Amsterdam Centraal, Utrecht Centraal, Alphen a/d Rijn]"
train_5,"[Delft, Schiedam Centrum, Delft, Den Haag Laan v NOI, Gouda, Den Haag Centraal, Delft, Den Haag Centraal, Delft, Den Haag Laan v NOI, Gouda, Den Haag Centraal]"
train_6,"[Dordrecht, Rotterdam Blaak, Schiedam Centrum, Rotterdam Blaak, Dordrecht, Breda, Tilburg, Eindhoven, Tilburg, s-Hertogenbosch, Tilburg, s-Hertogenbosch, Oss]"
train_7,"[Amersfoort, Zwolle, Almelo, Deventer, Almelo, Zwolle]"
train_8,"[Zutphen, Apeldoorn, Deventer, Apeldoorn, Zutphen, Dieren, Zutphen, Deventer, Apeldoorn, Deventer, Apeldoorn, Amersfoort, Utrecht Centraal]"
train_9,"[Alkmaar, Castricum, Beverwijk, Castricum, Alkmaar, Castricum, Zaandam, Hoorn, Alkmaar, Castricum, Beverwijk, Haarlem, Amsterdam Sloterdijk, Amsterdam Centraal, Amsterdam Amstel]"
train_10,"[Assen, Groningen, Leeuwarden, Groningen, Leeuwarden, Groningen, Assen]"
train_11,"[Amsterdam Amstel, Amsterdam Centraal, Amsterdam Amstel, Hilversum, Utrecht Centraal, Amsterdam Amstel, Hilversum, Amsterdam Amstel, Utrecht Centraal, Amsterdam Amstel]"
train_12,"[Den Haag Laan v NOI, Gouda, Den Haag Centraal, Leiden Centraal, Heemstede-Aerdenhout, Leiden Centraal, Den Haag Laan v NOI, Leiden Centraal, Alphen a/d Rijn, Utrecht Centraal, Hilversum]"
train_13,"[Arnhem Centraal, Dieren, Zutphen, Apeldoorn, Amersfoort, Apeldoorn, Zutphen, Dieren, Arnhem Centraal, Dieren, Arnhem Centraal, Ede-Wageningen, Arnhem Centraal]"
train_14,"[Arnhem Centraal, Dieren, Arnhem Centraal, Nijmegen, Arnhem Centraal, Dieren, Arnhem Centraal, Ede-Wageningen, Utrecht Centraal, Schiphol Airport, Leiden Centraal, Alphen a/d Rijn]"
train_15,"[Ede-Wageningen, Arnhem Centraal, Dieren, Zutphen, Apeldoorn, Zutphen, Apeldoorn, Zutphen, Dieren, Arnhem Centraal, Dieren, Arnhem Centraal, Nijmegen]"
train_16,"[Steenwijk, Heerenveen, Steenwijk, Heerenveen, Leeuwarden, Groningen, Leeuwarden, Heerenveen, Steenwijk]"
train_17,"[Breda, Tilburg, s-Hertogenbosch, Eindhoven, s-Hertogenbosch, Tilburg, Eindhoven, Weert, Roermond, Weert, Roermond, Sittard]"
train_18,"[Amsterdam Zuid, Amsterdam Amstel, Amsterdam Centraal, Utrecht Centraal, Amsterdam Amstel, Almere Centrum, Hilversum, Utrecht Centraal, Gouda, Den Haag Centraal]"
train_19,"[Venlo, Helmond, Eindhoven, Tilburg, Eindhoven, Weert, Roermond, Sittard, Maastricht, Sittard, Roermond]"
train_20,"[Zutphen, Apeldoorn, Amersfoort, Utrecht Centraal, Hilversum, Almere Centrum, Amsterdam Centraal, Amsterdam Amstel, Amsterdam Centraal, Amsterdam Sloterdijk, Amsterdam Centraal, Amsterdam Sloterdijk, Haarlem, Heemstede-Aerdenhout]"
score,2652.8876404494376
