train,stations
train_1,"[Hoorn, Zaandam, Castricum, Beverwijk, Zaandam, Amsterdam Sloterdijk, Haarlem, Beverwijk, Castricum, Zaandam, Castricum, Zaandam, Amsterdam Sloterdijk, Haarlem]"
train_2,"[Ede-Wageningen, Arnhem Centraal, Ede-Wageningen, Utrecht Centraal, Amsterdam Centraal, Almere Centrum, Amsterdam Amstel, Amsterdam Centraal, Almere Centrum, Hilversum]"
train_3,"[Steenwijk, Zwolle, Almelo, Hengelo, Almelo, Deventer, Zwolle, Assen]"
train_4,"[Apeldoorn, Zutphen, Deventer, Zwolle, Deventer, Zutphen, Dieren, Zutphen, Apeldoorn, Zutphen, Apeldoorn, Deventer]"
train_5,"[Schiphol Airport, Amsterdam Zuid, Schiphol Airport, Leiden Centraal, Den Haag Laan v NOI, Delft, Den Haag Laan v NOI, Gouda, Den Haag Laan v NOI, Delft, Den Haag Laan v NOI, Leiden Centraal, Den Haag Laan v NOI]"
train_6,"[Hoorn, Alkmaar, Hoorn, Alkmaar, Castricum, Beverwijk, Zaandam, Amsterdam Sloterdijk, Amsterdam Centraal, Utrecht Centraal, Amersfoort]"
train_7,"[Zaandam, Hoorn, Zaandam, Amsterdam Sloterdijk, Zaandam, Hoorn, Zaandam, Amsterdam Sloterdijk, Zaandam, Hoorn]"
train_8,"[Etten-Leur, Roosendaal, Etten-Leur, Roosendaal, Vlissingen, Roosendaal]"
train_9,"[Dieren, Arnhem Centraal, Dieren, Arnhem Centraal, Nijmegen, Arnhem Centraal, Ede-Wageningen, Utrecht Centraal, s-Hertogenbosch, Oss, Nijmegen, Arnhem Centraal, Nijmegen]"
train_10,"[Roermond, Sittard, Maastricht, Sittard, Roermond, Weert, Roermond, Weert, Roermond, Weert, Eindhoven, Weert]"
train_11,"[Rotterdam Blaak, Dordrecht, Rotterdam Centraal, Schiedam Centrum, Rotterdam Blaak, Dordrecht, Roosendaal, Dordrecht, Rotterdam Centraal, Schiedam Centrum, Rotterdam Centraal, Dordrecht, Breda]"
train_12,"[Leeuwarden, Groningen, Assen, Zwolle, Almelo, Deventer, Apeldoorn, Deventer]"
train_13,"[Amersfoort, Zwolle, Assen, Zwolle, Steenwijk, Heerenveen, Steenwijk]"
train_14,"[Eindhoven, s-Hertogenbosch, Eindhoven, Tilburg, Eindhoven, Tilburg, Eindhoven, s-Hertogenbosch, Tilburg, Breda, Etten-Leur]"
train_15,"[Heerenveen, Leeuwarden, Groningen, Leeuwarden, Groningen, Leeuwarden, Heerenveen]"
train_16,"[Hilversum, Amsterdam Amstel, Hilversum, Utrecht Centraal, Amersfoort, Zwolle, Steenwijk, Zwolle]"
train_17,"[Venlo, Helmond, Eindhoven, s-Hertogenbosch, Tilburg, Eindhoven, Weert, Eindhoven, Tilburg, Eindhoven, Helmond]"
train_18,"[Groningen, Assen, Groningen, Assen, Groningen, Leeuwarden, Heerenveen, Leeuwarden, Groningen]"
train_19,"[Almere Centrum, Amsterdam Amstel, Amsterdam Zuid, Amsterdam Amstel, Utrecht Centraal, Schiphol Airport, Utrecht Centraal, Alphen a/d Rijn]"
train_20,"[Tilburg, Breda, Tilburg, s-Hertogenbosch, Utrecht Centraal, Gouda, Rotterdam Alexander, Rotterdam Centraal, Rotterdam Alexander, Rotterdam Centraal, Rotterdam Alexander, Gouda, Rotterdam Alexander, Gouda, Alphen a/d Rijn]"
score,2655.8876404494376
