train,stations
train_1,"[Almere Centrum, Amsterdam Centraal, Utrecht Centraal, Gouda, Den Haag HS, Gouda, Rotterdam Alexander, Gouda, Rotterdam Alexander, Rotterdam Centraal, Schiedam Centrum, Rotterdam Blaak, Dordrecht]"
train_2,"[Oss, s-Hertogenbosch, Oss, Nijmegen, Arnhem Centraal, Dieren, Zutphen, Apeldoorn, Deventer, Zutphen, Dieren, Arnhem Centraal, Nijmegen, Arnhem Centraal, Ede-Wageningen]"
train_3,"[Leiden Centraal, Schiphol Airport, Utrecht Centraal, Amsterdam Amstel, Amsterdam Zuid, Amsterdam Sloterdijk, Amsterdam Zuid, Schiphol Airport, Amsterdam Zuid, Schiphol Airport, Utrecht Centraal]"
train_4,"[Heemstede-Aerdenhout, Leiden Centraal, Schiphol Airport, Amsterdam Zuid, Schiphol Airport, Leiden Centraal, Alphen a/d Rijn, Leiden Centraal, Heemstede-Aerdenhout, Leiden Centraal, Den Haag Centraal, Leiden Centraal, Alphen a/d Rijn, Utrecht Centraal]"
train_5,"[Arnhem Centraal, Dieren, Zutphen, Dieren, Zutphen, Deventer, Zutphen, Deventer, Apeldoorn, Zutphen, Dieren, Arnhem Centraal, Ede-Wageningen, Utrecht Centraal]"
train_6,"[Amsterdam Zuid, Amsterdam Sloterdijk, Amsterdam Zuid, Amsterdam Sloterdijk, Zaandam, Amsterdam Sloterdijk, Haarlem, Amsterdam Sloterdijk, Haarlem, Heemstede-Aerdenhout, Haarlem, Heemstede-Aerdenhout, Haarlem, Beverwijk, Castricum, Zaandam, Amsterdam Sloterdijk, Haarlem]"
train_7,"[Assen, Groningen, Assen, Zwolle, Amersfoort, Zwolle, Amersfoort]"
train_8,"[Lelystad Centrum, Almere Centrum, Lelystad Centrum, Almere Centrum, Lelystad Centrum, Almere Centrum, Lelystad Centrum, Almere Centrum, Lelystad Centrum, Almere Centrum, Lelystad Centrum, Almere Centrum, Amsterdam Centraal]"
train_9,"[s-Hertogenbosch, Oss, Nijmegen, Oss, Nijmegen, Arnhem Centraal, Dieren, Zutphen, Dieren, Arnhem Centraal, Nijmegen, Oss, Nijmegen, Arnhem Centraal, Nijmegen]"
train_10,"[Roosendaal, Vlissingen, Roosendaal]"
train_11,"[Rotterdam Alexander, Gouda, Alphen a/d Rijn, Gouda, Den Haag Centraal, Gouda, Rotterdam Alexander, Rotterdam Centraal, Rotterdam Alexander, Rotterdam Centraal, Schiedam Centrum, Rotterdam Centraal, Schiedam Centrum, Rotterdam Centraal, Schiedam Centrum, Delft, Den Haag Centraal, Delft]"
train_12,"[Castricum, Beverwijk, Castricum, Beverwijk, Haarlem, Beverwijk, Zaandam, Castricum, Zaandam, Amsterdam Sloterdijk, Amsterdam Centraal, Amsterdam Sloterdijk, Haarlem, Heemstede-Aerdenhout, Haarlem, Heemstede-Aerdenhout, Haarlem]"
train_13,"[Almelo, Zwolle, Assen, Groningen, Assen, Zwolle]"
train_14,"[Eindhoven, Helmond, Eindhoven, Helmond, Eindhoven, s-Hertogenbosch, Oss, s-Hertogenbosch, Utrecht Centraal, Schiphol Airport, Leiden Centraal, Den Haag Centraal, Delft]"
train_15,"[Gouda, Den Haag HS, Delft, Schiedam Centrum, Rotterdam Centraal, Rotterdam Alexander, Gouda, Alphen a/d Rijn, Gouda, Alphen a/d Rijn, Leiden Centraal, Den Haag Centraal, Delft, Den Haag Laan v NOI, Leiden Centraal]"
train_16,"[Steenwijk, Zwolle, Assen, Zwolle, Steenwijk, Zwolle, Deventer]"
train_17,"[Zutphen, Deventer, Zwolle, Almelo, Zwolle, Deventer, Zwolle]"
train_18,"[Schiphol Airport, Utrecht Centraal, Ede-Wageningen, Arnhem Centraal, Ede-Wageningen, Utrecht Centraal, Amsterdam Centraal, Utrecht Centraal]"
train_19,"[Helmond, Eindhoven, s-Hertogenbosch, Tilburg, s-Hertogenbosch, Oss, Nijmegen, Arnhem Centraal, Ede-Wageningen, Utrecht Centraal, Ede-Wageningen, Arnhem Centraal, Nijmegen]"
train_20,"[Eindhoven, Helmond, Eindhoven, s-Hertogenbosch, Oss, s-Hertogenbosch, Tilburg, s-Hertogenbosch, Oss, Nijmegen, Oss, Nijmegen, Arnhem Centraal, Dieren]"
score,900.1348314606739
