train,stations
train_1,"[Sittard, Maastricht, Sittard, Heerlen, Sittard, Roermond, Weert, Eindhoven, s-Hertogenbosch, Eindhoven, s-Hertogenbosch]"
train_2,"[Dieren, Zutphen, Apeldoorn, Amersfoort, Apeldoorn, Amersfoort, Apeldoorn, Deventer, Zwolle]"
train_3,"[Hengelo, Enschede, Hengelo, Almelo, Deventer, Zwolle, Amersfoort, Zwolle]"
train_4,"[Arnhem Centraal, Nijmegen, Oss, s-Hertogenbosch, Utrecht Centraal, Amsterdam Centraal, Almere Centrum, Amsterdam Centraal, Amsterdam Sloterdijk, Amsterdam Zuid, Schiphol Airport]"
train_5,"[Amersfoort, Zwolle, Steenwijk, Heerenveen, Steenwijk, Heerenveen, Leeuwarden, Groningen, Assen]"
train_6,"[Dordrecht, Breda, Tilburg, Eindhoven, Weert, Roermond, Sittard, Heerlen, Sittard, Maastricht, Sittard, Maastricht]"
train_7,"[Heemstede-Aerdenhout, Leiden Centraal, Alphen a/d Rijn, Leiden Centraal, Den Haag Laan v NOI, Leiden Centraal, Den Haag Centraal, Leiden Centraal, Den Haag HS, Leiden Centraal, Den Haag Laan v NOI, Delft, Den Haag HS, Leiden Centraal, Den Haag Centraal, Leiden Centraal]"
train_8,"[Rotterdam Blaak, Schiedam Centrum, Delft, Den Haag Laan v NOI, Delft, Den Haag Laan v NOI, Gouda, Rotterdam Alexander, Rotterdam Blaak, Dordrecht, Rotterdam Blaak, Dordrecht, Roosendaal]"
train_9,"[Breda, Dordrecht, Rotterdam Blaak, Dordrecht, Breda, Dordrecht, Rotterdam Centraal, Rotterdam Alexander, Gouda, Den Haag Centraal, Delft, Den Haag Centraal, Gouda]"
train_10,"[Almelo, Zwolle, Deventer, Almelo, Hengelo, Enschede, Hengelo, Almelo, Deventer, Apeldoorn, Deventer, Apeldoorn]"
train_11,"[Amsterdam Amstel, Amsterdam Centraal, Amsterdam Amstel, Utrecht Centraal, Amsterdam Centraal, Amsterdam Amstel, Hilversum, Utrecht Centraal, Hilversum, Almere Centrum, Lelystad Centrum]"
train_12,"[Hilversum, Utrecht Centraal, s-Hertogenbosch, Oss, s-Hertogenbosch, Tilburg, Breda, Etten-Leur, Roosendaal, Etten-Leur, Breda, Etten-Leur, Breda, Dordrecht, Rotterdam Centraal]"
train_13,"[Amsterdam Zuid, Amsterdam Amstel, Almere Centrum, Hilversum, Amsterdam Amstel, Utrecht Centraal, Schiphol Airport, Utrecht Centraal]"
train_14,"[Ede-Wageningen, Arnhem Centraal, Dieren, Zutphen, Dieren, Arnhem Centraal, Nijmegen, Oss, Nijmegen, Arnhem Centraal, Nijmegen, Arnhem Centraal, Ede-Wageningen, Arnhem Centraal, Nijmegen, Oss]"
train_15,"[Hilversum, Amsterdam Amstel, Utrecht Centraal, Gouda, Utrecht Centraal, Amsterdam Amstel, Utrecht Centraal, Alphen a/d Rijn, Leiden Centraal, Den Haag Laan v NOI]"
train_16,"[Zutphen, Dieren, Zutphen, Deventer, Almelo, Zwolle, Deventer, Apeldoorn, Amersfoort, Utrecht Centraal]"
train_17,"[Weert, Roermond, Weert, Roermond, Weert, Roermond, Weert, Eindhoven, Weert, Roermond, Weert, Roermond, Weert]"
train_18,"[Amsterdam Sloterdijk, Haarlem, Heemstede-Aerdenhout, Haarlem, Beverwijk, Zaandam, Hoorn, Alkmaar, Hoorn, Zaandam, Castricum]"
train_19,"[Den Haag Laan v NOI, Delft, Schiedam Centrum, Delft, Den Haag Centraal, Leiden Centraal, Den Haag Centraal, Leiden Centraal, Den Haag HS, Delft, Den Haag HS, Leiden Centraal, Schiphol Airport, Amsterdam Zuid, Amsterdam Sloterdijk, Haarlem, Heemstede-Aerdenhout, Haarlem]"
train_20,"[Amsterdam Centraal, Almere Centrum, Amsterdam Centraal, Almere Centrum, Lelystad Centrum, Almere Centrum, Lelystad Centrum, Almere Centrum, Amsterdam Amstel, Amsterdam Zuid, Amsterdam Sloterdijk, Zaandam]"
score,3370.044943820225
