train,stations
train_1,"[Schiedam Centrum, Rotterdam Centraal, Schiedam Centrum, Rotterdam Blaak, Schiedam Centrum, Rotterdam Blaak, Dordrecht, Rotterdam Blaak, Dordrecht, Breda, Tilburg, Breda, Tilburg, Breda, Dordrecht]"
train_2,"[Vlissingen, Roosendaal, Vlissingen]"
train_3,"[Weert, Roermond, Sittard, Maastricht, Sittard, Roermond, Weert, Eindhoven, Weert, Eindhoven, Tilburg, Breda]"
train_4,"[Heerlen, Sittard, Heerlen, Sittard, Heerlen, Sittard, Maastricht, Sittard, Heerlen, Sittard, Maastricht, Sittard]"
train_5,"[Nijmegen, Arnhem Centraal, Nijmegen, Arnhem Centraal, Ede-Wageningen, Utrecht Centraal, s-Hertogenbosch, Eindhoven, s-Hertogenbosch, Eindhoven, Weert]"
train_6,"[Rotterdam Centraal, Dordrecht, Rotterdam Centraal, Dordrecht, Roosendaal, Vlissingen]"
train_7,"[Beverwijk, Zaandam, Amsterdam Sloterdijk, Amsterdam Zuid, Amsterdam Amstel, Hilversum, Utrecht Centraal, Alphen a/d Rijn, Gouda, Rotterdam Alexander, Rotterdam Blaak, Rotterdam Alexander]"
train_8,"[Rotterdam Centraal, Dordrecht, Roosendaal, Etten-Leur, Breda, Etten-Leur, Roosendaal, Dordrecht, Rotterdam Centraal, Schiedam Centrum, Rotterdam Blaak, Dordrecht, Roosendaal]"
train_9,"[Assen, Zwolle, Deventer, Zwolle, Amersfoort, Zwolle]"
train_10,"[Amsterdam Sloterdijk, Zaandam, Castricum, Alkmaar, Den Helder, Alkmaar, Den Helder, Alkmaar]"
train_11,"[Roosendaal, Vlissingen, Roosendaal, Dordrecht, Rotterdam Blaak, Rotterdam Alexander, Rotterdam Centraal]"
train_12,"[Amsterdam Zuid, Schiphol Airport, Utrecht Centraal, Schiphol Airport, Utrecht Centraal, Gouda, Den Haag HS, Delft, Den Haag Centraal, Delft]"
train_13,"[Lelystad Centrum, Almere Centrum, Amsterdam Centraal, Utrecht Centraal, Gouda, Den Haag HS, Leiden Centraal, Alphen a/d Rijn, Gouda, Utrecht Centraal]"
train_14,"[Schiphol Airport, Utrecht Centraal, Amsterdam Amstel, Almere Centrum, Lelystad Centrum, Almere Centrum, Lelystad Centrum, Almere Centrum, Amsterdam Amstel, Amsterdam Zuid, Schiphol Airport]"
train_15,"[Beverwijk, Castricum, Beverwijk, Castricum, Alkmaar, Hoorn, Alkmaar, Castricum, Alkmaar, Den Helder]"
train_16,"[Hilversum, Utrecht Centraal, Amsterdam Amstel, Almere Centrum, Hilversum, Amsterdam Amstel, Amsterdam Zuid, Schiphol Airport, Utrecht Centraal]"
train_17,"[Den Haag Centraal, Leiden Centraal, Alphen a/d Rijn, Gouda, Alphen a/d Rijn, Leiden Centraal, Alphen a/d Rijn, Utrecht Centraal, Gouda, Den Haag Centraal, Leiden Centraal]"
train_18,"[Rotterdam Centraal, Rotterdam Alexander, Rotterdam Centraal, Rotterdam Alexander, Rotterdam Blaak, Rotterdam Alexander, Rotterdam Blaak, Rotterdam Alexander, Rotterdam Centraal, Schiedam Centrum, Rotterdam Blaak, Dordrecht, Roosendaal]"
train_19,"[Assen, Zwolle, Almelo, Deventer, Zwolle, Amersfoort]"
train_20,"[Maastricht, Sittard, Roermond, Sittard, Roermond, Weert, Eindhoven, Helmond, Eindhoven, s-Hertogenbosch, Eindhoven, Weert, Roermond]"
score,1355.2134831460671
