train,stations
train_1,"[Roosendaal, Vlissingen, Roosendaal]"
train_2,"[Ede-Wageningen, Utrecht Centraal, Amersfoort, Zwolle, Steenwijk, Zwolle, Amersfoort]"
train_3,"[Eindhoven, s-Hertogenbosch, Eindhoven, Tilburg, Eindhoven, Tilburg, Eindhoven, Tilburg, Eindhoven]"
train_4,"[Delft, Den Haag Laan v NOI, Delft, Schiedam Centrum, Rotterdam Centraal, Dordrecht, Rotterdam Centraal, Rotterdam Alexander, Rotterdam Blaak, Dordrecht, Roosendaal, Etten-Leur, Breda, Etten-Leur, Breda, Tilburg]"
train_5,"[Hengelo, Almelo, Deventer, Zutphen, Dieren, Arnhem Centraal, Dieren, Arnhem Centraal, Ede-Wageningen, Arnhem Centraal, Dieren, Arnhem Centraal, Nijmegen, Oss, s-Hertogenbosch]"
train_6,"[Weert, Roermond, Sittard, Roermond, Weert, Roermond, Sittard, Heerlen, Sittard, Roermond, Weert, Roermond, Sittard]"
train_7,"[Rotterdam Centraal, Dordrecht, Breda, Dordrecht, Rotterdam Centraal, Rotterdam Alexander, Gouda, Den Haag Centraal, Leiden Centraal, Schiphol Airport, Leiden Centraal, Den Haag HS, Leiden Centraal]"
train_8,"[Arnhem Centraal, Ede-Wageningen, Arnhem Centraal, Nijmegen, Arnhem Centraal, Nijmegen, Oss, s-Hertogenbosch, Tilburg, Breda, Dordrecht, Roosendaal]"
train_9,"[Leeuwarden, Groningen, Leeuwarden, Heerenveen, Steenwijk, Heerenveen, Leeuwarden, Heerenveen, Leeuwarden]"
train_10,"[Dieren, Arnhem Centraal, Nijmegen, Oss, Nijmegen, Arnhem Centraal, Nijmegen, Arnhem Centraal, Ede-Wageningen, Utrecht Centraal, Ede-Wageningen, Utrecht Centraal]"
train_11,"[Breda, Etten-Leur, Roosendaal, Vlissingen, Roosendaal]"
train_12,"[Delft, Den Haag Laan v NOI, Delft, Den Haag Centraal, Gouda, Den Haag Laan v NOI, Delft, Den Haag Centraal, Leiden Centraal, Den Haag HS, Gouda]"
train_13,"[Den Haag Laan v NOI, Delft, Den Haag Laan v NOI, Gouda, Den Haag Laan v NOI, Gouda, Den Haag Centraal, Leiden Centraal, Den Haag Centraal, Leiden Centraal, Den Haag HS]"
train_14,"[Helmond, Venlo, Helmond, Venlo, Helmond, Venlo]"
train_15,"[Sittard, Maastricht, Sittard, Heerlen, Sittard, Roermond, Sittard, Heerlen, Sittard, Heerlen, Sittard, Roermond]"
train_16,"[Amsterdam Centraal, Amsterdam Amstel, Utrecht Centraal, Alphen a/d Rijn, Gouda, Rotterdam Alexander, Rotterdam Blaak, Dordrecht, Rotterdam Centraal, Rotterdam Alexander, Rotterdam Centraal, Rotterdam Alexander, Rotterdam Centraal, Rotterdam Alexander, Gouda]"
train_17,"[Heerlen, Sittard, Heerlen, Sittard, Heerlen, Sittard, Roermond, Weert, Eindhoven, Tilburg, s-Hertogenbosch]"
train_18,"[Rotterdam Alexander, Rotterdam Centraal, Dordrecht, Breda, Etten-Leur, Breda, Etten-Leur, Breda, Dordrecht, Rotterdam Centraal, Schiedam Centrum, Rotterdam Blaak, Schiedam Centrum, Rotterdam Blaak, Rotterdam Alexander, Rotterdam Centraal, Schiedam Centrum, Delft]"
train_19,"[Beverwijk, Haarlem, Beverwijk, Castricum, Alkmaar, Den Helder, Alkmaar, Den Helder]"
train_20,"[Den Haag HS, Leiden Centraal, Den Haag HS, Delft, Den Haag Laan v NOI, Gouda, Den Haag HS, Gouda, Utrecht Centraal, Schiphol Airport]"
score,1210.8539325842703
