train,stations
train_1,"[Rotterdam Centraal, Dordrecht, Rotterdam Blaak, Schiedam Centrum, Rotterdam Blaak, Rotterdam Alexander, Rotterdam Centraal, Dordrecht, Breda, Dordrecht, Breda, Etten-Leur, Roosendaal]"
train_2,"[Tilburg, s-Hertogenbosch, Utrecht Centraal, Schiphol Airport, Utrecht Centraal, Amsterdam Centraal, Amsterdam Amstel, Almere Centrum]"
train_3,"[Assen, Groningen, Leeuwarden, Groningen, Leeuwarden, Heerenveen, Leeuwarden, Heerenveen]"
train_4,"[Etten-Leur, Breda, Etten-Leur, Roosendaal, Dordrecht, Rotterdam Blaak, Schiedam Centrum, Rotterdam Blaak, Schiedam Centrum, Delft, Schiedam Centrum, Rotterdam Blaak, Dordrecht, Rotterdam Blaak, Dordrecht, Rotterdam Centraal]"
train_5,"[Roermond, Sittard, Heerlen, Sittard, Heerlen, Sittard, Roermond, Weert, Roermond, Weert, Roermond, Sittard, Maastricht]"
train_6,"[Delft, Den Haag Laan v NOI, Leiden Centraal, Den Haag HS, Leiden Centraal, Alphen a/d Rijn, Leiden Centraal, Den Haag Laan v NOI, Leiden Centraal, Alphen a/d Rijn, Gouda, Den Haag Centraal, Gouda, Utrecht Centraal]"
train_7,"[Rotterdam Alexander, Rotterdam Blaak, Rotterdam Alexander, Gouda, Den Haag Centraal, Delft, Schiedam Centrum, Rotterdam Centraal, Rotterdam Alexander, Rotterdam Centraal, Rotterdam Alexander, Rotterdam Centraal, Schiedam Centrum, Rotterdam Centraal, Schiedam Centrum, Rotterdam Blaak, Dordrecht, Rotterdam Centraal, Dordrecht]"
train_8,"[Den Haag HS, Gouda, Den Haag HS, Gouda, Den Haag Laan v NOI, Gouda, Den Haag HS, Gouda, Rotterdam Alexander, Rotterdam Centraal]"
train_9,"[Assen, Zwolle, Steenwijk, Heerenveen, Leeuwarden, Groningen, Leeuwarden]"
train_10,"[Den Haag HS, Delft, Schiedam Centrum, Rotterdam Centraal, Schiedam Centrum, Delft, Den Haag Centraal, Delft, Den Haag Laan v NOI, Gouda, Den Haag Centraal, Gouda, Utrecht Centraal, Gouda]"
train_11,"[Venlo, Helmond, Venlo, Helmond, Venlo, Helmond, Eindhoven, s-Hertogenbosch]"
train_12,"[Almere Centrum, Amsterdam Centraal, Almere Centrum, Amsterdam Amstel, Hilversum, Amsterdam Amstel, Almere Centrum, Amsterdam Amstel]"
train_13,"[Leeuwarden, Groningen, Leeuwarden, Groningen, Assen, Groningen, Assen, Groningen]"
train_14,"[Heemstede-Aerdenhout, Haarlem, Heemstede-Aerdenhout, Leiden Centraal, Heemstede-Aerdenhout, Haarlem, Heemstede-Aerdenhout, Haarlem, Heemstede-Aerdenhout, Haarlem, Heemstede-Aerdenhout, Leiden Centraal, Alphen a/d Rijn, Gouda, Utrecht Centraal, Gouda, Alphen a/d Rijn]"
train_15,"[Zaandam, Hoorn, Alkmaar, Hoorn, Alkmaar, Den Helder, Alkmaar]"
train_16,"[Den Haag Laan v NOI, Leiden Centraal, Heemstede-Aerdenhout, Leiden Centraal, Den Haag HS, Leiden Centraal, Alphen a/d Rijn, Gouda, Alphen a/d Rijn, Leiden Centraal, Den Haag HS, Leiden Centraal, Schiphol Airport, Amsterdam Zuid, Schiphol Airport]"
train_17,"[Roermond, Weert, Roermond, Weert, Roermond, Weert, Eindhoven, Weert, Eindhoven, Weert, Eindhoven, Tilburg]"
train_18,"[Leiden Centraal, Schiphol Airport, Amsterdam Zuid, Schiphol Airport, Utrecht Centraal, Amsterdam Centraal, Amsterdam Sloterdijk, Haarlem, Amsterdam Sloterdijk, Zaandam, Amsterdam Sloterdijk, Amsterdam Zuid, Schiphol Airport, Amsterdam Zuid, Amsterdam Amstel]"
train_19,"[Schiphol Airport, Leiden Centraal, Heemstede-Aerdenhout, Haarlem, Amsterdam Sloterdijk, Amsterdam Zuid, Amsterdam Sloterdijk, Amsterdam Centraal, Amsterdam Sloterdijk, Zaandam, Hoorn, Alkmaar, Hoorn]"
train_20,"[Utrecht Centraal, Hilversum, Amsterdam Amstel, Amsterdam Zuid, Schiphol Airport, Leiden Centraal, Den Haag Laan v NOI, Delft, Den Haag Laan v NOI, Leiden Centraal, Den Haag Laan v NOI, Gouda, Utrecht Centraal]"
score,1153.2134831460671
