train,stations
train_1,"[Amersfoort, Apeldoorn, Amersfoort, Zwolle, Deventer, Zutphen, Dieren, Arnhem Centraal, Nijmegen, Oss]"
train_2,"[Rotterdam Blaak, Rotterdam Alexander, Gouda, Utrecht Centraal, s-Hertogenbosch, Oss, Nijmegen, Oss, s-Hertogenbosch, Utrecht Centraal, Ede-Wageningen]"
train_3,"[Lelystad Centrum, Almere Centrum, Amsterdam Amstel, Utrecht Centraal, Amsterdam Amstel, Amsterdam Zuid, Schiphol Airport, Utrecht Centraal, Amsterdam Centraal, Almere Centrum]"
train_4,"[Assen, Zwolle, Deventer, Almelo, Deventer, Zutphen, Deventer, Almelo]"
train_5,"[Nijmegen, Arnhem Centraal, Ede-Wageningen, Utrecht Centraal, Amsterdam Centraal, Utrecht Centraal, Alphen a/d Rijn, Utrecht Centraal, Amersfoort]"
train_6,"[Den Haag Centraal, Delft, Den Haag Centraal, Delft, Schiedam Centrum, Rotterdam Centraal, Dordrecht, Rotterdam Centraal, Dordrecht, Rotterdam Centraal, Rotterdam Alexander, Gouda, Rotterdam Alexander, Rotterdam Blaak, Schiedam Centrum, Rotterdam Blaak]"
train_7,"[Delft, Den Haag Centraal, Gouda, Rotterdam Alexander, Rotterdam Centraal, Dordrecht, Roosendaal, Dordrecht, Rotterdam Blaak, Schiedam Centrum, Delft, Den Haag Centraal, Leiden Centraal, Den Haag Laan v NOI]"
train_8,"[Groningen, Assen, Groningen, Assen, Zwolle, Steenwijk, Zwolle, Deventer, Apeldoorn]"
train_9,"[Tilburg, Breda, Tilburg, Breda, Dordrecht, Rotterdam Centraal, Rotterdam Alexander, Gouda, Den Haag HS, Leiden Centraal, Alphen a/d Rijn, Leiden Centraal, Den Haag Centraal, Delft]"
train_10,"[Leeuwarden, Groningen, Assen, Zwolle, Amersfoort, Zwolle]"
train_11,"[Groningen, Assen, Zwolle, Almelo, Deventer, Apeldoorn, Deventer, Apeldoorn, Amersfoort]"
train_12,"[Rotterdam Centraal, Dordrecht, Rotterdam Centraal, Rotterdam Alexander, Gouda, Den Haag Centraal, Leiden Centraal, Heemstede-Aerdenhout, Leiden Centraal, Den Haag Centraal, Delft, Den Haag HS, Delft, Den Haag HS, Delft, Den Haag Laan v NOI]"
train_13,"[Delft, Den Haag Laan v NOI, Delft, Schiedam Centrum, Rotterdam Blaak, Schiedam Centrum, Delft, Den Haag Laan v NOI, Gouda, Den Haag Centraal, Gouda, Den Haag HS, Gouda]"
train_14,"[Utrecht Centraal, Gouda, Utrecht Centraal, Ede-Wageningen, Utrecht Centraal, Amersfoort, Zwolle, Deventer, Apeldoorn]"
train_15,"[Deventer, Apeldoorn, Deventer, Zutphen, Dieren, Zutphen, Dieren, Arnhem Centraal, Nijmegen, Oss, s-Hertogenbosch, Tilburg, Eindhoven, Tilburg, Breda]"
train_16,"[Amsterdam Zuid, Amsterdam Sloterdijk, Haarlem, Amsterdam Sloterdijk, Amsterdam Zuid, Schiphol Airport, Amsterdam Zuid, Amsterdam Amstel, Almere Centrum, Lelystad Centrum, Almere Centrum, Amsterdam Centraal, Utrecht Centraal]"
train_17,"[Rotterdam Blaak, Dordrecht, Rotterdam Blaak, Rotterdam Alexander, Gouda, Den Haag Centraal, Gouda, Den Haag Centraal, Leiden Centraal, Alphen a/d Rijn, Utrecht Centraal, Ede-Wageningen]"
train_18,"[Zutphen, Deventer, Apeldoorn, Zutphen, Dieren, Zutphen, Deventer, Apeldoorn, Zutphen, Deventer, Almelo, Deventer, Apeldoorn]"
train_19,"[Amsterdam Amstel, Hilversum, Almere Centrum, Lelystad Centrum, Almere Centrum, Amsterdam Amstel, Amsterdam Zuid, Amsterdam Sloterdijk, Haarlem, Heemstede-Aerdenhout, Haarlem, Heemstede-Aerdenhout, Leiden Centraal]"
train_20,"[Groningen, Assen, Groningen, Leeuwarden, Heerenveen, Leeuwarden, Groningen, Assen, Groningen]"
score,1395.9325842696626
