train,stations
train_1,"[Den Haag Laan v NOI, Gouda, Alphen a/d Rijn, Utrecht Centraal, s-Hertogenbosch, Eindhoven, Tilburg, Eindhoven]"
train_2,"[Alphen a/d Rijn, Gouda, Den Haag Laan v NOI, Gouda, Den Haag HS, Leiden Centraal, Den Haag Centraal, Delft, Den Haag Centraal, Leiden Centraal, Heemstede-Aerdenhout]"
train_3,"[Tilburg, Breda, Tilburg, s-Hertogenbosch, Tilburg, s-Hertogenbosch, Eindhoven, Tilburg, s-Hertogenbosch, Oss, s-Hertogenbosch, Utrecht Centraal]"
train_4,"[Delft, Schiedam Centrum, Rotterdam Centraal, Dordrecht, Rotterdam Blaak, Dordrecht, Roosendaal, Vlissingen]"
train_5,"[Apeldoorn, Zutphen, Apeldoorn, Deventer, Zwolle, Amersfoort, Apeldoorn, Zutphen, Deventer]"
train_6,"[Ede-Wageningen, Arnhem Centraal, Dieren, Arnhem Centraal, Nijmegen, Arnhem Centraal, Ede-Wageningen, Utrecht Centraal, Alphen a/d Rijn, Leiden Centraal, Den Haag Laan v NOI, Leiden Centraal, Den Haag Laan v NOI, Delft]"
train_7,"[Vlissingen, Roosendaal, Vlissingen]"
train_8,"[Assen, Zwolle, Deventer, Zwolle, Steenwijk, Heerenveen, Steenwijk, Heerenveen, Steenwijk]"
train_9,"[Heemstede-Aerdenhout, Haarlem, Amsterdam Sloterdijk, Haarlem, Amsterdam Sloterdijk, Zaandam, Amsterdam Sloterdijk, Zaandam, Beverwijk, Castricum, Alkmaar, Castricum, Zaandam, Hoorn, Alkmaar]"
train_10,"[Weert, Roermond, Weert, Roermond, Weert, Roermond, Sittard, Maastricht, Sittard, Roermond, Weert, Eindhoven]"
train_11,"[Heerenveen, Steenwijk, Heerenveen, Leeuwarden, Heerenveen, Leeuwarden, Groningen, Leeuwarden, Heerenveen, Steenwijk]"
train_12,"[Sittard, Heerlen, Sittard, Roermond, Weert, Roermond, Sittard, Roermond, Weert, Roermond, Weert, Eindhoven, Helmond]"
train_13,"[s-Hertogenbosch, Eindhoven, Weert, Eindhoven, Helmond, Eindhoven, Tilburg, Breda, Dordrecht, Roosendaal, Dordrecht]"
train_14,"[Castricum, Beverwijk, Zaandam, Beverwijk, Zaandam, Hoorn, Zaandam, Beverwijk]"
train_15,"[Rotterdam Centraal, Rotterdam Alexander, Rotterdam Blaak, Rotterdam Alexander, Gouda, Rotterdam Alexander, Rotterdam Centraal, Dordrecht, Breda, Etten-Leur, Breda, Etten-Leur, Breda, Etten-Leur, Roosendaal]"
train_16,"[Heerlen, Sittard, Maastricht, Sittard, Roermond, Weert, Eindhoven, Tilburg, Breda, Dordrecht, Roosendaal]"
train_17,"[Zwolle, Almelo, Hengelo, Enschede, Hengelo, Enschede, Hengelo, Enschede, Hengelo, Almelo, Zwolle]"
train_18,"[Den Haag Laan v NOI, Delft, Schiedam Centrum, Rotterdam Blaak, Dordrecht, Roosendaal, Etten-Leur, Roosendaal, Etten-Leur, Breda, Dordrecht, Roosendaal, Dordrecht]"
train_19,"[Roermond, Weert, Eindhoven, Weert, Eindhoven, s-Hertogenbosch, Utrecht Centraal, Gouda, Den Haag Centraal, Gouda]"
train_20,"[Den Haag Laan v NOI, Gouda, Den Haag Centraal, Delft, Den Haag Centraal, Gouda, Den Haag Laan v NOI, Leiden Centraal, Den Haag Centraal, Delft, Schiedam Centrum, Rotterdam Blaak]"
score,2053.3707865168544
