train,stations
train_1,"[Leiden Centraal, Alphen a/d Rijn, Gouda, Alphen a/d Rijn, Gouda, Rotterdam Alexander, Rotterdam Blaak, Dordrecht, Breda, Tilburg, Eindhoven, s-Hertogenbosch]"
train_2,"[Arnhem Centraal, Dieren, Zutphen, Apeldoorn, Deventer, Almelo, Zwolle, Assen]"
train_3,"[Hoorn, Alkmaar, Hoorn, Zaandam, Hoorn, Zaandam, Hoorn, Alkmaar]"
train_4,"[Roermond, Sittard, Roermond, Weert, Roermond, Sittard, Roermond, Weert, Roermond, Weert, Roermond, Sittard, Roermond]"
train_5,"[Schiphol Airport, Utrecht Centraal, Ede-Wageningen, Arnhem Centraal, Ede-Wageningen, Arnhem Centraal, Dieren, Zutphen, Dieren, Zutphen, Dieren, Zutphen, Apeldoorn]"
train_6,"[Weert, Roermond, Sittard, Maastricht, Sittard, Heerlen, Sittard, Heerlen, Sittard, Heerlen, Sittard, Heerlen, Sittard]"
train_7,"[Utrecht Centraal, Amsterdam Centraal, Utrecht Centraal, s-Hertogenbosch, Oss, Nijmegen, Arnhem Centraal, Nijmegen, Oss, s-Hertogenbosch, Oss]"
train_8,"[Rotterdam Alexander, Rotterdam Blaak, Schiedam Centrum, Rotterdam Centraal, Dordrecht, Roosendaal, Etten-Leur, Roosendaal, Vlissingen]"
train_9,"[Nijmegen, Oss, s-Hertogenbosch, Oss, s-Hertogenbosch, Oss, Nijmegen, Arnhem Centraal, Nijmegen, Oss, s-Hertogenbosch, Oss, Nijmegen, Oss]"
train_10,"[Venlo, Helmond, Eindhoven, Tilburg, Eindhoven, Helmond, Venlo, Helmond, Eindhoven, Weert]"
train_11,"[Heerlen, Sittard, Roermond, Weert, Roermond, Weert, Eindhoven, Tilburg, Breda, Dordrecht, Rotterdam Blaak, Dordrecht]"
train_12,"[Arnhem Centraal, Ede-Wageningen, Utrecht Centraal, s-Hertogenbosch, Oss, s-Hertogenbosch, Oss, s-Hertogenbosch, Eindhoven, Helmond, Venlo]"
train_13,"[Amsterdam Sloterdijk, Amsterdam Zuid, Amsterdam Sloterdijk, Haarlem, Heemstede-Aerdenhout, Haarlem, Heemstede-Aerdenhout, Haarlem, Beverwijk, Castricum, Zaandam, Beverwijk, Zaandam, Amsterdam Sloterdijk, Haarlem]"
train_14,"[Leiden Centraal, Alphen a/d Rijn, Utrecht Centraal, s-Hertogenbosch, Eindhoven, Helmond, Venlo, Helmond, Eindhoven]"
train_15,"[Hoorn, Zaandam, Hoorn, Alkmaar, Den Helder, Alkmaar]"
train_16,"[Delft, Den Haag Laan v NOI, Delft, Den Haag Centraal, Gouda, Den Haag Laan v NOI, Delft, Schiedam Centrum, Delft, Den Haag Laan v NOI, Delft, Schiedam Centrum, Rotterdam Blaak, Dordrecht, Rotterdam Blaak]"
train_17,"[Heerenveen, Steenwijk, Heerenveen, Steenwijk, Zwolle, Amersfoort, Apeldoorn, Zutphen, Dieren, Arnhem Centraal, Ede-Wageningen]"
train_18,"[Roermond, Weert, Roermond, Weert, Roermond, Sittard, Maastricht, Sittard, Heerlen, Sittard, Roermond, Weert, Eindhoven]"
train_19,"[Sittard, Maastricht, Sittard, Heerlen, Sittard, Heerlen, Sittard, Maastricht, Sittard, Roermond, Weert, Eindhoven]"
train_20,"[Venlo, Helmond, Eindhoven, Tilburg, Breda, Etten-Leur, Roosendaal, Dordrecht, Rotterdam Blaak, Dordrecht, Roosendaal]"
score,1267.2134831460671
