train,stations
train_1,"[Almere Centrum, Hilversum, Almere Centrum, Amsterdam Centraal, Almere Centrum, Lelystad Centrum, Almere Centrum, Amsterdam Centraal, Utrecht Centraal]"
train_2,"[Alphen a/d Rijn, Leiden Centraal, Den Haag Laan v NOI, Gouda, Den Haag Centraal, Delft, Den Haag Laan v NOI, Delft, Den Haag HS, Leiden Centraal, Alphen a/d Rijn, Utrecht Centraal]"
train_3,"[Groningen, Leeuwarden, Groningen, Assen, Groningen, Leeuwarden, Groningen]"
train_4,"[Den Haag Centraal, Gouda, Den Haag Centraal, Gouda, Den Haag HS, Delft, Den Haag HS, Leiden Centraal, Schiphol Airport, Leiden Centraal, Heemstede-Aerdenhout, Haarlem, Amsterdam Sloterdijk, Amsterdam Centraal]"
train_5,"[Amsterdam Centraal, Utrecht Centraal, Schiphol Airport, Amsterdam Zuid, Schiphol Airport, Leiden Centraal, Heemstede-Aerdenhout, Leiden Centraal, Alphen a/d Rijn, Gouda, Utrecht Centraal]"
train_6,"[Ede-Wageningen, Utrecht Centraal, Gouda, Utrecht Centraal, Alphen a/d Rijn, Utrecht Centraal, Ede-Wageningen, Arnhem Centraal, Ede-Wageningen, Arnhem Centraal]"
train_7,"[Den Haag HS, Gouda, Den Haag Centraal, Gouda, Den Haag Centraal, Delft, Den Haag HS, Leiden Centraal, Den Haag Centraal, Gouda, Utrecht Centraal, Amersfoort]"
train_8,"[Hoorn, Zaandam, Amsterdam Sloterdijk, Amsterdam Centraal, Amsterdam Sloterdijk, Amsterdam Zuid, Schiphol Airport, Utrecht Centraal, Hilversum, Amsterdam Amstel, Amsterdam Centraal, Amsterdam Sloterdijk, Amsterdam Zuid]"
train_9,"[Enschede, Hengelo, Almelo, Zwolle, Steenwijk, Heerenveen, Steenwijk, Heerenveen, Leeuwarden, Heerenveen, Leeuwarden]"
train_10,"[Leeuwarden, Groningen, Leeuwarden, Heerenveen, Steenwijk, Zwolle, Deventer, Almelo]"
train_11,"[Sittard, Roermond, Sittard, Roermond, Sittard, Heerlen, Sittard, Heerlen, Sittard, Heerlen, Sittard, Roermond, Weert]"
train_12,"[Maastricht, Sittard, Heerlen, Sittard, Maastricht, Sittard, Maastricht, Sittard, Heerlen, Sittard, Roermond, Weert, Roermond]"
train_13,"[Arnhem Centraal, Ede-Wageningen, Arnhem Centraal, Ede-Wageningen, Utrecht Centraal, Amsterdam Amstel, Hilversum, Almere Centrum, Hilversum]"
train_14,"[Beverwijk, Castricum, Zaandam, Beverwijk, Castricum, Beverwijk, Zaandam, Beverwijk, Zaandam, Hoorn]"
train_15,"[Amsterdam Amstel, Amsterdam Centraal, Almere Centrum, Lelystad Centrum, Almere Centrum, Lelystad Centrum, Almere Centrum, Amsterdam Amstel, Amsterdam Zuid, Amsterdam Amstel, Almere Centrum, Amsterdam Centraal]"
train_16,"[Deventer, Almelo, Deventer, Zwolle, Assen, Zwolle]"
train_17,"[Hengelo, Enschede, Hengelo, Enschede, Hengelo, Enschede, Hengelo, Almelo, Hengelo, Almelo, Zwolle, Almelo]"
train_18,"[Apeldoorn, Zutphen, Deventer, Almelo, Zwolle, Almelo]"
train_19,"[Hilversum, Almere Centrum, Lelystad Centrum, Almere Centrum, Hilversum, Utrecht Centraal, Amsterdam Centraal, Utrecht Centraal, Amersfoort, Utrecht Centraal]"
train_20,"[Assen, Zwolle, Almelo, Zwolle, Deventer, Apeldoorn]"
score,1033.4943820224717
