train,stations
train_1,"[Heerenveen, Leeuwarden, Heerenveen, Steenwijk, Zwolle, Assen, Zwolle, Deventer]"
train_2,"[Steenwijk, Heerenveen, Steenwijk, Heerenveen, Steenwijk, Zwolle, Amersfoort, Zwolle]"
train_3,"[Breda, Etten-Leur, Roosendaal, Dordrecht, Rotterdam Centraal, Dordrecht, Roosendaal, Dordrecht, Roosendaal, Dordrecht, Rotterdam Centraal]"
train_4,"[Roermond, Weert, Eindhoven, Helmond, Eindhoven, s-Hertogenbosch, Eindhoven, Weert, Eindhoven, Weert, Eindhoven, Tilburg]"
train_5,"[Roosendaal, Vlissingen, Roosendaal, Etten-Leur, Roosendaal]"
train_6,"[Amsterdam Centraal, Amsterdam Amstel, Hilversum, Amsterdam Amstel, Amsterdam Zuid, Schiphol Airport, Leiden Centraal, Den Haag Laan v NOI, Gouda, Rotterdam Alexander, Gouda, Alphen a/d Rijn]"
train_7,"[Eindhoven, s-Hertogenbosch, Eindhoven, s-Hertogenbosch, Oss, Nijmegen, Arnhem Centraal, Dieren, Arnhem Centraal, Dieren, Zutphen, Deventer, Zutphen]"
train_8,"[Rotterdam Blaak, Dordrecht, Roosendaal, Vlissingen, Roosendaal]"
train_9,"[Leiden Centraal, Den Haag HS, Delft, Den Haag Laan v NOI, Gouda, Alphen a/d Rijn, Leiden Centraal, Alphen a/d Rijn, Leiden Centraal, Den Haag Centraal, Leiden Centraal, Den Haag Centraal, Delft]"
train_10,"[Heemstede-Aerdenhout, Haarlem, Amsterdam Sloterdijk, Amsterdam Zuid, Schiphol Airport, Utrecht Centraal, Alphen a/d Rijn, Utrecht Centraal, Amsterdam Centraal, Amsterdam Sloterdijk, Haarlem, Heemstede-Aerdenhout]"
train_11,"[Vlissingen, Roosendaal, Vlissingen]"
train_12,"[Heemstede-Aerdenhout, Haarlem, Beverwijk, Castricum, Alkmaar, Castricum, Alkmaar, Castricum, Zaandam, Beverwijk, Zaandam, Beverwijk, Castricum]"
train_13,"[Lelystad Centrum, Almere Centrum, Hilversum, Almere Centrum, Hilversum, Utrecht Centraal, Ede-Wageningen, Arnhem Centraal, Ede-Wageningen, Utrecht Centraal]"
train_14,"[Almere Centrum, Hilversum, Amsterdam Amstel, Almere Centrum, Lelystad Centrum, Almere Centrum, Lelystad Centrum, Almere Centrum, Amsterdam Centraal, Amsterdam Amstel]"
train_15,"[Maastricht, Sittard, Maastricht, Sittard, Maastricht, Sittard, Roermond, Sittard, Roermond, Weert, Roermond, Sittard, Maastricht]"
train_16,"[Arnhem Centraal, Ede-Wageningen, Utrecht Centraal, Amsterdam Amstel, Almere Centrum, Amsterdam Amstel, Utrecht Centraal, Hilversum, Almere Centrum]"
train_17,"[Hoorn, Zaandam, Amsterdam Sloterdijk, Amsterdam Zuid, Amsterdam Sloterdijk, Amsterdam Zuid, Amsterdam Sloterdijk, Amsterdam Centraal, Amsterdam Amstel, Hilversum, Amsterdam Amstel]"
train_18,"[Almere Centrum, Amsterdam Amstel, Hilversum, Amsterdam Amstel, Amsterdam Centraal, Amsterdam Amstel, Almere Centrum, Lelystad Centrum, Almere Centrum, Amsterdam Centraal]"
train_19,"[Den Haag Laan v NOI, Gouda, Den Haag Laan v NOI, Gouda, Alphen a/d Rijn, Utrecht Centraal, Alphen a/d Rijn, Leiden Centraal]"
train_20,"[s-Hertogenbosch, Tilburg, s-Hertogenbosch, Tilburg, Eindhoven, Tilburg, Breda, Tilburg, Eindhoven, Helmond, Venlo]"
score,1968.3707865168544
