train,stations
train_1,"[Lelystad Centrum, Almere Centrum, Amsterdam Centraal, Amsterdam Sloterdijk, Haarlem, Amsterdam Sloterdijk, Zaandam, Castricum, Zaandam, Beverwijk, Haarlem, Beverwijk, Zaandam]"
train_2,"[Rotterdam Alexander, Gouda, Den Haag HS, Gouda, Utrecht Centraal, Alphen a/d Rijn, Utrecht Centraal, Amsterdam Amstel, Amsterdam Zuid, Amsterdam Sloterdijk]"
train_3,"[Leiden Centraal, Schiphol Airport, Utrecht Centraal, Amsterdam Centraal, Amsterdam Sloterdijk, Amsterdam Centraal, Amsterdam Sloterdijk, Amsterdam Zuid, Schiphol Airport, Amsterdam Zuid, Amsterdam Sloterdijk, Amsterdam Centraal, Almere Centrum, Lelystad Centrum]"
train_4,"[Venlo, Helmond, Eindhoven, Weert, Roermond, Weert, Roermond, Sittard, Maastricht, Sittard, Heerlen, Sittard]"
train_5,"[Zutphen, Dieren, Zutphen, Apeldoorn, Deventer, Almelo, Zwolle, Almelo]"
train_6,"[Den Haag Centraal, Delft, Den Haag HS, Gouda, Den Haag Laan v NOI, Leiden Centraal, Schiphol Airport, Amsterdam Zuid, Amsterdam Amstel, Amsterdam Centraal, Amsterdam Sloterdijk, Amsterdam Centraal, Amsterdam Sloterdijk, Amsterdam Centraal, Amsterdam Amstel, Amsterdam Zuid, Amsterdam Sloterdijk]"
train_7,"[Almelo, Hengelo, Enschede, Hengelo, Enschede, Hengelo, Almelo, Deventer, Almelo, Deventer, Zwolle]"
train_8,"[Amsterdam Centraal, Amsterdam Amstel, Amsterdam Zuid, Amsterdam Sloterdijk, Zaandam, Hoorn, Alkmaar, Castricum, Alkmaar, Den Helder]"
train_9,"[Castricum, Beverwijk, Haarlem, Heemstede-Aerdenhout, Haarlem, Heemstede-Aerdenhout, Haarlem, Beverwijk, Castricum, Beverwijk, Haarlem, Heemstede-Aerdenhout, Leiden Centraal, Den Haag Centraal, Delft, Den Haag Laan v NOI, Leiden Centraal]"
train_10,"[Steenwijk, Heerenveen, Steenwijk, Heerenveen, Leeuwarden, Heerenveen, Leeuwarden, Groningen, Leeuwarden]"
train_11,"[Helmond, Eindhoven, Tilburg, Eindhoven, s-Hertogenbosch, Oss, Nijmegen, Arnhem Centraal, Nijmegen, Oss, s-Hertogenbosch, Utrecht Centraal]"
train_12,"[Roosendaal, Etten-Leur, Roosendaal, Dordrecht, Rotterdam Centraal, Rotterdam Alexander, Rotterdam Centraal, Dordrecht, Rotterdam Centraal, Schiedam Centrum, Rotterdam Centraal, Schiedam Centrum, Rotterdam Blaak, Rotterdam Alexander, Rotterdam Centraal, Rotterdam Alexander, Rotterdam Centraal, Schiedam Centrum]"
train_13,"[Zaandam, Amsterdam Sloterdijk, Amsterdam Centraal, Amsterdam Amstel, Almere Centrum, Amsterdam Centraal, Amsterdam Amstel, Amsterdam Centraal, Utrecht Centraal, Alphen a/d Rijn, Utrecht Centraal]"
train_14,"[Heerenveen, Steenwijk, Heerenveen, Steenwijk, Zwolle, Amersfoort, Utrecht Centraal, Ede-Wageningen, Arnhem Centraal, Ede-Wageningen]"
train_15,"[Den Haag Centraal, Leiden Centraal, Den Haag Centraal, Gouda, Den Haag Laan v NOI, Delft, Den Haag Centraal, Delft, Den Haag Centraal, Delft, Schiedam Centrum, Delft, Schiedam Centrum, Rotterdam Blaak]"
train_16,"[Dieren, Arnhem Centraal, Ede-Wageningen, Utrecht Centraal, Schiphol Airport, Amsterdam Zuid, Amsterdam Sloterdijk, Zaandam, Beverwijk, Zaandam, Castricum]"
train_17,"[Deventer, Zutphen, Dieren, Zutphen, Deventer, Apeldoorn, Zutphen, Deventer, Almelo, Zwolle]"
train_18,"[Zaandam, Hoorn, Alkmaar, Hoorn, Alkmaar, Den Helder, Alkmaar, Castricum]"
train_19,"[Rotterdam Blaak, Rotterdam Alexander, Rotterdam Blaak, Dordrecht, Rotterdam Blaak, Schiedam Centrum, Rotterdam Centraal, Schiedam Centrum, Delft, Den Haag HS, Delft, Den Haag Centraal, Delft, Den Haag Laan v NOI, Gouda, Alphen a/d Rijn]"
train_20,"[Steenwijk, Zwolle, Assen, Zwolle, Amersfoort, Apeldoorn]"
score,3377.044943820225
