train,stations
train_1,"[Sittard, Maastricht, Sittard, Roermond, Weert, Roermond, Weert, Eindhoven, Helmond, Eindhoven, Weert, Eindhoven, Helmond]"
train_2,"[Den Haag Centraal, Delft, Schiedam Centrum, Delft, Den Haag Centraal, Delft, Den Haag Centraal, Gouda, Den Haag Centraal, Leiden Centraal, Heemstede-Aerdenhout, Haarlem, Beverwijk, Zaandam]"
train_3,"[Rotterdam Blaak, Dordrecht, Rotterdam Centraal, Rotterdam Alexander, Gouda, Den Haag HS, Leiden Centraal, Den Haag HS, Leiden Centraal, Den Haag Centraal, Gouda, Den Haag HS, Delft, Den Haag HS]"
train_4,"[Dieren, Arnhem Centraal, Nijmegen, Arnhem Centraal, Dieren, Arnhem Centraal, Dieren, Arnhem Centraal, Nijmegen, Oss, s-Hertogenbosch, Utrecht Centraal, Hilversum]"
train_5,"[Leiden Centraal, Heemstede-Aerdenhout, Leiden Centraal, Heemstede-Aerdenhout, Haarlem, Heemstede-Aerdenhout, Leiden Centraal, Schiphol Airport, Amsterdam Zuid, Amsterdam Sloterdijk, Amsterdam Centraal, Utrecht Centraal, Ede-Wageningen, Arnhem Centraal, Ede-Wageningen]"
train_6,"[Amsterdam Zuid, Amsterdam Sloterdijk, Amsterdam Zuid, Amsterdam Sloterdijk, Haarlem, Heemstede-Aerdenhout, Leiden Centraal, Heemstede-Aerdenhout, Leiden Centraal, Den Haag Laan v NOI, Delft, Den Haag Laan v NOI, Gouda]"
train_7,"[Tilburg, Eindhoven, s-Hertogenbosch, Oss, Nijmegen, Oss, Nijmegen, Oss, s-Hertogenbosch, Tilburg, s-Hertogenbosch, Tilburg]"
train_8,"[Heerenveen, Leeuwarden, Groningen, Assen, Groningen, Leeuwarden, Groningen]"
train_9,"[Tilburg, Eindhoven, s-Hertogenbosch, Oss, Nijmegen, Oss, s-Hertogenbosch, Oss, Nijmegen, Oss, Nijmegen, Oss]"
train_10,"[Rotterdam Alexander, Rotterdam Centraal, Dordrecht, Rotterdam Centraal, Rotterdam Alexander, Rotterdam Blaak, Schiedam Centrum, Rotterdam Centraal, Schiedam Centrum, Rotterdam Blaak, Schiedam Centrum, Delft, Schiedam Centrum, Delft, Den Haag Laan v NOI, Delft, Den Haag HS, Leiden Centraal, Den Haag HS]"
train_11,"[Heerlen, Sittard, Roermond, Weert, Eindhoven, Helmond, Venlo, Helmond, Venlo]"
train_12,"[Leiden Centraal, Den Haag HS, Delft, Den Haag Centraal, Gouda, Utrecht Centraal, Amersfoort, Apeldoorn, Deventer, Almelo]"
train_13,"[Castricum, Beverwijk, Zaandam, Amsterdam Sloterdijk, Zaandam, Hoorn, Alkmaar, Castricum, Beverwijk, Zaandam, Castricum, Alkmaar]"
train_14,"[Beverwijk, Castricum, Alkmaar, Den Helder, Alkmaar, Hoorn, Alkmaar, Castricum, Beverwijk]"
train_15,"[Amsterdam Sloterdijk, Amsterdam Zuid, Schiphol Airport, Utrecht Centraal, Hilversum, Amsterdam Amstel, Amsterdam Centraal, Almere Centrum, Hilversum, Utrecht Centraal]"
train_16,"[Amersfoort, Utrecht Centraal, Amersfoort, Zwolle, Amersfoort, Apeldoorn, Zutphen, Apeldoorn]"
train_17,"[Hilversum, Almere Centrum, Lelystad Centrum, Almere Centrum, Lelystad Centrum, Almere Centrum, Amsterdam Amstel, Almere Centrum, Hilversum, Utrecht Centraal]"
train_18,"[Enschede, Hengelo, Almelo, Hengelo, Enschede, Hengelo, Almelo, Hengelo, Almelo, Hengelo, Enschede, Hengelo, Almelo, Deventer, Apeldoorn, Amersfoort, Utrecht Centraal]"
train_19,"[Tilburg, Breda, Etten-Leur, Breda, Tilburg, Breda, Etten-Leur, Roosendaal, Vlissingen]"
train_20,"[Amersfoort, Zwolle, Almelo, Zwolle, Assen]"
score,3334.685393258427
