train,stations
train_1,"[Roermond, Sittard, Roermond, Weert, Roermond, Weert, Eindhoven, Weert, Roermond, Weert, Roermond, Sittard, Roermond]"
train_2,"[Weert, Eindhoven, Helmond, Venlo, Helmond, Venlo, Helmond, Venlo]"
train_3,"[Almelo, Hengelo, Enschede, Hengelo, Enschede, Hengelo, Enschede, Hengelo, Almelo, Zwolle, Deventer, Zutphen, Deventer, Apeldoorn]"
train_4,"[Den Haag HS, Leiden Centraal, Alphen a/d Rijn, Leiden Centraal, Heemstede-Aerdenhout, Haarlem, Beverwijk, Haarlem, Amsterdam Sloterdijk, Amsterdam Zuid, Schiphol Airport, Amsterdam Zuid, Amsterdam Sloterdijk, Amsterdam Centraal, Amsterdam Sloterdijk, Amsterdam Centraal, Amsterdam Amstel]"
train_5,"[Breda, Tilburg, s-Hertogenbosch, Oss, Nijmegen, Arnhem Centraal, Nijmegen, Arnhem Centraal, Dieren, Arnhem Centraal, Nijmegen, Arnhem Centraal, Ede-Wageningen, Utrecht Centraal]"
train_6,"[Gouda, Den Haag Centraal, Delft, Den Haag HS, Gouda, Den Haag HS, Gouda, Alphen a/d Rijn, Utrecht Centraal, Gouda, Rotterdam Alexander]"
train_7,"[Utrecht Centraal, Ede-Wageningen, Arnhem Centraal, Ede-Wageningen, Utrecht Centraal, Amsterdam Centraal, Almere Centrum, Amsterdam Amstel, Utrecht Centraal]"
train_8,"[Oss, Nijmegen, Oss, Nijmegen, Oss, Nijmegen, Oss, s-Hertogenbosch, Utrecht Centraal, Alphen a/d Rijn, Leiden Centraal]"
train_9,"[Den Helder, Alkmaar, Den Helder, Alkmaar, Hoorn, Zaandam, Castricum]"
train_10,"[Schiphol Airport, Amsterdam Zuid, Amsterdam Amstel, Almere Centrum, Hilversum, Amsterdam Amstel, Amsterdam Zuid, Amsterdam Sloterdijk, Amsterdam Zuid, Amsterdam Sloterdijk, Amsterdam Zuid]"
train_11,"[Assen, Zwolle, Assen, Zwolle, Deventer, Zutphen, Apeldoorn]"
train_12,"[Steenwijk, Heerenveen, Steenwijk, Heerenveen, Leeuwarden, Heerenveen, Steenwijk, Heerenveen, Leeuwarden, Groningen, Assen]"
train_13,"[Dieren, Zutphen, Dieren, Zutphen, Apeldoorn, Amersfoort, Apeldoorn, Amersfoort, Apeldoorn, Deventer, Zutphen, Dieren]"
train_14,"[Zaandam, Castricum, Beverwijk, Zaandam, Castricum, Zaandam, Amsterdam Sloterdijk, Zaandam, Castricum, Alkmaar, Den Helder, Alkmaar]"
train_15,"[Den Haag HS, Gouda, Rotterdam Alexander, Rotterdam Centraal, Rotterdam Alexander, Rotterdam Blaak, Dordrecht, Breda, Tilburg, Breda, Dordrecht, Rotterdam Centraal, Dordrecht]"
train_16,"[Tilburg, Breda, Tilburg, Breda, Etten-Leur, Roosendaal, Etten-Leur, Breda, Tilburg, Breda, Tilburg, Eindhoven, s-Hertogenbosch]"
train_17,"[Leiden Centraal, Den Haag Centraal, Leiden Centraal, Den Haag Centraal, Delft, Den Haag Laan v NOI, Delft, Den Haag HS, Leiden Centraal, Den Haag Laan v NOI, Leiden Centraal, Alphen a/d Rijn, Utrecht Centraal]"
train_18,"[Vlissingen, Roosendaal, Dordrecht, Rotterdam Centraal, Schiedam Centrum, Rotterdam Blaak, Rotterdam Alexander, Rotterdam Blaak, Dordrecht, Rotterdam Blaak, Dordrecht]"
train_19,"[Arnhem Centraal, Nijmegen, Oss, s-Hertogenbosch, Oss, s-Hertogenbosch, Utrecht Centraal, Schiphol Airport, Leiden Centraal, Den Haag Centraal, Delft, Den Haag Laan v NOI]"
train_20,"[Breda, Tilburg, Breda, Tilburg, Breda, Tilburg, Breda, Tilburg, s-Hertogenbosch, Oss, s-Hertogenbosch, Utrecht Centraal]"
score,3438.4044943820227
