train,stations
train_1,"[Rotterdam Blaak, Dordrecht, Roosendaal, Etten-Leur, Roosendaal, Etten-Leur, Roosendaal, Vlissingen]"
train_2,"[Delft, Den Haag HS, Gouda, Den Haag HS, Delft, Schiedam Centrum, Rotterdam Blaak, Dordrecht, Roosendaal, Etten-Leur, Roosendaal]"
train_3,"[Steenwijk, Heerenveen, Steenwijk, Heerenveen, Steenwijk, Heerenveen, Steenwijk, Heerenveen, Leeuwarden, Groningen, Assen]"
train_4,"[Den Haag Centraal, Leiden Centraal, Schiphol Airport, Utrecht Centraal, Ede-Wageningen, Arnhem Centraal, Nijmegen, Oss, Nijmegen, Arnhem Centraal, Dieren, Zutphen]"
train_5,"[Alkmaar, Den Helder, Alkmaar, Castricum, Beverwijk, Zaandam, Hoorn, Alkmaar]"
train_6,"[Leeuwarden, Groningen, Assen, Groningen, Leeuwarden, Heerenveen, Steenwijk, Heerenveen, Leeuwarden]"
train_7,"[Gouda, Den Haag Centraal, Gouda, Utrecht Centraal, Gouda, Den Haag Centraal, Delft, Den Haag Centraal, Leiden Centraal, Schiphol Airport, Amsterdam Zuid, Amsterdam Sloterdijk, Haarlem]"
train_8,"[Heerenveen, Steenwijk, Zwolle, Amersfoort, Apeldoorn, Deventer, Zwolle, Amersfoort]"
train_9,"[Beverwijk, Zaandam, Castricum, Beverwijk, Haarlem, Beverwijk, Zaandam, Castricum, Zaandam, Castricum, Alkmaar, Castricum, Beverwijk]"
train_10,"[Gouda, Den Haag HS, Delft, Schiedam Centrum, Delft, Den Haag Centraal, Gouda, Utrecht Centraal, Amsterdam Amstel, Almere Centrum, Hilversum]"
train_11,"[Amsterdam Zuid, Schiphol Airport, Amsterdam Zuid, Amsterdam Amstel, Hilversum, Utrecht Centraal, Alphen a/d Rijn, Leiden Centraal, Den Haag Laan v NOI, Leiden Centraal, Den Haag Centraal, Gouda, Utrecht Centraal]"
train_12,"[Almere Centrum, Amsterdam Centraal, Amsterdam Amstel, Hilversum, Almere Centrum, Lelystad Centrum, Almere Centrum, Amsterdam Centraal, Almere Centrum, Lelystad Centrum, Almere Centrum]"
train_13,"[Deventer, Zwolle, Steenwijk, Zwolle, Assen, Groningen, Assen, Groningen]"
train_14,"[Den Haag Centraal, Delft, Den Haag Centraal, Delft, Den Haag Laan v NOI, Delft, Den Haag Centraal, Gouda, Den Haag Centraal, Delft, Schiedam Centrum, Delft, Den Haag Laan v NOI, Gouda]"
train_15,"[Amsterdam Centraal, Almere Centrum, Amsterdam Amstel, Amsterdam Zuid, Schiphol Airport, Leiden Centraal, Heemstede-Aerdenhout, Leiden Centraal, Den Haag HS, Delft, Schiedam Centrum, Rotterdam Blaak, Rotterdam Alexander, Rotterdam Blaak, Schiedam Centrum, Delft]"
train_16,"[Schiphol Airport, Amsterdam Zuid, Amsterdam Amstel, Amsterdam Zuid, Schiphol Airport, Amsterdam Zuid, Amsterdam Sloterdijk, Amsterdam Centraal, Amsterdam Sloterdijk, Haarlem, Heemstede-Aerdenhout, Haarlem, Beverwijk, Castricum, Alkmaar, Hoorn, Zaandam]"
train_17,"[Roermond, Sittard, Maastricht, Sittard, Roermond, Weert, Eindhoven, s-Hertogenbosch, Tilburg, Breda, Etten-Leur, Roosendaal]"
train_18,"[Weert, Eindhoven, Helmond, Venlo, Helmond, Venlo, Helmond, Eindhoven, Helmond]"
train_19,"[Rotterdam Blaak, Schiedam Centrum, Delft, Den Haag HS, Gouda, Den Haag Laan v NOI, Gouda, Alphen a/d Rijn, Leiden Centraal, Alphen a/d Rijn, Gouda]"
train_20,"[Enschede, Hengelo, Almelo, Hengelo, Enschede, Hengelo, Enschede, Hengelo, Enschede, Hengelo, Enschede, Hengelo, Almelo, Zwolle, Steenwijk, Heerenveen]"
score,3060.9662921348317
