train,stations
train_1,"[Groningen, Leeuwarden, Groningen, Leeuwarden, Heerenveen, Leeuwarden, Groningen]"
train_2,"[Roosendaal, Dordrecht, Breda, Etten-Leur, Breda, Etten-Leur, Roosendaal, Dordrecht, Rotterdam Blaak, Dordrecht, Roosendaal, Etten-Leur, Roosendaal]"
train_3,"[Schiphol Airport, Utrecht Centraal, s-Hertogenbosch, Tilburg, Eindhoven, Tilburg, Breda, Tilburg, s-Hertogenbosch, Tilburg]"
train_4,"[Beverwijk, Castricum, Beverwijk, Zaandam, Castricum, Beverwijk, Zaandam, Hoorn, Zaandam, Beverwijk]"
train_5,"[Zutphen, Deventer, Zutphen, Deventer, Zutphen, Dieren, Zutphen, Deventer, Zwolle, Amersfoort, Utrecht Centraal, Alphen a/d Rijn]"
train_6,"[Breda, Dordrecht, Roosendaal, Etten-Leur, Roosendaal, Etten-Leur, Roosendaal, Etten-Leur, Roosendaal, Vlissingen]"
train_7,"[Beverwijk, Castricum, Beverwijk, Castricum, Zaandam, Amsterdam Sloterdijk, Amsterdam Centraal, Amsterdam Amstel, Utrecht Centraal, Gouda, Den Haag HS, Leiden Centraal, Schiphol Airport, Amsterdam Zuid, Schiphol Airport]"
train_8,"[Groningen, Assen, Groningen, Leeuwarden, Heerenveen, Leeuwarden, Groningen, Assen]"
train_9,"[Steenwijk, Heerenveen, Leeuwarden, Groningen, Assen, Groningen, Assen, Zwolle]"
train_10,"[Schiedam Centrum, Rotterdam Centraal, Rotterdam Alexander, Gouda, Utrecht Centraal, Gouda, Utrecht Centraal, Alphen a/d Rijn, Gouda, Alphen a/d Rijn, Leiden Centraal, Schiphol Airport]"
train_11,"[Apeldoorn, Deventer, Apeldoorn, Amersfoort, Apeldoorn, Zutphen, Dieren, Arnhem Centraal, Ede-Wageningen, Utrecht Centraal, Gouda, Rotterdam Alexander]"
train_12,"[Heerlen, Sittard, Maastricht, Sittard, Roermond, Weert, Eindhoven, s-Hertogenbosch, Oss, Nijmegen, Arnhem Centraal, Dieren, Zutphen, Dieren]"
train_13,"[Schiedam Centrum, Delft, Den Haag HS, Delft, Den Haag Centraal, Leiden Centraal, Den Haag Centraal, Delft, Den Haag Laan v NOI, Leiden Centraal, Den Haag Centraal, Gouda, Utrecht Centraal, Alphen a/d Rijn]"
train_14,"[Dieren, Zutphen, Dieren, Arnhem Centraal, Dieren, Zutphen, Deventer, Apeldoorn, Amersfoort, Utrecht Centraal, s-Hertogenbosch, Eindhoven, s-Hertogenbosch]"
train_15,"[Schiphol Airport, Leiden Centraal, Den Haag Laan v NOI, Gouda, Den Haag Laan v NOI, Leiden Centraal, Alphen a/d Rijn, Leiden Centraal, Alphen a/d Rijn, Leiden Centraal, Den Haag Laan v NOI, Leiden Centraal, Alphen a/d Rijn]"
train_16,"[Sittard, Roermond, Sittard, Maastricht, Sittard, Heerlen, Sittard, Heerlen, Sittard, Maastricht, Sittard, Maastricht]"
train_17,"[Den Helder, Alkmaar, Castricum, Zaandam, Beverwijk, Haarlem, Heemstede-Aerdenhout, Haarlem, Amsterdam Sloterdijk, Amsterdam Centraal, Almere Centrum, Amsterdam Amstel]"
train_18,"[Helmond, Venlo, Helmond, Venlo, Helmond, Eindhoven, Helmond, Eindhoven, Helmond]"
train_19,"[s-Hertogenbosch, Utrecht Centraal, Amersfoort, Apeldoorn, Amersfoort, Apeldoorn, Zutphen, Deventer, Zwolle]"
train_20,"[Groningen, Assen, Groningen, Leeuwarden, Heerenveen, Steenwijk, Zwolle, Steenwijk, Zwolle]"
score,2794.2471910112363
