train,stations
train_1,"[Vlissingen, Roosendaal, Vlissingen]"
train_2,"[Roermond, Weert, Eindhoven, Tilburg, Eindhoven, s-Hertogenbosch, Oss, Nijmegen, Oss, s-Hertogenbosch, Oss, s-Hertogenbosch]"
train_3,"[Den Haag Laan v NOI, Gouda, Rotterdam Alexander, Rotterdam Centraal, Rotterdam Alexander, Rotterdam Centraal, Dordrecht, Breda, Etten-Leur, Roosendaal, Etten-Leur, Breda, Dordrecht, Rotterdam Blaak, Dordrecht]"
train_4,"[Oss, s-Hertogenbosch, Oss, s-Hertogenbosch, Tilburg, Breda, Tilburg, Breda, Tilburg, s-Hertogenbosch, Utrecht Centraal, Amsterdam Centraal, Amsterdam Amstel]"
train_5,"[Venlo, Helmond, Venlo, Helmond, Venlo, Helmond, Eindhoven, s-Hertogenbosch]"
train_6,"[Rotterdam Alexander, Rotterdam Centraal, Rotterdam Alexander, Rotterdam Blaak, Schiedam Centrum, Rotterdam Blaak, Dordrecht, Roosendaal, Vlissingen]"
train_7,"[Amsterdam Centraal, Amsterdam Amstel, Almere Centrum, Amsterdam Amstel, Amsterdam Centraal, Almere Centrum, Amsterdam Centraal, Utrecht Centraal, Alphen a/d Rijn, Leiden Centraal]"
train_8,"[Weert, Roermond, Sittard, Roermond, Weert, Eindhoven, s-Hertogenbosch, Oss, s-Hertogenbosch, Utrecht Centraal, Hilversum]"
train_9,"[Eindhoven, Helmond, Venlo, Helmond, Eindhoven, Tilburg, Eindhoven, s-Hertogenbosch, Eindhoven, Weert]"
train_10,"[Sittard, Roermond, Sittard, Maastricht, Sittard, Heerlen, Sittard, Roermond, Weert, Eindhoven, s-Hertogenbosch, Oss]"
train_11,"[Amsterdam Centraal, Almere Centrum, Amsterdam Amstel, Almere Centrum, Lelystad Centrum, Almere Centrum, Amsterdam Amstel, Hilversum, Utrecht Centraal]"
train_12,"[Zwolle, Amersfoort, Zwolle, Steenwijk, Zwolle, Assen, Groningen]"
train_13,"[Vlissingen, Roosendaal, Etten-Leur, Breda, Etten-Leur, Roosendaal, Etten-Leur, Breda, Etten-Leur, Breda, Dordrecht, Roosendaal]"
train_14,"[Almelo, Hengelo, Enschede, Hengelo, Enschede, Hengelo, Enschede, Hengelo, Almelo, Zwolle, Assen, Groningen, Assen]"
train_15,"[Venlo, Helmond, Venlo, Helmond, Eindhoven, Tilburg, Breda, Tilburg, Eindhoven, Helmond]"
train_16,"[Etten-Leur, Breda, Etten-Leur, Breda, Tilburg, Breda, Tilburg, s-Hertogenbosch, Utrecht Centraal, Alphen a/d Rijn, Utrecht Centraal]"
train_17,"[Schiphol Airport, Utrecht Centraal, Amsterdam Amstel, Amsterdam Zuid, Schiphol Airport, Amsterdam Zuid, Amsterdam Amstel, Utrecht Centraal, Alphen a/d Rijn, Utrecht Centraal, Amsterdam Amstel]"
train_18,"[Breda, Tilburg, s-Hertogenbosch, Tilburg, s-Hertogenbosch, Oss, Nijmegen, Arnhem Centraal, Nijmegen, Arnhem Centraal, Dieren, Zutphen, Dieren, Arnhem Centraal, Dieren]"
train_19,"[Maastricht, Sittard, Roermond, Sittard, Roermond, Weert, Eindhoven, s-Hertogenbosch, Oss, s-Hertogenbosch, Utrecht Centraal]"
train_20,"[Oss, Nijmegen, Oss, s-Hertogenbosch, Eindhoven, Weert, Roermond, Weert, Roermond, Weert, Roermond, Weert, Eindhoven]"
score,141.6179775280898
