train,stations
train_1,"[Hengelo, Almelo, Deventer, Apeldoorn, Zutphen, Deventer, Zwolle, Almelo]"
train_2,"[Dordrecht, Roosendaal, Vlissingen, Roosendaal, Etten-Leur, Roosendaal]"
train_3,"[Arnhem Centraal, Ede-Wageningen, Arnhem Centraal, Dieren, Zutphen, Deventer, Almelo, Zwolle, Deventer, Almelo, Hengelo]"
train_4,"[Hengelo, Enschede, Hengelo, Almelo, Deventer, Zwolle, Steenwijk, Heerenveen, Leeuwarden, Groningen]"
train_5,"[Den Haag Centraal, Gouda, Den Haag HS, Delft, Den Haag Centraal, Gouda, Rotterdam Alexander, Gouda, Alphen a/d Rijn, Gouda, Den Haag Laan v NOI]"
train_6,"[Steenwijk, Heerenveen, Steenwijk, Zwolle, Assen, Zwolle, Amersfoort]"
train_7,"[Helmond, Venlo, Helmond, Eindhoven, s-Hertogenbosch, Eindhoven, s-Hertogenbosch, Oss, Nijmegen, Oss]"
train_8,"[Maastricht, Sittard, Heerlen, Sittard, Heerlen, Sittard, Heerlen, Sittard, Heerlen, Sittard, Heerlen, Sittard]"
train_9,"[Rotterdam Alexander, Gouda, Alphen a/d Rijn, Utrecht Centraal, Amersfoort, Apeldoorn, Amersfoort, Zwolle]"
train_10,"[Amersfoort, Utrecht Centraal, Schiphol Airport, Utrecht Centraal, s-Hertogenbosch, Utrecht Centraal, s-Hertogenbosch, Oss]"
train_11,"[Schiphol Airport, Amsterdam Zuid, Schiphol Airport, Leiden Centraal, Alphen a/d Rijn, Leiden Centraal, Schiphol Airport, Amsterdam Zuid, Amsterdam Amstel, Amsterdam Centraal, Almere Centrum, Lelystad Centrum, Almere Centrum, Lelystad Centrum, Almere Centrum]"
train_12,"[Venlo, Helmond, Venlo, Helmond, Eindhoven, Weert, Eindhoven, Helmond, Venlo]"
train_13,"[Steenwijk, Heerenveen, Steenwijk, Zwolle, Steenwijk, Zwolle, Amersfoort, Utrecht Centraal, Ede-Wageningen]"
train_14,"[Beverwijk, Haarlem, Beverwijk, Haarlem, Amsterdam Sloterdijk, Amsterdam Zuid, Amsterdam Sloterdijk, Haarlem, Heemstede-Aerdenhout, Leiden Centraal, Schiphol Airport, Utrecht Centraal]"
train_15,"[Hengelo, Enschede, Hengelo, Almelo, Zwolle, Almelo, Zwolle]"
train_16,"[Rotterdam Alexander, Rotterdam Centraal, Dordrecht, Roosendaal, Dordrecht, Rotterdam Blaak, Dordrecht, Roosendaal]"
train_17,"[Leiden Centraal, Heemstede-Aerdenhout, Leiden Centraal, Den Haag Laan v NOI, Gouda, Den Haag HS, Delft, Schiedam Centrum, Rotterdam Centraal, Rotterdam Alexander, Gouda, Rotterdam Alexander, Gouda, Den Haag Laan v NOI, Leiden Centraal]"
train_18,"[Weert, Eindhoven, Tilburg, Breda, Dordrecht, Roosendaal, Vlissingen]"
train_19,"[Tilburg, s-Hertogenbosch, Tilburg, Eindhoven, s-Hertogenbosch, Tilburg, Breda, Tilburg, Eindhoven, s-Hertogenbosch, Utrecht Centraal]"
train_20,"[Arnhem Centraal, Dieren, Zutphen, Deventer, Apeldoorn, Amersfoort, Zwolle, Deventer, Zwolle, Deventer]"
score,1904.0112359550558
