train,stations
train_1,"[Den Haag HS, Leiden Centraal, Heemstede-Aerdenhout, Haarlem, Amsterdam Sloterdijk, Amsterdam Centraal, Utrecht Centraal, Schiphol Airport, Leiden Centraal, Heemstede-Aerdenhout, Leiden Centraal, Schiphol Airport]"
train_2,"[Gouda, Den Haag Laan v NOI, Leiden Centraal, Den Haag HS, Delft, Den Haag Centraal, Gouda, Den Haag Centraal, Delft, Schiedam Centrum, Rotterdam Blaak, Schiedam Centrum, Rotterdam Blaak, Rotterdam Alexander, Rotterdam Blaak]"
train_3,"[Roosendaal, Vlissingen, Roosendaal, Etten-Leur, Roosendaal, Dordrecht]"
train_4,"[Schiphol Airport, Leiden Centraal, Den Haag Laan v NOI, Gouda, Utrecht Centraal, Gouda, Rotterdam Alexander, Rotterdam Blaak, Schiedam Centrum, Rotterdam Blaak, Dordrecht, Breda, Etten-Leur, Roosendaal]"
train_5,"[Enschede, Hengelo, Enschede, Hengelo, Enschede, Hengelo, Enschede, Hengelo, Enschede, Hengelo, Almelo, Hengelo, Enschede, Hengelo, Almelo, Zwolle]"
train_6,"[Rotterdam Alexander, Rotterdam Centraal, Rotterdam Alexander, Rotterdam Centraal, Dordrecht, Roosendaal, Vlissingen]"
train_7,"[Sittard, Roermond, Weert, Eindhoven, Weert, Eindhoven, Helmond, Eindhoven, Weert, Roermond, Sittard, Heerlen, Sittard]"
train_8,"[Beverwijk, Castricum, Zaandam, Hoorn, Alkmaar, Castricum, Beverwijk, Zaandam, Castricum, Zaandam, Castricum, Zaandam]"
train_9,"[Venlo, Helmond, Eindhoven, Tilburg, Eindhoven, Tilburg, Breda, Dordrecht, Rotterdam Blaak, Schiedam Centrum, Rotterdam Blaak, Rotterdam Alexander]"
train_10,"[Vlissingen, Roosendaal, Vlissingen]"
train_11,"[Nijmegen, Arnhem Centraal, Dieren, Zutphen, Deventer, Zutphen, Deventer, Apeldoorn, Deventer, Almelo, Deventer, Apeldoorn, Deventer]"
train_12,"[Den Helder, Alkmaar, Hoorn, Alkmaar, Hoorn, Alkmaar, Hoorn]"
train_13,"[Assen, Zwolle, Deventer, Zwolle, Almelo, Hengelo, Enschede, Hengelo, Enschede, Hengelo, Enschede]"
train_14,"[Schiphol Airport, Amsterdam Zuid, Amsterdam Amstel, Amsterdam Zuid, Schiphol Airport, Amsterdam Zuid, Amsterdam Sloterdijk, Haarlem, Heemstede-Aerdenhout, Haarlem, Beverwijk, Haarlem, Heemstede-Aerdenhout, Leiden Centraal, Den Haag HS, Gouda, Utrecht Centraal]"
train_15,"[Weert, Roermond, Weert, Eindhoven, Tilburg, Eindhoven, Tilburg, Breda, Etten-Leur, Roosendaal]"
train_16,"[Gouda, Rotterdam Alexander, Rotterdam Blaak, Rotterdam Alexander, Rotterdam Blaak, Schiedam Centrum, Rotterdam Centraal, Dordrecht, Roosendaal, Vlissingen]"
train_17,"[Vlissingen, Roosendaal, Etten-Leur, Roosendaal, Etten-Leur, Breda, Dordrecht, Rotterdam Blaak, Schiedam Centrum, Delft, Den Haag Centraal]"
train_18,"[Tilburg, Eindhoven, Helmond, Eindhoven, s-Hertogenbosch, Oss, s-Hertogenbosch, Tilburg, Eindhoven, Helmond, Venlo]"
train_19,"[Hoorn, Zaandam, Castricum, Zaandam, Beverwijk, Castricum, Beverwijk, Zaandam, Amsterdam Sloterdijk, Haarlem, Beverwijk]"
train_20,"[Roermond, Weert, Eindhoven, s-Hertogenbosch, Oss, s-Hertogenbosch, Oss, s-Hertogenbosch, Oss, Nijmegen, Arnhem Centraal, Nijmegen, Arnhem Centraal, Ede-Wageningen, Arnhem Centraal]"
score,1939.0112359550558
