train,stations
train_1,"[Roosendaal, Dordrecht, Rotterdam Centraal, Schiedam Centrum, Rotterdam Centraal, Schiedam Centrum, Rotterdam Centraal, Schiedam Centrum, Rotterdam Blaak, Rotterdam Alexander, Rotterdam Blaak, Rotterdam Alexander, Gouda, Rotterdam Alexander, Gouda, Den Haag Centraal, Leiden Centraal, Den Haag HS]"
train_2,"[Alkmaar, Castricum, Beverwijk, Zaandam, Amsterdam Sloterdijk, Haarlem, Amsterdam Sloterdijk, Haarlem, Heemstede-Aerdenhout, Haarlem, Amsterdam Sloterdijk, Haarlem, Amsterdam Sloterdijk, Amsterdam Centraal, Amsterdam Amstel, Almere Centrum]"
train_3,"[Beverwijk, Haarlem, Beverwijk, Zaandam, Amsterdam Sloterdijk, Zaandam, Beverwijk, Castricum, Alkmaar, Den Helder]"
train_4,"[Maastricht, Sittard, Roermond, Sittard, Roermond, Weert, Roermond, Weert, Eindhoven, s-Hertogenbosch, Tilburg, s-Hertogenbosch]"
train_5,"[Den Helder, Alkmaar, Hoorn, Zaandam, Amsterdam Sloterdijk, Zaandam, Amsterdam Sloterdijk, Amsterdam Zuid, Amsterdam Sloterdijk, Amsterdam Centraal, Almere Centrum]"
train_6,"[Schiphol Airport, Amsterdam Zuid, Amsterdam Amstel, Almere Centrum, Amsterdam Amstel, Utrecht Centraal, Amsterdam Amstel, Utrecht Centraal, Hilversum, Almere Centrum]"
train_7,"[Hilversum, Utrecht Centraal, Gouda, Den Haag Laan v NOI, Delft, Den Haag Laan v NOI, Delft, Den Haag Laan v NOI, Delft, Schiedam Centrum, Rotterdam Blaak, Dordrecht, Rotterdam Centraal]"
train_8,"[Dordrecht, Breda, Dordrecht, Breda, Dordrecht, Breda, Dordrecht, Rotterdam Centraal, Schiedam Centrum, Rotterdam Blaak, Dordrecht, Rotterdam Centraal]"
train_9,"[Dieren, Zutphen, Apeldoorn, Amersfoort, Utrecht Centraal, Amersfoort, Zwolle, Almelo]"
train_10,"[Roosendaal, Vlissingen, Roosendaal]"
train_11,"[Rotterdam Centraal, Rotterdam Alexander, Rotterdam Centraal, Schiedam Centrum, Rotterdam Blaak, Schiedam Centrum, Delft, Den Haag Laan v NOI, Leiden Centraal, Den Haag Centraal, Gouda, Utrecht Centraal, Gouda, Alphen a/d Rijn]"
train_12,"[Haarlem, Heemstede-Aerdenhout, Haarlem, Beverwijk, Castricum, Beverwijk, Zaandam, Hoorn, Zaandam, Beverwijk, Haarlem]"
train_13,"[s-Hertogenbosch, Eindhoven, Tilburg, s-Hertogenbosch, Tilburg, Eindhoven, Weert, Eindhoven, Helmond, Venlo]"
train_14,"[Oss, Nijmegen, Arnhem Centraal, Ede-Wageningen, Utrecht Centraal, Ede-Wageningen, Arnhem Centraal, Ede-Wageningen, Arnhem Centraal, Dieren, Arnhem Centraal, Ede-Wageningen, Utrecht Centraal]"
train_15,"[Gouda, Rotterdam Alexander, Rotterdam Blaak, Dordrecht, Roosendaal, Vlissingen]"
train_16,"[Den Haag Laan v NOI, Leiden Centraal, Alphen a/d Rijn, Utrecht Centraal, Gouda, Den Haag Laan v NOI, Leiden Centraal, Den Haag Laan v NOI, Delft, Den Haag Laan v NOI, Gouda]"
train_17,"[Groningen, Assen, Zwolle, Deventer, Almelo, Zwolle, Deventer]"
train_18,"[Rotterdam Blaak, Schiedam Centrum, Rotterdam Centraal, Dordrecht, Breda, Etten-Leur, Roosendaal, Dordrecht, Breda, Dordrecht, Rotterdam Blaak, Dordrecht, Roosendaal]"
train_19,"[Roosendaal, Etten-Leur, Roosendaal, Vlissingen, Roosendaal, Etten-Leur, Breda]"
train_20,"[Breda, Etten-Leur, Roosendaal, Etten-Leur, Breda, Etten-Leur, Breda, Etten-Leur, Roosendaal, Dordrecht, Breda, Dordrecht, Breda, Tilburg, s-Hertogenbosch]"
score,2384.4494382022467
