train,stations
train_1,"[Beverwijk, Castricum, Zaandam, Castricum, Alkmaar, Hoorn, Zaandam, Castricum, Alkmaar, Hoorn, Zaandam, Castricum]"
train_2,"[Castricum, Zaandam, Amsterdam Sloterdijk, Haarlem, Beverwijk, Zaandam, Amsterdam Sloterdijk, Amsterdam Centraal, Amsterdam Amstel, Hilversum, Amsterdam Amstel, Utrecht Centraal]"
train_3,"[Hoorn, Alkmaar, Den Helder, Alkmaar, Castricum, Zaandam, Castricum, Zaandam, Castricum, Zaandam]"
train_4,"[Zaandam, Hoorn, Alkmaar, Hoorn, Alkmaar, Castricum, Alkmaar, Den Helder]"
train_5,"[Amsterdam Amstel, Amsterdam Centraal, Utrecht Centraal, Ede-Wageningen, Arnhem Centraal, Dieren, Zutphen, Deventer, Zutphen, Dieren, Zutphen, Dieren, Zutphen, Apeldoorn, Deventer]"
train_6,"[Leiden Centraal, Den Haag HS, Gouda, Utrecht Centraal, Ede-Wageningen, Arnhem Centraal, Ede-Wageningen, Utrecht Centraal, Ede-Wageningen, Arnhem Centraal, Nijmegen]"
train_7,"[Amsterdam Amstel, Amsterdam Zuid, Amsterdam Amstel, Utrecht Centraal, Schiphol Airport, Utrecht Centraal, Amersfoort, Zwolle]"
train_8,"[Rotterdam Blaak, Dordrecht, Rotterdam Centraal, Schiedam Centrum, Rotterdam Centraal, Schiedam Centrum, Rotterdam Blaak, Schiedam Centrum, Rotterdam Centraal, Dordrecht, Rotterdam Centraal, Schiedam Centrum, Rotterdam Blaak, Rotterdam Alexander, Rotterdam Blaak, Dordrecht, Rotterdam Blaak]"
train_9,"[Zaandam, Castricum, Beverwijk, Haarlem, Heemstede-Aerdenhout, Leiden Centraal, Den Haag Centraal, Delft, Den Haag Laan v NOI, Delft, Den Haag Laan v NOI, Delft, Den Haag Centraal, Leiden Centraal, Den Haag HS]"
train_10,"[Amsterdam Sloterdijk, Amsterdam Centraal, Amsterdam Sloterdijk, Haarlem, Amsterdam Sloterdijk, Amsterdam Centraal, Amsterdam Amstel, Amsterdam Zuid, Amsterdam Sloterdijk, Zaandam, Castricum, Beverwijk, Zaandam, Beverwijk, Haarlem]"
train_11,"[Oss, Nijmegen, Oss, Nijmegen, Oss, Nijmegen, Oss, s-Hertogenbosch, Tilburg, s-Hertogenbosch, Oss, Nijmegen]"
train_12,"[Zaandam, Beverwijk, Haarlem, Amsterdam Sloterdijk, Haarlem, Heemstede-Aerdenhout, Leiden Centraal, Alphen a/d Rijn, Utrecht Centraal, Ede-Wageningen, Utrecht Centraal]"
train_13,"[Alkmaar, Castricum, Zaandam, Hoorn, Alkmaar, Den Helder, Alkmaar, Castricum, Beverwijk]"
train_14,"[Rotterdam Alexander, Gouda, Den Haag HS, Leiden Centraal, Heemstede-Aerdenhout, Leiden Centraal, Schiphol Airport, Utrecht Centraal, Gouda, Utrecht Centraal, Amsterdam Amstel]"
train_15,"[Breda, Etten-Leur, Breda, Tilburg, Eindhoven, Weert, Roermond, Weert, Eindhoven, Weert, Eindhoven, Helmond]"
train_16,"[Gouda, Rotterdam Alexander, Gouda, Den Haag Centraal, Delft, Den Haag HS, Leiden Centraal, Den Haag Laan v NOI, Gouda, Alphen a/d Rijn, Gouda, Utrecht Centraal]"
train_17,"[Beverwijk, Castricum, Beverwijk, Haarlem, Heemstede-Aerdenhout, Leiden Centraal, Den Haag Centraal, Gouda, Den Haag Laan v NOI, Leiden Centraal, Heemstede-Aerdenhout, Haarlem, Beverwijk, Castricum]"
train_18,"[Schiphol Airport, Amsterdam Zuid, Amsterdam Amstel, Utrecht Centraal, s-Hertogenbosch, Oss, Nijmegen, Oss, s-Hertogenbosch, Utrecht Centraal, Alphen a/d Rijn]"
train_19,"[Apeldoorn, Deventer, Apeldoorn, Amersfoort, Apeldoorn, Amersfoort, Apeldoorn, Amersfoort, Utrecht Centraal, Amsterdam Amstel]"
train_20,"[Deventer, Zutphen, Dieren, Arnhem Centraal, Ede-Wageningen, Utrecht Centraal, Alphen a/d Rijn, Leiden Centraal, Heemstede-Aerdenhout, Leiden Centraal, Alphen a/d Rijn, Leiden Centraal, Den Haag Centraal]"
score,1590.2921348314612
