train,stations
train_1,"[Alphen a/d Rijn, Utrecht Centraal, Gouda, Den Haag Laan v NOI, Gouda, Utrecht Centraal, Amsterdam Centraal, Almere Centrum]"
train_2,"[Gouda, Den Haag HS, Leiden Centraal, Heemstede-Aerdenhout, Leiden Centraal, Den Haag Laan v NOI, Delft, Den Haag Centraal, Delft, Den Haag Centraal, Delft, Den Haag Centraal, Delft, Den Haag Centraal]"
train_3,"[Lelystad Centrum, Almere Centrum, Hilversum, Utrecht Centraal, Amsterdam Centraal, Utrecht Centraal, Alphen a/d Rijn, Utrecht Centraal]"
train_4,"[Den Haag Centraal, Leiden Centraal, Alphen a/d Rijn, Gouda, Den Haag Centraal, Delft, Den Haag Centraal, Gouda, Rotterdam Alexander, Gouda, Den Haag HS, Leiden Centraal, Heemstede-Aerdenhout]"
train_5,"[Venlo, Helmond, Eindhoven, Helmond, Venlo, Helmond, Eindhoven, Tilburg, Eindhoven]"
train_6,"[Beverwijk, Zaandam, Beverwijk, Castricum, Beverwijk, Zaandam, Beverwijk, Castricum, Beverwijk, Zaandam]"
train_7,"[Tilburg, s-Hertogenbosch, Oss, s-Hertogenbosch, Utrecht Centraal, Hilversum, Almere Centrum, Hilversum, Utrecht Centraal, Amersfoort]"
train_8,"[Den Helder, Alkmaar, Den Helder, Alkmaar, Den Helder]"
train_9,"[Hilversum, Almere Centrum, Amsterdam Amstel, Almere Centrum, Hilversum, Utrecht Centraal, Gouda, Alphen a/d Rijn, Leiden Centraal]"
train_10,"[Zwolle, Assen, Groningen, Assen, Groningen, Assen, Groningen, Leeuwarden]"
train_11,"[Haarlem, Beverwijk, Zaandam, Beverwijk, Castricum, Zaandam, Hoorn, Alkmaar, Hoorn]"
train_12,"[Delft, Schiedam Centrum, Delft, Den Haag Centraal, Delft, Den Haag HS, Gouda, Utrecht Centraal, Ede-Wageningen, Utrecht Centraal, Amersfoort]"
train_13,"[Heemstede-Aerdenhout, Haarlem, Beverwijk, Haarlem, Beverwijk, Haarlem, Amsterdam Sloterdijk, Amsterdam Zuid, Schiphol Airport, Leiden Centraal, Heemstede-Aerdenhout, Leiden Centraal, Heemstede-Aerdenhout, Haarlem, Beverwijk]"
train_14,"[Oss, Nijmegen, Arnhem Centraal, Nijmegen, Oss, s-Hertogenbosch, Tilburg, s-Hertogenbosch, Oss, s-Hertogenbosch, Oss, Nijmegen, Arnhem Centraal, Dieren, Zutphen]"
train_15,"[Amsterdam Amstel, Amsterdam Zuid, Schiphol Airport, Utrecht Centraal, Gouda, Utrecht Centraal, Alphen a/d Rijn, Leiden Centraal, Schiphol Airport, Amsterdam Zuid, Schiphol Airport, Amsterdam Zuid, Schiphol Airport]"
train_16,"[Steenwijk, Heerenveen, Leeuwarden, Heerenveen, Leeuwarden, Heerenveen, Leeuwarden, Groningen, Assen]"
train_17,"[Enschede, Hengelo, Almelo, Zwolle, Amersfoort, Utrecht Centraal, Gouda, Den Haag Centraal, Delft, Den Haag Centraal]"
train_18,"[Vlissingen, Roosendaal, Dordrecht, Breda, Tilburg, Breda, Dordrecht, Breda, Etten-Leur, Breda]"
train_19,"[Utrecht Centraal, Amersfoort, Apeldoorn, Zutphen, Apeldoorn, Amersfoort, Utrecht Centraal, s-Hertogenbosch, Eindhoven, Weert]"
train_20,"[Eindhoven, Helmond, Venlo, Helmond, Venlo, Helmond, Eindhoven, s-Hertogenbosch]"
score,2044.7303370786522
