train,stations
train_1,"[Amsterdam Amstel, Amsterdam Zuid, Schiphol Airport, Utrecht Centraal, Hilversum, Almere Centrum, Amsterdam Centraal, Almere Centrum, Amsterdam Amstel]"
train_2,"[Assen, Zwolle, Amersfoort, Zwolle, Almelo]"
train_3,"[Lelystad Centrum, Almere Centrum, Lelystad Centrum, Almere Centrum, Amsterdam Centraal, Almere Centrum, Amsterdam Centraal, Amsterdam Sloterdijk, Zaandam, Beverwijk, Zaandam]"
train_4,"[Ede-Wageningen, Arnhem Centraal, Nijmegen, Arnhem Centraal, Ede-Wageningen, Utrecht Centraal, Ede-Wageningen, Utrecht Centraal, Ede-Wageningen, Arnhem Centraal, Dieren, Arnhem Centraal]"
train_5,"[Leeuwarden, Heerenveen, Steenwijk, Heerenveen, Leeuwarden, Heerenveen, Leeuwarden, Groningen, Assen]"
train_6,"[Rotterdam Blaak, Dordrecht, Roosendaal, Etten-Leur, Breda, Tilburg, s-Hertogenbosch, Tilburg, s-Hertogenbosch, Eindhoven, Weert, Eindhoven]"
train_7,"[Steenwijk, Zwolle, Assen, Groningen, Leeuwarden, Heerenveen, Steenwijk, Zwolle]"
train_8,"[Amersfoort, Utrecht Centraal, s-Hertogenbosch, Tilburg, Eindhoven, s-Hertogenbosch, Oss, s-Hertogenbosch, Oss, Nijmegen, Arnhem Centraal, Nijmegen]"
train_9,"[Gouda, Alphen a/d Rijn, Leiden Centraal, Den Haag HS, Leiden Centraal, Schiphol Airport, Amsterdam Zuid, Schiphol Airport, Utrecht Centraal, s-Hertogenbosch, Eindhoven, Helmond]"
train_10,"[Beverwijk, Castricum, Beverwijk, Zaandam, Castricum, Zaandam, Castricum, Zaandam, Hoorn, Alkmaar]"
train_11,"[Rotterdam Centraal, Rotterdam Alexander, Gouda, Den Haag HS, Gouda, Utrecht Centraal, Schiphol Airport, Utrecht Centraal, Amsterdam Centraal]"
train_12,"[Alkmaar, Den Helder, Alkmaar, Hoorn, Zaandam, Castricum, Beverwijk, Castricum, Beverwijk]"
train_13,"[Dordrecht, Roosendaal, Vlissingen, Roosendaal, Etten-Leur, Roosendaal]"
train_14,"[Zwolle, Amersfoort, Utrecht Centraal, s-Hertogenbosch, Eindhoven, s-Hertogenbosch, Tilburg, Eindhoven, s-Hertogenbosch]"
train_15,"[Dordrecht, Rotterdam Centraal, Rotterdam Alexander, Rotterdam Centraal, Schiedam Centrum, Rotterdam Centraal, Rotterdam Alexander, Rotterdam Blaak, Dordrecht, Rotterdam Blaak, Dordrecht, Rotterdam Centraal, Schiedam Centrum, Rotterdam Blaak, Dordrecht, Rotterdam Centraal]"
train_16,"[Hilversum, Amsterdam Amstel, Amsterdam Zuid, Amsterdam Sloterdijk, Amsterdam Zuid, Amsterdam Sloterdijk, Amsterdam Centraal, Amsterdam Sloterdijk, Amsterdam Centraal, Utrecht Centraal, Alphen a/d Rijn, Gouda]"
train_17,"[Steenwijk, Zwolle, Steenwijk, Zwolle, Deventer, Almelo, Deventer, Apeldoorn, Deventer]"
train_18,"[Leiden Centraal, Schiphol Airport, Amsterdam Zuid, Schiphol Airport, Amsterdam Zuid, Schiphol Airport, Utrecht Centraal, Schiphol Airport, Leiden Centraal, Den Haag Centraal, Gouda, Den Haag Centraal]"
train_19,"[Rotterdam Centraal, Dordrecht, Rotterdam Blaak, Schiedam Centrum, Rotterdam Blaak, Schiedam Centrum, Rotterdam Centraal, Rotterdam Alexander, Rotterdam Blaak, Dordrecht, Roosendaal]"
train_20,"[Arnhem Centraal, Nijmegen, Oss, Nijmegen, Oss, Nijmegen, Oss, s-Hertogenbosch, Utrecht Centraal, Amersfoort, Utrecht Centraal]"
score,1930.0112359550558
