train,stations
train_1,"[Leiden Centraal, Schiphol Airport, Amsterdam Zuid, Amsterdam Amstel, Almere Centrum, Amsterdam Centraal, Amsterdam Sloterdijk, Amsterdam Centraal, Amsterdam Amstel, Almere Centrum, Amsterdam Amstel, Utrecht Centraal]"
train_2,"[Almere Centrum, Amsterdam Amstel, Almere Centrum, Amsterdam Centraal, Amsterdam Amstel, Almere Centrum, Hilversum, Utrecht Centraal, s-Hertogenbosch]"
train_3,"[Haarlem, Heemstede-Aerdenhout, Leiden Centraal, Alphen a/d Rijn, Leiden Centraal, Den Haag Laan v NOI, Gouda, Utrecht Centraal, Hilversum, Amsterdam Amstel, Amsterdam Centraal, Amsterdam Sloterdijk, Amsterdam Zuid]"
train_4,"[Steenwijk, Heerenveen, Steenwijk, Zwolle, Assen, Zwolle, Almelo]"
train_5,"[Zutphen, Apeldoorn, Deventer, Apeldoorn, Zutphen, Dieren, Zutphen, Apeldoorn, Amersfoort, Zwolle, Steenwijk]"
train_6,"[Rotterdam Alexander, Gouda, Rotterdam Alexander, Gouda, Den Haag HS, Leiden Centraal, Den Haag HS, Leiden Centraal, Den Haag Centraal, Leiden Centraal, Den Haag Centraal, Leiden Centraal, Schiphol Airport, Amsterdam Zuid, Amsterdam Amstel, Amsterdam Centraal]"
train_7,"[Steenwijk, Zwolle, Deventer, Apeldoorn, Zutphen, Deventer, Almelo, Deventer, Almelo]"
train_8,"[Dieren, Zutphen, Dieren, Arnhem Centraal, Nijmegen, Oss, s-Hertogenbosch, Oss, Nijmegen, Arnhem Centraal, Nijmegen, Oss, Nijmegen, Arnhem Centraal, Ede-Wageningen]"
train_9,"[Venlo, Helmond, Venlo, Helmond, Eindhoven, Tilburg, s-Hertogenbosch, Eindhoven, Weert]"
train_10,"[Amsterdam Sloterdijk, Haarlem, Heemstede-Aerdenhout, Haarlem, Heemstede-Aerdenhout, Leiden Centraal, Den Haag HS, Leiden Centraal, Den Haag Centraal, Delft, Den Haag Centraal, Leiden Centraal, Den Haag Laan v NOI, Gouda, Den Haag Centraal]"
train_11,"[Breda, Etten-Leur, Breda, Etten-Leur, Roosendaal, Etten-Leur, Roosendaal, Etten-Leur, Roosendaal, Dordrecht, Roosendaal, Dordrecht, Rotterdam Blaak, Rotterdam Alexander, Gouda]"
train_12,"[Lelystad Centrum, Almere Centrum, Amsterdam Amstel, Almere Centrum, Amsterdam Amstel, Utrecht Centraal, Amsterdam Centraal, Utrecht Centraal]"
train_13,"[Tilburg, Eindhoven, s-Hertogenbosch, Oss, Nijmegen, Arnhem Centraal, Dieren, Zutphen, Dieren, Arnhem Centraal, Dieren, Arnhem Centraal, Nijmegen, Oss]"
train_14,"[s-Hertogenbosch, Eindhoven, Tilburg, Eindhoven, Helmond, Eindhoven, s-Hertogenbosch, Oss, Nijmegen, Arnhem Centraal, Dieren, Arnhem Centraal, Ede-Wageningen, Arnhem Centraal]"
train_15,"[Lelystad Centrum, Almere Centrum, Amsterdam Centraal, Almere Centrum, Amsterdam Centraal, Utrecht Centraal, Alphen a/d Rijn, Leiden Centraal, Heemstede-Aerdenhout, Haarlem, Heemstede-Aerdenhout, Haarlem]"
train_16,"[Zutphen, Apeldoorn, Amersfoort, Zwolle, Deventer, Zwolle, Deventer, Apeldoorn]"
train_17,"[Oss, s-Hertogenbosch, Utrecht Centraal, Amsterdam Centraal, Almere Centrum, Amsterdam Centraal, Utrecht Centraal, Ede-Wageningen]"
train_18,"[s-Hertogenbosch, Eindhoven, Helmond, Eindhoven, Tilburg, Breda, Tilburg, s-Hertogenbosch, Eindhoven, Tilburg, Eindhoven, Tilburg]"
train_19,"[Ede-Wageningen, Utrecht Centraal, s-Hertogenbosch, Tilburg, s-Hertogenbosch, Oss, Nijmegen, Arnhem Centraal, Ede-Wageningen, Utrecht Centraal]"
train_20,"[Amsterdam Zuid, Amsterdam Sloterdijk, Amsterdam Zuid, Amsterdam Sloterdijk, Haarlem, Amsterdam Sloterdijk, Amsterdam Centraal, Almere Centrum, Amsterdam Amstel, Hilversum, Amsterdam Amstel]"
score,1179.2134831460671
