train,stations
train_1,"[Dordrecht, Breda, Etten-Leur, Roosendaal, Vlissingen, Roosendaal]"
train_2,"[Den Haag Laan v NOI, Gouda, Rotterdam Alexander, Gouda, Utrecht Centraal, s-Hertogenbosch, Eindhoven, s-Hertogenbosch, Oss, Nijmegen, Oss]"
train_3,"[Roosendaal, Dordrecht, Rotterdam Blaak, Rotterdam Alexander, Rotterdam Centraal, Dordrecht, Breda, Dordrecht, Roosendaal, Dordrecht, Breda]"
train_4,"[Maastricht, Sittard, Heerlen, Sittard, Maastricht, Sittard, Heerlen, Sittard, Maastricht, Sittard, Roermond, Sittard]"
train_5,"[Den Haag Centraal, Gouda, Den Haag HS, Delft, Den Haag HS, Delft, Den Haag Laan v NOI, Leiden Centraal, Den Haag Centraal, Gouda, Den Haag Laan v NOI, Leiden Centraal, Schiphol Airport]"
train_6,"[Den Haag Laan v NOI, Delft, Den Haag Centraal, Leiden Centraal, Schiphol Airport, Leiden Centraal, Alphen a/d Rijn, Gouda, Rotterdam Alexander, Gouda, Den Haag Laan v NOI, Leiden Centraal, Schiphol Airport]"
train_7,"[Roermond, Sittard, Roermond, Sittard, Roermond, Sittard, Heerlen, Sittard, Heerlen, Sittard, Maastricht, Sittard]"
train_8,"[Alphen a/d Rijn, Gouda, Den Haag HS, Delft, Schiedam Centrum, Rotterdam Centraal, Schiedam Centrum, Delft, Den Haag Laan v NOI, Gouda, Den Haag HS, Leiden Centraal, Heemstede-Aerdenhout, Haarlem, Amsterdam Sloterdijk]"
train_9,"[Den Haag HS, Delft, Den Haag Laan v NOI, Delft, Den Haag Laan v NOI, Leiden Centraal, Schiphol Airport, Utrecht Centraal, Amsterdam Amstel, Utrecht Centraal, Schiphol Airport, Amsterdam Zuid]"
train_10,"[Leiden Centraal, Den Haag Laan v NOI, Delft, Den Haag HS, Delft, Den Haag Laan v NOI, Leiden Centraal, Den Haag HS, Delft, Den Haag HS, Delft, Den Haag HS, Leiden Centraal, Schiphol Airport, Utrecht Centraal]"
train_11,"[Helmond, Venlo, Helmond, Venlo, Helmond, Venlo]"
train_12,"[Rotterdam Blaak, Dordrecht, Roosendaal, Vlissingen, Roosendaal]"
train_13,"[Vlissingen, Roosendaal, Vlissingen]"
train_14,"[Vlissingen, Roosendaal, Dordrecht, Rotterdam Blaak, Schiedam Centrum, Delft, Schiedam Centrum, Rotterdam Blaak, Schiedam Centrum, Rotterdam Centraal, Schiedam Centrum, Rotterdam Centraal, Dordrecht]"
train_15,"[Deventer, Almelo, Deventer, Almelo, Hengelo, Almelo, Deventer, Zwolle, Deventer]"
train_16,"[Almere Centrum, Amsterdam Centraal, Amsterdam Sloterdijk, Amsterdam Centraal, Amsterdam Amstel, Hilversum, Utrecht Centraal, Ede-Wageningen, Utrecht Centraal, Ede-Wageningen, Utrecht Centraal]"
train_17,"[Delft, Den Haag HS, Delft, Den Haag HS, Leiden Centraal, Schiphol Airport, Amsterdam Zuid, Amsterdam Sloterdijk, Amsterdam Centraal, Amsterdam Sloterdijk, Zaandam, Hoorn, Zaandam, Castricum, Zaandam, Castricum]"
train_18,"[Roosendaal, Dordrecht, Rotterdam Blaak, Schiedam Centrum, Rotterdam Centraal, Schiedam Centrum, Rotterdam Blaak, Rotterdam Alexander, Rotterdam Centraal, Dordrecht, Breda, Etten-Leur, Roosendaal, Dordrecht, Rotterdam Centraal]"
train_19,"[Hoorn, Zaandam, Castricum, Zaandam, Beverwijk, Castricum, Beverwijk, Haarlem, Amsterdam Sloterdijk, Amsterdam Zuid, Amsterdam Amstel, Amsterdam Centraal, Amsterdam Sloterdijk]"
train_20,"[Sittard, Roermond, Weert, Roermond, Sittard, Maastricht, Sittard, Maastricht, Sittard, Heerlen, Sittard, Heerlen, Sittard]"
score,1092.8539325842703
