train,stations
train_1,"[Almelo, Hengelo, Almelo, Hengelo, Almelo, Deventer, Almelo, Zwolle, Steenwijk, Heerenveen]"
train_2,"[Eindhoven, Tilburg, Eindhoven, s-Hertogenbosch, Eindhoven, Helmond, Eindhoven, Helmond, Eindhoven, s-Hertogenbosch, Utrecht Centraal]"
train_3,"[Dieren, Zutphen, Deventer, Zwolle, Steenwijk, Zwolle, Deventer, Almelo, Hengelo, Almelo]"
train_4,"[Ede-Wageningen, Utrecht Centraal, Gouda, Den Haag Laan v NOI, Leiden Centraal, Schiphol Airport, Amsterdam Zuid, Schiphol Airport, Utrecht Centraal, Ede-Wageningen, Arnhem Centraal]"
train_5,"[Amsterdam Zuid, Schiphol Airport, Amsterdam Zuid, Amsterdam Sloterdijk, Amsterdam Centraal, Amsterdam Sloterdijk, Amsterdam Centraal, Almere Centrum, Hilversum, Utrecht Centraal, Amersfoort, Apeldoorn, Zutphen]"
train_6,"[Vlissingen, Roosendaal, Etten-Leur, Roosendaal, Etten-Leur, Breda, Etten-Leur, Breda, Etten-Leur, Roosendaal]"
train_7,"[Heerenveen, Steenwijk, Heerenveen, Leeuwarden, Groningen, Leeuwarden, Heerenveen, Leeuwarden, Heerenveen, Leeuwarden]"
train_8,"[Zaandam, Hoorn, Zaandam, Hoorn, Zaandam, Amsterdam Sloterdijk, Amsterdam Centraal, Almere Centrum, Hilversum]"
train_9,"[Amsterdam Sloterdijk, Zaandam, Amsterdam Sloterdijk, Zaandam, Castricum, Alkmaar, Hoorn, Alkmaar, Castricum, Beverwijk, Castricum, Beverwijk, Zaandam]"
train_10,"[Nijmegen, Oss, s-Hertogenbosch, Oss, s-Hertogenbosch, Eindhoven, Weert, Roermond, Sittard, Maastricht, Sittard, Maastricht, Sittard]"
train_11,"[Den Haag HS, Gouda, Den Haag HS, Gouda, Rotterdam Alexander, Rotterdam Centraal, Dordrecht, Rotterdam Centraal, Schiedam Centrum, Rotterdam Centraal, Schiedam Centrum, Rotterdam Centraal, Rotterdam Alexander, Gouda, Den Haag Centraal]"
train_12,"[Nijmegen, Oss, Nijmegen, Oss, s-Hertogenbosch, Eindhoven, s-Hertogenbosch, Tilburg, Eindhoven, Helmond, Eindhoven, s-Hertogenbosch]"
train_13,"[Heemstede-Aerdenhout, Leiden Centraal, Heemstede-Aerdenhout, Leiden Centraal, Heemstede-Aerdenhout, Haarlem, Amsterdam Sloterdijk, Amsterdam Zuid, Schiphol Airport, Leiden Centraal, Den Haag Laan v NOI, Delft, Den Haag Laan v NOI, Delft, Den Haag Centraal, Delft]"
train_14,"[Alkmaar, Hoorn, Alkmaar, Castricum, Zaandam, Beverwijk, Castricum, Zaandam, Beverwijk, Zaandam]"
train_15,"[Utrecht Centraal, Amersfoort, Apeldoorn, Deventer, Zutphen, Deventer, Almelo, Zwolle, Deventer, Zutphen]"
train_16,"[Ede-Wageningen, Utrecht Centraal, s-Hertogenbosch, Oss, Nijmegen, Oss, s-Hertogenbosch, Tilburg, Breda, Etten-Leur, Breda, Etten-Leur, Breda, Etten-Leur, Breda]"
train_17,"[Heerenveen, Steenwijk, Zwolle, Amersfoort, Zwolle, Almelo]"
train_18,"[Delft, Den Haag HS, Delft, Den Haag Centraal, Leiden Centraal, Alphen a/d Rijn, Utrecht Centraal, Gouda, Rotterdam Alexander, Rotterdam Blaak, Schiedam Centrum, Rotterdam Blaak, Dordrecht, Breda]"
train_19,"[Zaandam, Beverwijk, Zaandam, Beverwijk, Castricum, Alkmaar, Castricum, Beverwijk, Haarlem, Amsterdam Sloterdijk, Haarlem, Amsterdam Sloterdijk, Zaandam]"
train_20,"[Lelystad Centrum, Almere Centrum, Hilversum, Almere Centrum, Hilversum, Amsterdam Amstel, Almere Centrum, Amsterdam Centraal, Amsterdam Sloterdijk]"
score,2859.2471910112363
