train,stations
train_1,"[Rotterdam Centraal, Schiedam Centrum, Delft, Den Haag Laan v NOI, Leiden Centraal, Den Haag HS, Leiden Centraal, Alphen a/d Rijn, Utrecht Centraal, Amersfoort, Zwolle]"
train_2,"[Dieren, Arnhem Centraal, Dieren, Zutphen, Dieren, Zutphen, Apeldoorn, Amersfoort, Utrecht Centraal, Ede-Wageningen, Utrecht Centraal]"
train_3,"[Assen, Zwolle, Steenwijk, Heerenveen, Steenwijk, Heerenveen, Leeuwarden, Groningen, Assen]"
train_4,"[Helmond, Eindhoven, Helmond, Venlo, Helmond, Venlo, Helmond, Eindhoven, s-Hertogenbosch]"
train_5,"[Leiden Centraal, Schiphol Airport, Amsterdam Zuid, Schiphol Airport, Utrecht Centraal, Amsterdam Centraal, Almere Centrum, Hilversum, Almere Centrum]"
train_6,"[Beverwijk, Haarlem, Heemstede-Aerdenhout, Haarlem, Amsterdam Sloterdijk, Amsterdam Zuid, Amsterdam Amstel, Utrecht Centraal, Ede-Wageningen, Arnhem Centraal, Nijmegen, Oss, Nijmegen, Oss]"
train_7,"[Haarlem, Heemstede-Aerdenhout, Haarlem, Beverwijk, Zaandam, Castricum, Beverwijk, Haarlem, Amsterdam Sloterdijk, Haarlem, Beverwijk, Haarlem, Beverwijk]"
train_8,"[Amsterdam Centraal, Almere Centrum, Amsterdam Amstel, Almere Centrum, Lelystad Centrum, Almere Centrum, Lelystad Centrum, Almere Centrum, Lelystad Centrum, Almere Centrum]"
train_9,"[Leiden Centraal, Den Haag Centraal, Delft, Schiedam Centrum, Rotterdam Centraal, Dordrecht, Roosendaal, Etten-Leur, Breda, Etten-Leur, Breda, Etten-Leur, Breda, Tilburg, Eindhoven, Helmond]"
train_10,"[Dieren, Zutphen, Deventer, Zwolle, Steenwijk, Heerenveen, Steenwijk, Zwolle, Assen]"
train_11,"[Rotterdam Alexander, Rotterdam Centraal, Rotterdam Alexander, Gouda, Rotterdam Alexander, Rotterdam Blaak, Dordrecht, Roosendaal, Dordrecht, Rotterdam Blaak, Rotterdam Alexander, Rotterdam Centraal, Rotterdam Alexander, Gouda, Den Haag Centraal]"
train_12,"[Beverwijk, Haarlem, Beverwijk, Castricum, Alkmaar, Hoorn, Alkmaar, Hoorn, Zaandam, Amsterdam Sloterdijk, Haarlem, Heemstede-Aerdenhout]"
train_13,"[Roermond, Weert, Roermond, Sittard, Roermond, Sittard, Heerlen, Sittard, Maastricht, Sittard, Roermond, Weert, Eindhoven]"
train_14,"[s-Hertogenbosch, Tilburg, Breda, Tilburg, Eindhoven, Helmond, Eindhoven, Tilburg, s-Hertogenbosch, Utrecht Centraal, Alphen a/d Rijn]"
train_15,"[Rotterdam Alexander, Gouda, Den Haag Laan v NOI, Delft, Den Haag HS, Leiden Centraal, Heemstede-Aerdenhout, Leiden Centraal, Den Haag Laan v NOI, Gouda, Den Haag Laan v NOI, Delft]"
train_16,"[Enschede, Hengelo, Enschede, Hengelo, Almelo, Hengelo, Almelo, Deventer, Zwolle, Assen, Groningen, Assen]"
train_17,"[Oss, Nijmegen, Arnhem Centraal, Dieren, Zutphen, Apeldoorn, Amersfoort, Apeldoorn, Zutphen, Apeldoorn, Deventer]"
train_18,"[Gouda, Rotterdam Alexander, Rotterdam Centraal, Dordrecht, Roosendaal, Vlissingen]"
train_19,"[Almere Centrum, Amsterdam Centraal, Utrecht Centraal, Alphen a/d Rijn, Gouda, Den Haag HS, Leiden Centraal, Den Haag HS, Delft, Schiedam Centrum, Rotterdam Blaak, Dordrecht]"
train_20,"[Amsterdam Amstel, Amsterdam Zuid, Schiphol Airport, Leiden Centraal, Schiphol Airport, Amsterdam Zuid, Amsterdam Sloterdijk, Amsterdam Centraal, Amsterdam Sloterdijk, Zaandam, Castricum, Alkmaar, Den Helder, Alkmaar]"
score,3872.483146067416
