train,stations
train_1,"[Deventer, Apeldoorn, Amersfoort, Utrecht Centraal, Hilversum, Utrecht Centraal, Amsterdam Amstel, Hilversum, Almere Centrum, Amsterdam Centraal, Amsterdam Amstel]"
train_2,"[Rotterdam Blaak, Rotterdam Alexander, Gouda, Den Haag Centraal, Leiden Centraal, Alphen a/d Rijn, Leiden Centraal, Den Haag Laan v NOI, Gouda, Alphen a/d Rijn, Utrecht Centraal]"
train_3,"[Rotterdam Centraal, Dordrecht, Breda, Tilburg, Breda, Tilburg, s-Hertogenbosch, Tilburg, Breda, Tilburg, Eindhoven, Weert]"
train_4,"[Den Helder, Alkmaar, Den Helder, Alkmaar, Castricum, Beverwijk, Castricum, Alkmaar, Hoorn]"
train_5,"[s-Hertogenbosch, Utrecht Centraal, Gouda, Rotterdam Alexander, Rotterdam Blaak, Rotterdam Alexander, Rotterdam Centraal, Dordrecht, Roosendaal]"
train_6,"[Enschede, Hengelo, Enschede, Hengelo, Enschede, Hengelo, Almelo, Zwolle, Amersfoort, Zwolle]"
train_7,"[Almere Centrum, Lelystad Centrum, Almere Centrum, Amsterdam Centraal, Almere Centrum, Amsterdam Amstel, Utrecht Centraal, Ede-Wageningen, Arnhem Centraal, Ede-Wageningen, Arnhem Centraal]"
train_8,"[Castricum, Zaandam, Amsterdam Sloterdijk, Haarlem, Beverwijk, Castricum, Beverwijk, Haarlem, Amsterdam Sloterdijk, Amsterdam Zuid, Amsterdam Sloterdijk, Amsterdam Centraal, Amsterdam Amstel, Amsterdam Centraal, Utrecht Centraal]"
train_9,"[Gouda, Den Haag HS, Leiden Centraal, Den Haag HS, Gouda, Den Haag Laan v NOI, Leiden Centraal, Den Haag Centraal, Delft, Den Haag HS, Gouda, Den Haag Centraal]"
train_10,"[Breda, Dordrecht, Breda, Dordrecht, Rotterdam Blaak, Dordrecht, Rotterdam Centraal, Schiedam Centrum, Delft, Den Haag HS, Delft, Den Haag Laan v NOI, Gouda]"
train_11,"[Den Haag Laan v NOI, Delft, Den Haag HS, Leiden Centraal, Alphen a/d Rijn, Gouda, Den Haag Centraal, Leiden Centraal, Den Haag HS, Leiden Centraal, Den Haag Centraal, Leiden Centraal, Heemstede-Aerdenhout, Leiden Centraal]"
train_12,"[Gouda, Utrecht Centraal, Amsterdam Amstel, Amsterdam Zuid, Schiphol Airport, Utrecht Centraal, Amersfoort, Apeldoorn, Zutphen, Deventer]"
train_13,"[Hengelo, Almelo, Deventer, Zwolle, Steenwijk, Heerenveen, Steenwijk, Zwolle, Almelo]"
train_14,"[Den Haag HS, Leiden Centraal, Den Haag Centraal, Leiden Centraal, Alphen a/d Rijn, Leiden Centraal, Heemstede-Aerdenhout, Haarlem, Amsterdam Sloterdijk, Amsterdam Centraal, Almere Centrum, Hilversum, Utrecht Centraal, Gouda]"
train_15,"[Leiden Centraal, Heemstede-Aerdenhout, Leiden Centraal, Den Haag Centraal, Leiden Centraal, Den Haag HS, Delft, Den Haag HS, Leiden Centraal, Den Haag Laan v NOI, Leiden Centraal, Schiphol Airport, Leiden Centraal, Den Haag Centraal, Leiden Centraal, Alphen a/d Rijn]"
train_16,"[Sittard, Roermond, Weert, Roermond, Sittard, Heerlen, Sittard, Maastricht, Sittard, Roermond, Weert, Eindhoven, Helmond]"
train_17,"[Ede-Wageningen, Arnhem Centraal, Nijmegen, Arnhem Centraal, Dieren, Arnhem Centraal, Dieren, Zutphen, Deventer, Apeldoorn, Amersfoort, Utrecht Centraal, s-Hertogenbosch]"
train_18,"[Sittard, Heerlen, Sittard, Heerlen, Sittard, Roermond, Sittard, Heerlen, Sittard, Roermond, Sittard, Maastricht]"
train_19,"[Sittard, Roermond, Sittard, Maastricht, Sittard, Roermond, Sittard, Heerlen, Sittard, Roermond, Sittard, Maastricht]"
train_20,"[Roermond, Weert, Eindhoven, s-Hertogenbosch, Utrecht Centraal, Hilversum, Amsterdam Amstel, Amsterdam Centraal, Almere Centrum, Lelystad Centrum, Almere Centrum]"
score,3124.3258426966295
