train,stations
train_1,"[Assen, Groningen, Leeuwarden, Heerenveen, Steenwijk, Heerenveen, Steenwijk, Heerenveen, Steenwijk, Zwolle]"
train_2,"[Heerlen, Sittard, Maastricht, Sittard, Heerlen, Sittard, Roermond, Weert, Roermond, Weert, Roermond, Sittard, Heerlen]"
train_3,"[Roosendaal, Vlissingen, Roosendaal]"
train_4,"[Maastricht, Sittard, Roermond, Sittard, Maastricht, Sittard, Maastricht, Sittard, Maastricht, Sittard, Heerlen, Sittard]"
train_5,"[Roermond, Weert, Eindhoven, s-Hertogenbosch, Tilburg, Breda, Dordrecht, Rotterdam Centraal, Rotterdam Alexander, Gouda, Den Haag HS, Leiden Centraal, Schiphol Airport]"
train_6,"[Alkmaar, Castricum, Zaandam, Hoorn, Alkmaar, Castricum, Zaandam, Castricum, Alkmaar, Den Helder]"
train_7,"[Helmond, Eindhoven, Tilburg, s-Hertogenbosch, Utrecht Centraal, Gouda, Den Haag Centraal, Delft, Den Haag HS, Leiden Centraal, Den Haag HS, Leiden Centraal, Heemstede-Aerdenhout]"
train_8,"[Tilburg, Breda, Tilburg, s-Hertogenbosch, Oss, s-Hertogenbosch, Eindhoven, Weert, Roermond, Sittard, Roermond, Weert, Roermond]"
train_9,"[s-Hertogenbosch, Tilburg, s-Hertogenbosch, Tilburg, Eindhoven, Weert, Roermond, Sittard, Maastricht, Sittard, Maastricht, Sittard]"
train_10,"[Vlissingen, Roosendaal, Vlissingen]"
train_11,"[Zwolle, Deventer, Almelo, Hengelo, Almelo, Hengelo, Almelo, Deventer, Apeldoorn, Amersfoort]"
train_12,"[Zaandam, Amsterdam Sloterdijk, Zaandam, Beverwijk, Castricum, Alkmaar, Hoorn, Alkmaar, Castricum, Alkmaar, Den Helder]"
train_13,"[Schiedam Centrum, Delft, Den Haag HS, Leiden Centraal, Den Haag Laan v NOI, Delft, Den Haag Laan v NOI, Leiden Centraal, Den Haag Laan v NOI, Leiden Centraal, Heemstede-Aerdenhout, Haarlem, Heemstede-Aerdenhout, Leiden Centraal, Alphen a/d Rijn, Leiden Centraal, Den Haag HS, Delft]"
train_14,"[Etten-Leur, Roosendaal, Etten-Leur, Breda, Tilburg, Breda, Tilburg, Eindhoven, Tilburg, s-Hertogenbosch, Oss, Nijmegen, Arnhem Centraal, Ede-Wageningen]"
train_15,"[Amsterdam Zuid, Schiphol Airport, Amsterdam Zuid, Schiphol Airport, Leiden Centraal, Alphen a/d Rijn, Utrecht Centraal, Gouda, Rotterdam Alexander, Gouda, Utrecht Centraal, Gouda, Utrecht Centraal]"
train_16,"[Zaandam, Amsterdam Sloterdijk, Amsterdam Zuid, Amsterdam Amstel, Hilversum, Almere Centrum, Lelystad Centrum, Almere Centrum, Lelystad Centrum, Almere Centrum, Amsterdam Centraal]"
train_17,"[Heerenveen, Steenwijk, Zwolle, Steenwijk, Heerenveen, Leeuwarden, Groningen, Leeuwarden]"
train_18,"[Alphen a/d Rijn, Gouda, Den Haag Centraal, Gouda, Rotterdam Alexander, Rotterdam Centraal, Dordrecht, Breda, Etten-Leur, Roosendaal, Etten-Leur, Roosendaal]"
train_19,"[Alphen a/d Rijn, Gouda, Alphen a/d Rijn, Gouda, Rotterdam Alexander, Rotterdam Blaak, Rotterdam Alexander, Rotterdam Blaak, Rotterdam Alexander, Rotterdam Centraal, Dordrecht, Roosendaal, Dordrecht]"
train_20,"[Almelo, Zwolle, Steenwijk, Zwolle, Assen, Groningen]"
score,2186.730337078652
