train,stations
train_1,"[Amsterdam Sloterdijk, Zaandam, Beverwijk, Castricum, Beverwijk, Haarlem, Beverwijk, Haarlem, Amsterdam Sloterdijk, Zaandam, Beverwijk, Zaandam, Amsterdam Sloterdijk]"
train_2,"[Apeldoorn, Deventer, Almelo, Zwolle, Almelo, Zwolle]"
train_3,"[Helmond, Eindhoven, Helmond, Venlo, Helmond, Venlo, Helmond, Eindhoven, Weert]"
train_4,"[Utrecht Centraal, Amersfoort, Zwolle, Steenwijk, Zwolle, Almelo]"
train_5,"[Utrecht Centraal, Gouda, Alphen a/d Rijn, Leiden Centraal, Den Haag Laan v NOI, Leiden Centraal, Den Haag Centraal, Leiden Centraal, Heemstede-Aerdenhout, Haarlem, Amsterdam Sloterdijk, Amsterdam Zuid, Schiphol Airport, Amsterdam Zuid, Amsterdam Sloterdijk, Haarlem]"
train_6,"[Alphen a/d Rijn, Gouda, Alphen a/d Rijn, Leiden Centraal, Den Haag HS, Gouda, Den Haag Centraal, Leiden Centraal, Den Haag HS, Delft, Den Haag HS, Gouda, Rotterdam Alexander]"
train_7,"[Rotterdam Centraal, Schiedam Centrum, Delft, Den Haag Centraal, Leiden Centraal, Den Haag Laan v NOI, Gouda, Rotterdam Alexander, Rotterdam Blaak, Dordrecht, Rotterdam Blaak, Schiedam Centrum, Rotterdam Blaak, Rotterdam Alexander, Rotterdam Centraal, Schiedam Centrum, Rotterdam Centraal, Schiedam Centrum]"
train_8,"[Steenwijk, Heerenveen, Leeuwarden, Heerenveen, Leeuwarden, Groningen, Assen, Zwolle, Deventer]"
train_9,"[Arnhem Centraal, Dieren, Zutphen, Dieren, Arnhem Centraal, Dieren, Arnhem Centraal, Dieren, Zutphen, Dieren, Zutphen, Dieren, Zutphen, Deventer, Zutphen, Apeldoorn]"
train_10,"[Rotterdam Blaak, Rotterdam Alexander, Rotterdam Centraal, Rotterdam Alexander, Gouda, Alphen a/d Rijn, Utrecht Centraal, Gouda, Den Haag Centraal, Gouda, Rotterdam Alexander, Rotterdam Centraal, Rotterdam Alexander, Rotterdam Blaak]"
train_11,"[Rotterdam Centraal, Rotterdam Alexander, Gouda, Alphen a/d Rijn, Utrecht Centraal, Gouda, Den Haag Centraal, Gouda, Alphen a/d Rijn, Utrecht Centraal]"
train_12,"[Almelo, Zwolle, Assen, Groningen, Assen, Groningen, Leeuwarden]"
train_13,"[Beverwijk, Haarlem, Beverwijk, Zaandam, Castricum, Zaandam, Amsterdam Sloterdijk, Haarlem, Heemstede-Aerdenhout, Leiden Centraal, Den Haag HS, Gouda, Alphen a/d Rijn]"
train_14,"[Den Haag Laan v NOI, Delft, Schiedam Centrum, Rotterdam Blaak, Dordrecht, Rotterdam Blaak, Rotterdam Alexander, Rotterdam Centraal, Schiedam Centrum, Rotterdam Blaak, Schiedam Centrum, Rotterdam Centraal, Rotterdam Alexander, Rotterdam Blaak, Dordrecht, Roosendaal]"
train_15,"[Gouda, Den Haag Centraal, Gouda, Alphen a/d Rijn, Leiden Centraal, Den Haag Centraal, Gouda, Rotterdam Alexander, Rotterdam Centraal, Schiedam Centrum, Delft, Den Haag Centraal, Gouda]"
train_16,"[Dordrecht, Breda, Tilburg, Eindhoven, Weert, Eindhoven, s-Hertogenbosch, Utrecht Centraal, Amsterdam Amstel, Utrecht Centraal]"
train_17,"[Rotterdam Blaak, Dordrecht, Breda, Etten-Leur, Roosendaal, Vlissingen, Roosendaal]"
train_18,"[Dieren, Arnhem Centraal, Nijmegen, Arnhem Centraal, Dieren, Zutphen, Dieren, Arnhem Centraal, Ede-Wageningen, Arnhem Centraal, Dieren, Arnhem Centraal, Dieren, Zutphen, Apeldoorn]"
train_19,"[s-Hertogenbosch, Oss, s-Hertogenbosch, Utrecht Centraal, Gouda, Den Haag Centraal, Delft, Den Haag Centraal, Leiden Centraal, Schiphol Airport, Leiden Centraal, Heemstede-Aerdenhout, Leiden Centraal]"
train_20,"[Assen, Groningen, Leeuwarden, Groningen, Leeuwarden, Heerenveen, Steenwijk, Zwolle]"
score,1718.651685393258
