train,stations
train_1,"[Zutphen, Apeldoorn, Amersfoort, Utrecht Centraal, Schiphol Airport, Leiden Centraal, Heemstede-Aerdenhout, Haarlem, Beverwijk, Zaandam]"
train_2,"[Rotterdam Blaak, Schiedam Centrum, Rotterdam Blaak, Rotterdam Alexander, Rotterdam Blaak, Dordrecht, Rotterdam Centraal, Dordrecht, Rotterdam Centraal, Schiedam Centrum, Delft, Schiedam Centrum, Rotterdam Blaak, Schiedam Centrum, Rotterdam Blaak, Schiedam Centrum, Rotterdam Blaak]"
train_3,"[Leeuwarden, Heerenveen, Leeuwarden, Heerenveen, Leeuwarden, Heerenveen, Leeuwarden, Groningen, Assen]"
train_4,"[Dieren, Zutphen, Dieren, Zutphen, Apeldoorn, Zutphen, Apeldoorn, Deventer, Almelo, Hengelo, Almelo, Hengelo, Almelo]"
train_5,"[Zaandam, Amsterdam Sloterdijk, Zaandam, Hoorn, Zaandam, Amsterdam Sloterdijk, Zaandam, Beverwijk, Zaandam, Castricum, Zaandam, Castricum, Alkmaar]"
train_6,"[Dieren, Arnhem Centraal, Nijmegen, Arnhem Centraal, Nijmegen, Oss, Nijmegen, Arnhem Centraal, Ede-Wageningen, Arnhem Centraal, Dieren, Zutphen, Apeldoorn, Zutphen]"
train_7,"[Almere Centrum, Amsterdam Centraal, Amsterdam Amstel, Hilversum, Amsterdam Amstel, Utrecht Centraal, Amsterdam Centraal, Almere Centrum, Lelystad Centrum, Almere Centrum]"
train_8,"[Alkmaar, Den Helder, Alkmaar, Den Helder, Alkmaar, Hoorn]"
train_9,"[s-Hertogenbosch, Utrecht Centraal, Hilversum, Amsterdam Amstel, Utrecht Centraal, Amsterdam Centraal, Amsterdam Sloterdijk, Haarlem, Amsterdam Sloterdijk, Amsterdam Centraal, Almere Centrum]"
train_10,"[Leiden Centraal, Heemstede-Aerdenhout, Leiden Centraal, Den Haag Centraal, Gouda, Den Haag Centraal, Leiden Centraal, Alphen a/d Rijn, Gouda, Utrecht Centraal, s-Hertogenbosch, Oss]"
train_11,"[Assen, Groningen, Assen, Zwolle, Assen, Zwolle]"
train_12,"[Hilversum, Almere Centrum, Hilversum, Almere Centrum, Amsterdam Centraal, Amsterdam Sloterdijk, Amsterdam Zuid, Amsterdam Sloterdijk, Haarlem, Heemstede-Aerdenhout, Leiden Centraal, Heemstede-Aerdenhout]"
train_13,"[Helmond, Eindhoven, s-Hertogenbosch, Oss, Nijmegen, Arnhem Centraal, Dieren, Arnhem Centraal, Ede-Wageningen, Utrecht Centraal, Hilversum, Amsterdam Amstel]"
train_14,"[Nijmegen, Arnhem Centraal, Nijmegen, Oss, s-Hertogenbosch, Oss, Nijmegen, Oss, s-Hertogenbosch, Oss, Nijmegen, Oss, s-Hertogenbosch, Tilburg]"
train_15,"[Alphen a/d Rijn, Gouda, Den Haag Laan v NOI, Gouda, Den Haag HS, Leiden Centraal, Den Haag Centraal, Delft, Den Haag Centraal, Leiden Centraal, Den Haag Laan v NOI]"
train_16,"[Tilburg, s-Hertogenbosch, Tilburg, Eindhoven, Weert, Roermond, Weert, Roermond, Sittard, Heerlen, Sittard, Maastricht]"
train_17,"[Etten-Leur, Breda, Etten-Leur, Breda, Etten-Leur, Roosendaal, Vlissingen, Roosendaal, Etten-Leur]"
train_18,"[Dordrecht, Roosendaal, Dordrecht, Breda, Dordrecht, Rotterdam Centraal, Dordrecht, Rotterdam Centraal, Rotterdam Alexander, Rotterdam Blaak, Dordrecht, Rotterdam Blaak]"
train_19,"[Amsterdam Centraal, Amsterdam Amstel, Almere Centrum, Amsterdam Centraal, Utrecht Centraal, Ede-Wageningen, Arnhem Centraal, Dieren, Zutphen, Deventer, Zutphen, Deventer]"
train_20,"[Alphen a/d Rijn, Gouda, Den Haag HS, Leiden Centraal, Den Haag Laan v NOI, Leiden Centraal, Heemstede-Aerdenhout, Haarlem, Amsterdam Sloterdijk, Haarlem, Beverwijk, Castricum, Beverwijk, Castricum, Zaandam]"
score,3020.9662921348317
