train,stations
train_1,"[Hilversum, Almere Centrum, Lelystad Centrum, Almere Centrum, Amsterdam Centraal, Utrecht Centraal, Amersfoort, Utrecht Centraal, Hilversum, Amsterdam Amstel]"
train_2,"[Schiedam Centrum, Delft, Den Haag Laan v NOI, Leiden Centraal, Alphen a/d Rijn, Leiden Centraal, Alphen a/d Rijn, Leiden Centraal, Heemstede-Aerdenhout, Leiden Centraal, Alphen a/d Rijn, Leiden Centraal, Den Haag HS, Leiden Centraal, Den Haag Laan v NOI]"
train_3,"[Amsterdam Amstel, Almere Centrum, Amsterdam Amstel, Amsterdam Centraal, Utrecht Centraal, Schiphol Airport, Utrecht Centraal, Gouda]"
train_4,"[Venlo, Helmond, Eindhoven, Weert, Roermond, Sittard, Heerlen, Sittard, Maastricht, Sittard, Roermond, Weert]"
train_5,"[Den Haag HS, Delft, Den Haag Centraal, Gouda, Den Haag Laan v NOI, Delft, Den Haag Laan v NOI, Leiden Centraal, Den Haag Laan v NOI, Leiden Centraal, Den Haag Laan v NOI, Gouda, Den Haag HS]"
train_6,"[Assen, Groningen, Leeuwarden, Groningen, Assen, Groningen, Leeuwarden]"
train_7,"[Apeldoorn, Zutphen, Deventer, Almelo, Zwolle, Steenwijk, Zwolle]"
train_8,"[s-Hertogenbosch, Tilburg, Breda, Etten-Leur, Breda, Dordrecht, Roosendaal, Vlissingen]"
train_9,"[Leiden Centraal, Den Haag Centraal, Delft, Den Haag Laan v NOI, Gouda, Den Haag HS, Leiden Centraal, Alphen a/d Rijn, Utrecht Centraal, Amsterdam Amstel]"
train_10,"[Zutphen, Dieren, Zutphen, Dieren, Zutphen, Dieren, Zutphen, Deventer, Almelo, Hengelo, Enschede, Hengelo, Almelo, Deventer, Almelo]"
train_11,"[Etten-Leur, Breda, Etten-Leur, Roosendaal, Dordrecht, Breda, Etten-Leur, Roosendaal, Vlissingen]"
train_12,"[Leeuwarden, Heerenveen, Steenwijk, Zwolle, Almelo, Hengelo, Enschede, Hengelo, Almelo, Zwolle]"
train_13,"[Arnhem Centraal, Dieren, Arnhem Centraal, Ede-Wageningen, Arnhem Centraal, Nijmegen, Oss, s-Hertogenbosch, Oss, s-Hertogenbosch, Utrecht Centraal, Gouda, Utrecht Centraal]"
train_14,"[Eindhoven, Tilburg, Eindhoven, s-Hertogenbosch, Tilburg, Breda, Etten-Leur, Roosendaal, Etten-Leur, Roosendaal, Dordrecht, Roosendaal]"
train_15,"[Amsterdam Sloterdijk, Haarlem, Beverwijk, Zaandam, Hoorn, Zaandam, Hoorn, Zaandam]"
train_16,"[Maastricht, Sittard, Heerlen, Sittard, Maastricht, Sittard, Heerlen, Sittard, Roermond, Weert, Roermond, Sittard, Roermond]"
train_17,"[Roosendaal, Vlissingen, Roosendaal, Dordrecht, Rotterdam Centraal]"
train_18,"[Enschede, Hengelo, Enschede, Hengelo, Almelo, Deventer, Zutphen, Deventer, Almelo, Deventer, Zwolle]"
train_19,"[Zaandam, Hoorn, Alkmaar, Castricum, Beverwijk, Haarlem, Amsterdam Sloterdijk, Amsterdam Centraal, Utrecht Centraal, Amersfoort]"
train_20,"[Eindhoven, Weert, Roermond, Weert, Roermond, Sittard, Maastricht, Sittard, Heerlen, Sittard, Maastricht, Sittard, Roermond]"
score,2481.8089887640454
