train,stations
train_1,"[Gouda, Rotterdam Alexander, Gouda, Utrecht Centraal, Amsterdam Amstel, Almere Centrum, Hilversum, Amsterdam Amstel, Amsterdam Zuid, Schiphol Airport, Leiden Centraal]"
train_2,"[Nijmegen, Arnhem Centraal, Dieren, Zutphen, Dieren, Arnhem Centraal, Ede-Wageningen, Arnhem Centraal, Nijmegen, Oss, Nijmegen, Arnhem Centraal, Nijmegen, Oss, Nijmegen]"
train_3,"[Roosendaal, Etten-Leur, Roosendaal, Vlissingen, Roosendaal]"
train_4,"[Zutphen, Apeldoorn, Amersfoort, Zwolle, Assen, Groningen, Leeuwarden]"
train_5,"[Leeuwarden, Groningen, Leeuwarden, Groningen, Assen, Zwolle]"
train_6,"[Eindhoven, Helmond, Eindhoven, Helmond, Venlo, Helmond, Eindhoven, Helmond, Eindhoven, Weert, Roermond, Sittard, Maastricht]"
train_7,"[Groningen, Leeuwarden, Groningen, Assen, Groningen, Leeuwarden, Heerenveen, Steenwijk]"
train_8,"[Zaandam, Hoorn, Alkmaar, Den Helder, Alkmaar, Den Helder]"
train_9,"[Oss, s-Hertogenbosch, Eindhoven, Helmond, Eindhoven, Helmond, Venlo, Helmond, Eindhoven, Helmond, Venlo]"
train_10,"[Dordrecht, Breda, Etten-Leur, Roosendaal, Etten-Leur, Roosendaal, Dordrecht, Breda, Tilburg, s-Hertogenbosch, Tilburg, Eindhoven]"
train_11,"[Den Haag HS, Gouda, Rotterdam Alexander, Rotterdam Centraal, Dordrecht, Rotterdam Centraal, Dordrecht, Roosendaal, Etten-Leur, Breda, Dordrecht, Rotterdam Centraal]"
train_12,"[Leiden Centraal, Heemstede-Aerdenhout, Leiden Centraal, Den Haag Centraal, Leiden Centraal, Schiphol Airport, Leiden Centraal, Den Haag Laan v NOI, Gouda, Den Haag Centraal, Delft, Schiedam Centrum, Rotterdam Centraal, Schiedam Centrum, Rotterdam Blaak]"
train_13,"[Heemstede-Aerdenhout, Leiden Centraal, Alphen a/d Rijn, Utrecht Centraal, Amsterdam Amstel, Hilversum, Amsterdam Amstel, Amsterdam Zuid, Amsterdam Amstel, Hilversum]"
train_14,"[Almere Centrum, Amsterdam Amstel, Amsterdam Centraal, Amsterdam Amstel, Hilversum, Almere Centrum, Amsterdam Centraal, Almere Centrum, Lelystad Centrum, Almere Centrum]"
train_15,"[Almelo, Hengelo, Enschede, Hengelo, Enschede, Hengelo, Enschede, Hengelo, Almelo, Deventer, Apeldoorn, Deventer, Zutphen, Dieren, Zutphen, Apeldoorn, Amersfoort]"
train_16,"[Heemstede-Aerdenhout, Haarlem, Amsterdam Sloterdijk, Amsterdam Zuid, Amsterdam Sloterdijk, Amsterdam Centraal, Almere Centrum, Hilversum, Amsterdam Amstel, Hilversum]"
train_17,"[Amsterdam Sloterdijk, Haarlem, Heemstede-Aerdenhout, Leiden Centraal, Den Haag HS, Leiden Centraal, Heemstede-Aerdenhout, Haarlem, Beverwijk, Haarlem, Heemstede-Aerdenhout, Leiden Centraal, Alphen a/d Rijn, Gouda, Alphen a/d Rijn]"
train_18,"[Zutphen, Apeldoorn, Amersfoort, Apeldoorn, Amersfoort, Utrecht Centraal, s-Hertogenbosch, Eindhoven, Helmond]"
train_19,"[Vlissingen, Roosendaal, Vlissingen]"
train_20,"[Apeldoorn, Amersfoort, Utrecht Centraal, Schiphol Airport, Utrecht Centraal, Amsterdam Amstel, Utrecht Centraal, s-Hertogenbosch]"
score,2891.2471910112363
