train,stations
train_1,"[Leiden Centraal, Heemstede-Aerdenhout, Haarlem, Heemstede-Aerdenhout, Leiden Centraal, Den Haag HS, Delft, Den Haag HS, Gouda, Rotterdam Alexander, Rotterdam Centraal, Rotterdam Alexander, Rotterdam Blaak, Rotterdam Alexander, Gouda, Utrecht Centraal, Amsterdam Amstel]"
train_2,"[Alphen a/d Rijn, Leiden Centraal, Den Haag Centraal, Gouda, Rotterdam Alexander, Rotterdam Blaak, Rotterdam Alexander, Rotterdam Centraal, Dordrecht, Rotterdam Centraal, Rotterdam Alexander, Rotterdam Blaak, Dordrecht, Breda, Etten-Leur, Breda]"
train_3,"[Dieren, Arnhem Centraal, Dieren, Arnhem Centraal, Ede-Wageningen, Arnhem Centraal, Ede-Wageningen, Utrecht Centraal, Ede-Wageningen, Utrecht Centraal, Amsterdam Centraal, Amsterdam Amstel]"
train_4,"[Dordrecht, Rotterdam Centraal, Schiedam Centrum, Rotterdam Blaak, Rotterdam Alexander, Rotterdam Blaak, Rotterdam Alexander, Gouda, Utrecht Centraal, Amersfoort, Zwolle, Assen]"
train_5,"[Apeldoorn, Amersfoort, Zwolle, Amersfoort, Apeldoorn, Deventer, Almelo]"
train_6,"[Steenwijk, Zwolle, Amersfoort, Utrecht Centraal, Amersfoort, Zwolle, Almelo, Hengelo]"
train_7,"[Castricum, Zaandam, Castricum, Zaandam, Beverwijk, Castricum, Zaandam, Amsterdam Sloterdijk, Amsterdam Zuid, Schiphol Airport, Amsterdam Zuid, Schiphol Airport, Amsterdam Zuid, Schiphol Airport, Utrecht Centraal]"
train_8,"[Deventer, Zwolle, Almelo, Hengelo, Almelo, Zwolle, Almelo]"
train_9,"[Etten-Leur, Roosendaal, Etten-Leur, Breda, Etten-Leur, Roosendaal, Dordrecht, Rotterdam Centraal, Dordrecht, Roosendaal, Etten-Leur, Roosendaal, Etten-Leur, Roosendaal]"
train_10,"[Amsterdam Amstel, Almere Centrum, Lelystad Centrum, Almere Centrum, Amsterdam Amstel, Amsterdam Centraal, Almere Centrum, Lelystad Centrum, Almere Centrum, Amsterdam Amstel]"
train_11,"[Heerlen, Sittard, Roermond, Sittard, Heerlen, Sittard, Heerlen, Sittard, Roermond, Sittard, Maastricht, Sittard]"
train_12,"[Weert, Roermond, Weert, Roermond, Sittard, Maastricht, Sittard, Maastricht, Sittard, Maastricht, Sittard, Roermond, Weert]"
train_13,"[Dordrecht, Breda, Dordrecht, Rotterdam Blaak, Dordrecht, Roosendaal, Dordrecht, Rotterdam Blaak, Schiedam Centrum, Rotterdam Centraal, Rotterdam Alexander, Rotterdam Blaak, Schiedam Centrum, Rotterdam Blaak]"
train_14,"[Rotterdam Blaak, Schiedam Centrum, Rotterdam Centraal, Rotterdam Alexander, Rotterdam Blaak, Rotterdam Alexander, Rotterdam Blaak, Rotterdam Alexander, Rotterdam Blaak, Schiedam Centrum, Rotterdam Blaak, Rotterdam Alexander, Gouda, Den Haag Centraal, Delft, Den Haag Centraal, Gouda]"
train_15,"[Zwolle, Assen, Zwolle, Deventer, Zutphen, Dieren, Zutphen, Deventer, Apeldoorn, Zutphen]"
train_16,"[Breda, Tilburg, Eindhoven, Tilburg, Breda, Tilburg, s-Hertogenbosch, Eindhoven, Helmond, Eindhoven, s-Hertogenbosch, Utrecht Centraal]"
train_17,"[Rotterdam Centraal, Rotterdam Alexander, Rotterdam Centraal, Dordrecht, Breda, Etten-Leur, Roosendaal, Etten-Leur, Breda, Etten-Leur, Breda, Tilburg, Breda, Tilburg, Eindhoven, s-Hertogenbosch]"
train_18,"[Vlissingen, Roosendaal, Dordrecht, Roosendaal, Dordrecht, Rotterdam Blaak, Schiedam Centrum, Rotterdam Centraal, Schiedam Centrum, Rotterdam Blaak]"
train_19,"[Leeuwarden, Heerenveen, Leeuwarden, Heerenveen, Steenwijk, Heerenveen, Leeuwarden, Groningen, Leeuwarden, Heerenveen]"
train_20,"[Haarlem, Heemstede-Aerdenhout, Haarlem, Amsterdam Sloterdijk, Amsterdam Centraal, Amsterdam Sloterdijk, Haarlem, Amsterdam Sloterdijk, Amsterdam Centraal, Amsterdam Amstel, Hilversum, Amsterdam Amstel, Amsterdam Zuid, Amsterdam Sloterdijk, Haarlem]"
score,2267.8089887640454
