train,stations
train_1,"[Venlo, Helmond, Eindhoven, s-Hertogenbosch, Tilburg, s-Hertogenbosch, Eindhoven, s-Hertogenbosch, Eindhoven, Weert, Roermond]"
train_2,"[Oss, s-Hertogenbosch, Utrecht Centraal, s-Hertogenbosch, Utrecht Centraal, Amsterdam Amstel, Amsterdam Centraal, Amsterdam Sloterdijk, Zaandam, Castricum, Alkmaar, Castricum, Alkmaar]"
train_3,"[Oss, s-Hertogenbosch, Eindhoven, Tilburg, Breda, Tilburg, Eindhoven, Helmond, Eindhoven, Weert, Eindhoven, s-Hertogenbosch]"
train_4,"[Lelystad Centrum, Almere Centrum, Hilversum, Utrecht Centraal, Amsterdam Amstel, Amsterdam Centraal, Amsterdam Amstel, Amsterdam Zuid, Amsterdam Amstel, Amsterdam Zuid, Amsterdam Amstel, Amsterdam Centraal, Utrecht Centraal]"
train_5,"[Oss, s-Hertogenbosch, Utrecht Centraal, Schiphol Airport, Utrecht Centraal, Alphen a/d Rijn, Leiden Centraal, Schiphol Airport, Leiden Centraal]"
train_6,"[Almere Centrum, Lelystad Centrum, Almere Centrum, Hilversum, Utrecht Centraal, s-Hertogenbosch, Utrecht Centraal, s-Hertogenbosch, Tilburg]"
train_7,"[Steenwijk, Zwolle, Amersfoort, Utrecht Centraal, s-Hertogenbosch, Utrecht Centraal, Schiphol Airport, Leiden Centraal]"
train_8,"[Roosendaal, Vlissingen, Roosendaal]"
train_9,"[Haarlem, Heemstede-Aerdenhout, Haarlem, Amsterdam Sloterdijk, Amsterdam Centraal, Amsterdam Sloterdijk, Haarlem, Heemstede-Aerdenhout, Leiden Centraal, Den Haag HS, Gouda, Den Haag Centraal, Leiden Centraal, Alphen a/d Rijn, Gouda, Rotterdam Alexander, Rotterdam Centraal]"
train_10,"[Groningen, Leeuwarden, Groningen, Assen, Zwolle, Deventer, Apeldoorn]"
train_11,"[Zaandam, Beverwijk, Haarlem, Heemstede-Aerdenhout, Leiden Centraal, Den Haag Laan v NOI, Delft, Den Haag HS, Leiden Centraal, Den Haag Centraal, Gouda, Rotterdam Alexander, Gouda, Rotterdam Alexander, Rotterdam Blaak]"
train_12,"[Den Helder, Alkmaar, Castricum, Beverwijk, Castricum, Alkmaar, Den Helder, Alkmaar, Castricum, Alkmaar]"
train_13,"[Den Haag Centraal, Leiden Centraal, Heemstede-Aerdenhout, Haarlem, Beverwijk, Haarlem, Beverwijk, Castricum, Zaandam, Castricum, Beverwijk, Zaandam]"
train_14,"[Apeldoorn, Deventer, Apeldoorn, Zutphen, Dieren, Arnhem Centraal, Dieren, Arnhem Centraal, Nijmegen, Oss, Nijmegen, Arnhem Centraal, Ede-Wageningen, Arnhem Centraal, Ede-Wageningen]"
train_15,"[Enschede, Hengelo, Almelo, Hengelo, Enschede, Hengelo, Enschede, Hengelo, Enschede, Hengelo, Almelo, Hengelo, Enschede, Hengelo, Almelo, Deventer, Apeldoorn, Deventer]"
train_16,"[Hengelo, Almelo, Hengelo, Enschede, Hengelo, Almelo, Hengelo, Enschede, Hengelo, Almelo, Hengelo, Almelo, Hengelo, Enschede, Hengelo, Enschede, Hengelo, Almelo]"
train_17,"[Den Haag Laan v NOI, Delft, Den Haag HS, Leiden Centraal, Heemstede-Aerdenhout, Haarlem, Heemstede-Aerdenhout, Haarlem, Amsterdam Sloterdijk, Haarlem, Beverwijk, Castricum, Alkmaar, Den Helder]"
train_18,"[Tilburg, s-Hertogenbosch, Tilburg, Breda, Etten-Leur, Roosendaal, Etten-Leur, Roosendaal, Vlissingen]"
train_19,"[Enschede, Hengelo, Almelo, Hengelo, Enschede, Hengelo, Enschede, Hengelo, Enschede, Hengelo, Almelo, Deventer, Zwolle, Deventer, Apeldoorn]"
train_20,"[Vlissingen, Roosendaal, Vlissingen]"
score,1925.0112359550558
