train,stations
train_1,"[Den Haag Laan v NOI, Delft, Schiedam Centrum, Rotterdam Centraal, Dordrecht, Roosendaal, Dordrecht, Breda, Etten-Leur, Breda, Dordrecht, Rotterdam Centraal, Rotterdam Alexander, Rotterdam Blaak]"
train_2,"[Enschede, Hengelo, Almelo, Deventer, Apeldoorn, Deventer, Zwolle, Almelo, Zwolle]"
train_3,"[Amsterdam Sloterdijk, Zaandam, Amsterdam Sloterdijk, Amsterdam Zuid, Schiphol Airport, Utrecht Centraal, Alphen a/d Rijn, Gouda, Den Haag Centraal, Leiden Centraal, Den Haag Centraal, Delft, Schiedam Centrum]"
train_4,"[Delft, Den Haag Laan v NOI, Gouda, Rotterdam Alexander, Rotterdam Blaak, Dordrecht, Roosendaal, Etten-Leur, Breda, Etten-Leur, Breda, Tilburg, s-Hertogenbosch, Tilburg]"
train_5,"[Den Haag HS, Leiden Centraal, Schiphol Airport, Amsterdam Zuid, Amsterdam Sloterdijk, Amsterdam Centraal, Almere Centrum, Amsterdam Centraal, Almere Centrum, Amsterdam Centraal, Almere Centrum, Lelystad Centrum]"
train_6,"[Amsterdam Zuid, Amsterdam Sloterdijk, Amsterdam Centraal, Almere Centrum, Amsterdam Centraal, Amsterdam Amstel, Hilversum, Utrecht Centraal, Amsterdam Centraal, Utrecht Centraal]"
train_7,"[Eindhoven, Weert, Roermond, Weert, Roermond, Sittard, Heerlen, Sittard, Maastricht, Sittard, Heerlen, Sittard, Roermond]"
train_8,"[Apeldoorn, Zutphen, Deventer, Zwolle, Almelo, Zwolle, Steenwijk, Heerenveen]"
train_9,"[Helmond, Eindhoven, s-Hertogenbosch, Eindhoven, Helmond, Venlo, Helmond, Venlo, Helmond]"
train_10,"[Nijmegen, Oss, s-Hertogenbosch, Tilburg, s-Hertogenbosch, Utrecht Centraal, Hilversum, Utrecht Centraal, Alphen a/d Rijn, Gouda, Utrecht Centraal]"
train_11,"[Hoorn, Alkmaar, Castricum, Zaandam, Hoorn, Alkmaar, Den Helder, Alkmaar]"
train_12,"[Arnhem Centraal, Ede-Wageningen, Arnhem Centraal, Ede-Wageningen, Utrecht Centraal, Amsterdam Amstel, Hilversum, Almere Centrum, Amsterdam Amstel, Amsterdam Centraal, Amsterdam Sloterdijk, Zaandam]"
train_13,"[Deventer, Zwolle, Steenwijk, Zwolle, Amersfoort, Apeldoorn, Deventer, Almelo]"
train_14,"[Den Haag Centraal, Delft, Den Haag Laan v NOI, Delft, Den Haag Centraal, Leiden Centraal, Den Haag HS, Gouda, Alphen a/d Rijn, Gouda, Den Haag Laan v NOI, Delft]"
train_15,"[Beverwijk, Castricum, Beverwijk, Haarlem, Amsterdam Sloterdijk, Haarlem, Heemstede-Aerdenhout, Leiden Centraal, Den Haag HS, Gouda, Rotterdam Alexander, Gouda, Den Haag Centraal, Gouda]"
train_16,"[Nijmegen, Oss, s-Hertogenbosch, Oss, Nijmegen, Oss, s-Hertogenbosch, Tilburg, Eindhoven, s-Hertogenbosch, Eindhoven, Tilburg]"
train_17,"[Enschede, Hengelo, Almelo, Deventer, Zutphen, Dieren, Zutphen, Deventer, Almelo, Zwolle]"
train_18,"[Assen, Zwolle, Assen, Groningen, Leeuwarden, Heerenveen, Leeuwarden]"
train_19,"[Nijmegen, Oss, s-Hertogenbosch, Oss, s-Hertogenbosch, Utrecht Centraal, Amsterdam Centraal, Almere Centrum, Lelystad Centrum, Almere Centrum, Amsterdam Centraal]"
train_20,"[Ede-Wageningen, Utrecht Centraal, Alphen a/d Rijn, Leiden Centraal, Den Haag Centraal, Leiden Centraal, Den Haag Laan v NOI, Leiden Centraal, Schiphol Airport, Amsterdam Zuid, Schiphol Airport, Leiden Centraal, Schiphol Airport]"
score,3655.123595505618
