train,stations
train_1,"[Utrecht Centraal, Schiphol Airport, Amsterdam Zuid, Schiphol Airport, Utrecht Centraal, Ede-Wageningen, Arnhem Centraal, Dieren, Zutphen, Dieren, Arnhem Centraal, Nijmegen, Arnhem Centraal]"
train_2,"[Nijmegen, Oss, Nijmegen, Oss, s-Hertogenbosch, Utrecht Centraal, Amsterdam Centraal, Utrecht Centraal, Hilversum, Utrecht Centraal]"
train_3,"[Breda, Dordrecht, Breda, Etten-Leur, Roosendaal, Etten-Leur, Breda, Dordrecht, Rotterdam Blaak, Schiedam Centrum, Delft, Den Haag Centraal, Gouda, Alphen a/d Rijn]"
train_4,"[Enschede, Hengelo, Almelo, Deventer, Zwolle, Steenwijk, Zwolle, Assen, Groningen]"
train_5,"[Venlo, Helmond, Eindhoven, Weert, Roermond, Weert, Roermond, Weert, Roermond, Weert, Roermond, Sittard]"
train_6,"[Delft, Den Haag Centraal, Delft, Schiedam Centrum, Rotterdam Centraal, Rotterdam Alexander, Gouda, Den Haag Laan v NOI, Delft, Den Haag Centraal, Gouda, Alphen a/d Rijn, Leiden Centraal, Den Haag Laan v NOI]"
train_7,"[Zaandam, Beverwijk, Castricum, Alkmaar, Hoorn, Zaandam, Beverwijk, Haarlem, Amsterdam Sloterdijk, Zaandam, Castricum, Zaandam]"
train_8,"[Beverwijk, Castricum, Beverwijk, Zaandam, Amsterdam Sloterdijk, Zaandam, Hoorn, Zaandam, Amsterdam Sloterdijk, Zaandam, Hoorn, Alkmaar]"
train_9,"[Amsterdam Centraal, Amsterdam Amstel, Amsterdam Zuid, Schiphol Airport, Leiden Centraal, Heemstede-Aerdenhout, Haarlem, Amsterdam Sloterdijk, Zaandam, Amsterdam Sloterdijk, Amsterdam Centraal, Almere Centrum, Amsterdam Centraal, Amsterdam Amstel, Amsterdam Centraal, Almere Centrum]"
train_10,"[Weert, Roermond, Weert, Roermond, Sittard, Maastricht, Sittard, Heerlen, Sittard, Maastricht, Sittard, Roermond, Weert]"
train_11,"[Leeuwarden, Groningen, Assen, Groningen, Assen, Groningen, Leeuwarden, Groningen]"
train_12,"[Rotterdam Centraal, Dordrecht, Rotterdam Blaak, Dordrecht, Rotterdam Centraal, Dordrecht, Breda, Tilburg, Eindhoven, Tilburg, Eindhoven]"
train_13,"[Dordrecht, Breda, Dordrecht, Rotterdam Centraal, Dordrecht, Rotterdam Blaak, Dordrecht, Breda, Dordrecht, Breda, Tilburg, Breda]"
train_14,"[Amersfoort, Utrecht Centraal, Ede-Wageningen, Arnhem Centraal, Ede-Wageningen, Utrecht Centraal, s-Hertogenbosch, Utrecht Centraal, s-Hertogenbosch, Tilburg]"
train_15,"[Apeldoorn, Deventer, Zutphen, Dieren, Arnhem Centraal, Nijmegen, Oss, Nijmegen, Oss, s-Hertogenbosch, Tilburg, Eindhoven, Tilburg]"
train_16,"[Oss, s-Hertogenbosch, Tilburg, s-Hertogenbosch, Utrecht Centraal, Gouda, Utrecht Centraal, Gouda, Alphen a/d Rijn, Leiden Centraal, Den Haag Centraal, Leiden Centraal]"
train_17,"[Etten-Leur, Breda, Dordrecht, Roosendaal, Etten-Leur, Breda, Tilburg, Eindhoven, s-Hertogenbosch, Oss, Nijmegen, Arnhem Centraal, Dieren]"
train_18,"[Hilversum, Amsterdam Amstel, Amsterdam Centraal, Amsterdam Amstel, Hilversum, Almere Centrum, Hilversum, Almere Centrum, Lelystad Centrum, Almere Centrum]"
train_19,"[Leiden Centraal, Den Haag Centraal, Delft, Den Haag HS, Leiden Centraal, Heemstede-Aerdenhout, Leiden Centraal, Alphen a/d Rijn, Gouda, Utrecht Centraal, Alphen a/d Rijn, Leiden Centraal, Den Haag Centraal]"
train_20,"[Zutphen, Dieren, Zutphen, Dieren, Zutphen, Deventer, Zwolle, Amersfoort, Zwolle, Assen]"
score,3167.685393258427
