train,stations
train_1,"[Helmond, Eindhoven, Tilburg, Eindhoven, Weert, Eindhoven, Helmond, Venlo, Helmond, Eindhoven]"
train_2,"[Almere Centrum, Amsterdam Centraal, Amsterdam Amstel, Amsterdam Centraal, Almere Centrum, Hilversum, Almere Centrum, Hilversum, Almere Centrum]"
train_3,"[Etten-Leur, Roosendaal, Dordrecht, Rotterdam Blaak, Dordrecht, Breda, Etten-Leur, Breda, Dordrecht, Roosendaal]"
train_4,"[Den Haag Centraal, Leiden Centraal, Den Haag HS, Delft, Den Haag Laan v NOI, Delft, Schiedam Centrum, Delft, Den Haag HS, Leiden Centraal, Heemstede-Aerdenhout, Haarlem, Amsterdam Sloterdijk, Haarlem, Amsterdam Sloterdijk, Amsterdam Centraal, Almere Centrum]"
train_5,"[Assen, Zwolle, Deventer, Zwolle, Deventer, Zutphen, Deventer, Apeldoorn, Amersfoort]"
train_6,"[Rotterdam Blaak, Schiedam Centrum, Rotterdam Centraal, Dordrecht, Roosendaal, Dordrecht, Rotterdam Blaak, Rotterdam Alexander, Gouda, Utrecht Centraal, Amersfoort, Utrecht Centraal, Amsterdam Amstel]"
train_7,"[Amsterdam Sloterdijk, Amsterdam Centraal, Utrecht Centraal, Amersfoort, Utrecht Centraal, Amersfoort, Zwolle, Deventer, Almelo]"
train_8,"[Zwolle, Deventer, Apeldoorn, Zutphen, Apeldoorn, Zutphen, Dieren, Arnhem Centraal, Dieren, Zutphen, Apeldoorn, Deventer]"
train_9,"[Alkmaar, Den Helder, Alkmaar, Den Helder, Alkmaar]"
train_10,"[Hoorn, Zaandam, Hoorn, Alkmaar, Castricum, Zaandam, Castricum, Beverwijk, Castricum, Zaandam, Castricum, Alkmaar]"
train_11,"[Heerenveen, Steenwijk, Heerenveen, Steenwijk, Zwolle, Assen, Zwolle]"
train_12,"[Dordrecht, Breda, Dordrecht, Roosendaal, Vlissingen]"
train_13,"[Eindhoven, Helmond, Venlo, Helmond, Venlo, Helmond, Venlo]"
train_14,"[Dordrecht, Rotterdam Centraal, Rotterdam Alexander, Gouda, Rotterdam Alexander, Rotterdam Blaak, Schiedam Centrum, Rotterdam Centraal, Dordrecht, Breda, Etten-Leur, Roosendaal]"
train_15,"[Roermond, Sittard, Heerlen, Sittard, Maastricht, Sittard, Heerlen, Sittard, Heerlen, Sittard, Heerlen, Sittard]"
train_16,"[Amsterdam Centraal, Amsterdam Amstel, Hilversum, Utrecht Centraal, Amsterdam Amstel, Hilversum, Amsterdam Amstel, Almere Centrum, Amsterdam Centraal]"
train_17,"[Amsterdam Zuid, Amsterdam Amstel, Amsterdam Zuid, Amsterdam Sloterdijk, Amsterdam Centraal, Amsterdam Amstel, Amsterdam Zuid, Amsterdam Sloterdijk, Amsterdam Centraal, Utrecht Centraal, Amersfoort, Apeldoorn, Deventer]"
train_18,"[Alkmaar, Den Helder, Alkmaar, Castricum, Beverwijk, Zaandam, Hoorn, Zaandam, Amsterdam Sloterdijk]"
train_19,"[Rotterdam Blaak, Rotterdam Alexander, Rotterdam Centraal, Schiedam Centrum, Rotterdam Blaak, Schiedam Centrum, Delft, Den Haag HS, Leiden Centraal, Alphen a/d Rijn, Utrecht Centraal, Hilversum, Utrecht Centraal, Ede-Wageningen]"
train_20,"[Deventer, Almelo, Zwolle, Deventer, Zwolle, Steenwijk, Zwolle]"
score,1987.0112359550558
