train,stations
train_1,"[Sittard, Maastricht, Sittard, Maastricht, Sittard, Heerlen, Sittard, Heerlen, Sittard, Heerlen, Sittard, Heerlen]"
train_2,"[Enschede, Hengelo, Almelo, Zwolle, Deventer, Apeldoorn, Deventer, Zutphen, Dieren, Zutphen, Apeldoorn, Zutphen, Dieren]"
train_3,"[Breda, Etten-Leur, Roosendaal, Dordrecht, Roosendaal, Etten-Leur, Breda, Tilburg, Breda, Tilburg, Eindhoven, s-Hertogenbosch, Oss]"
train_4,"[Gouda, Rotterdam Alexander, Rotterdam Centraal, Rotterdam Alexander, Rotterdam Centraal, Dordrecht, Breda, Tilburg, Breda, Tilburg, Breda, Dordrecht, Rotterdam Centraal, Rotterdam Alexander, Rotterdam Blaak]"
train_5,"[Alkmaar, Castricum, Beverwijk, Castricum, Beverwijk, Castricum, Alkmaar, Hoorn, Alkmaar, Castricum, Beverwijk, Haarlem, Beverwijk]"
train_6,"[Amsterdam Amstel, Utrecht Centraal, Amsterdam Centraal, Utrecht Centraal, Hilversum, Amsterdam Amstel, Almere Centrum, Hilversum]"
train_7,"[Heerlen, Sittard, Roermond, Weert, Roermond, Weert, Roermond, Sittard, Heerlen, Sittard, Heerlen, Sittard, Heerlen]"
train_8,"[s-Hertogenbosch, Utrecht Centraal, Amsterdam Centraal, Almere Centrum, Lelystad Centrum, Almere Centrum, Amsterdam Amstel, Hilversum, Utrecht Centraal]"
train_9,"[Breda, Etten-Leur, Roosendaal, Etten-Leur, Breda, Tilburg, s-Hertogenbosch, Eindhoven, Weert, Roermond, Weert, Eindhoven, Weert, Roermond]"
train_10,"[Almelo, Zwolle, Deventer, Apeldoorn, Amersfoort, Zwolle, Amersfoort]"
train_11,"[Maastricht, Sittard, Maastricht, Sittard, Heerlen, Sittard, Heerlen, Sittard, Roermond, Weert, Roermond, Weert, Roermond]"
train_12,"[Nijmegen, Oss, Nijmegen, Arnhem Centraal, Ede-Wageningen, Utrecht Centraal, Amersfoort, Utrecht Centraal, Amsterdam Amstel, Hilversum]"
train_13,"[Roermond, Weert, Eindhoven, s-Hertogenbosch, Utrecht Centraal, Hilversum, Almere Centrum, Hilversum, Amsterdam Amstel]"
train_14,"[Venlo, Helmond, Eindhoven, Weert, Roermond, Sittard, Heerlen, Sittard, Roermond, Weert, Roermond, Sittard]"
train_15,"[Zwolle, Almelo, Zwolle, Amersfoort, Zwolle]"
train_16,"[Amsterdam Sloterdijk, Haarlem, Amsterdam Sloterdijk, Amsterdam Centraal, Almere Centrum, Hilversum, Almere Centrum, Amsterdam Centraal, Amsterdam Amstel, Hilversum]"
train_17,"[Heemstede-Aerdenhout, Haarlem, Beverwijk, Haarlem, Beverwijk, Castricum, Alkmaar, Castricum, Alkmaar, Castricum, Alkmaar, Hoorn, Alkmaar, Castricum]"
train_18,"[Schiphol Airport, Utrecht Centraal, Schiphol Airport, Utrecht Centraal, Amsterdam Centraal, Amsterdam Sloterdijk, Amsterdam Zuid, Amsterdam Sloterdijk, Amsterdam Centraal]"
train_19,"[Nijmegen, Arnhem Centraal, Ede-Wageningen, Utrecht Centraal, Amersfoort, Zwolle, Deventer, Apeldoorn, Amersfoort, Apeldoorn]"
train_20,"[Amsterdam Sloterdijk, Amsterdam Zuid, Amsterdam Sloterdijk, Amsterdam Centraal, Amsterdam Sloterdijk, Amsterdam Centraal, Almere Centrum, Amsterdam Amstel, Almere Centrum, Hilversum, Utrecht Centraal]"
score,668.4157303370794
