train,stations
train_1,"[Dieren, Arnhem Centraal, Ede-Wageningen, Arnhem Centraal, Ede-Wageningen, Arnhem Centraal, Nijmegen, Oss, s-Hertogenbosch, Oss, s-Hertogenbosch, Oss, Nijmegen, Arnhem Centraal, Nijmegen]"
train_2,"[Leiden Centraal, Alphen a/d Rijn, Leiden Centraal, Alphen a/d Rijn, Gouda, Rotterdam Alexander, Rotterdam Centraal, Rotterdam Alexander, Gouda, Rotterdam Alexander, Gouda, Rotterdam Alexander, Rotterdam Centraal, Rotterdam Alexander, Gouda]"
train_3,"[Amsterdam Sloterdijk, Amsterdam Zuid, Schiphol Airport, Leiden Centraal, Schiphol Airport, Utrecht Centraal, Schiphol Airport, Amsterdam Zuid, Schiphol Airport, Leiden Centraal, Alphen a/d Rijn]"
train_4,"[Den Helder, Alkmaar, Castricum, Beverwijk, Haarlem, Heemstede-Aerdenhout, Leiden Centraal, Heemstede-Aerdenhout, Haarlem, Heemstede-Aerdenhout, Leiden Centraal, Den Haag HS, Delft, Den Haag HS, Leiden Centraal]"
train_5,"[Dieren, Arnhem Centraal, Dieren, Arnhem Centraal, Dieren, Zutphen, Deventer, Almelo, Deventer, Almelo, Deventer]"
train_6,"[Den Helder, Alkmaar, Castricum, Alkmaar, Castricum, Zaandam, Amsterdam Sloterdijk, Zaandam, Hoorn, Zaandam, Amsterdam Sloterdijk, Amsterdam Zuid, Amsterdam Sloterdijk]"
train_7,"[Schiedam Centrum, Rotterdam Blaak, Dordrecht, Rotterdam Centraal, Schiedam Centrum, Rotterdam Blaak, Rotterdam Alexander, Rotterdam Blaak, Schiedam Centrum, Rotterdam Centraal, Rotterdam Alexander, Rotterdam Blaak, Dordrecht, Rotterdam Centraal, Rotterdam Alexander, Gouda, Den Haag HS]"
train_8,"[Rotterdam Centraal, Rotterdam Alexander, Rotterdam Centraal, Rotterdam Alexander, Rotterdam Centraal, Schiedam Centrum, Delft, Den Haag Centraal, Leiden Centraal, Den Haag Laan v NOI, Leiden Centraal, Heemstede-Aerdenhout, Haarlem, Heemstede-Aerdenhout, Haarlem, Heemstede-Aerdenhout, Haarlem, Heemstede-Aerdenhout, Leiden Centraal, Den Haag Centraal, Gouda]"
train_9,"[Deventer, Zutphen, Deventer, Zwolle, Amersfoort, Utrecht Centraal, Ede-Wageningen, Arnhem Centraal, Nijmegen, Oss, Nijmegen]"
train_10,"[Steenwijk, Zwolle, Almelo, Zwolle, Almelo]"
train_11,"[Amsterdam Amstel, Utrecht Centraal, Amsterdam Amstel, Almere Centrum, Lelystad Centrum, Almere Centrum, Hilversum, Amsterdam Amstel, Utrecht Centraal]"
train_12,"[Dieren, Zutphen, Dieren, Zutphen, Apeldoorn, Deventer, Apeldoorn, Deventer, Zwolle, Steenwijk, Zwolle]"
train_13,"[Amsterdam Sloterdijk, Zaandam, Hoorn, Zaandam, Amsterdam Sloterdijk, Zaandam, Beverwijk, Zaandam, Hoorn, Alkmaar]"
train_14,"[Castricum, Beverwijk, Haarlem, Amsterdam Sloterdijk, Amsterdam Zuid, Amsterdam Sloterdijk, Amsterdam Centraal, Amsterdam Sloterdijk, Amsterdam Centraal, Utrecht Centraal, Gouda, Den Haag HS, Leiden Centraal, Den Haag Laan v NOI]"
train_15,"[Hoorn, Alkmaar, Hoorn, Zaandam, Castricum, Alkmaar, Hoorn, Alkmaar, Castricum, Beverwijk]"
train_16,"[Maastricht, Sittard, Heerlen, Sittard, Roermond, Weert, Roermond, Sittard, Roermond, Weert, Eindhoven, Tilburg]"
train_17,"[Delft, Den Haag Laan v NOI, Gouda, Den Haag HS, Gouda, Den Haag HS, Delft, Den Haag Centraal, Gouda, Den Haag HS, Delft, Schiedam Centrum]"
train_18,"[Amsterdam Centraal, Amsterdam Sloterdijk, Haarlem, Heemstede-Aerdenhout, Leiden Centraal, Alphen a/d Rijn, Utrecht Centraal, Ede-Wageningen, Arnhem Centraal, Dieren, Zutphen, Apeldoorn, Deventer, Apeldoorn]"
train_19,"[Alphen a/d Rijn, Utrecht Centraal, Gouda, Alphen a/d Rijn, Leiden Centraal, Heemstede-Aerdenhout, Haarlem, Heemstede-Aerdenhout, Haarlem, Beverwijk, Castricum, Beverwijk, Castricum, Zaandam]"
train_20,"[Dieren, Zutphen, Dieren, Zutphen, Deventer, Zwolle, Amersfoort, Apeldoorn, Amersfoort, Utrecht Centraal, Gouda]"
score,2145.089887640449
