train,stations
train_1,"[Almelo, Hengelo, Almelo, Zwolle, Almelo, Zwolle]"
train_2,"[Beverwijk, Zaandam, Amsterdam Sloterdijk, Zaandam, Beverwijk, Zaandam, Amsterdam Sloterdijk, Amsterdam Zuid, Schiphol Airport, Leiden Centraal, Den Haag HS, Delft, Den Haag Centraal, Leiden Centraal]"
train_3,"[Venlo, Helmond, Venlo, Helmond, Eindhoven, Helmond, Eindhoven, Helmond, Venlo]"
train_4,"[s-Hertogenbosch, Tilburg, s-Hertogenbosch, Eindhoven, Weert, Eindhoven, Weert, Roermond, Sittard, Heerlen, Sittard, Heerlen]"
train_5,"[Almelo, Hengelo, Almelo, Hengelo, Enschede, Hengelo, Enschede, Hengelo, Almelo, Zwolle, Deventer, Zwolle]"
train_6,"[Assen, Zwolle, Assen, Zwolle, Steenwijk, Zwolle]"
train_7,"[Helmond, Eindhoven, Weert, Roermond, Weert, Roermond, Sittard, Heerlen, Sittard, Roermond, Sittard, Heerlen, Sittard]"
train_8,"[Zaandam, Amsterdam Sloterdijk, Amsterdam Zuid, Amsterdam Sloterdijk, Amsterdam Zuid, Schiphol Airport, Amsterdam Zuid, Schiphol Airport, Amsterdam Zuid, Amsterdam Amstel, Utrecht Centraal, Schiphol Airport, Leiden Centraal, Alphen a/d Rijn]"
train_9,"[Arnhem Centraal, Ede-Wageningen, Utrecht Centraal, Amsterdam Amstel, Amsterdam Centraal, Almere Centrum, Lelystad Centrum, Almere Centrum, Lelystad Centrum, Almere Centrum, Amsterdam Amstel]"
train_10,"[Assen, Groningen, Leeuwarden, Heerenveen, Steenwijk, Heerenveen, Steenwijk, Zwolle, Steenwijk, Heerenveen]"
train_11,"[Heerlen, Sittard, Heerlen, Sittard, Heerlen, Sittard, Maastricht, Sittard, Heerlen, Sittard, Roermond, Sittard]"
train_12,"[Leeuwarden, Heerenveen, Leeuwarden, Groningen, Leeuwarden, Groningen, Assen, Groningen]"
train_13,"[Den Haag HS, Delft, Den Haag Centraal, Leiden Centraal, Heemstede-Aerdenhout, Leiden Centraal, Den Haag Laan v NOI, Leiden Centraal, Den Haag Centraal, Leiden Centraal, Alphen a/d Rijn, Gouda, Den Haag HS, Gouda]"
train_14,"[Nijmegen, Oss, Nijmegen, Oss, Nijmegen, Oss, s-Hertogenbosch, Tilburg, s-Hertogenbosch, Utrecht Centraal, s-Hertogenbosch]"
train_15,"[Leiden Centraal, Heemstede-Aerdenhout, Leiden Centraal, Den Haag Centraal, Delft, Den Haag HS, Leiden Centraal, Heemstede-Aerdenhout, Haarlem, Heemstede-Aerdenhout, Haarlem, Amsterdam Sloterdijk, Amsterdam Centraal, Utrecht Centraal, Gouda]"
train_16,"[Hilversum, Amsterdam Amstel, Utrecht Centraal, Amersfoort, Utrecht Centraal, Amsterdam Centraal, Almere Centrum, Amsterdam Amstel, Amsterdam Zuid, Schiphol Airport]"
train_17,"[Den Haag Centraal, Leiden Centraal, Schiphol Airport, Utrecht Centraal, Ede-Wageningen, Arnhem Centraal, Nijmegen, Oss, Nijmegen, Oss, Nijmegen]"
train_18,"[Hengelo, Almelo, Hengelo, Enschede, Hengelo, Almelo, Zwolle, Amersfoort, Apeldoorn, Amersfoort]"
train_19,"[Ede-Wageningen, Arnhem Centraal, Nijmegen, Arnhem Centraal, Ede-Wageningen, Arnhem Centraal, Nijmegen, Oss, Nijmegen, Arnhem Centraal, Ede-Wageningen, Arnhem Centraal, Nijmegen, Arnhem Centraal, Nijmegen]"
train_20,"[Ede-Wageningen, Utrecht Centraal, Amsterdam Amstel, Utrecht Centraal, Amersfoort, Utrecht Centraal, Hilversum, Almere Centrum, Lelystad Centrum, Almere Centrum]"
score,1040.4943820224717
