train,stations
train_1,"[Zwolle, Steenwijk, Heerenveen, Steenwijk, Zwolle, Steenwijk, Zwolle, Steenwijk, Zwolle]"
train_2,"[Rotterdam Blaak, Schiedam Centrum, Delft, Den Haag Centraal, Delft, Den Haag HS, Gouda, Utrecht Centraal, Amersfoort, Apeldoorn, Deventer, Apeldoorn, Deventer]"
train_3,"[Assen, Zwolle, Almelo, Zwolle, Amersfoort]"
train_4,"[Amsterdam Centraal, Utrecht Centraal, Amersfoort, Apeldoorn, Deventer, Almelo, Deventer, Almelo]"
train_5,"[Assen, Zwolle, Deventer, Zwolle, Steenwijk, Zwolle, Steenwijk]"
train_6,"[Den Haag Centraal, Delft, Schiedam Centrum, Rotterdam Centraal, Rotterdam Alexander, Gouda, Den Haag Centraal, Delft, Den Haag HS, Leiden Centraal, Den Haag Laan v NOI, Leiden Centraal, Schiphol Airport, Utrecht Centraal]"
train_7,"[Castricum, Alkmaar, Den Helder, Alkmaar, Castricum, Alkmaar, Hoorn, Alkmaar]"
train_8,"[Amsterdam Amstel, Amsterdam Zuid, Schiphol Airport, Amsterdam Zuid, Amsterdam Sloterdijk, Amsterdam Centraal, Amsterdam Sloterdijk, Haarlem, Beverwijk, Haarlem, Heemstede-Aerdenhout, Haarlem, Amsterdam Sloterdijk, Haarlem, Beverwijk, Castricum, Alkmaar]"
train_9,"[Heerlen, Sittard, Roermond, Weert, Eindhoven, Tilburg, Eindhoven, Tilburg, s-Hertogenbosch, Utrecht Centraal]"
train_10,"[Enschede, Hengelo, Enschede, Hengelo, Enschede, Hengelo, Almelo, Zwolle, Amersfoort, Zwolle]"
train_11,"[Schiedam Centrum, Rotterdam Centraal, Schiedam Centrum, Delft, Schiedam Centrum, Rotterdam Centraal, Schiedam Centrum, Delft, Schiedam Centrum, Rotterdam Blaak, Dordrecht, Roosendaal, Etten-Leur, Breda, Etten-Leur, Roosendaal]"
train_12,"[Amsterdam Centraal, Utrecht Centraal, Gouda, Den Haag Centraal, Leiden Centraal, Alphen a/d Rijn, Leiden Centraal, Schiphol Airport, Leiden Centraal, Den Haag HS, Delft, Schiedam Centrum, Rotterdam Blaak]"
train_13,"[Roosendaal, Etten-Leur, Breda, Dordrecht, Roosendaal, Dordrecht, Rotterdam Blaak, Dordrecht, Roosendaal]"
train_14,"[Alkmaar, Castricum, Alkmaar, Den Helder, Alkmaar, Castricum, Beverwijk, Haarlem, Beverwijk, Haarlem, Beverwijk]"
train_15,"[Roermond, Weert, Eindhoven, Helmond, Venlo, Helmond, Venlo, Helmond]"
train_16,"[Leiden Centraal, Den Haag Laan v NOI, Gouda, Alphen a/d Rijn, Gouda, Alphen a/d Rijn, Leiden Centraal, Den Haag Centraal, Leiden Centraal, Den Haag Laan v NOI, Leiden Centraal, Schiphol Airport]"
train_17,"[Apeldoorn, Zutphen, Dieren, Arnhem Centraal, Nijmegen, Oss, Nijmegen, Oss, Nijmegen, Oss, Nijmegen, Arnhem Centraal, Ede-Wageningen]"
train_18,"[Zaandam, Beverwijk, Haarlem, Amsterdam Sloterdijk, Haarlem, Heemstede-Aerdenhout, Leiden Centraal, Den Haag HS, Leiden Centraal, Den Haag HS, Delft, Den Haag HS, Gouda, Den Haag HS]"
train_19,"[Hengelo, Enschede, Hengelo, Almelo, Deventer, Almelo, Hengelo, Almelo, Deventer, Almelo, Hengelo, Enschede, Hengelo, Almelo]"
train_20,"[Almere Centrum, Amsterdam Amstel, Hilversum, Amsterdam Amstel, Hilversum, Utrecht Centraal, Amersfoort, Zwolle]"
score,2401.4494382022467
