train,stations
train_1,"[Vlissingen, Roosendaal, Etten-Leur, Roosendaal, Etten-Leur, Roosendaal, Vlissingen]"
train_2,"[Etten-Leur, Breda, Dordrecht, Rotterdam Blaak, Schiedam Centrum, Rotterdam Centraal, Schiedam Centrum, Rotterdam Blaak, Dordrecht, Rotterdam Centraal, Rotterdam Alexander, Rotterdam Blaak, Dordrecht, Rotterdam Centraal, Rotterdam Alexander, Rotterdam Blaak, Schiedam Centrum]"
train_3,"[Zwolle, Deventer, Almelo, Deventer, Apeldoorn, Deventer, Zutphen, Apeldoorn, Amersfoort, Utrecht Centraal, Amersfoort]"
train_4,"[Roermond, Weert, Roermond, Sittard, Heerlen, Sittard, Roermond, Weert, Eindhoven, Helmond, Eindhoven, Helmond, Venlo]"
train_5,"[Den Helder, Alkmaar, Hoorn, Zaandam, Castricum, Alkmaar, Hoorn, Zaandam, Amsterdam Sloterdijk, Amsterdam Zuid]"
train_6,"[Den Helder, Alkmaar, Hoorn, Alkmaar, Hoorn, Alkmaar, Hoorn]"
train_7,"[Schiedam Centrum, Delft, Schiedam Centrum, Rotterdam Blaak, Schiedam Centrum, Delft, Den Haag HS, Leiden Centraal, Den Haag Laan v NOI, Leiden Centraal, Heemstede-Aerdenhout, Leiden Centraal, Alphen a/d Rijn, Gouda, Utrecht Centraal, Amsterdam Amstel]"
train_8,"[Rotterdam Centraal, Rotterdam Alexander, Rotterdam Blaak, Schiedam Centrum, Delft, Den Haag Centraal, Gouda, Den Haag Centraal, Gouda, Alphen a/d Rijn, Gouda, Den Haag Centraal, Leiden Centraal]"
train_9,"[Almere Centrum, Lelystad Centrum, Almere Centrum, Amsterdam Amstel, Almere Centrum, Amsterdam Amstel, Utrecht Centraal, Alphen a/d Rijn, Gouda]"
train_10,"[Rotterdam Alexander, Rotterdam Blaak, Rotterdam Alexander, Gouda, Rotterdam Alexander, Gouda, Rotterdam Alexander, Rotterdam Blaak, Dordrecht, Rotterdam Blaak, Schiedam Centrum, Rotterdam Centraal, Rotterdam Alexander, Rotterdam Centraal, Dordrecht, Roosendaal]"
train_11,"[Utrecht Centraal, Amsterdam Centraal, Almere Centrum, Hilversum, Utrecht Centraal, Schiphol Airport, Amsterdam Zuid, Amsterdam Sloterdijk, Amsterdam Centraal, Almere Centrum]"
train_12,"[Maastricht, Sittard, Roermond, Sittard, Roermond, Weert, Roermond, Weert, Eindhoven, Weert, Eindhoven, Helmond]"
train_13,"[Alkmaar, Castricum, Alkmaar, Castricum, Zaandam, Beverwijk, Haarlem, Amsterdam Sloterdijk, Zaandam, Amsterdam Sloterdijk, Zaandam, Beverwijk, Castricum, Zaandam]"
train_14,"[Amsterdam Centraal, Utrecht Centraal, s-Hertogenbosch, Tilburg, s-Hertogenbosch, Oss, Nijmegen, Arnhem Centraal, Dieren, Zutphen, Deventer, Zwolle]"
train_15,"[Zaandam, Amsterdam Sloterdijk, Amsterdam Zuid, Schiphol Airport, Utrecht Centraal, s-Hertogenbosch, Tilburg, Breda, Dordrecht, Roosendaal]"
train_16,"[Zwolle, Steenwijk, Heerenveen, Leeuwarden, Groningen, Assen, Zwolle, Deventer]"
train_17,"[Nijmegen, Arnhem Centraal, Nijmegen, Oss, Nijmegen, Arnhem Centraal, Dieren, Arnhem Centraal, Ede-Wageningen, Utrecht Centraal, Hilversum, Utrecht Centraal]"
train_18,"[Utrecht Centraal, Hilversum, Almere Centrum, Amsterdam Amstel, Utrecht Centraal, Hilversum, Almere Centrum, Amsterdam Amstel]"
train_19,"[Sittard, Roermond, Weert, Eindhoven, s-Hertogenbosch, Eindhoven, s-Hertogenbosch, Oss, Nijmegen, Arnhem Centraal, Dieren, Zutphen, Deventer]"
train_20,"[Nijmegen, Arnhem Centraal, Ede-Wageningen, Arnhem Centraal, Nijmegen, Arnhem Centraal, Ede-Wageningen, Utrecht Centraal, Gouda, Den Haag Centraal, Gouda, Den Haag Laan v NOI]"
score,3255.685393258427
