train,stations
train_1,"[Amsterdam Sloterdijk, Amsterdam Zuid, Amsterdam Amstel, Amsterdam Zuid, Amsterdam Sloterdijk, Zaandam, Amsterdam Sloterdijk, Amsterdam Centraal, Amsterdam Sloterdijk, Haarlem, Amsterdam Sloterdijk, Amsterdam Zuid, Amsterdam Amstel, Utrecht Centraal, Alphen a/d Rijn]"
train_2,"[Almere Centrum, Amsterdam Centraal, Amsterdam Amstel, Utrecht Centraal, Hilversum, Amsterdam Amstel, Hilversum, Almere Centrum, Amsterdam Amstel]"
train_3,"[Rotterdam Alexander, Rotterdam Blaak, Dordrecht, Rotterdam Blaak, Dordrecht, Roosendaal, Etten-Leur, Roosendaal, Dordrecht, Rotterdam Centraal, Dordrecht, Rotterdam Centraal, Schiedam Centrum]"
train_4,"[Arnhem Centraal, Ede-Wageningen, Utrecht Centraal, Gouda, Den Haag Centraal, Leiden Centraal, Schiphol Airport, Amsterdam Zuid, Amsterdam Amstel, Hilversum, Utrecht Centraal, Hilversum]"
train_5,"[Den Helder, Alkmaar, Hoorn, Zaandam, Amsterdam Sloterdijk, Zaandam, Beverwijk, Zaandam, Amsterdam Sloterdijk, Amsterdam Zuid]"
train_6,"[Amsterdam Sloterdijk, Zaandam, Castricum, Beverwijk, Haarlem, Beverwijk, Haarlem, Heemstede-Aerdenhout, Haarlem, Heemstede-Aerdenhout, Haarlem, Amsterdam Sloterdijk, Amsterdam Zuid, Schiphol Airport, Utrecht Centraal]"
train_7,"[Tilburg, Breda, Etten-Leur, Roosendaal, Etten-Leur, Breda, Tilburg, Breda, Tilburg, s-Hertogenbosch, Tilburg, s-Hertogenbosch, Oss, s-Hertogenbosch, Oss, s-Hertogenbosch]"
train_8,"[Weert, Eindhoven, Helmond, Venlo, Helmond, Venlo, Helmond, Eindhoven, Helmond]"
train_9,"[Beverwijk, Haarlem, Beverwijk, Zaandam, Castricum, Zaandam, Beverwijk, Zaandam, Castricum, Alkmaar, Castricum, Zaandam]"
train_10,"[Eindhoven, Weert, Eindhoven, Weert, Roermond, Weert, Eindhoven, Helmond, Venlo, Helmond, Eindhoven]"
train_11,"[Enschede, Hengelo, Enschede, Hengelo, Enschede, Hengelo, Enschede, Hengelo, Enschede, Hengelo, Almelo, Hengelo, Almelo, Deventer, Apeldoorn, Amersfoort, Utrecht Centraal]"
train_12,"[Haarlem, Amsterdam Sloterdijk, Amsterdam Zuid, Amsterdam Amstel, Amsterdam Centraal, Almere Centrum, Lelystad Centrum, Almere Centrum, Amsterdam Amstel, Amsterdam Centraal, Utrecht Centraal, Amsterdam Amstel]"
train_13,"[Nijmegen, Oss, Nijmegen, Oss, s-Hertogenbosch, Utrecht Centraal, Schiphol Airport, Leiden Centraal, Schiphol Airport, Leiden Centraal, Alphen a/d Rijn]"
train_14,"[s-Hertogenbosch, Tilburg, Breda, Etten-Leur, Roosendaal, Vlissingen, Roosendaal]"
train_15,"[Venlo, Helmond, Eindhoven, Helmond, Eindhoven, Tilburg, s-Hertogenbosch, Oss, s-Hertogenbosch, Eindhoven, Tilburg, s-Hertogenbosch]"
train_16,"[Alkmaar, Castricum, Beverwijk, Castricum, Zaandam, Castricum, Alkmaar, Hoorn, Zaandam, Hoorn, Alkmaar]"
train_17,"[Heemstede-Aerdenhout, Haarlem, Amsterdam Sloterdijk, Zaandam, Beverwijk, Haarlem, Amsterdam Sloterdijk, Amsterdam Zuid, Amsterdam Sloterdijk, Amsterdam Centraal, Almere Centrum, Lelystad Centrum, Almere Centrum]"
train_18,"[Almelo, Zwolle, Amersfoort, Zwolle, Steenwijk, Zwolle]"
train_19,"[Almere Centrum, Lelystad Centrum, Almere Centrum, Lelystad Centrum, Almere Centrum, Amsterdam Centraal, Utrecht Centraal, Hilversum, Utrecht Centraal, Amsterdam Amstel, Almere Centrum]"
train_20,"[Tilburg, Breda, Tilburg, s-Hertogenbosch, Eindhoven, s-Hertogenbosch, Oss, s-Hertogenbosch, Utrecht Centraal, Alphen a/d Rijn]"
score,1566.2921348314612
