train,stations
train_1,"[Sittard, Roermond, Sittard, Maastricht, Sittard, Heerlen, Sittard, Roermond, Sittard, Roermond, Sittard, Roermond]"
train_2,"[Etten-Leur, Breda, Tilburg, s-Hertogenbosch, Utrecht Centraal, Ede-Wageningen, Arnhem Centraal, Dieren, Zutphen, Deventer, Almelo]"
train_3,"[Delft, Den Haag HS, Gouda, Alphen a/d Rijn, Leiden Centraal, Alphen a/d Rijn, Gouda, Alphen a/d Rijn, Gouda, Rotterdam Alexander, Gouda, Utrecht Centraal]"
train_4,"[Hilversum, Amsterdam Amstel, Amsterdam Zuid, Schiphol Airport, Amsterdam Zuid, Schiphol Airport, Leiden Centraal, Alphen a/d Rijn, Utrecht Centraal, s-Hertogenbosch, Utrecht Centraal]"
train_5,"[Oss, s-Hertogenbosch, Eindhoven, s-Hertogenbosch, Utrecht Centraal, Gouda, Den Haag Laan v NOI, Gouda, Den Haag Centraal, Delft]"
train_6,"[Almere Centrum, Hilversum, Almere Centrum, Amsterdam Centraal, Almere Centrum, Amsterdam Amstel, Amsterdam Centraal, Amsterdam Amstel, Utrecht Centraal]"
train_7,"[Hoorn, Alkmaar, Castricum, Alkmaar, Castricum, Beverwijk, Zaandam, Hoorn, Zaandam, Amsterdam Sloterdijk, Amsterdam Centraal, Almere Centrum]"
train_8,"[Etten-Leur, Breda, Tilburg, s-Hertogenbosch, Oss, s-Hertogenbosch, Eindhoven, s-Hertogenbosch, Eindhoven, Tilburg, Eindhoven, Helmond]"
train_9,"[Roermond, Weert, Eindhoven, Weert, Eindhoven, Weert, Roermond, Sittard, Maastricht, Sittard, Roermond, Sittard]"
train_10,"[Helmond, Venlo, Helmond, Eindhoven, Tilburg, Eindhoven, Tilburg, s-Hertogenbosch, Utrecht Centraal]"
train_11,"[Nijmegen, Oss, Nijmegen, Arnhem Centraal, Nijmegen, Arnhem Centraal, Nijmegen, Oss, s-Hertogenbosch, Oss, Nijmegen, Arnhem Centraal, Nijmegen, Oss]"
train_12,"[Heerlen, Sittard, Heerlen, Sittard, Roermond, Sittard, Heerlen, Sittard, Roermond, Sittard, Maastricht, Sittard]"
train_13,"[Amsterdam Zuid, Amsterdam Sloterdijk, Zaandam, Beverwijk, Haarlem, Beverwijk, Zaandam, Beverwijk, Haarlem, Beverwijk]"
train_14,"[Weert, Roermond, Sittard, Heerlen, Sittard, Maastricht, Sittard, Heerlen, Sittard, Roermond, Sittard, Maastricht, Sittard]"
train_15,"[Dieren, Arnhem Centraal, Nijmegen, Arnhem Centraal, Ede-Wageningen, Utrecht Centraal, Alphen a/d Rijn, Utrecht Centraal, Ede-Wageningen, Arnhem Centraal, Nijmegen]"
train_16,"[Zutphen, Dieren, Arnhem Centraal, Ede-Wageningen, Arnhem Centraal, Nijmegen, Arnhem Centraal, Dieren, Arnhem Centraal, Ede-Wageningen, Utrecht Centraal, Hilversum, Utrecht Centraal, Amsterdam Centraal]"
train_17,"[Zwolle, Deventer, Almelo, Zwolle, Assen, Zwolle]"
train_18,"[Zutphen, Deventer, Zutphen, Dieren, Zutphen, Dieren, Zutphen, Apeldoorn, Deventer, Almelo, Hengelo, Almelo, Zwolle]"
train_19,"[Eindhoven, Weert, Roermond, Weert, Eindhoven, Helmond, Eindhoven, s-Hertogenbosch, Tilburg, s-Hertogenbosch, Utrecht Centraal]"
train_20,"[Utrecht Centraal, Amsterdam Amstel, Almere Centrum, Lelystad Centrum, Almere Centrum, Lelystad Centrum, Almere Centrum, Lelystad Centrum, Almere Centrum, Lelystad Centrum, Almere Centrum]"
score,1246.2134831460671
