train,stations
train_1,"[Enschede, Hengelo, Almelo, Hengelo, Almelo, Zwolle, Assen, Groningen, Assen]"
train_2,"[Almelo, Zwolle, Almelo, Zwolle, Almelo]"
train_3,"[Almere Centrum, Hilversum, Amsterdam Amstel, Almere Centrum, Amsterdam Amstel, Almere Centrum, Amsterdam Centraal, Amsterdam Sloterdijk, Zaandam, Castricum]"
train_4,"[Amersfoort, Utrecht Centraal, Gouda, Den Haag HS, Delft, Den Haag HS, Delft, Schiedam Centrum, Rotterdam Centraal, Dordrecht, Breda, Etten-Leur, Breda, Tilburg, Breda, Tilburg]"
train_5,"[Almelo, Deventer, Zwolle, Assen, Groningen, Assen, Zwolle]"
train_6,"[Castricum, Zaandam, Castricum, Alkmaar, Den Helder, Alkmaar, Hoorn, Alkmaar]"
train_7,"[Leeuwarden, Heerenveen, Leeuwarden, Groningen, Leeuwarden, Groningen, Assen]"
train_8,"[s-Hertogenbosch, Oss, s-Hertogenbosch, Utrecht Centraal, Hilversum, Almere Centrum, Amsterdam Centraal, Amsterdam Amstel, Utrecht Centraal, Gouda, Alphen a/d Rijn]"
train_9,"[s-Hertogenbosch, Eindhoven, s-Hertogenbosch, Utrecht Centraal, Amsterdam Centraal, Almere Centrum, Lelystad Centrum, Almere Centrum, Amsterdam Amstel]"
train_10,"[Deventer, Zutphen, Dieren, Zutphen, Apeldoorn, Amersfoort, Apeldoorn, Zutphen, Dieren, Arnhem Centraal, Ede-Wageningen, Arnhem Centraal, Ede-Wageningen]"
train_11,"[Oss, Nijmegen, Oss, Nijmegen, Arnhem Centraal, Ede-Wageningen, Arnhem Centraal, Ede-Wageningen, Utrecht Centraal, Ede-Wageningen, Utrecht Centraal]"
train_12,"[Weert, Roermond, Sittard, Heerlen, Sittard, Roermond, Sittard, Maastricht, Sittard, Maastricht, Sittard, Roermond, Sittard]"
train_13,"[Heemstede-Aerdenhout, Haarlem, Heemstede-Aerdenhout, Haarlem, Heemstede-Aerdenhout, Leiden Centraal, Alphen a/d Rijn, Leiden Centraal, Den Haag Centraal, Gouda, Rotterdam Alexander, Rotterdam Blaak, Schiedam Centrum, Rotterdam Blaak, Rotterdam Alexander, Rotterdam Centraal, Dordrecht]"
train_14,"[Amsterdam Sloterdijk, Zaandam, Amsterdam Sloterdijk, Amsterdam Zuid, Amsterdam Amstel, Utrecht Centraal, Ede-Wageningen, Arnhem Centraal, Ede-Wageningen, Utrecht Centraal, s-Hertogenbosch, Oss, s-Hertogenbosch]"
train_15,"[Enschede, Hengelo, Enschede, Hengelo, Enschede, Hengelo, Almelo, Deventer, Apeldoorn, Zutphen, Apeldoorn, Zutphen, Dieren, Zutphen, Apeldoorn]"
train_16,"[Apeldoorn, Deventer, Zwolle, Assen, Zwolle, Amersfoort]"
train_17,"[Schiedam Centrum, Rotterdam Blaak, Schiedam Centrum, Delft, Schiedam Centrum, Delft, Den Haag HS, Leiden Centraal, Schiphol Airport, Utrecht Centraal, s-Hertogenbosch, Utrecht Centraal]"
train_18,"[Eindhoven, Tilburg, Breda, Dordrecht, Roosendaal, Dordrecht, Roosendaal, Etten-Leur, Roosendaal, Etten-Leur, Roosendaal, Etten-Leur]"
train_19,"[Rotterdam Centraal, Schiedam Centrum, Rotterdam Centraal, Rotterdam Alexander, Rotterdam Blaak, Dordrecht, Rotterdam Blaak, Schiedam Centrum, Delft, Den Haag HS, Gouda, Den Haag Centraal, Leiden Centraal, Heemstede-Aerdenhout, Haarlem, Beverwijk]"
train_20,"[Sittard, Heerlen, Sittard, Heerlen, Sittard, Maastricht, Sittard, Maastricht, Sittard, Heerlen, Sittard, Roermond]"
score,2744.8876404494376
