train,stations
train_1,"[Lelystad Centrum, Almere Centrum, Hilversum, Utrecht Centraal, Schiphol Airport, Amsterdam Zuid, Amsterdam Amstel, Hilversum, Almere Centrum, Amsterdam Centraal]"
train_2,"[Zwolle, Assen, Groningen, Assen, Zwolle, Deventer, Zutphen, Dieren, Arnhem Centraal]"
train_3,"[Amersfoort, Utrecht Centraal, Amersfoort, Zwolle, Steenwijk, Heerenveen, Steenwijk, Heerenveen, Leeuwarden, Heerenveen, Leeuwarden]"
train_4,"[Rotterdam Alexander, Rotterdam Blaak, Schiedam Centrum, Rotterdam Blaak, Schiedam Centrum, Delft, Den Haag Laan v NOI, Delft, Den Haag Laan v NOI, Gouda, Den Haag HS, Leiden Centraal, Den Haag Laan v NOI]"
train_5,"[Apeldoorn, Deventer, Apeldoorn, Deventer, Zwolle, Almelo, Zwolle]"
train_6,"[Heerenveen, Leeuwarden, Heerenveen, Steenwijk, Heerenveen, Steenwijk, Heerenveen, Leeuwarden, Heerenveen, Leeuwarden, Heerenveen, Steenwijk]"
train_7,"[Amsterdam Zuid, Amsterdam Sloterdijk, Haarlem, Amsterdam Sloterdijk, Zaandam, Hoorn, Alkmaar, Den Helder, Alkmaar]"
train_8,"[Zaandam, Hoorn, Zaandam, Amsterdam Sloterdijk, Amsterdam Centraal, Amsterdam Amstel, Amsterdam Centraal, Utrecht Centraal, Amsterdam Centraal, Amsterdam Sloterdijk, Zaandam, Castricum, Beverwijk]"
train_9,"[Oss, s-Hertogenbosch, Tilburg, Breda, Dordrecht, Roosendaal, Etten-Leur, Roosendaal, Dordrecht, Rotterdam Blaak, Rotterdam Alexander, Rotterdam Centraal, Dordrecht]"
train_10,"[Enschede, Hengelo, Enschede, Hengelo, Almelo, Hengelo, Enschede, Hengelo, Enschede, Hengelo, Almelo, Hengelo, Almelo, Zwolle, Steenwijk]"
train_11,"[Alkmaar, Castricum, Beverwijk, Castricum, Zaandam, Hoorn, Zaandam, Amsterdam Sloterdijk, Amsterdam Centraal, Utrecht Centraal, s-Hertogenbosch, Oss]"
train_12,"[Etten-Leur, Breda, Dordrecht, Roosendaal, Etten-Leur, Breda, Tilburg, s-Hertogenbosch, Utrecht Centraal, Alphen a/d Rijn, Gouda]"
train_13,"[Roermond, Weert, Roermond, Sittard, Maastricht, Sittard, Heerlen, Sittard, Maastricht, Sittard, Roermond, Sittard, Maastricht]"
train_14,"[Heemstede-Aerdenhout, Haarlem, Heemstede-Aerdenhout, Leiden Centraal, Heemstede-Aerdenhout, Haarlem, Amsterdam Sloterdijk, Amsterdam Zuid, Amsterdam Amstel, Amsterdam Centraal, Amsterdam Sloterdijk, Amsterdam Centraal, Utrecht Centraal, Alphen a/d Rijn]"
train_15,"[Utrecht Centraal, Schiphol Airport, Utrecht Centraal, Hilversum, Almere Centrum, Amsterdam Amstel, Hilversum]"
train_16,"[Schiphol Airport, Utrecht Centraal, Amsterdam Centraal, Amsterdam Amstel, Hilversum, Utrecht Centraal, s-Hertogenbosch, Utrecht Centraal]"
train_17,"[Dieren, Zutphen, Apeldoorn, Zutphen, Apeldoorn, Zutphen, Apeldoorn, Deventer, Zwolle, Steenwijk]"
train_18,"[Gouda, Den Haag HS, Leiden Centraal, Heemstede-Aerdenhout, Leiden Centraal, Den Haag Centraal, Gouda, Utrecht Centraal, Gouda, Den Haag Centraal, Gouda]"
train_19,"[Almere Centrum, Hilversum, Amsterdam Amstel, Amsterdam Centraal, Amsterdam Amstel, Hilversum, Amsterdam Amstel, Amsterdam Zuid, Schiphol Airport, Leiden Centraal, Den Haag Centraal]"
train_20,"[Zwolle, Almelo, Deventer, Apeldoorn, Deventer, Zutphen, Dieren, Arnhem Centraal, Nijmegen, Arnhem Centraal, Ede-Wageningen, Arnhem Centraal, Nijmegen]"
score,2594.52808988764
