train,stations
train_1,"[Etten-Leur, Roosendaal, Etten-Leur, Breda, Tilburg, s-Hertogenbosch, Utrecht Centraal, Ede-Wageningen, Arnhem Centraal, Ede-Wageningen, Arnhem Centraal, Nijmegen, Arnhem Centraal, Nijmegen]"
train_2,"[Rotterdam Blaak, Schiedam Centrum, Rotterdam Centraal, Schiedam Centrum, Rotterdam Centraal, Rotterdam Alexander, Rotterdam Centraal, Dordrecht, Breda, Etten-Leur, Roosendaal, Dordrecht, Roosendaal, Dordrecht]"
train_3,"[Almelo, Hengelo, Enschede, Hengelo, Almelo, Deventer, Almelo, Hengelo, Enschede, Hengelo, Almelo, Zwolle]"
train_4,"[Lelystad Centrum, Almere Centrum, Amsterdam Centraal, Amsterdam Amstel, Amsterdam Centraal, Almere Centrum, Hilversum, Amsterdam Amstel, Amsterdam Zuid, Amsterdam Sloterdijk, Haarlem, Beverwijk]"
train_5,"[Gouda, Den Haag HS, Delft, Den Haag Laan v NOI, Gouda, Alphen a/d Rijn, Utrecht Centraal, Amsterdam Amstel, Amsterdam Zuid, Amsterdam Amstel]"
train_6,"[Heemstede-Aerdenhout, Leiden Centraal, Heemstede-Aerdenhout, Leiden Centraal, Den Haag HS, Delft, Den Haag Laan v NOI, Delft, Den Haag Laan v NOI, Gouda, Den Haag HS, Gouda]"
train_7,"[Steenwijk, Zwolle, Assen, Zwolle, Steenwijk, Heerenveen, Steenwijk]"
train_8,"[Alkmaar, Castricum, Beverwijk, Haarlem, Amsterdam Sloterdijk, Haarlem, Heemstede-Aerdenhout, Leiden Centraal, Den Haag Laan v NOI, Delft, Schiedam Centrum, Rotterdam Centraal, Schiedam Centrum, Rotterdam Centraal, Schiedam Centrum, Delft, Den Haag Centraal, Delft, Den Haag HS, Delft]"
train_9,"[Amsterdam Sloterdijk, Amsterdam Centraal, Amsterdam Sloterdijk, Amsterdam Centraal, Amsterdam Sloterdijk, Amsterdam Zuid, Amsterdam Amstel, Hilversum, Almere Centrum, Lelystad Centrum, Almere Centrum, Amsterdam Amstel, Utrecht Centraal]"
train_10,"[Tilburg, s-Hertogenbosch, Tilburg, s-Hertogenbosch, Oss, s-Hertogenbosch, Utrecht Centraal, s-Hertogenbosch, Utrecht Centraal, s-Hertogenbosch]"
train_11,"[Almere Centrum, Amsterdam Centraal, Amsterdam Amstel, Hilversum, Almere Centrum, Lelystad Centrum, Almere Centrum, Lelystad Centrum, Almere Centrum, Amsterdam Centraal, Amsterdam Amstel, Amsterdam Centraal]"
train_12,"[Amsterdam Sloterdijk, Amsterdam Centraal, Almere Centrum, Amsterdam Amstel, Utrecht Centraal, s-Hertogenbosch, Oss, s-Hertogenbosch, Tilburg, Eindhoven, Weert]"
train_13,"[Almelo, Zwolle, Steenwijk, Heerenveen, Steenwijk, Zwolle, Amersfoort, Utrecht Centraal]"
train_14,"[Hengelo, Almelo, Zwolle, Steenwijk, Zwolle, Steenwijk, Heerenveen, Leeuwarden, Heerenveen]"
train_15,"[Alphen a/d Rijn, Gouda, Den Haag HS, Leiden Centraal, Alphen a/d Rijn, Utrecht Centraal, Amersfoort, Apeldoorn, Zutphen, Dieren, Arnhem Centraal]"
train_16,"[Lelystad Centrum, Almere Centrum, Amsterdam Centraal, Amsterdam Sloterdijk, Zaandam, Castricum, Beverwijk, Haarlem, Heemstede-Aerdenhout, Leiden Centraal, Den Haag Centraal, Delft, Den Haag HS, Gouda]"
train_17,"[Delft, Den Haag Laan v NOI, Leiden Centraal, Alphen a/d Rijn, Utrecht Centraal, Alphen a/d Rijn, Utrecht Centraal, Amersfoort, Utrecht Centraal, Alphen a/d Rijn]"
train_18,"[Eindhoven, Weert, Eindhoven, Weert, Eindhoven, Weert, Eindhoven, s-Hertogenbosch, Utrecht Centraal, Amsterdam Centraal]"
train_19,"[Arnhem Centraal, Nijmegen, Arnhem Centraal, Ede-Wageningen, Utrecht Centraal, Ede-Wageningen, Arnhem Centraal, Ede-Wageningen, Arnhem Centraal, Nijmegen, Arnhem Centraal, Ede-Wageningen, Arnhem Centraal, Dieren, Zutphen]"
train_20,"[Lelystad Centrum, Almere Centrum, Amsterdam Centraal, Amsterdam Sloterdijk, Amsterdam Centraal, Almere Centrum, Amsterdam Centraal, Utrecht Centraal, Amsterdam Centraal, Utrecht Centraal]"
score,1670.651685393258
