train,stations
train_1,"[Den Helder, Alkmaar, Hoorn, Alkmaar, Den Helder, Alkmaar, Castricum, Alkmaar]"
train_2,"[Alkmaar, Den Helder, Alkmaar, Castricum, Beverwijk, Zaandam, Castricum, Beverwijk, Castricum, Alkmaar, Castricum]"
train_3,"[Schiedam Centrum, Delft, Den Haag HS, Gouda, Den Haag Centraal, Gouda, Utrecht Centraal, Schiphol Airport, Utrecht Centraal]"
train_4,"[Vlissingen, Roosendaal, Vlissingen]"
train_5,"[Arnhem Centraal, Nijmegen, Arnhem Centraal, Nijmegen, Oss, Nijmegen, Oss, s-Hertogenbosch, Eindhoven, s-Hertogenbosch, Utrecht Centraal, Hilversum]"
train_6,"[Etten-Leur, Breda, Etten-Leur, Roosendaal, Etten-Leur, Breda, Dordrecht, Rotterdam Blaak, Rotterdam Alexander, Rotterdam Centraal, Schiedam Centrum, Rotterdam Blaak, Dordrecht, Roosendaal, Etten-Leur, Roosendaal]"
train_7,"[Oss, Nijmegen, Arnhem Centraal, Dieren, Zutphen, Dieren, Zutphen, Deventer, Zwolle, Assen, Groningen, Assen]"
train_8,"[Hilversum, Almere Centrum, Amsterdam Centraal, Amsterdam Sloterdijk, Zaandam, Castricum, Beverwijk, Castricum, Alkmaar, Hoorn, Alkmaar, Hoorn]"
train_9,"[Assen, Groningen, Assen, Groningen, Leeuwarden, Heerenveen, Leeuwarden, Groningen]"
train_10,"[Nijmegen, Arnhem Centraal, Nijmegen, Arnhem Centraal, Nijmegen, Oss, s-Hertogenbosch, Tilburg, s-Hertogenbosch, Tilburg, s-Hertogenbosch, Tilburg, Breda]"
train_11,"[Eindhoven, Weert, Roermond, Sittard, Heerlen, Sittard, Heerlen, Sittard, Maastricht, Sittard, Maastricht, Sittard]"
train_12,"[Castricum, Alkmaar, Castricum, Alkmaar, Hoorn, Alkmaar, Den Helder, Alkmaar, Castricum, Beverwijk]"
train_13,"[Etten-Leur, Breda, Dordrecht, Rotterdam Centraal, Rotterdam Alexander, Rotterdam Centraal, Dordrecht, Roosendaal, Etten-Leur, Roosendaal]"
train_14,"[s-Hertogenbosch, Eindhoven, Tilburg, Breda, Dordrecht, Rotterdam Blaak, Rotterdam Alexander, Rotterdam Centraal, Rotterdam Alexander, Rotterdam Blaak, Schiedam Centrum, Rotterdam Centraal, Schiedam Centrum, Rotterdam Blaak, Rotterdam Alexander, Rotterdam Blaak, Schiedam Centrum]"
train_15,"[Helmond, Eindhoven, s-Hertogenbosch, Oss, s-Hertogenbosch, Utrecht Centraal, Amsterdam Centraal, Amsterdam Sloterdijk, Amsterdam Zuid, Schiphol Airport, Leiden Centraal, Alphen a/d Rijn, Leiden Centraal]"
train_16,"[Almelo, Deventer, Almelo, Zwolle, Almelo, Hengelo, Enschede, Hengelo, Enschede, Hengelo, Enschede]"
train_17,"[Zaandam, Castricum, Beverwijk, Zaandam, Hoorn, Alkmaar, Hoorn, Alkmaar]"
train_18,"[Amsterdam Zuid, Amsterdam Sloterdijk, Zaandam, Beverwijk, Castricum, Zaandam, Castricum, Alkmaar, Castricum, Beverwijk, Haarlem, Heemstede-Aerdenhout, Leiden Centraal, Schiphol Airport]"
train_19,"[Den Haag Laan v NOI, Leiden Centraal, Den Haag Laan v NOI, Leiden Centraal, Den Haag Laan v NOI, Gouda, Alphen a/d Rijn, Leiden Centraal, Den Haag Centraal, Gouda, Den Haag HS, Leiden Centraal, Schiphol Airport]"
train_20,"[Deventer, Zwolle, Steenwijk, Heerenveen, Steenwijk, Heerenveen, Leeuwarden, Groningen, Leeuwarden]"
score,2580.168539325843
