train,stations
train_1,"[Ede-Wageningen, Arnhem Centraal, Dieren, Zutphen, Apeldoorn, Zutphen, Dieren, Zutphen, Deventer, Zutphen, Dieren, Arnhem Centraal, Ede-Wageningen, Utrecht Centraal]"
train_2,"[Amsterdam Centraal, Almere Centrum, Amsterdam Amstel, Hilversum, Utrecht Centraal, Hilversum, Amsterdam Amstel, Amsterdam Centraal, Almere Centrum, Lelystad Centrum]"
train_3,"[Tilburg, Eindhoven, Weert, Roermond, Sittard, Roermond, Weert, Eindhoven, s-Hertogenbosch, Oss, s-Hertogenbosch]"
train_4,"[Utrecht Centraal, Amsterdam Centraal, Utrecht Centraal, Amsterdam Amstel, Amsterdam Centraal, Amsterdam Sloterdijk, Haarlem, Beverwijk, Zaandam, Amsterdam Sloterdijk, Amsterdam Centraal, Amsterdam Amstel]"
train_5,"[Amsterdam Centraal, Almere Centrum, Lelystad Centrum, Almere Centrum, Amsterdam Amstel, Almere Centrum, Amsterdam Centraal, Utrecht Centraal]"
train_6,"[Rotterdam Blaak, Schiedam Centrum, Delft, Den Haag HS, Gouda, Utrecht Centraal, Gouda, Den Haag Centraal, Leiden Centraal, Schiphol Airport, Amsterdam Zuid, Amsterdam Amstel, Amsterdam Centraal, Amsterdam Sloterdijk, Amsterdam Centraal, Amsterdam Sloterdijk]"
train_7,"[Den Haag Centraal, Leiden Centraal, Den Haag HS, Delft, Den Haag Laan v NOI, Delft, Schiedam Centrum, Rotterdam Blaak, Schiedam Centrum, Rotterdam Blaak, Dordrecht, Roosendaal]"
train_8,"[Arnhem Centraal, Dieren, Arnhem Centraal, Dieren, Zutphen, Apeldoorn, Deventer, Zwolle, Amersfoort, Apeldoorn, Zutphen]"
train_9,"[Hengelo, Enschede, Hengelo, Almelo, Deventer, Apeldoorn, Amersfoort, Utrecht Centraal, Hilversum, Almere Centrum, Amsterdam Centraal, Amsterdam Sloterdijk, Zaandam]"
train_10,"[Apeldoorn, Amersfoort, Utrecht Centraal, Amsterdam Amstel, Amsterdam Centraal, Almere Centrum, Lelystad Centrum, Almere Centrum, Amsterdam Amstel, Almere Centrum]"
train_11,"[Amersfoort, Utrecht Centraal, Ede-Wageningen, Utrecht Centraal, Schiphol Airport, Amsterdam Zuid, Amsterdam Amstel, Almere Centrum, Amsterdam Amstel]"
train_12,"[Vlissingen, Roosendaal, Vlissingen]"
train_13,"[Dieren, Zutphen, Dieren, Arnhem Centraal, Dieren, Arnhem Centraal, Dieren, Arnhem Centraal, Nijmegen, Arnhem Centraal, Dieren, Arnhem Centraal, Dieren, Arnhem Centraal, Nijmegen, Oss]"
train_14,"[Dordrecht, Rotterdam Blaak, Rotterdam Alexander, Rotterdam Centraal, Schiedam Centrum, Rotterdam Centraal, Schiedam Centrum, Rotterdam Centraal, Rotterdam Alexander, Rotterdam Centraal, Schiedam Centrum, Rotterdam Blaak, Dordrecht, Roosendaal, Dordrecht, Rotterdam Blaak, Rotterdam Alexander, Gouda]"
train_15,"[Almelo, Hengelo, Almelo, Deventer, Almelo, Zwolle, Almelo]"
train_16,"[Rotterdam Centraal, Rotterdam Alexander, Gouda, Rotterdam Alexander, Rotterdam Centraal, Schiedam Centrum, Delft, Schiedam Centrum, Rotterdam Centraal, Rotterdam Alexander, Gouda, Den Haag Centraal, Delft, Den Haag HS, Leiden Centraal, Heemstede-Aerdenhout, Leiden Centraal, Schiphol Airport]"
train_17,"[Assen, Groningen, Leeuwarden, Heerenveen, Steenwijk, Heerenveen, Leeuwarden, Groningen]"
train_18,"[Den Haag Centraal, Delft, Den Haag HS, Leiden Centraal, Den Haag Centraal, Leiden Centraal, Den Haag Laan v NOI, Gouda, Utrecht Centraal, Hilversum, Utrecht Centraal, Gouda, Utrecht Centraal]"
train_19,"[Dieren, Arnhem Centraal, Dieren, Arnhem Centraal, Nijmegen, Arnhem Centraal, Dieren, Zutphen, Dieren, Arnhem Centraal, Nijmegen, Oss, Nijmegen, Oss, Nijmegen]"
train_20,"[Tilburg, Eindhoven, Weert, Roermond, Weert, Eindhoven, Tilburg, Breda, Etten-Leur, Breda, Etten-Leur, Roosendaal]"
score,2497.8089887640454
