train,stations
train_1,"[Rotterdam Alexander, Gouda, Den Haag HS, Gouda, Den Haag Laan v NOI, Gouda, Den Haag Centraal, Gouda, Utrecht Centraal]"
train_2,"[Amsterdam Amstel, Amsterdam Zuid, Amsterdam Amstel, Hilversum, Utrecht Centraal, Amsterdam Amstel, Hilversum, Amsterdam Amstel, Amsterdam Zuid, Amsterdam Sloterdijk, Zaandam]"
train_3,"[Breda, Dordrecht, Breda, Tilburg, Breda, Tilburg, Eindhoven, Tilburg, s-Hertogenbosch, Tilburg, Breda, Dordrecht]"
train_4,"[Beverwijk, Zaandam, Hoorn, Alkmaar, Den Helder, Alkmaar]"
train_5,"[Haarlem, Heemstede-Aerdenhout, Haarlem, Amsterdam Sloterdijk, Zaandam, Castricum, Alkmaar, Hoorn, Zaandam, Castricum, Alkmaar, Castricum, Beverwijk, Zaandam, Amsterdam Sloterdijk]"
train_6,"[Amsterdam Amstel, Almere Centrum, Hilversum, Almere Centrum, Lelystad Centrum, Almere Centrum, Hilversum, Utrecht Centraal, Alphen a/d Rijn]"
train_7,"[Deventer, Apeldoorn, Amersfoort, Apeldoorn, Deventer, Zwolle, Deventer, Zutphen, Deventer, Apeldoorn, Amersfoort]"
train_8,"[Groningen, Leeuwarden, Groningen, Leeuwarden, Groningen, Assen]"
train_9,"[Rotterdam Blaak, Dordrecht, Breda, Dordrecht, Roosendaal, Vlissingen]"
train_10,"[Hoorn, Alkmaar, Hoorn, Alkmaar, Den Helder, Alkmaar, Hoorn]"
train_11,"[Amsterdam Centraal, Utrecht Centraal, Gouda, Utrecht Centraal, Gouda, Utrecht Centraal, Hilversum, Almere Centrum, Amsterdam Amstel, Amsterdam Zuid]"
train_12,"[Deventer, Zutphen, Deventer, Almelo, Zwolle, Amersfoort, Zwolle]"
train_13,"[Almere Centrum, Amsterdam Centraal, Amsterdam Amstel, Amsterdam Zuid, Amsterdam Sloterdijk, Amsterdam Zuid, Amsterdam Sloterdijk, Zaandam, Amsterdam Sloterdijk, Amsterdam Centraal, Almere Centrum, Amsterdam Amstel, Utrecht Centraal]"
train_14,"[Den Haag HS, Gouda, Den Haag Laan v NOI, Delft, Den Haag Laan v NOI, Gouda, Den Haag Centraal, Gouda, Rotterdam Alexander, Gouda, Utrecht Centraal]"
train_15,"[Delft, Den Haag HS, Gouda, Den Haag Centraal, Gouda, Rotterdam Alexander, Rotterdam Blaak, Rotterdam Alexander, Rotterdam Centraal, Rotterdam Alexander, Rotterdam Blaak, Schiedam Centrum, Rotterdam Centraal, Schiedam Centrum, Rotterdam Blaak, Rotterdam Alexander, Rotterdam Blaak]"
train_16,"[Zwolle, Assen, Groningen, Assen, Zwolle, Assen]"
train_17,"[Tilburg, s-Hertogenbosch, Tilburg, Eindhoven, Helmond, Eindhoven, s-Hertogenbosch, Oss, Nijmegen, Oss, s-Hertogenbosch, Tilburg, Breda]"
train_18,"[Ede-Wageningen, Arnhem Centraal, Dieren, Zutphen, Deventer, Zwolle, Assen, Zwolle]"
train_19,"[Enschede, Hengelo, Enschede, Hengelo, Almelo, Hengelo, Almelo, Hengelo, Enschede, Hengelo, Almelo, Hengelo, Enschede, Hengelo, Enschede, Hengelo, Enschede, Hengelo, Almelo]"
train_20,"[Almere Centrum, Hilversum, Amsterdam Amstel, Utrecht Centraal, Amersfoort, Utrecht Centraal, Schiphol Airport, Amsterdam Zuid, Amsterdam Sloterdijk, Zaandam]"
score,1809.651685393258
