train,stations
train_1,"[Nijmegen, Arnhem Centraal, Nijmegen, Arnhem Centraal, Nijmegen, Oss, Nijmegen, Oss, s-Hertogenbosch, Oss, s-Hertogenbosch, Eindhoven, s-Hertogenbosch]"
train_2,"[Den Haag HS, Delft, Schiedam Centrum, Rotterdam Centraal, Dordrecht, Breda, Etten-Leur, Breda, Dordrecht, Rotterdam Centraal, Dordrecht, Rotterdam Blaak, Schiedam Centrum, Rotterdam Centraal, Schiedam Centrum, Rotterdam Centraal, Rotterdam Alexander, Gouda]"
train_3,"[Alkmaar, Hoorn, Alkmaar, Hoorn, Alkmaar, Hoorn, Alkmaar, Castricum, Zaandam]"
train_4,"[Amsterdam Zuid, Schiphol Airport, Leiden Centraal, Den Haag HS, Gouda, Den Haag HS, Leiden Centraal, Heemstede-Aerdenhout, Haarlem, Heemstede-Aerdenhout, Haarlem, Heemstede-Aerdenhout, Leiden Centraal, Den Haag HS, Delft, Schiedam Centrum, Rotterdam Blaak]"
train_5,"[Utrecht Centraal, Hilversum, Utrecht Centraal, Amsterdam Amstel, Amsterdam Zuid, Amsterdam Amstel, Amsterdam Zuid, Amsterdam Sloterdijk, Zaandam, Beverwijk, Zaandam, Beverwijk]"
train_6,"[Ede-Wageningen, Utrecht Centraal, Ede-Wageningen, Utrecht Centraal, Hilversum, Almere Centrum, Amsterdam Amstel, Amsterdam Zuid, Amsterdam Sloterdijk, Haarlem]"
train_7,"[Rotterdam Centraal, Dordrecht, Roosendaal, Vlissingen, Roosendaal, Etten-Leur]"
train_8,"[Zwolle, Assen, Zwolle, Almelo, Deventer, Zwolle]"
train_9,"[Venlo, Helmond, Venlo, Helmond, Venlo, Helmond, Eindhoven, Weert]"
train_10,"[Schiphol Airport, Utrecht Centraal, s-Hertogenbosch, Oss, Nijmegen, Oss, Nijmegen, Arnhem Centraal, Dieren, Zutphen, Dieren, Zutphen, Deventer]"
train_11,"[Heerlen, Sittard, Roermond, Sittard, Maastricht, Sittard, Roermond, Weert, Eindhoven, Tilburg, Breda, Etten-Leur, Roosendaal]"
train_12,"[Amsterdam Centraal, Utrecht Centraal, Ede-Wageningen, Arnhem Centraal, Dieren, Arnhem Centraal, Dieren, Zutphen, Dieren, Zutphen, Apeldoorn, Zutphen, Deventer]"
train_13,"[Sittard, Maastricht, Sittard, Maastricht, Sittard, Roermond, Weert, Roermond, Weert, Eindhoven, Weert, Eindhoven]"
train_14,"[Groningen, Assen, Groningen, Leeuwarden, Heerenveen, Leeuwarden, Heerenveen, Leeuwarden, Groningen]"
train_15,"[Hoorn, Zaandam, Castricum, Alkmaar, Den Helder, Alkmaar, Hoorn, Alkmaar]"
train_16,"[Nijmegen, Oss, Nijmegen, Oss, Nijmegen, Oss, Nijmegen, Arnhem Centraal, Ede-Wageningen, Arnhem Centraal, Ede-Wageningen, Utrecht Centraal, Hilversum]"
train_17,"[Hengelo, Almelo, Zwolle, Deventer, Zwolle, Almelo]"
train_18,"[Rotterdam Blaak, Schiedam Centrum, Rotterdam Centraal, Dordrecht, Breda, Dordrecht, Breda, Etten-Leur, Breda, Dordrecht, Roosendaal, Etten-Leur, Breda, Tilburg]"
train_19,"[Heemstede-Aerdenhout, Haarlem, Beverwijk, Zaandam, Beverwijk, Haarlem, Beverwijk, Zaandam, Beverwijk, Castricum]"
train_20,"[Enschede, Hengelo, Almelo, Zwolle, Assen, Groningen, Assen, Zwolle]"
score,1984.7303370786522
