train,stations
train_1,"[Roermond, Weert, Roermond, Sittard, Roermond, Sittard, Maastricht, Sittard, Heerlen, Sittard, Maastricht, Sittard, Heerlen]"
train_2,"[Alkmaar, Den Helder, Alkmaar, Den Helder, Alkmaar, Hoorn]"
train_3,"[Den Haag Laan v NOI, Gouda, Den Haag HS, Delft, Den Haag HS, Leiden Centraal, Den Haag HS, Delft, Den Haag Centraal, Leiden Centraal, Schiphol Airport, Amsterdam Zuid, Amsterdam Sloterdijk, Haarlem]"
train_4,"[Roermond, Sittard, Maastricht, Sittard, Maastricht, Sittard, Roermond, Sittard, Heerlen, Sittard, Heerlen, Sittard]"
train_5,"[Amsterdam Sloterdijk, Haarlem, Amsterdam Sloterdijk, Amsterdam Centraal, Amsterdam Amstel, Amsterdam Centraal, Almere Centrum, Amsterdam Centraal, Amsterdam Sloterdijk, Amsterdam Centraal, Utrecht Centraal, Alphen a/d Rijn, Utrecht Centraal]"
train_6,"[Amsterdam Amstel, Utrecht Centraal, Amersfoort, Zwolle, Almelo, Hengelo, Enschede, Hengelo, Almelo, Hengelo, Almelo, Hengelo]"
train_7,"[Almere Centrum, Amsterdam Amstel, Amsterdam Centraal, Amsterdam Amstel, Amsterdam Centraal, Amsterdam Sloterdijk, Haarlem, Amsterdam Sloterdijk, Zaandam, Beverwijk, Castricum, Alkmaar, Den Helder]"
train_8,"[Zaandam, Amsterdam Sloterdijk, Haarlem, Beverwijk, Castricum, Zaandam, Amsterdam Sloterdijk, Zaandam, Amsterdam Sloterdijk, Amsterdam Zuid, Schiphol Airport, Utrecht Centraal, Amersfoort]"
train_9,"[Hengelo, Almelo, Deventer, Zutphen, Dieren, Arnhem Centraal, Dieren, Arnhem Centraal, Dieren, Arnhem Centraal, Ede-Wageningen, Arnhem Centraal, Ede-Wageningen, Utrecht Centraal]"
train_10,"[Eindhoven, Weert, Roermond, Weert, Roermond, Weert, Roermond, Sittard, Heerlen, Sittard, Roermond, Weert, Eindhoven]"
train_11,"[Schiedam Centrum, Rotterdam Centraal, Schiedam Centrum, Delft, Schiedam Centrum, Rotterdam Blaak, Rotterdam Alexander, Rotterdam Centraal, Rotterdam Alexander, Gouda, Rotterdam Alexander, Rotterdam Centraal, Rotterdam Alexander, Gouda, Utrecht Centraal, Amsterdam Amstel, Amsterdam Centraal, Almere Centrum]"
train_12,"[Heemstede-Aerdenhout, Haarlem, Beverwijk, Castricum, Zaandam, Amsterdam Sloterdijk, Haarlem, Amsterdam Sloterdijk, Zaandam, Hoorn, Alkmaar, Den Helder]"
train_13,"[Zaandam, Beverwijk, Haarlem, Amsterdam Sloterdijk, Zaandam, Beverwijk, Haarlem, Amsterdam Sloterdijk, Zaandam, Amsterdam Sloterdijk, Amsterdam Zuid, Amsterdam Amstel, Amsterdam Zuid, Amsterdam Sloterdijk]"
train_14,"[Schiphol Airport, Leiden Centraal, Alphen a/d Rijn, Utrecht Centraal, Amersfoort, Apeldoorn, Deventer, Almelo, Deventer, Zwolle]"
train_15,"[Amsterdam Sloterdijk, Zaandam, Amsterdam Sloterdijk, Zaandam, Amsterdam Sloterdijk, Amsterdam Zuid, Amsterdam Amstel, Almere Centrum, Lelystad Centrum, Almere Centrum, Lelystad Centrum, Almere Centrum, Amsterdam Amstel, Utrecht Centraal]"
train_16,"[Zwolle, Steenwijk, Heerenveen, Steenwijk, Heerenveen, Steenwijk, Heerenveen, Steenwijk, Zwolle, Amersfoort]"
train_17,"[Ede-Wageningen, Arnhem Centraal, Nijmegen, Oss, s-Hertogenbosch, Eindhoven, s-Hertogenbosch, Tilburg, Breda, Etten-Leur, Breda, Tilburg, s-Hertogenbosch, Tilburg]"
train_18,"[Amsterdam Amstel, Amsterdam Centraal, Utrecht Centraal, Amsterdam Amstel, Hilversum, Utrecht Centraal, Hilversum, Utrecht Centraal, Gouda, Den Haag Laan v NOI]"
train_19,"[Leiden Centraal, Den Haag HS, Delft, Den Haag Laan v NOI, Gouda, Den Haag HS, Delft, Den Haag HS, Delft, Den Haag Laan v NOI, Leiden Centraal, Den Haag HS, Leiden Centraal, Den Haag Centraal, Leiden Centraal]"
train_20,"[Etten-Leur, Breda, Dordrecht, Rotterdam Centraal, Dordrecht, Roosendaal, Etten-Leur, Roosendaal, Dordrecht, Roosendaal, Etten-Leur, Roosendaal]"
score,2844.606741573034
