train,stations
train_1,"[Hengelo, Almelo, Hengelo, Enschede, Hengelo, Enschede, Hengelo, Enschede, Hengelo, Enschede, Hengelo, Enschede, Hengelo, Almelo, Zwolle, Deventer]"
train_2,"[Roosendaal, Dordrecht, Breda, Dordrecht, Roosendaal, Dordrecht, Breda, Dordrecht, Roosendaal]"
train_3,"[Ede-Wageningen, Arnhem Centraal, Dieren, Zutphen, Apeldoorn, Amersfoort, Utrecht Centraal, Alphen a/d Rijn, Leiden Centraal, Den Haag HS, Leiden Centraal, Schiphol Airport, Amsterdam Zuid]"
train_4,"[Almere Centrum, Amsterdam Amstel, Utrecht Centraal, s-Hertogenbosch, Oss, Nijmegen, Arnhem Centraal, Ede-Wageningen, Arnhem Centraal, Dieren, Zutphen, Deventer]"
train_5,"[Assen, Zwolle, Deventer, Apeldoorn, Zutphen, Dieren, Arnhem Centraal, Ede-Wageningen, Utrecht Centraal, s-Hertogenbosch]"
train_6,"[Nijmegen, Oss, Nijmegen, Arnhem Centraal, Ede-Wageningen, Arnhem Centraal, Ede-Wageningen, Arnhem Centraal, Ede-Wageningen, Arnhem Centraal, Nijmegen, Oss, Nijmegen, Oss, s-Hertogenbosch]"
train_7,"[Amsterdam Centraal, Utrecht Centraal, Ede-Wageningen, Arnhem Centraal, Dieren, Arnhem Centraal, Nijmegen, Oss, s-Hertogenbosch, Eindhoven, s-Hertogenbosch, Eindhoven]"
train_8,"[Maastricht, Sittard, Roermond, Sittard, Maastricht, Sittard, Maastricht, Sittard, Maastricht, Sittard, Heerlen, Sittard]"
train_9,"[Gouda, Den Haag Laan v NOI, Delft, Den Haag Laan v NOI, Leiden Centraal, Alphen a/d Rijn, Utrecht Centraal, Gouda, Utrecht Centraal, Gouda, Den Haag HS]"
train_10,"[Castricum, Beverwijk, Haarlem, Beverwijk, Castricum, Zaandam, Hoorn, Zaandam, Castricum, Beverwijk, Zaandam]"
train_11,"[Helmond, Eindhoven, Weert, Eindhoven, Helmond, Eindhoven, Tilburg, s-Hertogenbosch, Oss, s-Hertogenbosch, Oss, s-Hertogenbosch, Eindhoven]"
train_12,"[Amsterdam Sloterdijk, Haarlem, Heemstede-Aerdenhout, Haarlem, Beverwijk, Haarlem, Beverwijk, Castricum, Alkmaar, Den Helder, Alkmaar]"
train_13,"[Apeldoorn, Zutphen, Apeldoorn, Deventer, Almelo, Zwolle, Deventer, Zutphen, Dieren, Zutphen]"
train_14,"[Groningen, Assen, Groningen, Assen, Groningen, Leeuwarden, Groningen, Leeuwarden]"
train_15,"[Zutphen, Deventer, Zwolle, Steenwijk, Zwolle, Deventer, Almelo, Hengelo, Enschede, Hengelo, Enschede, Hengelo]"
train_16,"[Arnhem Centraal, Ede-Wageningen, Utrecht Centraal, Amsterdam Centraal, Amsterdam Sloterdijk, Amsterdam Zuid, Schiphol Airport, Utrecht Centraal, Ede-Wageningen, Arnhem Centraal, Dieren]"
train_17,"[Oss, Nijmegen, Oss, Nijmegen, Oss, Nijmegen, Oss, Nijmegen, Arnhem Centraal, Dieren, Zutphen, Apeldoorn, Deventer]"
train_18,"[Enschede, Hengelo, Almelo, Hengelo, Enschede, Hengelo, Almelo, Deventer, Zutphen, Apeldoorn, Zutphen, Deventer, Zwolle]"
train_19,"[Utrecht Centraal, Amersfoort, Apeldoorn, Deventer, Almelo, Zwolle, Steenwijk, Heerenveen, Steenwijk]"
train_20,"[Eindhoven, Weert, Roermond, Weert, Roermond, Weert, Roermond, Sittard, Roermond, Sittard, Maastricht, Sittard, Roermond]"
score,1154.2134831460671
