train,stations
train_1,"[Maastricht, Sittard, Maastricht, Sittard, Roermond, Sittard, Maastricht, Sittard, Heerlen, Sittard, Heerlen, Sittard]"
train_2,"[Vlissingen, Roosendaal, Vlissingen]"
train_3,"[Apeldoorn, Zutphen, Dieren, Arnhem Centraal, Ede-Wageningen, Utrecht Centraal, Amsterdam Centraal, Almere Centrum, Amsterdam Centraal, Utrecht Centraal]"
train_4,"[Hoorn, Zaandam, Castricum, Beverwijk, Zaandam, Beverwijk, Zaandam, Beverwijk, Haarlem, Heemstede-Aerdenhout, Haarlem]"
train_5,"[Deventer, Almelo, Hengelo, Enschede, Hengelo, Almelo, Hengelo, Enschede, Hengelo, Almelo, Zwolle, Deventer, Zutphen]"
train_6,"[Heerenveen, Leeuwarden, Heerenveen, Leeuwarden, Heerenveen, Leeuwarden, Groningen, Leeuwarden]"
train_7,"[Alkmaar, Castricum, Alkmaar, Hoorn, Alkmaar, Hoorn, Zaandam, Hoorn, Zaandam]"
train_8,"[Castricum, Beverwijk, Haarlem, Beverwijk, Haarlem, Heemstede-Aerdenhout, Haarlem, Beverwijk, Castricum, Beverwijk, Zaandam, Hoorn]"
train_9,"[Zutphen, Deventer, Zwolle, Steenwijk, Heerenveen, Leeuwarden, Groningen, Assen, Groningen]"
train_10,"[Amersfoort, Zwolle, Steenwijk, Heerenveen, Steenwijk, Heerenveen, Leeuwarden, Heerenveen, Leeuwarden, Heerenveen, Steenwijk]"
train_11,"[Roosendaal, Vlissingen, Roosendaal]"
train_12,"[Arnhem Centraal, Nijmegen, Oss, Nijmegen, Arnhem Centraal, Ede-Wageningen, Arnhem Centraal, Nijmegen, Oss, s-Hertogenbosch, Tilburg, Eindhoven, Weert]"
train_13,"[Amsterdam Amstel, Utrecht Centraal, Schiphol Airport, Utrecht Centraal, Amersfoort, Zwolle, Steenwijk]"
train_14,"[Leiden Centraal, Den Haag Centraal, Leiden Centraal, Alphen a/d Rijn, Leiden Centraal, Schiphol Airport, Leiden Centraal, Schiphol Airport, Utrecht Centraal, Alphen a/d Rijn]"
train_15,"[Zwolle, Assen, Groningen, Leeuwarden, Groningen, Assen]"
train_16,"[Castricum, Zaandam, Castricum, Beverwijk, Castricum, Alkmaar, Den Helder, Alkmaar, Castricum, Zaandam, Beverwijk]"
train_17,"[Almelo, Deventer, Almelo, Deventer, Zutphen, Dieren, Zutphen, Deventer, Almelo, Zwolle]"
train_18,"[Den Haag HS, Delft, Den Haag Laan v NOI, Gouda, Den Haag HS, Gouda, Den Haag HS, Delft, Den Haag HS, Leiden Centraal, Den Haag Laan v NOI, Delft, Schiedam Centrum, Delft]"
train_19,"[Assen, Groningen, Assen, Zwolle, Almelo, Deventer, Zutphen, Deventer, Zutphen]"
train_20,"[Venlo, Helmond, Eindhoven, Tilburg, Breda, Dordrecht, Rotterdam Blaak, Schiedam Centrum, Delft, Den Haag Centraal, Leiden Centraal, Schiphol Airport, Leiden Centraal]"
score,1459.5730337078649
