train,stations
train_1,"[Amsterdam Centraal, Utrecht Centraal, s-Hertogenbosch, Oss, s-Hertogenbosch, Utrecht Centraal, Amersfoort, Utrecht Centraal, Gouda, Rotterdam Alexander, Rotterdam Blaak, Schiedam Centrum]"
train_2,"[Amsterdam Centraal, Almere Centrum, Hilversum, Utrecht Centraal, Gouda, Den Haag Laan v NOI, Delft, Den Haag Laan v NOI, Gouda, Alphen a/d Rijn]"
train_3,"[Heemstede-Aerdenhout, Haarlem, Heemstede-Aerdenhout, Leiden Centraal, Den Haag HS, Gouda, Rotterdam Alexander, Gouda, Rotterdam Alexander, Rotterdam Blaak, Schiedam Centrum, Rotterdam Blaak, Schiedam Centrum, Rotterdam Centraal, Rotterdam Alexander, Gouda, Alphen a/d Rijn]"
train_4,"[Den Haag Centraal, Delft, Den Haag HS, Leiden Centraal, Den Haag Laan v NOI, Gouda, Den Haag Centraal, Delft, Den Haag Laan v NOI, Delft, Schiedam Centrum, Rotterdam Blaak, Dordrecht, Roosendaal]"
train_5,"[Amsterdam Zuid, Schiphol Airport, Amsterdam Zuid, Amsterdam Sloterdijk, Amsterdam Zuid, Amsterdam Amstel, Amsterdam Centraal, Amsterdam Sloterdijk, Amsterdam Centraal, Utrecht Centraal, Amsterdam Centraal, Amsterdam Amstel, Amsterdam Zuid, Schiphol Airport, Amsterdam Zuid, Amsterdam Sloterdijk]"
train_6,"[Zutphen, Apeldoorn, Amersfoort, Utrecht Centraal, Alphen a/d Rijn, Leiden Centraal, Alphen a/d Rijn, Leiden Centraal, Den Haag Centraal, Gouda, Rotterdam Alexander, Rotterdam Centraal]"
train_7,"[Zutphen, Dieren, Zutphen, Deventer, Apeldoorn, Amersfoort, Zwolle, Assen, Zwolle]"
train_8,"[Leiden Centraal, Alphen a/d Rijn, Gouda, Den Haag Centraal, Delft, Den Haag HS, Delft, Den Haag HS, Delft, Den Haag Centraal, Leiden Centraal, Heemstede-Aerdenhout, Leiden Centraal, Den Haag HS]"
train_9,"[Tilburg, Breda, Dordrecht, Roosendaal, Dordrecht, Rotterdam Blaak, Rotterdam Alexander, Gouda, Den Haag Centraal, Gouda, Den Haag Laan v NOI]"
train_10,"[Roosendaal, Vlissingen, Roosendaal, Dordrecht, Rotterdam Centraal]"
train_11,"[Den Haag Laan v NOI, Gouda, Den Haag HS, Gouda, Den Haag Centraal, Leiden Centraal, Alphen a/d Rijn, Gouda, Den Haag HS, Gouda]"
train_12,"[Rotterdam Blaak, Rotterdam Alexander, Gouda, Den Haag Centraal, Gouda, Den Haag Centraal, Gouda, Den Haag Laan v NOI, Delft, Schiedam Centrum, Rotterdam Centraal, Dordrecht]"
train_13,"[Heerenveen, Leeuwarden, Groningen, Assen, Groningen, Leeuwarden, Groningen, Assen]"
train_14,"[Zaandam, Beverwijk, Zaandam, Castricum, Zaandam, Beverwijk, Haarlem, Heemstede-Aerdenhout, Haarlem, Beverwijk, Haarlem, Beverwijk]"
train_15,"[Venlo, Helmond, Eindhoven, Helmond, Eindhoven, Tilburg, s-Hertogenbosch, Utrecht Centraal, Ede-Wageningen, Arnhem Centraal, Ede-Wageningen, Arnhem Centraal]"
train_16,"[Leiden Centraal, Alphen a/d Rijn, Leiden Centraal, Den Haag HS, Gouda, Den Haag Laan v NOI, Leiden Centraal, Heemstede-Aerdenhout, Haarlem, Beverwijk, Castricum, Beverwijk]"
train_17,"[Sittard, Roermond, Weert, Eindhoven, Helmond, Venlo, Helmond, Venlo, Helmond]"
train_18,"[Rotterdam Centraal, Rotterdam Alexander, Rotterdam Blaak, Schiedam Centrum, Rotterdam Blaak, Schiedam Centrum, Rotterdam Centraal, Schiedam Centrum, Delft, Den Haag Laan v NOI, Gouda, Den Haag HS, Delft, Den Haag Laan v NOI, Gouda]"
train_19,"[Delft, Den Haag Laan v NOI, Leiden Centraal, Den Haag Laan v NOI, Delft, Den Haag Laan v NOI, Delft, Den Haag Centraal, Delft, Den Haag HS, Delft, Den Haag Centraal, Gouda, Den Haag HS, Leiden Centraal]"
train_20,"[Roermond, Weert, Eindhoven, s-Hertogenbosch, Tilburg, s-Hertogenbosch, Tilburg, Eindhoven, s-Hertogenbosch, Eindhoven, Weert]"
score,1614.651685393258
