train,stations
train_1,"[Zaandam, Amsterdam Sloterdijk, Zaandam, Castricum, Beverwijk, Castricum, Beverwijk, Haarlem, Beverwijk, Haarlem, Beverwijk, Castricum, Zaandam, Hoorn]"
train_2,"[s-Hertogenbosch, Tilburg, s-Hertogenbosch, Tilburg, Breda, Etten-Leur, Roosendaal, Dordrecht, Roosendaal]"
train_3,"[Apeldoorn, Zutphen, Deventer, Zwolle, Steenwijk, Heerenveen, Leeuwarden, Groningen]"
train_4,"[Amsterdam Zuid, Schiphol Airport, Amsterdam Zuid, Amsterdam Sloterdijk, Amsterdam Centraal, Amsterdam Amstel, Amsterdam Zuid, Schiphol Airport, Amsterdam Zuid, Schiphol Airport, Utrecht Centraal, Schiphol Airport, Leiden Centraal, Den Haag HS]"
train_5,"[Hilversum, Utrecht Centraal, Alphen a/d Rijn, Gouda, Alphen a/d Rijn, Utrecht Centraal, Hilversum, Amsterdam Amstel, Amsterdam Zuid, Amsterdam Sloterdijk]"
train_6,"[Oss, s-Hertogenbosch, Utrecht Centraal, Hilversum, Almere Centrum, Amsterdam Centraal, Amsterdam Amstel, Amsterdam Zuid, Schiphol Airport, Utrecht Centraal]"
train_7,"[Beverwijk, Zaandam, Beverwijk, Zaandam, Amsterdam Sloterdijk, Amsterdam Zuid, Amsterdam Amstel, Almere Centrum, Amsterdam Centraal]"
train_8,"[Etten-Leur, Roosendaal, Dordrecht, Rotterdam Blaak, Schiedam Centrum, Rotterdam Blaak, Dordrecht, Rotterdam Centraal, Dordrecht, Rotterdam Blaak, Rotterdam Alexander, Rotterdam Centraal, Rotterdam Alexander, Gouda]"
train_9,"[Nijmegen, Oss, Nijmegen, Oss, s-Hertogenbosch, Eindhoven, Helmond, Venlo, Helmond, Venlo]"
train_10,"[Den Haag HS, Delft, Den Haag HS, Gouda, Utrecht Centraal, Schiphol Airport, Leiden Centraal, Heemstede-Aerdenhout, Haarlem, Beverwijk, Haarlem, Heemstede-Aerdenhout, Haarlem]"
train_11,"[Hilversum, Almere Centrum, Lelystad Centrum, Almere Centrum, Lelystad Centrum, Almere Centrum, Hilversum, Amsterdam Amstel, Almere Centrum, Lelystad Centrum]"
train_12,"[Lelystad Centrum, Almere Centrum, Amsterdam Centraal, Amsterdam Amstel, Utrecht Centraal, Hilversum, Almere Centrum, Hilversum, Utrecht Centraal, s-Hertogenbosch]"
train_13,"[Etten-Leur, Breda, Dordrecht, Breda, Etten-Leur, Breda, Etten-Leur, Roosendaal, Etten-Leur, Roosendaal, Dordrecht, Rotterdam Blaak, Dordrecht, Rotterdam Centraal]"
train_14,"[Zaandam, Amsterdam Sloterdijk, Haarlem, Amsterdam Sloterdijk, Amsterdam Zuid, Schiphol Airport, Utrecht Centraal, s-Hertogenbosch, Eindhoven, Tilburg, Eindhoven]"
train_15,"[Roosendaal, Etten-Leur, Breda, Tilburg, s-Hertogenbosch, Oss, Nijmegen, Arnhem Centraal, Nijmegen, Oss, Nijmegen, Arnhem Centraal, Ede-Wageningen, Utrecht Centraal]"
train_16,"[Rotterdam Blaak, Dordrecht, Breda, Tilburg, Breda, Etten-Leur, Roosendaal, Etten-Leur, Roosendaal, Etten-Leur, Roosendaal]"
train_17,"[Amsterdam Centraal, Amsterdam Amstel, Amsterdam Zuid, Schiphol Airport, Amsterdam Zuid, Amsterdam Amstel, Utrecht Centraal, Amsterdam Centraal, Utrecht Centraal, s-Hertogenbosch, Eindhoven, Tilburg]"
train_18,"[Lelystad Centrum, Almere Centrum, Amsterdam Centraal, Utrecht Centraal, Hilversum, Amsterdam Amstel, Amsterdam Centraal, Amsterdam Sloterdijk, Haarlem, Beverwijk, Haarlem, Beverwijk]"
train_19,"[Den Haag Centraal, Leiden Centraal, Alphen a/d Rijn, Utrecht Centraal, Alphen a/d Rijn, Utrecht Centraal, Amsterdam Centraal, Amsterdam Sloterdijk, Amsterdam Centraal, Amsterdam Sloterdijk, Amsterdam Centraal]"
train_20,"[Amsterdam Zuid, Amsterdam Amstel, Almere Centrum, Lelystad Centrum, Almere Centrum, Amsterdam Amstel, Hilversum, Almere Centrum, Amsterdam Centraal, Amsterdam Sloterdijk, Zaandam]"
score,1545.9325842696626
