train,stations
train_1,"[Alkmaar, Castricum, Zaandam, Hoorn, Zaandam, Castricum, Alkmaar, Den Helder, Alkmaar]"
train_2,"[Helmond, Eindhoven, Weert, Eindhoven, s-Hertogenbosch, Eindhoven, Tilburg, Eindhoven, Helmond, Venlo]"
train_3,"[Leeuwarden, Groningen, Leeuwarden, Heerenveen, Steenwijk, Heerenveen, Leeuwarden, Heerenveen, Steenwijk, Heerenveen]"
train_4,"[Vlissingen, Roosendaal, Vlissingen]"
train_5,"[Ede-Wageningen, Utrecht Centraal, s-Hertogenbosch, Tilburg, Breda, Dordrecht, Rotterdam Blaak, Dordrecht, Breda, Dordrecht, Breda]"
train_6,"[Gouda, Den Haag Centraal, Gouda, Utrecht Centraal, Ede-Wageningen, Arnhem Centraal, Ede-Wageningen, Utrecht Centraal, Gouda, Den Haag Centraal, Leiden Centraal]"
train_7,"[Hoorn, Alkmaar, Den Helder, Alkmaar, Castricum, Zaandam, Castricum, Alkmaar, Hoorn]"
train_8,"[Amsterdam Amstel, Amsterdam Centraal, Amsterdam Sloterdijk, Amsterdam Centraal, Almere Centrum, Amsterdam Centraal, Amsterdam Sloterdijk, Amsterdam Centraal, Amsterdam Sloterdijk, Amsterdam Zuid, Schiphol Airport, Leiden Centraal, Schiphol Airport, Amsterdam Zuid, Amsterdam Sloterdijk, Haarlem, Heemstede-Aerdenhout, Haarlem]"
train_9,"[Apeldoorn, Zutphen, Apeldoorn, Deventer, Zutphen, Apeldoorn, Amersfoort, Utrecht Centraal, Alphen a/d Rijn, Utrecht Centraal]"
train_10,"[Rotterdam Centraal, Rotterdam Alexander, Rotterdam Centraal, Schiedam Centrum, Rotterdam Blaak, Dordrecht, Breda, Dordrecht, Breda, Etten-Leur, Breda, Tilburg, Eindhoven, Helmond, Eindhoven]"
train_11,"[Dieren, Zutphen, Deventer, Zwolle, Amersfoort, Utrecht Centraal, s-Hertogenbosch, Oss, Nijmegen, Oss, s-Hertogenbosch]"
train_12,"[Tilburg, Breda, Tilburg, Breda, Dordrecht, Breda, Dordrecht, Rotterdam Centraal, Schiedam Centrum, Rotterdam Centraal, Schiedam Centrum, Rotterdam Blaak, Rotterdam Alexander, Rotterdam Blaak, Dordrecht]"
train_13,"[s-Hertogenbosch, Tilburg, Breda, Dordrecht, Rotterdam Blaak, Schiedam Centrum, Rotterdam Blaak, Dordrecht, Roosendaal, Etten-Leur, Breda, Tilburg, Breda, Tilburg]"
train_14,"[Schiphol Airport, Utrecht Centraal, Ede-Wageningen, Arnhem Centraal, Dieren, Zutphen, Deventer, Zutphen, Apeldoorn, Amersfoort, Apeldoorn]"
train_15,"[Arnhem Centraal, Nijmegen, Oss, Nijmegen, Arnhem Centraal, Ede-Wageningen, Utrecht Centraal, Gouda, Utrecht Centraal, Amersfoort, Apeldoorn]"
train_16,"[Vlissingen, Roosendaal, Vlissingen]"
train_17,"[Almere Centrum, Amsterdam Amstel, Hilversum, Almere Centrum, Lelystad Centrum, Almere Centrum, Lelystad Centrum, Almere Centrum, Lelystad Centrum, Almere Centrum, Lelystad Centrum]"
train_18,"[Rotterdam Blaak, Rotterdam Alexander, Rotterdam Centraal, Rotterdam Alexander, Gouda, Den Haag Laan v NOI, Leiden Centraal, Den Haag Laan v NOI, Leiden Centraal, Schiphol Airport, Leiden Centraal, Den Haag Centraal, Gouda, Den Haag HS]"
train_19,"[Lelystad Centrum, Almere Centrum, Hilversum, Utrecht Centraal, Gouda, Den Haag Laan v NOI, Gouda, Den Haag Laan v NOI]"
train_20,"[Assen, Groningen, Assen, Groningen, Leeuwarden, Heerenveen, Leeuwarden, Groningen, Assen]"
score,1874.0112359550558
