train,stations
train_1,"[Deventer, Apeldoorn, Deventer, Apeldoorn, Deventer, Zwolle, Amersfoort, Apeldoorn, Deventer, Apeldoorn, Deventer, Almelo]"
train_2,"[Den Haag Laan v NOI, Delft, Den Haag Laan v NOI, Leiden Centraal, Den Haag Laan v NOI, Gouda, Den Haag HS, Delft, Den Haag Centraal, Gouda, Rotterdam Alexander, Rotterdam Centraal, Rotterdam Alexander, Gouda, Rotterdam Alexander]"
train_3,"[Roosendaal, Vlissingen, Roosendaal, Etten-Leur, Breda, Dordrecht, Rotterdam Centraal]"
train_4,"[Heerlen, Sittard, Roermond, Sittard, Heerlen, Sittard, Roermond, Sittard, Roermond, Sittard, Roermond, Sittard]"
train_5,"[Haarlem, Amsterdam Sloterdijk, Haarlem, Beverwijk, Haarlem, Beverwijk, Haarlem, Beverwijk, Haarlem, Amsterdam Sloterdijk, Amsterdam Zuid, Amsterdam Sloterdijk, Zaandam, Amsterdam Sloterdijk]"
train_6,"[Rotterdam Centraal, Schiedam Centrum, Rotterdam Centraal, Schiedam Centrum, Delft, Den Haag Laan v NOI, Gouda, Utrecht Centraal, Ede-Wageningen, Utrecht Centraal, Alphen a/d Rijn, Gouda]"
train_7,"[Enschede, Hengelo, Enschede, Hengelo, Enschede, Hengelo, Enschede, Hengelo, Almelo, Zwolle, Amersfoort, Zwolle]"
train_8,"[Dieren, Arnhem Centraal, Ede-Wageningen, Arnhem Centraal, Nijmegen, Arnhem Centraal, Ede-Wageningen, Arnhem Centraal, Ede-Wageningen, Arnhem Centraal, Ede-Wageningen, Utrecht Centraal, Amersfoort, Utrecht Centraal]"
train_9,"[Amsterdam Amstel, Almere Centrum, Amsterdam Amstel, Amsterdam Centraal, Amsterdam Sloterdijk, Haarlem, Amsterdam Sloterdijk, Amsterdam Zuid, Schiphol Airport, Utrecht Centraal, Ede-Wageningen]"
train_10,"[Den Haag HS, Leiden Centraal, Alphen a/d Rijn, Utrecht Centraal, Gouda, Utrecht Centraal, s-Hertogenbosch, Tilburg, s-Hertogenbosch, Oss, s-Hertogenbosch]"
train_11,"[Zwolle, Almelo, Deventer, Almelo, Zwolle, Deventer]"
train_12,"[Alkmaar, Den Helder, Alkmaar, Den Helder, Alkmaar]"
train_13,"[Zwolle, Almelo, Deventer, Zutphen, Deventer, Zutphen, Apeldoorn, Deventer, Almelo, Hengelo, Enschede]"
train_14,"[Amersfoort, Utrecht Centraal, s-Hertogenbosch, Utrecht Centraal, Alphen a/d Rijn, Leiden Centraal, Den Haag Centraal, Delft, Den Haag HS, Delft, Schiedam Centrum, Delft, Den Haag HS]"
train_15,"[Schiedam Centrum, Rotterdam Centraal, Schiedam Centrum, Rotterdam Centraal, Schiedam Centrum, Rotterdam Centraal, Dordrecht, Rotterdam Centraal, Rotterdam Alexander, Rotterdam Centraal, Schiedam Centrum, Rotterdam Centraal, Schiedam Centrum, Rotterdam Centraal, Schiedam Centrum, Delft, Den Haag HS, Delft, Den Haag HS, Gouda, Utrecht Centraal]"
train_16,"[Nijmegen, Oss, Nijmegen, Oss, s-Hertogenbosch, Oss, s-Hertogenbosch, Utrecht Centraal, Hilversum, Amsterdam Amstel, Almere Centrum]"
train_17,"[Den Haag Laan v NOI, Gouda, Den Haag HS, Delft, Den Haag Laan v NOI, Gouda, Rotterdam Alexander, Gouda, Alphen a/d Rijn, Gouda, Den Haag Centraal]"
train_18,"[Arnhem Centraal, Dieren, Zutphen, Dieren, Zutphen, Dieren, Arnhem Centraal, Nijmegen, Oss, Nijmegen, Oss, s-Hertogenbosch, Utrecht Centraal, Hilversum]"
train_19,"[Schiedam Centrum, Rotterdam Centraal, Dordrecht, Rotterdam Centraal, Dordrecht, Breda, Tilburg, Eindhoven, Weert, Eindhoven, Tilburg, Breda]"
train_20,"[Rotterdam Blaak, Schiedam Centrum, Rotterdam Blaak, Dordrecht, Roosendaal, Dordrecht, Rotterdam Centraal, Schiedam Centrum, Rotterdam Blaak, Dordrecht, Breda, Etten-Leur, Breda, Dordrecht]"
score,1483.2921348314612
