train,stations
train_1,"[Leeuwarden, Heerenveen, Steenwijk, Zwolle, Deventer, Apeldoorn, Zutphen, Deventer, Zwolle]"
train_2,"[Hoorn, Zaandam, Beverwijk, Zaandam, Hoorn, Alkmaar, Den Helder]"
train_3,"[Rotterdam Blaak, Schiedam Centrum, Rotterdam Blaak, Dordrecht, Roosendaal, Dordrecht, Rotterdam Blaak, Rotterdam Alexander, Rotterdam Blaak, Schiedam Centrum, Delft, Den Haag HS, Leiden Centraal, Den Haag Centraal, Leiden Centraal]"
train_4,"[Almelo, Zwolle, Assen, Zwolle, Amersfoort]"
train_5,"[Amersfoort, Apeldoorn, Zutphen, Dieren, Zutphen, Dieren, Arnhem Centraal, Dieren, Arnhem Centraal, Nijmegen, Arnhem Centraal, Dieren, Arnhem Centraal, Dieren, Zutphen]"
train_6,"[Amsterdam Amstel, Almere Centrum, Amsterdam Centraal, Utrecht Centraal, Amsterdam Amstel, Almere Centrum, Lelystad Centrum, Almere Centrum, Hilversum]"
train_7,"[Amsterdam Centraal, Amsterdam Sloterdijk, Haarlem, Beverwijk, Haarlem, Heemstede-Aerdenhout, Haarlem, Beverwijk, Castricum, Beverwijk, Zaandam, Castricum, Alkmaar]"
train_8,"[Ede-Wageningen, Arnhem Centraal, Nijmegen, Oss, s-Hertogenbosch, Utrecht Centraal, Ede-Wageningen, Utrecht Centraal, Ede-Wageningen, Utrecht Centraal]"
train_9,"[Den Haag HS, Gouda, Den Haag Centraal, Delft, Schiedam Centrum, Delft, Den Haag Centraal, Delft, Den Haag HS, Gouda, Den Haag HS, Leiden Centraal, Den Haag HS, Delft]"
train_10,"[Vlissingen, Roosendaal, Etten-Leur, Roosendaal, Etten-Leur, Roosendaal, Vlissingen]"
train_11,"[Lelystad Centrum, Almere Centrum, Amsterdam Centraal, Almere Centrum, Lelystad Centrum, Almere Centrum, Amsterdam Centraal, Utrecht Centraal, Gouda, Alphen a/d Rijn]"
train_12,"[Heerenveen, Steenwijk, Heerenveen, Steenwijk, Heerenveen, Leeuwarden, Groningen, Leeuwarden, Groningen]"
train_13,"[Helmond, Eindhoven, Weert, Roermond, Sittard, Heerlen, Sittard, Heerlen, Sittard, Roermond, Weert, Eindhoven, s-Hertogenbosch]"
train_14,"[Groningen, Assen, Groningen, Leeuwarden, Heerenveen, Leeuwarden, Groningen, Assen]"
train_15,"[Beverwijk, Haarlem, Amsterdam Sloterdijk, Haarlem, Amsterdam Sloterdijk, Amsterdam Zuid, Amsterdam Amstel, Amsterdam Zuid, Amsterdam Sloterdijk, Amsterdam Zuid, Amsterdam Sloterdijk, Amsterdam Zuid, Schiphol Airport, Leiden Centraal]"
train_16,"[Gouda, Den Haag Laan v NOI, Leiden Centraal, Den Haag HS, Gouda, Den Haag Centraal, Leiden Centraal, Den Haag Centraal, Delft, Den Haag HS, Delft, Den Haag Laan v NOI, Leiden Centraal, Den Haag HS]"
train_17,"[Beverwijk, Zaandam, Hoorn, Alkmaar, Den Helder, Alkmaar]"
train_18,"[Haarlem, Amsterdam Sloterdijk, Zaandam, Beverwijk, Haarlem, Amsterdam Sloterdijk, Zaandam, Beverwijk, Haarlem, Heemstede-Aerdenhout, Leiden Centraal, Schiphol Airport]"
train_19,"[Amsterdam Amstel, Amsterdam Centraal, Amsterdam Amstel, Utrecht Centraal, Alphen a/d Rijn, Leiden Centraal, Den Haag Centraal, Delft, Schiedam Centrum, Delft, Den Haag Centraal, Delft, Schiedam Centrum, Delft, Den Haag Centraal]"
train_20,"[Zaandam, Amsterdam Sloterdijk, Amsterdam Zuid, Schiphol Airport, Amsterdam Zuid, Schiphol Airport, Utrecht Centraal, Amsterdam Centraal, Amsterdam Amstel, Almere Centrum, Lelystad Centrum, Almere Centrum]"
score,2793.8876404494376
