train,stations
train_1,"[Hoorn, Zaandam, Hoorn, Zaandam, Hoorn, Zaandam, Hoorn]"
train_2,"[Hoorn, Alkmaar, Hoorn, Zaandam, Beverwijk, Haarlem, Heemstede-Aerdenhout, Haarlem, Amsterdam Sloterdijk, Zaandam, Amsterdam Sloterdijk, Haarlem, Amsterdam Sloterdijk, Zaandam]"
train_3,"[Leiden Centraal, Den Haag Centraal, Leiden Centraal, Alphen a/d Rijn, Utrecht Centraal, s-Hertogenbosch, Eindhoven, Weert, Roermond, Weert, Eindhoven]"
train_4,"[Apeldoorn, Deventer, Zwolle, Assen, Groningen, Assen, Zwolle, Deventer]"
train_5,"[Apeldoorn, Zutphen, Apeldoorn, Deventer, Apeldoorn, Amersfoort, Apeldoorn, Amersfoort, Zwolle]"
train_6,"[Utrecht Centraal, Schiphol Airport, Leiden Centraal, Alphen a/d Rijn, Leiden Centraal, Schiphol Airport, Leiden Centraal, Schiphol Airport, Amsterdam Zuid, Amsterdam Sloterdijk, Zaandam, Castricum, Zaandam, Amsterdam Sloterdijk]"
train_7,"[Almelo, Hengelo, Enschede, Hengelo, Almelo, Hengelo, Enschede, Hengelo, Almelo, Deventer, Zutphen, Deventer, Zwolle, Steenwijk, Heerenveen]"
train_8,"[Heerenveen, Steenwijk, Zwolle, Deventer, Almelo, Zwolle, Amersfoort]"
train_9,"[Utrecht Centraal, Amersfoort, Apeldoorn, Deventer, Zwolle, Assen, Zwolle]"
train_10,"[Castricum, Alkmaar, Hoorn, Alkmaar, Hoorn, Zaandam, Amsterdam Sloterdijk, Amsterdam Zuid, Amsterdam Sloterdijk, Amsterdam Centraal, Amsterdam Amstel, Utrecht Centraal]"
train_11,"[Almelo, Zwolle, Amersfoort, Utrecht Centraal, s-Hertogenbosch, Tilburg, Eindhoven, s-Hertogenbosch]"
train_12,"[Weert, Roermond, Weert, Eindhoven, Weert, Roermond, Sittard, Roermond, Weert, Roermond, Weert, Eindhoven]"
train_13,"[Rotterdam Blaak, Schiedam Centrum, Rotterdam Blaak, Dordrecht, Roosendaal, Vlissingen]"
train_14,"[Hilversum, Utrecht Centraal, Gouda, Alphen a/d Rijn, Utrecht Centraal, Amsterdam Amstel, Amsterdam Zuid, Amsterdam Amstel, Almere Centrum, Hilversum]"
train_15,"[Roosendaal, Vlissingen, Roosendaal]"
train_16,"[Rotterdam Centraal, Rotterdam Alexander, Rotterdam Centraal, Dordrecht, Roosendaal, Dordrecht, Roosendaal, Vlissingen]"
train_17,"[Dieren, Arnhem Centraal, Nijmegen, Arnhem Centraal, Ede-Wageningen, Arnhem Centraal, Ede-Wageningen, Arnhem Centraal, Ede-Wageningen, Utrecht Centraal, Alphen a/d Rijn, Utrecht Centraal]"
train_18,"[Almelo, Deventer, Zwolle, Amersfoort, Apeldoorn, Zutphen, Apeldoorn, Amersfoort]"
train_19,"[Schiphol Airport, Utrecht Centraal, Amersfoort, Utrecht Centraal, Hilversum, Utrecht Centraal, Amsterdam Amstel, Amsterdam Centraal, Utrecht Centraal, Amsterdam Amstel]"
train_20,"[Zaandam, Castricum, Zaandam, Beverwijk, Zaandam, Beverwijk, Haarlem, Amsterdam Sloterdijk, Haarlem, Beverwijk, Haarlem]"
score,1232.8539325842703
