train,stations
train_1,"[Helmond, Eindhoven, s-Hertogenbosch, Tilburg, Breda, Dordrecht, Roosendaal, Dordrecht, Rotterdam Centraal, Schiedam Centrum, Rotterdam Blaak, Dordrecht, Rotterdam Blaak]"
train_2,"[Enschede, Hengelo, Enschede, Hengelo, Enschede, Hengelo, Almelo, Deventer, Zwolle, Amersfoort, Apeldoorn, Deventer]"
train_3,"[s-Hertogenbosch, Tilburg, s-Hertogenbosch, Oss, Nijmegen, Arnhem Centraal, Dieren, Zutphen, Apeldoorn, Deventer, Zwolle, Amersfoort]"
train_4,"[Lelystad Centrum, Almere Centrum, Lelystad Centrum, Almere Centrum, Amsterdam Amstel, Amsterdam Zuid, Amsterdam Amstel, Utrecht Centraal, Alphen a/d Rijn, Leiden Centraal, Den Haag HS, Delft, Den Haag HS]"
train_5,"[Den Helder, Alkmaar, Den Helder, Alkmaar, Castricum, Beverwijk, Zaandam, Amsterdam Sloterdijk, Amsterdam Centraal]"
train_6,"[Amsterdam Centraal, Amsterdam Amstel, Hilversum, Amsterdam Amstel, Amsterdam Centraal, Utrecht Centraal, Hilversum, Almere Centrum, Lelystad Centrum, Almere Centrum]"
train_7,"[Sittard, Roermond, Weert, Roermond, Weert, Eindhoven, Tilburg, Breda, Dordrecht, Roosendaal, Etten-Leur, Roosendaal]"
train_8,"[Oss, s-Hertogenbosch, Utrecht Centraal, s-Hertogenbosch, Eindhoven, s-Hertogenbosch, Tilburg, Eindhoven, Weert, Roermond]"
train_9,"[s-Hertogenbosch, Eindhoven, Helmond, Venlo, Helmond, Venlo, Helmond, Venlo]"
train_10,"[Lelystad Centrum, Almere Centrum, Amsterdam Centraal, Amsterdam Amstel, Utrecht Centraal, Schiphol Airport, Leiden Centraal, Den Haag Centraal, Gouda, Alphen a/d Rijn]"
train_11,"[Alkmaar, Hoorn, Zaandam, Hoorn, Zaandam, Hoorn, Alkmaar, Hoorn]"
train_12,"[Hengelo, Enschede, Hengelo, Almelo, Zwolle, Steenwijk, Zwolle, Assen]"
train_13,"[Hilversum, Utrecht Centraal, Amsterdam Amstel, Almere Centrum, Amsterdam Amstel, Amsterdam Centraal, Utrecht Centraal, Hilversum, Amsterdam Amstel]"
train_14,"[Amsterdam Amstel, Amsterdam Zuid, Schiphol Airport, Leiden Centraal, Schiphol Airport, Utrecht Centraal, Gouda, Den Haag Centraal, Leiden Centraal, Den Haag Laan v NOI, Gouda]"
train_15,"[Eindhoven, Helmond, Eindhoven, Weert, Eindhoven, Weert, Eindhoven, s-Hertogenbosch, Eindhoven, Helmond, Eindhoven, Tilburg, Breda]"
train_16,"[Enschede, Hengelo, Almelo, Zwolle, Steenwijk, Zwolle, Steenwijk, Heerenveen, Leeuwarden]"
train_17,"[Nijmegen, Arnhem Centraal, Ede-Wageningen, Utrecht Centraal, Ede-Wageningen, Arnhem Centraal, Ede-Wageningen, Arnhem Centraal, Ede-Wageningen, Utrecht Centraal, Amersfoort, Utrecht Centraal]"
train_18,"[Lelystad Centrum, Almere Centrum, Amsterdam Centraal, Almere Centrum, Amsterdam Amstel, Utrecht Centraal, Amersfoort, Utrecht Centraal, Amersfoort, Utrecht Centraal, Amsterdam Amstel]"
train_19,"[Schiedam Centrum, Rotterdam Blaak, Rotterdam Alexander, Gouda, Den Haag Centraal, Gouda, Rotterdam Alexander, Rotterdam Blaak, Schiedam Centrum, Delft, Schiedam Centrum, Rotterdam Blaak, Schiedam Centrum, Rotterdam Centraal, Rotterdam Alexander, Gouda, Den Haag Centraal]"
train_20,"[Rotterdam Blaak, Rotterdam Alexander, Rotterdam Centraal, Dordrecht, Breda, Tilburg, Eindhoven, Helmond, Venlo, Helmond]"
score,2838.2471910112363
