train,stations
train_1,"[Nijmegen, Arnhem Centraal, Dieren, Zutphen, Dieren, Arnhem Centraal, Ede-Wageningen, Arnhem Centraal, Dieren, Zutphen, Dieren, Zutphen, Dieren, Arnhem Centraal, Ede-Wageningen, Arnhem Centraal, Dieren, Zutphen]"
train_2,"[Weert, Roermond, Sittard, Maastricht, Sittard, Roermond, Sittard, Roermond, Sittard, Maastricht, Sittard, Maastricht, Sittard]"
train_3,"[Lelystad Centrum, Almere Centrum, Amsterdam Centraal, Almere Centrum, Hilversum, Amsterdam Amstel, Almere Centrum, Amsterdam Amstel, Amsterdam Zuid]"
train_4,"[Eindhoven, Helmond, Eindhoven, Tilburg, Eindhoven, Weert, Roermond, Sittard, Maastricht, Sittard, Maastricht, Sittard]"
train_5,"[Alphen a/d Rijn, Utrecht Centraal, Schiphol Airport, Leiden Centraal, Den Haag Centraal, Leiden Centraal, Den Haag Centraal, Delft, Den Haag HS, Gouda, Rotterdam Alexander, Rotterdam Centraal]"
train_6,"[Sittard, Maastricht, Sittard, Roermond, Weert, Eindhoven, Tilburg, Breda, Etten-Leur, Breda, Tilburg, s-Hertogenbosch, Utrecht Centraal]"
train_7,"[Sittard, Roermond, Weert, Eindhoven, Helmond, Venlo, Helmond, Venlo, Helmond]"
train_8,"[Haarlem, Beverwijk, Castricum, Beverwijk, Haarlem, Beverwijk, Zaandam, Castricum, Alkmaar, Hoorn, Zaandam]"
train_9,"[Den Haag Laan v NOI, Leiden Centraal, Alphen a/d Rijn, Utrecht Centraal, Amersfoort, Utrecht Centraal, s-Hertogenbosch, Eindhoven, Weert, Eindhoven, Weert]"
train_10,"[Delft, Den Haag Centraal, Leiden Centraal, Den Haag Centraal, Delft, Den Haag Centraal, Gouda, Utrecht Centraal, Alphen a/d Rijn, Leiden Centraal, Den Haag Laan v NOI, Leiden Centraal, Den Haag Centraal]"
train_11,"[Sittard, Maastricht, Sittard, Roermond, Weert, Roermond, Sittard, Roermond, Weert, Roermond, Sittard, Roermond, Sittard]"
train_12,"[Venlo, Helmond, Venlo, Helmond, Venlo, Helmond, Eindhoven]"
train_13,"[Den Haag HS, Gouda, Den Haag Centraal, Delft, Den Haag HS, Leiden Centraal, Alphen a/d Rijn, Leiden Centraal, Alphen a/d Rijn, Utrecht Centraal, Hilversum]"
train_14,"[Steenwijk, Heerenveen, Leeuwarden, Groningen, Leeuwarden, Groningen, Leeuwarden]"
train_15,"[Ede-Wageningen, Arnhem Centraal, Dieren, Zutphen, Dieren, Zutphen, Apeldoorn, Deventer, Almelo, Deventer, Zutphen, Apeldoorn]"
train_16,"[Tilburg, s-Hertogenbosch, Tilburg, s-Hertogenbosch, Utrecht Centraal, Hilversum, Utrecht Centraal, Gouda, Den Haag Centraal, Leiden Centraal, Schiphol Airport]"
train_17,"[Weert, Eindhoven, Tilburg, s-Hertogenbosch, Tilburg, Breda, Dordrecht, Rotterdam Blaak, Schiedam Centrum, Rotterdam Blaak, Rotterdam Alexander, Gouda, Utrecht Centraal]"
train_18,"[Haarlem, Beverwijk, Castricum, Zaandam, Hoorn, Alkmaar, Castricum, Beverwijk, Zaandam, Beverwijk, Haarlem]"
train_19,"[Nijmegen, Arnhem Centraal, Nijmegen, Arnhem Centraal, Nijmegen, Oss, s-Hertogenbosch, Eindhoven, Helmond, Eindhoven, s-Hertogenbosch, Utrecht Centraal]"
train_20,"[Assen, Zwolle, Deventer, Zutphen, Deventer, Apeldoorn, Amersfoort, Utrecht Centraal, Gouda, Rotterdam Alexander, Rotterdam Centraal]"
score,1465.2921348314612
