train,stations
train_1,"[Amsterdam Amstel, Amsterdam Centraal, Utrecht Centraal, s-Hertogenbosch, Oss, Nijmegen, Arnhem Centraal, Dieren, Zutphen, Dieren, Arnhem Centraal, Dieren, Zutphen, Deventer]"
train_2,"[Leiden Centraal, Den Haag Laan v NOI, Leiden Centraal, Den Haag Centraal, Gouda, Den Haag Laan v NOI, Gouda, Alphen a/d Rijn, Leiden Centraal, Den Haag HS, Gouda]"
train_3,"[s-Hertogenbosch, Tilburg, Breda, Etten-Leur, Breda, Dordrecht, Roosendaal, Vlissingen]"
train_4,"[Maastricht, Sittard, Roermond, Weert, Eindhoven, Tilburg, Eindhoven, Tilburg, Eindhoven, Helmond]"
train_5,"[Weert, Eindhoven, s-Hertogenbosch, Tilburg, Eindhoven, Tilburg, Eindhoven, Tilburg, Eindhoven, Weert]"
train_6,"[Utrecht Centraal, Amsterdam Amstel, Almere Centrum, Lelystad Centrum, Almere Centrum, Hilversum, Utrecht Centraal, s-Hertogenbosch, Oss, Nijmegen]"
train_7,"[Deventer, Almelo, Hengelo, Almelo, Zwolle, Steenwijk, Zwolle, Steenwijk]"
train_8,"[Rotterdam Alexander, Rotterdam Blaak, Schiedam Centrum, Rotterdam Centraal, Dordrecht, Roosendaal, Dordrecht, Rotterdam Blaak, Rotterdam Alexander, Rotterdam Centraal, Dordrecht, Breda, Tilburg, Breda]"
train_9,"[Zutphen, Deventer, Almelo, Deventer, Almelo, Deventer, Zwolle, Deventer]"
train_10,"[Roermond, Weert, Eindhoven, Helmond, Eindhoven, Tilburg, s-Hertogenbosch, Tilburg, Eindhoven, Weert, Eindhoven, Helmond]"
train_11,"[Etten-Leur, Roosendaal, Dordrecht, Roosendaal, Etten-Leur, Breda, Tilburg, Eindhoven, Tilburg, s-Hertogenbosch, Oss, s-Hertogenbosch]"
train_12,"[Rotterdam Centraal, Dordrecht, Breda, Etten-Leur, Roosendaal, Etten-Leur, Roosendaal, Etten-Leur, Breda, Dordrecht, Roosendaal]"
train_13,"[Weert, Roermond, Sittard, Heerlen, Sittard, Maastricht, Sittard, Roermond, Sittard, Heerlen, Sittard, Maastricht, Sittard]"
train_14,"[Leiden Centraal, Heemstede-Aerdenhout, Leiden Centraal, Den Haag HS, Gouda, Den Haag Laan v NOI, Leiden Centraal, Den Haag HS, Leiden Centraal, Schiphol Airport, Leiden Centraal, Schiphol Airport]"
train_15,"[Arnhem Centraal, Dieren, Arnhem Centraal, Nijmegen, Oss, Nijmegen, Arnhem Centraal, Ede-Wageningen, Arnhem Centraal, Dieren, Arnhem Centraal, Nijmegen, Arnhem Centraal, Dieren, Zutphen, Dieren]"
train_16,"[Amersfoort, Zwolle, Amersfoort, Apeldoorn, Zutphen, Deventer, Almelo, Deventer]"
train_17,"[Alphen a/d Rijn, Utrecht Centraal, Schiphol Airport, Amsterdam Zuid, Schiphol Airport, Amsterdam Zuid, Schiphol Airport, Leiden Centraal, Den Haag HS, Leiden Centraal, Alphen a/d Rijn, Utrecht Centraal]"
train_18,"[Zwolle, Assen, Zwolle, Amersfoort, Utrecht Centraal, Amsterdam Amstel, Amsterdam Zuid, Amsterdam Sloterdijk]"
train_19,"[Leiden Centraal, Schiphol Airport, Amsterdam Zuid, Schiphol Airport, Amsterdam Zuid, Amsterdam Sloterdijk, Amsterdam Centraal, Amsterdam Amstel, Amsterdam Zuid, Amsterdam Sloterdijk, Haarlem, Amsterdam Sloterdijk, Zaandam, Beverwijk, Castricum, Alkmaar]"
train_20,"[Hengelo, Enschede, Hengelo, Almelo, Zwolle, Almelo, Zwolle]"
score,2397.8089887640454
