train,stations
train_1,"[Utrecht Centraal, Hilversum, Almere Centrum, Amsterdam Amstel, Amsterdam Centraal, Amsterdam Amstel, Utrecht Centraal, Amsterdam Centraal, Utrecht Centraal]"
train_2,"[Heerenveen, Steenwijk, Zwolle, Steenwijk, Heerenveen, Leeuwarden, Heerenveen, Leeuwarden, Groningen, Assen]"
train_3,"[Oss, Nijmegen, Oss, s-Hertogenbosch, Eindhoven, Weert, Eindhoven, Helmond, Eindhoven, Weert, Roermond, Sittard, Maastricht]"
train_4,"[Tilburg, Breda, Etten-Leur, Breda, Etten-Leur, Breda, Etten-Leur, Breda, Tilburg, s-Hertogenbosch, Utrecht Centraal, Ede-Wageningen, Utrecht Centraal]"
train_5,"[Leeuwarden, Groningen, Assen, Zwolle, Assen, Groningen, Assen]"
train_6,"[Castricum, Beverwijk, Castricum, Zaandam, Castricum, Beverwijk, Haarlem, Heemstede-Aerdenhout, Haarlem, Beverwijk, Haarlem, Beverwijk, Zaandam]"
train_7,"[Gouda, Den Haag Laan v NOI, Delft, Den Haag Laan v NOI, Gouda, Utrecht Centraal, Amsterdam Centraal, Amsterdam Sloterdijk, Amsterdam Zuid, Amsterdam Amstel]"
train_8,"[Leeuwarden, Heerenveen, Leeuwarden, Groningen, Leeuwarden, Groningen, Assen, Groningen]"
train_9,"[Almere Centrum, Lelystad Centrum, Almere Centrum, Lelystad Centrum, Almere Centrum, Amsterdam Amstel, Almere Centrum, Lelystad Centrum, Almere Centrum, Hilversum, Utrecht Centraal]"
train_10,"[Den Helder, Alkmaar, Hoorn, Alkmaar, Hoorn, Zaandam, Hoorn]"
train_11,"[Weert, Eindhoven, s-Hertogenbosch, Tilburg, Breda, Tilburg, s-Hertogenbosch, Utrecht Centraal, Amersfoort, Zwolle]"
train_12,"[Helmond, Eindhoven, s-Hertogenbosch, Tilburg, Eindhoven, s-Hertogenbosch, Tilburg, s-Hertogenbosch, Oss, Nijmegen, Arnhem Centraal, Ede-Wageningen]"
train_13,"[Enschede, Hengelo, Almelo, Deventer, Almelo, Deventer, Zwolle, Almelo]"
train_14,"[Maastricht, Sittard, Roermond, Weert, Eindhoven, Helmond, Eindhoven, s-Hertogenbosch, Oss, Nijmegen, Arnhem Centraal, Ede-Wageningen, Arnhem Centraal, Dieren, Zutphen]"
train_15,"[Hoorn, Alkmaar, Hoorn, Zaandam, Amsterdam Sloterdijk, Amsterdam Centraal, Almere Centrum, Amsterdam Amstel, Hilversum, Utrecht Centraal]"
train_16,"[Deventer, Zutphen, Deventer, Zwolle, Deventer, Zwolle, Assen, Groningen]"
train_17,"[Roosendaal, Etten-Leur, Breda, Dordrecht, Rotterdam Blaak, Dordrecht, Rotterdam Blaak, Dordrecht, Roosendaal, Etten-Leur, Breda, Etten-Leur, Breda, Etten-Leur, Breda, Etten-Leur, Roosendaal]"
train_18,"[Assen, Groningen, Assen, Groningen, Leeuwarden, Heerenveen, Steenwijk, Heerenveen, Leeuwarden]"
train_19,"[Amsterdam Amstel, Almere Centrum, Lelystad Centrum, Almere Centrum, Lelystad Centrum, Almere Centrum, Hilversum, Almere Centrum, Amsterdam Amstel]"
train_20,"[Assen, Groningen, Assen, Groningen, Assen, Groningen, Leeuwarden, Groningen, Assen]"
score,1434.5730337078649
