train,stations
train_1,"[Dordrecht, Breda, Etten-Leur, Roosendaal, Dordrecht, Rotterdam Centraal, Rotterdam Alexander, Rotterdam Centraal, Rotterdam Alexander, Gouda, Utrecht Centraal, Amsterdam Centraal, Almere Centrum]"
train_2,"[Leiden Centraal, Heemstede-Aerdenhout, Haarlem, Amsterdam Sloterdijk, Zaandam, Hoorn, Alkmaar, Hoorn, Zaandam, Castricum, Beverwijk, Haarlem]"
train_3,"[Den Haag HS, Leiden Centraal, Den Haag HS, Delft, Schiedam Centrum, Rotterdam Blaak, Rotterdam Alexander, Rotterdam Centraal, Rotterdam Alexander, Gouda, Alphen a/d Rijn, Utrecht Centraal, Ede-Wageningen]"
train_4,"[Amsterdam Sloterdijk, Amsterdam Zuid, Amsterdam Sloterdijk, Amsterdam Zuid, Amsterdam Amstel, Amsterdam Zuid, Schiphol Airport, Leiden Centraal, Den Haag Laan v NOI, Delft, Den Haag Centraal, Leiden Centraal, Den Haag Laan v NOI, Leiden Centraal, Heemstede-Aerdenhout, Leiden Centraal]"
train_5,"[Venlo, Helmond, Eindhoven, s-Hertogenbosch, Utrecht Centraal, Amsterdam Centraal, Amsterdam Sloterdijk, Haarlem, Amsterdam Sloterdijk, Haarlem, Heemstede-Aerdenhout, Leiden Centraal]"
train_6,"[Utrecht Centraal, Alphen a/d Rijn, Leiden Centraal, Alphen a/d Rijn, Leiden Centraal, Heemstede-Aerdenhout, Leiden Centraal, Schiphol Airport, Amsterdam Zuid, Amsterdam Amstel, Amsterdam Centraal, Almere Centrum]"
train_7,"[Roermond, Weert, Roermond, Weert, Roermond, Weert, Roermond, Sittard, Heerlen, Sittard, Heerlen, Sittard, Heerlen]"
train_8,"[Steenwijk, Zwolle, Almelo, Zwolle, Deventer, Almelo]"
train_9,"[Utrecht Centraal, s-Hertogenbosch, Eindhoven, Weert, Roermond, Sittard, Maastricht, Sittard, Maastricht, Sittard, Roermond]"
train_10,"[Schiedam Centrum, Delft, Den Haag Centraal, Delft, Den Haag Laan v NOI, Gouda, Rotterdam Alexander, Rotterdam Centraal, Schiedam Centrum, Delft, Den Haag Laan v NOI, Leiden Centraal, Den Haag Laan v NOI, Delft, Den Haag Laan v NOI, Leiden Centraal, Den Haag Laan v NOI]"
train_11,"[Hilversum, Amsterdam Amstel, Utrecht Centraal, Alphen a/d Rijn, Utrecht Centraal, s-Hertogenbosch, Utrecht Centraal]"
train_12,"[Rotterdam Centraal, Rotterdam Alexander, Rotterdam Centraal, Schiedam Centrum, Rotterdam Blaak, Dordrecht, Breda, Etten-Leur, Roosendaal, Dordrecht, Rotterdam Centraal, Dordrecht, Rotterdam Centraal, Dordrecht]"
train_13,"[Groningen, Leeuwarden, Groningen, Assen, Groningen, Assen, Zwolle]"
train_14,"[Zaandam, Castricum, Zaandam, Hoorn, Alkmaar, Castricum, Alkmaar, Den Helder, Alkmaar, Castricum]"
train_15,"[Almere Centrum, Amsterdam Amstel, Utrecht Centraal, Gouda, Den Haag Laan v NOI, Delft, Schiedam Centrum, Delft, Den Haag Centraal, Gouda, Den Haag HS]"
train_16,"[Gouda, Den Haag HS, Gouda, Den Haag HS, Leiden Centraal, Den Haag Laan v NOI, Delft, Schiedam Centrum, Rotterdam Centraal, Dordrecht, Rotterdam Blaak, Dordrecht, Rotterdam Centraal, Rotterdam Alexander]"
train_17,"[Sittard, Maastricht, Sittard, Maastricht, Sittard, Heerlen, Sittard, Heerlen, Sittard, Heerlen, Sittard, Maastricht]"
train_18,"[Rotterdam Centraal, Rotterdam Alexander, Rotterdam Centraal, Dordrecht, Breda, Tilburg, Breda, Tilburg, Eindhoven, s-Hertogenbosch, Eindhoven, Weert, Roermond]"
train_19,"[Apeldoorn, Deventer, Apeldoorn, Zutphen, Dieren, Zutphen, Dieren, Zutphen, Apeldoorn, Zutphen, Apeldoorn, Deventer, Zutphen, Dieren, Arnhem Centraal]"
train_20,"[Den Helder, Alkmaar, Castricum, Beverwijk, Castricum, Beverwijk, Castricum, Beverwijk, Haarlem, Amsterdam Sloterdijk, Zaandam, Castricum, Beverwijk]"
score,2561.52808988764
