train,stations
train_1,"[Enschede, Hengelo, Almelo, Deventer, Zwolle, Steenwijk, Heerenveen, Steenwijk, Zwolle]"
train_2,"[Assen, Groningen, Assen, Zwolle, Amersfoort, Zwolle]"
train_3,"[Amsterdam Zuid, Amsterdam Sloterdijk, Amsterdam Zuid, Schiphol Airport, Amsterdam Zuid, Amsterdam Sloterdijk, Amsterdam Zuid, Schiphol Airport, Utrecht Centraal, s-Hertogenbosch, Tilburg, s-Hertogenbosch]"
train_4,"[Nijmegen, Arnhem Centraal, Nijmegen, Arnhem Centraal, Nijmegen, Arnhem Centraal, Ede-Wageningen, Utrecht Centraal, Alphen a/d Rijn, Gouda, Alphen a/d Rijn]"
train_5,"[Utrecht Centraal, Ede-Wageningen, Utrecht Centraal, Gouda, Den Haag HS, Leiden Centraal, Den Haag HS, Gouda, Alphen a/d Rijn, Utrecht Centraal]"
train_6,"[Roermond, Weert, Roermond, Sittard, Maastricht, Sittard, Roermond, Sittard, Roermond, Sittard, Heerlen, Sittard, Roermond]"
train_7,"[Amsterdam Sloterdijk, Amsterdam Zuid, Schiphol Airport, Leiden Centraal, Schiphol Airport, Utrecht Centraal, Gouda, Alphen a/d Rijn, Utrecht Centraal, Ede-Wageningen]"
train_8,"[Den Helder, Alkmaar, Castricum, Beverwijk, Castricum, Beverwijk, Haarlem, Amsterdam Sloterdijk, Amsterdam Zuid, Amsterdam Sloterdijk, Zaandam, Hoorn]"
train_9,"[Delft, Den Haag Centraal, Delft, Den Haag HS, Leiden Centraal, Heemstede-Aerdenhout, Leiden Centraal, Heemstede-Aerdenhout, Haarlem, Beverwijk, Castricum, Alkmaar, Den Helder]"
train_10,"[Groningen, Assen, Zwolle, Almelo, Hengelo, Enschede, Hengelo, Enschede, Hengelo, Enschede, Hengelo, Almelo]"
train_11,"[Castricum, Beverwijk, Zaandam, Amsterdam Sloterdijk, Amsterdam Zuid, Schiphol Airport, Leiden Centraal, Schiphol Airport, Leiden Centraal, Alphen a/d Rijn, Leiden Centraal, Den Haag Laan v NOI, Leiden Centraal, Den Haag HS, Delft]"
train_12,"[Amsterdam Zuid, Amsterdam Amstel, Almere Centrum, Amsterdam Amstel, Almere Centrum, Amsterdam Centraal, Utrecht Centraal, Hilversum]"
train_13,"[Almelo, Hengelo, Almelo, Deventer, Zwolle, Deventer, Zwolle, Amersfoort]"
train_14,"[Breda, Dordrecht, Rotterdam Blaak, Rotterdam Alexander, Rotterdam Centraal, Schiedam Centrum, Rotterdam Centraal, Schiedam Centrum, Rotterdam Centraal, Dordrecht, Breda, Tilburg, Eindhoven, s-Hertogenbosch, Tilburg]"
train_15,"[Etten-Leur, Roosendaal, Vlissingen, Roosendaal, Dordrecht]"
train_16,"[Beverwijk, Haarlem, Beverwijk, Zaandam, Beverwijk, Zaandam, Castricum, Alkmaar, Hoorn, Alkmaar]"
train_17,"[Maastricht, Sittard, Heerlen, Sittard, Heerlen, Sittard, Heerlen, Sittard, Roermond, Weert, Eindhoven, Weert]"
train_18,"[Amersfoort, Utrecht Centraal, Gouda, Den Haag Laan v NOI, Gouda, Alphen a/d Rijn, Gouda, Den Haag Centraal, Delft, Schiedam Centrum, Rotterdam Centraal, Rotterdam Alexander]"
train_19,"[Arnhem Centraal, Nijmegen, Oss, Nijmegen, Arnhem Centraal, Dieren, Arnhem Centraal, Ede-Wageningen, Utrecht Centraal, Gouda, Den Haag Laan v NOI, Leiden Centraal, Den Haag Laan v NOI]"
train_20,"[Breda, Etten-Leur, Roosendaal, Dordrecht, Breda, Dordrecht, Roosendaal, Vlissingen]"
score,2432.8089887640454
