train,stations
train_1,"[Breda, Etten-Leur, Roosendaal, Dordrecht, Rotterdam Blaak, Rotterdam Alexander, Gouda, Den Haag HS, Leiden Centraal, Den Haag Centraal, Leiden Centraal, Alphen a/d Rijn, Utrecht Centraal]"
train_2,"[Weert, Eindhoven, Weert, Eindhoven, Helmond, Eindhoven, Tilburg, Eindhoven, Weert, Roermond, Weert, Eindhoven]"
train_3,"[Dieren, Arnhem Centraal, Ede-Wageningen, Arnhem Centraal, Ede-Wageningen, Utrecht Centraal, Alphen a/d Rijn, Gouda, Den Haag Laan v NOI, Leiden Centraal, Schiphol Airport]"
train_4,"[Zwolle, Deventer, Zutphen, Apeldoorn, Amersfoort, Zwolle, Assen]"
train_5,"[Deventer, Zwolle, Deventer, Almelo, Deventer, Almelo, Deventer, Almelo]"
train_6,"[Delft, Den Haag Laan v NOI, Leiden Centraal, Schiphol Airport, Utrecht Centraal, Amsterdam Amstel, Amsterdam Centraal, Utrecht Centraal, Amsterdam Amstel, Amsterdam Zuid, Schiphol Airport, Leiden Centraal]"
train_7,"[Helmond, Eindhoven, s-Hertogenbosch, Eindhoven, Weert, Eindhoven, Weert, Roermond, Sittard, Roermond, Weert, Eindhoven]"
train_8,"[Schiphol Airport, Utrecht Centraal, Schiphol Airport, Utrecht Centraal, Schiphol Airport, Leiden Centraal, Den Haag Laan v NOI, Leiden Centraal]"
train_9,"[Den Haag Laan v NOI, Leiden Centraal, Schiphol Airport, Utrecht Centraal, Hilversum, Amsterdam Amstel, Amsterdam Zuid, Amsterdam Amstel, Almere Centrum, Hilversum]"
train_10,"[Arnhem Centraal, Dieren, Arnhem Centraal, Ede-Wageningen, Arnhem Centraal, Ede-Wageningen, Arnhem Centraal, Ede-Wageningen, Utrecht Centraal, Gouda, Rotterdam Alexander, Rotterdam Centraal, Schiedam Centrum, Rotterdam Blaak, Rotterdam Alexander, Rotterdam Blaak, Schiedam Centrum]"
train_11,"[Zutphen, Apeldoorn, Amersfoort, Zwolle, Almelo, Deventer, Apeldoorn, Zutphen]"
train_12,"[Assen, Zwolle, Almelo, Zwolle, Steenwijk, Heerenveen, Steenwijk]"
train_13,"[Rotterdam Centraal, Rotterdam Alexander, Gouda, Utrecht Centraal, Amsterdam Centraal, Amsterdam Amstel, Amsterdam Zuid, Amsterdam Sloterdijk, Amsterdam Centraal, Almere Centrum, Hilversum, Amsterdam Amstel]"
train_14,"[Leeuwarden, Heerenveen, Steenwijk, Zwolle, Steenwijk, Heerenveen, Leeuwarden, Heerenveen, Leeuwarden, Heerenveen, Leeuwarden]"
train_15,"[Almere Centrum, Amsterdam Amstel, Almere Centrum, Lelystad Centrum, Almere Centrum, Hilversum, Amsterdam Amstel, Hilversum]"
train_16,"[Maastricht, Sittard, Roermond, Sittard, Heerlen, Sittard, Roermond, Sittard, Heerlen, Sittard, Heerlen, Sittard]"
train_17,"[Maastricht, Sittard, Heerlen, Sittard, Roermond, Weert, Eindhoven, Weert, Roermond, Weert, Eindhoven, Weert]"
train_18,"[Utrecht Centraal, Gouda, Utrecht Centraal, Gouda, Utrecht Centraal, Amsterdam Amstel, Amsterdam Zuid, Amsterdam Amstel, Almere Centrum, Lelystad Centrum, Almere Centrum]"
train_19,"[Leeuwarden, Groningen, Assen, Zwolle, Assen, Zwolle]"
train_20,"[Groningen, Assen, Groningen, Leeuwarden, Heerenveen, Leeuwarden, Groningen, Assen, Groningen]"
score,1189.2134831460671
