train,stations
train_1,"[Deventer, Zwolle, Almelo, Deventer, Apeldoorn, Deventer, Almelo, Zwolle]"
train_2,"[Lelystad Centrum, Almere Centrum, Lelystad Centrum, Almere Centrum, Amsterdam Centraal, Almere Centrum, Lelystad Centrum, Almere Centrum, Hilversum, Amsterdam Amstel]"
train_3,"[Heerlen, Sittard, Maastricht, Sittard, Roermond, Weert, Roermond, Weert, Roermond, Sittard, Roermond, Weert, Roermond]"
train_4,"[Gouda, Den Haag Centraal, Gouda, Den Haag Centraal, Gouda, Den Haag Laan v NOI, Delft, Den Haag Laan v NOI, Leiden Centraal, Den Haag Centraal, Leiden Centraal, Alphen a/d Rijn]"
train_5,"[s-Hertogenbosch, Utrecht Centraal, s-Hertogenbosch, Utrecht Centraal, Alphen a/d Rijn, Gouda, Alphen a/d Rijn, Leiden Centraal, Alphen a/d Rijn]"
train_6,"[Rotterdam Blaak, Schiedam Centrum, Rotterdam Blaak, Dordrecht, Breda, Etten-Leur, Roosendaal, Vlissingen]"
train_7,"[Den Helder, Alkmaar, Den Helder, Alkmaar, Hoorn, Alkmaar, Castricum, Zaandam]"
train_8,"[Vlissingen, Roosendaal, Vlissingen]"
train_9,"[Almelo, Zwolle, Amersfoort, Utrecht Centraal, Gouda, Alphen a/d Rijn, Gouda, Den Haag HS, Delft]"
train_10,"[Helmond, Eindhoven, Weert, Eindhoven, Tilburg, s-Hertogenbosch, Tilburg, Eindhoven, s-Hertogenbosch, Tilburg, Eindhoven]"
train_11,"[Oss, s-Hertogenbosch, Eindhoven, s-Hertogenbosch, Tilburg, s-Hertogenbosch, Tilburg, Eindhoven, Weert, Eindhoven, Weert, Roermond]"
train_12,"[Leeuwarden, Groningen, Assen, Groningen, Assen, Groningen, Assen, Zwolle]"
train_13,"[Venlo, Helmond, Venlo, Helmond, Venlo, Helmond, Eindhoven, Weert]"
train_14,"[Delft, Den Haag HS, Delft, Schiedam Centrum, Delft, Den Haag HS, Gouda, Den Haag Laan v NOI, Leiden Centraal, Schiphol Airport, Utrecht Centraal, Schiphol Airport]"
train_15,"[Venlo, Helmond, Venlo, Helmond, Eindhoven, s-Hertogenbosch, Tilburg, Breda, Dordrecht, Rotterdam Blaak]"
train_16,"[Apeldoorn, Zutphen, Deventer, Zwolle, Assen, Zwolle, Deventer, Apeldoorn]"
train_17,"[Arnhem Centraal, Dieren, Zutphen, Apeldoorn, Deventer, Zwolle, Steenwijk, Zwolle, Steenwijk, Zwolle]"
train_18,"[Roosendaal, Vlissingen, Roosendaal]"
train_19,"[Den Helder, Alkmaar, Castricum, Beverwijk, Castricum, Beverwijk, Castricum, Zaandam, Beverwijk, Zaandam]"
train_20,"[Maastricht, Sittard, Maastricht, Sittard, Maastricht, Sittard, Maastricht, Sittard, Roermond, Weert, Roermond, Sittard, Maastricht]"
score,1090.4943820224717
