train,stations
train_1,"[Amsterdam Sloterdijk, Amsterdam Centraal, Amsterdam Sloterdijk, Amsterdam Zuid, Amsterdam Amstel, Utrecht Centraal, Amersfoort, Zwolle, Amersfoort, Zwolle]"
train_2,"[Heerenveen, Steenwijk, Zwolle, Steenwijk, Zwolle, Steenwijk, Heerenveen, Leeuwarden, Groningen]"
train_3,"[Schiedam Centrum, Rotterdam Centraal, Dordrecht, Rotterdam Centraal, Dordrecht, Rotterdam Blaak, Rotterdam Alexander, Rotterdam Blaak, Rotterdam Alexander, Gouda, Rotterdam Alexander, Rotterdam Centraal, Rotterdam Alexander, Rotterdam Blaak, Dordrecht, Roosendaal]"
train_4,"[Schiphol Airport, Leiden Centraal, Heemstede-Aerdenhout, Leiden Centraal, Schiphol Airport, Leiden Centraal, Den Haag Laan v NOI, Delft, Den Haag Laan v NOI, Delft, Den Haag HS, Delft, Den Haag Laan v NOI, Leiden Centraal, Schiphol Airport, Amsterdam Zuid]"
train_5,"[s-Hertogenbosch, Utrecht Centraal, s-Hertogenbosch, Oss, Nijmegen, Oss, Nijmegen, Oss, Nijmegen, Oss, Nijmegen]"
train_6,"[Breda, Dordrecht, Rotterdam Centraal, Rotterdam Alexander, Rotterdam Blaak, Rotterdam Alexander, Rotterdam Centraal, Schiedam Centrum, Delft, Den Haag Laan v NOI, Leiden Centraal, Den Haag Laan v NOI, Gouda, Den Haag Laan v NOI]"
train_7,"[Zaandam, Amsterdam Sloterdijk, Zaandam, Amsterdam Sloterdijk, Zaandam, Amsterdam Sloterdijk, Haarlem, Beverwijk, Castricum, Zaandam, Castricum, Alkmaar, Castricum, Alkmaar, Den Helder]"
train_8,"[Vlissingen, Roosendaal, Etten-Leur, Roosendaal, Vlissingen]"
train_9,"[Heemstede-Aerdenhout, Leiden Centraal, Schiphol Airport, Utrecht Centraal, Schiphol Airport, Leiden Centraal, Heemstede-Aerdenhout, Leiden Centraal, Den Haag HS, Leiden Centraal, Schiphol Airport]"
train_10,"[Den Helder, Alkmaar, Castricum, Zaandam, Beverwijk, Haarlem, Beverwijk, Haarlem, Beverwijk, Zaandam, Amsterdam Sloterdijk]"
train_11,"[Nijmegen, Arnhem Centraal, Nijmegen, Arnhem Centraal, Nijmegen, Oss, s-Hertogenbosch, Tilburg, Breda, Tilburg, Eindhoven, Helmond, Eindhoven, Tilburg]"
train_12,"[Gouda, Alphen a/d Rijn, Gouda, Alphen a/d Rijn, Leiden Centraal, Den Haag Laan v NOI, Gouda, Rotterdam Alexander, Rotterdam Blaak, Rotterdam Alexander, Gouda, Alphen a/d Rijn, Leiden Centraal]"
train_13,"[Hengelo, Almelo, Zwolle, Steenwijk, Zwolle, Deventer, Almelo, Deventer]"
train_14,"[Helmond, Venlo, Helmond, Eindhoven, Helmond, Eindhoven, Helmond, Eindhoven, Tilburg, Breda, Dordrecht, Roosendaal]"
train_15,"[Leiden Centraal, Den Haag HS, Gouda, Alphen a/d Rijn, Leiden Centraal, Den Haag HS, Delft, Den Haag Centraal, Leiden Centraal, Den Haag Laan v NOI, Delft, Schiedam Centrum, Delft, Den Haag HS, Leiden Centraal, Heemstede-Aerdenhout]"
train_16,"[s-Hertogenbosch, Eindhoven, Helmond, Venlo, Helmond, Eindhoven, Weert, Eindhoven, Tilburg, Breda]"
train_17,"[Assen, Groningen, Leeuwarden, Groningen, Assen, Zwolle]"
train_18,"[Sittard, Roermond, Sittard, Maastricht, Sittard, Heerlen, Sittard, Maastricht, Sittard, Roermond, Weert, Roermond, Weert]"
train_19,"[Sittard, Roermond, Weert, Eindhoven, Helmond, Eindhoven, s-Hertogenbosch, Utrecht Centraal, Alphen a/d Rijn, Utrecht Centraal]"
train_20,"[Den Helder, Alkmaar, Den Helder, Alkmaar, Hoorn, Zaandam, Amsterdam Sloterdijk, Haarlem]"
score,2109.089887640449
