train,stations
train_1,"[Vlissingen, Roosendaal, Vlissingen]"
train_2,"[Schiedam Centrum, Rotterdam Blaak, Schiedam Centrum, Rotterdam Centraal, Rotterdam Alexander, Gouda, Rotterdam Alexander, Rotterdam Centraal, Schiedam Centrum, Rotterdam Centraal, Rotterdam Alexander, Rotterdam Blaak, Schiedam Centrum, Rotterdam Blaak, Schiedam Centrum, Rotterdam Blaak, Schiedam Centrum, Delft, Den Haag HS]"
train_3,"[Dordrecht, Roosendaal, Dordrecht, Rotterdam Blaak, Dordrecht, Breda, Etten-Leur, Breda, Tilburg, s-Hertogenbosch, Tilburg, Breda, Dordrecht]"
train_4,"[Deventer, Almelo, Hengelo, Enschede, Hengelo, Almelo, Deventer, Zutphen, Apeldoorn, Zutphen, Apeldoorn, Deventer, Zutphen]"
train_5,"[Roosendaal, Vlissingen, Roosendaal, Etten-Leur, Breda, Tilburg, Eindhoven]"
train_6,"[Amersfoort, Zwolle, Amersfoort, Utrecht Centraal, Amsterdam Amstel, Amsterdam Centraal, Amsterdam Sloterdijk, Haarlem, Beverwijk, Castricum, Alkmaar, Castricum]"
train_7,"[Heerlen, Sittard, Maastricht, Sittard, Maastricht, Sittard, Roermond, Sittard, Heerlen, Sittard, Roermond, Weert]"
train_8,"[Schiedam Centrum, Rotterdam Centraal, Dordrecht, Rotterdam Blaak, Dordrecht, Roosendaal, Etten-Leur, Roosendaal, Dordrecht, Breda, Etten-Leur, Breda, Tilburg, s-Hertogenbosch]"
train_9,"[Amsterdam Zuid, Amsterdam Amstel, Almere Centrum, Amsterdam Centraal, Amsterdam Amstel, Amsterdam Zuid, Amsterdam Amstel, Hilversum, Amsterdam Amstel, Utrecht Centraal, Amersfoort]"
train_10,"[Nijmegen, Arnhem Centraal, Nijmegen, Arnhem Centraal, Dieren, Zutphen, Dieren, Arnhem Centraal, Nijmegen, Oss, s-Hertogenbosch, Eindhoven, Tilburg, Breda]"
train_11,"[Rotterdam Centraal, Schiedam Centrum, Rotterdam Blaak, Rotterdam Alexander, Rotterdam Blaak, Rotterdam Alexander, Rotterdam Centraal, Rotterdam Alexander, Rotterdam Centraal, Rotterdam Alexander, Rotterdam Blaak, Rotterdam Alexander, Rotterdam Centraal, Schiedam Centrum, Rotterdam Blaak, Schiedam Centrum, Delft, Den Haag HS, Leiden Centraal, Heemstede-Aerdenhout]"
train_12,"[Den Haag HS, Delft, Schiedam Centrum, Rotterdam Centraal, Rotterdam Alexander, Rotterdam Blaak, Rotterdam Alexander, Rotterdam Centraal, Dordrecht, Roosendaal, Vlissingen]"
train_13,"[Roermond, Sittard, Roermond, Sittard, Roermond, Weert, Roermond, Weert, Roermond, Weert, Eindhoven, Helmond]"
train_14,"[Helmond, Eindhoven, Helmond, Eindhoven, Tilburg, Eindhoven, Tilburg, Breda, Tilburg, s-Hertogenbosch, Eindhoven, Helmond]"
train_15,"[Amersfoort, Utrecht Centraal, s-Hertogenbosch, Utrecht Centraal, Amsterdam Centraal, Amsterdam Sloterdijk, Zaandam, Hoorn, Zaandam, Amsterdam Sloterdijk, Zaandam, Amsterdam Sloterdijk]"
train_16,"[Weert, Roermond, Sittard, Maastricht, Sittard, Heerlen, Sittard, Maastricht, Sittard, Roermond, Weert, Eindhoven]"
train_17,"[Haarlem, Beverwijk, Haarlem, Beverwijk, Zaandam, Beverwijk, Zaandam, Beverwijk, Zaandam]"
train_18,"[Beverwijk, Zaandam, Hoorn, Alkmaar, Castricum, Alkmaar, Den Helder, Alkmaar]"
train_19,"[Haarlem, Beverwijk, Zaandam, Amsterdam Sloterdijk, Amsterdam Zuid, Amsterdam Amstel, Amsterdam Centraal, Amsterdam Sloterdijk, Amsterdam Centraal, Almere Centrum, Amsterdam Centraal, Utrecht Centraal]"
train_20,"[Almere Centrum, Hilversum, Amsterdam Amstel, Almere Centrum, Lelystad Centrum, Almere Centrum, Hilversum, Almere Centrum]"
score,1415.5730337078649
