train,stations
train_1,"[Rotterdam Alexander, Rotterdam Centraal, Dordrecht, Rotterdam Blaak, Rotterdam Alexander, Gouda, Den Haag Laan v NOI, Leiden Centraal, Schiphol Airport, Leiden Centraal, Schiphol Airport, Amsterdam Zuid, Schiphol Airport, Amsterdam Zuid, Amsterdam Amstel]"
train_2,"[Oss, s-Hertogenbosch, Eindhoven, s-Hertogenbosch, Tilburg, s-Hertogenbosch, Utrecht Centraal, Gouda, Utrecht Centraal, Amersfoort, Utrecht Centraal]"
train_3,"[Zaandam, Hoorn, Zaandam, Castricum, Zaandam, Amsterdam Sloterdijk, Amsterdam Zuid, Amsterdam Amstel, Amsterdam Zuid, Amsterdam Sloterdijk, Amsterdam Zuid, Schiphol Airport, Leiden Centraal]"
train_4,"[Rotterdam Centraal, Schiedam Centrum, Rotterdam Blaak, Schiedam Centrum, Rotterdam Centraal, Rotterdam Alexander, Rotterdam Blaak, Rotterdam Alexander, Gouda, Rotterdam Alexander, Rotterdam Centraal, Rotterdam Alexander, Rotterdam Blaak, Rotterdam Alexander, Gouda, Den Haag HS, Leiden Centraal, Den Haag HS, Delft]"
train_5,"[Oss, s-Hertogenbosch, Tilburg, Breda, Dordrecht, Roosendaal, Etten-Leur, Roosendaal, Dordrecht, Roosendaal, Etten-Leur, Roosendaal, Etten-Leur]"
train_6,"[Venlo, Helmond, Venlo, Helmond, Eindhoven, Weert, Eindhoven, Tilburg, Eindhoven]"
train_7,"[Schiphol Airport, Leiden Centraal, Den Haag HS, Gouda, Alphen a/d Rijn, Leiden Centraal, Alphen a/d Rijn, Gouda, Den Haag Laan v NOI, Gouda]"
train_8,"[Sittard, Maastricht, Sittard, Heerlen, Sittard, Roermond, Weert, Eindhoven, Helmond, Eindhoven, Helmond, Eindhoven, Weert, Roermond]"
train_9,"[Lelystad Centrum, Almere Centrum, Amsterdam Centraal, Amsterdam Sloterdijk, Zaandam, Castricum, Beverwijk, Haarlem, Amsterdam Sloterdijk, Zaandam, Castricum, Beverwijk, Castricum, Zaandam, Beverwijk]"
train_10,"[Roosendaal, Etten-Leur, Breda, Tilburg, Breda, Dordrecht, Rotterdam Blaak, Schiedam Centrum, Rotterdam Blaak, Rotterdam Alexander, Gouda, Den Haag HS, Gouda, Den Haag Centraal]"
train_11,"[Hoorn, Alkmaar, Castricum, Zaandam, Amsterdam Sloterdijk, Zaandam, Beverwijk, Haarlem, Beverwijk, Zaandam, Beverwijk, Castricum]"
train_12,"[Zutphen, Apeldoorn, Zutphen, Apeldoorn, Zutphen, Apeldoorn, Zutphen, Deventer, Zwolle]"
train_13,"[Almelo, Zwolle, Steenwijk, Heerenveen, Steenwijk, Heerenveen, Steenwijk, Zwolle]"
train_14,"[Amsterdam Zuid, Amsterdam Amstel, Amsterdam Zuid, Amsterdam Amstel, Amsterdam Centraal, Amsterdam Sloterdijk, Zaandam, Castricum, Alkmaar, Den Helder, Alkmaar, Hoorn]"
train_15,"[Enschede, Hengelo, Enschede, Hengelo, Almelo, Deventer, Almelo, Zwolle, Deventer, Zwolle]"
train_16,"[Delft, Den Haag HS, Gouda, Den Haag Laan v NOI, Leiden Centraal, Den Haag Laan v NOI, Delft, Den Haag HS, Leiden Centraal, Alphen a/d Rijn, Gouda, Den Haag Centraal, Delft]"
train_17,"[Arnhem Centraal, Dieren, Zutphen, Dieren, Arnhem Centraal, Ede-Wageningen, Utrecht Centraal, Amersfoort, Apeldoorn, Zutphen, Apeldoorn, Zutphen]"
train_18,"[Rotterdam Centraal, Rotterdam Alexander, Gouda, Den Haag Laan v NOI, Leiden Centraal, Alphen a/d Rijn, Utrecht Centraal, Amersfoort, Zwolle]"
train_19,"[Haarlem, Heemstede-Aerdenhout, Leiden Centraal, Heemstede-Aerdenhout, Haarlem, Beverwijk, Castricum, Zaandam, Amsterdam Sloterdijk, Amsterdam Zuid, Amsterdam Amstel, Amsterdam Zuid, Schiphol Airport, Leiden Centraal, Den Haag HS, Leiden Centraal, Den Haag Laan v NOI]"
train_20,"[Amersfoort, Zwolle, Almelo, Zwolle, Assen, Groningen]"
score,2901.606741573034
