train,stations
train_1,"[Schiedam Centrum, Delft, Den Haag HS, Gouda, Den Haag Centraal, Leiden Centraal, Heemstede-Aerdenhout, Haarlem, Heemstede-Aerdenhout, Haarlem, Heemstede-Aerdenhout, Haarlem, Amsterdam Sloterdijk, Haarlem, Heemstede-Aerdenhout, Haarlem, Amsterdam Sloterdijk, Haarlem, Amsterdam Sloterdijk]"
train_2,"[Alkmaar, Hoorn, Zaandam, Amsterdam Sloterdijk, Haarlem, Beverwijk, Castricum, Beverwijk, Zaandam, Hoorn]"
train_3,"[Deventer, Zwolle, Almelo, Deventer, Zutphen, Apeldoorn, Deventer, Almelo, Hengelo, Enschede]"
train_4,"[Amsterdam Amstel, Amsterdam Centraal, Almere Centrum, Hilversum, Almere Centrum, Hilversum, Utrecht Centraal, s-Hertogenbosch, Eindhoven, Helmond]"
train_5,"[Zutphen, Apeldoorn, Deventer, Zutphen, Dieren, Zutphen, Dieren, Zutphen, Dieren, Arnhem Centraal, Ede-Wageningen, Arnhem Centraal, Dieren, Zutphen, Deventer, Apeldoorn]"
train_6,"[Amersfoort, Apeldoorn, Zutphen, Dieren, Arnhem Centraal, Dieren, Arnhem Centraal, Dieren, Zutphen, Apeldoorn, Zutphen, Apeldoorn, Deventer]"
train_7,"[Heemstede-Aerdenhout, Leiden Centraal, Schiphol Airport, Utrecht Centraal, Amsterdam Amstel, Amsterdam Centraal, Almere Centrum, Amsterdam Centraal, Amsterdam Sloterdijk, Amsterdam Centraal, Amsterdam Sloterdijk, Zaandam, Castricum, Beverwijk]"
train_8,"[Oss, s-Hertogenbosch, Utrecht Centraal, Amsterdam Amstel, Utrecht Centraal, Amersfoort, Apeldoorn, Deventer, Almelo, Deventer]"
train_9,"[Sittard, Maastricht, Sittard, Heerlen, Sittard, Roermond, Sittard, Roermond, Sittard, Roermond, Sittard, Roermond]"
train_10,"[Oss, Nijmegen, Arnhem Centraal, Ede-Wageningen, Arnhem Centraal, Ede-Wageningen, Arnhem Centraal, Nijmegen, Arnhem Centraal, Ede-Wageningen, Arnhem Centraal, Nijmegen, Arnhem Centraal, Nijmegen, Arnhem Centraal, Dieren]"
train_11,"[Amsterdam Zuid, Amsterdam Sloterdijk, Zaandam, Amsterdam Sloterdijk, Haarlem, Heemstede-Aerdenhout, Haarlem, Heemstede-Aerdenhout, Haarlem, Heemstede-Aerdenhout, Haarlem, Heemstede-Aerdenhout, Haarlem, Heemstede-Aerdenhout, Haarlem, Amsterdam Sloterdijk, Amsterdam Centraal, Almere Centrum, Hilversum, Utrecht Centraal]"
train_12,"[Venlo, Helmond, Eindhoven, Tilburg, Eindhoven, Tilburg, s-Hertogenbosch, Oss, s-Hertogenbosch, Utrecht Centraal]"
train_13,"[Almelo, Deventer, Apeldoorn, Deventer, Zutphen, Dieren, Zutphen, Apeldoorn, Deventer, Apeldoorn, Zutphen, Dieren, Zutphen, Apeldoorn]"
train_14,"[Roosendaal, Dordrecht, Rotterdam Blaak, Schiedam Centrum, Rotterdam Blaak, Dordrecht, Rotterdam Blaak, Dordrecht, Breda, Etten-Leur, Roosendaal, Dordrecht, Breda]"
train_15,"[Heemstede-Aerdenhout, Haarlem, Beverwijk, Haarlem, Beverwijk, Castricum, Zaandam, Amsterdam Sloterdijk, Haarlem, Amsterdam Sloterdijk, Amsterdam Centraal, Amsterdam Amstel, Amsterdam Zuid, Amsterdam Sloterdijk, Amsterdam Zuid, Schiphol Airport]"
train_16,"[Heemstede-Aerdenhout, Leiden Centraal, Heemstede-Aerdenhout, Leiden Centraal, Heemstede-Aerdenhout, Leiden Centraal, Schiphol Airport, Leiden Centraal, Alphen a/d Rijn, Leiden Centraal, Heemstede-Aerdenhout, Leiden Centraal, Alphen a/d Rijn]"
train_17,"[Weert, Eindhoven, Helmond, Eindhoven, Tilburg, Eindhoven, s-Hertogenbosch, Eindhoven, Weert, Eindhoven, Tilburg]"
train_18,"[Amsterdam Amstel, Amsterdam Centraal, Amsterdam Sloterdijk, Amsterdam Zuid, Amsterdam Sloterdijk, Amsterdam Centraal, Amsterdam Sloterdijk, Zaandam, Beverwijk, Zaandam, Amsterdam Sloterdijk, Amsterdam Zuid, Schiphol Airport, Amsterdam Zuid, Amsterdam Sloterdijk, Zaandam]"
train_19,"[Den Haag Centraal, Delft, Den Haag HS, Delft, Schiedam Centrum, Rotterdam Blaak, Rotterdam Alexander, Rotterdam Centraal, Dordrecht, Roosendaal, Dordrecht, Breda, Dordrecht, Rotterdam Centraal]"
train_20,"[Heerenveen, Leeuwarden, Groningen, Assen, Groningen, Leeuwarden, Groningen, Assen]"
score,1944.7303370786522
