train,stations
train_1,"[Heerenveen, Leeuwarden, Groningen, Leeuwarden, Heerenveen, Leeuwarden, Groningen, Assen]"
train_2,"[Leiden Centraal, Alphen a/d Rijn, Gouda, Den Haag Centraal, Gouda, Den Haag HS, Delft, Den Haag Centraal, Delft, Schiedam Centrum, Rotterdam Blaak, Schiedam Centrum, Delft, Den Haag Laan v NOI]"
train_3,"[Assen, Groningen, Assen, Zwolle, Deventer, Zutphen, Dieren, Arnhem Centraal, Dieren, Zutphen, Dieren, Zutphen]"
train_4,"[Heerenveen, Leeuwarden, Groningen, Leeuwarden, Groningen, Assen, Zwolle]"
train_5,"[Enschede, Hengelo, Almelo, Zwolle, Assen, Groningen, Leeuwarden, Heerenveen]"
train_6,"[Amsterdam Zuid, Amsterdam Sloterdijk, Amsterdam Centraal, Amsterdam Sloterdijk, Zaandam, Beverwijk, Zaandam, Beverwijk, Castricum, Alkmaar, Den Helder]"
train_7,"[Maastricht, Sittard, Heerlen, Sittard, Roermond, Sittard, Maastricht, Sittard, Roermond, Sittard, Maastricht, Sittard]"
train_8,"[Weert, Eindhoven, Weert, Roermond, Weert, Eindhoven, Tilburg, s-Hertogenbosch, Eindhoven, Helmond, Venlo]"
train_9,"[Maastricht, Sittard, Heerlen, Sittard, Heerlen, Sittard, Heerlen, Sittard, Heerlen, Sittard, Heerlen, Sittard]"
train_10,"[Ede-Wageningen, Arnhem Centraal, Nijmegen, Oss, Nijmegen, Arnhem Centraal, Ede-Wageningen, Arnhem Centraal, Ede-Wageningen, Utrecht Centraal, Alphen a/d Rijn, Gouda]"
train_11,"[Den Helder, Alkmaar, Den Helder, Alkmaar, Castricum, Beverwijk, Castricum, Beverwijk, Haarlem]"
train_12,"[Den Haag HS, Gouda, Rotterdam Alexander, Gouda, Den Haag Laan v NOI, Leiden Centraal, Den Haag Centraal, Delft, Den Haag Laan v NOI, Gouda, Den Haag HS, Leiden Centraal]"
train_13,"[Assen, Groningen, Assen, Groningen, Leeuwarden, Groningen, Assen, Zwolle]"
train_14,"[Utrecht Centraal, Ede-Wageningen, Utrecht Centraal, s-Hertogenbosch, Eindhoven, s-Hertogenbosch, Utrecht Centraal, s-Hertogenbosch, Oss]"
train_15,"[Zwolle, Steenwijk, Heerenveen, Leeuwarden, Heerenveen, Leeuwarden, Heerenveen, Steenwijk, Heerenveen, Leeuwarden, Heerenveen, Steenwijk]"
train_16,"[Heerlen, Sittard, Roermond, Sittard, Heerlen, Sittard, Heerlen, Sittard, Roermond, Weert, Roermond, Weert, Roermond]"
train_17,"[Dieren, Zutphen, Apeldoorn, Zutphen, Deventer, Zwolle, Steenwijk, Zwolle, Steenwijk, Heerenveen]"
train_18,"[Maastricht, Sittard, Roermond, Weert, Roermond, Weert, Roermond, Weert, Roermond, Weert, Eindhoven, Tilburg]"
train_19,"[Venlo, Helmond, Venlo, Helmond, Venlo, Helmond, Eindhoven, Weert]"
train_20,"[Leeuwarden, Heerenveen, Leeuwarden, Heerenveen, Steenwijk, Zwolle, Deventer, Almelo, Hengelo, Almelo]"
score,628.4157303370794
