train,stations
train_1,"[Zwolle, Amersfoort, Utrecht Centraal, s-Hertogenbosch, Tilburg, Breda, Tilburg, s-Hertogenbosch, Eindhoven, Weert]"
train_2,"[Gouda, Den Haag HS, Gouda, Utrecht Centraal, Amersfoort, Apeldoorn, Amersfoort, Apeldoorn, Amersfoort]"
train_3,"[Alphen a/d Rijn, Leiden Centraal, Schiphol Airport, Amsterdam Zuid, Amsterdam Amstel, Amsterdam Zuid, Amsterdam Amstel, Hilversum, Almere Centrum, Amsterdam Amstel, Amsterdam Centraal, Almere Centrum]"
train_4,"[Castricum, Alkmaar, Hoorn, Alkmaar, Castricum, Zaandam, Amsterdam Sloterdijk, Amsterdam Zuid, Amsterdam Sloterdijk, Zaandam, Amsterdam Sloterdijk, Haarlem, Beverwijk, Haarlem]"
train_5,"[Oss, s-Hertogenbosch, Eindhoven, Weert, Eindhoven, Weert, Roermond, Weert, Roermond, Sittard, Roermond, Weert]"
train_6,"[Amsterdam Amstel, Amsterdam Zuid, Schiphol Airport, Amsterdam Zuid, Amsterdam Amstel, Almere Centrum, Amsterdam Centraal, Almere Centrum, Lelystad Centrum, Almere Centrum, Amsterdam Amstel]"
train_7,"[Heerlen, Sittard, Heerlen, Sittard, Maastricht, Sittard, Maastricht, Sittard, Roermond, Sittard, Heerlen, Sittard]"
train_8,"[Zaandam, Castricum, Alkmaar, Castricum, Zaandam, Hoorn, Zaandam, Castricum, Zaandam, Hoorn, Zaandam]"
train_9,"[Weert, Eindhoven, s-Hertogenbosch, Eindhoven, Tilburg, s-Hertogenbosch, Eindhoven, Helmond, Venlo, Helmond]"
train_10,"[Deventer, Zutphen, Deventer, Zutphen, Deventer, Zutphen, Dieren, Arnhem Centraal, Nijmegen, Oss, Nijmegen, Oss, s-Hertogenbosch, Eindhoven]"
train_11,"[Amsterdam Amstel, Almere Centrum, Lelystad Centrum, Almere Centrum, Lelystad Centrum, Almere Centrum, Amsterdam Centraal, Amsterdam Sloterdijk, Haarlem, Heemstede-Aerdenhout, Leiden Centraal, Den Haag Centraal, Gouda, Rotterdam Alexander]"
train_12,"[Gouda, Den Haag Centraal, Delft, Den Haag Centraal, Delft, Den Haag Centraal, Gouda, Rotterdam Alexander, Rotterdam Centraal, Rotterdam Alexander, Rotterdam Blaak, Schiedam Centrum, Delft, Den Haag Laan v NOI, Leiden Centraal, Alphen a/d Rijn]"
train_13,"[Oss, s-Hertogenbosch, Oss, Nijmegen, Oss, s-Hertogenbosch, Utrecht Centraal, Gouda, Den Haag Laan v NOI, Delft, Den Haag Centraal, Delft]"
train_14,"[Zaandam, Amsterdam Sloterdijk, Amsterdam Centraal, Utrecht Centraal, Amsterdam Amstel, Almere Centrum, Hilversum, Utrecht Centraal, Schiphol Airport, Amsterdam Zuid, Schiphol Airport, Amsterdam Zuid]"
train_15,"[Den Haag Centraal, Delft, Schiedam Centrum, Delft, Den Haag Centraal, Leiden Centraal, Den Haag Laan v NOI, Delft, Den Haag Laan v NOI, Delft, Schiedam Centrum, Rotterdam Blaak, Dordrecht, Breda, Dordrecht]"
train_16,"[Den Haag Centraal, Leiden Centraal, Den Haag Laan v NOI, Delft, Schiedam Centrum, Delft, Schiedam Centrum, Rotterdam Blaak, Rotterdam Alexander, Rotterdam Blaak, Schiedam Centrum, Rotterdam Centraal, Rotterdam Alexander, Rotterdam Blaak, Rotterdam Alexander, Gouda, Rotterdam Alexander, Rotterdam Blaak, Rotterdam Alexander, Rotterdam Blaak]"
train_17,"[Rotterdam Centraal, Rotterdam Alexander, Gouda, Rotterdam Alexander, Gouda, Den Haag HS, Delft, Den Haag Laan v NOI, Leiden Centraal, Den Haag Centraal, Leiden Centraal, Den Haag Centraal, Leiden Centraal, Den Haag Laan v NOI, Gouda]"
train_18,"[Sittard, Heerlen, Sittard, Roermond, Sittard, Maastricht, Sittard, Maastricht, Sittard, Maastricht, Sittard, Heerlen]"
train_19,"[Groningen, Assen, Groningen, Leeuwarden, Groningen, Assen, Zwolle]"
train_20,"[Enschede, Hengelo, Enschede, Hengelo, Enschede, Hengelo, Enschede, Hengelo, Almelo, Deventer, Almelo, Deventer, Apeldoorn, Amersfoort]"
score,2430.168539325843
