train,stations
train_1,"[Heemstede-Aerdenhout, Haarlem, Heemstede-Aerdenhout, Haarlem, Heemstede-Aerdenhout, Haarlem, Amsterdam Sloterdijk, Zaandam, Hoorn, Alkmaar, Castricum, Beverwijk, Haarlem, Beverwijk, Zaandam]"
train_2,"[Enschede, Hengelo, Almelo, Zwolle, Almelo, Hengelo, Enschede, Hengelo, Enschede, Hengelo, Enschede, Hengelo, Enschede, Hengelo, Enschede]"
train_3,"[Amsterdam Centraal, Amsterdam Amstel, Hilversum, Amsterdam Amstel, Utrecht Centraal, Alphen a/d Rijn, Utrecht Centraal, s-Hertogenbosch, Oss]"
train_4,"[Delft, Den Haag Centraal, Delft, Den Haag Centraal, Leiden Centraal, Den Haag Centraal, Leiden Centraal, Schiphol Airport, Utrecht Centraal, Amsterdam Centraal, Utrecht Centraal]"
train_5,"[Amsterdam Amstel, Almere Centrum, Hilversum, Amsterdam Amstel, Utrecht Centraal, Gouda, Alphen a/d Rijn, Utrecht Centraal]"
train_6,"[Rotterdam Blaak, Rotterdam Alexander, Gouda, Alphen a/d Rijn, Leiden Centraal, Den Haag Centraal, Gouda, Rotterdam Alexander, Rotterdam Blaak, Dordrecht, Rotterdam Blaak, Schiedam Centrum, Rotterdam Blaak, Rotterdam Alexander, Rotterdam Blaak]"
train_7,"[Rotterdam Alexander, Rotterdam Centraal, Dordrecht, Breda, Etten-Leur, Breda, Tilburg, Eindhoven, Tilburg, s-Hertogenbosch, Utrecht Centraal, Hilversum]"
train_8,"[Den Haag Laan v NOI, Delft, Den Haag Centraal, Gouda, Den Haag HS, Delft, Den Haag HS, Gouda, Den Haag HS, Leiden Centraal, Den Haag HS, Leiden Centraal, Heemstede-Aerdenhout, Haarlem]"
train_9,"[Amsterdam Sloterdijk, Amsterdam Zuid, Amsterdam Sloterdijk, Haarlem, Amsterdam Sloterdijk, Amsterdam Zuid, Schiphol Airport, Utrecht Centraal, Alphen a/d Rijn, Leiden Centraal, Heemstede-Aerdenhout, Leiden Centraal]"
train_10,"[Delft, Den Haag Laan v NOI, Delft, Den Haag Centraal, Delft, Den Haag Laan v NOI, Delft, Schiedam Centrum, Rotterdam Centraal, Schiedam Centrum, Rotterdam Blaak, Dordrecht, Rotterdam Blaak, Rotterdam Alexander, Rotterdam Centraal, Schiedam Centrum, Rotterdam Centraal, Rotterdam Alexander, Rotterdam Blaak]"
train_11,"[Helmond, Eindhoven, Tilburg, s-Hertogenbosch, Eindhoven, Helmond, Venlo, Helmond, Eindhoven, Tilburg, s-Hertogenbosch]"
train_12,"[Zaandam, Beverwijk, Zaandam, Beverwijk, Haarlem, Beverwijk, Castricum, Beverwijk, Zaandam]"
train_13,"[Arnhem Centraal, Ede-Wageningen, Utrecht Centraal, Hilversum, Almere Centrum, Lelystad Centrum, Almere Centrum, Lelystad Centrum, Almere Centrum, Amsterdam Centraal, Utrecht Centraal]"
train_14,"[Leeuwarden, Groningen, Assen, Groningen, Leeuwarden, Heerenveen, Leeuwarden, Groningen]"
train_15,"[Lelystad Centrum, Almere Centrum, Hilversum, Amsterdam Amstel, Almere Centrum, Amsterdam Centraal, Amsterdam Amstel, Utrecht Centraal, Schiphol Airport]"
train_16,"[Assen, Groningen, Assen, Groningen, Leeuwarden, Heerenveen, Steenwijk, Zwolle, Steenwijk, Heerenveen]"
train_17,"[Arnhem Centraal, Ede-Wageningen, Arnhem Centraal, Ede-Wageningen, Utrecht Centraal, Amsterdam Centraal, Utrecht Centraal, Amersfoort, Apeldoorn, Amersfoort]"
train_18,"[Zwolle, Assen, Zwolle, Assen, Zwolle]"
train_19,"[Arnhem Centraal, Nijmegen, Oss, s-Hertogenbosch, Oss, Nijmegen, Arnhem Centraal, Nijmegen, Arnhem Centraal, Ede-Wageningen, Arnhem Centraal, Nijmegen, Oss, Nijmegen, Arnhem Centraal]"
train_20,"[Heerenveen, Steenwijk, Heerenveen, Steenwijk, Heerenveen, Leeuwarden, Heerenveen, Steenwijk, Zwolle, Assen]"
score,2071.089887640449
