train,stations
train_1,"[Hoorn, Zaandam, Amsterdam Sloterdijk, Amsterdam Centraal, Amsterdam Amstel, Utrecht Centraal, Amersfoort, Zwolle, Deventer, Almelo]"
train_2,"[Roosendaal, Vlissingen, Roosendaal, Etten-Leur, Breda, Dordrecht]"
train_3,"[Lelystad Centrum, Almere Centrum, Amsterdam Centraal, Almere Centrum, Amsterdam Centraal, Amsterdam Sloterdijk, Haarlem, Beverwijk, Haarlem, Heemstede-Aerdenhout, Leiden Centraal, Schiphol Airport]"
train_4,"[Almelo, Deventer, Almelo, Zwolle, Assen, Zwolle]"
train_5,"[Zaandam, Beverwijk, Zaandam, Beverwijk, Castricum, Beverwijk, Zaandam, Beverwijk, Haarlem, Amsterdam Sloterdijk]"
train_6,"[Amersfoort, Utrecht Centraal, Schiphol Airport, Utrecht Centraal, Amersfoort, Apeldoorn, Amersfoort, Zwolle]"
train_7,"[Schiedam Centrum, Delft, Den Haag Centraal, Leiden Centraal, Alphen a/d Rijn, Gouda, Alphen a/d Rijn, Utrecht Centraal, Alphen a/d Rijn, Gouda, Alphen a/d Rijn]"
train_8,"[Roosendaal, Vlissingen, Roosendaal, Dordrecht, Rotterdam Centraal, Rotterdam Alexander]"
train_9,"[Den Helder, Alkmaar, Den Helder, Alkmaar, Hoorn, Alkmaar, Castricum, Beverwijk]"
train_10,"[Deventer, Zwolle, Amersfoort, Zwolle, Amersfoort, Apeldoorn, Zutphen]"
train_11,"[Castricum, Beverwijk, Castricum, Alkmaar, Castricum, Alkmaar, Den Helder, Alkmaar, Castricum, Alkmaar, Hoorn]"
train_12,"[Deventer, Zwolle, Steenwijk, Zwolle, Deventer, Zutphen, Apeldoorn, Amersfoort]"
train_13,"[Schiedam Centrum, Delft, Schiedam Centrum, Rotterdam Blaak, Schiedam Centrum, Rotterdam Centraal, Schiedam Centrum, Rotterdam Centraal, Dordrecht, Rotterdam Centraal, Schiedam Centrum, Rotterdam Centraal, Schiedam Centrum, Delft, Den Haag HS, Gouda, Rotterdam Alexander, Rotterdam Blaak, Dordrecht]"
train_14,"[Heerenveen, Steenwijk, Zwolle, Deventer, Almelo, Zwolle, Assen]"
train_15,"[Amersfoort, Utrecht Centraal, Ede-Wageningen, Arnhem Centraal, Dieren, Zutphen, Deventer, Almelo, Hengelo, Almelo, Deventer, Zwolle]"
train_16,"[Hengelo, Almelo, Deventer, Almelo, Zwolle, Deventer, Apeldoorn, Deventer, Zwolle]"
train_17,"[Roosendaal, Etten-Leur, Breda, Dordrecht, Rotterdam Blaak, Dordrecht, Rotterdam Blaak, Schiedam Centrum, Delft, Schiedam Centrum, Rotterdam Blaak, Schiedam Centrum, Rotterdam Blaak, Dordrecht, Rotterdam Blaak, Dordrecht]"
train_18,"[Heerenveen, Steenwijk, Heerenveen, Steenwijk, Zwolle, Steenwijk, Heerenveen, Leeuwarden, Heerenveen, Steenwijk, Heerenveen]"
train_19,"[Amsterdam Zuid, Schiphol Airport, Leiden Centraal, Alphen a/d Rijn, Gouda, Utrecht Centraal, Alphen a/d Rijn, Gouda, Utrecht Centraal, Schiphol Airport]"
train_20,"[Helmond, Venlo, Helmond, Venlo, Helmond, Venlo]"
score,1199.2134831460671
