train,stations
train_1,"[Etten-Leur, Breda, Etten-Leur, Roosendaal, Vlissingen, Roosendaal]"
train_2,"[Helmond, Eindhoven, Tilburg, Breda, Etten-Leur, Roosendaal, Dordrecht, Roosendaal, Etten-Leur, Roosendaal]"
train_3,"[Vlissingen, Roosendaal, Vlissingen]"
train_4,"[Den Haag Centraal, Gouda, Alphen a/d Rijn, Gouda, Den Haag Laan v NOI, Delft, Den Haag Laan v NOI, Gouda, Rotterdam Alexander, Gouda]"
train_5,"[Alphen a/d Rijn, Utrecht Centraal, Alphen a/d Rijn, Utrecht Centraal, Amersfoort, Apeldoorn, Zutphen, Apeldoorn]"
train_6,"[Etten-Leur, Roosendaal, Etten-Leur, Breda, Etten-Leur, Roosendaal, Etten-Leur, Breda, Etten-Leur, Breda, Tilburg, s-Hertogenbosch, Tilburg, Breda, Dordrecht, Rotterdam Blaak, Schiedam Centrum]"
train_7,"[Amsterdam Centraal, Amsterdam Sloterdijk, Amsterdam Zuid, Amsterdam Sloterdijk, Amsterdam Centraal, Amsterdam Sloterdijk, Amsterdam Centraal, Amsterdam Sloterdijk, Haarlem, Beverwijk, Zaandam, Castricum, Beverwijk, Haarlem, Amsterdam Sloterdijk, Amsterdam Centraal, Amsterdam Sloterdijk]"
train_8,"[Tilburg, Breda, Dordrecht, Rotterdam Blaak, Rotterdam Alexander, Rotterdam Centraal, Dordrecht, Breda, Etten-Leur, Breda, Tilburg, Eindhoven, Helmond]"
train_9,"[Deventer, Apeldoorn, Zutphen, Dieren, Zutphen, Apeldoorn, Deventer, Apeldoorn, Deventer, Zutphen, Deventer, Zwolle]"
train_10,"[Roermond, Sittard, Heerlen, Sittard, Heerlen, Sittard, Roermond, Weert, Roermond, Sittard, Roermond, Sittard, Roermond]"
train_11,"[Gouda, Utrecht Centraal, Schiphol Airport, Utrecht Centraal, Hilversum, Utrecht Centraal, s-Hertogenbosch, Tilburg, Breda]"
train_12,"[Zwolle, Almelo, Zwolle, Deventer, Zwolle, Steenwijk]"
train_13,"[Zutphen, Deventer, Almelo, Hengelo, Almelo, Zwolle, Amersfoort, Utrecht Centraal, Ede-Wageningen]"
train_14,"[Schiphol Airport, Leiden Centraal, Den Haag HS, Gouda, Den Haag Laan v NOI, Gouda, Den Haag Centraal, Delft, Den Haag HS, Gouda]"
train_15,"[s-Hertogenbosch, Oss, Nijmegen, Arnhem Centraal, Nijmegen, Oss, Nijmegen, Oss, Nijmegen, Oss, s-Hertogenbosch, Utrecht Centraal]"
train_16,"[Schiedam Centrum, Rotterdam Centraal, Dordrecht, Roosendaal, Vlissingen, Roosendaal]"
train_17,"[Venlo, Helmond, Eindhoven, Weert, Eindhoven, Tilburg, Breda, Dordrecht, Rotterdam Blaak, Dordrecht, Roosendaal]"
train_18,"[Amsterdam Amstel, Hilversum, Almere Centrum, Amsterdam Centraal, Amsterdam Sloterdijk, Amsterdam Centraal, Almere Centrum, Amsterdam Centraal, Almere Centrum, Amsterdam Centraal, Amsterdam Sloterdijk, Zaandam]"
train_19,"[Delft, Den Haag Centraal, Gouda, Alphen a/d Rijn, Leiden Centraal, Alphen a/d Rijn, Gouda, Utrecht Centraal, Amersfoort, Zwolle]"
train_20,"[Rotterdam Blaak, Rotterdam Alexander, Rotterdam Blaak, Schiedam Centrum, Rotterdam Blaak, Schiedam Centrum, Rotterdam Blaak, Schiedam Centrum, Delft, Den Haag Centraal, Leiden Centraal, Den Haag Centraal, Delft, Den Haag Centraal, Delft, Den Haag Centraal]"
score,2040.3707865168544
