train,stations
train_1,"[Alphen a/d Rijn, Utrecht Centraal, Gouda, Alphen a/d Rijn, Gouda, Alphen a/d Rijn, Gouda, Alphen a/d Rijn, Leiden Centraal, Den Haag HS]"
train_2,"[Rotterdam Alexander, Gouda, Den Haag Laan v NOI, Leiden Centraal, Den Haag Laan v NOI, Leiden Centraal, Den Haag Laan v NOI, Leiden Centraal, Den Haag Laan v NOI, Gouda, Alphen a/d Rijn, Utrecht Centraal]"
train_3,"[Venlo, Helmond, Venlo, Helmond, Venlo, Helmond, Eindhoven, Weert]"
train_4,"[Sittard, Heerlen, Sittard, Heerlen, Sittard, Roermond, Sittard, Roermond, Weert, Eindhoven, Weert, Eindhoven]"
train_5,"[Roosendaal, Vlissingen, Roosendaal]"
train_6,"[Leeuwarden, Heerenveen, Steenwijk, Heerenveen, Leeuwarden, Heerenveen, Leeuwarden, Groningen, Leeuwarden, Heerenveen]"
train_7,"[Sittard, Roermond, Sittard, Heerlen, Sittard, Maastricht, Sittard, Maastricht, Sittard, Maastricht, Sittard, Roermond, Weert]"
train_8,"[Alphen a/d Rijn, Utrecht Centraal, Amersfoort, Zwolle, Assen, Groningen, Assen, Groningen]"
train_9,"[Leeuwarden, Groningen, Leeuwarden, Groningen, Assen, Zwolle]"
train_10,"[Leeuwarden, Heerenveen, Leeuwarden, Groningen, Leeuwarden, Groningen, Assen, Groningen]"
train_11,"[Steenwijk, Zwolle, Almelo, Hengelo, Almelo, Hengelo, Enschede, Hengelo, Enschede, Hengelo, Almelo, Hengelo, Enschede, Hengelo, Enschede, Hengelo, Enschede]"
train_12,"[s-Hertogenbosch, Oss, Nijmegen, Oss, Nijmegen, Oss, Nijmegen, Oss, Nijmegen, Oss, Nijmegen, Arnhem Centraal, Dieren]"
train_13,"[Den Helder, Alkmaar, Den Helder, Alkmaar, Den Helder]"
train_14,"[Nijmegen, Arnhem Centraal, Ede-Wageningen, Arnhem Centraal, Nijmegen, Oss, Nijmegen, Oss, Nijmegen, Arnhem Centraal, Dieren, Arnhem Centraal, Dieren, Zutphen, Deventer]"
train_15,"[Helmond, Venlo, Helmond, Venlo, Helmond, Venlo]"
train_16,"[Enschede, Hengelo, Enschede, Hengelo, Enschede, Hengelo, Enschede, Hengelo, Almelo, Deventer, Zwolle, Deventer, Apeldoorn, Deventer, Almelo]"
train_17,"[Eindhoven, Tilburg, Breda, Tilburg, s-Hertogenbosch, Oss, s-Hertogenbosch, Oss, Nijmegen, Oss, s-Hertogenbosch, Utrecht Centraal, Amersfoort]"
train_18,"[Etten-Leur, Roosendaal, Etten-Leur, Breda, Dordrecht, Rotterdam Blaak, Dordrecht, Roosendaal, Etten-Leur, Breda, Dordrecht, Roosendaal]"
train_19,"[Oss, s-Hertogenbosch, Tilburg, Eindhoven, Weert, Roermond, Sittard, Maastricht, Sittard, Heerlen, Sittard, Maastricht]"
train_20,"[Utrecht Centraal, Ede-Wageningen, Arnhem Centraal, Dieren, Zutphen, Deventer, Apeldoorn, Amersfoort, Utrecht Centraal, Gouda, Den Haag Centraal, Gouda]"
score,214.97752808988844
