train,stations
train_1,"[Rotterdam Centraal, Dordrecht, Rotterdam Centraal, Schiedam Centrum, Rotterdam Blaak, Schiedam Centrum, Rotterdam Blaak, Dordrecht, Rotterdam Blaak, Dordrecht, Rotterdam Blaak, Rotterdam Alexander, Rotterdam Blaak, Rotterdam Alexander, Rotterdam Blaak, Schiedam Centrum]"
train_2,"[Schiphol Airport, Amsterdam Zuid, Amsterdam Amstel, Amsterdam Zuid, Amsterdam Amstel, Amsterdam Centraal, Amsterdam Amstel, Amsterdam Zuid, Amsterdam Amstel, Almere Centrum, Amsterdam Centraal, Almere Centrum, Lelystad Centrum, Almere Centrum]"
train_3,"[Deventer, Apeldoorn, Zutphen, Deventer, Apeldoorn, Zutphen, Dieren, Zutphen, Apeldoorn, Deventer, Zutphen, Apeldoorn, Amersfoort]"
train_4,"[Alkmaar, Castricum, Zaandam, Castricum, Beverwijk, Haarlem, Amsterdam Sloterdijk, Haarlem, Beverwijk, Castricum, Zaandam, Hoorn, Alkmaar]"
train_5,"[Zutphen, Deventer, Zwolle, Steenwijk, Heerenveen, Steenwijk, Zwolle, Steenwijk, Zwolle]"
train_6,"[Nijmegen, Arnhem Centraal, Ede-Wageningen, Arnhem Centraal, Ede-Wageningen, Utrecht Centraal, Ede-Wageningen, Arnhem Centraal, Nijmegen, Arnhem Centraal, Dieren, Arnhem Centraal, Ede-Wageningen, Arnhem Centraal]"
train_7,"[Amsterdam Centraal, Almere Centrum, Lelystad Centrum, Almere Centrum, Lelystad Centrum, Almere Centrum, Amsterdam Amstel, Amsterdam Centraal, Almere Centrum, Amsterdam Centraal, Amsterdam Sloterdijk, Haarlem, Amsterdam Sloterdijk]"
train_8,"[Helmond, Venlo, Helmond, Venlo, Helmond, Venlo]"
train_9,"[Venlo, Helmond, Venlo, Helmond, Venlo, Helmond]"
train_10,"[Lelystad Centrum, Almere Centrum, Lelystad Centrum, Almere Centrum, Amsterdam Amstel, Amsterdam Zuid, Schiphol Airport, Utrecht Centraal, Ede-Wageningen, Utrecht Centraal]"
train_11,"[Zutphen, Apeldoorn, Deventer, Almelo, Zwolle, Assen, Zwolle]"
train_12,"[Rotterdam Alexander, Rotterdam Centraal, Schiedam Centrum, Rotterdam Centraal, Rotterdam Alexander, Rotterdam Blaak, Dordrecht, Breda, Etten-Leur, Breda, Dordrecht, Rotterdam Blaak, Rotterdam Alexander, Rotterdam Centraal, Schiedam Centrum, Delft, Den Haag Laan v NOI, Delft, Den Haag Centraal]"
train_13,"[Amsterdam Amstel, Amsterdam Centraal, Amsterdam Sloterdijk, Haarlem, Heemstede-Aerdenhout, Haarlem, Beverwijk, Castricum, Beverwijk, Zaandam, Beverwijk, Zaandam, Castricum, Beverwijk]"
train_14,"[Roosendaal, Etten-Leur, Breda, Dordrecht, Rotterdam Blaak, Rotterdam Alexander, Rotterdam Centraal, Rotterdam Alexander, Rotterdam Blaak, Schiedam Centrum, Rotterdam Blaak, Dordrecht, Breda, Etten-Leur, Breda, Etten-Leur, Breda]"
train_15,"[Ede-Wageningen, Arnhem Centraal, Ede-Wageningen, Utrecht Centraal, Amsterdam Amstel, Amsterdam Centraal, Almere Centrum, Lelystad Centrum, Almere Centrum, Amsterdam Amstel, Hilversum]"
train_16,"[Leiden Centraal, Schiphol Airport, Amsterdam Zuid, Amsterdam Amstel, Amsterdam Zuid, Schiphol Airport, Leiden Centraal, Alphen a/d Rijn, Utrecht Centraal, Amersfoort, Utrecht Centraal, Ede-Wageningen, Arnhem Centraal, Nijmegen]"
train_17,"[Etten-Leur, Roosendaal, Vlissingen, Roosendaal, Etten-Leur, Roosendaal, Etten-Leur]"
train_18,"[Apeldoorn, Amersfoort, Utrecht Centraal, Ede-Wageningen, Arnhem Centraal, Ede-Wageningen, Utrecht Centraal, s-Hertogenbosch, Utrecht Centraal, Gouda]"
train_19,"[Hengelo, Almelo, Deventer, Apeldoorn, Deventer, Almelo, Deventer, Zutphen, Apeldoorn, Deventer, Apeldoorn, Zutphen]"
train_20,"[Delft, Den Haag Centraal, Gouda, Den Haag HS, Delft, Schiedam Centrum, Delft, Den Haag Laan v NOI, Leiden Centraal, Alphen a/d Rijn, Utrecht Centraal, Gouda, Den Haag Centraal]"
score,1146.2134831460671
