train,stations
train_1,"[Amsterdam Amstel, Utrecht Centraal, Amsterdam Amstel, Almere Centrum, Lelystad Centrum, Almere Centrum, Amsterdam Centraal, Amsterdam Amstel, Amsterdam Zuid, Schiphol Airport, Leiden Centraal, Heemstede-Aerdenhout, Leiden Centraal]"
train_2,"[Roosendaal, Etten-Leur, Roosendaal, Vlissingen, Roosendaal, Dordrecht]"
train_3,"[Maastricht, Sittard, Heerlen, Sittard, Roermond, Weert, Roermond, Weert, Eindhoven, Tilburg, s-Hertogenbosch]"
train_4,"[Breda, Tilburg, s-Hertogenbosch, Oss, Nijmegen, Oss, s-Hertogenbosch, Utrecht Centraal, Ede-Wageningen, Arnhem Centraal, Ede-Wageningen, Arnhem Centraal, Ede-Wageningen]"
train_5,"[Leeuwarden, Groningen, Assen, Zwolle, Steenwijk, Heerenveen, Steenwijk, Heerenveen, Leeuwarden]"
train_6,"[Etten-Leur, Roosendaal, Etten-Leur, Roosendaal, Dordrecht, Rotterdam Blaak, Schiedam Centrum, Delft, Den Haag Laan v NOI, Delft, Den Haag Centraal, Leiden Centraal, Den Haag Laan v NOI, Gouda]"
train_7,"[Alkmaar, Castricum, Alkmaar, Hoorn, Alkmaar, Hoorn, Alkmaar, Den Helder]"
train_8,"[Oss, s-Hertogenbosch, Oss, Nijmegen, Arnhem Centraal, Dieren, Zutphen, Dieren, Arnhem Centraal, Ede-Wageningen, Arnhem Centraal, Nijmegen, Oss, s-Hertogenbosch, Tilburg]"
train_9,"[Beverwijk, Haarlem, Amsterdam Sloterdijk, Amsterdam Zuid, Amsterdam Amstel, Almere Centrum, Hilversum, Amsterdam Amstel, Almere Centrum]"
train_10,"[Tilburg, Eindhoven, s-Hertogenbosch, Oss, s-Hertogenbosch, Tilburg, Breda, Dordrecht, Roosendaal, Dordrecht, Rotterdam Blaak, Rotterdam Alexander]"
train_11,"[Gouda, Den Haag Centraal, Gouda, Rotterdam Alexander, Rotterdam Centraal, Rotterdam Alexander, Rotterdam Blaak, Schiedam Centrum, Rotterdam Centraal, Dordrecht, Breda, Tilburg, Eindhoven, Helmond, Eindhoven]"
train_12,"[Enschede, Hengelo, Enschede, Hengelo, Enschede, Hengelo, Enschede, Hengelo, Enschede, Hengelo, Almelo, Deventer, Apeldoorn, Zutphen, Dieren, Zutphen, Apeldoorn]"
train_13,"[Den Helder, Alkmaar, Hoorn, Zaandam, Hoorn, Alkmaar, Hoorn]"
train_14,"[Gouda, Den Haag Laan v NOI, Delft, Den Haag Centraal, Leiden Centraal, Den Haag HS, Gouda, Den Haag Laan v NOI, Leiden Centraal, Heemstede-Aerdenhout, Haarlem, Beverwijk]"
train_15,"[Rotterdam Blaak, Schiedam Centrum, Rotterdam Blaak, Rotterdam Alexander, Rotterdam Centraal, Dordrecht, Rotterdam Centraal, Schiedam Centrum, Rotterdam Centraal, Schiedam Centrum, Rotterdam Centraal, Dordrecht, Roosendaal, Dordrecht, Breda]"
train_16,"[Den Haag Centraal, Gouda, Utrecht Centraal, Alphen a/d Rijn, Gouda, Den Haag Laan v NOI, Gouda, Den Haag Centraal, Delft]"
train_17,"[Zwolle, Assen, Groningen, Assen, Groningen, Assen, Zwolle]"
train_18,"[Breda, Etten-Leur, Roosendaal, Vlissingen, Roosendaal, Etten-Leur, Breda, Etten-Leur]"
train_19,"[Amsterdam Zuid, Amsterdam Amstel, Amsterdam Zuid, Amsterdam Amstel, Almere Centrum, Hilversum, Utrecht Centraal, Schiphol Airport, Utrecht Centraal]"
train_20,"[Amsterdam Zuid, Amsterdam Sloterdijk, Amsterdam Zuid, Amsterdam Amstel, Hilversum, Utrecht Centraal, Amsterdam Amstel, Hilversum, Almere Centrum]"
score,2983.606741573034
