train,stations
train_1,"[Dieren, Zutphen, Dieren, Zutphen, Apeldoorn, Amersfoort, Utrecht Centraal, s-Hertogenbosch, Eindhoven, s-Hertogenbosch, Eindhoven, Helmond]"
train_2,"[Schiphol Airport, Amsterdam Zuid, Amsterdam Amstel, Almere Centrum, Amsterdam Amstel, Hilversum, Almere Centrum, Hilversum, Almere Centrum]"
train_3,"[Heerlen, Sittard, Maastricht, Sittard, Heerlen, Sittard, Heerlen, Sittard, Heerlen, Sittard, Roermond, Weert]"
train_4,"[Etten-Leur, Breda, Etten-Leur, Breda, Dordrecht, Breda, Etten-Leur, Roosendaal, Vlissingen]"
train_5,"[Amsterdam Centraal, Amsterdam Amstel, Utrecht Centraal, Ede-Wageningen, Utrecht Centraal, Ede-Wageningen, Arnhem Centraal, Dieren, Zutphen, Dieren, Arnhem Centraal, Dieren, Arnhem Centraal]"
train_6,"[Tilburg, Breda, Etten-Leur, Breda, Dordrecht, Breda, Dordrecht, Roosendaal, Etten-Leur, Breda, Tilburg, Eindhoven, Helmond, Eindhoven]"
train_7,"[Amsterdam Amstel, Almere Centrum, Hilversum, Almere Centrum, Amsterdam Centraal, Amsterdam Sloterdijk, Amsterdam Centraal, Almere Centrum, Hilversum, Utrecht Centraal]"
train_8,"[Amsterdam Amstel, Amsterdam Zuid, Amsterdam Sloterdijk, Amsterdam Centraal, Amsterdam Sloterdijk, Amsterdam Zuid, Schiphol Airport, Amsterdam Zuid, Amsterdam Amstel, Utrecht Centraal, Amsterdam Centraal, Almere Centrum, Hilversum]"
train_9,"[Deventer, Zutphen, Dieren, Arnhem Centraal, Nijmegen, Arnhem Centraal, Dieren, Arnhem Centraal, Nijmegen, Arnhem Centraal, Nijmegen, Arnhem Centraal, Ede-Wageningen, Utrecht Centraal]"
train_10,"[Steenwijk, Heerenveen, Leeuwarden, Heerenveen, Leeuwarden, Heerenveen, Steenwijk, Heerenveen, Steenwijk, Heerenveen, Steenwijk, Zwolle]"
train_11,"[Lelystad Centrum, Almere Centrum, Amsterdam Amstel, Hilversum, Amsterdam Amstel, Utrecht Centraal, Amsterdam Centraal, Almere Centrum]"
train_12,"[Dieren, Arnhem Centraal, Ede-Wageningen, Utrecht Centraal, Amersfoort, Utrecht Centraal, s-Hertogenbosch, Oss, s-Hertogenbosch, Oss, s-Hertogenbosch, Oss, s-Hertogenbosch]"
train_13,"[Heerenveen, Steenwijk, Zwolle, Assen, Zwolle, Steenwijk, Heerenveen, Steenwijk]"
train_14,"[Almere Centrum, Lelystad Centrum, Almere Centrum, Amsterdam Centraal, Amsterdam Amstel, Almere Centrum, Lelystad Centrum, Almere Centrum, Amsterdam Amstel, Almere Centrum, Lelystad Centrum]"
train_15,"[Vlissingen, Roosendaal, Vlissingen]"
train_16,"[Hoorn, Zaandam, Beverwijk, Castricum, Alkmaar, Hoorn, Zaandam, Castricum, Beverwijk, Castricum, Alkmaar]"
train_17,"[Helmond, Eindhoven, Weert, Eindhoven, Weert, Roermond, Weert, Roermond, Weert, Roermond, Sittard, Roermond, Sittard]"
train_18,"[Weert, Roermond, Sittard, Roermond, Weert, Roermond, Sittard, Maastricht, Sittard, Maastricht, Sittard, Heerlen, Sittard]"
train_19,"[Almelo, Hengelo, Almelo, Deventer, Apeldoorn, Deventer, Almelo, Zwolle, Amersfoort]"
train_20,"[Lelystad Centrum, Almere Centrum, Amsterdam Amstel, Amsterdam Zuid, Amsterdam Amstel, Amsterdam Centraal, Amsterdam Sloterdijk, Zaandam, Castricum, Beverwijk, Haarlem, Beverwijk, Castricum, Zaandam, Amsterdam Sloterdijk]"
score,848.7752808988762
