train,stations
train_1,"[Almere Centrum, Amsterdam Amstel, Hilversum, Utrecht Centraal, Amsterdam Centraal, Utrecht Centraal, s-Hertogenbosch, Oss, Nijmegen]"
train_2,"[Groningen, Assen, Groningen, Assen, Groningen, Assen, Zwolle, Steenwijk, Heerenveen, Steenwijk]"
train_3,"[Enschede, Hengelo, Almelo, Hengelo, Enschede, Hengelo, Almelo, Zwolle, Almelo, Hengelo, Almelo, Deventer]"
train_4,"[Den Haag HS, Gouda, Alphen a/d Rijn, Utrecht Centraal, s-Hertogenbosch, Oss, s-Hertogenbosch, Eindhoven, Weert, Eindhoven]"
train_5,"[Delft, Den Haag Laan v NOI, Delft, Schiedam Centrum, Delft, Den Haag Centraal, Gouda, Rotterdam Alexander, Rotterdam Centraal, Dordrecht, Roosendaal, Etten-Leur, Roosendaal, Etten-Leur, Roosendaal]"
train_6,"[Alphen a/d Rijn, Gouda, Rotterdam Alexander, Rotterdam Blaak, Schiedam Centrum, Rotterdam Centraal, Schiedam Centrum, Delft, Den Haag HS, Gouda, Den Haag Centraal, Delft, Den Haag HS, Delft, Den Haag Laan v NOI, Leiden Centraal, Heemstede-Aerdenhout]"
train_7,"[Den Haag Laan v NOI, Delft, Den Haag Centraal, Gouda, Utrecht Centraal, Amersfoort, Apeldoorn, Amersfoort, Zwolle]"
train_8,"[Tilburg, Eindhoven, Helmond, Eindhoven, Helmond, Venlo, Helmond, Eindhoven, s-Hertogenbosch, Eindhoven, Helmond]"
train_9,"[Ede-Wageningen, Utrecht Centraal, Amsterdam Amstel, Hilversum, Utrecht Centraal, Gouda, Den Haag Centraal, Gouda, Den Haag Centraal, Delft, Den Haag HS]"
train_10,"[Zutphen, Deventer, Apeldoorn, Deventer, Zutphen, Apeldoorn, Amersfoort, Apeldoorn, Amersfoort, Utrecht Centraal, Amsterdam Centraal]"
train_11,"[Den Haag HS, Delft, Schiedam Centrum, Rotterdam Centraal, Schiedam Centrum, Rotterdam Centraal, Rotterdam Alexander, Gouda, Den Haag Centraal, Leiden Centraal, Heemstede-Aerdenhout, Haarlem, Heemstede-Aerdenhout, Leiden Centraal, Heemstede-Aerdenhout, Leiden Centraal, Heemstede-Aerdenhout, Haarlem, Heemstede-Aerdenhout]"
train_12,"[Zaandam, Amsterdam Sloterdijk, Amsterdam Centraal, Amsterdam Sloterdijk, Amsterdam Centraal, Utrecht Centraal, Hilversum, Amsterdam Amstel, Utrecht Centraal, Ede-Wageningen, Arnhem Centraal, Dieren, Zutphen, Deventer]"
train_13,"[Den Haag Centraal, Delft, Den Haag Laan v NOI, Leiden Centraal, Den Haag HS, Gouda, Den Haag HS, Delft, Den Haag Laan v NOI, Leiden Centraal, Schiphol Airport, Leiden Centraal, Schiphol Airport]"
train_14,"[Castricum, Zaandam, Castricum, Zaandam, Hoorn, Alkmaar, Castricum, Beverwijk, Haarlem, Heemstede-Aerdenhout, Leiden Centraal, Alphen a/d Rijn]"
train_15,"[Utrecht Centraal, Schiphol Airport, Leiden Centraal, Alphen a/d Rijn, Utrecht Centraal, Amersfoort, Utrecht Centraal, Amsterdam Amstel, Almere Centrum, Lelystad Centrum]"
train_16,"[Deventer, Zwolle, Amersfoort, Zwolle, Assen, Zwolle]"
train_17,"[Den Haag Centraal, Delft, Den Haag Laan v NOI, Delft, Den Haag Laan v NOI, Gouda, Den Haag HS, Delft, Schiedam Centrum, Delft, Schiedam Centrum, Delft, Den Haag HS, Gouda]"
train_18,"[Ede-Wageningen, Utrecht Centraal, Schiphol Airport, Amsterdam Zuid, Schiphol Airport, Utrecht Centraal, Amersfoort, Apeldoorn, Amersfoort, Utrecht Centraal]"
train_19,"[Schiphol Airport, Amsterdam Zuid, Amsterdam Sloterdijk, Haarlem, Amsterdam Sloterdijk, Amsterdam Centraal, Amsterdam Amstel, Amsterdam Centraal, Amsterdam Amstel, Amsterdam Zuid, Amsterdam Sloterdijk, Haarlem, Heemstede-Aerdenhout, Haarlem, Heemstede-Aerdenhout, Leiden Centraal, Heemstede-Aerdenhout, Haarlem, Amsterdam Sloterdijk, Amsterdam Centraal]"
train_20,"[Nijmegen, Oss, s-Hertogenbosch, Eindhoven, Tilburg, s-Hertogenbosch, Tilburg, Breda, Etten-Leur, Breda, Dordrecht, Roosendaal]"
score,3102.3258426966295
