train,stations
train_1,"[Heerlen, Sittard, Heerlen, Sittard, Roermond, Weert, Eindhoven, s-Hertogenbosch, Tilburg, s-Hertogenbosch, Utrecht Centraal]"
train_2,"[Dordrecht, Breda, Dordrecht, Rotterdam Blaak, Rotterdam Alexander, Rotterdam Centraal, Dordrecht, Rotterdam Blaak, Dordrecht, Breda, Dordrecht, Roosendaal]"
train_3,"[Rotterdam Blaak, Rotterdam Alexander, Gouda, Utrecht Centraal, Gouda, Den Haag Centraal, Delft, Den Haag Centraal, Gouda, Den Haag HS, Delft, Den Haag Laan v NOI, Leiden Centraal]"
train_4,"[Den Haag Centraal, Gouda, Rotterdam Alexander, Gouda, Alphen a/d Rijn, Leiden Centraal, Den Haag Centraal, Gouda, Utrecht Centraal, Schiphol Airport]"
train_5,"[Assen, Zwolle, Steenwijk, Zwolle, Steenwijk, Heerenveen, Steenwijk, Heerenveen, Leeuwarden]"
train_6,"[Heerlen, Sittard, Roermond, Weert, Eindhoven, Helmond, Eindhoven, s-Hertogenbosch, Utrecht Centraal, Ede-Wageningen, Utrecht Centraal]"
train_7,"[Utrecht Centraal, Amsterdam Centraal, Utrecht Centraal, s-Hertogenbosch, Oss, s-Hertogenbosch, Utrecht Centraal, Amsterdam Centraal]"
train_8,"[Roermond, Weert, Eindhoven, Helmond, Eindhoven, Weert, Eindhoven, Helmond, Venlo, Helmond, Eindhoven, Weert]"
train_9,"[Gouda, Utrecht Centraal, Amersfoort, Zwolle, Assen, Zwolle, Deventer]"
train_10,"[Ede-Wageningen, Arnhem Centraal, Ede-Wageningen, Utrecht Centraal, Amersfoort, Zwolle, Almelo, Deventer, Zutphen]"
train_11,"[Breda, Etten-Leur, Breda, Tilburg, Breda, Etten-Leur, Breda, Etten-Leur, Breda, Dordrecht, Breda, Etten-Leur, Breda, Etten-Leur, Roosendaal, Etten-Leur, Breda, Dordrecht]"
train_12,"[Schiedam Centrum, Delft, Den Haag HS, Delft, Schiedam Centrum, Rotterdam Centraal, Dordrecht, Breda, Tilburg, Breda, Dordrecht, Roosendaal, Etten-Leur, Roosendaal]"
train_13,"[Steenwijk, Zwolle, Steenwijk, Zwolle, Almelo, Deventer, Almelo]"
train_14,"[Oss, Nijmegen, Arnhem Centraal, Ede-Wageningen, Utrecht Centraal, Schiphol Airport, Leiden Centraal, Den Haag HS, Gouda, Alphen a/d Rijn, Leiden Centraal]"
train_15,"[Leiden Centraal, Den Haag HS, Delft, Den Haag HS, Gouda, Den Haag Laan v NOI, Leiden Centraal, Schiphol Airport, Utrecht Centraal, Amersfoort]"
train_16,"[Lelystad Centrum, Almere Centrum, Amsterdam Centraal, Utrecht Centraal, Schiphol Airport, Utrecht Centraal, Gouda, Utrecht Centraal]"
train_17,"[Roosendaal, Dordrecht, Breda, Etten-Leur, Breda, Etten-Leur, Roosendaal, Etten-Leur, Breda, Tilburg, Breda, Tilburg, Eindhoven, s-Hertogenbosch]"
train_18,"[Helmond, Eindhoven, Helmond, Eindhoven, Weert, Roermond, Weert, Eindhoven, Helmond, Eindhoven, Weert, Eindhoven, s-Hertogenbosch, Oss]"
train_19,"[Etten-Leur, Breda, Etten-Leur, Breda, Dordrecht, Rotterdam Blaak, Schiedam Centrum, Delft, Den Haag Centraal, Gouda, Alphen a/d Rijn, Utrecht Centraal, Amsterdam Centraal]"
train_20,"[Den Haag HS, Leiden Centraal, Den Haag Laan v NOI, Leiden Centraal, Den Haag Centraal, Leiden Centraal, Den Haag Laan v NOI, Gouda, Utrecht Centraal, Ede-Wageningen, Utrecht Centraal]"
score,946.1348314606739
