train,stations
train_1,"[Delft, Den Haag HS, Gouda, Rotterdam Alexander, Rotterdam Centraal, Rotterdam Alexander, Gouda, Den Haag Laan v NOI, Delft, Den Haag HS, Gouda, Den Haag Laan v NOI, Leiden Centraal]"
train_2,"[Deventer, Zwolle, Amersfoort, Utrecht Centraal, Alphen a/d Rijn, Utrecht Centraal, s-Hertogenbosch]"
train_3,"[Dieren, Arnhem Centraal, Nijmegen, Oss, s-Hertogenbosch, Utrecht Centraal, Hilversum, Almere Centrum, Lelystad Centrum, Almere Centrum, Hilversum]"
train_4,"[Dieren, Arnhem Centraal, Ede-Wageningen, Utrecht Centraal, Hilversum, Almere Centrum, Amsterdam Centraal, Almere Centrum, Amsterdam Centraal, Almere Centrum]"
train_5,"[Sittard, Roermond, Weert, Eindhoven, Tilburg, Eindhoven, s-Hertogenbosch, Tilburg, Eindhoven, Weert, Roermond]"
train_6,"[Groningen, Assen, Groningen, Leeuwarden, Groningen, Leeuwarden, Groningen]"
train_7,"[Breda, Dordrecht, Rotterdam Blaak, Dordrecht, Breda, Etten-Leur, Breda, Dordrecht, Rotterdam Centraal, Schiedam Centrum, Rotterdam Blaak, Rotterdam Alexander, Rotterdam Blaak, Schiedam Centrum, Rotterdam Blaak]"
train_8,"[Hilversum, Utrecht Centraal, Amsterdam Centraal, Amsterdam Sloterdijk, Amsterdam Centraal, Utrecht Centraal, Amersfoort, Zwolle, Almelo]"
train_9,"[Assen, Groningen, Assen, Groningen, Leeuwarden, Heerenveen, Leeuwarden, Heerenveen, Steenwijk, Heerenveen, Steenwijk]"
train_10,"[Almere Centrum, Amsterdam Amstel, Amsterdam Centraal, Almere Centrum, Lelystad Centrum, Almere Centrum, Amsterdam Centraal, Almere Centrum, Hilversum, Utrecht Centraal]"
train_11,"[Dieren, Zutphen, Apeldoorn, Zutphen, Dieren, Arnhem Centraal, Nijmegen, Arnhem Centraal, Dieren, Zutphen, Apeldoorn, Zutphen, Dieren, Arnhem Centraal]"
train_12,"[Enschede, Hengelo, Almelo, Zwolle, Deventer, Almelo, Zwolle, Steenwijk]"
train_13,"[Zutphen, Dieren, Zutphen, Apeldoorn, Amersfoort, Apeldoorn, Amersfoort, Zwolle, Deventer]"
train_14,"[Den Haag Centraal, Leiden Centraal, Den Haag Centraal, Delft, Den Haag Centraal, Delft, Den Haag Centraal, Leiden Centraal, Alphen a/d Rijn, Leiden Centraal, Den Haag Centraal, Leiden Centraal, Heemstede-Aerdenhout, Haarlem, Beverwijk]"
train_15,"[Den Haag HS, Gouda, Den Haag HS, Delft, Schiedam Centrum, Rotterdam Blaak, Schiedam Centrum, Rotterdam Centraal, Schiedam Centrum, Rotterdam Blaak, Rotterdam Alexander, Gouda, Den Haag HS, Delft, Den Haag HS, Delft, Den Haag HS]"
train_16,"[Maastricht, Sittard, Maastricht, Sittard, Heerlen, Sittard, Roermond, Weert, Eindhoven, Weert, Eindhoven, Weert]"
train_17,"[Etten-Leur, Breda, Dordrecht, Breda, Tilburg, Eindhoven, s-Hertogenbosch, Tilburg, s-Hertogenbosch, Utrecht Centraal, s-Hertogenbosch]"
train_18,"[Heemstede-Aerdenhout, Leiden Centraal, Den Haag HS, Leiden Centraal, Heemstede-Aerdenhout, Haarlem, Amsterdam Sloterdijk, Amsterdam Zuid, Amsterdam Sloterdijk, Haarlem, Beverwijk, Zaandam, Amsterdam Sloterdijk, Zaandam, Amsterdam Sloterdijk]"
train_19,"[Rotterdam Alexander, Rotterdam Centraal, Schiedam Centrum, Rotterdam Blaak, Rotterdam Alexander, Rotterdam Centraal, Schiedam Centrum, Rotterdam Centraal, Schiedam Centrum, Rotterdam Blaak, Dordrecht, Rotterdam Blaak, Dordrecht, Rotterdam Blaak, Dordrecht, Rotterdam Blaak, Dordrecht, Rotterdam Blaak]"
train_20,"[Rotterdam Blaak, Rotterdam Alexander, Rotterdam Blaak, Dordrecht, Rotterdam Blaak, Schiedam Centrum, Rotterdam Blaak, Schiedam Centrum, Rotterdam Blaak, Schiedam Centrum, Rotterdam Centraal, Schiedam Centrum, Delft, Den Haag HS, Gouda, Den Haag Laan v NOI]"
score,1948.7303370786522
