train,stations
train_1,"[Ede-Wageningen, Arnhem Centraal, Nijmegen, Arnhem Centraal, Dieren, Arnhem Centraal, Ede-Wageningen, Arnhem Centraal, Dieren, Zutphen, Deventer, Almelo, Zwolle]"
train_2,"[Heemstede-Aerdenhout, Leiden Centraal, Den Haag Centraal, Gouda, Den Haag Centraal, Gouda, Utrecht Centraal, Ede-Wageningen, Utrecht Centraal, Ede-Wageningen, Arnhem Centraal]"
train_3,"[Venlo, Helmond, Venlo, Helmond, Eindhoven, s-Hertogenbosch, Oss, Nijmegen, Arnhem Centraal, Dieren]"
train_4,"[Maastricht, Sittard, Roermond, Sittard, Roermond, Sittard, Heerlen, Sittard, Heerlen, Sittard, Heerlen, Sittard]"
train_5,"[Roosendaal, Vlissingen, Roosendaal]"
train_6,"[Dieren, Zutphen, Apeldoorn, Zutphen, Deventer, Zwolle, Almelo, Hengelo, Almelo]"
train_7,"[Vlissingen, Roosendaal, Dordrecht, Rotterdam Blaak, Schiedam Centrum, Delft, Den Haag HS, Leiden Centraal, Den Haag HS, Gouda]"
train_8,"[Nijmegen, Oss, Nijmegen, Arnhem Centraal, Nijmegen, Arnhem Centraal, Ede-Wageningen, Arnhem Centraal, Dieren, Zutphen, Deventer, Zwolle, Amersfoort]"
train_9,"[Hoorn, Zaandam, Amsterdam Sloterdijk, Haarlem, Beverwijk, Haarlem, Heemstede-Aerdenhout, Haarlem, Heemstede-Aerdenhout, Haarlem, Heemstede-Aerdenhout, Leiden Centraal, Heemstede-Aerdenhout, Haarlem, Amsterdam Sloterdijk, Amsterdam Zuid, Amsterdam Amstel]"
train_10,"[Zutphen, Dieren, Zutphen, Apeldoorn, Amersfoort, Utrecht Centraal, Schiphol Airport, Utrecht Centraal, Amsterdam Amstel]"
train_11,"[Alphen a/d Rijn, Utrecht Centraal, Amsterdam Centraal, Utrecht Centraal, Alphen a/d Rijn, Utrecht Centraal, Ede-Wageningen, Arnhem Centraal]"
train_12,"[Etten-Leur, Breda, Etten-Leur, Roosendaal, Etten-Leur, Roosendaal, Vlissingen, Roosendaal]"
train_13,"[Hengelo, Almelo, Deventer, Almelo, Hengelo, Almelo, Hengelo, Enschede, Hengelo, Enschede, Hengelo, Almelo, Zwolle]"
train_14,"[Zwolle, Amersfoort, Zwolle, Assen, Groningen, Assen]"
train_15,"[Deventer, Zutphen, Apeldoorn, Amersfoort, Utrecht Centraal, Hilversum, Utrecht Centraal, Amersfoort, Utrecht Centraal, s-Hertogenbosch, Tilburg]"
train_16,"[Apeldoorn, Zutphen, Deventer, Zutphen, Deventer, Almelo, Zwolle, Almelo]"
train_17,"[Dordrecht, Roosendaal, Dordrecht, Roosendaal, Vlissingen]"
train_18,"[Hoorn, Zaandam, Amsterdam Sloterdijk, Amsterdam Zuid, Amsterdam Sloterdijk, Zaandam, Amsterdam Sloterdijk, Haarlem, Beverwijk, Zaandam, Beverwijk, Haarlem]"
train_19,"[Castricum, Beverwijk, Haarlem, Heemstede-Aerdenhout, Haarlem, Amsterdam Sloterdijk, Amsterdam Centraal, Utrecht Centraal, Amsterdam Amstel, Hilversum, Amsterdam Amstel, Amsterdam Centraal]"
train_20,"[Den Haag HS, Delft, Den Haag Centraal, Leiden Centraal, Schiphol Airport, Utrecht Centraal, Ede-Wageningen, Arnhem Centraal, Dieren, Arnhem Centraal, Nijmegen, Oss, s-Hertogenbosch]"
score,1528.9325842696626
