train,stations
train_1,"[Oss, s-Hertogenbosch, Eindhoven, Helmond, Eindhoven, Weert, Eindhoven, Weert, Roermond, Weert, Roermond, Sittard, Maastricht]"
train_2,"[Utrecht Centraal, Ede-Wageningen, Utrecht Centraal, Amsterdam Amstel, Hilversum, Almere Centrum, Hilversum, Utrecht Centraal]"
train_3,"[Zutphen, Apeldoorn, Zutphen, Dieren, Zutphen, Apeldoorn, Deventer, Apeldoorn, Deventer, Zutphen, Deventer, Zwolle, Deventer]"
train_4,"[Tilburg, Breda, Tilburg, Eindhoven, Helmond, Venlo, Helmond, Venlo, Helmond]"
train_5,"[Roermond, Weert, Roermond, Weert, Roermond, Sittard, Roermond, Sittard, Maastricht, Sittard, Roermond, Sittard, Roermond]"
train_6,"[Weert, Eindhoven, s-Hertogenbosch, Utrecht Centraal, Alphen a/d Rijn, Leiden Centraal, Den Haag HS, Gouda, Den Haag HS, Gouda]"
train_7,"[Zutphen, Deventer, Zutphen, Deventer, Apeldoorn, Zutphen, Dieren, Zutphen, Apeldoorn, Deventer, Zutphen, Dieren, Arnhem Centraal, Ede-Wageningen, Utrecht Centraal]"
train_8,"[Sittard, Heerlen, Sittard, Maastricht, Sittard, Heerlen, Sittard, Heerlen, Sittard, Heerlen, Sittard, Maastricht]"
train_9,"[Den Helder, Alkmaar, Den Helder, Alkmaar, Castricum, Zaandam, Amsterdam Sloterdijk, Zaandam, Beverwijk]"
train_10,"[Zwolle, Steenwijk, Zwolle, Steenwijk, Zwolle, Amersfoort, Apeldoorn, Amersfoort]"
train_11,"[Etten-Leur, Breda, Tilburg, s-Hertogenbosch, Oss, s-Hertogenbosch, Tilburg, Eindhoven, Helmond, Eindhoven, Tilburg, Breda, Tilburg, Eindhoven]"
train_12,"[Leiden Centraal, Den Haag Laan v NOI, Gouda, Den Haag Centraal, Gouda, Alphen a/d Rijn, Utrecht Centraal, Schiphol Airport, Leiden Centraal, Den Haag Laan v NOI]"
train_13,"[Enschede, Hengelo, Enschede, Hengelo, Almelo, Deventer, Zutphen, Dieren, Arnhem Centraal, Ede-Wageningen, Utrecht Centraal, s-Hertogenbosch, Eindhoven]"
train_14,"[Amsterdam Amstel, Amsterdam Centraal, Amsterdam Sloterdijk, Haarlem, Amsterdam Sloterdijk, Amsterdam Centraal, Utrecht Centraal, Amersfoort, Apeldoorn, Amersfoort, Utrecht Centraal, Ede-Wageningen, Arnhem Centraal]"
train_15,"[Alkmaar, Castricum, Zaandam, Amsterdam Sloterdijk, Haarlem, Heemstede-Aerdenhout, Haarlem, Beverwijk, Haarlem, Beverwijk, Castricum, Beverwijk, Zaandam, Hoorn]"
train_16,"[Sittard, Heerlen, Sittard, Roermond, Weert, Eindhoven, Weert, Roermond, Weert, Roermond, Weert, Roermond, Sittard]"
train_17,"[Heemstede-Aerdenhout, Haarlem, Heemstede-Aerdenhout, Leiden Centraal, Heemstede-Aerdenhout, Haarlem, Beverwijk, Haarlem, Heemstede-Aerdenhout, Haarlem, Beverwijk, Castricum, Beverwijk, Castricum, Beverwijk, Castricum]"
train_18,"[Schiphol Airport, Amsterdam Zuid, Schiphol Airport, Utrecht Centraal, Amsterdam Centraal, Almere Centrum, Amsterdam Amstel, Amsterdam Centraal, Amsterdam Sloterdijk, Amsterdam Zuid, Schiphol Airport, Amsterdam Zuid, Amsterdam Amstel]"
train_19,"[Almere Centrum, Amsterdam Centraal, Utrecht Centraal, Schiphol Airport, Leiden Centraal, Den Haag Laan v NOI, Gouda, Den Haag Centraal, Leiden Centraal, Den Haag HS]"
train_20,"[Utrecht Centraal, Alphen a/d Rijn, Gouda, Utrecht Centraal, Alphen a/d Rijn, Utrecht Centraal, Gouda, Den Haag Centraal, Gouda]"
score,1704.0112359550558
