train,stations
train_1,"[Breda, Tilburg, s-Hertogenbosch, Oss, s-Hertogenbosch, Oss, Nijmegen, Oss, Nijmegen, Oss, s-Hertogenbosch, Tilburg, Breda]"
train_2,"[Etten-Leur, Breda, Tilburg, Eindhoven, Helmond, Venlo, Helmond, Venlo, Helmond]"
train_3,"[Apeldoorn, Amersfoort, Utrecht Centraal, Amsterdam Amstel, Hilversum, Almere Centrum, Lelystad Centrum, Almere Centrum, Amsterdam Amstel, Amsterdam Zuid]"
train_4,"[Castricum, Alkmaar, Castricum, Zaandam, Hoorn, Zaandam, Castricum, Alkmaar, Hoorn, Zaandam, Beverwijk]"
train_5,"[Amsterdam Amstel, Almere Centrum, Lelystad Centrum, Almere Centrum, Lelystad Centrum, Almere Centrum, Lelystad Centrum, Almere Centrum, Hilversum, Amsterdam Amstel]"
train_6,"[Etten-Leur, Breda, Dordrecht, Roosendaal, Etten-Leur, Breda, Etten-Leur, Roosendaal, Vlissingen]"
train_7,"[Rotterdam Alexander, Rotterdam Centraal, Rotterdam Alexander, Rotterdam Centraal, Dordrecht, Rotterdam Blaak, Rotterdam Alexander, Rotterdam Centraal, Dordrecht, Roosendaal, Vlissingen]"
train_8,"[Heemstede-Aerdenhout, Haarlem, Heemstede-Aerdenhout, Leiden Centraal, Den Haag HS, Delft, Den Haag HS, Leiden Centraal, Alphen a/d Rijn, Gouda, Alphen a/d Rijn, Leiden Centraal, Den Haag HS, Leiden Centraal, Alphen a/d Rijn]"
train_9,"[Assen, Groningen, Leeuwarden, Heerenveen, Leeuwarden, Groningen, Assen, Zwolle]"
train_10,"[s-Hertogenbosch, Tilburg, s-Hertogenbosch, Tilburg, Eindhoven, Weert, Eindhoven, s-Hertogenbosch, Eindhoven, Weert, Roermond]"
train_11,"[Roosendaal, Dordrecht, Roosendaal, Etten-Leur, Roosendaal, Etten-Leur, Roosendaal, Vlissingen]"
train_12,"[Almelo, Deventer, Almelo, Zwolle, Steenwijk, Heerenveen, Leeuwarden, Groningen]"
train_13,"[Heerenveen, Steenwijk, Zwolle, Steenwijk, Zwolle, Almelo, Deventer, Almelo]"
train_14,"[Amersfoort, Apeldoorn, Deventer, Apeldoorn, Deventer, Apeldoorn, Zutphen, Apeldoorn, Zutphen, Deventer, Apeldoorn, Zutphen]"
train_15,"[Utrecht Centraal, Amsterdam Centraal, Almere Centrum, Amsterdam Amstel, Almere Centrum, Hilversum, Almere Centrum, Lelystad Centrum]"
train_16,"[Den Helder, Alkmaar, Castricum, Zaandam, Hoorn, Alkmaar, Den Helder, Alkmaar]"
train_17,"[Tilburg, Eindhoven, Helmond, Eindhoven, Helmond, Venlo, Helmond, Eindhoven, Helmond, Eindhoven, Weert, Roermond]"
train_18,"[Hilversum, Utrecht Centraal, Schiphol Airport, Utrecht Centraal, Alphen a/d Rijn, Gouda, Utrecht Centraal, Gouda]"
train_19,"[Steenwijk, Zwolle, Almelo, Deventer, Apeldoorn, Amersfoort, Zwolle]"
train_20,"[Zaandam, Castricum, Beverwijk, Haarlem, Heemstede-Aerdenhout, Haarlem, Heemstede-Aerdenhout, Leiden Centraal, Heemstede-Aerdenhout, Haarlem, Beverwijk, Zaandam, Beverwijk]"
score,1280.2134831460671
