train,stations
train_1,"[Arnhem Centraal, Nijmegen, Oss, s-Hertogenbosch, Oss, Nijmegen, Arnhem Centraal, Dieren, Zutphen, Deventer, Apeldoorn, Deventer, Zwolle]"
train_2,"[Vlissingen, Roosendaal, Vlissingen]"
train_3,"[Lelystad Centrum, Almere Centrum, Hilversum, Utrecht Centraal, Hilversum, Almere Centrum, Amsterdam Amstel, Amsterdam Centraal, Almere Centrum, Amsterdam Amstel]"
train_4,"[Maastricht, Sittard, Roermond, Weert, Eindhoven, Weert, Eindhoven, s-Hertogenbosch, Tilburg, Eindhoven, Helmond]"
train_5,"[Oss, Nijmegen, Arnhem Centraal, Dieren, Zutphen, Apeldoorn, Amersfoort, Zwolle, Amersfoort]"
train_6,"[Beverwijk, Castricum, Zaandam, Castricum, Beverwijk, Haarlem, Amsterdam Sloterdijk, Haarlem, Amsterdam Sloterdijk, Amsterdam Centraal, Almere Centrum, Hilversum, Amsterdam Amstel]"
train_7,"[Heerenveen, Leeuwarden, Groningen, Leeuwarden, Heerenveen, Steenwijk, Zwolle, Deventer]"
train_8,"[Amersfoort, Utrecht Centraal, Gouda, Alphen a/d Rijn, Leiden Centraal, Den Haag Laan v NOI, Gouda, Rotterdam Alexander, Rotterdam Centraal, Schiedam Centrum, Rotterdam Blaak, Schiedam Centrum, Delft, Schiedam Centrum, Delft]"
train_9,"[Enschede, Hengelo, Enschede, Hengelo, Enschede, Hengelo, Almelo, Zwolle, Steenwijk, Zwolle, Steenwijk]"
train_10,"[Schiphol Airport, Utrecht Centraal, Amsterdam Amstel, Utrecht Centraal, Amsterdam Amstel, Amsterdam Centraal, Almere Centrum, Amsterdam Centraal, Amsterdam Amstel, Amsterdam Zuid, Schiphol Airport, Leiden Centraal]"
train_11,"[Delft, Den Haag Laan v NOI, Gouda, Utrecht Centraal, Schiphol Airport, Utrecht Centraal, Alphen a/d Rijn, Gouda]"
train_12,"[Venlo, Helmond, Venlo, Helmond, Eindhoven, Tilburg, Breda, Etten-Leur, Roosendaal]"
train_13,"[Rotterdam Centraal, Schiedam Centrum, Delft, Den Haag Centraal, Leiden Centraal, Alphen a/d Rijn, Utrecht Centraal, Amsterdam Centraal, Almere Centrum, Amsterdam Amstel, Utrecht Centraal]"
train_14,"[Utrecht Centraal, Hilversum, Almere Centrum, Hilversum, Utrecht Centraal, Amsterdam Centraal, Utrecht Centraal, Amsterdam Amstel]"
train_15,"[Vlissingen, Roosendaal, Dordrecht, Rotterdam Centraal, Dordrecht, Rotterdam Blaak, Schiedam Centrum, Rotterdam Centraal, Rotterdam Alexander, Rotterdam Centraal]"
train_16,"[Almere Centrum, Amsterdam Amstel, Amsterdam Zuid, Amsterdam Sloterdijk, Zaandam, Beverwijk, Castricum, Alkmaar, Hoorn, Alkmaar, Hoorn]"
train_17,"[Hengelo, Almelo, Deventer, Zutphen, Dieren, Zutphen, Deventer, Apeldoorn, Deventer, Almelo, Deventer, Almelo, Hengelo]"
train_18,"[Utrecht Centraal, Ede-Wageningen, Arnhem Centraal, Ede-Wageningen, Utrecht Centraal, Amsterdam Centraal, Utrecht Centraal, Amsterdam Amstel, Amsterdam Zuid, Schiphol Airport]"
train_19,"[Schiedam Centrum, Rotterdam Centraal, Rotterdam Alexander, Rotterdam Blaak, Schiedam Centrum, Delft, Den Haag HS, Delft, Den Haag HS, Delft, Den Haag HS, Delft, Den Haag Laan v NOI, Leiden Centraal, Schiphol Airport, Utrecht Centraal]"
train_20,"[s-Hertogenbosch, Eindhoven, Weert, Roermond, Weert, Roermond, Weert, Roermond, Weert, Roermond, Weert, Roermond, Sittard]"
score,3368.685393258427
