train,stations
train_1,"[Zaandam, Castricum, Alkmaar, Hoorn, Zaandam, Castricum, Beverwijk, Zaandam, Castricum, Zaandam, Hoorn]"
train_2,"[Groningen, Leeuwarden, Groningen, Assen, Groningen, Leeuwarden, Groningen]"
train_3,"[Etten-Leur, Roosendaal, Etten-Leur, Roosendaal, Vlissingen, Roosendaal]"
train_4,"[Hengelo, Enschede, Hengelo, Almelo, Hengelo, Enschede, Hengelo, Enschede, Hengelo, Enschede, Hengelo, Almelo, Hengelo, Almelo, Deventer, Almelo, Hengelo, Enschede, Hengelo]"
train_5,"[Groningen, Leeuwarden, Groningen, Leeuwarden, Groningen, Assen, Groningen]"
train_6,"[Rotterdam Alexander, Rotterdam Centraal, Schiedam Centrum, Rotterdam Blaak, Dordrecht, Breda, Etten-Leur, Roosendaal, Dordrecht, Rotterdam Blaak, Dordrecht, Rotterdam Blaak, Rotterdam Alexander, Rotterdam Centraal, Dordrecht]"
train_7,"[Utrecht Centraal, Schiphol Airport, Leiden Centraal, Den Haag Laan v NOI, Leiden Centraal, Den Haag Laan v NOI, Gouda, Den Haag Laan v NOI, Delft, Den Haag HS, Leiden Centraal, Den Haag Laan v NOI]"
train_8,"[Leiden Centraal, Alphen a/d Rijn, Utrecht Centraal, Amersfoort, Utrecht Centraal, Amsterdam Centraal, Almere Centrum, Amsterdam Amstel, Amsterdam Centraal, Almere Centrum]"
train_9,"[Steenwijk, Heerenveen, Steenwijk, Zwolle, Almelo, Zwolle, Amersfoort]"
train_10,"[Leeuwarden, Heerenveen, Steenwijk, Zwolle, Assen, Zwolle, Steenwijk, Heerenveen]"
train_11,"[Zwolle, Steenwijk, Heerenveen, Leeuwarden, Heerenveen, Leeuwarden, Heerenveen, Leeuwarden, Groningen]"
train_12,"[Den Haag HS, Leiden Centraal, Schiphol Airport, Leiden Centraal, Den Haag HS, Delft, Den Haag Centraal, Leiden Centraal, Schiphol Airport, Utrecht Centraal, Hilversum, Utrecht Centraal]"
train_13,"[Zaandam, Hoorn, Zaandam, Castricum, Beverwijk, Castricum, Alkmaar, Castricum, Alkmaar, Hoorn, Zaandam]"
train_14,"[Arnhem Centraal, Nijmegen, Arnhem Centraal, Ede-Wageningen, Utrecht Centraal, Hilversum, Utrecht Centraal, Schiphol Airport, Amsterdam Zuid, Amsterdam Sloterdijk, Zaandam, Beverwijk]"
train_15,"[Castricum, Beverwijk, Zaandam, Hoorn, Zaandam, Hoorn, Alkmaar, Den Helder]"
train_16,"[Apeldoorn, Deventer, Almelo, Hengelo, Almelo, Zwolle, Almelo, Deventer, Zutphen]"
train_17,"[Den Haag Centraal, Gouda, Den Haag HS, Gouda, Den Haag HS, Leiden Centraal, Alphen a/d Rijn, Leiden Centraal, Schiphol Airport, Leiden Centraal, Alphen a/d Rijn]"
train_18,"[Heemstede-Aerdenhout, Haarlem, Beverwijk, Zaandam, Beverwijk, Haarlem, Heemstede-Aerdenhout, Leiden Centraal, Schiphol Airport, Amsterdam Zuid, Amsterdam Amstel, Utrecht Centraal, Gouda]"
train_19,"[Steenwijk, Heerenveen, Leeuwarden, Heerenveen, Steenwijk, Heerenveen, Steenwijk, Heerenveen, Steenwijk, Heerenveen, Leeuwarden]"
train_20,"[Heerenveen, Steenwijk, Zwolle, Steenwijk, Heerenveen, Steenwijk, Heerenveen, Steenwijk, Heerenveen, Steenwijk, Heerenveen, Steenwijk]"
score,1582.2921348314612
