train,stations
train_1,"[Beverwijk, Castricum, Alkmaar, Hoorn, Alkmaar, Hoorn, Alkmaar, Castricum, Beverwijk, Zaandam]"
train_2,"[Amsterdam Centraal, Utrecht Centraal, Amsterdam Centraal, Amsterdam Sloterdijk, Haarlem, Amsterdam Sloterdijk, Amsterdam Zuid, Amsterdam Amstel, Utrecht Centraal, Hilversum, Almere Centrum]"
train_3,"[Breda, Tilburg, s-Hertogenbosch, Eindhoven, Weert, Eindhoven, Tilburg, s-Hertogenbosch, Utrecht Centraal, Amersfoort]"
train_4,"[Tilburg, Eindhoven, Weert, Roermond, Sittard, Maastricht, Sittard, Maastricht, Sittard, Heerlen, Sittard, Maastricht]"
train_5,"[Utrecht Centraal, Schiphol Airport, Amsterdam Zuid, Amsterdam Amstel, Hilversum, Utrecht Centraal, Amsterdam Amstel, Amsterdam Zuid, Amsterdam Sloterdijk, Haarlem, Heemstede-Aerdenhout, Leiden Centraal, Den Haag HS]"
train_6,"[Zaandam, Beverwijk, Zaandam, Hoorn, Alkmaar, Hoorn, Zaandam, Beverwijk]"
train_7,"[Groningen, Assen, Zwolle, Steenwijk, Zwolle, Steenwijk, Zwolle]"
train_8,"[Etten-Leur, Breda, Etten-Leur, Roosendaal, Dordrecht, Breda, Etten-Leur, Roosendaal, Vlissingen]"
train_9,"[Steenwijk, Heerenveen, Leeuwarden, Heerenveen, Leeuwarden, Heerenveen, Leeuwarden, Heerenveen, Steenwijk, Zwolle, Deventer]"
train_10,"[Hoorn, Alkmaar, Castricum, Beverwijk, Castricum, Beverwijk, Haarlem, Heemstede-Aerdenhout, Haarlem, Heemstede-Aerdenhout, Haarlem, Beverwijk, Haarlem, Amsterdam Sloterdijk, Amsterdam Centraal, Amsterdam Sloterdijk, Amsterdam Centraal]"
train_11,"[Eindhoven, s-Hertogenbosch, Tilburg, s-Hertogenbosch, Tilburg, Eindhoven, s-Hertogenbosch, Eindhoven, Tilburg, Breda, Dordrecht]"
train_12,"[Heerlen, Sittard, Maastricht, Sittard, Roermond, Weert, Eindhoven, s-Hertogenbosch, Utrecht Centraal, Gouda, Alphen a/d Rijn]"
train_13,"[Sittard, Heerlen, Sittard, Heerlen, Sittard, Heerlen, Sittard, Heerlen, Sittard, Maastricht, Sittard, Roermond]"
train_14,"[Zwolle, Amersfoort, Zwolle, Assen, Zwolle]"
train_15,"[Alkmaar, Castricum, Alkmaar, Hoorn, Zaandam, Hoorn, Alkmaar, Den Helder]"
train_16,"[Sittard, Heerlen, Sittard, Roermond, Sittard, Heerlen, Sittard, Heerlen, Sittard, Heerlen, Sittard, Roermond, Weert]"
train_17,"[Sittard, Maastricht, Sittard, Heerlen, Sittard, Maastricht, Sittard, Roermond, Sittard, Heerlen, Sittard, Maastricht]"
train_18,"[Beverwijk, Castricum, Beverwijk, Haarlem, Heemstede-Aerdenhout, Haarlem, Heemstede-Aerdenhout, Haarlem, Beverwijk, Zaandam, Beverwijk, Castricum, Beverwijk]"
train_19,"[Eindhoven, Tilburg, Eindhoven, Tilburg, s-Hertogenbosch, Oss, Nijmegen, Oss, s-Hertogenbosch, Utrecht Centraal]"
train_20,"[Hengelo, Enschede, Hengelo, Almelo, Hengelo, Enschede, Hengelo, Enschede, Hengelo, Enschede, Hengelo, Almelo, Hengelo, Almelo, Zwolle, Deventer]"
score,393.33707865168526
