train,stations
train_1,"[Heerenveen, Steenwijk, Zwolle, Steenwijk, Zwolle, Assen, Zwolle]"
train_2,"[Sittard, Maastricht, Sittard, Roermond, Weert, Roermond, Sittard, Roermond, Weert, Eindhoven, Weert, Eindhoven, Helmond]"
train_3,"[Gouda, Rotterdam Alexander, Rotterdam Centraal, Rotterdam Alexander, Rotterdam Centraal, Schiedam Centrum, Delft, Den Haag Centraal, Gouda, Den Haag Centraal, Leiden Centraal, Alphen a/d Rijn, Gouda, Alphen a/d Rijn, Gouda]"
train_4,"[Rotterdam Alexander, Rotterdam Blaak, Rotterdam Alexander, Rotterdam Blaak, Dordrecht, Rotterdam Blaak, Schiedam Centrum, Rotterdam Centraal, Dordrecht, Breda, Dordrecht, Breda, Tilburg, Eindhoven]"
train_5,"[Den Helder, Alkmaar, Den Helder, Alkmaar, Den Helder]"
train_6,"[Heerlen, Sittard, Heerlen, Sittard, Heerlen, Sittard, Heerlen, Sittard, Heerlen, Sittard, Roermond, Weert, Roermond]"
train_7,"[Almere Centrum, Amsterdam Centraal, Almere Centrum, Lelystad Centrum, Almere Centrum, Amsterdam Amstel, Utrecht Centraal, Hilversum, Utrecht Centraal, Amsterdam Amstel, Amsterdam Centraal]"
train_8,"[Oss, s-Hertogenbosch, Eindhoven, Weert, Eindhoven, Helmond, Venlo, Helmond, Venlo]"
train_9,"[Tilburg, Eindhoven, Tilburg, s-Hertogenbosch, Tilburg, Eindhoven, Helmond, Eindhoven, s-Hertogenbosch, Tilburg, s-Hertogenbosch, Tilburg]"
train_10,"[Sittard, Maastricht, Sittard, Roermond, Sittard, Maastricht, Sittard, Maastricht, Sittard, Heerlen, Sittard, Heerlen]"
train_11,"[Amsterdam Sloterdijk, Zaandam, Amsterdam Sloterdijk, Haarlem, Heemstede-Aerdenhout, Haarlem, Beverwijk, Zaandam, Hoorn, Zaandam, Amsterdam Sloterdijk, Amsterdam Centraal, Utrecht Centraal]"
train_12,"[Nijmegen, Arnhem Centraal, Nijmegen, Arnhem Centraal, Nijmegen, Arnhem Centraal, Ede-Wageningen, Utrecht Centraal, Amsterdam Amstel, Almere Centrum, Lelystad Centrum, Almere Centrum]"
train_13,"[Gouda, Den Haag Laan v NOI, Leiden Centraal, Heemstede-Aerdenhout, Leiden Centraal, Den Haag HS, Gouda, Utrecht Centraal, Amsterdam Centraal, Amsterdam Sloterdijk, Haarlem, Amsterdam Sloterdijk, Zaandam]"
train_14,"[Lelystad Centrum, Almere Centrum, Lelystad Centrum, Almere Centrum, Amsterdam Centraal, Almere Centrum, Amsterdam Centraal, Almere Centrum, Lelystad Centrum, Almere Centrum, Amsterdam Amstel]"
train_15,"[Arnhem Centraal, Nijmegen, Arnhem Centraal, Ede-Wageningen, Utrecht Centraal, Amsterdam Centraal, Amsterdam Amstel, Amsterdam Zuid, Amsterdam Amstel, Amsterdam Centraal, Almere Centrum, Amsterdam Centraal, Amsterdam Sloterdijk]"
train_16,"[Eindhoven, Weert, Roermond, Sittard, Heerlen, Sittard, Maastricht, Sittard, Heerlen, Sittard, Heerlen, Sittard]"
train_17,"[Amsterdam Amstel, Hilversum, Amsterdam Amstel, Hilversum, Almere Centrum, Amsterdam Amstel, Utrecht Centraal, Hilversum]"
train_18,"[Almelo, Zwolle, Steenwijk, Heerenveen, Steenwijk, Zwolle, Amersfoort]"
train_19,"[Weert, Roermond, Sittard, Maastricht, Sittard, Roermond, Sittard, Heerlen, Sittard, Heerlen, Sittard, Heerlen, Sittard]"
train_20,"[Roermond, Weert, Roermond, Weert, Eindhoven, Helmond, Eindhoven, Tilburg, Eindhoven, Weert, Roermond, Weert]"
score,1087.8539325842703
