train,stations
train_1,"[Roermond, Weert, Eindhoven, s-Hertogenbosch, Oss, Nijmegen, Arnhem Centraal, Dieren, Zutphen, Apeldoorn, Amersfoort, Apeldoorn]"
train_2,"[Hengelo, Almelo, Deventer, Apeldoorn, Deventer, Zwolle, Steenwijk, Zwolle, Assen]"
train_3,"[Almelo, Zwolle, Assen, Zwolle, Assen]"
train_4,"[Enschede, Hengelo, Enschede, Hengelo, Enschede, Hengelo, Enschede, Hengelo, Almelo, Zwolle, Almelo, Hengelo, Almelo]"
train_5,"[Gouda, Utrecht Centraal, Amsterdam Amstel, Amsterdam Zuid, Amsterdam Sloterdijk, Zaandam, Beverwijk, Haarlem, Heemstede-Aerdenhout, Haarlem, Beverwijk, Zaandam]"
train_6,"[Weert, Roermond, Weert, Roermond, Weert, Roermond, Weert, Roermond, Sittard, Heerlen, Sittard, Roermond, Weert]"
train_7,"[Gouda, Den Haag Centraal, Leiden Centraal, Schiphol Airport, Utrecht Centraal, s-Hertogenbosch, Oss, s-Hertogenbosch, Utrecht Centraal, Ede-Wageningen]"
train_8,"[Eindhoven, Tilburg, s-Hertogenbosch, Oss, Nijmegen, Oss, Nijmegen, Arnhem Centraal, Ede-Wageningen, Arnhem Centraal, Ede-Wageningen, Utrecht Centraal]"
train_9,"[Gouda, Den Haag HS, Delft, Schiedam Centrum, Rotterdam Blaak, Schiedam Centrum, Rotterdam Blaak, Rotterdam Alexander, Gouda, Rotterdam Alexander, Rotterdam Centraal, Schiedam Centrum, Rotterdam Centraal, Dordrecht, Breda, Tilburg, Breda]"
train_10,"[Den Haag HS, Gouda, Den Haag Laan v NOI, Delft, Schiedam Centrum, Delft, Den Haag Laan v NOI, Leiden Centraal, Schiphol Airport, Leiden Centraal, Den Haag HS, Leiden Centraal, Alphen a/d Rijn]"
train_11,"[Groningen, Leeuwarden, Groningen, Assen, Groningen, Assen, Groningen, Leeuwarden]"
train_12,"[Den Haag HS, Delft, Den Haag HS, Gouda, Alphen a/d Rijn, Utrecht Centraal, Hilversum, Amsterdam Amstel, Almere Centrum]"
train_13,"[Lelystad Centrum, Almere Centrum, Hilversum, Almere Centrum, Lelystad Centrum, Almere Centrum, Amsterdam Amstel, Almere Centrum, Hilversum]"
train_14,"[Almelo, Hengelo, Almelo, Hengelo, Enschede, Hengelo, Almelo, Deventer, Zwolle, Amersfoort, Zwolle]"
train_15,"[Rotterdam Blaak, Dordrecht, Rotterdam Blaak, Dordrecht, Breda, Etten-Leur, Breda, Tilburg, s-Hertogenbosch, Eindhoven, Helmond, Venlo]"
train_16,"[Beverwijk, Zaandam, Beverwijk, Haarlem, Beverwijk, Castricum, Zaandam, Hoorn, Alkmaar]"
train_17,"[Vlissingen, Roosendaal, Etten-Leur, Breda, Dordrecht, Roosendaal, Dordrecht, Rotterdam Centraal, Rotterdam Alexander, Rotterdam Centraal]"
train_18,"[Amsterdam Zuid, Amsterdam Amstel, Amsterdam Centraal, Utrecht Centraal, Gouda, Den Haag HS, Gouda, Alphen a/d Rijn, Utrecht Centraal, s-Hertogenbosch]"
train_19,"[Leeuwarden, Heerenveen, Steenwijk, Heerenveen, Steenwijk, Heerenveen, Steenwijk, Zwolle, Amersfoort]"
train_20,"[Haarlem, Amsterdam Sloterdijk, Amsterdam Centraal, Amsterdam Sloterdijk, Zaandam, Amsterdam Sloterdijk, Amsterdam Centraal, Utrecht Centraal, Amsterdam Centraal, Amsterdam Sloterdijk, Haarlem, Beverwijk, Zaandam, Hoorn]"
score,3603.7640449438204
