train,stations
train_1,"[Roermond, Weert, Roermond, Sittard, Maastricht, Sittard, Maastricht, Sittard, Roermond, Weert, Eindhoven, Weert]"
train_2,"[s-Hertogenbosch, Eindhoven, Tilburg, Eindhoven, Helmond, Eindhoven, s-Hertogenbosch, Oss, Nijmegen, Oss, s-Hertogenbosch, Tilburg]"
train_3,"[Nijmegen, Oss, Nijmegen, Arnhem Centraal, Dieren, Arnhem Centraal, Ede-Wageningen, Utrecht Centraal, Ede-Wageningen, Utrecht Centraal, Hilversum]"
train_4,"[Alkmaar, Den Helder, Alkmaar, Castricum, Zaandam, Hoorn, Zaandam, Amsterdam Sloterdijk, Amsterdam Centraal, Amsterdam Amstel]"
train_5,"[Den Haag HS, Gouda, Den Haag Laan v NOI, Leiden Centraal, Den Haag Laan v NOI, Gouda, Den Haag Laan v NOI, Delft, Den Haag HS, Leiden Centraal, Heemstede-Aerdenhout, Haarlem]"
train_6,"[Amsterdam Zuid, Schiphol Airport, Utrecht Centraal, Amersfoort, Zwolle, Almelo, Zwolle]"
train_7,"[Groningen, Assen, Zwolle, Amersfoort, Apeldoorn, Amersfoort, Apeldoorn]"
train_8,"[Haarlem, Beverwijk, Castricum, Zaandam, Amsterdam Sloterdijk, Haarlem, Heemstede-Aerdenhout, Haarlem, Amsterdam Sloterdijk, Amsterdam Zuid, Schiphol Airport, Leiden Centraal, Alphen a/d Rijn, Utrecht Centraal]"
train_9,"[Amersfoort, Zwolle, Amersfoort, Apeldoorn, Zutphen, Dieren, Zutphen, Deventer, Zwolle]"
train_10,"[Roosendaal, Etten-Leur, Roosendaal, Etten-Leur, Breda, Tilburg, Eindhoven, Tilburg, s-Hertogenbosch, Eindhoven, Tilburg, Eindhoven]"
train_11,"[Zutphen, Deventer, Almelo, Deventer, Zutphen, Apeldoorn, Deventer, Almelo, Zwolle]"
train_12,"[Breda, Etten-Leur, Breda, Tilburg, Eindhoven, Helmond, Venlo, Helmond, Eindhoven, s-Hertogenbosch, Utrecht Centraal]"
train_13,"[Dieren, Arnhem Centraal, Nijmegen, Oss, Nijmegen, Arnhem Centraal, Ede-Wageningen, Arnhem Centraal, Ede-Wageningen, Utrecht Centraal, Ede-Wageningen, Arnhem Centraal, Ede-Wageningen, Arnhem Centraal]"
train_14,"[Amsterdam Sloterdijk, Haarlem, Heemstede-Aerdenhout, Leiden Centraal, Alphen a/d Rijn, Leiden Centraal, Schiphol Airport, Utrecht Centraal, Amersfoort, Apeldoorn, Zutphen, Dieren]"
train_15,"[Den Helder, Alkmaar, Den Helder, Alkmaar, Hoorn, Zaandam, Amsterdam Sloterdijk]"
train_16,"[Delft, Den Haag HS, Leiden Centraal, Den Haag Laan v NOI, Leiden Centraal, Schiphol Airport, Amsterdam Zuid, Amsterdam Amstel, Amsterdam Zuid, Amsterdam Amstel, Utrecht Centraal, s-Hertogenbosch, Eindhoven, s-Hertogenbosch]"
train_17,"[Almelo, Hengelo, Enschede, Hengelo, Enschede, Hengelo, Almelo, Zwolle, Assen, Groningen]"
train_18,"[Dordrecht, Rotterdam Blaak, Schiedam Centrum, Rotterdam Centraal, Dordrecht, Rotterdam Blaak, Dordrecht, Roosendaal, Etten-Leur, Roosendaal, Dordrecht, Roosendaal]"
train_19,"[Lelystad Centrum, Almere Centrum, Amsterdam Amstel, Hilversum, Almere Centrum, Amsterdam Centraal, Amsterdam Amstel, Amsterdam Centraal, Amsterdam Sloterdijk, Zaandam, Hoorn]"
train_20,"[Alphen a/d Rijn, Gouda, Den Haag Centraal, Delft, Den Haag Laan v NOI, Delft, Schiedam Centrum, Rotterdam Blaak, Rotterdam Alexander, Gouda, Den Haag Laan v NOI, Delft, Schiedam Centrum, Rotterdam Centraal, Schiedam Centrum, Rotterdam Blaak]"
score,3274.685393258427
