train,stations
train_1,"[Weert, Roermond, Sittard, Maastricht, Sittard, Maastricht, Sittard, Roermond, Weert, Roermond, Weert, Eindhoven]"
train_2,"[Venlo, Helmond, Venlo, Helmond, Eindhoven, s-Hertogenbosch, Utrecht Centraal, Hilversum]"
train_3,"[Den Haag HS, Leiden Centraal, Den Haag Laan v NOI, Leiden Centraal, Den Haag Centraal, Leiden Centraal, Den Haag HS, Gouda, Den Haag Laan v NOI, Leiden Centraal, Den Haag HS, Delft, Den Haag Laan v NOI, Delft]"
train_4,"[Rotterdam Alexander, Rotterdam Blaak, Dordrecht, Roosendaal, Etten-Leur, Roosendaal, Etten-Leur, Breda, Etten-Leur, Roosendaal, Dordrecht, Roosendaal]"
train_5,"[Utrecht Centraal, Schiphol Airport, Leiden Centraal, Den Haag Laan v NOI, Leiden Centraal, Schiphol Airport, Amsterdam Zuid, Schiphol Airport, Amsterdam Zuid, Amsterdam Sloterdijk, Amsterdam Centraal, Amsterdam Amstel, Hilversum]"
train_6,"[Amsterdam Centraal, Amsterdam Amstel, Amsterdam Centraal, Utrecht Centraal, Ede-Wageningen, Arnhem Centraal, Ede-Wageningen, Utrecht Centraal, Alphen a/d Rijn, Leiden Centraal, Heemstede-Aerdenhout, Leiden Centraal]"
train_7,"[Heerenveen, Steenwijk, Heerenveen, Steenwijk, Heerenveen, Steenwijk, Zwolle, Amersfoort, Apeldoorn, Deventer, Zutphen]"
train_8,"[Weert, Eindhoven, s-Hertogenbosch, Tilburg, Eindhoven, Weert, Eindhoven, Weert, Eindhoven, Helmond, Eindhoven, Tilburg]"
train_9,"[Delft, Den Haag Laan v NOI, Gouda, Den Haag Laan v NOI, Delft, Den Haag HS, Leiden Centraal, Den Haag Laan v NOI, Delft, Den Haag Laan v NOI, Leiden Centraal, Den Haag Laan v NOI, Delft, Den Haag HS]"
train_10,"[Tilburg, Eindhoven, Tilburg, Breda, Dordrecht, Rotterdam Centraal, Schiedam Centrum, Delft, Den Haag HS, Leiden Centraal, Den Haag Laan v NOI, Gouda]"
train_11,"[Alphen a/d Rijn, Utrecht Centraal, Gouda, Den Haag Laan v NOI, Gouda, Alphen a/d Rijn, Gouda, Den Haag Laan v NOI]"
train_12,"[Assen, Groningen, Leeuwarden, Heerenveen, Steenwijk, Zwolle, Assen, Groningen]"
train_13,"[Sittard, Maastricht, Sittard, Heerlen, Sittard, Heerlen, Sittard, Heerlen, Sittard, Heerlen, Sittard, Maastricht]"
train_14,"[Roermond, Sittard, Roermond, Weert, Roermond, Sittard, Roermond, Sittard, Roermond, Weert, Roermond, Weert, Roermond]"
train_15,"[Alphen a/d Rijn, Utrecht Centraal, Amersfoort, Zwolle, Amersfoort, Apeldoorn, Amersfoort]"
train_16,"[Vlissingen, Roosendaal, Vlissingen]"
train_17,"[Amersfoort, Utrecht Centraal, s-Hertogenbosch, Utrecht Centraal, Hilversum, Almere Centrum, Hilversum, Almere Centrum]"
train_18,"[Utrecht Centraal, s-Hertogenbosch, Eindhoven, s-Hertogenbosch, Oss, s-Hertogenbosch, Tilburg, s-Hertogenbosch, Utrecht Centraal, Amsterdam Centraal]"
train_19,"[Breda, Tilburg, s-Hertogenbosch, Utrecht Centraal, Schiphol Airport, Utrecht Centraal, Alphen a/d Rijn, Leiden Centraal, Alphen a/d Rijn]"
train_20,"[Dieren, Arnhem Centraal, Nijmegen, Oss, s-Hertogenbosch, Utrecht Centraal, Amersfoort, Apeldoorn, Amersfoort, Zwolle]"
score,1515.9325842696626
