train,stations
train_1,"[Nijmegen, Arnhem Centraal, Ede-Wageningen, Utrecht Centraal, Alphen a/d Rijn, Utrecht Centraal, Amsterdam Centraal, Almere Centrum, Amsterdam Centraal, Amsterdam Amstel]"
train_2,"[Zutphen, Deventer, Apeldoorn, Amersfoort, Zwolle, Steenwijk, Zwolle, Deventer, Zwolle]"
train_3,"[Amsterdam Zuid, Amsterdam Amstel, Amsterdam Zuid, Schiphol Airport, Amsterdam Zuid, Amsterdam Amstel, Almere Centrum, Amsterdam Amstel, Utrecht Centraal, Amersfoort, Apeldoorn, Amersfoort]"
train_4,"[Amersfoort, Apeldoorn, Deventer, Almelo, Zwolle, Assen]"
train_5,"[Amsterdam Zuid, Amsterdam Amstel, Utrecht Centraal, Amersfoort, Apeldoorn, Amersfoort, Utrecht Centraal, Amersfoort, Zwolle]"
train_6,"[Amersfoort, Apeldoorn, Zutphen, Dieren, Arnhem Centraal, Ede-Wageningen, Utrecht Centraal, Amersfoort, Utrecht Centraal, Alphen a/d Rijn]"
train_7,"[Amsterdam Zuid, Amsterdam Amstel, Utrecht Centraal, s-Hertogenbosch, Oss, s-Hertogenbosch, Oss, Nijmegen, Arnhem Centraal, Ede-Wageningen, Arnhem Centraal, Nijmegen, Arnhem Centraal, Nijmegen]"
train_8,"[Zaandam, Castricum, Beverwijk, Haarlem, Beverwijk, Zaandam, Beverwijk, Castricum, Beverwijk, Zaandam]"
train_9,"[Sittard, Roermond, Sittard, Roermond, Weert, Roermond, Weert, Roermond, Weert, Roermond, Sittard, Maastricht, Sittard]"
train_10,"[Amsterdam Sloterdijk, Haarlem, Heemstede-Aerdenhout, Leiden Centraal, Den Haag HS, Gouda, Rotterdam Alexander, Rotterdam Blaak, Schiedam Centrum, Delft, Den Haag Centraal, Delft, Den Haag Centraal, Leiden Centraal, Schiphol Airport]"
train_11,"[Helmond, Eindhoven, Helmond, Eindhoven, Helmond, Eindhoven, Tilburg, Breda, Dordrecht, Rotterdam Blaak, Schiedam Centrum, Rotterdam Blaak, Dordrecht, Breda, Tilburg]"
train_12,"[Arnhem Centraal, Ede-Wageningen, Arnhem Centraal, Ede-Wageningen, Utrecht Centraal, Amsterdam Centraal, Amsterdam Amstel, Amsterdam Zuid, Amsterdam Sloterdijk, Amsterdam Centraal, Almere Centrum, Hilversum]"
train_13,"[Alphen a/d Rijn, Gouda, Rotterdam Alexander, Rotterdam Blaak, Dordrecht, Roosendaal, Dordrecht, Rotterdam Centraal, Rotterdam Alexander, Rotterdam Centraal, Dordrecht, Rotterdam Centraal, Rotterdam Alexander]"
train_14,"[Weert, Eindhoven, Weert, Eindhoven, Helmond, Eindhoven, s-Hertogenbosch, Oss, Nijmegen, Arnhem Centraal, Dieren, Zutphen, Dieren, Arnhem Centraal, Dieren]"
train_15,"[Deventer, Zutphen, Dieren, Zutphen, Dieren, Zutphen, Apeldoorn, Amersfoort, Apeldoorn, Zutphen, Apeldoorn, Amersfoort]"
train_16,"[Alkmaar, Castricum, Beverwijk, Zaandam, Castricum, Zaandam, Beverwijk, Zaandam, Castricum, Alkmaar, Den Helder]"
train_17,"[Hengelo, Enschede, Hengelo, Enschede, Hengelo, Almelo, Hengelo, Almelo, Deventer, Zutphen, Deventer, Zutphen, Dieren, Zutphen, Deventer, Almelo]"
train_18,"[Weert, Eindhoven, Helmond, Eindhoven, Helmond, Venlo, Helmond, Eindhoven, Weert, Roermond, Weert, Eindhoven]"
train_19,"[Den Haag HS, Leiden Centraal, Heemstede-Aerdenhout, Leiden Centraal, Den Haag Laan v NOI, Leiden Centraal, Den Haag HS, Leiden Centraal, Den Haag Laan v NOI, Delft, Den Haag Laan v NOI, Gouda, Den Haag Centraal, Gouda]"
train_20,"[Etten-Leur, Breda, Tilburg, Breda, Etten-Leur, Roosendaal, Vlissingen, Roosendaal]"
score,2643.8876404494376
