train,stations
train_1,"[Zutphen, Dieren, Arnhem Centraal, Ede-Wageningen, Utrecht Centraal, Ede-Wageningen, Utrecht Centraal, Schiphol Airport, Amsterdam Zuid, Amsterdam Amstel, Amsterdam Centraal]"
train_2,"[Heerlen, Sittard, Roermond, Weert, Eindhoven, s-Hertogenbosch, Eindhoven, Tilburg, Eindhoven, s-Hertogenbosch, Tilburg]"
train_3,"[Ede-Wageningen, Arnhem Centraal, Ede-Wageningen, Utrecht Centraal, Hilversum, Almere Centrum, Lelystad Centrum, Almere Centrum, Hilversum, Utrecht Centraal, Ede-Wageningen]"
train_4,"[Zwolle, Amersfoort, Utrecht Centraal, Amersfoort, Utrecht Centraal, Schiphol Airport, Amsterdam Zuid, Amsterdam Sloterdijk, Zaandam, Amsterdam Sloterdijk, Amsterdam Zuid, Amsterdam Sloterdijk]"
train_5,"[Heerenveen, Steenwijk, Heerenveen, Leeuwarden, Groningen, Assen, Groningen, Leeuwarden]"
train_6,"[Roosendaal, Dordrecht, Roosendaal, Dordrecht, Rotterdam Centraal, Schiedam Centrum, Delft, Den Haag HS, Leiden Centraal, Den Haag HS, Leiden Centraal, Schiphol Airport]"
train_7,"[Amsterdam Sloterdijk, Amsterdam Zuid, Schiphol Airport, Utrecht Centraal, s-Hertogenbosch, Tilburg, Eindhoven, Tilburg, Breda, Etten-Leur, Roosendaal]"
train_8,"[Rotterdam Centraal, Dordrecht, Rotterdam Blaak, Dordrecht, Breda, Tilburg, Breda, Dordrecht, Breda, Dordrecht, Roosendaal]"
train_9,"[Assen, Zwolle, Amersfoort, Apeldoorn, Amersfoort, Zwolle]"
train_10,"[Gouda, Alphen a/d Rijn, Utrecht Centraal, s-Hertogenbosch, Tilburg, Breda, Dordrecht, Rotterdam Centraal, Rotterdam Alexander, Rotterdam Centraal, Schiedam Centrum, Rotterdam Centraal, Rotterdam Alexander, Rotterdam Centraal]"
train_11,"[Groningen, Leeuwarden, Groningen, Leeuwarden, Heerenveen, Steenwijk, Zwolle]"
train_12,"[Hoorn, Zaandam, Castricum, Beverwijk, Zaandam, Beverwijk, Zaandam, Castricum, Beverwijk, Zaandam]"
train_13,"[Vlissingen, Roosendaal, Vlissingen]"
train_14,"[Rotterdam Blaak, Schiedam Centrum, Rotterdam Centraal, Dordrecht, Rotterdam Blaak, Dordrecht, Roosendaal, Vlissingen]"
train_15,"[Den Helder, Alkmaar, Hoorn, Alkmaar, Castricum, Zaandam, Hoorn, Alkmaar, Hoorn]"
train_16,"[Delft, Den Haag Laan v NOI, Leiden Centraal, Alphen a/d Rijn, Utrecht Centraal, Ede-Wageningen, Utrecht Centraal, Amersfoort, Zwolle]"
train_17,"[Weert, Roermond, Weert, Roermond, Weert, Eindhoven, Helmond, Eindhoven, s-Hertogenbosch, Tilburg, Eindhoven, s-Hertogenbosch, Tilburg]"
train_18,"[Dieren, Zutphen, Deventer, Zwolle, Almelo, Deventer, Almelo, Hengelo, Almelo]"
train_19,"[Delft, Den Haag HS, Gouda, Den Haag HS, Leiden Centraal, Den Haag Centraal, Delft, Den Haag Laan v NOI, Gouda, Den Haag Centraal, Gouda]"
train_20,"[Amersfoort, Zwolle, Amersfoort, Utrecht Centraal, Schiphol Airport, Amsterdam Zuid, Schiphol Airport, Amsterdam Zuid, Amsterdam Amstel, Utrecht Centraal]"
score,2488.8089887640454
