train,stations
train_1,"[Ede-Wageningen, Utrecht Centraal, Amsterdam Centraal, Amsterdam Amstel, Hilversum, Almere Centrum, Lelystad Centrum, Almere Centrum, Amsterdam Centraal, Amsterdam Sloterdijk, Zaandam, Amsterdam Sloterdijk]"
train_2,"[Venlo, Helmond, Eindhoven, Helmond, Eindhoven, Helmond, Eindhoven, Helmond, Eindhoven, Tilburg, Eindhoven, Helmond, Venlo]"
train_3,"[Castricum, Alkmaar, Den Helder, Alkmaar, Den Helder, Alkmaar, Castricum, Beverwijk]"
train_4,"[Schiphol Airport, Utrecht Centraal, s-Hertogenbosch, Utrecht Centraal, Ede-Wageningen, Utrecht Centraal, Hilversum, Amsterdam Amstel]"
train_5,"[Etten-Leur, Breda, Etten-Leur, Roosendaal, Dordrecht, Breda, Etten-Leur, Roosendaal, Dordrecht, Rotterdam Centraal, Dordrecht, Rotterdam Blaak, Rotterdam Alexander, Rotterdam Centraal]"
train_6,"[Amsterdam Zuid, Schiphol Airport, Amsterdam Zuid, Schiphol Airport, Amsterdam Zuid, Amsterdam Amstel, Almere Centrum, Amsterdam Amstel, Utrecht Centraal, Amsterdam Centraal, Amsterdam Sloterdijk, Amsterdam Zuid, Schiphol Airport, Leiden Centraal]"
train_7,"[Heerenveen, Steenwijk, Zwolle, Almelo, Deventer, Zwolle, Steenwijk, Heerenveen]"
train_8,"[Breda, Tilburg, Eindhoven, Weert, Roermond, Sittard, Maastricht, Sittard, Heerlen, Sittard, Heerlen, Sittard]"
train_9,"[Amsterdam Centraal, Utrecht Centraal, Amsterdam Amstel, Utrecht Centraal, Schiphol Airport, Amsterdam Zuid, Schiphol Airport, Amsterdam Zuid, Schiphol Airport, Leiden Centraal, Den Haag Centraal, Leiden Centraal, Den Haag Laan v NOI]"
train_10,"[Lelystad Centrum, Almere Centrum, Lelystad Centrum, Almere Centrum, Lelystad Centrum, Almere Centrum, Amsterdam Amstel, Amsterdam Centraal, Amsterdam Amstel, Amsterdam Zuid, Amsterdam Sloterdijk, Haarlem, Heemstede-Aerdenhout, Haarlem, Amsterdam Sloterdijk, Zaandam]"
train_11,"[Groningen, Assen, Zwolle, Assen, Zwolle, Steenwijk, Heerenveen]"
train_12,"[Hengelo, Almelo, Hengelo, Enschede, Hengelo, Enschede, Hengelo, Almelo, Deventer, Almelo, Zwolle]"
train_13,"[s-Hertogenbosch, Utrecht Centraal, Schiphol Airport, Leiden Centraal, Den Haag Centraal, Gouda, Den Haag Centraal, Delft, Den Haag HS, Leiden Centraal, Heemstede-Aerdenhout, Haarlem]"
train_14,"[Ede-Wageningen, Utrecht Centraal, Ede-Wageningen, Arnhem Centraal, Dieren, Zutphen, Dieren, Zutphen, Deventer, Apeldoorn, Deventer, Apeldoorn, Zutphen, Deventer, Apeldoorn]"
train_15,"[Amsterdam Amstel, Utrecht Centraal, Hilversum, Utrecht Centraal, Hilversum, Almere Centrum, Hilversum, Amsterdam Amstel, Hilversum]"
train_16,"[Etten-Leur, Breda, Tilburg, Eindhoven, s-Hertogenbosch, Utrecht Centraal, Gouda, Den Haag Centraal, Leiden Centraal, Heemstede-Aerdenhout, Leiden Centraal, Heemstede-Aerdenhout]"
train_17,"[Rotterdam Alexander, Rotterdam Centraal, Schiedam Centrum, Rotterdam Blaak, Rotterdam Alexander, Rotterdam Centraal, Rotterdam Alexander, Gouda, Utrecht Centraal, Amersfoort, Apeldoorn, Zutphen, Apeldoorn, Amersfoort]"
train_18,"[Amsterdam Centraal, Almere Centrum, Lelystad Centrum, Almere Centrum, Amsterdam Centraal, Amsterdam Amstel, Hilversum, Almere Centrum, Lelystad Centrum, Almere Centrum, Amsterdam Centraal]"
train_19,"[Delft, Den Haag Laan v NOI, Leiden Centraal, Den Haag HS, Gouda, Utrecht Centraal, Amersfoort, Zwolle, Almelo, Hengelo]"
train_20,"[s-Hertogenbosch, Utrecht Centraal, Ede-Wageningen, Utrecht Centraal, s-Hertogenbosch, Tilburg, s-Hertogenbosch, Eindhoven, Helmond, Eindhoven, Helmond]"
score,2722.2471910112363
