train,stations
train_1,"[Amersfoort, Zwolle, Assen, Groningen, Leeuwarden, Heerenveen, Steenwijk, Heerenveen]"
train_2,"[Groningen, Leeuwarden, Groningen, Assen, Zwolle, Amersfoort]"
train_3,"[Etten-Leur, Roosendaal, Dordrecht, Roosendaal, Vlissingen]"
train_4,"[Groningen, Assen, Groningen, Leeuwarden, Groningen, Assen, Zwolle]"
train_5,"[Lelystad Centrum, Almere Centrum, Lelystad Centrum, Almere Centrum, Amsterdam Amstel, Amsterdam Centraal, Amsterdam Amstel, Amsterdam Centraal, Almere Centrum, Hilversum, Utrecht Centraal, Gouda]"
train_6,"[Den Haag Laan v NOI, Delft, Den Haag Centraal, Gouda, Den Haag Laan v NOI, Leiden Centraal, Den Haag Laan v NOI, Gouda, Utrecht Centraal, Amsterdam Centraal]"
train_7,"[Tilburg, Breda, Tilburg, Eindhoven, Helmond, Venlo, Helmond, Venlo, Helmond]"
train_8,"[Dordrecht, Roosendaal, Dordrecht, Rotterdam Blaak, Dordrecht, Roosendaal, Etten-Leur, Roosendaal, Etten-Leur, Breda, Etten-Leur, Roosendaal]"
train_9,"[Schiedam Centrum, Delft, Den Haag Laan v NOI, Delft, Den Haag HS, Gouda, Alphen a/d Rijn, Leiden Centraal, Den Haag HS, Leiden Centraal, Den Haag Laan v NOI, Delft, Den Haag Centraal, Gouda, Rotterdam Alexander]"
train_10,"[Heerenveen, Leeuwarden, Heerenveen, Leeuwarden, Groningen, Leeuwarden, Heerenveen, Steenwijk, Zwolle]"
train_11,"[Hoorn, Alkmaar, Den Helder, Alkmaar, Den Helder, Alkmaar]"
train_12,"[Schiedam Centrum, Delft, Den Haag Centraal, Leiden Centraal, Alphen a/d Rijn, Leiden Centraal, Schiphol Airport, Amsterdam Zuid, Amsterdam Amstel, Amsterdam Centraal, Utrecht Centraal, Amsterdam Centraal]"
train_13,"[Ede-Wageningen, Arnhem Centraal, Ede-Wageningen, Utrecht Centraal, Alphen a/d Rijn, Leiden Centraal, Alphen a/d Rijn, Leiden Centraal, Den Haag Centraal, Gouda, Den Haag HS, Delft]"
train_14,"[Amsterdam Amstel, Amsterdam Centraal, Amsterdam Amstel, Amsterdam Zuid, Amsterdam Sloterdijk, Amsterdam Centraal, Utrecht Centraal, Gouda, Utrecht Centraal, Amersfoort, Apeldoorn, Amersfoort]"
train_15,"[Weert, Eindhoven, Tilburg, Breda, Etten-Leur, Breda, Dordrecht, Rotterdam Centraal, Schiedam Centrum, Rotterdam Blaak, Dordrecht, Rotterdam Blaak, Rotterdam Alexander, Gouda, Rotterdam Alexander]"
train_16,"[Dordrecht, Rotterdam Centraal, Schiedam Centrum, Delft, Den Haag HS, Gouda, Den Haag Centraal, Leiden Centraal, Alphen a/d Rijn, Utrecht Centraal, s-Hertogenbosch, Tilburg]"
train_17,"[Schiphol Airport, Utrecht Centraal, Amsterdam Amstel, Hilversum, Utrecht Centraal, s-Hertogenbosch, Tilburg, Breda, Dordrecht]"
train_18,"[Vlissingen, Roosendaal, Vlissingen]"
train_19,"[Rotterdam Blaak, Rotterdam Alexander, Gouda, Alphen a/d Rijn, Gouda, Rotterdam Alexander, Gouda, Rotterdam Alexander, Rotterdam Centraal, Schiedam Centrum, Rotterdam Centraal, Rotterdam Alexander, Gouda, Den Haag HS, Gouda]"
train_20,"[s-Hertogenbosch, Oss, s-Hertogenbosch, Utrecht Centraal, Ede-Wageningen, Utrecht Centraal, Hilversum, Almere Centrum, Lelystad Centrum, Almere Centrum]"
score,1677.2921348314612
