train,stations
train_1,"[Den Helder, Alkmaar, Den Helder, Alkmaar, Hoorn, Zaandam]"
train_2,"[Amersfoort, Zwolle, Amersfoort, Utrecht Centraal, Alphen a/d Rijn, Utrecht Centraal, Ede-Wageningen]"
train_3,"[Amsterdam Zuid, Amsterdam Sloterdijk, Haarlem, Heemstede-Aerdenhout, Haarlem, Heemstede-Aerdenhout, Haarlem, Beverwijk, Zaandam, Castricum, Beverwijk, Haarlem, Beverwijk, Castricum, Beverwijk]"
train_4,"[Arnhem Centraal, Dieren, Arnhem Centraal, Dieren, Zutphen, Dieren, Arnhem Centraal, Ede-Wageningen, Arnhem Centraal, Dieren, Zutphen, Deventer, Almelo, Hengelo, Enschede, Hengelo, Enschede, Hengelo]"
train_5,"[Rotterdam Blaak, Dordrecht, Rotterdam Blaak, Dordrecht, Roosendaal, Etten-Leur, Breda, Dordrecht, Breda, Tilburg, Breda, Etten-Leur, Breda, Tilburg]"
train_6,"[Roosendaal, Vlissingen, Roosendaal, Etten-Leur, Roosendaal]"
train_7,"[Almere Centrum, Lelystad Centrum, Almere Centrum, Amsterdam Amstel, Utrecht Centraal, Alphen a/d Rijn, Utrecht Centraal, Amersfoort, Utrecht Centraal]"
train_8,"[Groningen, Assen, Groningen, Assen, Groningen, Assen, Zwolle, Deventer, Almelo]"
train_9,"[Enschede, Hengelo, Enschede, Hengelo, Almelo, Deventer, Zutphen, Dieren, Arnhem Centraal, Nijmegen, Arnhem Centraal, Dieren, Arnhem Centraal, Dieren, Arnhem Centraal, Ede-Wageningen, Arnhem Centraal]"
train_10,"[Den Haag Centraal, Gouda, Den Haag HS, Leiden Centraal, Heemstede-Aerdenhout, Haarlem, Beverwijk, Haarlem, Amsterdam Sloterdijk, Amsterdam Zuid, Amsterdam Sloterdijk, Haarlem, Amsterdam Sloterdijk, Haarlem]"
train_11,"[Heemstede-Aerdenhout, Haarlem, Beverwijk, Haarlem, Amsterdam Sloterdijk, Zaandam, Amsterdam Sloterdijk, Zaandam, Hoorn, Alkmaar, Castricum, Alkmaar, Den Helder]"
train_12,"[Venlo, Helmond, Venlo, Helmond, Venlo, Helmond]"
train_13,"[Arnhem Centraal, Ede-Wageningen, Utrecht Centraal, Schiphol Airport, Utrecht Centraal, Schiphol Airport, Amsterdam Zuid, Schiphol Airport, Amsterdam Zuid, Schiphol Airport]"
train_14,"[Zutphen, Dieren, Zutphen, Apeldoorn, Zutphen, Apeldoorn, Amersfoort, Zwolle, Steenwijk, Heerenveen]"
train_15,"[Hilversum, Amsterdam Amstel, Utrecht Centraal, Ede-Wageningen, Utrecht Centraal, Amersfoort, Apeldoorn, Zutphen, Dieren, Arnhem Centraal]"
train_16,"[Amersfoort, Apeldoorn, Amersfoort, Apeldoorn, Amersfoort, Zwolle, Deventer, Apeldoorn]"
train_17,"[Amsterdam Sloterdijk, Zaandam, Hoorn, Alkmaar, Hoorn, Alkmaar, Hoorn, Alkmaar]"
train_18,"[Enschede, Hengelo, Almelo, Hengelo, Almelo, Hengelo, Almelo, Hengelo, Enschede, Hengelo, Enschede, Hengelo, Enschede, Hengelo, Almelo, Hengelo, Enschede, Hengelo, Almelo, Hengelo, Almelo]"
train_19,"[Hengelo, Almelo, Zwolle, Almelo, Deventer, Zutphen, Apeldoorn, Amersfoort]"
train_20,"[Enschede, Hengelo, Enschede, Hengelo, Almelo, Zwolle, Amersfoort, Zwolle, Deventer]"
score,363.33707865168526
