train,stations
train_1,"[Ede-Wageningen, Utrecht Centraal, Alphen a/d Rijn, Gouda, Den Haag Centraal, Gouda, Alphen a/d Rijn, Utrecht Centraal, Amersfoort]"
train_2,"[Lelystad Centrum, Almere Centrum, Hilversum, Almere Centrum, Amsterdam Amstel, Hilversum, Amsterdam Amstel, Amsterdam Zuid, Amsterdam Amstel]"
train_3,"[Dordrecht, Rotterdam Blaak, Rotterdam Alexander, Gouda, Alphen a/d Rijn, Utrecht Centraal, Alphen a/d Rijn, Utrecht Centraal, Ede-Wageningen, Arnhem Centraal]"
train_4,"[Weert, Roermond, Weert, Eindhoven, Helmond, Eindhoven, Tilburg, Eindhoven, Weert, Roermond, Weert, Roermond, Sittard]"
train_5,"[Groningen, Assen, Groningen, Assen, Zwolle, Assen, Zwolle]"
train_6,"[Leeuwarden, Groningen, Leeuwarden, Groningen, Assen, Groningen, Leeuwarden]"
train_7,"[Nijmegen, Oss, s-Hertogenbosch, Eindhoven, Weert, Roermond, Weert, Eindhoven, Tilburg, Eindhoven, Helmond]"
train_8,"[Amsterdam Amstel, Amsterdam Centraal, Amsterdam Amstel, Utrecht Centraal, Ede-Wageningen, Arnhem Centraal, Dieren, Arnhem Centraal, Ede-Wageningen, Arnhem Centraal, Ede-Wageningen, Arnhem Centraal, Dieren, Arnhem Centraal, Nijmegen]"
train_9,"[Heerlen, Sittard, Roermond, Sittard, Heerlen, Sittard, Roermond, Weert, Eindhoven, Tilburg, Breda, Etten-Leur, Roosendaal]"
train_10,"[Gouda, Den Haag Centraal, Leiden Centraal, Den Haag HS, Gouda, Rotterdam Alexander, Rotterdam Blaak, Rotterdam Alexander, Rotterdam Blaak, Schiedam Centrum, Delft, Schiedam Centrum, Delft, Den Haag HS, Gouda, Rotterdam Alexander]"
train_11,"[Maastricht, Sittard, Heerlen, Sittard, Heerlen, Sittard, Roermond, Weert, Eindhoven, s-Hertogenbosch, Utrecht Centraal]"
train_12,"[Hengelo, Enschede, Hengelo, Enschede, Hengelo, Enschede, Hengelo, Almelo, Zwolle, Deventer, Zwolle]"
train_13,"[Roosendaal, Dordrecht, Rotterdam Centraal, Schiedam Centrum, Rotterdam Centraal, Dordrecht, Rotterdam Blaak, Dordrecht, Breda, Tilburg, Eindhoven, Tilburg]"
train_14,"[Rotterdam Alexander, Gouda, Rotterdam Alexander, Gouda, Rotterdam Alexander, Rotterdam Blaak, Rotterdam Alexander, Rotterdam Blaak, Schiedam Centrum, Delft, Den Haag HS, Delft, Schiedam Centrum, Rotterdam Centraal, Rotterdam Alexander, Rotterdam Centraal, Schiedam Centrum, Rotterdam Centraal, Rotterdam Alexander, Rotterdam Blaak, Rotterdam Alexander, Gouda]"
train_15,"[Apeldoorn, Amersfoort, Apeldoorn, Amersfoort, Zwolle, Steenwijk, Zwolle]"
train_16,"[Maastricht, Sittard, Heerlen, Sittard, Roermond, Weert, Eindhoven, Tilburg, Breda, Dordrecht, Breda, Etten-Leur, Roosendaal]"
train_17,"[Roosendaal, Dordrecht, Rotterdam Centraal, Schiedam Centrum, Rotterdam Centraal, Dordrecht, Roosendaal, Dordrecht, Roosendaal]"
train_18,"[Oss, s-Hertogenbosch, Eindhoven, Helmond, Venlo, Helmond, Venlo, Helmond, Eindhoven]"
train_19,"[Rotterdam Centraal, Rotterdam Alexander, Rotterdam Centraal, Dordrecht, Rotterdam Centraal, Dordrecht, Breda, Tilburg, Eindhoven, Helmond, Venlo]"
train_20,"[Rotterdam Alexander, Rotterdam Centraal, Dordrecht, Rotterdam Blaak, Dordrecht, Rotterdam Centraal, Dordrecht, Rotterdam Centraal, Schiedam Centrum, Rotterdam Centraal, Schiedam Centrum, Delft, Den Haag HS, Leiden Centraal, Den Haag Laan v NOI, Leiden Centraal, Den Haag Laan v NOI]"
score,844.7752808988762
