train,stations
train_1,"[Vlissingen, Roosendaal, Dordrecht, Breda, Tilburg, Breda, Etten-Leur, Roosendaal, Etten-Leur, Roosendaal]"
train_2,"[Eindhoven, Weert, Roermond, Sittard, Heerlen, Sittard, Heerlen, Sittard, Maastricht, Sittard, Maastricht, Sittard]"
train_3,"[Tilburg, s-Hertogenbosch, Utrecht Centraal, Hilversum, Almere Centrum, Lelystad Centrum, Almere Centrum, Hilversum, Utrecht Centraal]"
train_4,"[Rotterdam Centraal, Schiedam Centrum, Rotterdam Centraal, Dordrecht, Roosendaal, Etten-Leur, Roosendaal, Vlissingen]"
train_5,"[Amsterdam Amstel, Utrecht Centraal, Schiphol Airport, Leiden Centraal, Den Haag HS, Delft, Den Haag Centraal, Leiden Centraal, Den Haag Centraal, Leiden Centraal, Schiphol Airport]"
train_6,"[Amersfoort, Utrecht Centraal, Amsterdam Amstel, Almere Centrum, Amsterdam Centraal, Almere Centrum, Lelystad Centrum, Almere Centrum, Lelystad Centrum, Almere Centrum]"
train_7,"[Den Haag Centraal, Gouda, Den Haag Laan v NOI, Gouda, Utrecht Centraal, Amsterdam Centraal, Almere Centrum, Amsterdam Amstel]"
train_8,"[Gouda, Rotterdam Alexander, Rotterdam Centraal, Rotterdam Alexander, Rotterdam Centraal, Rotterdam Alexander, Rotterdam Blaak, Rotterdam Alexander, Rotterdam Blaak, Schiedam Centrum, Rotterdam Centraal, Dordrecht, Roosendaal]"
train_9,"[Rotterdam Centraal, Rotterdam Alexander, Rotterdam Centraal, Rotterdam Alexander, Gouda, Den Haag HS, Delft, Schiedam Centrum, Rotterdam Blaak, Rotterdam Alexander, Rotterdam Centraal, Dordrecht, Breda, Etten-Leur, Roosendaal, Etten-Leur, Breda]"
train_10,"[Heerlen, Sittard, Heerlen, Sittard, Maastricht, Sittard, Maastricht, Sittard, Heerlen, Sittard, Maastricht, Sittard]"
train_11,"[Amsterdam Amstel, Hilversum, Utrecht Centraal, Schiphol Airport, Leiden Centraal, Den Haag HS, Gouda, Rotterdam Alexander, Rotterdam Centraal, Schiedam Centrum, Rotterdam Centraal, Rotterdam Alexander, Rotterdam Centraal, Schiedam Centrum]"
train_12,"[Oss, s-Hertogenbosch, Eindhoven, Helmond, Eindhoven, Weert, Eindhoven, Tilburg, Eindhoven, Helmond, Venlo]"
train_13,"[Leiden Centraal, Alphen a/d Rijn, Gouda, Alphen a/d Rijn, Leiden Centraal, Alphen a/d Rijn, Leiden Centraal, Schiphol Airport, Leiden Centraal, Alphen a/d Rijn, Utrecht Centraal]"
train_14,"[Den Helder, Alkmaar, Castricum, Beverwijk, Haarlem, Beverwijk, Castricum, Alkmaar, Hoorn, Alkmaar, Castricum, Alkmaar]"
train_15,"[Amsterdam Zuid, Schiphol Airport, Amsterdam Zuid, Schiphol Airport, Leiden Centraal, Heemstede-Aerdenhout, Leiden Centraal, Den Haag Laan v NOI, Gouda, Utrecht Centraal, Schiphol Airport, Amsterdam Zuid, Amsterdam Amstel]"
train_16,"[Steenwijk, Heerenveen, Steenwijk, Heerenveen, Steenwijk, Zwolle, Amersfoort, Apeldoorn, Zutphen, Apeldoorn]"
train_17,"[Gouda, Den Haag Centraal, Delft, Den Haag Centraal, Leiden Centraal, Heemstede-Aerdenhout, Leiden Centraal, Den Haag HS, Leiden Centraal, Den Haag Centraal, Delft, Den Haag HS, Delft, Den Haag HS, Delft, Schiedam Centrum, Rotterdam Centraal]"
train_18,"[Etten-Leur, Breda, Tilburg, Breda, Dordrecht, Rotterdam Centraal, Schiedam Centrum, Rotterdam Centraal, Rotterdam Alexander, Rotterdam Centraal, Rotterdam Alexander, Rotterdam Blaak, Rotterdam Alexander, Rotterdam Blaak, Dordrecht, Rotterdam Centraal, Rotterdam Alexander, Rotterdam Centraal]"
train_19,"[Schiedam Centrum, Delft, Schiedam Centrum, Delft, Den Haag HS, Delft, Den Haag Centraal, Delft, Den Haag Centraal, Gouda, Alphen a/d Rijn, Gouda, Alphen a/d Rijn, Gouda]"
train_20,"[Amsterdam Amstel, Hilversum, Amsterdam Amstel, Amsterdam Centraal, Almere Centrum, Hilversum, Utrecht Centraal, Schiphol Airport, Leiden Centraal]"
score,1756.651685393258
