train,stations
train_1,"[Amersfoort, Apeldoorn, Deventer, Zutphen, Deventer, Zwolle, Deventer, Almelo, Zwolle]"
train_2,"[Roermond, Sittard, Heerlen, Sittard, Roermond, Weert, Roermond, Sittard, Maastricht, Sittard, Roermond, Sittard, Roermond]"
train_3,"[Zwolle, Assen, Groningen, Assen, Zwolle, Deventer, Almelo]"
train_4,"[Tilburg, s-Hertogenbosch, Oss, s-Hertogenbosch, Tilburg, Breda, Tilburg, s-Hertogenbosch, Utrecht Centraal, Hilversum, Amsterdam Amstel, Amsterdam Centraal]"
train_5,"[Almelo, Zwolle, Steenwijk, Heerenveen, Leeuwarden, Heerenveen, Leeuwarden, Groningen]"
train_6,"[Nijmegen, Oss, Nijmegen, Oss, Nijmegen, Arnhem Centraal, Nijmegen, Arnhem Centraal, Nijmegen, Oss, Nijmegen, Arnhem Centraal, Ede-Wageningen]"
train_7,"[s-Hertogenbosch, Eindhoven, Tilburg, Breda, Dordrecht, Rotterdam Centraal, Rotterdam Alexander, Rotterdam Centraal, Rotterdam Alexander, Gouda, Den Haag Centraal, Gouda, Alphen a/d Rijn]"
train_8,"[Den Haag Laan v NOI, Gouda, Rotterdam Alexander, Rotterdam Blaak, Rotterdam Alexander, Rotterdam Centraal, Schiedam Centrum, Rotterdam Blaak, Rotterdam Alexander, Gouda, Den Haag Centraal, Leiden Centraal, Den Haag Laan v NOI, Delft, Schiedam Centrum, Rotterdam Blaak, Schiedam Centrum]"
train_9,"[Amsterdam Zuid, Schiphol Airport, Utrecht Centraal, Alphen a/d Rijn, Leiden Centraal, Schiphol Airport, Amsterdam Zuid, Amsterdam Amstel, Amsterdam Zuid, Schiphol Airport, Amsterdam Zuid, Schiphol Airport, Amsterdam Zuid, Schiphol Airport, Amsterdam Zuid, Amsterdam Sloterdijk]"
train_10,"[Heemstede-Aerdenhout, Haarlem, Heemstede-Aerdenhout, Leiden Centraal, Schiphol Airport, Leiden Centraal, Alphen a/d Rijn, Gouda, Utrecht Centraal, Amsterdam Amstel, Amsterdam Zuid, Amsterdam Sloterdijk, Haarlem, Beverwijk]"
train_11,"[Almelo, Deventer, Zwolle, Almelo, Hengelo, Enschede, Hengelo, Enschede, Hengelo, Enschede, Hengelo, Almelo, Hengelo, Enschede, Hengelo]"
train_12,"[Maastricht, Sittard, Maastricht, Sittard, Roermond, Sittard, Heerlen, Sittard, Heerlen, Sittard, Maastricht, Sittard]"
train_13,"[Helmond, Eindhoven, Tilburg, s-Hertogenbosch, Eindhoven, s-Hertogenbosch, Utrecht Centraal, Ede-Wageningen, Utrecht Centraal, Gouda]"
train_14,"[Amsterdam Amstel, Amsterdam Centraal, Amsterdam Amstel, Amsterdam Centraal, Amsterdam Amstel, Utrecht Centraal, Hilversum, Utrecht Centraal, s-Hertogenbosch, Oss, s-Hertogenbosch, Eindhoven, s-Hertogenbosch]"
train_15,"[Helmond, Eindhoven, s-Hertogenbosch, Oss, Nijmegen, Arnhem Centraal, Dieren, Arnhem Centraal, Nijmegen, Oss, s-Hertogenbosch, Oss, Nijmegen, Arnhem Centraal]"
train_16,"[Oss, s-Hertogenbosch, Utrecht Centraal, Ede-Wageningen, Utrecht Centraal, Amsterdam Amstel, Hilversum, Amsterdam Amstel, Amsterdam Zuid]"
train_17,"[Den Haag Centraal, Delft, Den Haag Laan v NOI, Delft, Den Haag Centraal, Gouda, Den Haag HS, Gouda, Rotterdam Alexander, Rotterdam Blaak, Dordrecht, Breda, Dordrecht]"
train_18,"[Dieren, Arnhem Centraal, Nijmegen, Oss, s-Hertogenbosch, Oss, Nijmegen, Oss, Nijmegen, Oss, Nijmegen, Oss, Nijmegen]"
train_19,"[Maastricht, Sittard, Maastricht, Sittard, Heerlen, Sittard, Roermond, Sittard, Roermond, Weert, Eindhoven, s-Hertogenbosch]"
train_20,"[Hoorn, Zaandam, Amsterdam Sloterdijk, Haarlem, Amsterdam Sloterdijk, Haarlem, Heemstede-Aerdenhout, Haarlem, Heemstede-Aerdenhout, Haarlem, Heemstede-Aerdenhout, Haarlem, Heemstede-Aerdenhout, Leiden Centraal, Heemstede-Aerdenhout, Leiden Centraal, Den Haag HS, Delft, Den Haag HS]"
score,2172.4494382022467
