train,stations
train_1,"[Den Haag HS, Delft, Den Haag Centraal, Gouda, Den Haag Laan v NOI, Leiden Centraal, Heemstede-Aerdenhout, Haarlem, Beverwijk, Haarlem, Beverwijk, Haarlem, Beverwijk]"
train_2,"[Dieren, Arnhem Centraal, Nijmegen, Arnhem Centraal, Ede-Wageningen, Arnhem Centraal, Dieren, Zutphen, Dieren, Zutphen, Apeldoorn, Amersfoort, Apeldoorn]"
train_3,"[Amsterdam Zuid, Amsterdam Amstel, Hilversum, Amsterdam Amstel, Hilversum, Almere Centrum, Lelystad Centrum, Almere Centrum, Amsterdam Centraal, Amsterdam Amstel]"
train_4,"[Den Helder, Alkmaar, Den Helder, Alkmaar, Den Helder]"
train_5,"[Apeldoorn, Deventer, Zwolle, Deventer, Almelo, Deventer, Zwolle, Assen]"
train_6,"[Zwolle, Steenwijk, Heerenveen, Steenwijk, Heerenveen, Leeuwarden, Groningen, Leeuwarden, Heerenveen]"
train_7,"[Hoorn, Alkmaar, Hoorn, Alkmaar, Hoorn, Zaandam, Hoorn, Zaandam]"
train_8,"[Dordrecht, Rotterdam Centraal, Schiedam Centrum, Rotterdam Blaak, Rotterdam Alexander, Rotterdam Centraal, Schiedam Centrum, Rotterdam Centraal, Rotterdam Alexander, Rotterdam Centraal, Schiedam Centrum, Delft, Schiedam Centrum, Rotterdam Centraal, Schiedam Centrum, Rotterdam Centraal, Rotterdam Alexander, Gouda, Rotterdam Alexander, Rotterdam Blaak, Schiedam Centrum, Rotterdam Centraal]"
train_9,"[Roermond, Weert, Roermond, Weert, Roermond, Sittard, Heerlen, Sittard, Heerlen, Sittard, Maastricht, Sittard, Roermond]"
train_10,"[Haarlem, Amsterdam Sloterdijk, Haarlem, Beverwijk, Zaandam, Amsterdam Sloterdijk, Zaandam, Beverwijk, Zaandam, Amsterdam Sloterdijk, Zaandam, Castricum, Beverwijk]"
train_11,"[Beverwijk, Zaandam, Hoorn, Alkmaar, Hoorn, Zaandam, Hoorn, Alkmaar]"
train_12,"[Delft, Den Haag Centraal, Delft, Schiedam Centrum, Rotterdam Centraal, Dordrecht, Rotterdam Blaak, Schiedam Centrum, Rotterdam Centraal, Dordrecht, Breda, Dordrecht, Rotterdam Blaak, Rotterdam Alexander, Rotterdam Centraal, Rotterdam Alexander]"
train_13,"[Haarlem, Beverwijk, Zaandam, Beverwijk, Castricum, Zaandam, Hoorn, Alkmaar, Hoorn]"
train_14,"[Deventer, Apeldoorn, Amersfoort, Zwolle, Assen, Groningen, Assen, Groningen, Assen]"
train_15,"[Roermond, Weert, Eindhoven, s-Hertogenbosch, Oss, s-Hertogenbosch, Oss, s-Hertogenbosch, Eindhoven, Weert, Eindhoven, Weert, Roermond]"
train_16,"[Sittard, Roermond, Weert, Eindhoven, Tilburg, s-Hertogenbosch, Eindhoven, Helmond, Eindhoven, s-Hertogenbosch, Tilburg, Breda, Tilburg]"
train_17,"[Maastricht, Sittard, Maastricht, Sittard, Maastricht, Sittard, Roermond, Sittard, Maastricht, Sittard, Maastricht, Sittard]"
train_18,"[Heerlen, Sittard, Maastricht, Sittard, Maastricht, Sittard, Maastricht, Sittard, Heerlen, Sittard, Maastricht, Sittard]"
train_19,"[Leeuwarden, Heerenveen, Steenwijk, Heerenveen, Leeuwarden, Groningen, Leeuwarden, Heerenveen, Leeuwarden, Heerenveen]"
train_20,"[Schiphol Airport, Amsterdam Zuid, Schiphol Airport, Leiden Centraal, Den Haag Laan v NOI, Leiden Centraal, Den Haag Centraal, Gouda, Rotterdam Alexander, Gouda, Utrecht Centraal, Gouda, Den Haag Laan v NOI]"
score,1501.2921348314612
