train,stations
train_1,"[Enschede, Hengelo, Enschede, Hengelo, Enschede, Hengelo, Almelo, Deventer, Zwolle, Steenwijk, Zwolle]"
train_2,"[Nijmegen, Oss, Nijmegen, Arnhem Centraal, Dieren, Zutphen, Dieren, Zutphen, Dieren, Arnhem Centraal, Ede-Wageningen, Utrecht Centraal, Schiphol Airport, Amsterdam Zuid]"
train_3,"[Heemstede-Aerdenhout, Haarlem, Amsterdam Sloterdijk, Amsterdam Zuid, Amsterdam Amstel, Amsterdam Centraal, Almere Centrum, Lelystad Centrum, Almere Centrum, Lelystad Centrum, Almere Centrum, Amsterdam Amstel]"
train_4,"[s-Hertogenbosch, Oss, Nijmegen, Arnhem Centraal, Ede-Wageningen, Arnhem Centraal, Nijmegen, Arnhem Centraal, Dieren, Zutphen, Deventer, Zwolle]"
train_5,"[Leeuwarden, Heerenveen, Steenwijk, Heerenveen, Leeuwarden, Heerenveen, Steenwijk, Heerenveen, Leeuwarden, Heerenveen, Steenwijk, Heerenveen]"
train_6,"[Alphen a/d Rijn, Gouda, Den Haag Centraal, Delft, Den Haag HS, Leiden Centraal, Alphen a/d Rijn, Utrecht Centraal, Amsterdam Centraal, Utrecht Centraal]"
train_7,"[Vlissingen, Roosendaal, Dordrecht, Roosendaal, Etten-Leur, Breda, Tilburg, Eindhoven, Helmond]"
train_8,"[Amsterdam Centraal, Amsterdam Sloterdijk, Haarlem, Beverwijk, Castricum, Alkmaar, Den Helder, Alkmaar, Hoorn, Alkmaar]"
train_9,"[Rotterdam Centraal, Dordrecht, Rotterdam Blaak, Rotterdam Alexander, Gouda, Alphen a/d Rijn, Leiden Centraal, Den Haag Centraal, Leiden Centraal, Den Haag Laan v NOI, Delft, Den Haag Laan v NOI, Gouda]"
train_10,"[Alphen a/d Rijn, Gouda, Den Haag Centraal, Leiden Centraal, Heemstede-Aerdenhout, Haarlem, Heemstede-Aerdenhout, Leiden Centraal, Alphen a/d Rijn, Utrecht Centraal, Amersfoort, Zwolle]"
train_11,"[Maastricht, Sittard, Heerlen, Sittard, Maastricht, Sittard, Maastricht, Sittard, Roermond, Weert, Eindhoven, Tilburg]"
train_12,"[Schiphol Airport, Utrecht Centraal, Hilversum, Amsterdam Amstel, Almere Centrum, Amsterdam Amstel, Hilversum]"
train_13,"[Groningen, Assen, Groningen, Assen, Zwolle, Steenwijk, Zwolle, Steenwijk, Heerenveen]"
train_14,"[Zaandam, Beverwijk, Haarlem, Amsterdam Sloterdijk, Zaandam, Amsterdam Sloterdijk, Haarlem, Amsterdam Sloterdijk, Zaandam, Hoorn, Alkmaar, Den Helder]"
train_15,"[Nijmegen, Arnhem Centraal, Ede-Wageningen, Arnhem Centraal, Nijmegen, Arnhem Centraal, Nijmegen, Oss, s-Hertogenbosch, Eindhoven, Helmond, Eindhoven, Helmond, Eindhoven, Helmond]"
train_16,"[Vlissingen, Roosendaal, Dordrecht, Rotterdam Centraal, Dordrecht, Roosendaal, Etten-Leur, Roosendaal]"
train_17,"[Amsterdam Sloterdijk, Amsterdam Zuid, Amsterdam Sloterdijk, Haarlem, Beverwijk, Zaandam, Beverwijk, Haarlem, Heemstede-Aerdenhout, Leiden Centraal, Schiphol Airport, Amsterdam Zuid, Schiphol Airport]"
train_18,"[Eindhoven, Helmond, Venlo, Helmond, Venlo, Helmond, Venlo]"
train_19,"[Amersfoort, Zwolle, Almelo, Deventer, Almelo, Zwolle]"
train_20,"[Zutphen, Deventer, Apeldoorn, Amersfoort, Apeldoorn, Amersfoort, Zwolle, Steenwijk, Heerenveen]"
score,3100.9662921348317
