train,stations
train_1,"[Tilburg, Breda, Etten-Leur, Breda, Etten-Leur, Roosendaal, Dordrecht, Rotterdam Blaak, Rotterdam Alexander, Gouda, Den Haag Laan v NOI, Delft, Schiedam Centrum, Rotterdam Blaak, Rotterdam Alexander, Gouda]"
train_2,"[Leiden Centraal, Den Haag HS, Gouda, Den Haag Centraal, Delft, Den Haag Laan v NOI, Delft, Schiedam Centrum, Delft, Den Haag Centraal, Delft, Schiedam Centrum, Rotterdam Centraal, Dordrecht, Breda]"
train_3,"[Den Haag Centraal, Delft, Schiedam Centrum, Rotterdam Centraal, Schiedam Centrum, Delft, Den Haag HS, Delft, Den Haag Laan v NOI, Delft, Den Haag Centraal, Leiden Centraal, Alphen a/d Rijn, Leiden Centraal, Schiphol Airport, Leiden Centraal, Heemstede-Aerdenhout, Haarlem]"
train_4,"[Amsterdam Amstel, Almere Centrum, Amsterdam Amstel, Amsterdam Zuid, Amsterdam Sloterdijk, Haarlem, Amsterdam Sloterdijk, Haarlem, Heemstede-Aerdenhout, Leiden Centraal, Den Haag HS, Leiden Centraal, Den Haag Centraal]"
train_5,"[Leiden Centraal, Den Haag HS, Gouda, Rotterdam Alexander, Rotterdam Blaak, Schiedam Centrum, Rotterdam Blaak, Schiedam Centrum, Delft, Den Haag HS, Delft, Den Haag HS, Leiden Centraal, Alphen a/d Rijn, Gouda, Rotterdam Alexander]"
train_6,"[Zaandam, Castricum, Zaandam, Amsterdam Sloterdijk, Zaandam, Beverwijk, Castricum, Zaandam, Hoorn, Zaandam, Beverwijk]"
train_7,"[Haarlem, Amsterdam Sloterdijk, Amsterdam Centraal, Almere Centrum, Lelystad Centrum, Almere Centrum, Amsterdam Centraal, Utrecht Centraal, Amsterdam Centraal, Amsterdam Amstel, Almere Centrum]"
train_8,"[Hoorn, Alkmaar, Castricum, Zaandam, Hoorn, Zaandam, Amsterdam Sloterdijk, Amsterdam Centraal, Utrecht Centraal, Gouda, Den Haag HS]"
train_9,"[Breda, Etten-Leur, Breda, Dordrecht, Rotterdam Blaak, Rotterdam Alexander, Rotterdam Blaak, Rotterdam Alexander, Rotterdam Centraal, Rotterdam Alexander, Rotterdam Blaak, Dordrecht, Rotterdam Blaak, Rotterdam Alexander, Gouda, Rotterdam Alexander, Rotterdam Blaak, Schiedam Centrum]"
train_10,"[Hoorn, Alkmaar, Castricum, Alkmaar, Hoorn, Zaandam, Castricum, Alkmaar, Castricum, Zaandam, Castricum, Zaandam]"
train_11,"[Zutphen, Apeldoorn, Zutphen, Dieren, Arnhem Centraal, Ede-Wageningen, Arnhem Centraal, Ede-Wageningen, Arnhem Centraal, Ede-Wageningen, Utrecht Centraal, Ede-Wageningen, Arnhem Centraal]"
train_12,"[Deventer, Zutphen, Apeldoorn, Amersfoort, Apeldoorn, Zutphen, Apeldoorn, Deventer, Zutphen, Dieren, Zutphen, Deventer]"
train_13,"[Assen, Groningen, Leeuwarden, Heerenveen, Leeuwarden, Groningen, Assen, Groningen]"
train_14,"[Nijmegen, Oss, s-Hertogenbosch, Tilburg, Eindhoven, Helmond, Venlo, Helmond, Eindhoven, Weert, Eindhoven]"
train_15,"[Eindhoven, Helmond, Eindhoven, Tilburg, s-Hertogenbosch, Eindhoven, Tilburg, Breda, Dordrecht, Roosendaal]"
train_16,"[Hoorn, Alkmaar, Den Helder, Alkmaar, Den Helder, Alkmaar]"
train_17,"[Heerenveen, Leeuwarden, Groningen, Leeuwarden, Heerenveen, Leeuwarden, Groningen, Assen]"
train_18,"[Den Haag Centraal, Gouda, Den Haag HS, Gouda, Rotterdam Alexander, Rotterdam Blaak, Schiedam Centrum, Delft, Den Haag Centraal, Gouda, Den Haag Laan v NOI, Leiden Centraal, Alphen a/d Rijn]"
train_19,"[Leiden Centraal, Schiphol Airport, Utrecht Centraal, s-Hertogenbosch, Oss, Nijmegen, Arnhem Centraal, Ede-Wageningen, Utrecht Centraal, Alphen a/d Rijn]"
train_20,"[Dordrecht, Breda, Tilburg, Eindhoven, s-Hertogenbosch, Utrecht Centraal, Ede-Wageningen, Utrecht Centraal, Hilversum]"
score,2355.8089887640454
