train,stations
train_1,"[Delft, Den Haag HS, Leiden Centraal, Den Haag Centraal, Delft, Den Haag HS, Gouda, Utrecht Centraal, Ede-Wageningen, Utrecht Centraal, Gouda, Utrecht Centraal]"
train_2,"[Zutphen, Apeldoorn, Amersfoort, Apeldoorn, Deventer, Zutphen, Apeldoorn, Amersfoort, Utrecht Centraal, Alphen a/d Rijn]"
train_3,"[Ede-Wageningen, Utrecht Centraal, Amsterdam Centraal, Almere Centrum, Lelystad Centrum, Almere Centrum, Hilversum, Almere Centrum, Amsterdam Centraal]"
train_4,"[Weert, Roermond, Weert, Roermond, Sittard, Maastricht, Sittard, Roermond, Sittard, Maastricht, Sittard, Roermond, Sittard]"
train_5,"[Roosendaal, Vlissingen, Roosendaal, Dordrecht, Breda, Tilburg]"
train_6,"[Weert, Eindhoven, s-Hertogenbosch, Utrecht Centraal, Schiphol Airport, Leiden Centraal, Den Haag HS, Leiden Centraal, Den Haag Centraal, Gouda]"
train_7,"[Hilversum, Amsterdam Amstel, Utrecht Centraal, Hilversum, Almere Centrum, Amsterdam Amstel, Hilversum, Utrecht Centraal, Amersfoort]"
train_8,"[Den Helder, Alkmaar, Castricum, Alkmaar, Den Helder, Alkmaar, Hoorn, Zaandam]"
train_9,"[Amsterdam Zuid, Schiphol Airport, Leiden Centraal, Schiphol Airport, Utrecht Centraal, Schiphol Airport, Utrecht Centraal, Amsterdam Centraal, Amsterdam Sloterdijk, Haarlem]"
train_10,"[Heemstede-Aerdenhout, Haarlem, Beverwijk, Castricum, Beverwijk, Zaandam, Beverwijk, Castricum, Beverwijk, Zaandam, Hoorn]"
train_11,"[Dordrecht, Rotterdam Blaak, Rotterdam Alexander, Gouda, Rotterdam Alexander, Rotterdam Centraal, Dordrecht, Breda, Tilburg, Eindhoven, Weert, Roermond, Sittard]"
train_12,"[Zwolle, Amersfoort, Utrecht Centraal, Gouda, Den Haag HS, Delft, Den Haag Centraal, Delft, Den Haag Centraal, Gouda]"
train_13,"[Dordrecht, Rotterdam Blaak, Dordrecht, Roosendaal, Dordrecht, Rotterdam Blaak, Schiedam Centrum, Rotterdam Centraal, Rotterdam Alexander, Rotterdam Blaak, Dordrecht, Breda, Dordrecht]"
train_14,"[Amsterdam Zuid, Schiphol Airport, Leiden Centraal, Den Haag Laan v NOI, Gouda, Den Haag Laan v NOI, Gouda, Den Haag Laan v NOI, Gouda]"
train_15,"[Maastricht, Sittard, Maastricht, Sittard, Heerlen, Sittard, Maastricht, Sittard, Maastricht, Sittard, Heerlen, Sittard]"
train_16,"[Schiedam Centrum, Rotterdam Centraal, Schiedam Centrum, Rotterdam Centraal, Dordrecht, Rotterdam Blaak, Rotterdam Alexander, Rotterdam Blaak, Rotterdam Alexander, Gouda, Alphen a/d Rijn, Gouda, Rotterdam Alexander, Rotterdam Blaak, Dordrecht, Roosendaal]"
train_17,"[Lelystad Centrum, Almere Centrum, Amsterdam Amstel, Amsterdam Centraal, Almere Centrum, Hilversum, Almere Centrum, Amsterdam Amstel, Utrecht Centraal]"
train_18,"[Hilversum, Almere Centrum, Lelystad Centrum, Almere Centrum, Amsterdam Centraal, Amsterdam Sloterdijk, Amsterdam Zuid, Amsterdam Amstel, Almere Centrum, Amsterdam Amstel, Amsterdam Centraal, Amsterdam Amstel]"
train_19,"[Heemstede-Aerdenhout, Haarlem, Heemstede-Aerdenhout, Haarlem, Amsterdam Sloterdijk, Haarlem, Beverwijk, Castricum, Zaandam, Amsterdam Sloterdijk, Amsterdam Zuid, Amsterdam Amstel, Utrecht Centraal, Amersfoort, Apeldoorn]"
train_20,"[Gouda, Den Haag Laan v NOI, Gouda, Den Haag Centraal, Gouda, Den Haag HS, Leiden Centraal, Heemstede-Aerdenhout, Haarlem, Amsterdam Sloterdijk, Haarlem, Heemstede-Aerdenhout, Haarlem]"
score,1721.0112359550558
