train,stations
train_1,"[Gouda, Rotterdam Alexander, Rotterdam Blaak, Schiedam Centrum, Rotterdam Centraal, Dordrecht, Breda, Etten-Leur, Roosendaal, Dordrecht, Rotterdam Blaak, Rotterdam Alexander, Rotterdam Centraal, Dordrecht, Rotterdam Centraal]"
train_2,"[Schiphol Airport, Amsterdam Zuid, Schiphol Airport, Leiden Centraal, Den Haag HS, Delft, Den Haag Laan v NOI, Delft, Den Haag HS, Gouda, Den Haag Centraal, Delft, Den Haag Centraal, Gouda]"
train_3,"[Ede-Wageningen, Utrecht Centraal, Hilversum, Utrecht Centraal, s-Hertogenbosch, Eindhoven, Helmond, Eindhoven, s-Hertogenbosch, Oss, s-Hertogenbosch, Oss, s-Hertogenbosch]"
train_4,"[Heemstede-Aerdenhout, Leiden Centraal, Alphen a/d Rijn, Utrecht Centraal, Alphen a/d Rijn, Gouda, Den Haag Centraal, Delft, Den Haag Laan v NOI, Gouda]"
train_5,"[Oss, s-Hertogenbosch, Oss, s-Hertogenbosch, Tilburg, Eindhoven, s-Hertogenbosch, Oss, s-Hertogenbosch, Utrecht Centraal, Amsterdam Centraal]"
train_6,"[Vlissingen, Roosendaal, Dordrecht, Breda, Etten-Leur, Breda, Etten-Leur, Roosendaal]"
train_7,"[Zutphen, Dieren, Zutphen, Apeldoorn, Zutphen, Apeldoorn, Amersfoort, Apeldoorn, Amersfoort, Utrecht Centraal]"
train_8,"[Breda, Tilburg, Eindhoven, Weert, Roermond, Weert, Roermond, Weert, Eindhoven, Tilburg, Breda, Tilburg]"
train_9,"[Castricum, Zaandam, Amsterdam Sloterdijk, Haarlem, Heemstede-Aerdenhout, Haarlem, Amsterdam Sloterdijk, Amsterdam Centraal, Utrecht Centraal, Schiphol Airport, Leiden Centraal, Den Haag Centraal, Delft, Den Haag Laan v NOI, Leiden Centraal]"
train_10,"[Castricum, Beverwijk, Castricum, Beverwijk, Haarlem, Beverwijk, Zaandam, Hoorn, Zaandam, Beverwijk]"
train_11,"[Ede-Wageningen, Arnhem Centraal, Dieren, Zutphen, Dieren, Arnhem Centraal, Nijmegen, Oss, Nijmegen, Arnhem Centraal, Dieren, Zutphen, Dieren, Arnhem Centraal, Ede-Wageningen, Arnhem Centraal, Dieren]"
train_12,"[Steenwijk, Heerenveen, Steenwijk, Heerenveen, Steenwijk, Zwolle, Assen, Groningen, Leeuwarden]"
train_13,"[Amsterdam Amstel, Hilversum, Utrecht Centraal, Hilversum, Amsterdam Amstel, Amsterdam Zuid, Schiphol Airport, Utrecht Centraal, s-Hertogenbosch, Tilburg]"
train_14,"[Haarlem, Heemstede-Aerdenhout, Leiden Centraal, Den Haag HS, Delft, Den Haag HS, Gouda, Rotterdam Alexander, Gouda, Den Haag HS, Gouda, Rotterdam Alexander, Gouda, Den Haag Laan v NOI]"
train_15,"[Heemstede-Aerdenhout, Leiden Centraal, Heemstede-Aerdenhout, Leiden Centraal, Den Haag HS, Delft, Den Haag Centraal, Delft, Den Haag Centraal, Leiden Centraal, Den Haag Laan v NOI, Gouda, Den Haag Laan v NOI]"
train_16,"[Enschede, Hengelo, Enschede, Hengelo, Enschede, Hengelo, Enschede, Hengelo, Enschede, Hengelo, Almelo, Hengelo, Enschede, Hengelo, Almelo, Zwolle, Steenwijk]"
train_17,"[Den Helder, Alkmaar, Castricum, Zaandam, Hoorn, Alkmaar, Castricum, Zaandam, Castricum, Alkmaar, Castricum, Beverwijk]"
train_18,"[Den Haag HS, Delft, Schiedam Centrum, Delft, Den Haag Centraal, Delft, Den Haag Laan v NOI, Leiden Centraal, Den Haag Centraal, Leiden Centraal, Den Haag Laan v NOI, Gouda, Den Haag Laan v NOI, Delft]"
train_19,"[Amsterdam Amstel, Almere Centrum, Lelystad Centrum, Almere Centrum, Amsterdam Centraal, Almere Centrum, Amsterdam Amstel, Hilversum, Amsterdam Amstel]"
train_20,"[Hilversum, Almere Centrum, Amsterdam Amstel, Utrecht Centraal, Alphen a/d Rijn, Leiden Centraal, Den Haag HS, Gouda, Den Haag Centraal, Leiden Centraal]"
score,3207.685393258427
