train,stations
train_1,"[Tilburg, Breda, Etten-Leur, Roosendaal, Vlissingen, Roosendaal, Etten-Leur, Roosendaal]"
train_2,"[Almere Centrum, Hilversum, Amsterdam Amstel, Amsterdam Zuid, Amsterdam Amstel, Amsterdam Zuid, Schiphol Airport, Leiden Centraal, Schiphol Airport, Utrecht Centraal, Ede-Wageningen]"
train_3,"[Etten-Leur, Breda, Tilburg, s-Hertogenbosch, Utrecht Centraal, Amersfoort, Zwolle, Deventer, Almelo]"
train_4,"[Etten-Leur, Roosendaal, Dordrecht, Breda, Dordrecht, Breda, Tilburg, s-Hertogenbosch, Utrecht Centraal, Amsterdam Amstel, Amsterdam Centraal]"
train_5,"[Alkmaar, Den Helder, Alkmaar, Castricum, Alkmaar, Den Helder, Alkmaar]"
train_6,"[Heemstede-Aerdenhout, Haarlem, Beverwijk, Zaandam, Beverwijk, Haarlem, Heemstede-Aerdenhout, Haarlem, Amsterdam Sloterdijk, Amsterdam Centraal, Utrecht Centraal, s-Hertogenbosch]"
train_7,"[Sittard, Roermond, Sittard, Maastricht, Sittard, Maastricht, Sittard, Heerlen, Sittard, Heerlen, Sittard, Heerlen]"
train_8,"[Hoorn, Alkmaar, Hoorn, Alkmaar, Hoorn, Alkmaar, Den Helder]"
train_9,"[Weert, Eindhoven, s-Hertogenbosch, Utrecht Centraal, Alphen a/d Rijn, Utrecht Centraal, Gouda, Den Haag Centraal, Leiden Centraal, Heemstede-Aerdenhout]"
train_10,"[Almelo, Zwolle, Amersfoort, Zwolle, Almelo, Hengelo, Enschede, Hengelo]"
train_11,"[Maastricht, Sittard, Maastricht, Sittard, Maastricht, Sittard, Maastricht, Sittard, Heerlen, Sittard, Roermond, Sittard]"
train_12,"[Eindhoven, Weert, Eindhoven, Weert, Eindhoven, Tilburg, Breda, Tilburg, s-Hertogenbosch, Eindhoven, Weert]"
train_13,"[Hilversum, Almere Centrum, Amsterdam Centraal, Almere Centrum, Lelystad Centrum, Almere Centrum, Amsterdam Amstel, Utrecht Centraal, Amsterdam Centraal, Amsterdam Amstel]"
train_14,"[Amsterdam Zuid, Amsterdam Amstel, Amsterdam Zuid, Amsterdam Amstel, Amsterdam Zuid, Amsterdam Sloterdijk, Amsterdam Centraal, Utrecht Centraal, Amsterdam Amstel, Utrecht Centraal, Ede-Wageningen, Utrecht Centraal]"
train_15,"[Roermond, Weert, Roermond, Weert, Roermond, Weert, Roermond, Weert, Eindhoven, Tilburg, s-Hertogenbosch, Utrecht Centraal]"
train_16,"[Beverwijk, Zaandam, Amsterdam Sloterdijk, Zaandam, Hoorn, Alkmaar, Hoorn, Alkmaar, Den Helder]"
train_17,"[Breda, Dordrecht, Roosendaal, Dordrecht, Roosendaal, Dordrecht, Roosendaal, Dordrecht, Rotterdam Centraal, Rotterdam Alexander]"
train_18,"[Etten-Leur, Breda, Dordrecht, Breda, Tilburg, Eindhoven, Tilburg, s-Hertogenbosch, Eindhoven, Weert, Roermond, Weert]"
train_19,"[Castricum, Beverwijk, Castricum, Alkmaar, Castricum, Alkmaar, Hoorn, Alkmaar, Hoorn, Alkmaar, Castricum, Alkmaar]"
train_20,"[Enschede, Hengelo, Enschede, Hengelo, Almelo, Hengelo, Enschede, Hengelo, Almelo, Zwolle, Deventer, Apeldoorn, Deventer, Apeldoorn]"
score,746.7752808988762
