train,stations
train_1,"[Tilburg, Eindhoven, Weert, Eindhoven, Weert, Roermond, Weert, Roermond, Sittard, Maastricht, Sittard, Maastricht]"
train_2,"[Tilburg, s-Hertogenbosch, Utrecht Centraal, Amsterdam Amstel, Amsterdam Centraal, Almere Centrum, Lelystad Centrum, Almere Centrum, Amsterdam Amstel, Almere Centrum]"
train_3,"[Assen, Groningen, Leeuwarden, Heerenveen, Steenwijk, Zwolle, Deventer, Apeldoorn, Amersfoort]"
train_4,"[Alkmaar, Hoorn, Alkmaar, Castricum, Beverwijk, Zaandam, Amsterdam Sloterdijk, Amsterdam Zuid, Amsterdam Amstel, Almere Centrum, Amsterdam Centraal]"
train_5,"[Alphen a/d Rijn, Gouda, Den Haag Laan v NOI, Leiden Centraal, Den Haag Centraal, Leiden Centraal, Schiphol Airport, Utrecht Centraal, Ede-Wageningen, Utrecht Centraal]"
train_6,"[Deventer, Zutphen, Apeldoorn, Deventer, Apeldoorn, Zutphen, Apeldoorn, Zutphen, Dieren, Zutphen, Apeldoorn, Amersfoort]"
train_7,"[Amsterdam Centraal, Utrecht Centraal, Amsterdam Centraal, Utrecht Centraal, Hilversum, Utrecht Centraal, Schiphol Airport, Leiden Centraal, Den Haag Laan v NOI]"
train_8,"[Gouda, Den Haag HS, Leiden Centraal, Heemstede-Aerdenhout, Haarlem, Beverwijk, Castricum, Zaandam, Beverwijk, Haarlem, Amsterdam Sloterdijk, Haarlem, Beverwijk]"
train_9,"[Maastricht, Sittard, Heerlen, Sittard, Roermond, Weert, Eindhoven, Weert, Roermond, Sittard, Roermond, Sittard]"
train_10,"[Roosendaal, Vlissingen, Roosendaal, Etten-Leur, Roosendaal]"
train_11,"[Maastricht, Sittard, Maastricht, Sittard, Heerlen, Sittard, Maastricht, Sittard, Heerlen, Sittard, Roermond, Sittard]"
train_12,"[Apeldoorn, Zutphen, Deventer, Apeldoorn, Zutphen, Deventer, Apeldoorn, Amersfoort, Apeldoorn, Zutphen, Deventer]"
train_13,"[Heerlen, Sittard, Maastricht, Sittard, Heerlen, Sittard, Roermond, Sittard, Maastricht, Sittard, Heerlen, Sittard]"
train_14,"[Ede-Wageningen, Utrecht Centraal, Amsterdam Centraal, Amsterdam Sloterdijk, Amsterdam Zuid, Schiphol Airport, Utrecht Centraal, Hilversum, Amsterdam Amstel, Utrecht Centraal]"
train_15,"[Heerlen, Sittard, Heerlen, Sittard, Maastricht, Sittard, Roermond, Sittard, Heerlen, Sittard, Roermond, Weert]"
train_16,"[Almelo, Deventer, Almelo, Zwolle, Steenwijk, Heerenveen, Steenwijk, Zwolle]"
train_17,"[Groningen, Assen, Zwolle, Almelo, Hengelo, Almelo, Deventer, Zwolle]"
train_18,"[Haarlem, Beverwijk, Zaandam, Beverwijk, Castricum, Alkmaar, Den Helder, Alkmaar, Castricum]"
train_19,"[Lelystad Centrum, Almere Centrum, Hilversum, Amsterdam Amstel, Hilversum, Utrecht Centraal, Gouda, Utrecht Centraal, Amsterdam Centraal]"
train_20,"[Den Helder, Alkmaar, Den Helder, Alkmaar, Hoorn, Alkmaar, Castricum, Beverwijk]"
score,1327.5730337078649
