train,stations
train_1,"[Roermond, Weert, Eindhoven, Tilburg, s-Hertogenbosch, Utrecht Centraal, Amsterdam Amstel, Amsterdam Zuid, Schiphol Airport, Amsterdam Zuid, Schiphol Airport, Amsterdam Zuid, Amsterdam Amstel, Amsterdam Centraal, Amsterdam Amstel]"
train_2,"[Rotterdam Centraal, Schiedam Centrum, Delft, Den Haag Laan v NOI, Gouda, Rotterdam Alexander, Gouda, Alphen a/d Rijn, Utrecht Centraal, Amsterdam Amstel, Hilversum]"
train_3,"[Deventer, Zwolle, Steenwijk, Zwolle, Assen, Zwolle, Deventer]"
train_4,"[Eindhoven, s-Hertogenbosch, Tilburg, s-Hertogenbosch, Tilburg, Eindhoven, Tilburg, Eindhoven, Helmond, Eindhoven, s-Hertogenbosch, Oss]"
train_5,"[Delft, Den Haag Laan v NOI, Delft, Schiedam Centrum, Rotterdam Blaak, Rotterdam Alexander, Rotterdam Blaak, Dordrecht, Rotterdam Blaak, Schiedam Centrum, Rotterdam Centraal, Rotterdam Alexander, Rotterdam Centraal, Dordrecht, Breda, Tilburg]"
train_6,"[Leeuwarden, Heerenveen, Leeuwarden, Groningen, Leeuwarden, Groningen, Assen]"
train_7,"[Etten-Leur, Roosendaal, Vlissingen, Roosendaal, Dordrecht, Rotterdam Blaak]"
train_8,"[Leiden Centraal, Den Haag Centraal, Delft, Den Haag Centraal, Leiden Centraal, Den Haag Centraal, Gouda, Den Haag HS, Delft, Den Haag HS, Delft, Schiedam Centrum, Delft, Den Haag HS, Delft, Den Haag Laan v NOI]"
train_9,"[Zaandam, Castricum, Alkmaar, Hoorn, Zaandam, Beverwijk, Castricum, Alkmaar, Den Helder]"
train_10,"[Den Haag Centraal, Gouda, Utrecht Centraal, Amsterdam Centraal, Amsterdam Amstel, Amsterdam Zuid, Amsterdam Sloterdijk, Haarlem, Heemstede-Aerdenhout, Haarlem, Beverwijk, Zaandam]"
train_11,"[Alphen a/d Rijn, Gouda, Den Haag Laan v NOI, Leiden Centraal, Den Haag HS, Leiden Centraal, Den Haag Laan v NOI, Gouda, Den Haag HS, Delft, Den Haag HS, Leiden Centraal, Den Haag Laan v NOI]"
train_12,"[Amsterdam Amstel, Hilversum, Utrecht Centraal, Gouda, Den Haag Laan v NOI, Gouda, Den Haag Centraal, Leiden Centraal, Den Haag HS, Leiden Centraal]"
train_13,"[Enschede, Hengelo, Almelo, Zwolle, Amersfoort, Apeldoorn, Zutphen, Apeldoorn, Zutphen]"
train_14,"[Tilburg, s-Hertogenbosch, Tilburg, s-Hertogenbosch, Utrecht Centraal, Schiphol Airport, Leiden Centraal, Schiphol Airport, Leiden Centraal, Den Haag HS, Leiden Centraal]"
train_15,"[Delft, Den Haag HS, Delft, Den Haag Centraal, Delft, Schiedam Centrum, Rotterdam Blaak, Dordrecht, Breda, Tilburg, Breda, Dordrecht, Rotterdam Blaak, Schiedam Centrum, Rotterdam Centraal]"
train_16,"[Den Helder, Alkmaar, Hoorn, Alkmaar, Den Helder, Alkmaar]"
train_17,"[Den Haag Laan v NOI, Gouda, Den Haag HS, Leiden Centraal, Den Haag Laan v NOI, Gouda, Rotterdam Alexander, Gouda, Den Haag Laan v NOI, Leiden Centraal, Den Haag Centraal, Leiden Centraal]"
train_18,"[Assen, Groningen, Assen, Groningen, Leeuwarden, Heerenveen, Steenwijk, Zwolle, Steenwijk, Heerenveen]"
train_19,"[Almere Centrum, Hilversum, Utrecht Centraal, Amsterdam Centraal, Almere Centrum, Amsterdam Amstel, Amsterdam Zuid, Schiphol Airport, Utrecht Centraal]"
train_20,"[Hengelo, Enschede, Hengelo, Enschede, Hengelo, Enschede, Hengelo, Almelo, Hengelo, Enschede, Hengelo, Almelo, Deventer, Zutphen, Apeldoorn, Zutphen, Dieren, Zutphen]"
score,2696.8876404494376
