train,stations
train_1,"[Dordrecht, Breda, Etten-Leur, Roosendaal, Etten-Leur, Roosendaal, Vlissingen]"
train_2,"[Groningen, Assen, Groningen, Assen, Groningen, Assen, Groningen, Assen, Zwolle]"
train_3,"[Sittard, Roermond, Weert, Eindhoven, Weert, Eindhoven, Helmond, Eindhoven, Helmond, Venlo, Helmond]"
train_4,"[Assen, Groningen, Assen, Groningen, Assen, Groningen, Assen, Zwolle, Deventer]"
train_5,"[Sittard, Maastricht, Sittard, Roermond, Sittard, Heerlen, Sittard, Roermond, Sittard, Maastricht, Sittard, Roermond, Weert]"
train_6,"[Dordrecht, Rotterdam Blaak, Schiedam Centrum, Rotterdam Blaak, Schiedam Centrum, Rotterdam Centraal, Schiedam Centrum, Rotterdam Blaak, Schiedam Centrum, Delft, Den Haag Laan v NOI, Leiden Centraal, Heemstede-Aerdenhout, Haarlem, Beverwijk, Haarlem, Beverwijk]"
train_7,"[Schiphol Airport, Amsterdam Zuid, Amsterdam Amstel, Utrecht Centraal, Ede-Wageningen, Arnhem Centraal, Nijmegen, Arnhem Centraal, Ede-Wageningen, Arnhem Centraal, Nijmegen, Arnhem Centraal, Ede-Wageningen, Arnhem Centraal, Dieren]"
train_8,"[Alkmaar, Den Helder, Alkmaar, Castricum, Zaandam, Amsterdam Sloterdijk, Haarlem, Amsterdam Sloterdijk, Amsterdam Zuid, Schiphol Airport, Utrecht Centraal]"
train_9,"[Almelo, Hengelo, Almelo, Deventer, Zwolle, Deventer, Zwolle, Assen]"
train_10,"[Hoorn, Alkmaar, Hoorn, Zaandam, Hoorn, Zaandam, Castricum, Zaandam, Beverwijk]"
train_11,"[Helmond, Eindhoven, Helmond, Venlo, Helmond, Eindhoven, Weert, Eindhoven, Helmond, Eindhoven, Helmond, Eindhoven, s-Hertogenbosch]"
train_12,"[Roermond, Weert, Eindhoven, Weert, Eindhoven, Weert, Eindhoven, s-Hertogenbosch, Oss, Nijmegen, Oss, s-Hertogenbosch]"
train_13,"[Helmond, Eindhoven, Tilburg, Eindhoven, s-Hertogenbosch, Utrecht Centraal, Gouda, Utrecht Centraal, Amsterdam Amstel, Amsterdam Zuid, Schiphol Airport, Amsterdam Zuid]"
train_14,"[Weert, Roermond, Sittard, Maastricht, Sittard, Heerlen, Sittard, Maastricht, Sittard, Heerlen, Sittard, Maastricht, Sittard]"
train_15,"[Schiphol Airport, Amsterdam Zuid, Schiphol Airport, Amsterdam Zuid, Schiphol Airport, Amsterdam Zuid, Amsterdam Sloterdijk, Haarlem, Amsterdam Sloterdijk, Zaandam, Beverwijk, Castricum, Beverwijk, Haarlem, Beverwijk]"
train_16,"[Almere Centrum, Lelystad Centrum, Almere Centrum, Amsterdam Amstel, Amsterdam Zuid, Schiphol Airport, Amsterdam Zuid, Amsterdam Amstel, Hilversum, Utrecht Centraal, Amsterdam Centraal]"
train_17,"[Zutphen, Apeldoorn, Deventer, Apeldoorn, Deventer, Almelo, Deventer, Zwolle, Steenwijk, Heerenveen, Steenwijk]"
train_18,"[Amsterdam Amstel, Amsterdam Zuid, Amsterdam Sloterdijk, Zaandam, Hoorn, Zaandam, Amsterdam Sloterdijk, Zaandam, Hoorn, Alkmaar, Hoorn]"
train_19,"[Schiphol Airport, Amsterdam Zuid, Schiphol Airport, Leiden Centraal, Den Haag Laan v NOI, Gouda, Den Haag Centraal, Leiden Centraal, Heemstede-Aerdenhout, Leiden Centraal, Den Haag Laan v NOI, Delft, Den Haag Laan v NOI]"
train_20,"[Schiedam Centrum, Rotterdam Centraal, Dordrecht, Roosendaal, Vlissingen, Roosendaal]"
score,1870.0112359550558
