train,stations
train_1,"[Groningen, Assen, Groningen, Leeuwarden, Groningen, Leeuwarden, Heerenveen, Leeuwarden]"
train_2,"[Etten-Leur, Breda, Dordrecht, Rotterdam Centraal, Schiedam Centrum, Rotterdam Centraal, Dordrecht, Roosendaal, Dordrecht, Rotterdam Centraal, Dordrecht, Rotterdam Centraal]"
train_3,"[Hilversum, Utrecht Centraal, Gouda, Den Haag Centraal, Leiden Centraal, Heemstede-Aerdenhout, Haarlem, Beverwijk, Castricum, Alkmaar, Hoorn, Zaandam, Amsterdam Sloterdijk]"
train_4,"[Eindhoven, Tilburg, s-Hertogenbosch, Tilburg, s-Hertogenbosch, Eindhoven, Weert, Eindhoven, Helmond, Venlo]"
train_5,"[Apeldoorn, Amersfoort, Apeldoorn, Amersfoort, Zwolle, Assen]"
train_6,"[Den Haag HS, Leiden Centraal, Den Haag HS, Leiden Centraal, Den Haag HS, Gouda, Den Haag Centraal, Delft, Den Haag Laan v NOI, Delft, Den Haag HS, Leiden Centraal, Den Haag Centraal, Gouda]"
train_7,"[Arnhem Centraal, Dieren, Arnhem Centraal, Nijmegen, Arnhem Centraal, Nijmegen, Oss, s-Hertogenbosch, Oss, Nijmegen, Oss, s-Hertogenbosch, Oss, s-Hertogenbosch]"
train_8,"[Nijmegen, Oss, s-Hertogenbosch, Eindhoven, Weert, Eindhoven, Weert, Eindhoven, Weert, Roermond, Weert, Roermond]"
train_9,"[Zaandam, Amsterdam Sloterdijk, Amsterdam Zuid, Schiphol Airport, Amsterdam Zuid, Schiphol Airport, Utrecht Centraal, Amsterdam Centraal, Utrecht Centraal, Alphen a/d Rijn, Gouda]"
train_10,"[Schiedam Centrum, Rotterdam Centraal, Schiedam Centrum, Rotterdam Centraal, Schiedam Centrum, Rotterdam Blaak, Dordrecht, Rotterdam Blaak, Dordrecht, Breda, Etten-Leur, Breda, Dordrecht, Rotterdam Blaak, Dordrecht, Rotterdam Blaak, Schiedam Centrum]"
train_11,"[Utrecht Centraal, Ede-Wageningen, Arnhem Centraal, Nijmegen, Oss, s-Hertogenbosch, Utrecht Centraal, Gouda, Den Haag Centraal, Gouda, Rotterdam Alexander, Rotterdam Centraal]"
train_12,"[Hoorn, Alkmaar, Hoorn, Zaandam, Hoorn, Zaandam, Amsterdam Sloterdijk, Amsterdam Centraal, Almere Centrum]"
train_13,"[Enschede, Hengelo, Almelo, Zwolle, Amersfoort, Apeldoorn, Deventer, Zutphen, Deventer, Zwolle]"
train_14,"[Rotterdam Centraal, Schiedam Centrum, Rotterdam Blaak, Rotterdam Alexander, Rotterdam Blaak, Schiedam Centrum, Rotterdam Centraal, Schiedam Centrum, Delft, Den Haag Laan v NOI, Gouda, Rotterdam Alexander, Rotterdam Centraal, Dordrecht, Rotterdam Blaak, Rotterdam Alexander, Rotterdam Centraal]"
train_15,"[Amersfoort, Utrecht Centraal, Gouda, Den Haag Laan v NOI, Gouda, Den Haag HS, Delft, Schiedam Centrum, Rotterdam Centraal, Schiedam Centrum, Rotterdam Blaak, Schiedam Centrum, Rotterdam Blaak, Schiedam Centrum]"
train_16,"[Oss, Nijmegen, Oss, Nijmegen, Oss, Nijmegen, Arnhem Centraal, Dieren, Zutphen, Apeldoorn, Deventer, Apeldoorn, Amersfoort]"
train_17,"[Dordrecht, Breda, Etten-Leur, Roosendaal, Dordrecht, Roosendaal, Vlissingen]"
train_18,"[Sittard, Heerlen, Sittard, Heerlen, Sittard, Roermond, Sittard, Maastricht, Sittard, Roermond, Sittard, Roermond, Weert]"
train_19,"[s-Hertogenbosch, Oss, Nijmegen, Oss, s-Hertogenbosch, Utrecht Centraal, Ede-Wageningen, Arnhem Centraal, Ede-Wageningen, Utrecht Centraal, Amsterdam Centraal]"
train_20,"[Oss, Nijmegen, Arnhem Centraal, Dieren, Arnhem Centraal, Ede-Wageningen, Utrecht Centraal, Amsterdam Centraal, Amsterdam Amstel, Hilversum, Almere Centrum]"
score,2939.606741573034
