train,stations
train_1,"[Alkmaar, Castricum, Zaandam, Hoorn, Zaandam, Hoorn, Zaandam, Beverwijk, Castricum, Beverwijk]"
train_2,"[Roosendaal, Etten-Leur, Breda, Tilburg, s-Hertogenbosch, Oss, s-Hertogenbosch, Utrecht Centraal, Alphen a/d Rijn, Utrecht Centraal, Gouda]"
train_3,"[Venlo, Helmond, Eindhoven, Tilburg, Breda, Tilburg, s-Hertogenbosch, Tilburg, s-Hertogenbosch, Tilburg, s-Hertogenbosch, Eindhoven]"
train_4,"[Eindhoven, s-Hertogenbosch, Oss, s-Hertogenbosch, Eindhoven, Tilburg, s-Hertogenbosch, Oss, Nijmegen, Oss, Nijmegen, Oss]"
train_5,"[Schiedam Centrum, Rotterdam Centraal, Rotterdam Alexander, Rotterdam Centraal, Dordrecht, Roosendaal, Etten-Leur, Breda, Dordrecht, Rotterdam Centraal, Schiedam Centrum, Delft, Den Haag Laan v NOI, Leiden Centraal, Heemstede-Aerdenhout, Haarlem, Heemstede-Aerdenhout, Haarlem]"
train_6,"[Deventer, Zutphen, Deventer, Almelo, Deventer, Zutphen, Apeldoorn, Zutphen, Deventer, Zutphen, Deventer, Apeldoorn]"
train_7,"[Vlissingen, Roosendaal, Vlissingen]"
train_8,"[Zaandam, Castricum, Zaandam, Beverwijk, Zaandam, Castricum, Zaandam, Castricum, Alkmaar, Hoorn, Alkmaar]"
train_9,"[Alkmaar, Den Helder, Alkmaar, Den Helder, Alkmaar, Castricum, Beverwijk]"
train_10,"[Alkmaar, Castricum, Alkmaar, Den Helder, Alkmaar, Den Helder, Alkmaar]"
train_11,"[Vlissingen, Roosendaal, Vlissingen]"
train_12,"[Eindhoven, Tilburg, Breda, Dordrecht, Rotterdam Centraal, Schiedam Centrum, Delft, Den Haag Centraal, Leiden Centraal, Den Haag Laan v NOI, Leiden Centraal, Den Haag Laan v NOI, Gouda]"
train_13,"[Tilburg, Breda, Tilburg, Breda, Tilburg, Eindhoven, s-Hertogenbosch, Tilburg, Eindhoven, s-Hertogenbosch, Oss, s-Hertogenbosch]"
train_14,"[Helmond, Venlo, Helmond, Eindhoven, Weert, Roermond, Weert, Roermond, Sittard, Maastricht, Sittard]"
train_15,"[Rotterdam Blaak, Rotterdam Alexander, Gouda, Den Haag Laan v NOI, Delft, Den Haag Laan v NOI, Delft, Den Haag Centraal, Delft, Den Haag Laan v NOI, Gouda, Alphen a/d Rijn]"
train_16,"[Maastricht, Sittard, Roermond, Weert, Roermond, Sittard, Roermond, Weert, Roermond, Sittard, Roermond, Sittard, Maastricht]"
train_17,"[Leiden Centraal, Heemstede-Aerdenhout, Haarlem, Amsterdam Sloterdijk, Amsterdam Centraal, Amsterdam Sloterdijk, Haarlem, Heemstede-Aerdenhout, Leiden Centraal, Schiphol Airport, Amsterdam Zuid, Amsterdam Sloterdijk, Zaandam, Beverwijk, Castricum, Beverwijk]"
train_18,"[Delft, Den Haag HS, Gouda, Den Haag Centraal, Gouda, Den Haag HS, Delft, Den Haag HS, Delft, Schiedam Centrum, Delft, Den Haag HS, Gouda, Den Haag Centraal]"
train_19,"[Vlissingen, Roosendaal, Dordrecht, Breda, Etten-Leur, Roosendaal]"
train_20,"[Haarlem, Amsterdam Sloterdijk, Amsterdam Centraal, Utrecht Centraal, Amsterdam Centraal, Utrecht Centraal, Amsterdam Centraal, Amsterdam Amstel, Hilversum]"
score,1123.4943820224717
