train,stations
train_1,"[Leiden Centraal, Heemstede-Aerdenhout, Leiden Centraal, Den Haag HS, Delft, Den Haag Laan v NOI, Leiden Centraal, Den Haag HS, Gouda, Alphen a/d Rijn, Gouda, Utrecht Centraal]"
train_2,"[Vlissingen, Roosendaal, Vlissingen]"
train_3,"[Dordrecht, Roosendaal, Etten-Leur, Roosendaal, Dordrecht, Roosendaal, Vlissingen]"
train_4,"[Den Haag HS, Gouda, Den Haag HS, Leiden Centraal, Schiphol Airport, Utrecht Centraal, Amsterdam Centraal, Amsterdam Amstel, Almere Centrum]"
train_5,"[Maastricht, Sittard, Roermond, Weert, Roermond, Weert, Roermond, Sittard, Heerlen, Sittard, Maastricht, Sittard, Heerlen]"
train_6,"[Nijmegen, Oss, s-Hertogenbosch, Oss, Nijmegen, Arnhem Centraal, Ede-Wageningen, Utrecht Centraal, Amsterdam Amstel, Hilversum, Amsterdam Amstel]"
train_7,"[Hilversum, Amsterdam Amstel, Utrecht Centraal, Amsterdam Amstel, Hilversum, Utrecht Centraal, Ede-Wageningen, Utrecht Centraal, Amsterdam Amstel]"
train_8,"[Nijmegen, Oss, Nijmegen, Arnhem Centraal, Ede-Wageningen, Arnhem Centraal, Nijmegen, Oss, s-Hertogenbosch, Oss, Nijmegen, Arnhem Centraal, Ede-Wageningen, Utrecht Centraal]"
train_9,"[Amersfoort, Apeldoorn, Deventer, Zutphen, Apeldoorn, Amersfoort, Zwolle, Amersfoort]"
train_10,"[Sittard, Maastricht, Sittard, Heerlen, Sittard, Heerlen, Sittard, Roermond, Weert, Roermond, Weert, Roermond, Sittard]"
train_11,"[Groningen, Leeuwarden, Heerenveen, Leeuwarden, Groningen, Assen, Zwolle]"
train_12,"[Utrecht Centraal, Hilversum, Utrecht Centraal, Amersfoort, Zwolle, Steenwijk, Heerenveen, Leeuwarden, Heerenveen, Leeuwarden]"
train_13,"[Den Haag Laan v NOI, Delft, Den Haag Laan v NOI, Leiden Centraal, Den Haag Laan v NOI, Gouda, Den Haag Laan v NOI, Gouda, Alphen a/d Rijn, Gouda]"
train_14,"[Deventer, Zutphen, Apeldoorn, Deventer, Zwolle, Amersfoort, Zwolle, Steenwijk]"
train_15,"[Den Haag Laan v NOI, Delft, Den Haag HS, Leiden Centraal, Heemstede-Aerdenhout, Leiden Centraal, Den Haag Laan v NOI, Leiden Centraal, Heemstede-Aerdenhout, Haarlem, Beverwijk, Zaandam, Beverwijk, Castricum]"
train_16,"[Roermond, Weert, Roermond, Weert, Eindhoven, Tilburg, Eindhoven, Helmond, Venlo, Helmond]"
train_17,"[Amersfoort, Zwolle, Steenwijk, Heerenveen, Steenwijk, Heerenveen, Leeuwarden, Groningen, Assen]"
train_18,"[Zaandam, Hoorn, Alkmaar, Den Helder, Alkmaar, Hoorn, Zaandam]"
train_19,"[Castricum, Beverwijk, Haarlem, Beverwijk, Haarlem, Heemstede-Aerdenhout, Leiden Centraal, Schiphol Airport, Utrecht Centraal, Amsterdam Centraal, Amsterdam Sloterdijk, Haarlem, Heemstede-Aerdenhout]"
train_20,"[Beverwijk, Haarlem, Amsterdam Sloterdijk, Zaandam, Amsterdam Sloterdijk, Amsterdam Zuid, Schiphol Airport, Utrecht Centraal, Ede-Wageningen, Arnhem Centraal, Ede-Wageningen, Utrecht Centraal]"
score,1207.8539325842703
