train,stations
train_1,"[Almere Centrum, Amsterdam Amstel, Hilversum, Almere Centrum, Amsterdam Centraal, Amsterdam Amstel, Almere Centrum, Amsterdam Centraal]"
train_2,"[Utrecht Centraal, Ede-Wageningen, Utrecht Centraal, s-Hertogenbosch, Tilburg, s-Hertogenbosch, Eindhoven, Tilburg, s-Hertogenbosch, Eindhoven]"
train_3,"[Zutphen, Deventer, Zwolle, Deventer, Apeldoorn, Deventer, Almelo, Deventer, Zwolle]"
train_4,"[Leeuwarden, Groningen, Assen, Groningen, Assen, Zwolle, Deventer, Almelo]"
train_5,"[Dordrecht, Rotterdam Centraal, Dordrecht, Rotterdam Centraal, Rotterdam Alexander, Rotterdam Blaak, Dordrecht, Roosendaal, Dordrecht, Breda, Dordrecht]"
train_6,"[Zutphen, Dieren, Arnhem Centraal, Dieren, Zutphen, Deventer, Zutphen, Deventer, Zutphen, Apeldoorn, Amersfoort, Utrecht Centraal, s-Hertogenbosch]"
train_7,"[Schiphol Airport, Utrecht Centraal, s-Hertogenbosch, Utrecht Centraal, Schiphol Airport, Utrecht Centraal]"
train_8,"[Groningen, Leeuwarden, Groningen, Assen, Groningen, Leeuwarden, Heerenveen, Leeuwarden]"
train_9,"[Roermond, Sittard, Maastricht, Sittard, Maastricht, Sittard, Roermond, Weert, Roermond, Sittard, Roermond, Weert, Eindhoven]"
train_10,"[Rotterdam Alexander, Rotterdam Blaak, Dordrecht, Rotterdam Blaak, Dordrecht, Roosendaal, Etten-Leur, Breda, Tilburg, Breda, Tilburg, s-Hertogenbosch, Utrecht Centraal]"
train_11,"[Weert, Roermond, Weert, Roermond, Sittard, Roermond, Sittard, Heerlen, Sittard, Heerlen, Sittard, Roermond, Weert]"
train_12,"[Etten-Leur, Breda, Etten-Leur, Roosendaal, Vlissingen, Roosendaal, Etten-Leur, Breda, Etten-Leur]"
train_13,"[Etten-Leur, Roosendaal, Vlissingen, Roosendaal, Dordrecht, Rotterdam Centraal]"
train_14,"[Schiphol Airport, Utrecht Centraal, s-Hertogenbosch, Eindhoven, Helmond, Eindhoven, Weert, Eindhoven, Tilburg, Breda, Tilburg]"
train_15,"[Heerlen, Sittard, Heerlen, Sittard, Heerlen, Sittard, Roermond, Sittard, Roermond, Sittard, Roermond, Sittard]"
train_16,"[Beverwijk, Zaandam, Hoorn, Alkmaar, Hoorn, Zaandam, Amsterdam Sloterdijk, Amsterdam Centraal, Utrecht Centraal]"
train_17,"[Dordrecht, Roosendaal, Vlissingen, Roosendaal]"
train_18,"[Delft, Den Haag Laan v NOI, Delft, Den Haag Laan v NOI, Delft, Den Haag Centraal, Delft, Den Haag HS, Delft, Den Haag Centraal, Leiden Centraal, Alphen a/d Rijn, Utrecht Centraal, Gouda]"
train_19,"[Breda, Dordrecht, Rotterdam Centraal, Dordrecht, Breda, Tilburg, Eindhoven, Tilburg, s-Hertogenbosch, Eindhoven, Weert]"
train_20,"[Oss, Nijmegen, Oss, s-Hertogenbosch, Eindhoven, s-Hertogenbosch, Oss, Nijmegen, Oss, Nijmegen, Oss, Nijmegen]"
score,748.7752808988762
