train,stations
train_1,"[Eindhoven, Tilburg, Breda, Tilburg, s-Hertogenbosch, Oss, s-Hertogenbosch, Eindhoven, Tilburg, Eindhoven, s-Hertogenbosch, Tilburg]"
train_2,"[Breda, Etten-Leur, Breda, Etten-Leur, Breda, Dordrecht, Rotterdam Centraal, Schiedam Centrum, Rotterdam Centraal, Rotterdam Alexander, Gouda, Den Haag Laan v NOI, Gouda, Den Haag Laan v NOI]"
train_3,"[Hengelo, Almelo, Zwolle, Almelo, Hengelo, Almelo, Deventer, Almelo]"
train_4,"[Alphen a/d Rijn, Utrecht Centraal, Gouda, Utrecht Centraal, s-Hertogenbosch, Utrecht Centraal, Hilversum, Almere Centrum]"
train_5,"[Deventer, Zwolle, Almelo, Hengelo, Almelo, Hengelo, Almelo, Zwolle]"
train_6,"[Rotterdam Alexander, Rotterdam Centraal, Schiedam Centrum, Rotterdam Centraal, Rotterdam Alexander, Rotterdam Centraal, Rotterdam Alexander, Gouda, Utrecht Centraal, Alphen a/d Rijn, Leiden Centraal, Schiphol Airport, Leiden Centraal, Den Haag HS, Leiden Centraal, Den Haag Centraal]"
train_7,"[Utrecht Centraal, Alphen a/d Rijn, Utrecht Centraal, s-Hertogenbosch, Eindhoven, Weert, Eindhoven, Helmond, Venlo]"
train_8,"[Heemstede-Aerdenhout, Haarlem, Amsterdam Sloterdijk, Amsterdam Zuid, Schiphol Airport, Amsterdam Zuid, Amsterdam Amstel, Amsterdam Centraal, Amsterdam Amstel, Utrecht Centraal, Hilversum, Amsterdam Amstel, Amsterdam Zuid, Amsterdam Sloterdijk, Haarlem]"
train_9,"[Hilversum, Almere Centrum, Hilversum, Amsterdam Amstel, Hilversum, Almere Centrum, Lelystad Centrum, Almere Centrum, Lelystad Centrum]"
train_10,"[Roermond, Weert, Eindhoven, Helmond, Venlo, Helmond, Eindhoven, Weert, Roermond, Sittard, Roermond]"
train_11,"[Alphen a/d Rijn, Leiden Centraal, Heemstede-Aerdenhout, Leiden Centraal, Alphen a/d Rijn, Leiden Centraal, Den Haag Centraal, Gouda, Rotterdam Alexander, Rotterdam Blaak, Schiedam Centrum, Delft, Den Haag Centraal, Leiden Centraal, Heemstede-Aerdenhout]"
train_12,"[Beverwijk, Zaandam, Amsterdam Sloterdijk, Zaandam, Hoorn, Zaandam, Castricum, Beverwijk, Castricum, Alkmaar, Den Helder]"
train_13,"[Vlissingen, Roosendaal, Etten-Leur, Roosendaal, Etten-Leur, Breda, Dordrecht, Rotterdam Centraal, Dordrecht, Rotterdam Blaak]"
train_14,"[Heerenveen, Leeuwarden, Heerenveen, Leeuwarden, Groningen, Leeuwarden, Groningen, Assen]"
train_15,"[Rotterdam Alexander, Gouda, Den Haag HS, Leiden Centraal, Alphen a/d Rijn, Leiden Centraal, Den Haag Laan v NOI, Delft, Schiedam Centrum, Rotterdam Centraal, Rotterdam Alexander, Gouda, Alphen a/d Rijn, Gouda, Rotterdam Alexander, Rotterdam Centraal]"
train_16,"[Ede-Wageningen, Arnhem Centraal, Ede-Wageningen, Utrecht Centraal, Ede-Wageningen, Arnhem Centraal, Ede-Wageningen, Arnhem Centraal, Dieren, Zutphen, Dieren, Zutphen, Deventer, Zutphen, Dieren, Arnhem Centraal]"
train_17,"[Schiedam Centrum, Rotterdam Centraal, Schiedam Centrum, Rotterdam Centraal, Schiedam Centrum, Rotterdam Centraal, Rotterdam Alexander, Rotterdam Centraal, Rotterdam Alexander, Rotterdam Centraal, Schiedam Centrum, Rotterdam Blaak, Dordrecht, Roosendaal, Vlissingen]"
train_18,"[Amersfoort, Utrecht Centraal, Amsterdam Centraal, Amsterdam Sloterdijk, Zaandam, Beverwijk, Zaandam, Castricum, Zaandam, Castricum, Zaandam, Amsterdam Sloterdijk, Amsterdam Centraal, Amsterdam Amstel]"
train_19,"[Amsterdam Zuid, Amsterdam Sloterdijk, Haarlem, Heemstede-Aerdenhout, Leiden Centraal, Den Haag Centraal, Leiden Centraal, Heemstede-Aerdenhout, Leiden Centraal, Alphen a/d Rijn, Utrecht Centraal, Hilversum, Almere Centrum]"
train_20,"[Heerlen, Sittard, Heerlen, Sittard, Maastricht, Sittard, Maastricht, Sittard, Heerlen, Sittard, Heerlen, Sittard]"
score,2771.2471910112363
