train,stations
train_1,"[Lelystad Centrum, Almere Centrum, Lelystad Centrum, Almere Centrum, Lelystad Centrum, Almere Centrum, Amsterdam Amstel, Amsterdam Zuid, Amsterdam Amstel, Utrecht Centraal, Gouda]"
train_2,"[Hoorn, Alkmaar, Castricum, Beverwijk, Haarlem, Beverwijk, Zaandam, Beverwijk, Zaandam, Amsterdam Sloterdijk, Amsterdam Centraal]"
train_3,"[Zaandam, Beverwijk, Zaandam, Beverwijk, Castricum, Alkmaar, Castricum, Zaandam, Hoorn, Alkmaar]"
train_4,"[Roermond, Sittard, Maastricht, Sittard, Heerlen, Sittard, Maastricht, Sittard, Heerlen, Sittard, Roermond, Weert, Roermond]"
train_5,"[Venlo, Helmond, Venlo, Helmond, Venlo, Helmond]"
train_6,"[Beverwijk, Castricum, Alkmaar, Den Helder, Alkmaar, Den Helder, Alkmaar]"
train_7,"[Roermond, Weert, Eindhoven, Helmond, Venlo, Helmond, Venlo, Helmond, Eindhoven]"
train_8,"[Schiedam Centrum, Rotterdam Centraal, Schiedam Centrum, Rotterdam Centraal, Dordrecht, Rotterdam Blaak, Dordrecht, Rotterdam Centraal, Dordrecht, Rotterdam Blaak, Schiedam Centrum, Delft, Den Haag HS, Gouda, Utrecht Centraal]"
train_9,"[Alphen a/d Rijn, Utrecht Centraal, Ede-Wageningen, Arnhem Centraal, Ede-Wageningen, Arnhem Centraal, Dieren, Zutphen, Dieren, Zutphen, Dieren, Arnhem Centraal, Dieren, Arnhem Centraal, Nijmegen]"
train_10,"[Hengelo, Enschede, Hengelo, Enschede, Hengelo, Enschede, Hengelo, Enschede, Hengelo, Enschede, Hengelo, Enschede, Hengelo, Enschede, Hengelo, Enschede, Hengelo, Enschede, Hengelo, Enschede, Hengelo, Almelo]"
train_11,"[Vlissingen, Roosendaal, Etten-Leur, Breda, Dordrecht, Rotterdam Blaak, Schiedam Centrum, Delft, Den Haag HS, Leiden Centraal, Heemstede-Aerdenhout, Leiden Centraal]"
train_12,"[Lelystad Centrum, Almere Centrum, Amsterdam Centraal, Amsterdam Sloterdijk, Amsterdam Centraal, Amsterdam Amstel, Hilversum, Amsterdam Amstel, Amsterdam Centraal, Almere Centrum, Amsterdam Amstel]"
train_13,"[Groningen, Assen, Groningen, Leeuwarden, Heerenveen, Leeuwarden, Groningen, Leeuwarden]"
train_14,"[Almere Centrum, Amsterdam Centraal, Amsterdam Amstel, Amsterdam Centraal, Almere Centrum, Hilversum, Amsterdam Amstel, Hilversum, Utrecht Centraal, Ede-Wageningen]"
train_15,"[Zutphen, Deventer, Zutphen, Apeldoorn, Amersfoort, Apeldoorn, Deventer, Zutphen, Apeldoorn, Zutphen, Deventer]"
train_16,"[Almelo, Zwolle, Almelo, Deventer, Apeldoorn, Deventer, Zwolle, Steenwijk]"
train_17,"[Roermond, Sittard, Heerlen, Sittard, Maastricht, Sittard, Maastricht, Sittard, Roermond, Weert, Roermond, Weert, Eindhoven]"
train_18,"[Den Haag Centraal, Gouda, Utrecht Centraal, Alphen a/d Rijn, Gouda, Den Haag Laan v NOI, Leiden Centraal, Alphen a/d Rijn, Utrecht Centraal]"
train_19,"[Schiphol Airport, Leiden Centraal, Den Haag Centraal, Delft, Den Haag Centraal, Gouda, Utrecht Centraal, Amsterdam Centraal, Amsterdam Amstel, Amsterdam Centraal, Amsterdam Amstel, Amsterdam Zuid, Schiphol Airport, Amsterdam Zuid, Schiphol Airport]"
train_20,"[Etten-Leur, Breda, Dordrecht, Roosendaal, Dordrecht, Rotterdam Centraal, Rotterdam Alexander, Rotterdam Blaak, Rotterdam Alexander, Rotterdam Centraal, Rotterdam Alexander, Rotterdam Centraal, Dordrecht, Rotterdam Blaak]"
score,2704.8876404494376
