train,stations
train_1,"[Venlo, Helmond, Venlo, Helmond, Venlo, Helmond, Eindhoven, Helmond, Eindhoven]"
train_2,"[Steenwijk, Heerenveen, Leeuwarden, Groningen, Leeuwarden, Heerenveen, Leeuwarden, Groningen]"
train_3,"[Etten-Leur, Roosendaal, Dordrecht, Roosendaal, Etten-Leur, Breda, Dordrecht, Rotterdam Blaak, Schiedam Centrum, Delft, Den Haag Centraal, Leiden Centraal, Den Haag Laan v NOI]"
train_4,"[Etten-Leur, Roosendaal, Vlissingen, Roosendaal]"
train_5,"[Tilburg, Eindhoven, Weert, Roermond, Weert, Eindhoven, Helmond, Venlo, Helmond]"
train_6,"[Heerenveen, Steenwijk, Zwolle, Amersfoort, Apeldoorn, Amersfoort, Apeldoorn, Deventer, Zwolle]"
train_7,"[Rotterdam Alexander, Rotterdam Centraal, Dordrecht, Roosendaal, Etten-Leur, Breda, Etten-Leur, Breda, Etten-Leur, Breda, Dordrecht, Rotterdam Centraal, Rotterdam Alexander, Rotterdam Centraal, Schiedam Centrum, Rotterdam Centraal, Rotterdam Alexander, Rotterdam Blaak]"
train_8,"[Haarlem, Heemstede-Aerdenhout, Haarlem, Amsterdam Sloterdijk, Haarlem, Heemstede-Aerdenhout, Haarlem, Beverwijk, Castricum, Zaandam, Amsterdam Sloterdijk, Haarlem, Heemstede-Aerdenhout, Haarlem, Heemstede-Aerdenhout, Leiden Centraal, Heemstede-Aerdenhout, Leiden Centraal, Heemstede-Aerdenhout]"
train_9,"[Helmond, Eindhoven, Weert, Roermond, Sittard, Roermond, Sittard, Roermond, Sittard, Roermond, Weert, Roermond, Weert]"
train_10,"[Den Haag HS, Leiden Centraal, Alphen a/d Rijn, Leiden Centraal, Den Haag Laan v NOI, Leiden Centraal, Alphen a/d Rijn, Gouda, Den Haag Laan v NOI, Gouda, Den Haag Laan v NOI]"
train_11,"[Steenwijk, Heerenveen, Leeuwarden, Heerenveen, Leeuwarden, Heerenveen, Leeuwarden, Heerenveen, Steenwijk, Heerenveen, Leeuwarden]"
train_12,"[Helmond, Eindhoven, Weert, Roermond, Sittard, Heerlen, Sittard, Maastricht, Sittard, Roermond, Sittard, Heerlen, Sittard]"
train_13,"[Roermond, Sittard, Roermond, Sittard, Maastricht, Sittard, Heerlen, Sittard, Heerlen, Sittard, Maastricht, Sittard]"
train_14,"[Oss, s-Hertogenbosch, Utrecht Centraal, s-Hertogenbosch, Tilburg, s-Hertogenbosch, Eindhoven, s-Hertogenbosch, Tilburg, Eindhoven]"
train_15,"[Haarlem, Beverwijk, Zaandam, Hoorn, Zaandam, Hoorn, Zaandam, Amsterdam Sloterdijk, Haarlem, Amsterdam Sloterdijk]"
train_16,"[Enschede, Hengelo, Almelo, Zwolle, Steenwijk, Heerenveen, Steenwijk, Heerenveen, Leeuwarden, Groningen]"
train_17,"[Oss, Nijmegen, Oss, s-Hertogenbosch, Eindhoven, s-Hertogenbosch, Tilburg, Breda, Etten-Leur, Breda, Tilburg, Breda, Tilburg, Breda]"
train_18,"[Amsterdam Zuid, Amsterdam Sloterdijk, Zaandam, Beverwijk, Zaandam, Beverwijk, Zaandam, Castricum, Beverwijk, Haarlem, Amsterdam Sloterdijk]"
train_19,"[Arnhem Centraal, Ede-Wageningen, Arnhem Centraal, Nijmegen, Arnhem Centraal, Dieren, Arnhem Centraal, Dieren, Arnhem Centraal, Nijmegen, Arnhem Centraal, Nijmegen, Arnhem Centraal, Ede-Wageningen, Utrecht Centraal]"
train_20,"[Zwolle, Steenwijk, Zwolle, Amersfoort, Apeldoorn, Amersfoort, Zwolle]"
score,1128.8539325842703
