train,stations
train_1,"[Leiden Centraal, Alphen a/d Rijn, Utrecht Centraal, Amsterdam Amstel, Amsterdam Centraal, Utrecht Centraal, Amsterdam Amstel, Amsterdam Centraal, Amsterdam Sloterdijk, Amsterdam Centraal, Almere Centrum]"
train_2,"[Amsterdam Sloterdijk, Amsterdam Zuid, Amsterdam Sloterdijk, Zaandam, Castricum, Alkmaar, Hoorn, Zaandam, Castricum, Beverwijk, Haarlem, Beverwijk, Castricum]"
train_3,"[Etten-Leur, Breda, Etten-Leur, Roosendaal, Vlissingen, Roosendaal]"
train_4,"[Zutphen, Deventer, Zutphen, Dieren, Arnhem Centraal, Nijmegen, Arnhem Centraal, Ede-Wageningen, Utrecht Centraal, Amsterdam Centraal, Amsterdam Sloterdijk, Amsterdam Zuid, Schiphol Airport, Leiden Centraal]"
train_5,"[Eindhoven, Tilburg, s-Hertogenbosch, Oss, s-Hertogenbosch, Eindhoven, Helmond, Eindhoven, Helmond, Eindhoven, Weert, Eindhoven, s-Hertogenbosch, Oss]"
train_6,"[Rotterdam Centraal, Dordrecht, Rotterdam Blaak, Dordrecht, Roosendaal, Vlissingen]"
train_7,"[Amersfoort, Utrecht Centraal, Amsterdam Amstel, Hilversum, Amsterdam Amstel, Hilversum, Almere Centrum, Amsterdam Centraal, Amsterdam Amstel]"
train_8,"[Vlissingen, Roosendaal, Dordrecht, Roosendaal, Dordrecht, Roosendaal]"
train_9,"[s-Hertogenbosch, Utrecht Centraal, Amsterdam Amstel, Amsterdam Centraal, Almere Centrum, Amsterdam Centraal, Utrecht Centraal, s-Hertogenbosch, Oss, s-Hertogenbosch]"
train_10,"[Heerlen, Sittard, Heerlen, Sittard, Maastricht, Sittard, Roermond, Weert, Eindhoven, Weert, Eindhoven, Helmond]"
train_11,"[Assen, Groningen, Assen, Zwolle, Steenwijk, Heerenveen, Steenwijk, Heerenveen, Steenwijk, Zwolle]"
train_12,"[Rotterdam Blaak, Rotterdam Alexander, Rotterdam Centraal, Rotterdam Alexander, Gouda, Den Haag Laan v NOI, Leiden Centraal, Den Haag HS, Gouda, Den Haag HS, Leiden Centraal, Den Haag Centraal, Gouda, Rotterdam Alexander]"
train_13,"[Hilversum, Amsterdam Amstel, Amsterdam Centraal, Amsterdam Amstel, Amsterdam Zuid, Amsterdam Sloterdijk, Zaandam, Castricum, Beverwijk, Haarlem, Beverwijk, Zaandam]"
train_14,"[Heerlen, Sittard, Maastricht, Sittard, Maastricht, Sittard, Roermond, Sittard, Maastricht, Sittard, Roermond, Weert]"
train_15,"[Deventer, Apeldoorn, Amersfoort, Utrecht Centraal, Ede-Wageningen, Arnhem Centraal, Dieren, Zutphen, Deventer, Zutphen, Apeldoorn, Zutphen]"
train_16,"[Utrecht Centraal, Gouda, Den Haag Laan v NOI, Gouda, Alphen a/d Rijn, Utrecht Centraal, Schiphol Airport]"
train_17,"[Steenwijk, Heerenveen, Leeuwarden, Heerenveen, Steenwijk, Heerenveen, Steenwijk, Heerenveen, Steenwijk, Heerenveen, Steenwijk, Zwolle]"
train_18,"[Eindhoven, s-Hertogenbosch, Oss, Nijmegen, Oss, s-Hertogenbosch, Tilburg, Eindhoven, Tilburg, Eindhoven, Helmond, Eindhoven, Helmond]"
train_19,"[Amsterdam Sloterdijk, Amsterdam Zuid, Amsterdam Amstel, Utrecht Centraal, Alphen a/d Rijn, Gouda, Den Haag Centraal, Gouda, Utrecht Centraal, Ede-Wageningen]"
train_20,"[Rotterdam Alexander, Rotterdam Centraal, Schiedam Centrum, Rotterdam Centraal, Schiedam Centrum, Rotterdam Centraal, Dordrecht, Breda, Etten-Leur, Roosendaal, Vlissingen]"
score,2365.4494382022467
