train,stations
train_1,"[Den Haag Centraal, Delft, Den Haag HS, Delft, Den Haag HS, Delft, Den Haag Centraal, Leiden Centraal, Schiphol Airport, Amsterdam Zuid, Schiphol Airport, Utrecht Centraal, Schiphol Airport]"
train_2,"[Venlo, Helmond, Venlo, Helmond, Venlo, Helmond, Eindhoven]"
train_3,"[Heerlen, Sittard, Roermond, Weert, Roermond, Weert, Eindhoven, Helmond, Eindhoven, Helmond, Eindhoven, s-Hertogenbosch, Eindhoven, Helmond]"
train_4,"[Den Haag HS, Gouda, Den Haag Centraal, Gouda, Den Haag HS, Delft, Den Haag Laan v NOI, Leiden Centraal, Alphen a/d Rijn, Utrecht Centraal, Amsterdam Amstel]"
train_5,"[Apeldoorn, Amersfoort, Apeldoorn, Deventer, Zwolle, Steenwijk, Heerenveen, Steenwijk, Zwolle]"
train_6,"[Amsterdam Sloterdijk, Amsterdam Centraal, Utrecht Centraal, Alphen a/d Rijn, Utrecht Centraal, Amsterdam Centraal, Utrecht Centraal, s-Hertogenbosch]"
train_7,"[Delft, Den Haag HS, Leiden Centraal, Den Haag Laan v NOI, Leiden Centraal, Den Haag Centraal, Leiden Centraal, Heemstede-Aerdenhout, Haarlem, Heemstede-Aerdenhout, Haarlem, Heemstede-Aerdenhout, Leiden Centraal, Schiphol Airport, Utrecht Centraal, Amsterdam Amstel]"
train_8,"[Venlo, Helmond, Venlo, Helmond, Venlo, Helmond, Eindhoven, Weert]"
train_9,"[Assen, Groningen, Leeuwarden, Groningen, Leeuwarden, Groningen]"
train_10,"[Sittard, Heerlen, Sittard, Maastricht, Sittard, Roermond, Weert, Eindhoven, Tilburg, Eindhoven, Helmond, Eindhoven]"
train_11,"[Sittard, Heerlen, Sittard, Heerlen, Sittard, Maastricht, Sittard, Roermond, Sittard, Heerlen, Sittard, Roermond, Weert]"
train_12,"[Helmond, Eindhoven, Helmond, Venlo, Helmond, Venlo, Helmond, Venlo]"
train_13,"[Zutphen, Apeldoorn, Zutphen, Deventer, Zutphen, Apeldoorn, Zutphen, Dieren, Arnhem Centraal, Dieren, Zutphen, Apeldoorn, Deventer]"
train_14,"[Gouda, Utrecht Centraal, Gouda, Den Haag Laan v NOI, Delft, Den Haag Laan v NOI, Gouda, Utrecht Centraal, Ede-Wageningen, Arnhem Centraal]"
train_15,"[Schiphol Airport, Utrecht Centraal, Amsterdam Centraal, Amsterdam Sloterdijk, Amsterdam Centraal, Amsterdam Amstel, Almere Centrum, Amsterdam Amstel, Almere Centrum]"
train_16,"[Zwolle, Assen, Groningen, Leeuwarden, Heerenveen, Steenwijk, Zwolle]"
train_17,"[Leeuwarden, Groningen, Leeuwarden, Heerenveen, Leeuwarden, Heerenveen, Leeuwarden, Heerenveen, Leeuwarden]"
train_18,"[Den Haag Laan v NOI, Leiden Centraal, Den Haag Centraal, Leiden Centraal, Den Haag Laan v NOI, Leiden Centraal, Schiphol Airport, Utrecht Centraal, Amersfoort, Apeldoorn, Deventer, Zwolle]"
train_19,"[Rotterdam Alexander, Gouda, Alphen a/d Rijn, Gouda, Utrecht Centraal, Gouda, Alphen a/d Rijn, Gouda, Alphen a/d Rijn, Gouda, Den Haag Centraal]"
train_20,"[Tilburg, s-Hertogenbosch, Eindhoven, Helmond, Eindhoven, Helmond, Eindhoven, Weert, Eindhoven, Helmond, Eindhoven, Tilburg, s-Hertogenbosch]"
score,363.33707865168526
