train,stations
train_1,"[Zaandam, Beverwijk, Zaandam, Castricum, Beverwijk, Zaandam, Castricum, Alkmaar, Den Helder]"
train_2,"[Almelo, Hengelo, Almelo, Deventer, Zutphen, Dieren, Zutphen, Apeldoorn, Amersfoort, Zwolle]"
train_3,"[Amsterdam Centraal, Almere Centrum, Amsterdam Amstel, Amsterdam Zuid, Amsterdam Sloterdijk, Amsterdam Zuid, Amsterdam Sloterdijk, Haarlem, Amsterdam Sloterdijk, Haarlem, Amsterdam Sloterdijk, Haarlem, Beverwijk]"
train_4,"[Haarlem, Heemstede-Aerdenhout, Haarlem, Beverwijk, Castricum, Alkmaar, Hoorn, Zaandam, Amsterdam Sloterdijk, Haarlem, Amsterdam Sloterdijk, Amsterdam Zuid, Amsterdam Amstel, Amsterdam Zuid, Amsterdam Amstel]"
train_5,"[Den Haag Centraal, Leiden Centraal, Schiphol Airport, Amsterdam Zuid, Amsterdam Amstel, Amsterdam Zuid, Schiphol Airport, Leiden Centraal, Schiphol Airport, Leiden Centraal, Schiphol Airport, Utrecht Centraal]"
train_6,"[Weert, Roermond, Weert, Roermond, Weert, Roermond, Weert, Eindhoven, Weert, Eindhoven, Weert, Eindhoven, Helmond]"
train_7,"[Sittard, Heerlen, Sittard, Heerlen, Sittard, Maastricht, Sittard, Heerlen, Sittard, Maastricht, Sittard, Roermond, Weert]"
train_8,"[Lelystad Centrum, Almere Centrum, Lelystad Centrum, Almere Centrum, Lelystad Centrum, Almere Centrum, Hilversum, Utrecht Centraal, Schiphol Airport, Amsterdam Zuid, Amsterdam Sloterdijk]"
train_9,"[Delft, Den Haag Laan v NOI, Delft, Den Haag Centraal, Gouda, Utrecht Centraal, Hilversum, Amsterdam Amstel, Amsterdam Zuid, Amsterdam Amstel, Almere Centrum]"
train_10,"[Breda, Etten-Leur, Roosendaal, Etten-Leur, Roosendaal, Dordrecht, Roosendaal, Dordrecht, Breda, Etten-Leur, Roosendaal]"
train_11,"[Den Haag HS, Delft, Den Haag Laan v NOI, Delft, Schiedam Centrum, Rotterdam Centraal, Rotterdam Alexander, Rotterdam Centraal, Dordrecht, Rotterdam Centraal, Rotterdam Alexander, Gouda, Den Haag Laan v NOI, Leiden Centraal, Den Haag Centraal, Leiden Centraal]"
train_12,"[Ede-Wageningen, Arnhem Centraal, Dieren, Arnhem Centraal, Dieren, Arnhem Centraal, Dieren, Zutphen, Deventer, Zutphen, Deventer, Almelo, Deventer]"
train_13,"[Amsterdam Zuid, Amsterdam Sloterdijk, Haarlem, Beverwijk, Castricum, Zaandam, Castricum, Zaandam, Hoorn, Zaandam, Amsterdam Sloterdijk, Zaandam]"
train_14,"[Castricum, Zaandam, Castricum, Zaandam, Amsterdam Sloterdijk, Amsterdam Centraal, Utrecht Centraal, s-Hertogenbosch, Oss, Nijmegen, Arnhem Centraal, Dieren, Zutphen]"
train_15,"[Apeldoorn, Amersfoort, Utrecht Centraal, Gouda, Utrecht Centraal, Alphen a/d Rijn, Utrecht Centraal, Amersfoort, Apeldoorn]"
train_16,"[Leeuwarden, Groningen, Leeuwarden, Heerenveen, Leeuwarden, Heerenveen, Steenwijk, Zwolle]"
train_17,"[Zwolle, Almelo, Zwolle, Steenwijk, Heerenveen, Steenwijk, Zwolle]"
train_18,"[Enschede, Hengelo, Almelo, Hengelo, Enschede, Hengelo, Enschede, Hengelo, Almelo, Hengelo, Enschede, Hengelo, Almelo, Hengelo, Enschede, Hengelo, Almelo, Deventer]"
train_19,"[Heerlen, Sittard, Maastricht, Sittard, Maastricht, Sittard, Heerlen, Sittard, Roermond, Sittard, Heerlen, Sittard]"
train_20,"[Schiphol Airport, Utrecht Centraal, Amsterdam Amstel, Utrecht Centraal, Hilversum, Amsterdam Amstel, Utrecht Centraal, Amsterdam Centraal, Amsterdam Amstel, Amsterdam Zuid]"
score,2548.168539325843
