train,stations
train_1,"[Den Haag Centraal, Delft, Den Haag HS, Delft, Den Haag Laan v NOI, Leiden Centraal, Den Haag Centraal, Gouda, Den Haag Laan v NOI, Gouda, Den Haag Centraal, Delft, Schiedam Centrum]"
train_2,"[Utrecht Centraal, Amersfoort, Zwolle, Deventer, Zwolle, Steenwijk, Zwolle]"
train_3,"[Arnhem Centraal, Ede-Wageningen, Arnhem Centraal, Dieren, Zutphen, Apeldoorn, Deventer, Apeldoorn, Zutphen, Apeldoorn, Amersfoort, Utrecht Centraal, Amsterdam Amstel]"
train_4,"[Hengelo, Enschede, Hengelo, Enschede, Hengelo, Almelo, Deventer, Zutphen, Apeldoorn, Deventer, Zwolle, Amersfoort, Utrecht Centraal]"
train_5,"[Amsterdam Sloterdijk, Amsterdam Zuid, Amsterdam Sloterdijk, Amsterdam Zuid, Amsterdam Sloterdijk, Haarlem, Heemstede-Aerdenhout, Leiden Centraal, Schiphol Airport, Utrecht Centraal, Amersfoort]"
train_6,"[Beverwijk, Haarlem, Heemstede-Aerdenhout, Haarlem, Heemstede-Aerdenhout, Leiden Centraal, Alphen a/d Rijn, Utrecht Centraal, Amsterdam Centraal, Utrecht Centraal, Ede-Wageningen]"
train_7,"[Etten-Leur, Breda, Tilburg, Eindhoven, Helmond, Eindhoven, Tilburg, s-Hertogenbosch, Utrecht Centraal, Amsterdam Amstel, Utrecht Centraal]"
train_8,"[Haarlem, Amsterdam Sloterdijk, Zaandam, Amsterdam Sloterdijk, Haarlem, Heemstede-Aerdenhout, Haarlem, Beverwijk, Haarlem, Amsterdam Sloterdijk, Zaandam, Beverwijk, Zaandam, Amsterdam Sloterdijk, Zaandam, Castricum, Alkmaar]"
train_9,"[Vlissingen, Roosendaal, Dordrecht, Rotterdam Centraal, Dordrecht, Roosendaal, Etten-Leur, Breda, Dordrecht]"
train_10,"[Venlo, Helmond, Venlo, Helmond, Venlo, Helmond]"
train_11,"[Beverwijk, Haarlem, Beverwijk, Haarlem, Beverwijk, Haarlem, Heemstede-Aerdenhout, Leiden Centraal, Den Haag Centraal, Delft, Den Haag HS, Leiden Centraal, Alphen a/d Rijn, Leiden Centraal]"
train_12,"[Gouda, Den Haag HS, Delft, Den Haag HS, Leiden Centraal, Den Haag Centraal, Leiden Centraal, Den Haag Laan v NOI, Gouda, Rotterdam Alexander, Rotterdam Blaak, Schiedam Centrum, Rotterdam Blaak, Rotterdam Alexander, Rotterdam Blaak]"
train_13,"[Heemstede-Aerdenhout, Leiden Centraal, Schiphol Airport, Utrecht Centraal, Amersfoort, Apeldoorn, Deventer, Almelo, Hengelo, Enschede, Hengelo, Enschede, Hengelo, Enschede]"
train_14,"[Schiedam Centrum, Delft, Den Haag Laan v NOI, Delft, Den Haag Laan v NOI, Leiden Centraal, Den Haag Laan v NOI, Gouda, Utrecht Centraal, Amsterdam Centraal, Amsterdam Sloterdijk, Amsterdam Zuid, Amsterdam Sloterdijk, Amsterdam Centraal]"
train_15,"[Nijmegen, Arnhem Centraal, Ede-Wageningen, Arnhem Centraal, Ede-Wageningen, Utrecht Centraal, Hilversum, Amsterdam Amstel, Utrecht Centraal, Schiphol Airport, Amsterdam Zuid, Schiphol Airport]"
train_16,"[s-Hertogenbosch, Utrecht Centraal, Schiphol Airport, Amsterdam Zuid, Schiphol Airport, Amsterdam Zuid, Amsterdam Amstel, Amsterdam Centraal, Almere Centrum, Lelystad Centrum, Almere Centrum, Amsterdam Amstel]"
train_17,"[Sittard, Maastricht, Sittard, Heerlen, Sittard, Heerlen, Sittard, Maastricht, Sittard, Roermond, Sittard, Maastricht]"
train_18,"[Enschede, Hengelo, Enschede, Hengelo, Enschede, Hengelo, Enschede, Hengelo, Almelo, Hengelo, Almelo, Deventer, Zutphen, Dieren, Zutphen, Dieren, Zutphen, Deventer]"
train_19,"[Enschede, Hengelo, Almelo, Hengelo, Enschede, Hengelo, Enschede, Hengelo, Almelo, Zwolle, Deventer, Almelo, Hengelo, Almelo]"
train_20,"[Amsterdam Centraal, Utrecht Centraal, Amsterdam Amstel, Almere Centrum, Amsterdam Centraal, Utrecht Centraal, Schiphol Airport, Amsterdam Zuid, Schiphol Airport]"
score,2380.168539325843
