train,stations
train_1,"[Heerlen, Sittard, Roermond, Sittard, Heerlen, Sittard, Maastricht, Sittard, Roermond, Sittard, Heerlen, Sittard]"
train_2,"[Rotterdam Alexander, Gouda, Alphen a/d Rijn, Gouda, Den Haag Centraal, Gouda, Den Haag Centraal, Gouda, Rotterdam Alexander, Rotterdam Blaak, Schiedam Centrum, Delft, Schiedam Centrum, Rotterdam Centraal, Schiedam Centrum, Rotterdam Centraal]"
train_3,"[Etten-Leur, Breda, Tilburg, Eindhoven, Weert, Eindhoven, Tilburg, Eindhoven, Weert, Roermond, Sittard, Heerlen]"
train_4,"[s-Hertogenbosch, Utrecht Centraal, Schiphol Airport, Utrecht Centraal, Amersfoort, Utrecht Centraal, Amsterdam Amstel, Amsterdam Centraal, Almere Centrum]"
train_5,"[Hoorn, Zaandam, Amsterdam Sloterdijk, Amsterdam Centraal, Almere Centrum, Amsterdam Centraal, Amsterdam Sloterdijk, Zaandam, Amsterdam Sloterdijk, Amsterdam Zuid, Amsterdam Sloterdijk, Amsterdam Zuid, Schiphol Airport, Leiden Centraal, Heemstede-Aerdenhout]"
train_6,"[Almelo, Zwolle, Assen, Groningen, Assen, Groningen, Assen]"
train_7,"[Etten-Leur, Roosendaal, Etten-Leur, Roosendaal, Dordrecht, Breda, Tilburg, s-Hertogenbosch, Oss, Nijmegen, Arnhem Centraal, Nijmegen, Oss]"
train_8,"[Haarlem, Beverwijk, Zaandam, Castricum, Beverwijk, Zaandam, Beverwijk, Haarlem, Beverwijk, Haarlem, Heemstede-Aerdenhout]"
train_9,"[Apeldoorn, Amersfoort, Apeldoorn, Deventer, Almelo, Deventer, Zwolle, Amersfoort]"
train_10,"[Den Haag Centraal, Delft, Den Haag Laan v NOI, Leiden Centraal, Den Haag Laan v NOI, Delft, Den Haag Laan v NOI, Gouda, Utrecht Centraal, Alphen a/d Rijn, Utrecht Centraal]"
train_11,"[Rotterdam Centraal, Schiedam Centrum, Rotterdam Blaak, Dordrecht, Roosendaal, Vlissingen, Roosendaal]"
train_12,"[Vlissingen, Roosendaal, Etten-Leur, Breda, Tilburg, Breda, Tilburg, Breda, Etten-Leur, Breda, Tilburg, s-Hertogenbosch]"
train_13,"[Heerlen, Sittard, Maastricht, Sittard, Roermond, Weert, Eindhoven, Helmond, Eindhoven, Weert, Roermond, Weert, Eindhoven]"
train_14,"[Assen, Groningen, Assen, Groningen, Assen, Groningen, Leeuwarden, Heerenveen, Steenwijk, Zwolle]"
train_15,"[Zwolle, Almelo, Deventer, Almelo, Deventer, Zutphen, Apeldoorn, Amersfoort]"
train_16,"[Ede-Wageningen, Utrecht Centraal, Gouda, Utrecht Centraal, Amsterdam Centraal, Amsterdam Amstel, Hilversum, Almere Centrum, Lelystad Centrum, Almere Centrum]"
train_17,"[Venlo, Helmond, Eindhoven, Tilburg, Eindhoven, s-Hertogenbosch, Utrecht Centraal, Amsterdam Centraal]"
train_18,"[Amersfoort, Utrecht Centraal, Amsterdam Amstel, Utrecht Centraal, Amsterdam Amstel, Amsterdam Zuid, Amsterdam Amstel, Amsterdam Centraal, Amsterdam Sloterdijk, Haarlem, Heemstede-Aerdenhout, Haarlem, Amsterdam Sloterdijk, Amsterdam Zuid, Amsterdam Amstel, Amsterdam Centraal]"
train_19,"[Haarlem, Beverwijk, Castricum, Zaandam, Castricum, Zaandam, Amsterdam Sloterdijk, Zaandam, Amsterdam Sloterdijk, Amsterdam Centraal, Amsterdam Amstel, Amsterdam Centraal, Utrecht Centraal, s-Hertogenbosch]"
train_20,"[Rotterdam Centraal, Rotterdam Alexander, Rotterdam Centraal, Dordrecht, Breda, Dordrecht, Roosendaal, Vlissingen]"
score,2889.606741573034
