train,stations
train_1,"[Steenwijk, Zwolle, Assen, Zwolle, Amersfoort, Apeldoorn]"
train_2,"[Amsterdam Zuid, Schiphol Airport, Utrecht Centraal, s-Hertogenbosch, Tilburg, Breda, Dordrecht, Rotterdam Blaak, Schiedam Centrum, Delft, Den Haag Centraal, Delft, Den Haag HS]"
train_3,"[Roermond, Sittard, Heerlen, Sittard, Heerlen, Sittard, Heerlen, Sittard, Maastricht, Sittard, Maastricht, Sittard]"
train_4,"[Alphen a/d Rijn, Utrecht Centraal, Gouda, Utrecht Centraal, Amsterdam Amstel, Utrecht Centraal, Ede-Wageningen, Utrecht Centraal, Ede-Wageningen]"
train_5,"[Leiden Centraal, Schiphol Airport, Amsterdam Zuid, Amsterdam Amstel, Almere Centrum, Amsterdam Centraal, Utrecht Centraal, Schiphol Airport, Leiden Centraal, Heemstede-Aerdenhout, Leiden Centraal]"
train_6,"[Groningen, Leeuwarden, Groningen, Leeuwarden, Heerenveen, Leeuwarden, Heerenveen, Steenwijk]"
train_7,"[Gouda, Utrecht Centraal, Amersfoort, Zwolle, Deventer, Zwolle, Amersfoort, Apeldoorn]"
train_8,"[Rotterdam Centraal, Dordrecht, Breda, Dordrecht, Rotterdam Blaak, Schiedam Centrum, Rotterdam Centraal, Schiedam Centrum, Rotterdam Blaak, Dordrecht, Rotterdam Centraal, Dordrecht, Roosendaal]"
train_9,"[Heerlen, Sittard, Heerlen, Sittard, Maastricht, Sittard, Maastricht, Sittard, Roermond, Weert, Eindhoven, Weert]"
train_10,"[Castricum, Alkmaar, Den Helder, Alkmaar, Hoorn, Alkmaar, Hoorn, Alkmaar]"
train_11,"[Roermond, Weert, Roermond, Weert, Roermond, Sittard, Heerlen, Sittard, Heerlen, Sittard, Maastricht, Sittard, Heerlen]"
train_12,"[Amersfoort, Zwolle, Assen, Zwolle, Assen]"
train_13,"[Almere Centrum, Hilversum, Utrecht Centraal, Schiphol Airport, Utrecht Centraal, Alphen a/d Rijn, Utrecht Centraal]"
train_14,"[Utrecht Centraal, Gouda, Utrecht Centraal, Amsterdam Amstel, Amsterdam Zuid, Amsterdam Sloterdijk, Amsterdam Zuid, Schiphol Airport, Utrecht Centraal, Hilversum, Utrecht Centraal]"
train_15,"[Helmond, Venlo, Helmond, Venlo, Helmond, Venlo]"
train_16,"[Utrecht Centraal, Schiphol Airport, Leiden Centraal, Den Haag HS, Gouda, Den Haag HS, Gouda, Den Haag Laan v NOI, Leiden Centraal, Den Haag Laan v NOI]"
train_17,"[Zwolle, Assen, Groningen, Leeuwarden, Groningen, Assen]"
train_18,"[s-Hertogenbosch, Oss, Nijmegen, Oss, Nijmegen, Oss, Nijmegen, Arnhem Centraal, Ede-Wageningen, Utrecht Centraal, Gouda]"
train_19,"[Weert, Eindhoven, Weert, Roermond, Weert, Roermond, Sittard, Heerlen, Sittard, Roermond, Weert, Roermond, Weert]"
train_20,"[Helmond, Venlo, Helmond, Eindhoven, Weert, Eindhoven, s-Hertogenbosch, Oss, s-Hertogenbosch, Utrecht Centraal]"
score,907.1348314606739
