train,stations
train_1,"[Den Helder, Alkmaar, Castricum, Alkmaar, Hoorn, Zaandam, Castricum, Alkmaar, Den Helder]"
train_2,"[Den Haag Laan v NOI, Gouda, Alphen a/d Rijn, Gouda, Alphen a/d Rijn, Gouda, Alphen a/d Rijn, Leiden Centraal, Den Haag Centraal, Leiden Centraal, Den Haag Laan v NOI]"
train_3,"[s-Hertogenbosch, Tilburg, Breda, Dordrecht, Rotterdam Centraal, Dordrecht, Rotterdam Blaak, Dordrecht, Rotterdam Blaak, Rotterdam Alexander, Rotterdam Blaak, Schiedam Centrum, Rotterdam Centraal, Schiedam Centrum, Delft]"
train_4,"[Assen, Groningen, Leeuwarden, Groningen, Assen, Zwolle]"
train_5,"[Deventer, Zutphen, Dieren, Arnhem Centraal, Dieren, Zutphen, Dieren, Zutphen, Apeldoorn, Zutphen, Apeldoorn, Deventer, Almelo, Hengelo, Enschede]"
train_6,"[Sittard, Maastricht, Sittard, Heerlen, Sittard, Heerlen, Sittard, Heerlen, Sittard, Heerlen, Sittard, Maastricht]"
train_7,"[Nijmegen, Arnhem Centraal, Dieren, Arnhem Centraal, Nijmegen, Oss, Nijmegen, Oss, Nijmegen, Oss, s-Hertogenbosch, Tilburg, Eindhoven]"
train_8,"[Vlissingen, Roosendaal, Dordrecht, Rotterdam Centraal, Schiedam Centrum, Rotterdam Blaak, Schiedam Centrum, Delft, Den Haag Laan v NOI, Gouda]"
train_9,"[Zwolle, Assen, Zwolle, Steenwijk, Heerenveen, Leeuwarden, Heerenveen, Leeuwarden]"
train_10,"[Delft, Schiedam Centrum, Rotterdam Blaak, Schiedam Centrum, Rotterdam Blaak, Dordrecht, Rotterdam Centraal, Rotterdam Alexander, Gouda, Den Haag Laan v NOI, Gouda, Den Haag HS]"
train_11,"[Venlo, Helmond, Venlo, Helmond, Eindhoven, Weert, Roermond, Weert, Roermond, Sittard]"
train_12,"[Dordrecht, Roosendaal, Dordrecht, Breda, Tilburg, Eindhoven, Helmond, Eindhoven, Helmond, Venlo]"
train_13,"[Alkmaar, Hoorn, Zaandam, Hoorn, Zaandam, Beverwijk, Zaandam, Amsterdam Sloterdijk, Zaandam]"
train_14,"[Dordrecht, Roosendaal, Vlissingen, Roosendaal, Etten-Leur, Roosendaal]"
train_15,"[Amsterdam Sloterdijk, Amsterdam Zuid, Amsterdam Amstel, Amsterdam Centraal, Utrecht Centraal, Gouda, Den Haag Laan v NOI, Delft, Den Haag HS, Leiden Centraal, Heemstede-Aerdenhout, Leiden Centraal, Heemstede-Aerdenhout]"
train_16,"[Zaandam, Castricum, Alkmaar, Castricum, Alkmaar, Den Helder, Alkmaar, Castricum, Beverwijk, Haarlem, Amsterdam Sloterdijk, Zaandam, Amsterdam Sloterdijk, Amsterdam Centraal]"
train_17,"[Almere Centrum, Amsterdam Amstel, Utrecht Centraal, Alphen a/d Rijn, Gouda, Utrecht Centraal, Gouda, Den Haag Centraal, Leiden Centraal, Den Haag Laan v NOI, Leiden Centraal]"
train_18,"[Breda, Etten-Leur, Roosendaal, Vlissingen, Roosendaal]"
train_19,"[Rotterdam Centraal, Schiedam Centrum, Rotterdam Blaak, Rotterdam Alexander, Gouda, Den Haag Centraal, Leiden Centraal, Schiphol Airport, Utrecht Centraal, Amsterdam Centraal, Amsterdam Sloterdijk, Haarlem, Heemstede-Aerdenhout, Leiden Centraal]"
train_20,"[s-Hertogenbosch, Tilburg, s-Hertogenbosch, Utrecht Centraal, Hilversum, Utrecht Centraal, Amsterdam Amstel, Hilversum, Utrecht Centraal, Amsterdam Centraal]"
score,3153.3258426966295
