train,stations
train_1,"[Weert, Roermond, Weert, Eindhoven, Tilburg, Breda, Etten-Leur, Roosendaal, Etten-Leur, Roosendaal]"
train_2,"[Nijmegen, Arnhem Centraal, Nijmegen, Arnhem Centraal, Dieren, Zutphen, Dieren, Zutphen, Dieren, Arnhem Centraal, Nijmegen, Arnhem Centraal, Ede-Wageningen, Utrecht Centraal]"
train_3,"[Heerlen, Sittard, Maastricht, Sittard, Heerlen, Sittard, Roermond, Weert, Eindhoven, s-Hertogenbosch, Eindhoven, Helmond, Eindhoven]"
train_4,"[Dieren, Zutphen, Apeldoorn, Zutphen, Deventer, Zwolle, Almelo, Zwolle]"
train_5,"[Hoorn, Zaandam, Beverwijk, Castricum, Alkmaar, Den Helder, Alkmaar, Hoorn]"
train_6,"[Helmond, Venlo, Helmond, Venlo, Helmond, Eindhoven, Helmond, Eindhoven, Helmond, Eindhoven]"
train_7,"[Ede-Wageningen, Arnhem Centraal, Dieren, Zutphen, Deventer, Almelo, Deventer, Almelo, Zwolle]"
train_8,"[Sittard, Roermond, Weert, Roermond, Sittard, Heerlen, Sittard, Maastricht, Sittard, Roermond, Sittard, Heerlen, Sittard]"
train_9,"[Hoorn, Zaandam, Hoorn, Zaandam, Castricum, Zaandam, Hoorn, Zaandam, Castricum, Alkmaar]"
train_10,"[Tilburg, s-Hertogenbosch, Oss, Nijmegen, Arnhem Centraal, Ede-Wageningen, Arnhem Centraal, Nijmegen, Arnhem Centraal, Ede-Wageningen, Arnhem Centraal, Dieren, Zutphen, Deventer, Zwolle]"
train_11,"[Den Helder, Alkmaar, Hoorn, Zaandam, Castricum, Alkmaar, Hoorn, Alkmaar, Castricum, Zaandam]"
train_12,"[Utrecht Centraal, s-Hertogenbosch, Oss, Nijmegen, Oss, s-Hertogenbosch, Utrecht Centraal, Amsterdam Centraal, Amsterdam Sloterdijk, Zaandam, Beverwijk]"
train_13,"[Maastricht, Sittard, Roermond, Weert, Eindhoven, Tilburg, Eindhoven, Weert, Roermond, Sittard, Roermond, Weert]"
train_14,"[Weert, Roermond, Sittard, Heerlen, Sittard, Roermond, Weert, Roermond, Weert, Roermond, Weert, Roermond, Weert]"
train_15,"[Ede-Wageningen, Utrecht Centraal, Ede-Wageningen, Arnhem Centraal, Dieren, Arnhem Centraal, Ede-Wageningen, Arnhem Centraal, Nijmegen, Oss, s-Hertogenbosch, Tilburg, Eindhoven]"
train_16,"[Steenwijk, Heerenveen, Steenwijk, Heerenveen, Steenwijk, Zwolle, Deventer, Almelo, Deventer, Almelo]"
train_17,"[Tilburg, s-Hertogenbosch, Eindhoven, Helmond, Eindhoven, s-Hertogenbosch, Utrecht Centraal, Amersfoort, Zwolle]"
train_18,"[Hilversum, Almere Centrum, Hilversum, Almere Centrum, Amsterdam Centraal, Almere Centrum, Hilversum, Almere Centrum]"
train_19,"[Rotterdam Centraal, Rotterdam Alexander, Rotterdam Centraal, Schiedam Centrum, Rotterdam Centraal, Schiedam Centrum, Rotterdam Centraal, Schiedam Centrum, Delft, Schiedam Centrum, Rotterdam Blaak, Dordrecht, Breda, Etten-Leur, Breda, Dordrecht, Breda, Dordrecht]"
train_20,"[Assen, Zwolle, Amersfoort, Apeldoorn, Zutphen, Deventer, Almelo, Hengelo, Enschede, Hengelo]"
score,467.696629213483
