train,stations
train_1,"[Hilversum, Almere Centrum, Lelystad Centrum, Almere Centrum, Hilversum, Almere Centrum, Amsterdam Amstel, Almere Centrum]"
train_2,"[Amsterdam Sloterdijk, Amsterdam Zuid, Amsterdam Sloterdijk, Amsterdam Centraal, Utrecht Centraal, Ede-Wageningen, Utrecht Centraal, Hilversum, Utrecht Centraal, Alphen a/d Rijn]"
train_3,"[Hoorn, Zaandam, Beverwijk, Haarlem, Beverwijk, Haarlem, Heemstede-Aerdenhout, Leiden Centraal, Heemstede-Aerdenhout, Leiden Centraal, Den Haag HS, Gouda]"
train_4,"[Eindhoven, Tilburg, s-Hertogenbosch, Tilburg, s-Hertogenbosch, Tilburg, Breda, Tilburg, Breda, Tilburg, Breda, Etten-Leur, Breda, Etten-Leur, Roosendaal]"
train_5,"[Roosendaal, Vlissingen, Roosendaal, Dordrecht, Breda, Etten-Leur]"
train_6,"[Weert, Eindhoven, Weert, Eindhoven, Helmond, Eindhoven, Tilburg, Breda, Tilburg, Breda, Etten-Leur, Breda, Etten-Leur, Roosendaal]"
train_7,"[Almere Centrum, Amsterdam Amstel, Hilversum, Almere Centrum, Lelystad Centrum, Almere Centrum, Lelystad Centrum, Almere Centrum, Hilversum, Utrecht Centraal]"
train_8,"[Amsterdam Amstel, Amsterdam Zuid, Amsterdam Amstel, Amsterdam Centraal, Almere Centrum, Lelystad Centrum, Almere Centrum, Lelystad Centrum, Almere Centrum, Hilversum, Amsterdam Amstel, Utrecht Centraal]"
train_9,"[Rotterdam Blaak, Schiedam Centrum, Rotterdam Blaak, Rotterdam Alexander, Rotterdam Blaak, Schiedam Centrum, Rotterdam Centraal, Schiedam Centrum, Rotterdam Centraal, Rotterdam Alexander, Rotterdam Blaak, Rotterdam Alexander, Rotterdam Blaak, Schiedam Centrum, Rotterdam Blaak, Schiedam Centrum, Rotterdam Centraal, Rotterdam Alexander, Rotterdam Blaak, Dordrecht]"
train_10,"[Hilversum, Almere Centrum, Lelystad Centrum, Almere Centrum, Amsterdam Amstel, Utrecht Centraal, s-Hertogenbosch, Eindhoven, Weert, Eindhoven]"
train_11,"[Deventer, Apeldoorn, Deventer, Zwolle, Amersfoort, Utrecht Centraal, Ede-Wageningen, Arnhem Centraal, Ede-Wageningen, Utrecht Centraal]"
train_12,"[Steenwijk, Heerenveen, Steenwijk, Zwolle, Assen, Groningen, Assen, Groningen, Leeuwarden]"
train_13,"[Assen, Zwolle, Amersfoort, Apeldoorn, Zutphen, Dieren, Zutphen, Apeldoorn, Deventer]"
train_14,"[Amsterdam Zuid, Schiphol Airport, Amsterdam Zuid, Amsterdam Sloterdijk, Haarlem, Beverwijk, Zaandam, Beverwijk, Castricum, Zaandam, Castricum, Zaandam, Beverwijk]"
train_15,"[Lelystad Centrum, Almere Centrum, Hilversum, Utrecht Centraal, s-Hertogenbosch, Oss, Nijmegen, Arnhem Centraal, Ede-Wageningen, Arnhem Centraal, Dieren, Zutphen, Deventer]"
train_16,"[Alkmaar, Den Helder, Alkmaar, Hoorn, Zaandam, Amsterdam Sloterdijk, Haarlem, Heemstede-Aerdenhout, Leiden Centraal, Den Haag Laan v NOI, Delft]"
train_17,"[Rotterdam Centraal, Dordrecht, Rotterdam Centraal, Schiedam Centrum, Rotterdam Blaak, Dordrecht, Rotterdam Centraal, Schiedam Centrum, Rotterdam Blaak, Rotterdam Alexander, Gouda, Utrecht Centraal, Amsterdam Centraal]"
train_18,"[Heemstede-Aerdenhout, Haarlem, Amsterdam Sloterdijk, Zaandam, Amsterdam Sloterdijk, Zaandam, Castricum, Zaandam, Hoorn, Alkmaar, Castricum, Alkmaar, Castricum, Beverwijk, Haarlem, Amsterdam Sloterdijk]"
train_19,"[Almelo, Deventer, Almelo, Hengelo, Enschede, Hengelo, Almelo, Deventer, Zwolle, Deventer, Apeldoorn, Deventer]"
train_20,"[Rotterdam Centraal, Schiedam Centrum, Delft, Schiedam Centrum, Delft, Schiedam Centrum, Rotterdam Blaak, Schiedam Centrum, Delft, Den Haag Centraal, Delft, Den Haag HS, Delft, Den Haag HS, Delft, Schiedam Centrum, Rotterdam Blaak, Dordrecht, Roosendaal]"
score,2963.9662921348317
