train,stations
train_1,"[Assen, Groningen, Assen, Zwolle, Steenwijk, Heerenveen, Steenwijk, Heerenveen, Steenwijk, Zwolle]"
train_2,"[Enschede, Hengelo, Almelo, Deventer, Zwolle, Amersfoort, Apeldoorn, Amersfoort, Utrecht Centraal, Hilversum]"
train_3,"[Breda, Etten-Leur, Breda, Tilburg, Eindhoven, Helmond, Eindhoven, Helmond, Eindhoven, Tilburg, s-Hertogenbosch, Tilburg, s-Hertogenbosch, Oss, s-Hertogenbosch]"
train_4,"[Tilburg, Eindhoven, Weert, Roermond, Weert, Roermond, Weert, Eindhoven, Helmond, Venlo]"
train_5,"[Gouda, Den Haag HS, Delft, Schiedam Centrum, Delft, Den Haag HS, Gouda, Den Haag HS, Gouda, Utrecht Centraal, Schiphol Airport, Amsterdam Zuid, Schiphol Airport]"
train_6,"[Rotterdam Blaak, Schiedam Centrum, Rotterdam Blaak, Rotterdam Alexander, Rotterdam Blaak, Schiedam Centrum, Delft, Den Haag Centraal, Leiden Centraal, Den Haag HS, Delft, Den Haag Centraal, Leiden Centraal, Den Haag Laan v NOI, Gouda, Rotterdam Alexander]"
train_7,"[Sittard, Maastricht, Sittard, Heerlen, Sittard, Maastricht, Sittard, Roermond, Weert, Eindhoven, Weert, Roermond]"
train_8,"[Schiphol Airport, Amsterdam Zuid, Amsterdam Amstel, Amsterdam Centraal, Amsterdam Sloterdijk, Haarlem, Amsterdam Sloterdijk, Amsterdam Centraal, Utrecht Centraal, Gouda, Alphen a/d Rijn, Leiden Centraal, Heemstede-Aerdenhout, Haarlem, Amsterdam Sloterdijk, Amsterdam Centraal, Amsterdam Sloterdijk]"
train_9,"[Deventer, Almelo, Deventer, Zutphen, Apeldoorn, Zutphen, Apeldoorn, Deventer, Almelo]"
train_10,"[Venlo, Helmond, Eindhoven, Tilburg, s-Hertogenbosch, Eindhoven, s-Hertogenbosch, Eindhoven, s-Hertogenbosch, Tilburg]"
train_11,"[Breda, Dordrecht, Breda, Etten-Leur, Breda, Etten-Leur, Breda, Dordrecht, Rotterdam Blaak, Schiedam Centrum, Rotterdam Blaak, Schiedam Centrum, Delft, Den Haag Laan v NOI, Gouda]"
train_12,"[Weert, Eindhoven, Tilburg, Eindhoven, Helmond, Eindhoven, Tilburg, Eindhoven, Weert, Roermond, Sittard]"
train_13,"[Zaandam, Castricum, Beverwijk, Castricum, Beverwijk, Castricum, Zaandam, Beverwijk, Castricum, Alkmaar, Castricum, Beverwijk, Castricum, Beverwijk]"
train_14,"[Den Haag Centraal, Gouda, Utrecht Centraal, Ede-Wageningen, Arnhem Centraal, Dieren, Arnhem Centraal, Ede-Wageningen, Arnhem Centraal, Ede-Wageningen, Arnhem Centraal, Ede-Wageningen, Arnhem Centraal, Nijmegen, Arnhem Centraal]"
train_15,"[Almelo, Hengelo, Enschede, Hengelo, Almelo, Deventer, Almelo, Hengelo, Enschede, Hengelo, Enschede, Hengelo, Almelo, Zwolle]"
train_16,"[Almere Centrum, Hilversum, Utrecht Centraal, Amsterdam Amstel, Utrecht Centraal, Gouda, Den Haag HS, Delft, Schiedam Centrum, Delft, Schiedam Centrum, Delft, Den Haag Laan v NOI]"
train_17,"[Sittard, Heerlen, Sittard, Maastricht, Sittard, Roermond, Weert, Eindhoven, Tilburg, s-Hertogenbosch, Tilburg, Eindhoven]"
train_18,"[Alphen a/d Rijn, Utrecht Centraal, Schiphol Airport, Utrecht Centraal, Schiphol Airport, Amsterdam Zuid, Schiphol Airport, Leiden Centraal, Alphen a/d Rijn]"
train_19,"[Groningen, Assen, Groningen, Leeuwarden, Heerenveen, Leeuwarden, Groningen, Leeuwarden]"
train_20,"[Schiphol Airport, Utrecht Centraal, Hilversum, Almere Centrum, Amsterdam Centraal, Amsterdam Sloterdijk, Amsterdam Centraal, Almere Centrum, Amsterdam Amstel]"
score,2629.8876404494376
