train,stations
train_1,"[Zaandam, Castricum, Zaandam, Castricum, Beverwijk, Zaandam, Beverwijk, Castricum, Beverwijk, Zaandam, Amsterdam Sloterdijk, Amsterdam Zuid]"
train_2,"[Hoorn, Alkmaar, Castricum, Zaandam, Hoorn, Zaandam, Amsterdam Sloterdijk, Amsterdam Zuid, Schiphol Airport, Utrecht Centraal, Hilversum]"
train_3,"[Den Haag Laan v NOI, Leiden Centraal, Den Haag Laan v NOI, Leiden Centraal, Den Haag Laan v NOI, Leiden Centraal, Alphen a/d Rijn, Utrecht Centraal, Alphen a/d Rijn, Leiden Centraal, Heemstede-Aerdenhout, Leiden Centraal, Den Haag HS, Delft]"
train_4,"[Groningen, Assen, Zwolle, Assen, Groningen, Leeuwarden, Heerenveen]"
train_5,"[Vlissingen, Roosendaal, Etten-Leur, Breda, Etten-Leur, Breda, Dordrecht, Rotterdam Centraal, Rotterdam Alexander, Rotterdam Centraal, Dordrecht]"
train_6,"[Amsterdam Amstel, Hilversum, Almere Centrum, Hilversum, Almere Centrum, Amsterdam Centraal, Amsterdam Amstel, Amsterdam Centraal, Amsterdam Sloterdijk, Amsterdam Centraal, Almere Centrum]"
train_7,"[Leeuwarden, Heerenveen, Steenwijk, Heerenveen, Steenwijk, Zwolle, Almelo, Deventer, Apeldoorn]"
train_8,"[Zaandam, Beverwijk, Haarlem, Heemstede-Aerdenhout, Leiden Centraal, Schiphol Airport, Amsterdam Zuid, Schiphol Airport, Utrecht Centraal, Amsterdam Centraal, Almere Centrum]"
train_9,"[Leiden Centraal, Den Haag Centraal, Gouda, Den Haag HS, Gouda, Rotterdam Alexander, Gouda, Den Haag Centraal, Delft, Den Haag Laan v NOI, Delft, Den Haag Centraal, Delft]"
train_10,"[Hilversum, Almere Centrum, Lelystad Centrum, Almere Centrum, Lelystad Centrum, Almere Centrum, Lelystad Centrum, Almere Centrum, Amsterdam Amstel, Almere Centrum, Lelystad Centrum]"
train_11,"[Amsterdam Sloterdijk, Zaandam, Castricum, Zaandam, Beverwijk, Haarlem, Amsterdam Sloterdijk, Amsterdam Zuid, Amsterdam Sloterdijk, Amsterdam Zuid, Schiphol Airport, Utrecht Centraal]"
train_12,"[Delft, Den Haag Laan v NOI, Gouda, Den Haag Centraal, Delft, Den Haag Laan v NOI, Leiden Centraal, Alphen a/d Rijn, Utrecht Centraal, Schiphol Airport]"
train_13,"[Almere Centrum, Amsterdam Centraal, Almere Centrum, Amsterdam Centraal, Utrecht Centraal, Amsterdam Amstel, Almere Centrum, Amsterdam Amstel, Amsterdam Centraal, Amsterdam Amstel]"
train_14,"[Amsterdam Centraal, Utrecht Centraal, Alphen a/d Rijn, Leiden Centraal, Den Haag Centraal, Delft, Schiedam Centrum, Rotterdam Blaak, Rotterdam Alexander, Rotterdam Blaak, Schiedam Centrum, Rotterdam Centraal, Dordrecht]"
train_15,"[s-Hertogenbosch, Eindhoven, s-Hertogenbosch, Oss, s-Hertogenbosch, Tilburg, Eindhoven, Weert, Roermond, Sittard, Maastricht, Sittard]"
train_16,"[Tilburg, s-Hertogenbosch, Eindhoven, s-Hertogenbosch, Tilburg, s-Hertogenbosch, Tilburg, s-Hertogenbosch, Tilburg, Breda, Etten-Leur, Roosendaal, Dordrecht]"
train_17,"[Gouda, Den Haag HS, Delft, Den Haag Laan v NOI, Gouda, Alphen a/d Rijn, Utrecht Centraal, Amersfoort, Zwolle]"
train_18,"[Ede-Wageningen, Arnhem Centraal, Nijmegen, Arnhem Centraal, Dieren, Zutphen, Apeldoorn, Deventer, Zutphen, Dieren, Arnhem Centraal, Nijmegen, Oss, Nijmegen, Arnhem Centraal]"
train_19,"[Roosendaal, Dordrecht, Breda, Tilburg, s-Hertogenbosch, Utrecht Centraal, Amersfoort, Apeldoorn, Amersfoort]"
train_20,"[Heemstede-Aerdenhout, Leiden Centraal, Heemstede-Aerdenhout, Leiden Centraal, Alphen a/d Rijn, Leiden Centraal, Den Haag HS, Leiden Centraal, Schiphol Airport, Leiden Centraal, Alphen a/d Rijn, Gouda, Alphen a/d Rijn]"
score,3375.044943820225
