train,stations
train_1,"[Tilburg, Breda, Tilburg, s-Hertogenbosch, Utrecht Centraal, Hilversum, Amsterdam Amstel, Hilversum, Amsterdam Amstel, Amsterdam Centraal]"
train_2,"[Heerlen, Sittard, Heerlen, Sittard, Roermond, Sittard, Heerlen, Sittard, Roermond, Sittard, Maastricht, Sittard]"
train_3,"[Schiedam Centrum, Rotterdam Blaak, Dordrecht, Rotterdam Centraal, Rotterdam Alexander, Gouda, Rotterdam Alexander, Rotterdam Centraal, Schiedam Centrum, Rotterdam Blaak, Dordrecht, Roosendaal]"
train_4,"[Amersfoort, Utrecht Centraal, Amsterdam Centraal, Utrecht Centraal, Ede-Wageningen, Utrecht Centraal, Amsterdam Amstel, Utrecht Centraal]"
train_5,"[Hilversum, Utrecht Centraal, s-Hertogenbosch, Tilburg, Eindhoven, Tilburg, s-Hertogenbosch, Eindhoven, s-Hertogenbosch, Eindhoven]"
train_6,"[Maastricht, Sittard, Roermond, Weert, Roermond, Weert, Roermond, Sittard, Maastricht, Sittard, Roermond, Sittard, Heerlen]"
train_7,"[Roosendaal, Vlissingen, Roosendaal]"
train_8,"[Deventer, Almelo, Zwolle, Amersfoort, Zwolle, Deventer]"
train_9,"[Amsterdam Sloterdijk, Amsterdam Centraal, Almere Centrum, Amsterdam Amstel, Almere Centrum, Lelystad Centrum, Almere Centrum, Lelystad Centrum, Almere Centrum, Amsterdam Centraal, Amsterdam Sloterdijk, Amsterdam Centraal, Amsterdam Sloterdijk]"
train_10,"[Lelystad Centrum, Almere Centrum, Hilversum, Utrecht Centraal, Amersfoort, Apeldoorn, Deventer, Zutphen, Apeldoorn, Deventer, Zutphen, Deventer]"
train_11,"[Zwolle, Assen, Groningen, Assen, Zwolle, Deventer, Almelo]"
train_12,"[Arnhem Centraal, Nijmegen, Arnhem Centraal, Nijmegen, Arnhem Centraal, Ede-Wageningen, Utrecht Centraal, Hilversum, Almere Centrum, Lelystad Centrum, Almere Centrum, Hilversum]"
train_13,"[Heemstede-Aerdenhout, Leiden Centraal, Heemstede-Aerdenhout, Leiden Centraal, Den Haag Laan v NOI, Gouda, Utrecht Centraal, Amsterdam Centraal, Amsterdam Sloterdijk, Amsterdam Centraal, Almere Centrum, Lelystad Centrum]"
train_14,"[Zutphen, Dieren, Zutphen, Dieren, Arnhem Centraal, Dieren, Arnhem Centraal, Nijmegen, Oss, s-Hertogenbosch, Utrecht Centraal, Alphen a/d Rijn, Leiden Centraal]"
train_15,"[Amsterdam Sloterdijk, Amsterdam Centraal, Amsterdam Sloterdijk, Amsterdam Centraal, Almere Centrum, Amsterdam Centraal, Amsterdam Amstel, Almere Centrum, Amsterdam Amstel, Utrecht Centraal, Ede-Wageningen]"
train_16,"[Beverwijk, Zaandam, Hoorn, Zaandam, Hoorn, Zaandam, Hoorn, Alkmaar]"
train_17,"[Haarlem, Amsterdam Sloterdijk, Haarlem, Heemstede-Aerdenhout, Leiden Centraal, Den Haag Laan v NOI, Delft, Den Haag Centraal, Gouda, Den Haag Centraal, Gouda, Den Haag Laan v NOI, Delft, Schiedam Centrum]"
train_18,"[Heerlen, Sittard, Heerlen, Sittard, Roermond, Weert, Roermond, Sittard, Roermond, Sittard, Roermond, Sittard, Heerlen]"
train_19,"[Groningen, Leeuwarden, Heerenveen, Leeuwarden, Heerenveen, Leeuwarden, Groningen, Assen]"
train_20,"[Amersfoort, Utrecht Centraal, Amsterdam Amstel, Amsterdam Centraal, Almere Centrum, Hilversum, Utrecht Centraal, Ede-Wageningen, Utrecht Centraal, Amersfoort, Utrecht Centraal]"
score,1755.651685393258
