train,stations
train_1,"[Eindhoven, Helmond, Eindhoven, Helmond, Venlo, Helmond, Eindhoven, Weert, Eindhoven, Helmond, Eindhoven, Tilburg]"
train_2,"[Leeuwarden, Heerenveen, Leeuwarden, Groningen, Assen, Groningen, Leeuwarden, Groningen]"
train_3,"[Den Haag HS, Leiden Centraal, Den Haag Centraal, Gouda, Den Haag Centraal, Gouda, Alphen a/d Rijn, Utrecht Centraal, Amsterdam Centraal, Amsterdam Sloterdijk, Haarlem]"
train_4,"[Roosendaal, Dordrecht, Rotterdam Blaak, Rotterdam Alexander, Gouda, Den Haag Centraal, Gouda, Utrecht Centraal, Amsterdam Centraal, Utrecht Centraal]"
train_5,"[Amsterdam Zuid, Schiphol Airport, Amsterdam Zuid, Schiphol Airport, Utrecht Centraal, Ede-Wageningen, Utrecht Centraal, Amersfoort, Zwolle]"
train_6,"[Roosendaal, Vlissingen, Roosendaal]"
train_7,"[Alkmaar, Den Helder, Alkmaar, Hoorn, Alkmaar, Castricum, Beverwijk, Castricum, Zaandam, Amsterdam Sloterdijk]"
train_8,"[Heemstede-Aerdenhout, Haarlem, Heemstede-Aerdenhout, Leiden Centraal, Alphen a/d Rijn, Leiden Centraal, Heemstede-Aerdenhout, Leiden Centraal, Schiphol Airport, Amsterdam Zuid, Amsterdam Amstel, Amsterdam Centraal, Almere Centrum, Amsterdam Amstel, Amsterdam Zuid]"
train_9,"[Dordrecht, Rotterdam Blaak, Schiedam Centrum, Delft, Schiedam Centrum, Delft, Den Haag HS, Delft, Den Haag Laan v NOI, Leiden Centraal, Schiphol Airport, Leiden Centraal, Den Haag Centraal, Delft, Den Haag Laan v NOI, Leiden Centraal, Schiphol Airport]"
train_10,"[Den Haag Centraal, Leiden Centraal, Den Haag Centraal, Delft, Schiedam Centrum, Rotterdam Centraal, Rotterdam Alexander, Rotterdam Centraal, Schiedam Centrum, Rotterdam Blaak, Dordrecht, Rotterdam Blaak, Schiedam Centrum, Rotterdam Centraal, Schiedam Centrum, Rotterdam Blaak, Schiedam Centrum, Rotterdam Centraal, Dordrecht]"
train_11,"[Leiden Centraal, Alphen a/d Rijn, Utrecht Centraal, Amersfoort, Apeldoorn, Zutphen, Dieren, Zutphen, Deventer, Zwolle, Deventer]"
train_12,"[Venlo, Helmond, Eindhoven, s-Hertogenbosch, Utrecht Centraal, Amsterdam Centraal, Almere Centrum, Lelystad Centrum, Almere Centrum]"
train_13,"[Vlissingen, Roosendaal, Etten-Leur, Breda, Dordrecht, Rotterdam Blaak, Schiedam Centrum, Rotterdam Centraal, Rotterdam Alexander, Rotterdam Blaak, Rotterdam Alexander, Rotterdam Centraal, Rotterdam Alexander]"
train_14,"[Etten-Leur, Breda, Dordrecht, Breda, Dordrecht, Breda, Etten-Leur, Roosendaal, Etten-Leur, Roosendaal]"
train_15,"[Leeuwarden, Groningen, Assen, Zwolle, Amersfoort, Zwolle]"
train_16,"[Den Haag Centraal, Gouda, Den Haag HS, Delft, Den Haag Centraal, Gouda, Den Haag Laan v NOI, Leiden Centraal, Heemstede-Aerdenhout, Haarlem, Heemstede-Aerdenhout, Leiden Centraal, Schiphol Airport]"
train_17,"[Amsterdam Sloterdijk, Amsterdam Zuid, Amsterdam Amstel, Almere Centrum, Hilversum, Almere Centrum, Hilversum, Utrecht Centraal, Ede-Wageningen]"
train_18,"[Breda, Etten-Leur, Breda, Dordrecht, Roosendaal, Dordrecht, Rotterdam Blaak, Schiedam Centrum, Delft, Den Haag HS, Leiden Centraal, Heemstede-Aerdenhout, Leiden Centraal, Den Haag Centraal]"
train_19,"[Roermond, Weert, Roermond, Weert, Roermond, Sittard, Maastricht, Sittard, Heerlen, Sittard, Maastricht, Sittard, Heerlen]"
train_20,"[Heemstede-Aerdenhout, Haarlem, Beverwijk, Zaandam, Amsterdam Sloterdijk, Amsterdam Zuid, Amsterdam Amstel, Amsterdam Centraal, Almere Centrum, Hilversum, Amsterdam Amstel]"
score,3112.9662921348317
