train,stations
train_1,"[Etten-Leur, Roosendaal, Etten-Leur, Roosendaal, Dordrecht, Rotterdam Centraal, Rotterdam Alexander, Gouda, Alphen a/d Rijn, Leiden Centraal, Den Haag HS, Delft, Den Haag Laan v NOI]"
train_2,"[Lelystad Centrum, Almere Centrum, Hilversum, Amsterdam Amstel, Amsterdam Centraal, Amsterdam Amstel, Utrecht Centraal, Schiphol Airport, Utrecht Centraal]"
train_3,"[Den Haag HS, Gouda, Den Haag HS, Delft, Den Haag HS, Delft, Den Haag HS, Delft, Den Haag Laan v NOI, Gouda, Den Haag Centraal, Leiden Centraal, Den Haag Laan v NOI]"
train_4,"[Roermond, Sittard, Roermond, Weert, Roermond, Weert, Eindhoven, Helmond, Venlo, Helmond, Eindhoven]"
train_5,"[Amersfoort, Apeldoorn, Zutphen, Apeldoorn, Deventer, Apeldoorn, Amersfoort, Utrecht Centraal, Ede-Wageningen, Arnhem Centraal, Ede-Wageningen]"
train_6,"[Castricum, Alkmaar, Hoorn, Zaandam, Amsterdam Sloterdijk, Amsterdam Centraal, Amsterdam Sloterdijk, Haarlem, Heemstede-Aerdenhout, Leiden Centraal, Den Haag Centraal, Gouda, Den Haag Laan v NOI, Delft]"
train_7,"[Amsterdam Sloterdijk, Amsterdam Centraal, Utrecht Centraal, Alphen a/d Rijn, Leiden Centraal, Den Haag HS, Delft, Den Haag Centraal, Gouda, Alphen a/d Rijn, Leiden Centraal, Alphen a/d Rijn]"
train_8,"[Roermond, Sittard, Roermond, Sittard, Maastricht, Sittard, Roermond, Sittard, Heerlen, Sittard, Roermond, Weert, Roermond]"
train_9,"[Helmond, Venlo, Helmond, Eindhoven, Helmond, Venlo, Helmond, Venlo]"
train_10,"[Roosendaal, Dordrecht, Rotterdam Blaak, Schiedam Centrum, Rotterdam Blaak, Schiedam Centrum, Rotterdam Blaak, Rotterdam Alexander, Rotterdam Blaak, Dordrecht, Roosendaal, Dordrecht, Rotterdam Centraal, Schiedam Centrum]"
train_11,"[Den Haag Laan v NOI, Leiden Centraal, Den Haag HS, Leiden Centraal, Alphen a/d Rijn, Gouda, Den Haag HS, Leiden Centraal, Den Haag Centraal, Gouda, Den Haag HS, Gouda]"
train_12,"[Apeldoorn, Zutphen, Apeldoorn, Zutphen, Deventer, Zwolle, Amersfoort, Utrecht Centraal, s-Hertogenbosch]"
train_13,"[Vlissingen, Roosendaal, Vlissingen]"
train_14,"[Leiden Centraal, Den Haag HS, Gouda, Utrecht Centraal, Alphen a/d Rijn, Utrecht Centraal, Hilversum, Almere Centrum, Hilversum]"
train_15,"[Leiden Centraal, Alphen a/d Rijn, Gouda, Utrecht Centraal, Ede-Wageningen, Utrecht Centraal, Amsterdam Amstel, Amsterdam Centraal, Amsterdam Sloterdijk, Zaandam, Beverwijk]"
train_16,"[Roosendaal, Vlissingen, Roosendaal]"
train_17,"[Sittard, Roermond, Sittard, Heerlen, Sittard, Heerlen, Sittard, Roermond, Weert, Roermond, Weert, Roermond, Sittard]"
train_18,"[Beverwijk, Haarlem, Heemstede-Aerdenhout, Haarlem, Amsterdam Sloterdijk, Amsterdam Zuid, Amsterdam Sloterdijk, Amsterdam Zuid, Amsterdam Amstel, Utrecht Centraal, s-Hertogenbosch, Utrecht Centraal]"
train_19,"[Alkmaar, Hoorn, Zaandam, Amsterdam Sloterdijk, Haarlem, Heemstede-Aerdenhout, Haarlem, Beverwijk, Zaandam, Amsterdam Sloterdijk, Amsterdam Zuid, Amsterdam Sloterdijk, Amsterdam Centraal, Amsterdam Amstel]"
train_20,"[Hoorn, Alkmaar, Hoorn, Zaandam, Beverwijk, Zaandam, Hoorn, Zaandam]"
score,1423.5730337078649
