train,stations
train_1,"[Heerenveen, Leeuwarden, Heerenveen, Leeuwarden, Heerenveen, Steenwijk, Heerenveen, Steenwijk, Zwolle, Deventer, Zwolle]"
train_2,"[Heemstede-Aerdenhout, Leiden Centraal, Heemstede-Aerdenhout, Leiden Centraal, Den Haag Centraal, Gouda, Den Haag HS, Delft, Den Haag HS, Leiden Centraal, Den Haag Laan v NOI, Gouda, Den Haag HS]"
train_3,"[Amsterdam Zuid, Amsterdam Sloterdijk, Amsterdam Zuid, Schiphol Airport, Leiden Centraal, Den Haag HS, Delft, Den Haag Centraal, Gouda, Den Haag HS, Leiden Centraal, Den Haag Centraal, Delft, Schiedam Centrum, Rotterdam Centraal]"
train_4,"[Beverwijk, Haarlem, Heemstede-Aerdenhout, Haarlem, Heemstede-Aerdenhout, Haarlem, Beverwijk, Haarlem, Amsterdam Sloterdijk, Amsterdam Zuid, Amsterdam Amstel, Hilversum, Utrecht Centraal]"
train_5,"[Rotterdam Blaak, Rotterdam Alexander, Rotterdam Centraal, Schiedam Centrum, Delft, Den Haag Laan v NOI, Leiden Centraal, Den Haag Centraal, Leiden Centraal, Schiphol Airport, Leiden Centraal, Den Haag Centraal, Gouda, Den Haag Centraal, Gouda]"
train_6,"[Oss, Nijmegen, Oss, Nijmegen, Oss, s-Hertogenbosch, Tilburg, Eindhoven, Helmond, Eindhoven, Weert, Eindhoven]"
train_7,"[Rotterdam Blaak, Dordrecht, Rotterdam Blaak, Rotterdam Alexander, Rotterdam Centraal, Rotterdam Alexander, Gouda, Utrecht Centraal, Gouda, Rotterdam Alexander, Rotterdam Blaak, Dordrecht, Rotterdam Blaak, Rotterdam Alexander, Rotterdam Blaak, Schiedam Centrum]"
train_8,"[Delft, Den Haag Laan v NOI, Leiden Centraal, Den Haag HS, Leiden Centraal, Den Haag Laan v NOI, Leiden Centraal, Den Haag Centraal, Delft, Den Haag Centraal, Delft, Den Haag HS, Gouda, Rotterdam Alexander, Rotterdam Centraal, Dordrecht]"
train_9,"[Schiphol Airport, Leiden Centraal, Alphen a/d Rijn, Utrecht Centraal, Amsterdam Centraal, Utrecht Centraal, Ede-Wageningen, Arnhem Centraal, Ede-Wageningen, Utrecht Centraal]"
train_10,"[Schiphol Airport, Leiden Centraal, Den Haag Centraal, Leiden Centraal, Den Haag HS, Gouda, Den Haag Centraal, Leiden Centraal, Heemstede-Aerdenhout, Haarlem, Beverwijk, Haarlem, Heemstede-Aerdenhout, Leiden Centraal]"
train_11,"[Heerlen, Sittard, Maastricht, Sittard, Roermond, Sittard, Roermond, Weert, Roermond, Weert, Eindhoven, Helmond, Eindhoven, Helmond]"
train_12,"[Dieren, Arnhem Centraal, Ede-Wageningen, Arnhem Centraal, Nijmegen, Arnhem Centraal, Nijmegen, Arnhem Centraal, Ede-Wageningen, Arnhem Centraal, Nijmegen, Arnhem Centraal, Ede-Wageningen, Arnhem Centraal, Nijmegen, Oss]"
train_13,"[Rotterdam Centraal, Rotterdam Alexander, Rotterdam Blaak, Schiedam Centrum, Rotterdam Blaak, Schiedam Centrum, Rotterdam Centraal, Rotterdam Alexander, Gouda, Alphen a/d Rijn, Leiden Centraal, Alphen a/d Rijn, Utrecht Centraal, Ede-Wageningen]"
train_14,"[Rotterdam Blaak, Rotterdam Alexander, Rotterdam Blaak, Schiedam Centrum, Rotterdam Centraal, Dordrecht, Rotterdam Centraal, Schiedam Centrum, Rotterdam Centraal, Schiedam Centrum, Delft, Den Haag HS, Delft, Den Haag Laan v NOI, Gouda, Den Haag Laan v NOI]"
train_15,"[Den Haag Centraal, Gouda, Den Haag Laan v NOI, Delft, Den Haag Laan v NOI, Delft, Den Haag HS, Gouda, Utrecht Centraal, Ede-Wageningen, Utrecht Centraal]"
train_16,"[Apeldoorn, Zutphen, Apeldoorn, Amersfoort, Zwolle, Amersfoort, Utrecht Centraal, s-Hertogenbosch]"
train_17,"[Deventer, Apeldoorn, Zutphen, Apeldoorn, Amersfoort, Utrecht Centraal, Alphen a/d Rijn, Utrecht Centraal, Ede-Wageningen, Arnhem Centraal]"
train_18,"[Rotterdam Alexander, Gouda, Den Haag HS, Gouda, Den Haag Centraal, Gouda, Utrecht Centraal, Amsterdam Centraal, Amsterdam Sloterdijk, Amsterdam Centraal, Amsterdam Sloterdijk, Amsterdam Centraal, Amsterdam Amstel]"
train_19,"[Amsterdam Centraal, Almere Centrum, Lelystad Centrum, Almere Centrum, Amsterdam Amstel, Almere Centrum, Hilversum, Utrecht Centraal, Alphen a/d Rijn]"
train_20,"[Sittard, Maastricht, Sittard, Maastricht, Sittard, Heerlen, Sittard, Roermond, Weert, Roermond, Sittard, Roermond, Sittard]"
score,1478.2921348314612
