train,stations
train_1,"[Hoorn, Zaandam, Beverwijk, Zaandam, Castricum, Alkmaar, Hoorn, Alkmaar, Castricum, Alkmaar, Castricum]"
train_2,"[Amersfoort, Utrecht Centraal, s-Hertogenbosch, Eindhoven, Tilburg, s-Hertogenbosch, Oss, Nijmegen, Oss, Nijmegen, Oss]"
train_3,"[Beverwijk, Castricum, Zaandam, Beverwijk, Haarlem, Beverwijk, Castricum, Zaandam, Hoorn, Zaandam]"
train_4,"[Beverwijk, Castricum, Zaandam, Castricum, Beverwijk, Castricum, Alkmaar, Castricum, Zaandam, Beverwijk, Haarlem, Beverwijk, Haarlem, Amsterdam Sloterdijk]"
train_5,"[Leeuwarden, Heerenveen, Leeuwarden, Heerenveen, Steenwijk, Heerenveen, Steenwijk, Heerenveen, Steenwijk, Zwolle, Amersfoort]"
train_6,"[Gouda, Den Haag Laan v NOI, Delft, Schiedam Centrum, Delft, Den Haag HS, Delft, Schiedam Centrum, Rotterdam Centraal, Schiedam Centrum, Rotterdam Centraal, Dordrecht, Roosendaal]"
train_7,"[Steenwijk, Heerenveen, Steenwijk, Zwolle, Assen, Zwolle, Steenwijk]"
train_8,"[Den Haag Centraal, Leiden Centraal, Alphen a/d Rijn, Leiden Centraal, Den Haag HS, Leiden Centraal, Den Haag HS, Gouda, Den Haag Laan v NOI, Delft, Den Haag HS, Gouda]"
train_9,"[Den Haag HS, Gouda, Den Haag HS, Delft, Schiedam Centrum, Rotterdam Centraal, Dordrecht, Rotterdam Centraal, Dordrecht, Rotterdam Centraal, Rotterdam Alexander, Rotterdam Centraal, Dordrecht]"
train_10,"[Delft, Den Haag Centraal, Delft, Den Haag Centraal, Delft, Den Haag Centraal, Delft, Den Haag HS, Delft, Den Haag Centraal, Delft, Schiedam Centrum, Rotterdam Blaak, Rotterdam Alexander, Rotterdam Blaak, Schiedam Centrum, Rotterdam Centraal, Schiedam Centrum]"
train_11,"[Venlo, Helmond, Venlo, Helmond, Venlo, Helmond]"
train_12,"[Amersfoort, Zwolle, Almelo, Deventer, Zwolle, Assen]"
train_13,"[Alkmaar, Den Helder, Alkmaar, Den Helder, Alkmaar, Castricum, Alkmaar, Castricum]"
train_14,"[Almere Centrum, Hilversum, Almere Centrum, Lelystad Centrum, Almere Centrum, Lelystad Centrum, Almere Centrum, Hilversum, Utrecht Centraal, Hilversum, Utrecht Centraal]"
train_15,"[Zwolle, Assen, Groningen, Assen, Zwolle, Almelo, Hengelo, Almelo]"
train_16,"[Amsterdam Amstel, Hilversum, Amsterdam Amstel, Utrecht Centraal, Alphen a/d Rijn, Utrecht Centraal, Amsterdam Amstel, Hilversum]"
train_17,"[Eindhoven, s-Hertogenbosch, Utrecht Centraal, Amersfoort, Zwolle, Assen, Groningen, Assen]"
train_18,"[Heemstede-Aerdenhout, Leiden Centraal, Den Haag Laan v NOI, Delft, Schiedam Centrum, Rotterdam Blaak, Dordrecht, Roosendaal, Vlissingen]"
train_19,"[Amsterdam Sloterdijk, Haarlem, Amsterdam Sloterdijk, Zaandam, Hoorn, Zaandam, Amsterdam Sloterdijk, Haarlem, Amsterdam Sloterdijk, Zaandam, Hoorn, Zaandam, Castricum]"
train_20,"[Venlo, Helmond, Venlo, Helmond, Venlo, Helmond, Eindhoven, Weert]"
score,768.7752808988762
