train,stations
train_1,"[Zwolle, Steenwijk, Zwolle, Steenwijk, Zwolle, Amersfoort, Zwolle]"
train_2,"[Breda, Dordrecht, Rotterdam Blaak, Schiedam Centrum, Rotterdam Blaak, Schiedam Centrum, Delft, Den Haag HS, Gouda, Den Haag Laan v NOI, Gouda, Den Haag Centraal]"
train_3,"[Dordrecht, Roosendaal, Dordrecht, Roosendaal, Etten-Leur, Roosendaal, Dordrecht, Breda, Dordrecht, Breda, Tilburg]"
train_4,"[Nijmegen, Arnhem Centraal, Ede-Wageningen, Arnhem Centraal, Ede-Wageningen, Utrecht Centraal, Hilversum, Amsterdam Amstel, Hilversum, Amsterdam Amstel, Amsterdam Zuid]"
train_5,"[Etten-Leur, Roosendaal, Dordrecht, Roosendaal, Dordrecht, Roosendaal, Etten-Leur, Roosendaal, Etten-Leur, Breda, Dordrecht, Rotterdam Blaak]"
train_6,"[Amsterdam Amstel, Hilversum, Almere Centrum, Amsterdam Amstel, Almere Centrum, Amsterdam Amstel, Almere Centrum]"
train_7,"[Dieren, Zutphen, Apeldoorn, Amersfoort, Utrecht Centraal, Amsterdam Amstel, Amsterdam Centraal, Utrecht Centraal, Schiphol Airport, Leiden Centraal]"
train_8,"[Lelystad Centrum, Almere Centrum, Amsterdam Amstel, Utrecht Centraal, s-Hertogenbosch, Eindhoven, s-Hertogenbosch, Oss, Nijmegen, Oss]"
train_9,"[Almere Centrum, Amsterdam Centraal, Amsterdam Sloterdijk, Zaandam, Castricum, Beverwijk, Castricum, Beverwijk, Haarlem, Amsterdam Sloterdijk, Haarlem, Amsterdam Sloterdijk, Amsterdam Centraal, Amsterdam Amstel, Utrecht Centraal]"
train_10,"[Hoorn, Alkmaar, Hoorn, Alkmaar, Hoorn, Zaandam, Amsterdam Sloterdijk, Amsterdam Centraal, Almere Centrum, Lelystad Centrum]"
train_11,"[Nijmegen, Arnhem Centraal, Ede-Wageningen, Utrecht Centraal, Hilversum, Almere Centrum, Hilversum, Amsterdam Amstel, Amsterdam Zuid, Amsterdam Sloterdijk, Haarlem]"
train_12,"[Amsterdam Centraal, Amsterdam Sloterdijk, Zaandam, Beverwijk, Haarlem, Amsterdam Sloterdijk, Haarlem, Heemstede-Aerdenhout, Haarlem, Amsterdam Sloterdijk, Haarlem, Heemstede-Aerdenhout, Haarlem, Heemstede-Aerdenhout, Haarlem, Heemstede-Aerdenhout, Leiden Centraal, Heemstede-Aerdenhout, Leiden Centraal]"
train_13,"[Rotterdam Alexander, Rotterdam Blaak, Schiedam Centrum, Rotterdam Blaak, Dordrecht, Rotterdam Blaak, Rotterdam Alexander, Rotterdam Centraal, Rotterdam Alexander, Rotterdam Blaak, Schiedam Centrum, Rotterdam Blaak, Dordrecht, Rotterdam Blaak, Dordrecht, Roosendaal]"
train_14,"[Zutphen, Deventer, Zwolle, Steenwijk, Zwolle, Amersfoort, Apeldoorn, Amersfoort]"
train_15,"[Beverwijk, Haarlem, Heemstede-Aerdenhout, Haarlem, Beverwijk, Castricum, Beverwijk, Castricum, Zaandam, Beverwijk, Castricum, Zaandam, Castricum, Zaandam]"
train_16,"[Lelystad Centrum, Almere Centrum, Hilversum, Amsterdam Amstel, Amsterdam Zuid, Amsterdam Amstel, Utrecht Centraal, Schiphol Airport, Utrecht Centraal]"
train_17,"[Amsterdam Zuid, Amsterdam Sloterdijk, Amsterdam Centraal, Almere Centrum, Lelystad Centrum, Almere Centrum, Amsterdam Amstel, Utrecht Centraal, Ede-Wageningen, Arnhem Centraal, Dieren, Zutphen, Dieren]"
train_18,"[Venlo, Helmond, Eindhoven, Helmond, Eindhoven, Helmond, Venlo, Helmond, Eindhoven, Helmond, Venlo]"
train_19,"[Oss, Nijmegen, Arnhem Centraal, Ede-Wageningen, Arnhem Centraal, Nijmegen, Arnhem Centraal, Dieren, Zutphen, Apeldoorn, Amersfoort, Zwolle]"
train_20,"[Breda, Etten-Leur, Roosendaal, Etten-Leur, Roosendaal, Vlissingen, Roosendaal, Etten-Leur]"
score,967.4943820224717
