train,stations
train_1,"[Steenwijk, Heerenveen, Steenwijk, Heerenveen, Leeuwarden, Groningen, Assen, Zwolle, Steenwijk]"
train_2,"[Helmond, Venlo, Helmond, Eindhoven, Weert, Eindhoven, Helmond, Venlo, Helmond]"
train_3,"[Groningen, Assen, Zwolle, Almelo, Hengelo, Almelo, Zwolle]"
train_4,"[Amsterdam Centraal, Amsterdam Amstel, Hilversum, Amsterdam Amstel, Amsterdam Centraal, Amsterdam Amstel, Hilversum, Utrecht Centraal, Ede-Wageningen, Utrecht Centraal]"
train_5,"[Assen, Zwolle, Steenwijk, Zwolle, Assen, Zwolle]"
train_6,"[Amsterdam Centraal, Almere Centrum, Amsterdam Amstel, Hilversum, Amsterdam Amstel, Hilversum, Amsterdam Amstel]"
train_7,"[Alphen a/d Rijn, Leiden Centraal, Den Haag Laan v NOI, Leiden Centraal, Heemstede-Aerdenhout, Haarlem, Beverwijk, Zaandam, Castricum, Zaandam, Beverwijk, Castricum, Beverwijk]"
train_8,"[Dieren, Arnhem Centraal, Nijmegen, Oss, Nijmegen, Oss, s-Hertogenbosch, Oss, s-Hertogenbosch, Oss, Nijmegen, Arnhem Centraal, Nijmegen, Oss]"
train_9,"[Apeldoorn, Deventer, Zutphen, Apeldoorn, Zutphen, Apeldoorn, Amersfoort, Apeldoorn, Amersfoort, Apeldoorn]"
train_10,"[Apeldoorn, Amersfoort, Utrecht Centraal, Hilversum, Almere Centrum, Amsterdam Amstel, Amsterdam Centraal, Utrecht Centraal, Hilversum]"
train_11,"[Groningen, Assen, Zwolle, Amersfoort, Utrecht Centraal, Schiphol Airport, Utrecht Centraal]"
train_12,"[Enschede, Hengelo, Enschede, Hengelo, Enschede, Hengelo, Enschede, Hengelo, Almelo, Hengelo, Enschede, Hengelo, Almelo, Deventer, Zwolle, Steenwijk]"
train_13,"[Deventer, Zwolle, Assen, Groningen, Assen, Zwolle]"
train_14,"[Rotterdam Blaak, Dordrecht, Breda, Etten-Leur, Breda, Dordrecht, Breda, Tilburg, s-Hertogenbosch, Utrecht Centraal, Schiphol Airport, Amsterdam Zuid]"
train_15,"[Amersfoort, Zwolle, Deventer, Apeldoorn, Amersfoort, Apeldoorn, Amersfoort, Zwolle]"
train_16,"[Utrecht Centraal, Hilversum, Utrecht Centraal, s-Hertogenbosch, Oss, Nijmegen, Oss, s-Hertogenbosch, Eindhoven, Tilburg, Breda, Etten-Leur]"
train_17,"[Hoorn, Zaandam, Beverwijk, Haarlem, Beverwijk, Zaandam, Castricum, Beverwijk, Zaandam, Castricum]"
train_18,"[Groningen, Leeuwarden, Heerenveen, Steenwijk, Zwolle, Almelo, Zwolle]"
train_19,"[Ede-Wageningen, Arnhem Centraal, Dieren, Zutphen, Deventer, Apeldoorn, Amersfoort, Zwolle, Steenwijk, Heerenveen, Leeuwarden]"
train_20,"[Deventer, Zutphen, Dieren, Arnhem Centraal, Ede-Wageningen, Arnhem Centraal, Dieren, Arnhem Centraal, Dieren, Zutphen, Apeldoorn, Zutphen, Deventer, Apeldoorn, Zutphen]"
score,552.0561797752807
