train,stations
train_1,"[Etten-Leur, Breda, Etten-Leur, Breda, Etten-Leur, Breda, Dordrecht, Rotterdam Blaak, Schiedam Centrum, Rotterdam Centraal, Schiedam Centrum, Rotterdam Blaak, Schiedam Centrum, Delft, Den Haag Centraal, Delft, Den Haag HS, Delft, Den Haag Centraal]"
train_2,"[Steenwijk, Heerenveen, Leeuwarden, Heerenveen, Steenwijk, Heerenveen, Steenwijk, Heerenveen, Steenwijk, Heerenveen, Steenwijk, Zwolle]"
train_3,"[Arnhem Centraal, Dieren, Arnhem Centraal, Dieren, Arnhem Centraal, Dieren, Arnhem Centraal, Ede-Wageningen, Utrecht Centraal, Amersfoort, Apeldoorn, Deventer, Zwolle]"
train_4,"[Leeuwarden, Heerenveen, Leeuwarden, Heerenveen, Steenwijk, Heerenveen, Steenwijk, Zwolle, Steenwijk, Zwolle]"
train_5,"[Almelo, Deventer, Apeldoorn, Deventer, Almelo, Zwolle, Deventer, Zwolle]"
train_6,"[Castricum, Beverwijk, Castricum, Beverwijk, Zaandam, Amsterdam Sloterdijk, Amsterdam Centraal, Almere Centrum, Amsterdam Amstel, Amsterdam Centraal, Utrecht Centraal, Hilversum]"
train_7,"[s-Hertogenbosch, Eindhoven, Weert, Roermond, Weert, Eindhoven, s-Hertogenbosch, Utrecht Centraal, Amsterdam Centraal, Amsterdam Sloterdijk, Amsterdam Centraal, Amsterdam Amstel]"
train_8,"[Eindhoven, Helmond, Eindhoven, Tilburg, Eindhoven, Helmond, Venlo, Helmond, Venlo]"
train_9,"[Dieren, Zutphen, Apeldoorn, Amersfoort, Zwolle, Steenwijk, Zwolle, Almelo]"
train_10,"[Amersfoort, Apeldoorn, Deventer, Zwolle, Almelo, Hengelo, Enschede, Hengelo, Enschede, Hengelo, Almelo, Deventer]"
train_11,"[Breda, Tilburg, Eindhoven, Weert, Eindhoven, Weert, Eindhoven, Tilburg, Eindhoven, Helmond]"
train_12,"[Arnhem Centraal, Ede-Wageningen, Arnhem Centraal, Nijmegen, Arnhem Centraal, Dieren, Zutphen, Deventer, Almelo, Deventer, Zwolle, Deventer]"
train_13,"[Dieren, Arnhem Centraal, Dieren, Arnhem Centraal, Dieren, Zutphen, Deventer, Apeldoorn, Zutphen, Deventer, Almelo, Zwolle]"
train_14,"[Tilburg, Breda, Dordrecht, Rotterdam Blaak, Rotterdam Alexander, Rotterdam Centraal, Schiedam Centrum, Delft, Schiedam Centrum, Rotterdam Blaak, Dordrecht, Breda, Dordrecht, Breda, Tilburg]"
train_15,"[Castricum, Zaandam, Beverwijk, Haarlem, Beverwijk, Haarlem, Amsterdam Sloterdijk, Amsterdam Centraal, Amsterdam Sloterdijk, Amsterdam Centraal, Amsterdam Amstel, Hilversum, Amsterdam Amstel]"
train_16,"[Vlissingen, Roosendaal, Vlissingen]"
train_17,"[Rotterdam Blaak, Rotterdam Alexander, Rotterdam Centraal, Dordrecht, Rotterdam Centraal, Schiedam Centrum, Rotterdam Centraal, Schiedam Centrum, Rotterdam Centraal, Dordrecht, Rotterdam Centraal, Rotterdam Alexander, Rotterdam Centraal, Rotterdam Alexander, Rotterdam Centraal, Dordrecht, Roosendaal]"
train_18,"[Dordrecht, Breda, Etten-Leur, Roosendaal, Etten-Leur, Roosendaal, Vlissingen]"
train_19,"[Amersfoort, Utrecht Centraal, s-Hertogenbosch, Eindhoven, Weert, Eindhoven, Tilburg, Eindhoven, Weert, Eindhoven]"
train_20,"[Enschede, Hengelo, Enschede, Hengelo, Enschede, Hengelo, Almelo, Hengelo, Almelo, Zwolle, Steenwijk, Zwolle]"
score,777.4157303370794
