train,stations
train_1,"[Almelo, Deventer, Apeldoorn, Amersfoort, Utrecht Centraal, s-Hertogenbosch, Eindhoven, Tilburg, Eindhoven]"
train_2,"[Dieren, Zutphen, Apeldoorn, Deventer, Zwolle, Almelo, Hengelo, Almelo, Deventer, Zutphen, Dieren]"
train_3,"[Castricum, Beverwijk, Zaandam, Amsterdam Sloterdijk, Zaandam, Hoorn, Zaandam, Amsterdam Sloterdijk, Amsterdam Zuid, Amsterdam Sloterdijk, Haarlem, Beverwijk]"
train_4,"[Den Helder, Alkmaar, Hoorn, Zaandam, Hoorn, Zaandam, Amsterdam Sloterdijk, Haarlem, Heemstede-Aerdenhout, Leiden Centraal]"
train_5,"[s-Hertogenbosch, Tilburg, Eindhoven, Weert, Roermond, Weert, Eindhoven, Tilburg, Eindhoven, Helmond, Venlo]"
train_6,"[Ede-Wageningen, Utrecht Centraal, Amersfoort, Apeldoorn, Deventer, Almelo, Zwolle]"
train_7,"[Dieren, Zutphen, Dieren, Arnhem Centraal, Nijmegen, Arnhem Centraal, Dieren, Zutphen, Apeldoorn, Deventer, Apeldoorn, Amersfoort, Zwolle]"
train_8,"[Delft, Den Haag Centraal, Delft, Den Haag Laan v NOI, Leiden Centraal, Den Haag Centraal, Gouda, Den Haag Laan v NOI, Delft, Schiedam Centrum, Rotterdam Centraal, Rotterdam Alexander, Rotterdam Centraal, Schiedam Centrum, Rotterdam Centraal, Schiedam Centrum, Delft]"
train_9,"[Roosendaal, Etten-Leur, Breda, Dordrecht, Breda, Tilburg, Breda, Tilburg, s-Hertogenbosch, Oss, s-Hertogenbosch, Eindhoven, s-Hertogenbosch]"
train_10,"[Amsterdam Sloterdijk, Amsterdam Centraal, Almere Centrum, Amsterdam Amstel, Utrecht Centraal, Alphen a/d Rijn, Leiden Centraal, Schiphol Airport, Amsterdam Zuid, Schiphol Airport, Utrecht Centraal]"
train_11,"[Haarlem, Beverwijk, Haarlem, Amsterdam Sloterdijk, Amsterdam Centraal, Amsterdam Sloterdijk, Zaandam, Beverwijk, Zaandam, Beverwijk, Castricum, Alkmaar]"
train_12,"[Heerlen, Sittard, Roermond, Sittard, Heerlen, Sittard, Heerlen, Sittard, Roermond, Weert, Eindhoven, Weert]"
train_13,"[Hilversum, Utrecht Centraal, Amersfoort, Zwolle, Almelo, Deventer, Apeldoorn, Deventer, Zwolle]"
train_14,"[Steenwijk, Zwolle, Almelo, Hengelo, Enschede, Hengelo, Enschede, Hengelo, Enschede, Hengelo, Almelo, Hengelo, Almelo, Deventer]"
train_15,"[Roosendaal, Vlissingen, Roosendaal, Dordrecht, Rotterdam Centraal, Rotterdam Alexander]"
train_16,"[Zaandam, Hoorn, Alkmaar, Castricum, Alkmaar, Den Helder, Alkmaar, Castricum, Zaandam, Castricum]"
train_17,"[Schiedam Centrum, Rotterdam Blaak, Dordrecht, Rotterdam Centraal, Rotterdam Alexander, Rotterdam Blaak, Rotterdam Alexander, Gouda, Alphen a/d Rijn, Gouda, Den Haag Laan v NOI, Delft, Den Haag HS, Delft]"
train_18,"[Lelystad Centrum, Almere Centrum, Hilversum, Amsterdam Amstel, Hilversum, Amsterdam Amstel, Amsterdam Zuid, Amsterdam Sloterdijk, Haarlem, Beverwijk]"
train_19,"[Beverwijk, Castricum, Zaandam, Castricum, Alkmaar, Hoorn, Alkmaar, Den Helder, Alkmaar, Castricum]"
train_20,"[Venlo, Helmond, Venlo, Helmond, Venlo, Helmond]"
score,3053.3258426966295
