train,stations
train_1,"[Alphen a/d Rijn, Leiden Centraal, Heemstede-Aerdenhout, Leiden Centraal, Alphen a/d Rijn, Utrecht Centraal, Gouda, Den Haag Centraal, Gouda, Alphen a/d Rijn, Leiden Centraal]"
train_2,"[Alkmaar, Castricum, Zaandam, Amsterdam Sloterdijk, Amsterdam Zuid, Schiphol Airport, Leiden Centraal, Den Haag HS, Gouda, Rotterdam Alexander, Rotterdam Centraal, Dordrecht, Rotterdam Blaak, Rotterdam Alexander, Gouda, Rotterdam Alexander]"
train_3,"[Zaandam, Amsterdam Sloterdijk, Amsterdam Centraal, Utrecht Centraal, Gouda, Alphen a/d Rijn, Leiden Centraal, Schiphol Airport, Leiden Centraal, Alphen a/d Rijn, Leiden Centraal, Den Haag Centraal, Leiden Centraal]"
train_4,"[Amsterdam Amstel, Utrecht Centraal, Gouda, Utrecht Centraal, s-Hertogenbosch, Tilburg, Breda, Etten-Leur, Breda, Dordrecht, Roosendaal, Etten-Leur]"
train_5,"[Venlo, Helmond, Venlo, Helmond, Eindhoven, Weert, Roermond, Sittard, Roermond, Sittard]"
train_6,"[Zaandam, Castricum, Alkmaar, Castricum, Beverwijk, Castricum, Alkmaar, Castricum, Zaandam, Castricum, Beverwijk, Castricum, Zaandam, Amsterdam Sloterdijk, Amsterdam Centraal, Almere Centrum]"
train_7,"[Amsterdam Centraal, Amsterdam Sloterdijk, Amsterdam Zuid, Amsterdam Sloterdijk, Haarlem, Heemstede-Aerdenhout, Haarlem, Heemstede-Aerdenhout, Leiden Centraal, Den Haag HS, Delft, Den Haag HS, Delft, Den Haag HS, Delft, Schiedam Centrum, Rotterdam Blaak, Rotterdam Alexander, Gouda]"
train_8,"[Weert, Eindhoven, Helmond, Eindhoven, Weert, Eindhoven, Helmond, Venlo, Helmond, Venlo]"
train_9,"[Enschede, Hengelo, Enschede, Hengelo, Almelo, Zwolle, Amersfoort, Apeldoorn, Deventer, Apeldoorn, Deventer]"
train_10,"[Roermond, Weert, Eindhoven, Weert, Roermond, Weert, Eindhoven, Tilburg, Eindhoven, Helmond, Venlo]"
train_11,"[Breda, Dordrecht, Breda, Dordrecht, Rotterdam Blaak, Rotterdam Alexander, Rotterdam Blaak, Dordrecht, Rotterdam Blaak, Rotterdam Alexander, Rotterdam Centraal, Schiedam Centrum, Delft, Den Haag Laan v NOI]"
train_12,"[Zutphen, Dieren, Zutphen, Deventer, Almelo, Zwolle, Deventer, Zwolle]"
train_13,"[Lelystad Centrum, Almere Centrum, Lelystad Centrum, Almere Centrum, Lelystad Centrum, Almere Centrum, Hilversum, Utrecht Centraal, Alphen a/d Rijn, Gouda, Den Haag Centraal]"
train_14,"[s-Hertogenbosch, Utrecht Centraal, Ede-Wageningen, Utrecht Centraal, Hilversum, Utrecht Centraal, Hilversum, Amsterdam Amstel, Utrecht Centraal]"
train_15,"[Leiden Centraal, Den Haag HS, Gouda, Den Haag HS, Delft, Den Haag Centraal, Leiden Centraal, Schiphol Airport, Amsterdam Zuid, Amsterdam Amstel, Almere Centrum, Amsterdam Centraal]"
train_16,"[Alphen a/d Rijn, Utrecht Centraal, s-Hertogenbosch, Utrecht Centraal, Schiphol Airport, Amsterdam Zuid, Amsterdam Sloterdijk, Amsterdam Zuid, Schiphol Airport]"
train_17,"[Apeldoorn, Deventer, Zutphen, Deventer, Zutphen, Dieren, Arnhem Centraal, Dieren, Arnhem Centraal, Dieren, Zutphen, Deventer, Almelo, Hengelo, Almelo]"
train_18,"[Vlissingen, Roosendaal, Etten-Leur, Breda, Dordrecht, Roosendaal, Dordrecht, Roosendaal]"
train_19,"[Amsterdam Sloterdijk, Amsterdam Zuid, Schiphol Airport, Leiden Centraal, Alphen a/d Rijn, Gouda, Den Haag Centraal, Leiden Centraal, Schiphol Airport, Leiden Centraal, Den Haag Centraal, Delft, Den Haag HS, Delft]"
train_20,"[Eindhoven, Weert, Eindhoven, s-Hertogenbosch, Eindhoven, Tilburg, Eindhoven, s-Hertogenbosch, Eindhoven, Weert]"
score,2190.089887640449
