train,stations
train_1,"[Enschede, Hengelo, Enschede, Hengelo, Enschede, Hengelo, Almelo, Hengelo, Almelo, Zwolle, Amersfoort, Apeldoorn]"
train_2,"[s-Hertogenbosch, Tilburg, Breda, Dordrecht, Roosendaal, Vlissingen]"
train_3,"[Ede-Wageningen, Arnhem Centraal, Nijmegen, Arnhem Centraal, Dieren, Zutphen, Apeldoorn, Zutphen, Deventer, Zutphen, Apeldoorn, Deventer, Zwolle]"
train_4,"[Leeuwarden, Groningen, Leeuwarden, Heerenveen, Steenwijk, Heerenveen, Steenwijk, Zwolle, Steenwijk]"
train_5,"[Roosendaal, Dordrecht, Breda, Tilburg, s-Hertogenbosch, Utrecht Centraal, s-Hertogenbosch, Eindhoven, Helmond, Eindhoven, s-Hertogenbosch]"
train_6,"[Almelo, Deventer, Almelo, Hengelo, Enschede, Hengelo, Almelo, Hengelo, Enschede, Hengelo, Enschede, Hengelo, Almelo, Zwolle]"
train_7,"[Amsterdam Amstel, Amsterdam Centraal, Amsterdam Amstel, Almere Centrum, Amsterdam Amstel, Amsterdam Centraal, Almere Centrum, Lelystad Centrum, Almere Centrum, Lelystad Centrum, Almere Centrum]"
train_8,"[Den Haag Centraal, Gouda, Den Haag Centraal, Gouda, Utrecht Centraal, Gouda, Alphen a/d Rijn, Utrecht Centraal, Alphen a/d Rijn, Leiden Centraal]"
train_9,"[Zutphen, Deventer, Almelo, Zwolle, Deventer, Almelo, Deventer, Zutphen]"
train_10,"[Heemstede-Aerdenhout, Leiden Centraal, Schiphol Airport, Leiden Centraal, Schiphol Airport, Utrecht Centraal, Ede-Wageningen, Utrecht Centraal, Amsterdam Amstel, Utrecht Centraal]"
train_11,"[Heerlen, Sittard, Roermond, Sittard, Heerlen, Sittard, Heerlen, Sittard, Maastricht, Sittard, Heerlen, Sittard]"
train_12,"[Hengelo, Enschede, Hengelo, Almelo, Deventer, Zwolle, Steenwijk, Heerenveen, Leeuwarden, Heerenveen, Steenwijk, Heerenveen]"
train_13,"[Rotterdam Alexander, Rotterdam Blaak, Dordrecht, Rotterdam Centraal, Dordrecht, Rotterdam Blaak, Dordrecht, Roosendaal, Dordrecht, Rotterdam Centraal, Dordrecht, Rotterdam Blaak]"
train_14,"[Apeldoorn, Zutphen, Deventer, Apeldoorn, Zutphen, Deventer, Zutphen, Dieren, Arnhem Centraal, Ede-Wageningen, Utrecht Centraal, Amsterdam Centraal]"
train_15,"[Sittard, Heerlen, Sittard, Maastricht, Sittard, Heerlen, Sittard, Maastricht, Sittard, Maastricht, Sittard, Maastricht]"
train_16,"[Enschede, Hengelo, Enschede, Hengelo, Enschede, Hengelo, Enschede, Hengelo, Almelo, Zwolle, Amersfoort, Apeldoorn, Deventer]"
train_17,"[Amsterdam Amstel, Amsterdam Centraal, Utrecht Centraal, Amsterdam Amstel, Utrecht Centraal, Alphen a/d Rijn, Gouda, Den Haag Centraal, Gouda]"
train_18,"[Helmond, Venlo, Helmond, Venlo, Helmond, Venlo]"
train_19,"[Den Helder, Alkmaar, Castricum, Zaandam, Castricum, Zaandam, Amsterdam Sloterdijk, Amsterdam Zuid, Schiphol Airport, Utrecht Centraal, Schiphol Airport]"
train_20,"[Den Haag HS, Leiden Centraal, Alphen a/d Rijn, Leiden Centraal, Den Haag Laan v NOI, Gouda, Alphen a/d Rijn, Utrecht Centraal, Amersfoort, Utrecht Centraal, Amersfoort]"
score,1116.8539325842703
