train,stations
train_1,"[Etten-Leur, Breda, Tilburg, s-Hertogenbosch, Utrecht Centraal, Amsterdam Centraal, Amsterdam Amstel, Utrecht Centraal, s-Hertogenbosch, Utrecht Centraal]"
train_2,"[Rotterdam Alexander, Rotterdam Centraal, Schiedam Centrum, Rotterdam Blaak, Rotterdam Alexander, Gouda, Den Haag HS, Gouda, Rotterdam Alexander, Gouda, Den Haag HS, Delft, Schiedam Centrum, Rotterdam Blaak, Rotterdam Alexander, Rotterdam Centraal]"
train_3,"[Dieren, Zutphen, Apeldoorn, Amersfoort, Apeldoorn, Zutphen, Deventer, Almelo, Zwolle]"
train_4,"[Weert, Roermond, Sittard, Roermond, Sittard, Roermond, Weert, Roermond, Weert, Roermond, Weert, Roermond, Weert]"
train_5,"[Rotterdam Blaak, Dordrecht, Roosendaal, Dordrecht, Breda, Tilburg, Eindhoven, s-Hertogenbosch, Oss, s-Hertogenbosch, Tilburg, Breda]"
train_6,"[Delft, Schiedam Centrum, Delft, Den Haag Laan v NOI, Gouda, Alphen a/d Rijn, Leiden Centraal, Den Haag Laan v NOI, Delft, Den Haag HS, Delft, Den Haag Laan v NOI, Gouda, Rotterdam Alexander]"
train_7,"[Heemstede-Aerdenhout, Leiden Centraal, Heemstede-Aerdenhout, Haarlem, Heemstede-Aerdenhout, Leiden Centraal, Heemstede-Aerdenhout, Haarlem, Amsterdam Sloterdijk, Amsterdam Zuid, Schiphol Airport, Leiden Centraal, Den Haag Laan v NOI, Delft, Den Haag HS, Leiden Centraal, Den Haag Laan v NOI]"
train_8,"[Ede-Wageningen, Utrecht Centraal, Ede-Wageningen, Arnhem Centraal, Dieren, Zutphen, Dieren, Arnhem Centraal, Ede-Wageningen, Arnhem Centraal, Nijmegen, Arnhem Centraal, Dieren, Zutphen, Dieren]"
train_9,"[Amersfoort, Utrecht Centraal, Schiphol Airport, Utrecht Centraal, Alphen a/d Rijn, Utrecht Centraal, Ede-Wageningen, Arnhem Centraal]"
train_10,"[Gouda, Alphen a/d Rijn, Gouda, Den Haag HS, Leiden Centraal, Heemstede-Aerdenhout, Leiden Centraal, Heemstede-Aerdenhout, Haarlem, Amsterdam Sloterdijk, Haarlem, Amsterdam Sloterdijk, Amsterdam Centraal, Almere Centrum]"
train_11,"[Apeldoorn, Deventer, Apeldoorn, Deventer, Zwolle, Almelo, Zwolle, Deventer]"
train_12,"[Beverwijk, Castricum, Beverwijk, Castricum, Alkmaar, Castricum, Beverwijk, Haarlem, Heemstede-Aerdenhout, Leiden Centraal, Heemstede-Aerdenhout, Haarlem, Amsterdam Sloterdijk, Haarlem, Heemstede-Aerdenhout, Haarlem, Beverwijk]"
train_13,"[Eindhoven, Tilburg, Eindhoven, s-Hertogenbosch, Eindhoven, Tilburg, Breda, Etten-Leur, Breda, Dordrecht, Rotterdam Blaak, Dordrecht]"
train_14,"[Almere Centrum, Hilversum, Amsterdam Amstel, Hilversum, Almere Centrum, Amsterdam Amstel, Utrecht Centraal, Amsterdam Amstel]"
train_15,"[Beverwijk, Castricum, Zaandam, Amsterdam Sloterdijk, Amsterdam Centraal, Almere Centrum, Amsterdam Centraal, Amsterdam Sloterdijk, Haarlem, Amsterdam Sloterdijk, Zaandam, Amsterdam Sloterdijk, Amsterdam Zuid, Amsterdam Sloterdijk, Amsterdam Centraal, Amsterdam Amstel, Amsterdam Centraal, Amsterdam Amstel]"
train_16,"[Amsterdam Zuid, Amsterdam Amstel, Almere Centrum, Hilversum, Utrecht Centraal, Schiphol Airport, Amsterdam Zuid, Amsterdam Amstel, Amsterdam Zuid, Amsterdam Amstel, Hilversum]"
train_17,"[Beverwijk, Castricum, Zaandam, Beverwijk, Castricum, Beverwijk, Haarlem, Amsterdam Sloterdijk, Zaandam, Beverwijk, Zaandam, Castricum]"
train_18,"[Beverwijk, Zaandam, Amsterdam Sloterdijk, Amsterdam Centraal, Utrecht Centraal, s-Hertogenbosch, Tilburg, Breda, Tilburg, Breda, Tilburg, Eindhoven]"
train_19,"[Assen, Zwolle, Deventer, Apeldoorn, Amersfoort, Utrecht Centraal, Alphen a/d Rijn, Gouda, Rotterdam Alexander, Gouda]"
train_20,"[Breda, Tilburg, s-Hertogenbosch, Eindhoven, Tilburg, s-Hertogenbosch, Eindhoven, s-Hertogenbosch, Utrecht Centraal, Schiphol Airport]"
score,1707.0112359550558
