train,stations
train_1,"[Gouda, Den Haag Laan v NOI, Leiden Centraal, Alphen a/d Rijn, Gouda, Alphen a/d Rijn, Gouda, Den Haag Laan v NOI, Leiden Centraal, Den Haag Laan v NOI, Delft, Den Haag Laan v NOI]"
train_2,"[Tilburg, Eindhoven, Helmond, Venlo, Helmond, Eindhoven, s-Hertogenbosch, Utrecht Centraal, s-Hertogenbosch]"
train_3,"[Rotterdam Blaak, Schiedam Centrum, Rotterdam Blaak, Rotterdam Alexander, Gouda, Rotterdam Alexander, Gouda, Utrecht Centraal, Hilversum, Almere Centrum, Amsterdam Amstel, Hilversum]"
train_4,"[Leeuwarden, Groningen, Leeuwarden, Groningen, Leeuwarden, Heerenveen, Steenwijk]"
train_5,"[Almere Centrum, Amsterdam Centraal, Amsterdam Sloterdijk, Amsterdam Zuid, Schiphol Airport, Utrecht Centraal, Amersfoort, Apeldoorn, Amersfoort, Zwolle]"
train_6,"[Breda, Dordrecht, Breda, Dordrecht, Rotterdam Blaak, Schiedam Centrum, Delft, Den Haag Centraal, Delft, Den Haag HS, Leiden Centraal, Den Haag HS, Delft, Den Haag HS, Leiden Centraal]"
train_7,"[Den Helder, Alkmaar, Hoorn, Zaandam, Beverwijk, Haarlem, Heemstede-Aerdenhout, Haarlem, Heemstede-Aerdenhout, Haarlem, Heemstede-Aerdenhout, Haarlem, Beverwijk]"
train_8,"[Hoorn, Alkmaar, Hoorn, Alkmaar, Den Helder, Alkmaar]"
train_9,"[Venlo, Helmond, Venlo, Helmond, Venlo, Helmond, Eindhoven, Helmond, Eindhoven]"
train_10,"[Alphen a/d Rijn, Utrecht Centraal, Gouda, Utrecht Centraal, Hilversum, Amsterdam Amstel, Amsterdam Centraal, Almere Centrum, Lelystad Centrum, Almere Centrum]"
train_11,"[Arnhem Centraal, Dieren, Zutphen, Dieren, Arnhem Centraal, Dieren, Arnhem Centraal, Dieren, Zutphen, Apeldoorn, Zutphen, Dieren, Zutphen, Apeldoorn]"
train_12,"[Ede-Wageningen, Arnhem Centraal, Nijmegen, Oss, Nijmegen, Oss, Nijmegen, Arnhem Centraal, Nijmegen, Oss, s-Hertogenbosch, Tilburg, Breda, Etten-Leur, Breda]"
train_13,"[Apeldoorn, Amersfoort, Zwolle, Deventer, Almelo, Deventer, Almelo, Deventer]"
train_14,"[Etten-Leur, Breda, Etten-Leur, Breda, Dordrecht, Rotterdam Centraal, Schiedam Centrum, Rotterdam Centraal, Schiedam Centrum, Rotterdam Blaak, Dordrecht, Breda, Etten-Leur, Breda, Tilburg, s-Hertogenbosch, Oss, s-Hertogenbosch]"
train_15,"[Den Haag Centraal, Leiden Centraal, Alphen a/d Rijn, Utrecht Centraal, Alphen a/d Rijn, Gouda, Utrecht Centraal, Ede-Wageningen, Utrecht Centraal]"
train_16,"[Ede-Wageningen, Arnhem Centraal, Nijmegen, Arnhem Centraal, Nijmegen, Arnhem Centraal, Ede-Wageningen, Utrecht Centraal, Gouda, Den Haag HS, Delft, Den Haag HS, Leiden Centraal, Den Haag Laan v NOI, Leiden Centraal]"
train_17,"[Dieren, Zutphen, Deventer, Apeldoorn, Amersfoort, Utrecht Centraal, Ede-Wageningen, Utrecht Centraal, Schiphol Airport, Leiden Centraal, Den Haag Centraal]"
train_18,"[Deventer, Apeldoorn, Zutphen, Dieren, Arnhem Centraal, Dieren, Zutphen, Deventer, Zutphen, Deventer, Apeldoorn, Amersfoort, Zwolle]"
train_19,"[Amsterdam Amstel, Almere Centrum, Hilversum, Almere Centrum, Lelystad Centrum, Almere Centrum, Hilversum, Utrecht Centraal, s-Hertogenbosch]"
train_20,"[Schiphol Airport, Amsterdam Zuid, Amsterdam Amstel, Almere Centrum, Amsterdam Centraal, Almere Centrum, Amsterdam Amstel, Amsterdam Centraal, Amsterdam Sloterdijk, Zaandam, Hoorn]"
score,1930.7303370786522
