train,stations
train_1,"[Amsterdam Zuid, Amsterdam Sloterdijk, Amsterdam Centraal, Almere Centrum, Hilversum, Almere Centrum, Hilversum, Utrecht Centraal, Alphen a/d Rijn, Leiden Centraal]"
train_2,"[Rotterdam Blaak, Schiedam Centrum, Delft, Schiedam Centrum, Rotterdam Centraal, Dordrecht, Rotterdam Blaak, Rotterdam Alexander, Gouda, Utrecht Centraal, Amersfoort, Utrecht Centraal, Amsterdam Amstel, Amsterdam Zuid, Amsterdam Sloterdijk]"
train_3,"[Nijmegen, Arnhem Centraal, Nijmegen, Oss, s-Hertogenbosch, Eindhoven, Helmond, Venlo, Helmond, Eindhoven, Weert, Roermond]"
train_4,"[Hoorn, Zaandam, Beverwijk, Haarlem, Heemstede-Aerdenhout, Haarlem, Beverwijk, Castricum, Alkmaar, Castricum, Beverwijk, Zaandam]"
train_5,"[Hengelo, Almelo, Zwolle, Amersfoort, Apeldoorn, Zutphen, Deventer, Zwolle]"
train_6,"[Den Haag Centraal, Delft, Schiedam Centrum, Rotterdam Centraal, Schiedam Centrum, Delft, Schiedam Centrum, Rotterdam Centraal, Schiedam Centrum, Rotterdam Centraal, Dordrecht, Rotterdam Blaak, Schiedam Centrum, Delft, Den Haag Laan v NOI, Leiden Centraal, Heemstede-Aerdenhout, Leiden Centraal, Alphen a/d Rijn]"
train_7,"[Den Haag Centraal, Leiden Centraal, Schiphol Airport, Leiden Centraal, Den Haag Laan v NOI, Gouda, Alphen a/d Rijn, Utrecht Centraal, Hilversum, Almere Centrum]"
train_8,"[Schiedam Centrum, Rotterdam Centraal, Rotterdam Alexander, Gouda, Den Haag HS, Gouda, Den Haag HS, Delft, Den Haag Centraal, Delft, Den Haag HS, Delft, Den Haag Centraal, Delft, Schiedam Centrum, Delft]"
train_9,"[Tilburg, s-Hertogenbosch, Tilburg, Eindhoven, Helmond, Eindhoven, Tilburg, Eindhoven, s-Hertogenbosch, Utrecht Centraal, Amersfoort]"
train_10,"[Leiden Centraal, Alphen a/d Rijn, Leiden Centraal, Heemstede-Aerdenhout, Leiden Centraal, Schiphol Airport, Utrecht Centraal, Amsterdam Amstel, Hilversum, Utrecht Centraal]"
train_11,"[Amsterdam Centraal, Amsterdam Sloterdijk, Amsterdam Centraal, Almere Centrum, Hilversum, Almere Centrum, Amsterdam Amstel, Amsterdam Zuid, Schiphol Airport, Utrecht Centraal]"
train_12,"[Den Helder, Alkmaar, Hoorn, Alkmaar, Castricum, Zaandam, Hoorn, Alkmaar]"
train_13,"[Delft, Den Haag HS, Delft, Den Haag HS, Leiden Centraal, Den Haag HS, Leiden Centraal, Alphen a/d Rijn, Leiden Centraal, Heemstede-Aerdenhout, Leiden Centraal, Den Haag Centraal, Leiden Centraal, Den Haag HS, Gouda]"
train_14,"[Utrecht Centraal, Amsterdam Amstel, Hilversum, Utrecht Centraal, Ede-Wageningen, Utrecht Centraal, Amsterdam Amstel, Utrecht Centraal, Gouda]"
train_15,"[Dieren, Zutphen, Apeldoorn, Zutphen, Apeldoorn, Zutphen, Apeldoorn, Deventer, Apeldoorn, Zutphen, Apeldoorn]"
train_16,"[Leiden Centraal, Heemstede-Aerdenhout, Leiden Centraal, Schiphol Airport, Leiden Centraal, Schiphol Airport, Leiden Centraal, Den Haag HS, Delft, Den Haag Centraal, Leiden Centraal, Den Haag HS, Delft, Den Haag HS]"
train_17,"[Leeuwarden, Groningen, Leeuwarden, Groningen, Leeuwarden, Groningen]"
train_18,"[Eindhoven, s-Hertogenbosch, Oss, Nijmegen, Arnhem Centraal, Dieren, Arnhem Centraal, Dieren, Zutphen, Dieren, Zutphen, Apeldoorn, Deventer, Almelo]"
train_19,"[Hoorn, Zaandam, Castricum, Beverwijk, Haarlem, Amsterdam Sloterdijk, Amsterdam Centraal, Utrecht Centraal, s-Hertogenbosch, Oss, s-Hertogenbosch]"
train_20,"[Hengelo, Enschede, Hengelo, Almelo, Zwolle, Deventer, Zutphen, Deventer, Almelo]"
score,2476.168539325843
