train,stations
train_1,"[Rotterdam Centraal, Dordrecht, Rotterdam Blaak, Schiedam Centrum, Rotterdam Centraal, Schiedam Centrum, Rotterdam Blaak, Schiedam Centrum, Delft, Den Haag HS, Delft, Den Haag HS, Delft, Den Haag Laan v NOI, Gouda, Alphen a/d Rijn]"
train_2,"[Almere Centrum, Lelystad Centrum, Almere Centrum, Lelystad Centrum, Almere Centrum, Lelystad Centrum, Almere Centrum, Amsterdam Centraal, Amsterdam Amstel, Amsterdam Zuid, Schiphol Airport, Utrecht Centraal]"
train_3,"[Oss, Nijmegen, Arnhem Centraal, Dieren, Zutphen, Apeldoorn, Zutphen, Deventer, Apeldoorn, Amersfoort, Utrecht Centraal, Ede-Wageningen]"
train_4,"[Helmond, Eindhoven, Helmond, Eindhoven, s-Hertogenbosch, Eindhoven, Helmond, Eindhoven, Helmond, Venlo, Helmond]"
train_5,"[Almere Centrum, Hilversum, Amsterdam Amstel, Almere Centrum, Lelystad Centrum, Almere Centrum, Lelystad Centrum, Almere Centrum, Hilversum]"
train_6,"[Rotterdam Alexander, Gouda, Alphen a/d Rijn, Gouda, Utrecht Centraal, Gouda, Rotterdam Alexander, Gouda, Den Haag Centraal, Gouda, Alphen a/d Rijn]"
train_7,"[Schiedam Centrum, Rotterdam Centraal, Rotterdam Alexander, Rotterdam Centraal, Dordrecht, Rotterdam Centraal, Dordrecht, Rotterdam Centraal, Dordrecht, Breda, Tilburg, Breda, Etten-Leur, Breda]"
train_8,"[Oss, s-Hertogenbosch, Eindhoven, Tilburg, s-Hertogenbosch, Tilburg, Eindhoven, s-Hertogenbosch, Utrecht Centraal, s-Hertogenbosch]"
train_9,"[Vlissingen, Roosendaal, Dordrecht, Rotterdam Blaak, Rotterdam Alexander, Rotterdam Centraal, Rotterdam Alexander, Rotterdam Blaak, Rotterdam Alexander, Rotterdam Centraal, Dordrecht]"
train_10,"[Enschede, Hengelo, Enschede, Hengelo, Enschede, Hengelo, Almelo, Zwolle, Assen, Zwolle]"
train_11,"[Den Haag HS, Leiden Centraal, Den Haag HS, Delft, Schiedam Centrum, Rotterdam Blaak, Schiedam Centrum, Rotterdam Blaak, Schiedam Centrum, Rotterdam Blaak, Dordrecht, Rotterdam Blaak, Dordrecht, Breda, Tilburg]"
train_12,"[Rotterdam Blaak, Dordrecht, Roosendaal, Vlissingen, Roosendaal]"
train_13,"[Assen, Groningen, Assen, Zwolle, Almelo, Deventer, Almelo]"
train_14,"[Ede-Wageningen, Utrecht Centraal, Hilversum, Utrecht Centraal, Amsterdam Centraal, Amsterdam Sloterdijk, Amsterdam Zuid, Amsterdam Amstel, Hilversum, Amsterdam Amstel]"
train_15,"[Enschede, Hengelo, Almelo, Hengelo, Almelo, Hengelo, Enschede, Hengelo, Almelo, Zwolle, Deventer, Zutphen, Deventer, Zutphen]"
train_16,"[Amsterdam Centraal, Utrecht Centraal, Gouda, Rotterdam Alexander, Rotterdam Blaak, Schiedam Centrum, Rotterdam Centraal, Dordrecht, Roosendaal]"
train_17,"[s-Hertogenbosch, Utrecht Centraal, Hilversum, Utrecht Centraal, s-Hertogenbosch, Tilburg, Breda, Dordrecht, Roosendaal]"
train_18,"[Amsterdam Zuid, Amsterdam Amstel, Amsterdam Centraal, Almere Centrum, Amsterdam Centraal, Utrecht Centraal, Hilversum, Almere Centrum, Amsterdam Amstel]"
train_19,"[Rotterdam Centraal, Rotterdam Alexander, Rotterdam Centraal, Schiedam Centrum, Delft, Schiedam Centrum, Rotterdam Blaak, Dordrecht, Rotterdam Centraal, Schiedam Centrum, Delft, Schiedam Centrum, Rotterdam Blaak, Rotterdam Alexander, Rotterdam Blaak, Rotterdam Alexander, Rotterdam Blaak, Rotterdam Alexander, Rotterdam Centraal, Schiedam Centrum, Delft]"
train_20,"[Hengelo, Enschede, Hengelo, Enschede, Hengelo, Enschede, Hengelo, Enschede, Hengelo, Almelo, Hengelo, Almelo, Zwolle, Steenwijk, Zwolle]"
score,1223.8539325842703
