train,stations
train_1,"[Den Haag HS, Delft, Den Haag Centraal, Delft, Den Haag Laan v NOI, Delft, Den Haag Laan v NOI, Leiden Centraal, Schiphol Airport, Amsterdam Zuid, Schiphol Airport, Utrecht Centraal, s-Hertogenbosch, Oss]"
train_2,"[Heerlen, Sittard, Maastricht, Sittard, Heerlen, Sittard, Maastricht, Sittard, Heerlen, Sittard, Roermond, Sittard]"
train_3,"[Weert, Eindhoven, Weert, Eindhoven, s-Hertogenbosch, Tilburg, s-Hertogenbosch, Tilburg, Eindhoven, s-Hertogenbosch, Oss, s-Hertogenbosch]"
train_4,"[Heerenveen, Steenwijk, Heerenveen, Steenwijk, Zwolle, Deventer, Zwolle, Amersfoort, Utrecht Centraal]"
train_5,"[Hengelo, Enschede, Hengelo, Enschede, Hengelo, Almelo, Deventer, Apeldoorn, Zutphen, Apeldoorn, Deventer, Zutphen, Deventer, Apeldoorn, Zutphen]"
train_6,"[Schiedam Centrum, Rotterdam Centraal, Rotterdam Alexander, Rotterdam Centraal, Schiedam Centrum, Delft, Den Haag Laan v NOI, Gouda, Den Haag Centraal, Gouda, Utrecht Centraal, s-Hertogenbosch, Eindhoven]"
train_7,"[Utrecht Centraal, Amersfoort, Zwolle, Steenwijk, Heerenveen, Leeuwarden, Groningen, Assen, Groningen]"
train_8,"[Hoorn, Alkmaar, Hoorn, Zaandam, Amsterdam Sloterdijk, Zaandam, Hoorn, Alkmaar, Hoorn]"
train_9,"[Alkmaar, Castricum, Alkmaar, Hoorn, Zaandam, Beverwijk, Haarlem, Heemstede-Aerdenhout, Leiden Centraal, Den Haag HS, Delft, Den Haag HS, Leiden Centraal]"
train_10,"[Oss, Nijmegen, Arnhem Centraal, Ede-Wageningen, Utrecht Centraal, Schiphol Airport, Amsterdam Zuid, Amsterdam Amstel, Amsterdam Centraal, Almere Centrum, Hilversum]"
train_11,"[Almere Centrum, Amsterdam Centraal, Almere Centrum, Amsterdam Centraal, Amsterdam Amstel, Amsterdam Centraal, Amsterdam Sloterdijk, Zaandam, Hoorn, Alkmaar, Den Helder]"
train_12,"[Assen, Zwolle, Assen, Zwolle, Deventer, Almelo]"
train_13,"[Rotterdam Alexander, Gouda, Rotterdam Alexander, Rotterdam Centraal, Dordrecht, Rotterdam Centraal, Dordrecht, Rotterdam Blaak, Schiedam Centrum, Delft, Den Haag Laan v NOI, Delft, Den Haag Laan v NOI, Delft, Den Haag Laan v NOI]"
train_14,"[Amsterdam Zuid, Amsterdam Sloterdijk, Amsterdam Centraal, Amsterdam Amstel, Almere Centrum, Amsterdam Centraal, Almere Centrum, Amsterdam Centraal, Amsterdam Amstel, Amsterdam Centraal, Amsterdam Sloterdijk, Amsterdam Centraal, Amsterdam Sloterdijk, Amsterdam Centraal, Amsterdam Sloterdijk, Zaandam, Amsterdam Sloterdijk]"
train_15,"[Roosendaal, Etten-Leur, Roosendaal, Etten-Leur, Breda, Tilburg, Eindhoven, s-Hertogenbosch, Oss, s-Hertogenbosch, Tilburg, Breda, Etten-Leur, Breda, Dordrecht]"
train_16,"[Den Haag Laan v NOI, Leiden Centraal, Den Haag HS, Gouda, Den Haag Centraal, Gouda, Den Haag Laan v NOI, Gouda, Utrecht Centraal]"
train_17,"[Beverwijk, Haarlem, Amsterdam Sloterdijk, Amsterdam Centraal, Amsterdam Sloterdijk, Zaandam, Hoorn, Zaandam, Hoorn, Alkmaar, Hoorn]"
train_18,"[Leiden Centraal, Den Haag Laan v NOI, Gouda, Den Haag Centraal, Gouda, Rotterdam Alexander, Rotterdam Blaak, Schiedam Centrum, Rotterdam Blaak, Schiedam Centrum, Rotterdam Blaak, Schiedam Centrum, Delft, Den Haag Centraal]"
train_19,"[Almere Centrum, Hilversum, Amsterdam Amstel, Utrecht Centraal, Amersfoort, Zwolle, Assen]"
train_20,"[Delft, Den Haag Centraal, Gouda, Utrecht Centraal, Amsterdam Centraal, Amsterdam Sloterdijk, Amsterdam Zuid, Amsterdam Sloterdijk, Haarlem, Amsterdam Sloterdijk, Haarlem, Heemstede-Aerdenhout, Haarlem, Beverwijk]"
score,2743.2471910112363
