train,stations
train_1,"[Almere Centrum, Amsterdam Centraal, Amsterdam Amstel, Utrecht Centraal, Amersfoort, Zwolle, Assen, Zwolle]"
train_2,"[Amsterdam Sloterdijk, Zaandam, Hoorn, Zaandam, Amsterdam Sloterdijk, Zaandam, Hoorn, Zaandam, Amsterdam Sloterdijk, Haarlem, Beverwijk, Haarlem]"
train_3,"[Enschede, Hengelo, Enschede, Hengelo, Enschede, Hengelo, Enschede, Hengelo, Almelo, Deventer, Zutphen, Dieren, Arnhem Centraal, Dieren, Arnhem Centraal, Dieren, Zutphen, Apeldoorn]"
train_4,"[Deventer, Zutphen, Apeldoorn, Amersfoort, Zwolle, Amersfoort, Apeldoorn, Amersfoort]"
train_5,"[Zaandam, Amsterdam Sloterdijk, Zaandam, Castricum, Alkmaar, Hoorn, Zaandam, Beverwijk, Zaandam, Beverwijk, Castricum]"
train_6,"[Utrecht Centraal, s-Hertogenbosch, Oss, Nijmegen, Arnhem Centraal, Nijmegen, Oss, s-Hertogenbosch, Eindhoven, Weert, Roermond, Weert]"
train_7,"[Leiden Centraal, Alphen a/d Rijn, Leiden Centraal, Schiphol Airport, Amsterdam Zuid, Amsterdam Amstel, Amsterdam Zuid, Amsterdam Sloterdijk, Amsterdam Centraal, Almere Centrum, Amsterdam Centraal, Almere Centrum, Amsterdam Amstel]"
train_8,"[Oss, Nijmegen, Arnhem Centraal, Ede-Wageningen, Arnhem Centraal, Dieren, Zutphen, Apeldoorn, Zutphen, Dieren, Zutphen, Apeldoorn, Zutphen]"
train_9,"[Deventer, Zwolle, Steenwijk, Heerenveen, Leeuwarden, Groningen, Assen, Zwolle]"
train_10,"[Schiedam Centrum, Rotterdam Centraal, Rotterdam Alexander, Rotterdam Blaak, Schiedam Centrum, Rotterdam Blaak, Schiedam Centrum, Rotterdam Centraal, Rotterdam Alexander, Rotterdam Centraal, Rotterdam Alexander, Rotterdam Centraal, Schiedam Centrum, Rotterdam Blaak, Dordrecht, Rotterdam Blaak, Schiedam Centrum, Rotterdam Blaak, Schiedam Centrum, Rotterdam Centraal, Schiedam Centrum]"
train_11,"[Lelystad Centrum, Almere Centrum, Amsterdam Centraal, Utrecht Centraal, Ede-Wageningen, Utrecht Centraal, Amsterdam Amstel, Amsterdam Centraal, Amsterdam Sloterdijk, Amsterdam Zuid, Schiphol Airport, Leiden Centraal]"
train_12,"[Delft, Den Haag HS, Delft, Den Haag Laan v NOI, Gouda, Den Haag Laan v NOI, Gouda, Utrecht Centraal, Amsterdam Amstel, Amsterdam Centraal, Amsterdam Amstel, Amsterdam Zuid]"
train_13,"[Heemstede-Aerdenhout, Leiden Centraal, Den Haag Centraal, Delft, Schiedam Centrum, Delft, Den Haag Laan v NOI, Leiden Centraal, Den Haag Centraal, Leiden Centraal, Schiphol Airport, Utrecht Centraal, Amsterdam Amstel, Amsterdam Centraal, Amsterdam Sloterdijk]"
train_14,"[Delft, Den Haag Centraal, Leiden Centraal, Heemstede-Aerdenhout, Leiden Centraal, Schiphol Airport, Amsterdam Zuid, Schiphol Airport, Utrecht Centraal, Amersfoort, Utrecht Centraal, Amersfoort, Utrecht Centraal]"
train_15,"[Alphen a/d Rijn, Utrecht Centraal, Amsterdam Amstel, Hilversum, Utrecht Centraal, Amersfoort, Utrecht Centraal, s-Hertogenbosch, Utrecht Centraal]"
train_16,"[Schiedam Centrum, Rotterdam Centraal, Schiedam Centrum, Rotterdam Centraal, Schiedam Centrum, Rotterdam Centraal, Dordrecht, Rotterdam Blaak, Rotterdam Alexander, Gouda, Den Haag HS, Gouda, Den Haag Laan v NOI, Delft, Den Haag Laan v NOI]"
train_17,"[Breda, Tilburg, Eindhoven, Tilburg, Eindhoven, s-Hertogenbosch, Tilburg, Breda, Etten-Leur, Breda, Tilburg, Eindhoven, Helmond]"
train_18,"[Beverwijk, Castricum, Zaandam, Amsterdam Sloterdijk, Amsterdam Centraal, Utrecht Centraal, Amsterdam Centraal, Amsterdam Sloterdijk, Amsterdam Zuid, Amsterdam Sloterdijk, Haarlem, Heemstede-Aerdenhout, Haarlem, Beverwijk]"
train_19,"[Ede-Wageningen, Utrecht Centraal, Alphen a/d Rijn, Utrecht Centraal, Hilversum, Amsterdam Amstel, Almere Centrum, Lelystad Centrum, Almere Centrum]"
train_20,"[Rotterdam Centraal, Rotterdam Alexander, Gouda, Den Haag Centraal, Delft, Schiedam Centrum, Delft, Den Haag Centraal, Gouda, Utrecht Centraal, Hilversum, Almere Centrum]"
score,3055.3258426966295
