train,stations
train_1,"[Heerenveen, Steenwijk, Zwolle, Almelo, Hengelo, Enschede, Hengelo, Almelo, Hengelo, Almelo, Hengelo, Enschede, Hengelo, Almelo, Hengelo]"
train_2,"[Schiphol Airport, Amsterdam Zuid, Schiphol Airport, Utrecht Centraal, Amersfoort, Apeldoorn, Amersfoort, Zwolle]"
train_3,"[Heerenveen, Leeuwarden, Heerenveen, Leeuwarden, Heerenveen, Leeuwarden, Heerenveen, Leeuwarden, Heerenveen, Steenwijk, Zwolle]"
train_4,"[Beverwijk, Zaandam, Castricum, Zaandam, Amsterdam Sloterdijk, Zaandam, Hoorn, Alkmaar, Hoorn, Alkmaar, Castricum]"
train_5,"[Venlo, Helmond, Venlo, Helmond, Eindhoven, Helmond, Eindhoven, Helmond, Venlo]"
train_6,"[Hengelo, Almelo, Hengelo, Almelo, Deventer, Almelo, Deventer, Zwolle, Steenwijk, Zwolle]"
train_7,"[s-Hertogenbosch, Utrecht Centraal, Gouda, Utrecht Centraal, Ede-Wageningen, Arnhem Centraal, Dieren, Zutphen, Dieren, Arnhem Centraal, Ede-Wageningen, Utrecht Centraal]"
train_8,"[Alkmaar, Hoorn, Zaandam, Hoorn, Alkmaar, Den Helder, Alkmaar]"
train_9,"[Dieren, Zutphen, Dieren, Arnhem Centraal, Ede-Wageningen, Arnhem Centraal, Dieren, Zutphen, Dieren, Zutphen, Dieren, Zutphen, Apeldoorn, Deventer, Zwolle, Deventer]"
train_10,"[Vlissingen, Roosendaal, Vlissingen]"
train_11,"[Den Haag Laan v NOI, Gouda, Den Haag Laan v NOI, Gouda, Den Haag Laan v NOI, Gouda, Utrecht Centraal]"
train_12,"[Almelo, Hengelo, Enschede, Hengelo, Enschede, Hengelo, Enschede, Hengelo, Enschede, Hengelo, Enschede, Hengelo, Enschede, Hengelo, Almelo, Zwolle]"
train_13,"[Amsterdam Amstel, Amsterdam Centraal, Amsterdam Amstel, Hilversum, Amsterdam Amstel, Utrecht Centraal, Gouda, Den Haag Centraal, Delft, Schiedam Centrum, Delft, Schiedam Centrum, Rotterdam Centraal, Schiedam Centrum, Rotterdam Centraal]"
train_14,"[s-Hertogenbosch, Oss, s-Hertogenbosch, Tilburg, s-Hertogenbosch, Tilburg, Eindhoven, Helmond, Venlo, Helmond, Eindhoven]"
train_15,"[Lelystad Centrum, Almere Centrum, Hilversum, Amsterdam Amstel, Hilversum, Almere Centrum, Hilversum, Almere Centrum]"
train_16,"[Dieren, Zutphen, Dieren, Zutphen, Dieren, Zutphen, Dieren, Arnhem Centraal, Dieren, Zutphen, Dieren, Zutphen, Apeldoorn, Deventer, Almelo]"
train_17,"[Schiedam Centrum, Rotterdam Centraal, Dordrecht, Breda, Dordrecht, Roosendaal, Dordrecht, Breda, Etten-Leur, Breda, Dordrecht, Roosendaal]"
train_18,"[Assen, Groningen, Leeuwarden, Groningen, Assen, Groningen, Leeuwarden]"
train_19,"[Den Haag Laan v NOI, Gouda, Den Haag Laan v NOI, Leiden Centraal, Den Haag HS, Leiden Centraal, Den Haag Centraal, Delft, Den Haag HS, Leiden Centraal, Den Haag HS, Leiden Centraal, Heemstede-Aerdenhout, Haarlem]"
train_20,"[Delft, Den Haag Centraal, Leiden Centraal, Den Haag HS, Gouda, Den Haag Laan v NOI, Delft, Schiedam Centrum, Delft, Den Haag Laan v NOI, Gouda, Den Haag Centraal]"
score,1226.8539325842703
