train,stations
train_1,"[Leiden Centraal, Den Haag Centraal, Gouda, Alphen a/d Rijn, Utrecht Centraal, s-Hertogenbosch, Oss, Nijmegen, Oss, Nijmegen, Arnhem Centraal]"
train_2,"[Deventer, Zwolle, Deventer, Zutphen, Dieren, Zutphen, Dieren, Arnhem Centraal, Ede-Wageningen, Utrecht Centraal, Ede-Wageningen, Arnhem Centraal, Nijmegen]"
train_3,"[Apeldoorn, Amersfoort, Zwolle, Amersfoort, Utrecht Centraal, Ede-Wageningen, Arnhem Centraal, Ede-Wageningen, Arnhem Centraal, Ede-Wageningen]"
train_4,"[Leiden Centraal, Den Haag Centraal, Gouda, Den Haag Centraal, Gouda, Den Haag Laan v NOI, Gouda, Rotterdam Alexander, Rotterdam Centraal, Dordrecht, Breda]"
train_5,"[Gouda, Den Haag Centraal, Delft, Schiedam Centrum, Rotterdam Centraal, Dordrecht, Breda, Dordrecht, Rotterdam Blaak, Dordrecht, Rotterdam Centraal, Rotterdam Alexander, Rotterdam Centraal, Dordrecht]"
train_6,"[Eindhoven, Tilburg, Breda, Etten-Leur, Breda, Tilburg, Eindhoven, s-Hertogenbosch, Oss, Nijmegen, Oss, Nijmegen, Arnhem Centraal]"
train_7,"[Etten-Leur, Roosendaal, Vlissingen, Roosendaal]"
train_8,"[Groningen, Assen, Groningen, Assen, Groningen, Assen, Groningen, Assen, Zwolle]"
train_9,"[Apeldoorn, Deventer, Apeldoorn, Amersfoort, Zwolle, Assen, Zwolle]"
train_10,"[Hengelo, Enschede, Hengelo, Almelo, Zwolle, Assen, Zwolle]"
train_11,"[Eindhoven, Weert, Eindhoven, s-Hertogenbosch, Oss, Nijmegen, Arnhem Centraal, Dieren, Zutphen, Dieren, Zutphen, Deventer, Zwolle]"
train_12,"[Den Helder, Alkmaar, Den Helder, Alkmaar, Den Helder]"
train_13,"[s-Hertogenbosch, Utrecht Centraal, Amsterdam Amstel, Almere Centrum, Amsterdam Centraal, Amsterdam Amstel, Amsterdam Zuid, Amsterdam Sloterdijk, Zaandam, Hoorn]"
train_14,"[s-Hertogenbosch, Tilburg, Eindhoven, Helmond, Venlo, Helmond, Eindhoven, s-Hertogenbosch, Utrecht Centraal, Gouda]"
train_15,"[Utrecht Centraal, Ede-Wageningen, Arnhem Centraal, Dieren, Arnhem Centraal, Dieren, Arnhem Centraal, Dieren, Arnhem Centraal, Ede-Wageningen, Utrecht Centraal, Amsterdam Centraal]"
train_16,"[Rotterdam Alexander, Rotterdam Centraal, Schiedam Centrum, Rotterdam Centraal, Dordrecht, Rotterdam Centraal, Dordrecht, Roosendaal, Dordrecht, Rotterdam Blaak, Dordrecht, Roosendaal]"
train_17,"[Zutphen, Apeldoorn, Deventer, Almelo, Zwolle, Assen, Groningen]"
train_18,"[s-Hertogenbosch, Eindhoven, Helmond, Eindhoven, Weert, Eindhoven, s-Hertogenbosch, Eindhoven, s-Hertogenbosch, Oss, Nijmegen, Oss]"
train_19,"[Venlo, Helmond, Venlo, Helmond, Venlo, Helmond]"
train_20,"[Almere Centrum, Hilversum, Utrecht Centraal, Alphen a/d Rijn, Gouda, Den Haag Laan v NOI, Delft, Den Haag Centraal, Delft, Den Haag Laan v NOI, Leiden Centraal]"
score,1413.5730337078649
