train,stations
train_1,"[Leiden Centraal, Alphen a/d Rijn, Gouda, Alphen a/d Rijn, Leiden Centraal, Den Haag HS, Leiden Centraal, Alphen a/d Rijn, Gouda, Den Haag Centraal, Leiden Centraal, Schiphol Airport]"
train_2,"[Leeuwarden, Heerenveen, Leeuwarden, Heerenveen, Steenwijk, Heerenveen, Leeuwarden, Heerenveen, Leeuwarden, Groningen]"
train_3,"[Maastricht, Sittard, Heerlen, Sittard, Roermond, Weert, Roermond, Sittard, Maastricht, Sittard, Maastricht, Sittard, Roermond]"
train_4,"[Den Haag Centraal, Leiden Centraal, Heemstede-Aerdenhout, Leiden Centraal, Den Haag Laan v NOI, Delft, Den Haag Centraal, Gouda, Den Haag HS, Gouda, Den Haag Laan v NOI]"
train_5,"[Maastricht, Sittard, Roermond, Sittard, Maastricht, Sittard, Maastricht, Sittard, Heerlen, Sittard, Maastricht, Sittard]"
train_6,"[Rotterdam Centraal, Schiedam Centrum, Rotterdam Centraal, Dordrecht, Rotterdam Centraal, Dordrecht, Roosendaal, Vlissingen]"
train_7,"[Apeldoorn, Deventer, Almelo, Deventer, Zutphen, Deventer, Zutphen, Apeldoorn, Amersfoort, Apeldoorn, Deventer]"
train_8,"[Rotterdam Blaak, Dordrecht, Rotterdam Centraal, Rotterdam Alexander, Rotterdam Centraal, Dordrecht, Rotterdam Centraal, Dordrecht, Roosendaal, Etten-Leur, Roosendaal, Etten-Leur, Breda, Tilburg]"
train_9,"[Den Haag Centraal, Leiden Centraal, Schiphol Airport, Utrecht Centraal, Amsterdam Centraal, Amsterdam Amstel, Amsterdam Zuid, Amsterdam Amstel, Amsterdam Zuid, Amsterdam Amstel, Amsterdam Zuid, Schiphol Airport]"
train_10,"[Vlissingen, Roosendaal, Vlissingen]"
train_11,"[Utrecht Centraal, Schiphol Airport, Amsterdam Zuid, Amsterdam Amstel, Hilversum, Amsterdam Amstel, Hilversum, Utrecht Centraal, s-Hertogenbosch]"
train_12,"[Helmond, Venlo, Helmond, Venlo, Helmond, Venlo]"
train_13,"[Maastricht, Sittard, Roermond, Weert, Roermond, Sittard, Roermond, Weert, Eindhoven, Weert, Roermond, Sittard]"
train_14,"[Enschede, Hengelo, Enschede, Hengelo, Enschede, Hengelo, Almelo, Deventer, Apeldoorn, Zutphen, Deventer, Almelo, Hengelo, Enschede, Hengelo, Almelo, Hengelo]"
train_15,"[Rotterdam Alexander, Rotterdam Blaak, Rotterdam Alexander, Rotterdam Centraal, Schiedam Centrum, Rotterdam Centraal, Rotterdam Alexander, Rotterdam Centraal, Dordrecht, Roosendaal, Dordrecht, Roosendaal]"
train_16,"[Maastricht, Sittard, Maastricht, Sittard, Maastricht, Sittard, Heerlen, Sittard, Heerlen, Sittard, Maastricht, Sittard]"
train_17,"[Roermond, Sittard, Roermond, Weert, Roermond, Sittard, Roermond, Weert, Roermond, Weert, Eindhoven, Tilburg]"
train_18,"[Gouda, Alphen a/d Rijn, Utrecht Centraal, Amsterdam Amstel, Hilversum, Utrecht Centraal, Hilversum, Amsterdam Amstel, Utrecht Centraal]"
train_19,"[Amersfoort, Apeldoorn, Deventer, Zwolle, Almelo, Zwolle]"
train_20,"[Roermond, Sittard, Maastricht, Sittard, Heerlen, Sittard, Roermond, Sittard, Roermond, Sittard, Maastricht, Sittard]"
score,427.33707865168526
