train,stations
train_1,"[Eindhoven, s-Hertogenbosch, Utrecht Centraal, Amersfoort, Apeldoorn, Deventer, Zwolle, Steenwijk, Heerenveen, Steenwijk]"
train_2,"[Almere Centrum, Lelystad Centrum, Almere Centrum, Amsterdam Centraal, Almere Centrum, Amsterdam Amstel, Almere Centrum, Amsterdam Amstel, Amsterdam Centraal]"
train_3,"[Heerlen, Sittard, Heerlen, Sittard, Heerlen, Sittard, Maastricht, Sittard, Maastricht, Sittard, Roermond, Sittard]"
train_4,"[Hilversum, Almere Centrum, Amsterdam Amstel, Amsterdam Centraal, Almere Centrum, Lelystad Centrum, Almere Centrum, Lelystad Centrum, Almere Centrum, Hilversum]"
train_5,"[Hengelo, Enschede, Hengelo, Almelo, Deventer, Zutphen, Dieren, Zutphen, Dieren, Zutphen, Dieren, Zutphen, Deventer, Apeldoorn, Amersfoort]"
train_6,"[Enschede, Hengelo, Almelo, Deventer, Almelo, Hengelo, Almelo, Zwolle, Steenwijk, Heerenveen, Steenwijk]"
train_7,"[Rotterdam Alexander, Rotterdam Centraal, Rotterdam Alexander, Gouda, Alphen a/d Rijn, Leiden Centraal, Alphen a/d Rijn, Gouda, Den Haag Centraal, Leiden Centraal, Alphen a/d Rijn, Leiden Centraal, Alphen a/d Rijn]"
train_8,"[Schiedam Centrum, Delft, Schiedam Centrum, Rotterdam Centraal, Dordrecht, Breda, Etten-Leur, Breda, Dordrecht, Rotterdam Centraal, Dordrecht, Roosendaal, Etten-Leur, Roosendaal]"
train_9,"[Amsterdam Amstel, Hilversum, Amsterdam Amstel, Amsterdam Centraal, Amsterdam Amstel, Amsterdam Zuid, Schiphol Airport, Leiden Centraal, Den Haag HS, Gouda, Den Haag HS, Gouda]"
train_10,"[Oss, s-Hertogenbosch, Utrecht Centraal, Hilversum, Almere Centrum, Amsterdam Amstel, Utrecht Centraal, Amersfoort, Utrecht Centraal]"
train_11,"[Apeldoorn, Deventer, Zwolle, Deventer, Apeldoorn, Deventer, Zutphen, Deventer, Apeldoorn, Amersfoort, Apeldoorn]"
train_12,"[Tilburg, s-Hertogenbosch, Oss, Nijmegen, Arnhem Centraal, Ede-Wageningen, Arnhem Centraal, Dieren, Arnhem Centraal, Nijmegen, Oss, s-Hertogenbosch, Utrecht Centraal]"
train_13,"[Haarlem, Heemstede-Aerdenhout, Leiden Centraal, Den Haag HS, Delft, Den Haag HS, Delft, Den Haag Centraal, Delft, Den Haag Laan v NOI, Delft, Schiedam Centrum, Rotterdam Centraal, Rotterdam Alexander, Rotterdam Blaak, Dordrecht, Rotterdam Blaak, Dordrecht]"
train_14,"[Den Haag Laan v NOI, Delft, Den Haag HS, Leiden Centraal, Den Haag HS, Leiden Centraal, Alphen a/d Rijn, Gouda, Den Haag Laan v NOI, Gouda, Den Haag Laan v NOI]"
train_15,"[Alkmaar, Den Helder, Alkmaar, Castricum, Zaandam, Beverwijk, Haarlem, Amsterdam Sloterdijk, Zaandam, Castricum, Alkmaar]"
train_16,"[Schiphol Airport, Leiden Centraal, Alphen a/d Rijn, Leiden Centraal, Den Haag HS, Leiden Centraal, Den Haag Laan v NOI, Delft, Den Haag Centraal, Leiden Centraal, Heemstede-Aerdenhout, Leiden Centraal, Den Haag Laan v NOI, Leiden Centraal, Heemstede-Aerdenhout, Haarlem]"
train_17,"[Arnhem Centraal, Ede-Wageningen, Utrecht Centraal, Ede-Wageningen, Utrecht Centraal, s-Hertogenbosch, Tilburg, Breda, Tilburg, Eindhoven]"
train_18,"[Roosendaal, Dordrecht, Rotterdam Blaak, Rotterdam Alexander, Gouda, Rotterdam Alexander, Rotterdam Centraal, Dordrecht, Rotterdam Centraal, Dordrecht, Rotterdam Centraal, Schiedam Centrum, Rotterdam Centraal, Dordrecht]"
train_19,"[Leeuwarden, Groningen, Leeuwarden, Groningen, Assen, Groningen, Assen]"
train_20,"[Hengelo, Almelo, Deventer, Almelo, Hengelo, Almelo, Zwolle, Steenwijk, Heerenveen, Leeuwarden]"
score,2718.8876404494376
