train,stations
train_1,"[Roosendaal, Etten-Leur, Roosendaal, Etten-Leur, Breda, Dordrecht, Rotterdam Centraal, Schiedam Centrum, Rotterdam Blaak, Rotterdam Alexander, Gouda, Den Haag HS, Leiden Centraal, Heemstede-Aerdenhout, Haarlem, Amsterdam Sloterdijk]"
train_2,"[Zwolle, Amersfoort, Zwolle, Almelo, Zwolle]"
train_3,"[s-Hertogenbosch, Tilburg, Eindhoven, Weert, Eindhoven, Tilburg, Eindhoven, s-Hertogenbosch, Utrecht Centraal]"
train_4,"[Amsterdam Centraal, Amsterdam Amstel, Amsterdam Zuid, Schiphol Airport, Amsterdam Zuid, Amsterdam Sloterdijk, Zaandam, Hoorn, Zaandam, Amsterdam Sloterdijk, Zaandam, Amsterdam Sloterdijk, Amsterdam Centraal, Amsterdam Amstel, Utrecht Centraal]"
train_5,"[Heemstede-Aerdenhout, Leiden Centraal, Schiphol Airport, Amsterdam Zuid, Amsterdam Amstel, Utrecht Centraal, Hilversum, Almere Centrum, Hilversum, Utrecht Centraal, Alphen a/d Rijn]"
train_6,"[Castricum, Zaandam, Castricum, Beverwijk, Castricum, Beverwijk, Haarlem, Heemstede-Aerdenhout, Leiden Centraal, Schiphol Airport, Utrecht Centraal, Alphen a/d Rijn]"
train_7,"[Rotterdam Centraal, Schiedam Centrum, Rotterdam Blaak, Rotterdam Alexander, Rotterdam Blaak, Rotterdam Alexander, Gouda, Alphen a/d Rijn, Utrecht Centraal, Hilversum, Utrecht Centraal, Amsterdam Amstel, Amsterdam Zuid, Amsterdam Sloterdijk]"
train_8,"[Leeuwarden, Heerenveen, Steenwijk, Zwolle, Amersfoort, Zwolle, Assen]"
train_9,"[Den Haag HS, Delft, Schiedam Centrum, Rotterdam Blaak, Dordrecht, Roosendaal, Vlissingen]"
train_10,"[Amsterdam Centraal, Amsterdam Amstel, Utrecht Centraal, Gouda, Den Haag Laan v NOI, Delft, Den Haag Centraal, Delft, Den Haag Centraal, Leiden Centraal, Heemstede-Aerdenhout, Haarlem, Beverwijk]"
train_11,"[Venlo, Helmond, Eindhoven, Helmond, Venlo, Helmond, Eindhoven, s-Hertogenbosch, Eindhoven, s-Hertogenbosch]"
train_12,"[Deventer, Zwolle, Almelo, Deventer, Apeldoorn, Deventer, Zwolle, Almelo]"
train_13,"[Roosendaal, Vlissingen, Roosendaal]"
train_14,"[Lelystad Centrum, Almere Centrum, Amsterdam Centraal, Almere Centrum, Amsterdam Centraal, Almere Centrum, Lelystad Centrum, Almere Centrum, Amsterdam Centraal, Almere Centrum]"
train_15,"[Lelystad Centrum, Almere Centrum, Amsterdam Amstel, Hilversum, Almere Centrum, Amsterdam Centraal, Amsterdam Sloterdijk, Amsterdam Zuid, Amsterdam Sloterdijk, Zaandam]"
train_16,"[Roermond, Weert, Eindhoven, s-Hertogenbosch, Eindhoven, Tilburg, Eindhoven, Weert, Roermond, Weert, Roermond]"
train_17,"[Maastricht, Sittard, Heerlen, Sittard, Maastricht, Sittard, Roermond, Weert, Eindhoven, Tilburg, s-Hertogenbosch, Eindhoven]"
train_18,"[Ede-Wageningen, Utrecht Centraal, Schiphol Airport, Utrecht Centraal, Hilversum, Amsterdam Amstel, Amsterdam Centraal, Utrecht Centraal]"
train_19,"[Eindhoven, s-Hertogenbosch, Utrecht Centraal, Schiphol Airport, Amsterdam Zuid, Amsterdam Amstel, Hilversum, Almere Centrum, Lelystad Centrum, Almere Centrum]"
train_20,"[Steenwijk, Heerenveen, Leeuwarden, Groningen, Assen, Groningen, Assen, Groningen, Assen]"
score,2388.4494382022467
