train,stations
train_1,"[Groningen, Assen, Groningen, Leeuwarden, Heerenveen, Steenwijk, Heerenveen, Leeuwarden, Groningen]"
train_2,"[Hoorn, Zaandam, Castricum, Zaandam, Hoorn, Alkmaar, Castricum, Zaandam, Beverwijk, Zaandam]"
train_3,"[Heerenveen, Leeuwarden, Groningen, Assen, Groningen, Assen, Groningen, Leeuwarden, Heerenveen]"
train_4,"[Utrecht Centraal, Amsterdam Amstel, Almere Centrum, Amsterdam Amstel, Utrecht Centraal, Amsterdam Centraal, Amsterdam Sloterdijk, Amsterdam Zuid, Amsterdam Amstel, Amsterdam Centraal, Almere Centrum]"
train_5,"[Den Haag Centraal, Gouda, Den Haag Laan v NOI, Delft, Den Haag HS, Leiden Centraal, Schiphol Airport, Leiden Centraal, Den Haag HS, Delft, Den Haag Laan v NOI, Delft, Den Haag Centraal, Leiden Centraal]"
train_6,"[Etten-Leur, Breda, Tilburg, Eindhoven, Weert, Roermond, Weert, Eindhoven, Weert, Eindhoven, Helmond, Venlo]"
train_7,"[Zaandam, Castricum, Beverwijk, Zaandam, Beverwijk, Castricum, Beverwijk, Castricum, Alkmaar, Hoorn, Alkmaar]"
train_8,"[Maastricht, Sittard, Maastricht, Sittard, Heerlen, Sittard, Heerlen, Sittard, Roermond, Weert, Roermond, Sittard, Heerlen]"
train_9,"[Maastricht, Sittard, Heerlen, Sittard, Maastricht, Sittard, Maastricht, Sittard, Roermond, Sittard, Roermond, Weert, Roermond]"
train_10,"[Steenwijk, Heerenveen, Leeuwarden, Heerenveen, Steenwijk, Zwolle, Amersfoort, Zwolle]"
train_11,"[Den Haag Laan v NOI, Delft, Den Haag Centraal, Leiden Centraal, Den Haag HS, Delft, Schiedam Centrum, Delft, Den Haag Laan v NOI, Leiden Centraal, Heemstede-Aerdenhout, Leiden Centraal, Den Haag HS, Leiden Centraal, Den Haag Laan v NOI, Delft, Den Haag Centraal]"
train_12,"[Castricum, Beverwijk, Castricum, Beverwijk, Castricum, Beverwijk, Castricum, Alkmaar, Castricum, Alkmaar, Hoorn, Alkmaar, Hoorn]"
train_13,"[Leeuwarden, Groningen, Leeuwarden, Groningen, Leeuwarden, Groningen]"
train_14,"[Groningen, Leeuwarden, Heerenveen, Steenwijk, Zwolle, Steenwijk, Heerenveen, Steenwijk, Heerenveen, Steenwijk]"
train_15,"[Deventer, Zutphen, Apeldoorn, Amersfoort, Utrecht Centraal, Amsterdam Amstel, Hilversum, Utrecht Centraal, Schiphol Airport]"
train_16,"[Zwolle, Amersfoort, Utrecht Centraal, Amersfoort, Apeldoorn, Amersfoort, Apeldoorn, Deventer, Zwolle]"
train_17,"[Schiphol Airport, Leiden Centraal, Heemstede-Aerdenhout, Leiden Centraal, Den Haag HS, Leiden Centraal, Den Haag HS, Delft, Schiedam Centrum, Rotterdam Centraal, Rotterdam Alexander, Gouda, Alphen a/d Rijn, Utrecht Centraal]"
train_18,"[Venlo, Helmond, Venlo, Helmond, Venlo, Helmond]"
train_19,"[Maastricht, Sittard, Roermond, Sittard, Roermond, Weert, Eindhoven, s-Hertogenbosch, Eindhoven, Tilburg, Breda, Tilburg]"
train_20,"[Roosendaal, Etten-Leur, Breda, Etten-Leur, Breda, Etten-Leur, Breda, Tilburg, Eindhoven, Helmond, Venlo, Helmond, Venlo]"
score,945.4943820224717
