train,stations
train_1,"[Leeuwarden, Groningen, Leeuwarden, Heerenveen, Steenwijk, Zwolle, Deventer, Apeldoorn, Deventer]"
train_2,"[Beverwijk, Haarlem, Beverwijk, Castricum, Zaandam, Castricum, Alkmaar, Den Helder, Alkmaar]"
train_3,"[Roermond, Sittard, Maastricht, Sittard, Heerlen, Sittard, Roermond, Sittard, Maastricht, Sittard, Heerlen, Sittard]"
train_4,"[Apeldoorn, Amersfoort, Apeldoorn, Zutphen, Apeldoorn, Deventer, Zwolle, Amersfoort]"
train_5,"[Dordrecht, Rotterdam Blaak, Schiedam Centrum, Delft, Den Haag HS, Leiden Centraal, Schiphol Airport, Amsterdam Zuid, Schiphol Airport, Amsterdam Zuid, Amsterdam Amstel, Amsterdam Centraal, Amsterdam Sloterdijk, Amsterdam Centraal, Amsterdam Sloterdijk, Amsterdam Centraal, Utrecht Centraal]"
train_6,"[Rotterdam Centraal, Rotterdam Alexander, Rotterdam Centraal, Schiedam Centrum, Delft, Den Haag Centraal, Gouda, Utrecht Centraal, Schiphol Airport, Amsterdam Zuid, Schiphol Airport, Leiden Centraal, Schiphol Airport]"
train_7,"[Haarlem, Beverwijk, Haarlem, Heemstede-Aerdenhout, Haarlem, Amsterdam Sloterdijk, Amsterdam Centraal, Utrecht Centraal, Amersfoort, Zwolle, Assen]"
train_8,"[Sittard, Heerlen, Sittard, Heerlen, Sittard, Maastricht, Sittard, Roermond, Weert, Roermond, Weert, Eindhoven]"
train_9,"[Helmond, Eindhoven, Tilburg, Eindhoven, Weert, Roermond, Sittard, Heerlen, Sittard, Maastricht, Sittard, Heerlen]"
train_10,"[Rotterdam Blaak, Schiedam Centrum, Rotterdam Blaak, Dordrecht, Rotterdam Centraal, Dordrecht, Rotterdam Blaak, Schiedam Centrum, Rotterdam Blaak, Rotterdam Alexander, Gouda, Den Haag Centraal, Leiden Centraal, Den Haag Centraal, Leiden Centraal]"
train_11,"[Dordrecht, Breda, Dordrecht, Roosendaal, Vlissingen]"
train_12,"[Leeuwarden, Groningen, Assen, Groningen, Assen, Groningen, Leeuwarden, Heerenveen, Steenwijk]"
train_13,"[Heerlen, Sittard, Roermond, Weert, Eindhoven, Weert, Eindhoven, Helmond, Eindhoven, Tilburg, Breda, Dordrecht]"
train_14,"[Amsterdam Sloterdijk, Amsterdam Centraal, Utrecht Centraal, Ede-Wageningen, Utrecht Centraal, Hilversum, Utrecht Centraal, Amersfoort, Apeldoorn, Amersfoort]"
train_15,"[Almere Centrum, Amsterdam Centraal, Amsterdam Amstel, Almere Centrum, Lelystad Centrum, Almere Centrum, Hilversum, Almere Centrum, Hilversum, Utrecht Centraal]"
train_16,"[Heemstede-Aerdenhout, Leiden Centraal, Den Haag Laan v NOI, Delft, Schiedam Centrum, Rotterdam Blaak, Schiedam Centrum, Rotterdam Blaak, Dordrecht, Rotterdam Centraal, Dordrecht, Rotterdam Centraal, Dordrecht, Roosendaal]"
train_17,"[Heemstede-Aerdenhout, Leiden Centraal, Alphen a/d Rijn, Gouda, Den Haag Laan v NOI, Delft, Den Haag Laan v NOI, Leiden Centraal, Den Haag Laan v NOI, Gouda, Den Haag HS, Delft]"
train_18,"[Roosendaal, Etten-Leur, Roosendaal, Dordrecht, Rotterdam Blaak, Schiedam Centrum, Rotterdam Blaak, Schiedam Centrum, Delft, Den Haag HS, Delft, Den Haag Centraal, Gouda, Den Haag HS, Leiden Centraal]"
train_19,"[Roermond, Weert, Eindhoven, s-Hertogenbosch, Tilburg, Breda, Dordrecht, Breda, Etten-Leur, Breda, Dordrecht, Breda, Tilburg]"
train_20,"[Den Haag HS, Leiden Centraal, Schiphol Airport, Leiden Centraal, Schiphol Airport, Leiden Centraal, Den Haag Centraal, Leiden Centraal, Heemstede-Aerdenhout, Haarlem, Heemstede-Aerdenhout, Haarlem, Heemstede-Aerdenhout, Leiden Centraal, Alphen a/d Rijn, Gouda]"
score,2393.8089887640454
