train,stations
train_1,"[Tilburg, Eindhoven, Helmond, Venlo, Helmond, Eindhoven, s-Hertogenbosch, Tilburg, s-Hertogenbosch, Tilburg]"
train_2,"[Vlissingen, Roosendaal, Vlissingen]"
train_3,"[Almelo, Zwolle, Almelo, Hengelo, Almelo, Zwolle, Steenwijk]"
train_4,"[Oss, s-Hertogenbosch, Oss, s-Hertogenbosch, Eindhoven, Weert, Eindhoven, s-Hertogenbosch, Utrecht Centraal, Schiphol Airport, Amsterdam Zuid, Schiphol Airport]"
train_5,"[Ede-Wageningen, Arnhem Centraal, Ede-Wageningen, Utrecht Centraal, Hilversum, Almere Centrum, Amsterdam Amstel, Amsterdam Centraal, Amsterdam Amstel, Utrecht Centraal, Gouda]"
train_6,"[Gouda, Den Haag Laan v NOI, Gouda, Alphen a/d Rijn, Gouda, Den Haag HS, Gouda, Rotterdam Alexander, Gouda, Rotterdam Alexander, Rotterdam Centraal, Schiedam Centrum]"
train_7,"[Tilburg, Eindhoven, s-Hertogenbosch, Eindhoven, Weert, Eindhoven, Tilburg, s-Hertogenbosch, Eindhoven, Weert, Eindhoven]"
train_8,"[Amersfoort, Zwolle, Amersfoort, Apeldoorn, Zutphen, Apeldoorn, Deventer, Zwolle]"
train_9,"[Enschede, Hengelo, Almelo, Hengelo, Almelo, Deventer, Zutphen, Apeldoorn, Amersfoort, Zwolle]"
train_10,"[Zwolle, Almelo, Deventer, Zutphen, Apeldoorn, Amersfoort, Apeldoorn, Deventer, Zutphen, Dieren]"
train_11,"[s-Hertogenbosch, Utrecht Centraal, Amersfoort, Apeldoorn, Amersfoort, Apeldoorn, Zutphen, Deventer, Zutphen, Dieren, Zutphen]"
train_12,"[Utrecht Centraal, Schiphol Airport, Amsterdam Zuid, Amsterdam Amstel, Amsterdam Zuid, Schiphol Airport, Utrecht Centraal, Gouda, Den Haag HS, Leiden Centraal, Alphen a/d Rijn, Leiden Centraal]"
train_13,"[Vlissingen, Roosendaal, Dordrecht, Breda, Tilburg, Eindhoven, Tilburg, Breda]"
train_14,"[Hengelo, Almelo, Deventer, Almelo, Deventer, Zwolle, Almelo, Hengelo, Enschede, Hengelo]"
train_15,"[Venlo, Helmond, Venlo, Helmond, Eindhoven, Weert, Roermond, Sittard, Maastricht, Sittard]"
train_16,"[Gouda, Den Haag HS, Leiden Centraal, Alphen a/d Rijn, Utrecht Centraal, Amersfoort, Zwolle, Steenwijk, Heerenveen, Leeuwarden]"
train_17,"[Etten-Leur, Roosendaal, Dordrecht, Breda, Dordrecht, Breda, Etten-Leur, Breda, Etten-Leur, Roosendaal]"
train_18,"[Maastricht, Sittard, Maastricht, Sittard, Roermond, Weert, Eindhoven, s-Hertogenbosch, Utrecht Centraal, Amsterdam Amstel, Amsterdam Zuid]"
train_19,"[Roermond, Sittard, Heerlen, Sittard, Heerlen, Sittard, Roermond, Weert, Eindhoven, Tilburg, Breda, Tilburg]"
train_20,"[Groningen, Assen, Zwolle, Deventer, Zutphen, Deventer, Zutphen, Deventer, Apeldoorn, Zutphen, Dieren, Zutphen]"
score,854.7752808988762
