train,stations
train_1,"[Beverwijk, Castricum, Beverwijk, Zaandam, Beverwijk, Zaandam, Beverwijk, Haarlem, Beverwijk, Castricum]"
train_2,"[Rotterdam Centraal, Dordrecht, Breda, Etten-Leur, Breda, Tilburg, Eindhoven, Tilburg, Eindhoven, Tilburg, Breda, Dordrecht]"
train_3,"[Utrecht Centraal, Schiphol Airport, Utrecht Centraal, Ede-Wageningen, Arnhem Centraal, Dieren, Zutphen, Deventer, Almelo, Hengelo, Almelo]"
train_4,"[Den Haag HS, Leiden Centraal, Den Haag Centraal, Gouda, Rotterdam Alexander, Rotterdam Blaak, Dordrecht, Breda, Tilburg, Eindhoven, Helmond, Eindhoven, s-Hertogenbosch, Tilburg]"
train_5,"[Groningen, Assen, Zwolle, Amersfoort, Zwolle, Almelo, Hengelo]"
train_6,"[Deventer, Zutphen, Apeldoorn, Amersfoort, Zwolle, Steenwijk, Zwolle, Amersfoort]"
train_7,"[s-Hertogenbosch, Oss, s-Hertogenbosch, Oss, Nijmegen, Oss, s-Hertogenbosch, Eindhoven, Tilburg, Eindhoven, Weert, Eindhoven, Helmond]"
train_8,"[Rotterdam Blaak, Rotterdam Alexander, Rotterdam Centraal, Dordrecht, Rotterdam Blaak, Schiedam Centrum, Rotterdam Centraal, Dordrecht, Rotterdam Centraal, Rotterdam Alexander, Rotterdam Centraal, Dordrecht, Roosendaal]"
train_9,"[Castricum, Zaandam, Hoorn, Zaandam, Castricum, Alkmaar, Hoorn, Alkmaar, Den Helder]"
train_10,"[Enschede, Hengelo, Almelo, Deventer, Almelo, Zwolle, Almelo, Deventer]"
train_11,"[Den Haag Centraal, Gouda, Den Haag Laan v NOI, Leiden Centraal, Heemstede-Aerdenhout, Leiden Centraal, Den Haag Laan v NOI, Delft, Den Haag Laan v NOI, Delft, Den Haag Laan v NOI, Gouda, Rotterdam Alexander]"
train_12,"[Castricum, Zaandam, Castricum, Alkmaar, Castricum, Beverwijk, Zaandam, Castricum, Beverwijk, Castricum, Beverwijk, Haarlem, Heemstede-Aerdenhout, Leiden Centraal, Den Haag HS]"
train_13,"[Leiden Centraal, Den Haag Centraal, Gouda, Den Haag Centraal, Leiden Centraal, Alphen a/d Rijn, Gouda, Den Haag HS, Leiden Centraal, Den Haag Laan v NOI, Delft, Schiedam Centrum, Delft, Den Haag HS]"
train_14,"[Zutphen, Apeldoorn, Zutphen, Dieren, Zutphen, Apeldoorn, Zutphen, Deventer, Zwolle, Steenwijk, Heerenveen]"
train_15,"[Maastricht, Sittard, Maastricht, Sittard, Maastricht, Sittard, Heerlen, Sittard, Maastricht, Sittard, Roermond, Sittard]"
train_16,"[Weert, Roermond, Sittard, Heerlen, Sittard, Maastricht, Sittard, Roermond, Weert, Roermond, Sittard, Heerlen, Sittard]"
train_17,"[Leeuwarden, Groningen, Assen, Groningen, Assen, Zwolle, Steenwijk, Zwolle]"
train_18,"[Roermond, Weert, Eindhoven, Helmond, Eindhoven, s-Hertogenbosch, Utrecht Centraal, Gouda, Utrecht Centraal, Amsterdam Centraal, Almere Centrum]"
train_19,"[Den Haag Laan v NOI, Delft, Den Haag Laan v NOI, Leiden Centraal, Schiphol Airport, Amsterdam Zuid, Amsterdam Sloterdijk, Amsterdam Zuid, Amsterdam Amstel, Almere Centrum, Lelystad Centrum, Almere Centrum, Amsterdam Centraal]"
train_20,"[Almere Centrum, Amsterdam Amstel, Utrecht Centraal, Amsterdam Amstel, Almere Centrum, Hilversum, Utrecht Centraal, Amsterdam Amstel, Amsterdam Zuid, Schiphol Airport]"
score,2948.9662921348317
