train,stations
train_1,"[Delft, Den Haag HS, Leiden Centraal, Alphen a/d Rijn, Leiden Centraal, Alphen a/d Rijn, Utrecht Centraal, Hilversum, Amsterdam Amstel, Almere Centrum]"
train_2,"[Alkmaar, Hoorn, Alkmaar, Den Helder, Alkmaar, Hoorn, Alkmaar, Castricum]"
train_3,"[Dieren, Zutphen, Dieren, Arnhem Centraal, Dieren, Zutphen, Dieren, Arnhem Centraal, Nijmegen, Arnhem Centraal, Nijmegen, Arnhem Centraal, Dieren, Zutphen, Apeldoorn, Zutphen]"
train_4,"[Den Helder, Alkmaar, Den Helder, Alkmaar, Castricum, Alkmaar, Castricum, Zaandam, Hoorn]"
train_5,"[Rotterdam Blaak, Rotterdam Alexander, Gouda, Den Haag HS, Gouda, Alphen a/d Rijn, Leiden Centraal, Den Haag Laan v NOI, Delft, Schiedam Centrum, Delft, Den Haag HS, Delft, Schiedam Centrum, Rotterdam Blaak, Schiedam Centrum]"
train_6,"[Alkmaar, Hoorn, Alkmaar, Hoorn, Zaandam, Castricum, Alkmaar, Den Helder]"
train_7,"[Arnhem Centraal, Dieren, Zutphen, Apeldoorn, Zutphen, Apeldoorn, Deventer, Apeldoorn, Amersfoort, Apeldoorn, Deventer]"
train_8,"[Leiden Centraal, Den Haag Laan v NOI, Delft, Den Haag HS, Delft, Schiedam Centrum, Delft, Den Haag Centraal, Leiden Centraal, Den Haag HS, Delft, Den Haag HS, Delft, Den Haag Laan v NOI, Leiden Centraal, Heemstede-Aerdenhout, Leiden Centraal, Alphen a/d Rijn]"
train_9,"[Almere Centrum, Amsterdam Amstel, Amsterdam Zuid, Amsterdam Amstel, Amsterdam Centraal, Utrecht Centraal, Schiphol Airport, Utrecht Centraal, Amsterdam Centraal]"
train_10,"[Ede-Wageningen, Utrecht Centraal, Ede-Wageningen, Arnhem Centraal, Nijmegen, Oss, Nijmegen, Arnhem Centraal, Nijmegen, Arnhem Centraal, Nijmegen, Oss]"
train_11,"[Schiphol Airport, Amsterdam Zuid, Amsterdam Sloterdijk, Zaandam, Castricum, Beverwijk, Castricum, Beverwijk, Zaandam, Amsterdam Sloterdijk, Haarlem, Beverwijk, Castricum, Beverwijk]"
train_12,"[Amsterdam Zuid, Schiphol Airport, Utrecht Centraal, Schiphol Airport, Amsterdam Zuid, Schiphol Airport, Leiden Centraal, Den Haag Centraal, Gouda, Den Haag Laan v NOI, Delft, Den Haag HS]"
train_13,"[Roermond, Weert, Eindhoven, Helmond, Venlo, Helmond, Eindhoven, s-Hertogenbosch, Utrecht Centraal]"
train_14,"[Amsterdam Zuid, Schiphol Airport, Amsterdam Zuid, Amsterdam Sloterdijk, Amsterdam Zuid, Amsterdam Amstel, Almere Centrum, Lelystad Centrum, Almere Centrum, Amsterdam Centraal, Utrecht Centraal, Amsterdam Amstel]"
train_15,"[Ede-Wageningen, Utrecht Centraal, Amersfoort, Zwolle, Assen, Groningen, Leeuwarden]"
train_16,"[Den Haag Centraal, Leiden Centraal, Den Haag HS, Leiden Centraal, Den Haag Centraal, Delft, Den Haag HS, Leiden Centraal, Den Haag Laan v NOI, Gouda, Den Haag HS, Gouda]"
train_17,"[Alkmaar, Castricum, Alkmaar, Den Helder, Alkmaar, Hoorn, Zaandam, Hoorn]"
train_18,"[Heerenveen, Steenwijk, Zwolle, Assen, Zwolle, Assen]"
train_19,"[Roermond, Weert, Roermond, Sittard, Roermond, Weert, Eindhoven, Helmond, Eindhoven, s-Hertogenbosch, Oss, s-Hertogenbosch, Tilburg]"
train_20,"[Den Haag HS, Leiden Centraal, Den Haag Centraal, Leiden Centraal, Den Haag Laan v NOI, Delft, Den Haag Laan v NOI, Gouda, Den Haag Laan v NOI, Delft, Den Haag Centraal, Gouda]"
score,1948.3707865168544
