train,stations
train_1,"[Hilversum, Almere Centrum, Amsterdam Amstel, Hilversum, Utrecht Centraal, Amsterdam Centraal, Almere Centrum, Lelystad Centrum, Almere Centrum]"
train_2,"[Schiedam Centrum, Rotterdam Blaak, Rotterdam Alexander, Rotterdam Blaak, Dordrecht, Breda, Tilburg, Breda, Tilburg, s-Hertogenbosch, Eindhoven, Weert, Eindhoven]"
train_3,"[Dordrecht, Roosendaal, Etten-Leur, Breda, Etten-Leur, Roosendaal, Etten-Leur, Breda, Etten-Leur, Roosendaal, Vlissingen]"
train_4,"[Deventer, Apeldoorn, Amersfoort, Apeldoorn, Amersfoort, Apeldoorn, Deventer, Apeldoorn, Amersfoort, Apeldoorn]"
train_5,"[Den Haag HS, Delft, Den Haag Centraal, Delft, Den Haag Centraal, Leiden Centraal, Schiphol Airport, Utrecht Centraal, s-Hertogenbosch, Tilburg, s-Hertogenbosch]"
train_6,"[Zutphen, Deventer, Zutphen, Deventer, Zutphen, Deventer, Zutphen, Apeldoorn, Zutphen, Apeldoorn, Amersfoort]"
train_7,"[Utrecht Centraal, Gouda, Den Haag HS, Gouda, Rotterdam Alexander, Rotterdam Blaak, Rotterdam Alexander, Rotterdam Centraal, Schiedam Centrum, Rotterdam Blaak, Schiedam Centrum, Delft, Den Haag Laan v NOI, Gouda]"
train_8,"[s-Hertogenbosch, Tilburg, Breda, Tilburg, Eindhoven, Tilburg, s-Hertogenbosch, Oss, Nijmegen, Oss, s-Hertogenbosch, Tilburg]"
train_9,"[Hengelo, Almelo, Deventer, Zwolle, Assen, Groningen, Leeuwarden]"
train_10,"[Almelo, Hengelo, Enschede, Hengelo, Enschede, Hengelo, Almelo, Deventer, Zwolle, Deventer, Apeldoorn, Amersfoort, Utrecht Centraal]"
train_11,"[Dordrecht, Rotterdam Centraal, Rotterdam Alexander, Rotterdam Centraal, Rotterdam Alexander, Gouda, Den Haag Centraal, Leiden Centraal, Den Haag Laan v NOI, Gouda, Rotterdam Alexander, Gouda, Den Haag Centraal, Gouda]"
train_12,"[Steenwijk, Heerenveen, Steenwijk, Zwolle, Assen, Groningen, Leeuwarden, Heerenveen, Steenwijk]"
train_13,"[Dieren, Arnhem Centraal, Nijmegen, Arnhem Centraal, Ede-Wageningen, Utrecht Centraal, Amersfoort, Apeldoorn, Amersfoort, Utrecht Centraal, Hilversum]"
train_14,"[Nijmegen, Arnhem Centraal, Dieren, Zutphen, Deventer, Almelo, Deventer, Almelo, Hengelo, Enschede, Hengelo, Almelo, Deventer]"
train_15,"[Roermond, Weert, Eindhoven, Weert, Roermond, Weert, Roermond, Weert, Eindhoven, Helmond, Venlo]"
train_16,"[Den Helder, Alkmaar, Castricum, Alkmaar, Hoorn, Zaandam, Beverwijk, Castricum, Alkmaar, Hoorn]"
train_17,"[Breda, Etten-Leur, Breda, Etten-Leur, Breda, Dordrecht, Rotterdam Centraal, Rotterdam Alexander, Rotterdam Centraal, Schiedam Centrum, Rotterdam Blaak, Schiedam Centrum, Rotterdam Centraal, Dordrecht, Breda, Dordrecht]"
train_18,"[Den Helder, Alkmaar, Castricum, Zaandam, Amsterdam Sloterdijk, Haarlem, Heemstede-Aerdenhout, Haarlem, Beverwijk, Zaandam, Amsterdam Sloterdijk, Amsterdam Centraal, Almere Centrum, Amsterdam Centraal]"
train_19,"[Amsterdam Zuid, Amsterdam Amstel, Almere Centrum, Amsterdam Amstel, Almere Centrum, Amsterdam Centraal, Almere Centrum, Amsterdam Amstel, Utrecht Centraal]"
train_20,"[Amersfoort, Apeldoorn, Zutphen, Deventer, Zwolle, Almelo, Deventer, Almelo]"
score,3299.685393258427
