train,stations
train_1,"[Castricum, Alkmaar, Den Helder, Alkmaar, Hoorn, Zaandam, Amsterdam Sloterdijk, Amsterdam Centraal, Amsterdam Amstel, Almere Centrum]"
train_2,"[Steenwijk, Heerenveen, Leeuwarden, Heerenveen, Leeuwarden, Heerenveen, Leeuwarden, Groningen, Leeuwarden]"
train_3,"[s-Hertogenbosch, Oss, Nijmegen, Oss, s-Hertogenbosch, Tilburg, Eindhoven, Weert, Eindhoven, s-Hertogenbosch, Tilburg, Eindhoven]"
train_4,"[Venlo, Helmond, Eindhoven, Helmond, Venlo, Helmond, Eindhoven, Weert, Roermond, Sittard, Roermond]"
train_5,"[Oss, s-Hertogenbosch, Tilburg, Breda, Tilburg, Eindhoven, Tilburg, Eindhoven, Tilburg, s-Hertogenbosch, Utrecht Centraal]"
train_6,"[Zutphen, Dieren, Arnhem Centraal, Dieren, Arnhem Centraal, Dieren, Arnhem Centraal, Ede-Wageningen, Utrecht Centraal, Amersfoort, Utrecht Centraal, Amsterdam Centraal, Amsterdam Amstel, Amsterdam Zuid]"
train_7,"[Schiedam Centrum, Delft, Den Haag Laan v NOI, Gouda, Alphen a/d Rijn, Utrecht Centraal, Schiphol Airport, Utrecht Centraal, Amersfoort]"
train_8,"[Helmond, Eindhoven, Helmond, Venlo, Helmond, Eindhoven, Tilburg, s-Hertogenbosch, Oss, s-Hertogenbosch, Tilburg]"
train_9,"[Helmond, Eindhoven, Weert, Eindhoven, Helmond, Venlo, Helmond, Eindhoven, Helmond, Venlo]"
train_10,"[Delft, Den Haag HS, Leiden Centraal, Den Haag Centraal, Gouda, Den Haag HS, Delft, Den Haag HS, Leiden Centraal, Den Haag HS, Delft, Den Haag Laan v NOI, Gouda, Alphen a/d Rijn]"
train_11,"[Roermond, Weert, Roermond, Weert, Eindhoven, Weert, Eindhoven, s-Hertogenbosch, Oss, s-Hertogenbosch, Tilburg, Eindhoven]"
train_12,"[Leiden Centraal, Alphen a/d Rijn, Utrecht Centraal, Amsterdam Centraal, Utrecht Centraal, s-Hertogenbosch, Tilburg, Breda, Etten-Leur, Roosendaal]"
train_13,"[Den Haag Centraal, Leiden Centraal, Alphen a/d Rijn, Gouda, Utrecht Centraal, Amersfoort, Zwolle, Almelo, Deventer]"
train_14,"[Eindhoven, Helmond, Eindhoven, Tilburg, Eindhoven, Tilburg, Breda, Etten-Leur, Breda, Dordrecht, Rotterdam Centraal, Schiedam Centrum, Rotterdam Centraal, Schiedam Centrum, Delft, Den Haag Laan v NOI]"
train_15,"[Etten-Leur, Breda, Dordrecht, Breda, Tilburg, Breda, Etten-Leur, Roosendaal, Etten-Leur, Breda, Etten-Leur, Roosendaal, Etten-Leur, Roosendaal, Etten-Leur, Breda]"
train_16,"[Assen, Zwolle, Amersfoort, Apeldoorn, Zutphen, Dieren, Zutphen, Apeldoorn, Deventer, Apeldoorn]"
train_17,"[Groningen, Leeuwarden, Heerenveen, Steenwijk, Zwolle, Deventer, Apeldoorn, Deventer, Almelo]"
train_18,"[Helmond, Eindhoven, Tilburg, s-Hertogenbosch, Oss, Nijmegen, Arnhem Centraal, Dieren, Arnhem Centraal, Nijmegen, Arnhem Centraal, Dieren, Arnhem Centraal, Ede-Wageningen, Arnhem Centraal]"
train_19,"[Amsterdam Sloterdijk, Zaandam, Amsterdam Sloterdijk, Amsterdam Zuid, Amsterdam Amstel, Almere Centrum, Amsterdam Centraal, Utrecht Centraal, Ede-Wageningen, Arnhem Centraal, Dieren, Arnhem Centraal]"
train_20,"[Almelo, Hengelo, Almelo, Hengelo, Almelo, Deventer, Almelo, Deventer, Zwolle, Steenwijk, Heerenveen]"
score,1385.9325842696626
