train,stations
train_1,"[Groningen, Assen, Groningen, Assen, Groningen, Leeuwarden, Groningen, Leeuwarden]"
train_2,"[Apeldoorn, Zutphen, Apeldoorn, Zutphen, Apeldoorn, Amersfoort, Zwolle, Assen]"
train_3,"[s-Hertogenbosch, Tilburg, s-Hertogenbosch, Utrecht Centraal, Schiphol Airport, Leiden Centraal, Den Haag HS, Delft, Den Haag HS, Gouda, Alphen a/d Rijn]"
train_4,"[Zaandam, Castricum, Beverwijk, Zaandam, Beverwijk, Haarlem, Amsterdam Sloterdijk, Amsterdam Centraal, Amsterdam Amstel, Hilversum, Amsterdam Amstel]"
train_5,"[Schiphol Airport, Leiden Centraal, Heemstede-Aerdenhout, Leiden Centraal, Den Haag Laan v NOI, Leiden Centraal, Den Haag Laan v NOI, Delft, Den Haag Centraal, Delft, Den Haag HS, Leiden Centraal, Den Haag Laan v NOI, Leiden Centraal, Heemstede-Aerdenhout, Leiden Centraal]"
train_6,"[Groningen, Leeuwarden, Heerenveen, Steenwijk, Heerenveen, Leeuwarden, Heerenveen, Steenwijk, Zwolle]"
train_7,"[Den Haag HS, Leiden Centraal, Alphen a/d Rijn, Gouda, Utrecht Centraal, Ede-Wageningen, Utrecht Centraal, Alphen a/d Rijn, Gouda, Rotterdam Alexander, Rotterdam Centraal]"
train_8,"[Alkmaar, Den Helder, Alkmaar, Den Helder, Alkmaar, Hoorn]"
train_9,"[Lelystad Centrum, Almere Centrum, Hilversum, Almere Centrum, Amsterdam Amstel, Amsterdam Zuid, Amsterdam Sloterdijk, Zaandam, Castricum, Alkmaar, Hoorn]"
train_10,"[Roermond, Sittard, Heerlen, Sittard, Heerlen, Sittard, Heerlen, Sittard, Maastricht, Sittard, Roermond, Weert, Roermond]"
train_11,"[Ede-Wageningen, Utrecht Centraal, Amsterdam Centraal, Amsterdam Amstel, Amsterdam Zuid, Amsterdam Sloterdijk, Haarlem, Beverwijk, Haarlem, Beverwijk, Haarlem, Beverwijk]"
train_12,"[Leiden Centraal, Alphen a/d Rijn, Leiden Centraal, Den Haag Laan v NOI, Leiden Centraal, Alphen a/d Rijn, Leiden Centraal, Alphen a/d Rijn, Gouda, Den Haag Laan v NOI, Leiden Centraal, Heemstede-Aerdenhout, Haarlem, Beverwijk]"
train_13,"[Zaandam, Amsterdam Sloterdijk, Amsterdam Zuid, Schiphol Airport, Leiden Centraal, Heemstede-Aerdenhout, Leiden Centraal, Den Haag Centraal, Delft, Schiedam Centrum, Rotterdam Blaak, Rotterdam Alexander, Rotterdam Blaak, Schiedam Centrum, Rotterdam Blaak, Rotterdam Alexander, Rotterdam Blaak]"
train_14,"[Heemstede-Aerdenhout, Haarlem, Beverwijk, Haarlem, Heemstede-Aerdenhout, Haarlem, Heemstede-Aerdenhout, Leiden Centraal, Heemstede-Aerdenhout, Haarlem, Beverwijk, Haarlem, Heemstede-Aerdenhout, Haarlem, Beverwijk, Zaandam]"
train_15,"[Rotterdam Alexander, Gouda, Rotterdam Alexander, Gouda, Rotterdam Alexander, Rotterdam Centraal, Rotterdam Alexander, Rotterdam Centraal, Rotterdam Alexander, Rotterdam Centraal, Schiedam Centrum, Rotterdam Blaak, Schiedam Centrum, Rotterdam Centraal, Schiedam Centrum, Rotterdam Blaak, Dordrecht, Roosendaal, Etten-Leur]"
train_16,"[Utrecht Centraal, Gouda, Rotterdam Alexander, Rotterdam Blaak, Rotterdam Alexander, Rotterdam Centraal, Schiedam Centrum, Rotterdam Centraal, Dordrecht, Roosendaal, Dordrecht, Rotterdam Centraal, Schiedam Centrum, Rotterdam Blaak, Dordrecht]"
train_17,"[Castricum, Beverwijk, Zaandam, Hoorn, Alkmaar, Hoorn, Zaandam, Hoorn]"
train_18,"[Den Haag Laan v NOI, Leiden Centraal, Den Haag HS, Leiden Centraal, Heemstede-Aerdenhout, Haarlem, Heemstede-Aerdenhout, Leiden Centraal, Den Haag Centraal, Gouda, Utrecht Centraal, Amsterdam Amstel, Utrecht Centraal, Amsterdam Amstel]"
train_19,"[Amsterdam Centraal, Utrecht Centraal, Alphen a/d Rijn, Leiden Centraal, Heemstede-Aerdenhout, Leiden Centraal, Den Haag Centraal, Delft, Den Haag Centraal, Gouda, Alphen a/d Rijn]"
train_20,"[Lelystad Centrum, Almere Centrum, Hilversum, Utrecht Centraal, Hilversum, Amsterdam Amstel, Utrecht Centraal, Alphen a/d Rijn, Utrecht Centraal]"
score,1867.3707865168544
