train,stations
train_1,"[Amsterdam Sloterdijk, Zaandam, Hoorn, Zaandam, Amsterdam Sloterdijk, Zaandam, Castricum, Beverwijk, Haarlem, Amsterdam Sloterdijk, Haarlem, Beverwijk, Castricum, Beverwijk]"
train_2,"[Hengelo, Almelo, Zwolle, Assen, Zwolle, Assen]"
train_3,"[Utrecht Centraal, Ede-Wageningen, Utrecht Centraal, Hilversum, Utrecht Centraal, Amsterdam Centraal, Amsterdam Sloterdijk, Amsterdam Zuid, Amsterdam Amstel, Amsterdam Centraal, Utrecht Centraal]"
train_4,"[Den Haag Centraal, Delft, Den Haag Centraal, Leiden Centraal, Alphen a/d Rijn, Gouda, Alphen a/d Rijn, Gouda, Utrecht Centraal, Amersfoort, Utrecht Centraal, Amersfoort]"
train_5,"[Heemstede-Aerdenhout, Leiden Centraal, Den Haag Laan v NOI, Gouda, Alphen a/d Rijn, Gouda, Alphen a/d Rijn, Gouda, Alphen a/d Rijn, Leiden Centraal, Den Haag HS]"
train_6,"[Hilversum, Utrecht Centraal, Amsterdam Amstel, Amsterdam Zuid, Amsterdam Amstel, Hilversum, Amsterdam Amstel, Utrecht Centraal, Gouda, Rotterdam Alexander, Rotterdam Centraal, Schiedam Centrum]"
train_7,"[Heerenveen, Steenwijk, Zwolle, Steenwijk, Zwolle, Almelo, Deventer, Apeldoorn, Deventer]"
train_8,"[Rotterdam Centraal, Schiedam Centrum, Rotterdam Centraal, Rotterdam Alexander, Rotterdam Centraal, Schiedam Centrum, Rotterdam Blaak, Dordrecht, Rotterdam Blaak, Dordrecht, Rotterdam Blaak, Schiedam Centrum, Rotterdam Blaak, Dordrecht, Rotterdam Centraal, Rotterdam Alexander, Rotterdam Blaak, Rotterdam Alexander]"
train_9,"[Amsterdam Amstel, Almere Centrum, Lelystad Centrum, Almere Centrum, Lelystad Centrum, Almere Centrum, Amsterdam Amstel, Almere Centrum, Amsterdam Centraal, Amsterdam Amstel]"
train_10,"[Beverwijk, Haarlem, Beverwijk, Castricum, Beverwijk, Castricum, Beverwijk, Castricum, Alkmaar, Den Helder, Alkmaar]"
train_11,"[Hoorn, Zaandam, Amsterdam Sloterdijk, Zaandam, Amsterdam Sloterdijk, Amsterdam Zuid, Schiphol Airport, Leiden Centraal, Schiphol Airport, Leiden Centraal, Den Haag Centraal, Gouda, Alphen a/d Rijn, Gouda]"
train_12,"[Dordrecht, Breda, Dordrecht, Breda, Tilburg, Breda, Tilburg, Breda, Dordrecht, Breda, Etten-Leur, Breda, Etten-Leur, Breda, Etten-Leur]"
train_13,"[Den Haag HS, Gouda, Den Haag HS, Leiden Centraal, Heemstede-Aerdenhout, Leiden Centraal, Den Haag Centraal, Leiden Centraal, Den Haag Laan v NOI, Gouda, Rotterdam Alexander, Rotterdam Centraal, Rotterdam Alexander, Rotterdam Blaak]"
train_14,"[Hilversum, Amsterdam Amstel, Utrecht Centraal, Schiphol Airport, Leiden Centraal, Den Haag Laan v NOI, Leiden Centraal, Den Haag Laan v NOI, Gouda, Rotterdam Alexander, Gouda]"
train_15,"[Rotterdam Centraal, Dordrecht, Rotterdam Blaak, Rotterdam Alexander, Rotterdam Blaak, Rotterdam Alexander, Rotterdam Blaak, Schiedam Centrum, Rotterdam Centraal, Schiedam Centrum, Rotterdam Centraal, Schiedam Centrum, Rotterdam Blaak, Dordrecht, Breda, Tilburg, s-Hertogenbosch]"
train_16,"[Amsterdam Zuid, Amsterdam Amstel, Amsterdam Zuid, Schiphol Airport, Utrecht Centraal, Ede-Wageningen, Arnhem Centraal, Ede-Wageningen, Arnhem Centraal, Ede-Wageningen, Arnhem Centraal, Dieren, Arnhem Centraal, Dieren, Zutphen]"
train_17,"[Heerenveen, Steenwijk, Heerenveen, Steenwijk, Zwolle, Steenwijk, Zwolle, Amersfoort, Apeldoorn]"
train_18,"[Oss, Nijmegen, Arnhem Centraal, Nijmegen, Oss, Nijmegen, Arnhem Centraal, Ede-Wageningen, Arnhem Centraal, Ede-Wageningen, Arnhem Centraal, Dieren, Zutphen, Dieren, Arnhem Centraal, Dieren]"
train_19,"[Hengelo, Almelo, Deventer, Zwolle, Deventer, Zutphen, Apeldoorn, Amersfoort, Apeldoorn]"
train_20,"[Oss, Nijmegen, Arnhem Centraal, Ede-Wageningen, Utrecht Centraal, Hilversum, Almere Centrum, Hilversum, Utrecht Centraal, Schiphol Airport]"
score,1734.0112359550558
