train,stations
train_1,"[Dieren, Arnhem Centraal, Nijmegen, Arnhem Centraal, Nijmegen, Oss, s-Hertogenbosch, Utrecht Centraal, Amersfoort, Apeldoorn, Zutphen, Deventer]"
train_2,"[Venlo, Helmond, Venlo, Helmond, Eindhoven, Weert, Roermond, Weert, Roermond, Sittard]"
train_3,"[Ede-Wageningen, Utrecht Centraal, Alphen a/d Rijn, Leiden Centraal, Den Haag Centraal, Leiden Centraal, Den Haag Laan v NOI, Leiden Centraal, Schiphol Airport, Utrecht Centraal]"
train_4,"[Den Haag Centraal, Gouda, Utrecht Centraal, Alphen a/d Rijn, Leiden Centraal, Alphen a/d Rijn, Leiden Centraal, Den Haag HS, Gouda, Den Haag Centraal, Leiden Centraal, Den Haag Laan v NOI]"
train_5,"[Eindhoven, s-Hertogenbosch, Oss, s-Hertogenbosch, Tilburg, Breda, Etten-Leur, Roosendaal, Etten-Leur, Breda, Tilburg, s-Hertogenbosch, Oss, Nijmegen, Oss]"
train_6,"[Gouda, Den Haag Laan v NOI, Delft, Den Haag Centraal, Delft, Den Haag HS, Gouda, Den Haag Laan v NOI, Leiden Centraal, Alphen a/d Rijn, Utrecht Centraal]"
train_7,"[Beverwijk, Haarlem, Beverwijk, Zaandam, Castricum, Zaandam, Hoorn, Zaandam, Hoorn]"
train_8,"[Den Haag HS, Leiden Centraal, Den Haag Laan v NOI, Delft, Den Haag Laan v NOI, Leiden Centraal, Alphen a/d Rijn, Leiden Centraal, Den Haag Laan v NOI, Leiden Centraal, Heemstede-Aerdenhout, Leiden Centraal, Den Haag HS, Leiden Centraal, Heemstede-Aerdenhout, Haarlem]"
train_9,"[s-Hertogenbosch, Utrecht Centraal, Amersfoort, Zwolle, Steenwijk, Heerenveen, Leeuwarden, Heerenveen, Steenwijk, Heerenveen]"
train_10,"[Amsterdam Amstel, Utrecht Centraal, s-Hertogenbosch, Utrecht Centraal, Amsterdam Amstel, Amsterdam Centraal, Amsterdam Sloterdijk, Zaandam, Beverwijk, Castricum, Zaandam]"
train_11,"[Hengelo, Enschede, Hengelo, Almelo, Zwolle, Steenwijk, Heerenveen, Steenwijk, Zwolle]"
train_12,"[Heerenveen, Steenwijk, Heerenveen, Steenwijk, Zwolle, Amersfoort, Utrecht Centraal, Amsterdam Amstel, Amsterdam Zuid, Amsterdam Amstel, Amsterdam Zuid, Schiphol Airport]"
train_13,"[Almelo, Deventer, Zwolle, Deventer, Apeldoorn, Deventer, Zwolle, Assen, Groningen]"
train_14,"[Amsterdam Sloterdijk, Amsterdam Zuid, Schiphol Airport, Leiden Centraal, Alphen a/d Rijn, Leiden Centraal, Alphen a/d Rijn, Gouda, Den Haag Centraal, Delft, Schiedam Centrum, Delft, Schiedam Centrum, Rotterdam Centraal, Schiedam Centrum, Rotterdam Centraal]"
train_15,"[Heerenveen, Steenwijk, Zwolle, Assen, Zwolle, Almelo, Hengelo]"
train_16,"[Dieren, Arnhem Centraal, Dieren, Zutphen, Dieren, Arnhem Centraal, Ede-Wageningen, Arnhem Centraal, Ede-Wageningen, Utrecht Centraal, Ede-Wageningen, Arnhem Centraal, Ede-Wageningen, Utrecht Centraal]"
train_17,"[Deventer, Almelo, Hengelo, Enschede, Hengelo, Almelo, Hengelo, Enschede, Hengelo, Almelo, Hengelo, Almelo, Hengelo, Enschede, Hengelo, Enschede, Hengelo, Almelo, Hengelo]"
train_18,"[Dieren, Arnhem Centraal, Nijmegen, Arnhem Centraal, Nijmegen, Arnhem Centraal, Dieren, Zutphen, Dieren, Arnhem Centraal, Nijmegen, Oss, s-Hertogenbosch, Eindhoven, Helmond]"
train_19,"[Amersfoort, Utrecht Centraal, Amsterdam Centraal, Amsterdam Sloterdijk, Amsterdam Zuid, Amsterdam Sloterdijk, Amsterdam Centraal, Utrecht Centraal, Amsterdam Centraal, Amsterdam Amstel, Amsterdam Centraal]"
train_20,"[Rotterdam Alexander, Rotterdam Blaak, Rotterdam Alexander, Gouda, Alphen a/d Rijn, Utrecht Centraal, Gouda, Alphen a/d Rijn, Gouda, Den Haag Centraal, Delft, Den Haag Laan v NOI]"
score,2269.4494382022467
