train,stations
train_1,"[Dordrecht, Roosendaal, Dordrecht, Rotterdam Centraal, Rotterdam Alexander, Gouda, Rotterdam Alexander, Gouda, Den Haag Centraal, Delft, Den Haag HS, Delft, Den Haag Laan v NOI, Delft]"
train_2,"[Hengelo, Almelo, Deventer, Zwolle, Deventer, Zutphen, Dieren, Arnhem Centraal, Dieren, Arnhem Centraal, Ede-Wageningen, Arnhem Centraal, Dieren]"
train_3,"[Vlissingen, Roosendaal, Vlissingen]"
train_4,"[Zutphen, Deventer, Almelo, Hengelo, Enschede, Hengelo, Almelo, Zwolle, Steenwijk, Zwolle]"
train_5,"[Alkmaar, Castricum, Alkmaar, Castricum, Alkmaar, Castricum, Beverwijk, Haarlem, Amsterdam Sloterdijk, Amsterdam Centraal, Amsterdam Amstel, Amsterdam Zuid, Schiphol Airport, Utrecht Centraal, Hilversum]"
train_6,"[Dieren, Arnhem Centraal, Nijmegen, Oss, s-Hertogenbosch, Eindhoven, Helmond, Eindhoven, s-Hertogenbosch, Eindhoven, Weert, Roermond, Sittard]"
train_7,"[Groningen, Assen, Groningen, Leeuwarden, Groningen, Leeuwarden, Groningen]"
train_8,"[Maastricht, Sittard, Heerlen, Sittard, Maastricht, Sittard, Maastricht, Sittard, Heerlen, Sittard, Heerlen, Sittard]"
train_9,"[Hoorn, Alkmaar, Castricum, Beverwijk, Zaandam, Castricum, Zaandam, Amsterdam Sloterdijk, Haarlem, Beverwijk, Castricum, Alkmaar]"
train_10,"[Leiden Centraal, Alphen a/d Rijn, Utrecht Centraal, s-Hertogenbosch, Eindhoven, Tilburg, Breda, Dordrecht, Breda, Etten-Leur, Breda, Etten-Leur]"
train_11,"[Vlissingen, Roosendaal, Etten-Leur, Breda, Dordrecht, Rotterdam Centraal, Rotterdam Alexander, Gouda, Alphen a/d Rijn, Gouda]"
train_12,"[Gouda, Den Haag Laan v NOI, Delft, Den Haag Laan v NOI, Delft, Den Haag Laan v NOI, Gouda, Den Haag HS, Delft, Schiedam Centrum, Rotterdam Blaak, Schiedam Centrum, Rotterdam Centraal, Rotterdam Alexander]"
train_13,"[Beverwijk, Zaandam, Beverwijk, Zaandam, Hoorn, Zaandam, Hoorn, Zaandam]"
train_14,"[Rotterdam Blaak, Dordrecht, Roosendaal, Vlissingen, Roosendaal, Etten-Leur]"
train_15,"[Amersfoort, Zwolle, Deventer, Apeldoorn, Amersfoort, Utrecht Centraal, Hilversum, Amsterdam Amstel, Amsterdam Zuid, Amsterdam Sloterdijk]"
train_16,"[Groningen, Assen, Groningen, Leeuwarden, Heerenveen, Steenwijk, Heerenveen, Leeuwarden, Heerenveen, Leeuwarden, Heerenveen]"
train_17,"[Enschede, Hengelo, Enschede, Hengelo, Enschede, Hengelo, Almelo, Deventer, Apeldoorn, Zutphen, Apeldoorn, Zutphen, Dieren, Arnhem Centraal, Ede-Wageningen]"
train_18,"[Etten-Leur, Roosendaal, Dordrecht, Rotterdam Centraal, Schiedam Centrum, Rotterdam Blaak, Dordrecht, Breda, Etten-Leur, Roosendaal, Dordrecht, Roosendaal, Etten-Leur]"
train_19,"[Amsterdam Sloterdijk, Zaandam, Hoorn, Zaandam, Beverwijk, Castricum, Zaandam, Beverwijk, Haarlem, Heemstede-Aerdenhout, Haarlem, Beverwijk]"
train_20,"[Steenwijk, Heerenveen, Leeuwarden, Heerenveen, Steenwijk, Zwolle, Deventer, Apeldoorn, Amersfoort, Zwolle]"
score,2584.52808988764
