train,stations
train_1,"[Amsterdam Amstel, Utrecht Centraal, Alphen a/d Rijn, Leiden Centraal, Den Haag Laan v NOI, Gouda, Alphen a/d Rijn, Leiden Centraal, Schiphol Airport, Leiden Centraal, Heemstede-Aerdenhout]"
train_2,"[s-Hertogenbosch, Oss, s-Hertogenbosch, Tilburg, Eindhoven, s-Hertogenbosch, Tilburg, s-Hertogenbosch, Utrecht Centraal, Amsterdam Centraal, Amsterdam Sloterdijk, Zaandam]"
train_3,"[Apeldoorn, Amersfoort, Zwolle, Deventer, Zutphen, Apeldoorn, Zutphen, Deventer, Zwolle]"
train_4,"[Oss, s-Hertogenbosch, Utrecht Centraal, Hilversum, Amsterdam Amstel, Amsterdam Zuid, Amsterdam Sloterdijk, Amsterdam Centraal, Utrecht Centraal, Hilversum, Utrecht Centraal]"
train_5,"[Den Helder, Alkmaar, Den Helder, Alkmaar, Castricum, Zaandam, Beverwijk, Zaandam]"
train_6,"[Beverwijk, Castricum, Zaandam, Amsterdam Sloterdijk, Zaandam, Amsterdam Sloterdijk, Amsterdam Centraal, Amsterdam Sloterdijk, Zaandam, Hoorn, Zaandam, Hoorn, Alkmaar, Castricum]"
train_7,"[Den Haag Laan v NOI, Delft, Den Haag HS, Leiden Centraal, Den Haag Centraal, Delft, Den Haag HS, Delft, Schiedam Centrum, Rotterdam Blaak, Schiedam Centrum, Delft, Den Haag HS, Delft, Den Haag HS, Leiden Centraal, Heemstede-Aerdenhout, Haarlem, Amsterdam Sloterdijk]"
train_8,"[Amsterdam Centraal, Amsterdam Sloterdijk, Amsterdam Zuid, Amsterdam Sloterdijk, Amsterdam Zuid, Amsterdam Sloterdijk, Haarlem, Amsterdam Sloterdijk, Haarlem, Amsterdam Sloterdijk, Amsterdam Zuid, Schiphol Airport, Leiden Centraal, Den Haag Laan v NOI, Leiden Centraal]"
train_9,"[Amsterdam Sloterdijk, Amsterdam Centraal, Amsterdam Sloterdijk, Amsterdam Zuid, Amsterdam Sloterdijk, Amsterdam Centraal, Almere Centrum, Hilversum, Amsterdam Amstel, Almere Centrum, Amsterdam Amstel]"
train_10,"[Weert, Roermond, Weert, Roermond, Sittard, Heerlen, Sittard, Heerlen, Sittard, Maastricht, Sittard, Maastricht, Sittard]"
train_11,"[Breda, Etten-Leur, Roosendaal, Vlissingen, Roosendaal, Dordrecht]"
train_12,"[Heemstede-Aerdenhout, Leiden Centraal, Schiphol Airport, Leiden Centraal, Den Haag Centraal, Delft, Den Haag Centraal, Delft, Den Haag Centraal, Delft, Den Haag Laan v NOI, Gouda, Rotterdam Alexander]"
train_13,"[s-Hertogenbosch, Utrecht Centraal, Gouda, Den Haag HS, Gouda, Rotterdam Alexander, Gouda, Den Haag Centraal, Leiden Centraal, Alphen a/d Rijn, Leiden Centraal, Heemstede-Aerdenhout]"
train_14,"[Lelystad Centrum, Almere Centrum, Amsterdam Amstel, Amsterdam Centraal, Amsterdam Sloterdijk, Amsterdam Centraal, Amsterdam Sloterdijk, Zaandam, Hoorn, Alkmaar, Castricum, Beverwijk, Haarlem, Heemstede-Aerdenhout, Haarlem]"
train_15,"[Etten-Leur, Roosendaal, Vlissingen, Roosendaal, Dordrecht, Rotterdam Blaak]"
train_16,"[Dordrecht, Breda, Dordrecht, Breda, Tilburg, s-Hertogenbosch, Utrecht Centraal, Ede-Wageningen, Utrecht Centraal]"
train_17,"[Heemstede-Aerdenhout, Leiden Centraal, Den Haag Laan v NOI, Leiden Centraal, Schiphol Airport, Utrecht Centraal, Hilversum, Almere Centrum, Hilversum, Amsterdam Amstel]"
train_18,"[Den Helder, Alkmaar, Den Helder, Alkmaar, Den Helder]"
train_19,"[Alkmaar, Den Helder, Alkmaar, Castricum, Alkmaar, Castricum, Beverwijk, Zaandam, Beverwijk]"
train_20,"[s-Hertogenbosch, Tilburg, s-Hertogenbosch, Utrecht Centraal, Alphen a/d Rijn, Leiden Centraal, Den Haag Laan v NOI, Delft, Schiedam Centrum, Delft, Den Haag Laan v NOI, Leiden Centraal, Schiphol Airport, Amsterdam Zuid]"
score,1827.3707865168544
