train,stations
train_1,"[Rotterdam Alexander, Rotterdam Blaak, Dordrecht, Rotterdam Centraal, Dordrecht, Roosendaal, Vlissingen]"
train_2,"[Assen, Groningen, Assen, Groningen, Leeuwarden, Groningen, Assen, Zwolle]"
train_3,"[Zaandam, Hoorn, Alkmaar, Den Helder, Alkmaar, Castricum, Zaandam, Amsterdam Sloterdijk, Amsterdam Zuid, Amsterdam Amstel]"
train_4,"[Amsterdam Sloterdijk, Zaandam, Beverwijk, Castricum, Alkmaar, Den Helder, Alkmaar, Den Helder]"
train_5,"[Hilversum, Amsterdam Amstel, Hilversum, Almere Centrum, Lelystad Centrum, Almere Centrum, Amsterdam Amstel, Utrecht Centraal]"
train_6,"[Maastricht, Sittard, Roermond, Sittard, Heerlen, Sittard, Roermond, Sittard, Maastricht, Sittard, Maastricht, Sittard]"
train_7,"[Leiden Centraal, Den Haag Laan v NOI, Leiden Centraal, Den Haag HS, Delft, Schiedam Centrum, Rotterdam Blaak, Schiedam Centrum, Rotterdam Blaak, Schiedam Centrum, Delft, Den Haag Centraal, Leiden Centraal, Heemstede-Aerdenhout, Haarlem, Amsterdam Sloterdijk, Haarlem, Amsterdam Sloterdijk]"
train_8,"[Leiden Centraal, Schiphol Airport, Utrecht Centraal, Amsterdam Amstel, Hilversum, Almere Centrum, Lelystad Centrum, Almere Centrum, Amsterdam Centraal]"
train_9,"[Roosendaal, Vlissingen, Roosendaal]"
train_10,"[Heerenveen, Steenwijk, Heerenveen, Steenwijk, Zwolle, Amersfoort, Zwolle, Deventer]"
train_11,"[Dieren, Zutphen, Dieren, Zutphen, Dieren, Zutphen, Apeldoorn, Amersfoort, Zwolle, Assen]"
train_12,"[Oss, s-Hertogenbosch, Eindhoven, s-Hertogenbosch, Oss, s-Hertogenbosch, Utrecht Centraal, Amersfoort, Apeldoorn, Amersfoort]"
train_13,"[Den Haag HS, Delft, Den Haag Laan v NOI, Delft, Den Haag Laan v NOI, Gouda, Alphen a/d Rijn, Utrecht Centraal, Amersfoort, Zwolle]"
train_14,"[Roermond, Weert, Eindhoven, Helmond, Eindhoven, s-Hertogenbosch, Oss, Nijmegen, Arnhem Centraal, Ede-Wageningen, Arnhem Centraal, Dieren, Arnhem Centraal, Dieren, Arnhem Centraal]"
train_15,"[Assen, Groningen, Leeuwarden, Heerenveen, Steenwijk, Heerenveen, Steenwijk, Zwolle, Steenwijk, Heerenveen]"
train_16,"[Etten-Leur, Breda, Dordrecht, Roosendaal, Dordrecht, Rotterdam Blaak, Rotterdam Alexander, Gouda, Alphen a/d Rijn, Utrecht Centraal, s-Hertogenbosch]"
train_17,"[Sittard, Heerlen, Sittard, Heerlen, Sittard, Heerlen, Sittard, Heerlen, Sittard, Heerlen, Sittard, Roermond, Weert]"
train_18,"[Alkmaar, Castricum, Beverwijk, Castricum, Alkmaar, Den Helder, Alkmaar, Hoorn, Alkmaar]"
train_19,"[Gouda, Den Haag HS, Leiden Centraal, Schiphol Airport, Utrecht Centraal, Amsterdam Amstel, Amsterdam Centraal, Amsterdam Sloterdijk, Amsterdam Centraal, Almere Centrum, Hilversum]"
train_20,"[Roosendaal, Etten-Leur, Breda, Dordrecht, Roosendaal, Vlissingen]"
score,2495.8089887640454
