train,stations
train_1,"[Maastricht, Sittard, Heerlen, Sittard, Heerlen, Sittard, Heerlen, Sittard, Roermond, Weert, Eindhoven, Helmond, Eindhoven, Helmond]"
train_2,"[Oss, Nijmegen, Oss, Nijmegen, Oss, s-Hertogenbosch, Eindhoven, s-Hertogenbosch, Utrecht Centraal, Amersfoort]"
train_3,"[Tilburg, Breda, Tilburg, Eindhoven, Tilburg, Breda, Dordrecht, Rotterdam Blaak, Dordrecht, Roosendaal, Etten-Leur, Roosendaal]"
train_4,"[Amsterdam Centraal, Amsterdam Sloterdijk, Haarlem, Heemstede-Aerdenhout, Leiden Centraal, Den Haag Laan v NOI, Gouda, Den Haag HS, Leiden Centraal, Den Haag HS, Gouda, Den Haag Laan v NOI, Leiden Centraal]"
train_5,"[Gouda, Rotterdam Alexander, Rotterdam Blaak, Dordrecht, Roosendaal, Dordrecht, Roosendaal, Etten-Leur, Breda, Dordrecht, Breda, Dordrecht]"
train_6,"[Steenwijk, Heerenveen, Steenwijk, Zwolle, Steenwijk, Zwolle, Assen, Groningen]"
train_7,"[Maastricht, Sittard, Maastricht, Sittard, Maastricht, Sittard, Heerlen, Sittard, Maastricht, Sittard, Roermond, Weert, Roermond]"
train_8,"[Schiedam Centrum, Delft, Schiedam Centrum, Rotterdam Centraal, Schiedam Centrum, Rotterdam Blaak, Dordrecht, Rotterdam Blaak, Dordrecht, Rotterdam Centraal, Rotterdam Alexander, Rotterdam Blaak, Rotterdam Alexander, Gouda, Den Haag HS, Delft, Schiedam Centrum, Rotterdam Centraal, Schiedam Centrum]"
train_9,"[Venlo, Helmond, Eindhoven, Helmond, Eindhoven, Tilburg, Eindhoven, Helmond, Eindhoven, Helmond, Eindhoven, Weert, Roermond]"
train_10,"[s-Hertogenbosch, Eindhoven, Weert, Eindhoven, Helmond, Eindhoven, s-Hertogenbosch, Eindhoven, s-Hertogenbosch, Oss, s-Hertogenbosch, Oss, Nijmegen]"
train_11,"[Eindhoven, Weert, Roermond, Sittard, Roermond, Sittard, Roermond, Weert, Roermond, Weert, Eindhoven, Tilburg]"
train_12,"[Den Helder, Alkmaar, Den Helder, Alkmaar, Castricum, Zaandam, Amsterdam Sloterdijk, Haarlem, Heemstede-Aerdenhout, Haarlem, Beverwijk]"
train_13,"[Sittard, Maastricht, Sittard, Roermond, Weert, Eindhoven, s-Hertogenbosch, Eindhoven, Weert, Eindhoven, Weert]"
train_14,"[Rotterdam Alexander, Rotterdam Centraal, Rotterdam Alexander, Gouda, Den Haag HS, Leiden Centraal, Den Haag HS, Leiden Centraal, Alphen a/d Rijn, Utrecht Centraal, Gouda, Alphen a/d Rijn]"
train_15,"[Schiedam Centrum, Delft, Schiedam Centrum, Rotterdam Blaak, Rotterdam Alexander, Gouda, Den Haag Laan v NOI, Delft, Schiedam Centrum, Delft, Schiedam Centrum, Delft, Den Haag Centraal, Delft, Schiedam Centrum, Rotterdam Blaak, Dordrecht]"
train_16,"[Dieren, Zutphen, Deventer, Almelo, Zwolle, Amersfoort, Apeldoorn, Amersfoort]"
train_17,"[Helmond, Eindhoven, Weert, Eindhoven, Weert, Eindhoven, Tilburg, s-Hertogenbosch, Tilburg, Breda, Dordrecht, Rotterdam Blaak]"
train_18,"[Almere Centrum, Hilversum, Almere Centrum, Hilversum, Almere Centrum, Amsterdam Centraal, Almere Centrum, Lelystad Centrum, Almere Centrum]"
train_19,"[Heerlen, Sittard, Maastricht, Sittard, Maastricht, Sittard, Maastricht, Sittard, Heerlen, Sittard, Heerlen, Sittard]"
train_20,"[Sittard, Heerlen, Sittard, Roermond, Sittard, Maastricht, Sittard, Roermond, Sittard, Heerlen, Sittard, Heerlen]"
score,1312.5730337078649
