train,stations
train_1,"[Heerenveen, Leeuwarden, Heerenveen, Leeuwarden, Groningen, Assen, Groningen, Leeuwarden, Heerenveen]"
train_2,"[Heemstede-Aerdenhout, Haarlem, Amsterdam Sloterdijk, Amsterdam Zuid, Schiphol Airport, Utrecht Centraal, s-Hertogenbosch, Tilburg, s-Hertogenbosch, Eindhoven, s-Hertogenbosch, Oss]"
train_3,"[Den Haag Centraal, Delft, Schiedam Centrum, Rotterdam Centraal, Dordrecht, Roosendaal, Vlissingen]"
train_4,"[Hoorn, Zaandam, Amsterdam Sloterdijk, Haarlem, Amsterdam Sloterdijk, Amsterdam Centraal, Utrecht Centraal, Hilversum, Almere Centrum, Lelystad Centrum, Almere Centrum]"
train_5,"[Leiden Centraal, Den Haag Laan v NOI, Delft, Den Haag HS, Delft, Den Haag HS, Leiden Centraal, Den Haag HS, Gouda, Den Haag HS, Gouda, Den Haag HS, Gouda]"
train_6,"[Hoorn, Zaandam, Hoorn, Zaandam, Castricum, Alkmaar, Den Helder, Alkmaar]"
train_7,"[Heerlen, Sittard, Roermond, Weert, Eindhoven, Weert, Roermond, Weert, Eindhoven, Weert, Roermond, Weert]"
train_8,"[Dordrecht, Rotterdam Blaak, Rotterdam Alexander, Rotterdam Centraal, Dordrecht, Roosendaal, Vlissingen]"
train_9,"[Heerlen, Sittard, Maastricht, Sittard, Maastricht, Sittard, Heerlen, Sittard, Roermond, Weert, Eindhoven, Weert]"
train_10,"[Rotterdam Alexander, Rotterdam Centraal, Schiedam Centrum, Rotterdam Blaak, Rotterdam Alexander, Rotterdam Centraal, Schiedam Centrum, Rotterdam Centraal, Dordrecht, Rotterdam Blaak, Dordrecht, Roosendaal]"
train_11,"[Rotterdam Blaak, Dordrecht, Rotterdam Blaak, Rotterdam Alexander, Gouda, Den Haag Centraal, Leiden Centraal, Schiphol Airport, Leiden Centraal, Den Haag HS, Leiden Centraal, Den Haag Laan v NOI, Leiden Centraal, Den Haag Centraal, Delft]"
train_12,"[Beverwijk, Haarlem, Heemstede-Aerdenhout, Haarlem, Amsterdam Sloterdijk, Haarlem, Heemstede-Aerdenhout, Leiden Centraal, Alphen a/d Rijn, Leiden Centraal, Den Haag Centraal, Delft, Schiedam Centrum, Rotterdam Centraal, Rotterdam Alexander, Gouda]"
train_13,"[Den Haag Laan v NOI, Gouda, Den Haag Laan v NOI, Gouda, Utrecht Centraal, Amersfoort, Zwolle]"
train_14,"[Schiedam Centrum, Delft, Den Haag Centraal, Gouda, Den Haag Laan v NOI, Gouda, Utrecht Centraal, Ede-Wageningen, Utrecht Centraal, Hilversum]"
train_15,"[Amsterdam Centraal, Amsterdam Sloterdijk, Amsterdam Centraal, Amsterdam Amstel, Almere Centrum, Lelystad Centrum, Almere Centrum, Amsterdam Amstel, Hilversum, Utrecht Centraal, Amsterdam Centraal]"
train_16,"[Steenwijk, Zwolle, Amersfoort, Utrecht Centraal, Alphen a/d Rijn, Gouda, Den Haag Centraal, Gouda]"
train_17,"[Heerlen, Sittard, Maastricht, Sittard, Heerlen, Sittard, Heerlen, Sittard, Maastricht, Sittard, Heerlen, Sittard]"
train_18,"[Zwolle, Almelo, Hengelo, Enschede, Hengelo, Almelo, Zwolle, Assen]"
train_19,"[Amsterdam Amstel, Utrecht Centraal, Amersfoort, Apeldoorn, Zutphen, Apeldoorn, Amersfoort, Zwolle]"
train_20,"[Hengelo, Almelo, Zwolle, Deventer, Almelo, Deventer, Apeldoorn, Deventer, Zutphen, Apeldoorn]"
score,2731.52808988764
