train,stations
train_1,"[Eindhoven, Weert, Roermond, Weert, Eindhoven, Tilburg, s-Hertogenbosch, Utrecht Centraal, Amsterdam Centraal, Utrecht Centraal]"
train_2,"[Eindhoven, s-Hertogenbosch, Oss, s-Hertogenbosch, Utrecht Centraal, Amersfoort, Zwolle, Steenwijk, Heerenveen, Steenwijk]"
train_3,"[Heerenveen, Leeuwarden, Heerenveen, Leeuwarden, Heerenveen, Leeuwarden, Heerenveen, Steenwijk, Zwolle, Steenwijk]"
train_4,"[Rotterdam Blaak, Schiedam Centrum, Rotterdam Blaak, Schiedam Centrum, Rotterdam Centraal, Dordrecht, Rotterdam Blaak, Dordrecht, Rotterdam Blaak, Schiedam Centrum, Rotterdam Centraal, Rotterdam Alexander, Rotterdam Centraal, Schiedam Centrum, Delft, Den Haag Laan v NOI, Delft, Den Haag Laan v NOI]"
train_5,"[Zutphen, Dieren, Arnhem Centraal, Dieren, Zutphen, Dieren, Arnhem Centraal, Nijmegen, Oss, s-Hertogenbosch, Eindhoven, Weert, Roermond, Sittard, Maastricht]"
train_6,"[Steenwijk, Zwolle, Steenwijk, Zwolle, Amersfoort, Apeldoorn, Zutphen, Deventer, Zutphen]"
train_7,"[Zwolle, Steenwijk, Heerenveen, Steenwijk, Zwolle, Amersfoort, Apeldoorn, Deventer, Zutphen, Dieren, Arnhem Centraal]"
train_8,"[Tilburg, Eindhoven, Helmond, Venlo, Helmond, Eindhoven, Weert, Roermond, Weert, Eindhoven, s-Hertogenbosch]"
train_9,"[Amsterdam Zuid, Schiphol Airport, Amsterdam Zuid, Schiphol Airport, Amsterdam Zuid, Amsterdam Sloterdijk, Amsterdam Zuid, Schiphol Airport, Leiden Centraal, Heemstede-Aerdenhout, Leiden Centraal, Den Haag Centraal, Delft, Den Haag HS, Gouda, Alphen a/d Rijn]"
train_10,"[Steenwijk, Zwolle, Deventer, Almelo, Deventer, Zutphen, Dieren, Arnhem Centraal, Dieren, Zutphen, Dieren, Arnhem Centraal]"
train_11,"[Zaandam, Hoorn, Zaandam, Beverwijk, Castricum, Alkmaar, Den Helder, Alkmaar]"
train_12,"[Hengelo, Enschede, Hengelo, Enschede, Hengelo, Enschede, Hengelo, Enschede, Hengelo, Almelo, Zwolle, Amersfoort, Apeldoorn, Deventer]"
train_13,"[Alkmaar, Den Helder, Alkmaar, Hoorn, Zaandam, Hoorn, Zaandam]"
train_14,"[Oss, s-Hertogenbosch, Utrecht Centraal, Amsterdam Centraal, Amsterdam Sloterdijk, Amsterdam Zuid, Amsterdam Sloterdijk, Zaandam, Castricum, Zaandam, Amsterdam Sloterdijk, Haarlem, Amsterdam Sloterdijk, Amsterdam Zuid]"
train_15,"[Gouda, Utrecht Centraal, Alphen a/d Rijn, Gouda, Utrecht Centraal, Amsterdam Centraal, Almere Centrum, Amsterdam Centraal, Amsterdam Sloterdijk, Amsterdam Centraal, Amsterdam Sloterdijk, Amsterdam Centraal]"
train_16,"[Gouda, Rotterdam Alexander, Gouda, Den Haag Laan v NOI, Leiden Centraal, Den Haag Centraal, Delft, Den Haag Centraal, Delft, Den Haag HS, Leiden Centraal, Alphen a/d Rijn, Leiden Centraal, Den Haag HS, Delft]"
train_17,"[Venlo, Helmond, Eindhoven, Helmond, Venlo, Helmond, Eindhoven, Helmond, Eindhoven, Tilburg, Breda]"
train_18,"[Maastricht, Sittard, Heerlen, Sittard, Maastricht, Sittard, Maastricht, Sittard, Roermond, Weert, Roermond, Sittard, Maastricht]"
train_19,"[Groningen, Leeuwarden, Groningen, Assen, Groningen, Leeuwarden, Heerenveen, Steenwijk]"
train_20,"[Gouda, Den Haag Laan v NOI, Gouda, Alphen a/d Rijn, Leiden Centraal, Den Haag HS, Gouda, Utrecht Centraal, Amersfoort, Apeldoorn]"
score,2135.4494382022467
