train,stations
train_1,"[Tilburg, Breda, Tilburg, Eindhoven, Tilburg, Breda, Etten-Leur, Roosendaal, Dordrecht, Roosendaal, Dordrecht]"
train_2,"[Eindhoven, Tilburg, Eindhoven, Weert, Eindhoven, Helmond, Eindhoven, Tilburg, Breda, Tilburg, Breda, Etten-Leur, Breda, Etten-Leur]"
train_3,"[Schiphol Airport, Utrecht Centraal, Amsterdam Amstel, Hilversum, Utrecht Centraal, Alphen a/d Rijn, Leiden Centraal, Den Haag Centraal, Delft, Den Haag Centraal]"
train_4,"[Schiphol Airport, Amsterdam Zuid, Amsterdam Sloterdijk, Amsterdam Zuid, Schiphol Airport, Leiden Centraal, Den Haag HS, Gouda, Den Haag Centraal, Gouda, Alphen a/d Rijn, Leiden Centraal, Alphen a/d Rijn]"
train_5,"[Etten-Leur, Breda, Tilburg, Eindhoven, Helmond, Eindhoven, Weert, Eindhoven, s-Hertogenbosch, Tilburg, s-Hertogenbosch, Eindhoven, s-Hertogenbosch]"
train_6,"[Breda, Etten-Leur, Breda, Etten-Leur, Roosendaal, Vlissingen, Roosendaal, Etten-Leur, Breda]"
train_7,"[Assen, Groningen, Assen, Zwolle, Steenwijk, Zwolle, Almelo]"
train_8,"[Oss, Nijmegen, Oss, Nijmegen, Arnhem Centraal, Ede-Wageningen, Utrecht Centraal, Gouda, Alphen a/d Rijn, Gouda, Utrecht Centraal]"
train_9,"[Utrecht Centraal, Hilversum, Almere Centrum, Hilversum, Almere Centrum, Amsterdam Centraal, Utrecht Centraal, Amsterdam Amstel]"
train_10,"[Amsterdam Sloterdijk, Haarlem, Beverwijk, Zaandam, Beverwijk, Haarlem, Amsterdam Sloterdijk, Zaandam, Amsterdam Sloterdijk, Amsterdam Centraal, Amsterdam Sloterdijk, Amsterdam Centraal, Amsterdam Sloterdijk, Haarlem, Beverwijk]"
train_11,"[Ede-Wageningen, Arnhem Centraal, Dieren, Arnhem Centraal, Ede-Wageningen, Utrecht Centraal, Ede-Wageningen, Arnhem Centraal, Dieren, Zutphen, Apeldoorn, Amersfoort]"
train_12,"[Rotterdam Alexander, Rotterdam Centraal, Rotterdam Alexander, Rotterdam Blaak, Rotterdam Alexander, Rotterdam Centraal, Dordrecht, Rotterdam Blaak, Dordrecht, Rotterdam Centraal, Schiedam Centrum, Delft, Den Haag Laan v NOI, Gouda, Alphen a/d Rijn]"
train_13,"[Zwolle, Deventer, Zutphen, Deventer, Zutphen, Apeldoorn, Deventer, Apeldoorn, Amersfoort, Apeldoorn, Zutphen]"
train_14,"[Hoorn, Alkmaar, Den Helder, Alkmaar, Hoorn, Alkmaar, Hoorn]"
train_15,"[Heerlen, Sittard, Maastricht, Sittard, Roermond, Sittard, Heerlen, Sittard, Maastricht, Sittard, Heerlen, Sittard]"
train_16,"[Rotterdam Alexander, Rotterdam Centraal, Rotterdam Alexander, Rotterdam Centraal, Dordrecht, Roosendaal, Etten-Leur, Breda, Dordrecht, Rotterdam Blaak, Schiedam Centrum, Delft, Schiedam Centrum, Delft, Den Haag Laan v NOI]"
train_17,"[Ede-Wageningen, Arnhem Centraal, Dieren, Arnhem Centraal, Ede-Wageningen, Arnhem Centraal, Nijmegen, Arnhem Centraal, Nijmegen, Arnhem Centraal, Ede-Wageningen, Utrecht Centraal, Hilversum, Utrecht Centraal]"
train_18,"[Tilburg, s-Hertogenbosch, Tilburg, Breda, Dordrecht, Rotterdam Centraal, Dordrecht, Roosendaal, Etten-Leur, Breda, Dordrecht, Roosendaal]"
train_19,"[Nijmegen, Oss, s-Hertogenbosch, Tilburg, s-Hertogenbosch, Eindhoven, Helmond, Venlo, Helmond, Eindhoven, Helmond]"
train_20,"[Castricum, Beverwijk, Castricum, Zaandam, Castricum, Alkmaar, Hoorn, Zaandam, Castricum, Zaandam, Castricum, Zaandam, Amsterdam Sloterdijk, Amsterdam Centraal, Amsterdam Sloterdijk]"
score,2531.52808988764
