train,stations
train_1,"[Apeldoorn, Deventer, Almelo, Zwolle, Deventer, Zutphen, Apeldoorn, Deventer, Almelo]"
train_2,"[Amsterdam Amstel, Utrecht Centraal, Alphen a/d Rijn, Utrecht Centraal, Amsterdam Amstel, Almere Centrum, Amsterdam Centraal, Utrecht Centraal]"
train_3,"[Hilversum, Amsterdam Amstel, Amsterdam Zuid, Amsterdam Sloterdijk, Zaandam, Beverwijk, Haarlem, Heemstede-Aerdenhout, Leiden Centraal, Den Haag HS, Leiden Centraal, Schiphol Airport, Leiden Centraal]"
train_4,"[Zaandam, Hoorn, Alkmaar, Den Helder, Alkmaar, Den Helder]"
train_5,"[s-Hertogenbosch, Oss, s-Hertogenbosch, Utrecht Centraal, Amsterdam Amstel, Utrecht Centraal, Amersfoort, Apeldoorn, Zutphen, Apeldoorn]"
train_6,"[Amsterdam Zuid, Schiphol Airport, Amsterdam Zuid, Schiphol Airport, Leiden Centraal, Schiphol Airport, Amsterdam Zuid, Schiphol Airport, Utrecht Centraal, Amsterdam Amstel, Amsterdam Zuid, Amsterdam Sloterdijk, Zaandam, Hoorn]"
train_7,"[Amersfoort, Utrecht Centraal, Amsterdam Centraal, Amsterdam Sloterdijk, Haarlem, Amsterdam Sloterdijk, Zaandam, Amsterdam Sloterdijk, Amsterdam Zuid, Amsterdam Sloterdijk, Amsterdam Zuid, Schiphol Airport, Amsterdam Zuid, Amsterdam Sloterdijk, Zaandam, Castricum]"
train_8,"[Hoorn, Zaandam, Castricum, Beverwijk, Castricum, Alkmaar, Hoorn, Alkmaar, Hoorn, Zaandam]"
train_9,"[Schiphol Airport, Amsterdam Zuid, Amsterdam Sloterdijk, Zaandam, Hoorn, Alkmaar, Hoorn, Alkmaar, Hoorn, Alkmaar]"
train_10,"[Almelo, Deventer, Almelo, Deventer, Almelo, Deventer, Zutphen, Apeldoorn, Deventer]"
train_11,"[Zaandam, Castricum, Beverwijk, Zaandam, Amsterdam Sloterdijk, Amsterdam Zuid, Schiphol Airport, Utrecht Centraal, Ede-Wageningen, Arnhem Centraal, Dieren, Zutphen, Deventer]"
train_12,"[Venlo, Helmond, Eindhoven, Helmond, Venlo, Helmond, Venlo, Helmond]"
train_13,"[Den Haag Centraal, Leiden Centraal, Schiphol Airport, Leiden Centraal, Den Haag Centraal, Leiden Centraal, Den Haag HS, Delft, Schiedam Centrum, Rotterdam Blaak, Dordrecht, Rotterdam Blaak, Rotterdam Alexander, Gouda, Den Haag Laan v NOI]"
train_14,"[Maastricht, Sittard, Maastricht, Sittard, Maastricht, Sittard, Roermond, Weert, Eindhoven, Helmond, Eindhoven, s-Hertogenbosch, Eindhoven]"
train_15,"[s-Hertogenbosch, Oss, s-Hertogenbosch, Utrecht Centraal, Alphen a/d Rijn, Gouda, Alphen a/d Rijn, Utrecht Centraal, s-Hertogenbosch]"
train_16,"[Amsterdam Centraal, Almere Centrum, Amsterdam Centraal, Amsterdam Amstel, Almere Centrum, Amsterdam Amstel, Hilversum, Amsterdam Amstel]"
train_17,"[Heerenveen, Steenwijk, Heerenveen, Leeuwarden, Heerenveen, Leeuwarden, Heerenveen, Leeuwarden, Groningen, Leeuwarden]"
train_18,"[Heemstede-Aerdenhout, Leiden Centraal, Heemstede-Aerdenhout, Haarlem, Amsterdam Sloterdijk, Amsterdam Zuid, Schiphol Airport, Leiden Centraal, Den Haag HS, Gouda, Alphen a/d Rijn, Leiden Centraal, Den Haag Laan v NOI, Delft, Schiedam Centrum]"
train_19,"[Vlissingen, Roosendaal, Vlissingen]"
train_20,"[Weert, Eindhoven, Weert, Roermond, Weert, Eindhoven, Weert, Eindhoven, Helmond, Venlo]"
score,1851.0112359550558
