train,stations
train_1,"[Den Haag Centraal, Leiden Centraal, Schiphol Airport, Amsterdam Zuid, Schiphol Airport, Amsterdam Zuid, Schiphol Airport, Amsterdam Zuid, Amsterdam Sloterdijk, Zaandam, Hoorn, Alkmaar, Castricum, Zaandam, Castricum, Zaandam]"
train_2,"[Nijmegen, Arnhem Centraal, Dieren, Zutphen, Dieren, Arnhem Centraal, Nijmegen, Oss, s-Hertogenbosch, Tilburg, Eindhoven, Tilburg, Breda, Dordrecht]"
train_3,"[Alphen a/d Rijn, Leiden Centraal, Schiphol Airport, Utrecht Centraal, Ede-Wageningen, Utrecht Centraal, s-Hertogenbosch, Oss, Nijmegen]"
train_4,"[Hengelo, Almelo, Zwolle, Deventer, Zwolle, Steenwijk, Zwolle]"
train_5,"[Deventer, Zutphen, Deventer, Zutphen, Dieren, Zutphen, Deventer, Zutphen, Apeldoorn, Deventer, Zutphen, Deventer, Zutphen, Apeldoorn, Deventer]"
train_6,"[Zwolle, Amersfoort, Utrecht Centraal, Gouda, Utrecht Centraal, Amersfoort, Zwolle, Amersfoort]"
train_7,"[Amsterdam Zuid, Amsterdam Amstel, Hilversum, Utrecht Centraal, Schiphol Airport, Utrecht Centraal, Ede-Wageningen, Arnhem Centraal, Nijmegen]"
train_8,"[Zaandam, Castricum, Beverwijk, Haarlem, Amsterdam Sloterdijk, Haarlem, Heemstede-Aerdenhout, Haarlem, Heemstede-Aerdenhout, Haarlem, Heemstede-Aerdenhout, Haarlem, Heemstede-Aerdenhout, Haarlem, Amsterdam Sloterdijk, Haarlem, Beverwijk, Castricum, Beverwijk]"
train_9,"[Oss, s-Hertogenbosch, Eindhoven, Weert, Roermond, Weert, Eindhoven, Helmond, Eindhoven, s-Hertogenbosch, Utrecht Centraal]"
train_10,"[Heemstede-Aerdenhout, Haarlem, Heemstede-Aerdenhout, Leiden Centraal, Heemstede-Aerdenhout, Leiden Centraal, Den Haag Centraal, Leiden Centraal, Den Haag Laan v NOI, Leiden Centraal, Den Haag Centraal, Leiden Centraal, Heemstede-Aerdenhout, Leiden Centraal, Schiphol Airport, Leiden Centraal]"
train_11,"[Assen, Groningen, Leeuwarden, Heerenveen, Leeuwarden, Heerenveen, Steenwijk, Heerenveen, Steenwijk, Heerenveen, Steenwijk]"
train_12,"[Utrecht Centraal, Amsterdam Amstel, Utrecht Centraal, Amsterdam Centraal, Almere Centrum, Hilversum, Amsterdam Amstel, Amsterdam Zuid, Amsterdam Amstel]"
train_13,"[Amersfoort, Zwolle, Almelo, Hengelo, Enschede, Hengelo, Almelo, Deventer, Almelo]"
train_14,"[Hoorn, Zaandam, Amsterdam Sloterdijk, Haarlem, Beverwijk, Haarlem, Beverwijk, Haarlem, Heemstede-Aerdenhout, Haarlem, Beverwijk, Haarlem, Heemstede-Aerdenhout, Leiden Centraal]"
train_15,"[s-Hertogenbosch, Utrecht Centraal, Hilversum, Utrecht Centraal, Amsterdam Centraal, Amsterdam Amstel, Amsterdam Zuid, Schiphol Airport, Amsterdam Zuid, Schiphol Airport, Amsterdam Zuid, Amsterdam Amstel, Utrecht Centraal]"
train_16,"[Rotterdam Centraal, Dordrecht, Rotterdam Blaak, Rotterdam Alexander, Rotterdam Centraal, Rotterdam Alexander, Rotterdam Centraal, Rotterdam Alexander, Rotterdam Blaak, Rotterdam Alexander, Rotterdam Blaak, Rotterdam Alexander, Rotterdam Blaak, Schiedam Centrum, Delft, Den Haag Centraal, Leiden Centraal, Den Haag Laan v NOI]"
train_17,"[s-Hertogenbosch, Eindhoven, Helmond, Eindhoven, s-Hertogenbosch, Utrecht Centraal, Amsterdam Centraal, Utrecht Centraal, Schiphol Airport]"
train_18,"[Heerlen, Sittard, Roermond, Weert, Roermond, Sittard, Roermond, Weert, Eindhoven, Helmond, Venlo]"
train_19,"[Vlissingen, Roosendaal, Etten-Leur, Breda, Etten-Leur, Roosendaal, Etten-Leur, Breda, Tilburg, Breda, Etten-Leur, Roosendaal, Etten-Leur]"
train_20,"[Apeldoorn, Zutphen, Apeldoorn, Amersfoort, Utrecht Centraal, Schiphol Airport, Amsterdam Zuid, Schiphol Airport, Utrecht Centraal, Hilversum]"
score,2637.52808988764
