train,stations
train_1,"[s-Hertogenbosch, Tilburg, s-Hertogenbosch, Eindhoven, Helmond, Venlo, Helmond, Venlo, Helmond]"
train_2,"[Arnhem Centraal, Dieren, Zutphen, Deventer, Zutphen, Apeldoorn, Amersfoort, Utrecht Centraal, Schiphol Airport, Leiden Centraal, Heemstede-Aerdenhout, Leiden Centraal]"
train_3,"[Rotterdam Blaak, Rotterdam Alexander, Rotterdam Centraal, Dordrecht, Rotterdam Blaak, Rotterdam Alexander, Rotterdam Blaak, Rotterdam Alexander, Rotterdam Centraal, Schiedam Centrum, Rotterdam Centraal, Schiedam Centrum, Delft, Den Haag HS, Gouda, Den Haag Centraal, Leiden Centraal, Alphen a/d Rijn]"
train_4,"[Amsterdam Centraal, Amsterdam Sloterdijk, Amsterdam Zuid, Amsterdam Amstel, Amsterdam Centraal, Almere Centrum, Amsterdam Amstel, Almere Centrum, Amsterdam Amstel, Hilversum]"
train_5,"[Eindhoven, Tilburg, s-Hertogenbosch, Utrecht Centraal, Gouda, Den Haag HS, Leiden Centraal, Heemstede-Aerdenhout, Leiden Centraal, Den Haag HS, Gouda]"
train_6,"[Amsterdam Sloterdijk, Zaandam, Hoorn, Alkmaar, Den Helder, Alkmaar, Hoorn, Zaandam]"
train_7,"[Groningen, Leeuwarden, Groningen, Assen, Groningen, Leeuwarden, Heerenveen, Leeuwarden]"
train_8,"[Rotterdam Centraal, Schiedam Centrum, Rotterdam Blaak, Schiedam Centrum, Rotterdam Centraal, Dordrecht, Breda, Dordrecht, Roosendaal, Dordrecht, Rotterdam Centraal, Schiedam Centrum, Rotterdam Blaak, Rotterdam Alexander]"
train_9,"[Enschede, Hengelo, Almelo, Zwolle, Almelo, Deventer, Zwolle]"
train_10,"[Utrecht Centraal, Hilversum, Utrecht Centraal, Gouda, Den Haag Centraal, Leiden Centraal, Schiphol Airport, Amsterdam Zuid, Amsterdam Sloterdijk, Amsterdam Centraal, Almere Centrum, Lelystad Centrum, Almere Centrum]"
train_11,"[Heerenveen, Steenwijk, Heerenveen, Steenwijk, Heerenveen, Steenwijk, Heerenveen, Steenwijk, Heerenveen, Steenwijk, Zwolle, Deventer]"
train_12,"[Den Haag Centraal, Gouda, Den Haag HS, Delft, Den Haag HS, Gouda, Alphen a/d Rijn, Gouda, Den Haag Laan v NOI, Delft, Den Haag Laan v NOI, Delft]"
train_13,"[Maastricht, Sittard, Maastricht, Sittard, Heerlen, Sittard, Roermond, Weert, Roermond, Sittard, Heerlen, Sittard, Roermond]"
train_14,"[Gouda, Den Haag Laan v NOI, Gouda, Rotterdam Alexander, Rotterdam Centraal, Rotterdam Alexander, Rotterdam Blaak, Dordrecht, Breda, Tilburg, Eindhoven, Tilburg]"
train_15,"[Almelo, Zwolle, Steenwijk, Heerenveen, Steenwijk, Heerenveen, Leeuwarden, Groningen, Assen]"
train_16,"[Helmond, Eindhoven, Tilburg, Breda, Tilburg, s-Hertogenbosch, Oss, s-Hertogenbosch, Eindhoven, Tilburg, Eindhoven, s-Hertogenbosch]"
train_17,"[Utrecht Centraal, Amsterdam Centraal, Amsterdam Amstel, Utrecht Centraal, Schiphol Airport, Utrecht Centraal, Alphen a/d Rijn, Utrecht Centraal]"
train_18,"[Nijmegen, Arnhem Centraal, Nijmegen, Arnhem Centraal, Ede-Wageningen, Arnhem Centraal, Ede-Wageningen, Arnhem Centraal, Dieren, Arnhem Centraal, Dieren, Zutphen, Deventer, Zutphen, Deventer, Apeldoorn, Deventer]"
train_19,"[Almere Centrum, Amsterdam Centraal, Amsterdam Amstel, Utrecht Centraal, Amsterdam Amstel, Amsterdam Centraal, Amsterdam Sloterdijk, Haarlem, Heemstede-Aerdenhout, Haarlem, Heemstede-Aerdenhout, Haarlem, Heemstede-Aerdenhout, Haarlem, Beverwijk, Haarlem, Beverwijk]"
train_20,"[Amsterdam Zuid, Amsterdam Sloterdijk, Haarlem, Beverwijk, Zaandam, Hoorn, Zaandam, Hoorn, Zaandam]"
score,2952.9662921348317
