train,stations
train_1,"[Rotterdam Alexander, Rotterdam Centraal, Rotterdam Alexander, Rotterdam Blaak, Schiedam Centrum, Rotterdam Blaak, Rotterdam Alexander, Gouda, Alphen a/d Rijn, Gouda, Rotterdam Alexander, Rotterdam Centraal, Dordrecht, Roosendaal, Etten-Leur]"
train_2,"[Heerlen, Sittard, Roermond, Sittard, Roermond, Weert, Eindhoven, Helmond, Venlo, Helmond]"
train_3,"[Almere Centrum, Amsterdam Centraal, Amsterdam Sloterdijk, Zaandam, Hoorn, Zaandam, Amsterdam Sloterdijk, Haarlem, Heemstede-Aerdenhout, Leiden Centraal, Heemstede-Aerdenhout, Leiden Centraal, Alphen a/d Rijn]"
train_4,"[Tilburg, Breda, Etten-Leur, Roosendaal, Vlissingen, Roosendaal]"
train_5,"[Zutphen, Apeldoorn, Zutphen, Apeldoorn, Zutphen, Apeldoorn, Amersfoort, Zwolle]"
train_6,"[Ede-Wageningen, Arnhem Centraal, Nijmegen, Oss, Nijmegen, Oss, s-Hertogenbosch, Oss, s-Hertogenbosch, Oss, Nijmegen, Arnhem Centraal, Nijmegen, Arnhem Centraal, Ede-Wageningen]"
train_7,"[Roosendaal, Etten-Leur, Breda, Dordrecht, Roosendaal, Vlissingen]"
train_8,"[Zaandam, Hoorn, Alkmaar, Hoorn, Alkmaar, Hoorn, Alkmaar]"
train_9,"[Arnhem Centraal, Dieren, Zutphen, Deventer, Zutphen, Dieren, Arnhem Centraal, Dieren, Arnhem Centraal, Nijmegen, Oss, s-Hertogenbosch, Oss, Nijmegen, Arnhem Centraal, Nijmegen]"
train_10,"[Dieren, Arnhem Centraal, Dieren, Arnhem Centraal, Nijmegen, Oss, Nijmegen, Oss, s-Hertogenbosch, Eindhoven, Weert, Roermond, Sittard]"
train_11,"[Den Haag Centraal, Delft, Den Haag Centraal, Delft, Den Haag Laan v NOI, Delft, Den Haag HS, Delft, Schiedam Centrum, Delft, Den Haag Laan v NOI, Gouda, Den Haag Laan v NOI]"
train_12,"[Enschede, Hengelo, Almelo, Hengelo, Almelo, Zwolle, Almelo, Deventer, Apeldoorn, Deventer, Zutphen]"
train_13,"[Utrecht Centraal, Gouda, Utrecht Centraal, Amsterdam Centraal, Amsterdam Sloterdijk, Amsterdam Centraal, Amsterdam Amstel, Utrecht Centraal, Schiphol Airport, Leiden Centraal, Heemstede-Aerdenhout, Haarlem, Heemstede-Aerdenhout]"
train_14,"[Assen, Groningen, Leeuwarden, Groningen, Leeuwarden, Groningen, Assen]"
train_15,"[Helmond, Eindhoven, Weert, Roermond, Weert, Roermond, Sittard, Maastricht, Sittard, Roermond, Weert, Roermond, Weert]"
train_16,"[Nijmegen, Oss, s-Hertogenbosch, Utrecht Centraal, Amsterdam Amstel, Hilversum, Almere Centrum, Hilversum, Almere Centrum]"
train_17,"[Alkmaar, Castricum, Beverwijk, Haarlem, Beverwijk, Haarlem, Heemstede-Aerdenhout, Leiden Centraal, Den Haag HS, Gouda, Rotterdam Alexander, Rotterdam Blaak, Schiedam Centrum, Rotterdam Centraal, Schiedam Centrum, Rotterdam Centraal, Rotterdam Alexander]"
train_18,"[Den Haag Laan v NOI, Leiden Centraal, Den Haag Centraal, Leiden Centraal, Den Haag HS, Gouda, Rotterdam Alexander, Rotterdam Blaak, Rotterdam Alexander, Gouda, Den Haag HS, Delft, Den Haag Centraal, Gouda]"
train_19,"[Den Haag Laan v NOI, Gouda, Den Haag HS, Gouda, Den Haag HS, Leiden Centraal, Alphen a/d Rijn, Leiden Centraal, Alphen a/d Rijn, Gouda]"
train_20,"[Amsterdam Zuid, Schiphol Airport, Leiden Centraal, Den Haag Laan v NOI, Gouda, Den Haag Laan v NOI, Gouda, Rotterdam Alexander, Gouda, Den Haag Laan v NOI, Leiden Centraal]"
score,2546.168539325843
