train,stations
train_1,"[Dieren, Zutphen, Apeldoorn, Amersfoort, Apeldoorn, Zutphen, Deventer, Apeldoorn, Deventer, Apeldoorn, Amersfoort]"
train_2,"[Vlissingen, Roosendaal, Dordrecht, Rotterdam Blaak, Rotterdam Alexander, Rotterdam Centraal, Dordrecht, Breda, Dordrecht]"
train_3,"[Tilburg, Breda, Tilburg, Breda, Dordrecht, Roosendaal, Vlissingen]"
train_4,"[Heerlen, Sittard, Heerlen, Sittard, Roermond, Sittard, Roermond, Sittard, Maastricht, Sittard, Roermond, Weert, Roermond]"
train_5,"[Gouda, Den Haag Laan v NOI, Delft, Schiedam Centrum, Delft, Den Haag HS, Leiden Centraal, Alphen a/d Rijn, Utrecht Centraal, Ede-Wageningen, Utrecht Centraal]"
train_6,"[Sittard, Maastricht, Sittard, Maastricht, Sittard, Maastricht, Sittard, Roermond, Sittard, Maastricht, Sittard, Roermond]"
train_7,"[Zwolle, Deventer, Zwolle, Almelo, Deventer, Zwolle, Steenwijk, Heerenveen]"
train_8,"[Sittard, Roermond, Sittard, Maastricht, Sittard, Heerlen, Sittard, Maastricht, Sittard, Maastricht, Sittard, Heerlen]"
train_9,"[Dieren, Zutphen, Dieren, Zutphen, Apeldoorn, Amersfoort, Zwolle, Deventer, Zutphen, Apeldoorn]"
train_10,"[Den Haag Centraal, Leiden Centraal, Den Haag Centraal, Gouda, Alphen a/d Rijn, Utrecht Centraal, Schiphol Airport, Utrecht Centraal, Amersfoort]"
train_11,"[Heerlen, Sittard, Roermond, Sittard, Heerlen, Sittard, Roermond, Sittard, Heerlen, Sittard, Heerlen, Sittard]"
train_12,"[Den Haag Centraal, Gouda, Rotterdam Alexander, Rotterdam Blaak, Schiedam Centrum, Rotterdam Centraal, Dordrecht, Rotterdam Centraal, Rotterdam Alexander, Rotterdam Blaak, Dordrecht, Roosendaal, Etten-Leur, Breda, Tilburg]"
train_13,"[Roosendaal, Vlissingen, Roosendaal, Dordrecht, Rotterdam Centraal, Rotterdam Alexander]"
train_14,"[Nijmegen, Oss, Nijmegen, Oss, Nijmegen, Arnhem Centraal, Ede-Wageningen, Arnhem Centraal, Ede-Wageningen, Utrecht Centraal, Gouda, Den Haag HS]"
train_15,"[Den Haag Centraal, Gouda, Alphen a/d Rijn, Gouda, Den Haag HS, Gouda, Den Haag Laan v NOI, Delft, Den Haag Centraal, Gouda]"
train_16,"[Amsterdam Amstel, Almere Centrum, Lelystad Centrum, Almere Centrum, Lelystad Centrum, Almere Centrum, Lelystad Centrum, Almere Centrum, Hilversum, Utrecht Centraal, Hilversum]"
train_17,"[Almelo, Hengelo, Almelo, Hengelo, Enschede, Hengelo, Almelo, Deventer, Zutphen, Deventer, Apeldoorn, Deventer, Zutphen, Deventer, Zwolle]"
train_18,"[Sittard, Heerlen, Sittard, Heerlen, Sittard, Maastricht, Sittard, Roermond, Sittard, Heerlen, Sittard, Roermond]"
train_19,"[Maastricht, Sittard, Maastricht, Sittard, Maastricht, Sittard, Maastricht, Sittard, Roermond, Sittard, Roermond, Sittard]"
train_20,"[Zutphen, Dieren, Zutphen, Dieren, Arnhem Centraal, Dieren, Arnhem Centraal, Ede-Wageningen, Arnhem Centraal, Ede-Wageningen, Arnhem Centraal, Dieren, Zutphen, Dieren, Zutphen, Apeldoorn, Deventer, Apeldoorn]"
score,653.4157303370794
