train,stations
train_1,"[Breda, Tilburg, Eindhoven, Weert, Eindhoven, Helmond, Venlo, Helmond, Venlo]"
train_2,"[Rotterdam Centraal, Dordrecht, Roosendaal, Etten-Leur, Roosendaal, Dordrecht, Breda, Dordrecht, Roosendaal, Dordrecht]"
train_3,"[Amsterdam Zuid, Amsterdam Sloterdijk, Haarlem, Heemstede-Aerdenhout, Leiden Centraal, Alphen a/d Rijn, Utrecht Centraal, s-Hertogenbosch, Oss, Nijmegen, Arnhem Centraal, Nijmegen, Arnhem Centraal]"
train_4,"[Weert, Roermond, Weert, Roermond, Weert, Roermond, Sittard, Maastricht, Sittard, Heerlen, Sittard, Heerlen, Sittard]"
train_5,"[Leeuwarden, Groningen, Assen, Groningen, Assen, Zwolle, Almelo]"
train_6,"[Hilversum, Utrecht Centraal, Amsterdam Centraal, Amsterdam Amstel, Hilversum, Utrecht Centraal, Amsterdam Amstel, Hilversum, Utrecht Centraal]"
train_7,"[Eindhoven, Tilburg, s-Hertogenbosch, Eindhoven, Weert, Roermond, Sittard, Heerlen, Sittard, Heerlen, Sittard, Maastricht]"
train_8,"[Roermond, Weert, Roermond, Weert, Roermond, Sittard, Heerlen, Sittard, Maastricht, Sittard, Roermond, Sittard, Heerlen]"
train_9,"[Etten-Leur, Roosendaal, Vlissingen, Roosendaal, Etten-Leur, Breda, Etten-Leur, Breda, Etten-Leur]"
train_10,"[Den Haag HS, Leiden Centraal, Den Haag Centraal, Leiden Centraal, Den Haag HS, Delft, Schiedam Centrum, Rotterdam Centraal, Schiedam Centrum, Delft, Den Haag Laan v NOI, Gouda, Utrecht Centraal, Amsterdam Centraal]"
train_11,"[Amsterdam Centraal, Amsterdam Sloterdijk, Zaandam, Castricum, Zaandam, Castricum, Beverwijk, Castricum, Alkmaar, Hoorn, Zaandam, Beverwijk]"
train_12,"[Den Haag HS, Delft, Schiedam Centrum, Delft, Den Haag Centraal, Gouda, Rotterdam Alexander, Rotterdam Centraal, Schiedam Centrum, Rotterdam Centraal, Rotterdam Alexander, Gouda, Rotterdam Alexander, Rotterdam Blaak, Dordrecht, Breda, Tilburg, s-Hertogenbosch]"
train_13,"[Schiphol Airport, Amsterdam Zuid, Amsterdam Sloterdijk, Amsterdam Zuid, Amsterdam Amstel, Utrecht Centraal, Schiphol Airport, Amsterdam Zuid, Amsterdam Sloterdijk, Amsterdam Zuid, Schiphol Airport, Amsterdam Zuid, Amsterdam Amstel, Utrecht Centraal]"
train_14,"[Breda, Etten-Leur, Roosendaal, Vlissingen, Roosendaal]"
train_15,"[Den Haag Centraal, Gouda, Alphen a/d Rijn, Gouda, Den Haag HS, Delft, Den Haag Laan v NOI, Leiden Centraal, Den Haag Laan v NOI, Leiden Centraal, Schiphol Airport, Leiden Centraal, Den Haag Centraal]"
train_16,"[Weert, Roermond, Weert, Eindhoven, s-Hertogenbosch, Oss, s-Hertogenbosch, Utrecht Centraal, Amersfoort, Apeldoorn, Deventer]"
train_17,"[Heemstede-Aerdenhout, Haarlem, Beverwijk, Zaandam, Hoorn, Alkmaar, Hoorn, Zaandam, Hoorn]"
train_18,"[Almelo, Deventer, Apeldoorn, Deventer, Zutphen, Dieren, Zutphen, Apeldoorn, Zutphen, Deventer, Zwolle, Steenwijk]"
train_19,"[Deventer, Zwolle, Amersfoort, Utrecht Centraal, Schiphol Airport, Amsterdam Zuid, Amsterdam Sloterdijk, Zaandam, Beverwijk]"
train_20,"[Zwolle, Assen, Groningen, Leeuwarden, Heerenveen, Steenwijk, Zwolle, Deventer]"
score,3390.044943820225
