train,stations
train_1,"[Amsterdam Centraal, Amsterdam Amstel, Almere Centrum, Amsterdam Amstel, Hilversum, Almere Centrum, Hilversum, Utrecht Centraal]"
train_2,"[Etten-Leur, Breda, Tilburg, Eindhoven, Tilburg, Breda, Etten-Leur, Roosendaal, Etten-Leur, Roosendaal, Etten-Leur, Breda, Dordrecht, Rotterdam Blaak, Rotterdam Alexander]"
train_3,"[Apeldoorn, Deventer, Apeldoorn, Zutphen, Dieren, Arnhem Centraal, Ede-Wageningen, Arnhem Centraal, Dieren, Arnhem Centraal, Ede-Wageningen, Utrecht Centraal, Gouda, Utrecht Centraal]"
train_4,"[Enschede, Hengelo, Enschede, Hengelo, Almelo, Zwolle, Deventer, Almelo, Hengelo, Enschede, Hengelo, Enschede, Hengelo, Almelo, Hengelo]"
train_5,"[Lelystad Centrum, Almere Centrum, Lelystad Centrum, Almere Centrum, Amsterdam Amstel, Amsterdam Zuid, Amsterdam Sloterdijk, Zaandam, Hoorn, Alkmaar]"
train_6,"[Eindhoven, Weert, Roermond, Weert, Roermond, Sittard, Roermond, Weert, Eindhoven, s-Hertogenbosch, Tilburg, s-Hertogenbosch]"
train_7,"[Eindhoven, s-Hertogenbosch, Eindhoven, Tilburg, s-Hertogenbosch, Utrecht Centraal, s-Hertogenbosch, Oss, Nijmegen, Oss]"
train_8,"[Sittard, Maastricht, Sittard, Roermond, Weert, Roermond, Sittard, Heerlen, Sittard, Heerlen, Sittard, Heerlen, Sittard]"
train_9,"[Etten-Leur, Breda, Dordrecht, Roosendaal, Etten-Leur, Roosendaal, Etten-Leur, Breda, Tilburg, s-Hertogenbosch, Utrecht Centraal, Amersfoort]"
train_10,"[Breda, Etten-Leur, Roosendaal, Etten-Leur, Roosendaal, Vlissingen, Roosendaal]"
train_11,"[Leeuwarden, Groningen, Assen, Groningen, Leeuwarden, Groningen, Leeuwarden]"
train_12,"[Apeldoorn, Zutphen, Apeldoorn, Deventer, Zwolle, Steenwijk, Zwolle, Deventer, Almelo]"
train_13,"[Hilversum, Utrecht Centraal, Amsterdam Centraal, Amsterdam Amstel, Utrecht Centraal, Schiphol Airport, Leiden Centraal, Den Haag HS, Leiden Centraal, Den Haag Laan v NOI, Gouda]"
train_14,"[Helmond, Venlo, Helmond, Venlo, Helmond, Eindhoven, Tilburg, s-Hertogenbosch]"
train_15,"[Breda, Dordrecht, Rotterdam Centraal, Schiedam Centrum, Delft, Schiedam Centrum, Delft, Den Haag HS, Leiden Centraal, Den Haag HS, Gouda, Den Haag Laan v NOI, Gouda]"
train_16,"[Hengelo, Almelo, Hengelo, Almelo, Deventer, Zwolle, Steenwijk, Zwolle, Almelo]"
train_17,"[Breda, Etten-Leur, Roosendaal, Vlissingen, Roosendaal, Dordrecht]"
train_18,"[Amsterdam Amstel, Almere Centrum, Amsterdam Amstel, Hilversum, Amsterdam Amstel, Amsterdam Centraal, Amsterdam Amstel, Amsterdam Centraal, Almere Centrum, Lelystad Centrum]"
train_19,"[Arnhem Centraal, Dieren, Arnhem Centraal, Nijmegen, Oss, Nijmegen, Oss, Nijmegen, Arnhem Centraal, Nijmegen, Oss, Nijmegen, Oss]"
train_20,"[Den Haag Laan v NOI, Leiden Centraal, Schiphol Airport, Utrecht Centraal, Amsterdam Amstel, Almere Centrum, Hilversum, Utrecht Centraal, s-Hertogenbosch]"
score,1655.651685393258
