train,stations
train_1,"[Steenwijk, Heerenveen, Steenwijk, Zwolle, Deventer, Zwolle, Amersfoort, Utrecht Centraal]"
train_2,"[Vlissingen, Roosendaal, Dordrecht, Breda, Tilburg, Breda, Etten-Leur, Roosendaal, Etten-Leur, Roosendaal]"
train_3,"[Amsterdam Amstel, Almere Centrum, Lelystad Centrum, Almere Centrum, Amsterdam Centraal, Almere Centrum, Lelystad Centrum, Almere Centrum, Amsterdam Centraal, Amsterdam Amstel, Hilversum]"
train_4,"[Rotterdam Alexander, Rotterdam Blaak, Schiedam Centrum, Rotterdam Blaak, Rotterdam Alexander, Gouda, Den Haag Centraal, Leiden Centraal, Schiphol Airport, Utrecht Centraal, Alphen a/d Rijn, Gouda]"
train_5,"[Gouda, Rotterdam Alexander, Rotterdam Blaak, Schiedam Centrum, Rotterdam Blaak, Rotterdam Alexander, Rotterdam Centraal, Dordrecht, Roosendaal, Dordrecht, Roosendaal]"
train_6,"[Sittard, Heerlen, Sittard, Maastricht, Sittard, Heerlen, Sittard, Heerlen, Sittard, Maastricht, Sittard, Heerlen]"
train_7,"[Enschede, Hengelo, Almelo, Zwolle, Amersfoort, Apeldoorn, Zutphen, Deventer, Apeldoorn]"
train_8,"[Heemstede-Aerdenhout, Leiden Centraal, Den Haag Centraal, Gouda, Den Haag HS, Gouda, Utrecht Centraal, s-Hertogenbosch, Utrecht Centraal, Hilversum]"
train_9,"[Delft, Den Haag Centraal, Delft, Den Haag Laan v NOI, Gouda, Den Haag Laan v NOI, Gouda, Alphen a/d Rijn, Utrecht Centraal]"
train_10,"[Schiphol Airport, Leiden Centraal, Alphen a/d Rijn, Gouda, Utrecht Centraal, Schiphol Airport, Leiden Centraal, Den Haag HS, Delft, Den Haag Centraal, Gouda]"
train_11,"[Amsterdam Zuid, Schiphol Airport, Utrecht Centraal, Gouda, Den Haag Laan v NOI, Delft, Den Haag HS, Delft, Den Haag Laan v NOI, Gouda, Den Haag HS]"
train_12,"[Weert, Roermond, Weert, Eindhoven, Weert, Eindhoven, Helmond, Venlo, Helmond, Eindhoven, Helmond]"
train_13,"[Oss, s-Hertogenbosch, Utrecht Centraal, s-Hertogenbosch, Eindhoven, Helmond, Eindhoven, Weert, Roermond, Weert, Eindhoven, Helmond]"
train_14,"[Hoorn, Alkmaar, Castricum, Beverwijk, Castricum, Zaandam, Castricum, Beverwijk, Haarlem, Amsterdam Sloterdijk, Zaandam, Castricum, Alkmaar, Hoorn]"
train_15,"[Maastricht, Sittard, Heerlen, Sittard, Roermond, Weert, Roermond, Weert, Eindhoven, Tilburg, s-Hertogenbosch, Tilburg]"
train_16,"[Enschede, Hengelo, Almelo, Zwolle, Assen, Zwolle, Assen]"
train_17,"[Zwolle, Steenwijk, Zwolle, Almelo, Hengelo, Enschede, Hengelo, Enschede, Hengelo, Enschede, Hengelo, Almelo, Hengelo, Almelo]"
train_18,"[Lelystad Centrum, Almere Centrum, Amsterdam Amstel, Utrecht Centraal, Alphen a/d Rijn, Leiden Centraal, Den Haag HS, Delft, Den Haag Centraal, Gouda, Alphen a/d Rijn]"
train_19,"[Deventer, Zutphen, Deventer, Zwolle, Steenwijk, Zwolle, Assen, Zwolle]"
train_20,"[Amsterdam Sloterdijk, Haarlem, Amsterdam Sloterdijk, Amsterdam Centraal, Amsterdam Amstel, Amsterdam Centraal, Amsterdam Sloterdijk, Zaandam, Beverwijk, Zaandam, Castricum, Alkmaar, Den Helder]"
score,2344.8089887640454
