train,stations
train_1,"[Leeuwarden, Groningen, Assen, Zwolle, Amersfoort, Apeldoorn, Amersfoort]"
train_2,"[Assen, Groningen, Assen, Groningen, Assen, Groningen, Leeuwarden, Groningen]"
train_3,"[Delft, Den Haag Laan v NOI, Delft, Den Haag Centraal, Gouda, Rotterdam Alexander, Gouda, Den Haag HS, Leiden Centraal, Schiphol Airport, Utrecht Centraal]"
train_4,"[Sittard, Heerlen, Sittard, Heerlen, Sittard, Heerlen, Sittard, Roermond, Sittard, Heerlen, Sittard, Roermond]"
train_5,"[Heemstede-Aerdenhout, Haarlem, Amsterdam Sloterdijk, Haarlem, Beverwijk, Zaandam, Hoorn, Zaandam, Hoorn, Alkmaar]"
train_6,"[Hilversum, Almere Centrum, Lelystad Centrum, Almere Centrum, Lelystad Centrum, Almere Centrum, Amsterdam Centraal, Amsterdam Sloterdijk, Amsterdam Zuid, Schiphol Airport, Utrecht Centraal]"
train_7,"[Amsterdam Sloterdijk, Amsterdam Centraal, Utrecht Centraal, Amersfoort, Zwolle, Amersfoort, Utrecht Centraal, Alphen a/d Rijn]"
train_8,"[Sittard, Maastricht, Sittard, Heerlen, Sittard, Heerlen, Sittard, Heerlen, Sittard, Maastricht, Sittard, Roermond, Weert]"
train_9,"[Heerenveen, Leeuwarden, Groningen, Leeuwarden, Heerenveen, Leeuwarden, Groningen, Assen]"
train_10,"[Roermond, Sittard, Roermond, Sittard, Maastricht, Sittard, Maastricht, Sittard, Maastricht, Sittard, Maastricht, Sittard]"
train_11,"[Delft, Den Haag HS, Leiden Centraal, Heemstede-Aerdenhout, Leiden Centraal, Den Haag Centraal, Leiden Centraal, Heemstede-Aerdenhout, Haarlem, Heemstede-Aerdenhout, Haarlem, Heemstede-Aerdenhout, Leiden Centraal, Heemstede-Aerdenhout, Haarlem, Heemstede-Aerdenhout, Haarlem, Heemstede-Aerdenhout, Leiden Centraal]"
train_12,"[Heemstede-Aerdenhout, Leiden Centraal, Schiphol Airport, Leiden Centraal, Alphen a/d Rijn, Gouda, Den Haag HS, Gouda, Alphen a/d Rijn, Leiden Centraal, Den Haag HS, Delft, Schiedam Centrum]"
train_13,"[Heerlen, Sittard, Roermond, Sittard, Maastricht, Sittard, Maastricht, Sittard, Roermond, Sittard, Heerlen, Sittard]"
train_14,"[Almere Centrum, Amsterdam Centraal, Amsterdam Sloterdijk, Haarlem, Amsterdam Sloterdijk, Amsterdam Zuid, Amsterdam Amstel, Utrecht Centraal, Amsterdam Centraal, Almere Centrum, Amsterdam Centraal, Amsterdam Sloterdijk]"
train_15,"[Oss, s-Hertogenbosch, Utrecht Centraal, Alphen a/d Rijn, Gouda, Den Haag HS, Delft, Den Haag Centraal, Delft, Den Haag Centraal, Gouda]"
train_16,"[Beverwijk, Zaandam, Beverwijk, Castricum, Zaandam, Beverwijk, Haarlem, Beverwijk, Castricum, Zaandam]"
train_17,"[Castricum, Zaandam, Beverwijk, Zaandam, Amsterdam Sloterdijk, Zaandam, Hoorn, Alkmaar, Castricum, Alkmaar, Castricum, Zaandam]"
train_18,"[Vlissingen, Roosendaal, Vlissingen]"
train_19,"[Dordrecht, Roosendaal, Vlissingen, Roosendaal]"
train_20,"[Enschede, Hengelo, Enschede, Hengelo, Enschede, Hengelo, Almelo, Hengelo, Enschede, Hengelo, Enschede, Hengelo, Almelo, Deventer, Zwolle, Amersfoort]"
score,632.0561797752807
