train,stations
train_1,"[Venlo, Helmond, Eindhoven, s-Hertogenbosch, Utrecht Centraal, Ede-Wageningen, Utrecht Centraal, Hilversum, Almere Centrum]"
train_2,"[Breda, Dordrecht, Roosendaal, Etten-Leur, Breda, Dordrecht, Rotterdam Blaak, Rotterdam Alexander, Rotterdam Centraal, Schiedam Centrum, Rotterdam Centraal, Dordrecht, Rotterdam Blaak, Rotterdam Alexander, Rotterdam Blaak, Schiedam Centrum]"
train_3,"[Rotterdam Blaak, Schiedam Centrum, Rotterdam Centraal, Dordrecht, Roosendaal, Etten-Leur, Breda, Dordrecht, Rotterdam Centraal, Rotterdam Alexander, Rotterdam Blaak, Schiedam Centrum, Delft, Den Haag HS, Delft, Den Haag Centraal]"
train_4,"[Amsterdam Sloterdijk, Haarlem, Amsterdam Sloterdijk, Haarlem, Amsterdam Sloterdijk, Zaandam, Amsterdam Sloterdijk, Amsterdam Centraal, Almere Centrum, Amsterdam Centraal, Almere Centrum, Amsterdam Centraal, Amsterdam Sloterdijk, Zaandam, Beverwijk]"
train_5,"[Dordrecht, Breda, Tilburg, Eindhoven, Helmond, Eindhoven, Helmond, Venlo, Helmond, Venlo]"
train_6,"[Schiphol Airport, Leiden Centraal, Alphen a/d Rijn, Utrecht Centraal, Amersfoort, Utrecht Centraal, Ede-Wageningen, Utrecht Centraal, Amsterdam Centraal, Amsterdam Sloterdijk]"
train_7,"[Heerlen, Sittard, Heerlen, Sittard, Roermond, Sittard, Heerlen, Sittard, Heerlen, Sittard, Heerlen, Sittard]"
train_8,"[Rotterdam Blaak, Schiedam Centrum, Delft, Den Haag Centraal, Delft, Den Haag Centraal, Leiden Centraal, Schiphol Airport, Leiden Centraal, Den Haag Centraal, Gouda, Den Haag Centraal, Gouda]"
train_9,"[Hengelo, Almelo, Zwolle, Almelo, Zwolle, Deventer, Apeldoorn]"
train_10,"[Hilversum, Almere Centrum, Amsterdam Centraal, Almere Centrum, Hilversum, Amsterdam Amstel, Amsterdam Centraal, Amsterdam Sloterdijk, Amsterdam Centraal, Amsterdam Amstel, Hilversum]"
train_11,"[Den Haag Laan v NOI, Delft, Den Haag HS, Gouda, Alphen a/d Rijn, Utrecht Centraal, Amersfoort, Utrecht Centraal, Alphen a/d Rijn, Leiden Centraal, Schiphol Airport, Amsterdam Zuid]"
train_12,"[Heerenveen, Leeuwarden, Groningen, Assen, Zwolle, Almelo, Deventer]"
train_13,"[Etten-Leur, Roosendaal, Vlissingen, Roosendaal, Etten-Leur, Roosendaal, Etten-Leur]"
train_14,"[Groningen, Assen, Zwolle, Almelo, Deventer, Zutphen, Dieren, Zutphen, Deventer, Zutphen]"
train_15,"[Sittard, Roermond, Weert, Roermond, Sittard, Roermond, Weert, Eindhoven, Tilburg, Breda, Dordrecht, Rotterdam Blaak, Rotterdam Alexander]"
train_16,"[Venlo, Helmond, Venlo, Helmond, Venlo, Helmond]"
train_17,"[Zwolle, Steenwijk, Heerenveen, Leeuwarden, Heerenveen, Steenwijk, Zwolle, Assen]"
train_18,"[Helmond, Eindhoven, Helmond, Eindhoven, Tilburg, s-Hertogenbosch, Tilburg, Breda, Etten-Leur, Breda, Dordrecht, Rotterdam Blaak, Rotterdam Alexander, Gouda, Utrecht Centraal]"
train_19,"[Venlo, Helmond, Eindhoven, Tilburg, Eindhoven, Weert, Roermond, Weert, Eindhoven, Weert, Roermond]"
train_20,"[Schiedam Centrum, Rotterdam Blaak, Schiedam Centrum, Rotterdam Centraal, Dordrecht, Roosendaal, Dordrecht, Breda, Etten-Leur, Breda, Etten-Leur, Breda, Tilburg, s-Hertogenbosch]"
score,1401.9325842696626
