train,stations
train_1,"[Leiden Centraal, Heemstede-Aerdenhout, Leiden Centraal, Schiphol Airport, Leiden Centraal, Alphen a/d Rijn, Utrecht Centraal, Ede-Wageningen, Utrecht Centraal, Amsterdam Centraal]"
train_2,"[Amersfoort, Utrecht Centraal, Ede-Wageningen, Arnhem Centraal, Nijmegen, Oss, s-Hertogenbosch, Eindhoven, Helmond, Venlo, Helmond]"
train_3,"[Roermond, Sittard, Heerlen, Sittard, Heerlen, Sittard, Roermond, Sittard, Heerlen, Sittard, Roermond, Sittard]"
train_4,"[Leiden Centraal, Heemstede-Aerdenhout, Leiden Centraal, Schiphol Airport, Amsterdam Zuid, Schiphol Airport, Utrecht Centraal, s-Hertogenbosch, Oss, Nijmegen, Oss, s-Hertogenbosch]"
train_5,"[Leeuwarden, Heerenveen, Steenwijk, Zwolle, Almelo, Zwolle, Deventer, Apeldoorn]"
train_6,"[Amsterdam Centraal, Utrecht Centraal, Gouda, Utrecht Centraal, Hilversum, Almere Centrum, Amsterdam Centraal, Amsterdam Amstel, Amsterdam Centraal, Amsterdam Sloterdijk, Amsterdam Zuid, Amsterdam Amstel]"
train_7,"[Hoorn, Zaandam, Hoorn, Alkmaar, Castricum, Alkmaar, Castricum, Beverwijk, Castricum, Zaandam, Hoorn]"
train_8,"[Amsterdam Sloterdijk, Amsterdam Zuid, Schiphol Airport, Amsterdam Zuid, Amsterdam Sloterdijk, Amsterdam Centraal, Almere Centrum, Lelystad Centrum, Almere Centrum, Amsterdam Amstel, Almere Centrum, Amsterdam Amstel]"
train_9,"[Dieren, Zutphen, Apeldoorn, Amersfoort, Zwolle, Assen, Groningen, Leeuwarden]"
train_10,"[Lelystad Centrum, Almere Centrum, Lelystad Centrum, Almere Centrum, Lelystad Centrum, Almere Centrum, Hilversum, Utrecht Centraal, s-Hertogenbosch, Eindhoven, s-Hertogenbosch]"
train_11,"[Hengelo, Enschede, Hengelo, Almelo, Zwolle, Amersfoort, Apeldoorn, Zutphen, Dieren, Arnhem Centraal, Ede-Wageningen]"
train_12,"[Helmond, Eindhoven, s-Hertogenbosch, Utrecht Centraal, Schiphol Airport, Leiden Centraal, Den Haag Laan v NOI, Delft, Den Haag Laan v NOI, Leiden Centraal, Den Haag Laan v NOI, Leiden Centraal, Den Haag Laan v NOI]"
train_13,"[Alphen a/d Rijn, Utrecht Centraal, Alphen a/d Rijn, Utrecht Centraal, Hilversum, Amsterdam Amstel, Amsterdam Centraal, Amsterdam Amstel, Utrecht Centraal, Hilversum]"
train_14,"[Roermond, Sittard, Roermond, Sittard, Heerlen, Sittard, Heerlen, Sittard, Roermond, Weert, Eindhoven, Helmond, Eindhoven, Helmond]"
train_15,"[Deventer, Zutphen, Deventer, Zutphen, Deventer, Zwolle, Steenwijk, Heerenveen, Leeuwarden, Groningen]"
train_16,"[Etten-Leur, Roosendaal, Etten-Leur, Breda, Etten-Leur, Roosendaal, Dordrecht, Roosendaal, Etten-Leur, Roosendaal, Dordrecht, Rotterdam Blaak, Schiedam Centrum, Rotterdam Centraal, Schiedam Centrum]"
train_17,"[Etten-Leur, Roosendaal, Dordrecht, Rotterdam Blaak, Dordrecht, Roosendaal, Vlissingen]"
train_18,"[Haarlem, Heemstede-Aerdenhout, Leiden Centraal, Alphen a/d Rijn, Gouda, Den Haag Laan v NOI, Leiden Centraal, Heemstede-Aerdenhout, Leiden Centraal, Den Haag Centraal, Delft, Den Haag HS, Leiden Centraal, Alphen a/d Rijn]"
train_19,"[s-Hertogenbosch, Tilburg, s-Hertogenbosch, Utrecht Centraal, Hilversum, Amsterdam Amstel, Almere Centrum, Amsterdam Amstel, Utrecht Centraal]"
train_20,"[Maastricht, Sittard, Heerlen, Sittard, Roermond, Sittard, Heerlen, Sittard, Heerlen, Sittard, Roermond, Sittard]"
score,2751.2471910112363
