train,stations
train_1,"[Apeldoorn, Deventer, Apeldoorn, Zutphen, Dieren, Zutphen, Apeldoorn, Zutphen, Dieren, Arnhem Centraal, Nijmegen, Oss, Nijmegen, Oss]"
train_2,"[Lelystad Centrum, Almere Centrum, Amsterdam Amstel, Hilversum, Almere Centrum, Hilversum, Amsterdam Amstel, Almere Centrum]"
train_3,"[Utrecht Centraal, Schiphol Airport, Utrecht Centraal, Hilversum, Almere Centrum, Amsterdam Amstel, Amsterdam Zuid, Schiphol Airport]"
train_4,"[Deventer, Zwolle, Deventer, Apeldoorn, Zutphen, Apeldoorn, Zutphen, Dieren, Arnhem Centraal, Dieren, Arnhem Centraal, Ede-Wageningen]"
train_5,"[Heemstede-Aerdenhout, Leiden Centraal, Den Haag HS, Delft, Den Haag Laan v NOI, Leiden Centraal, Den Haag Centraal, Delft, Den Haag Centraal, Delft, Schiedam Centrum, Rotterdam Blaak, Rotterdam Alexander, Rotterdam Centraal, Schiedam Centrum, Delft, Den Haag HS, Delft]"
train_6,"[Schiedam Centrum, Rotterdam Centraal, Dordrecht, Rotterdam Centraal, Rotterdam Alexander, Gouda, Utrecht Centraal, Amsterdam Centraal, Amsterdam Sloterdijk, Zaandam, Amsterdam Sloterdijk, Amsterdam Zuid, Amsterdam Sloterdijk, Zaandam, Amsterdam Sloterdijk, Haarlem]"
train_7,"[Schiphol Airport, Leiden Centraal, Schiphol Airport, Amsterdam Zuid, Amsterdam Sloterdijk, Amsterdam Centraal, Almere Centrum, Hilversum, Utrecht Centraal, Ede-Wageningen, Utrecht Centraal]"
train_8,"[Lelystad Centrum, Almere Centrum, Amsterdam Centraal, Almere Centrum, Hilversum, Utrecht Centraal, Amsterdam Amstel, Amsterdam Zuid, Schiphol Airport, Utrecht Centraal]"
train_9,"[Breda, Dordrecht, Roosendaal, Vlissingen, Roosendaal]"
train_10,"[Alphen a/d Rijn, Leiden Centraal, Schiphol Airport, Amsterdam Zuid, Amsterdam Amstel, Almere Centrum, Amsterdam Centraal, Almere Centrum, Hilversum, Utrecht Centraal]"
train_11,"[Leiden Centraal, Den Haag Laan v NOI, Leiden Centraal, Schiphol Airport, Amsterdam Zuid, Amsterdam Amstel, Amsterdam Zuid, Amsterdam Amstel, Utrecht Centraal, Amersfoort, Utrecht Centraal, s-Hertogenbosch, Eindhoven, Helmond, Eindhoven]"
train_12,"[Rotterdam Centraal, Schiedam Centrum, Rotterdam Centraal, Schiedam Centrum, Rotterdam Blaak, Schiedam Centrum, Rotterdam Blaak, Rotterdam Alexander, Gouda, Den Haag Centraal, Gouda, Den Haag Laan v NOI, Leiden Centraal, Den Haag Centraal, Delft, Den Haag Laan v NOI]"
train_13,"[Den Haag Laan v NOI, Leiden Centraal, Heemstede-Aerdenhout, Leiden Centraal, Alphen a/d Rijn, Leiden Centraal, Alphen a/d Rijn, Gouda, Utrecht Centraal, Amersfoort, Apeldoorn, Zutphen]"
train_14,"[Schiphol Airport, Leiden Centraal, Den Haag Laan v NOI, Leiden Centraal, Alphen a/d Rijn, Leiden Centraal, Den Haag HS, Gouda, Den Haag Laan v NOI, Leiden Centraal, Den Haag HS, Gouda]"
train_15,"[Amsterdam Amstel, Amsterdam Centraal, Utrecht Centraal, Hilversum, Utrecht Centraal, Ede-Wageningen, Arnhem Centraal, Ede-Wageningen, Arnhem Centraal, Nijmegen, Arnhem Centraal, Dieren, Zutphen, Dieren]"
train_16,"[Rotterdam Blaak, Dordrecht, Rotterdam Centraal, Rotterdam Alexander, Rotterdam Centraal, Rotterdam Alexander, Rotterdam Blaak, Dordrecht, Rotterdam Blaak, Dordrecht, Roosendaal, Dordrecht, Breda]"
train_17,"[Den Haag Laan v NOI, Leiden Centraal, Den Haag Laan v NOI, Leiden Centraal, Schiphol Airport, Leiden Centraal, Den Haag Laan v NOI, Leiden Centraal, Den Haag Laan v NOI, Delft, Den Haag Centraal, Delft, Den Haag HS, Delft, Den Haag Centraal, Delft, Den Haag Laan v NOI]"
train_18,"[Steenwijk, Zwolle, Almelo, Zwolle, Almelo, Hengelo, Almelo]"
train_19,"[Zwolle, Amersfoort, Utrecht Centraal, Alphen a/d Rijn, Gouda, Den Haag HS, Delft, Schiedam Centrum, Rotterdam Blaak, Rotterdam Alexander, Rotterdam Blaak, Rotterdam Alexander]"
train_20,"[Den Haag HS, Delft, Den Haag Centraal, Delft, Den Haag Laan v NOI, Delft, Den Haag Laan v NOI, Gouda, Alphen a/d Rijn, Gouda, Utrecht Centraal, Amsterdam Amstel]"
score,1300.5730337078649
