train,stations
train_1,"[Nijmegen, Arnhem Centraal, Ede-Wageningen, Arnhem Centraal, Ede-Wageningen, Utrecht Centraal, Schiphol Airport, Utrecht Centraal, Amersfoort, Utrecht Centraal, Hilversum]"
train_2,"[Dordrecht, Roosendaal, Dordrecht, Breda, Tilburg, Breda, Etten-Leur, Breda, Dordrecht, Rotterdam Centraal, Dordrecht, Roosendaal]"
train_3,"[Hoorn, Zaandam, Amsterdam Sloterdijk, Zaandam, Beverwijk, Castricum, Zaandam, Hoorn, Alkmaar, Castricum, Alkmaar]"
train_4,"[Rotterdam Alexander, Rotterdam Centraal, Schiedam Centrum, Rotterdam Blaak, Dordrecht, Breda, Etten-Leur, Breda, Dordrecht, Rotterdam Centraal, Dordrecht, Breda, Dordrecht, Rotterdam Blaak]"
train_5,"[Heerlen, Sittard, Maastricht, Sittard, Heerlen, Sittard, Roermond, Sittard, Roermond, Weert, Eindhoven, s-Hertogenbosch]"
train_6,"[Heerlen, Sittard, Roermond, Sittard, Heerlen, Sittard, Maastricht, Sittard, Heerlen, Sittard, Heerlen, Sittard]"
train_7,"[Vlissingen, Roosendaal, Vlissingen]"
train_8,"[Venlo, Helmond, Eindhoven, Helmond, Venlo, Helmond, Eindhoven, Weert, Eindhoven, Tilburg]"
train_9,"[Steenwijk, Zwolle, Steenwijk, Heerenveen, Leeuwarden, Groningen, Leeuwarden]"
train_10,"[Alphen a/d Rijn, Utrecht Centraal, Gouda, Alphen a/d Rijn, Utrecht Centraal, s-Hertogenbosch, Eindhoven, s-Hertogenbosch, Oss]"
train_11,"[Amersfoort, Apeldoorn, Amersfoort, Apeldoorn, Deventer, Almelo, Zwolle]"
train_12,"[Amsterdam Amstel, Utrecht Centraal, Amersfoort, Apeldoorn, Amersfoort, Zwolle, Deventer, Almelo]"
train_13,"[Helmond, Eindhoven, Tilburg, Eindhoven, Helmond, Venlo, Helmond, Venlo]"
train_14,"[Weert, Eindhoven, Weert, Roermond, Sittard, Roermond, Weert, Eindhoven, s-Hertogenbosch, Utrecht Centraal, Amersfoort]"
train_15,"[Dieren, Arnhem Centraal, Dieren, Zutphen, Deventer, Almelo, Hengelo, Almelo, Hengelo, Almelo, Zwolle]"
train_16,"[Tilburg, Breda, Dordrecht, Roosendaal, Etten-Leur, Roosendaal, Vlissingen]"
train_17,"[Almere Centrum, Hilversum, Utrecht Centraal, Amsterdam Amstel, Utrecht Centraal, Hilversum, Utrecht Centraal, Amsterdam Centraal, Amsterdam Sloterdijk, Amsterdam Centraal, Almere Centrum]"
train_18,"[Haarlem, Heemstede-Aerdenhout, Leiden Centraal, Den Haag Laan v NOI, Leiden Centraal, Alphen a/d Rijn, Leiden Centraal, Den Haag Laan v NOI, Leiden Centraal, Schiphol Airport, Leiden Centraal, Den Haag HS, Gouda, Den Haag Laan v NOI]"
train_19,"[Schiedam Centrum, Delft, Schiedam Centrum, Rotterdam Blaak, Dordrecht, Rotterdam Blaak, Dordrecht, Breda, Dordrecht, Breda, Etten-Leur, Breda, Tilburg, Eindhoven, Helmond]"
train_20,"[Deventer, Apeldoorn, Amersfoort, Utrecht Centraal, Schiphol Airport, Utrecht Centraal, Amsterdam Amstel, Amsterdam Zuid, Amsterdam Sloterdijk, Haarlem, Heemstede-Aerdenhout]"
score,2443.8089887640454
