train,stations
train_1,"[s-Hertogenbosch, Utrecht Centraal, Amsterdam Centraal, Amsterdam Amstel, Almere Centrum, Amsterdam Amstel, Hilversum, Amsterdam Amstel]"
train_2,"[Hoorn, Zaandam, Amsterdam Sloterdijk, Amsterdam Centraal, Amsterdam Amstel, Hilversum, Utrecht Centraal, Amersfoort, Zwolle, Assen]"
train_3,"[Alkmaar, Hoorn, Alkmaar, Castricum, Zaandam, Hoorn, Zaandam, Amsterdam Sloterdijk, Amsterdam Zuid, Amsterdam Sloterdijk, Amsterdam Zuid]"
train_4,"[Zutphen, Apeldoorn, Amersfoort, Utrecht Centraal, Gouda, Den Haag Laan v NOI, Delft, Schiedam Centrum, Rotterdam Centraal, Schiedam Centrum, Rotterdam Blaak, Rotterdam Alexander, Gouda]"
train_5,"[Dieren, Arnhem Centraal, Nijmegen, Arnhem Centraal, Dieren, Arnhem Centraal, Dieren, Zutphen, Deventer, Zwolle, Assen]"
train_6,"[Den Haag Centraal, Gouda, Utrecht Centraal, Gouda, Den Haag Laan v NOI, Delft, Den Haag Centraal, Gouda, Den Haag HS, Gouda]"
train_7,"[Venlo, Helmond, Eindhoven, s-Hertogenbosch, Oss, s-Hertogenbosch, Eindhoven, Tilburg, s-Hertogenbosch, Oss, Nijmegen, Oss]"
train_8,"[Heerlen, Sittard, Maastricht, Sittard, Roermond, Weert, Eindhoven, Weert, Eindhoven, Tilburg, s-Hertogenbosch, Tilburg]"
train_9,"[Den Haag HS, Gouda, Den Haag Laan v NOI, Delft, Den Haag Centraal, Delft, Den Haag HS, Delft, Schiedam Centrum, Rotterdam Centraal, Schiedam Centrum, Delft, Schiedam Centrum, Rotterdam Blaak, Dordrecht, Breda]"
train_10,"[Schiphol Airport, Amsterdam Zuid, Schiphol Airport, Leiden Centraal, Alphen a/d Rijn, Leiden Centraal, Den Haag Centraal, Gouda, Den Haag Centraal, Delft, Den Haag Centraal, Leiden Centraal, Den Haag Laan v NOI, Gouda]"
train_11,"[Heerenveen, Steenwijk, Heerenveen, Steenwijk, Zwolle, Amersfoort, Utrecht Centraal, s-Hertogenbosch, Eindhoven, s-Hertogenbosch]"
train_12,"[Breda, Etten-Leur, Breda, Dordrecht, Breda, Dordrecht, Rotterdam Centraal, Schiedam Centrum, Delft, Den Haag Centraal, Leiden Centraal, Schiphol Airport, Leiden Centraal, Den Haag Laan v NOI, Delft]"
train_13,"[Hoorn, Zaandam, Beverwijk, Haarlem, Amsterdam Sloterdijk, Amsterdam Centraal, Utrecht Centraal, Hilversum, Almere Centrum, Hilversum]"
train_14,"[Haarlem, Amsterdam Sloterdijk, Zaandam, Hoorn, Zaandam, Beverwijk, Zaandam, Amsterdam Sloterdijk, Haarlem, Heemstede-Aerdenhout, Leiden Centraal, Den Haag HS]"
train_15,"[Rotterdam Blaak, Rotterdam Alexander, Rotterdam Centraal, Schiedam Centrum, Rotterdam Blaak, Schiedam Centrum, Rotterdam Centraal, Schiedam Centrum, Rotterdam Blaak, Schiedam Centrum, Delft, Den Haag Laan v NOI, Delft, Den Haag Laan v NOI, Leiden Centraal, Den Haag Centraal, Leiden Centraal, Heemstede-Aerdenhout, Haarlem, Heemstede-Aerdenhout]"
train_16,"[Heerenveen, Leeuwarden, Heerenveen, Steenwijk, Zwolle, Amersfoort, Apeldoorn, Amersfoort, Apeldoorn]"
train_17,"[Schiedam Centrum, Rotterdam Centraal, Schiedam Centrum, Rotterdam Centraal, Rotterdam Alexander, Gouda, Den Haag HS, Delft, Den Haag Centraal, Leiden Centraal, Heemstede-Aerdenhout, Haarlem, Heemstede-Aerdenhout, Haarlem, Heemstede-Aerdenhout, Haarlem, Heemstede-Aerdenhout, Leiden Centraal, Den Haag Laan v NOI, Delft]"
train_18,"[Amsterdam Amstel, Utrecht Centraal, Gouda, Den Haag Centraal, Gouda, Den Haag Laan v NOI, Delft, Den Haag Laan v NOI, Delft, Den Haag Centraal, Gouda]"
train_19,"[Dieren, Zutphen, Dieren, Zutphen, Apeldoorn, Zutphen, Dieren, Arnhem Centraal, Dieren, Zutphen, Apeldoorn, Deventer, Almelo, Hengelo, Enschede]"
train_20,"[Schiphol Airport, Amsterdam Zuid, Amsterdam Sloterdijk, Amsterdam Zuid, Schiphol Airport, Amsterdam Zuid, Amsterdam Amstel, Utrecht Centraal, Schiphol Airport, Leiden Centraal, Schiphol Airport, Utrecht Centraal]"
score,2858.606741573034
