train,stations
train_1,"[Apeldoorn, Amersfoort, Utrecht Centraal, Alphen a/d Rijn, Utrecht Centraal, s-Hertogenbosch, Tilburg, Eindhoven, Weert]"
train_2,"[Sittard, Maastricht, Sittard, Heerlen, Sittard, Roermond, Weert, Eindhoven, Tilburg, Breda, Tilburg, Eindhoven]"
train_3,"[Weert, Eindhoven, s-Hertogenbosch, Tilburg, Eindhoven, Helmond, Eindhoven, Helmond, Venlo, Helmond, Eindhoven, Helmond]"
train_4,"[Roermond, Weert, Eindhoven, Weert, Roermond, Weert, Roermond, Weert, Eindhoven, Helmond, Eindhoven, Helmond, Venlo]"
train_5,"[Ede-Wageningen, Utrecht Centraal, Schiphol Airport, Leiden Centraal, Den Haag HS, Delft, Den Haag Centraal, Leiden Centraal, Den Haag HS, Leiden Centraal, Den Haag Centraal, Delft, Schiedam Centrum]"
train_6,"[Den Haag Laan v NOI, Gouda, Alphen a/d Rijn, Utrecht Centraal, Amsterdam Amstel, Almere Centrum, Amsterdam Amstel, Hilversum]"
train_7,"[Arnhem Centraal, Ede-Wageningen, Arnhem Centraal, Ede-Wageningen, Utrecht Centraal, Amsterdam Amstel, Amsterdam Zuid, Amsterdam Sloterdijk, Zaandam, Castricum, Alkmaar, Castricum, Zaandam, Castricum, Zaandam, Amsterdam Sloterdijk]"
train_8,"[Groningen, Assen, Zwolle, Assen, Zwolle, Assen]"
train_9,"[Weert, Roermond, Weert, Roermond, Weert, Roermond, Weert, Eindhoven, Helmond, Venlo, Helmond, Eindhoven]"
train_10,"[Dieren, Zutphen, Apeldoorn, Zutphen, Dieren, Zutphen, Deventer, Zwolle, Deventer, Zutphen, Deventer, Almelo]"
train_11,"[Tilburg, Breda, Etten-Leur, Breda, Dordrecht, Rotterdam Blaak, Schiedam Centrum, Delft, Schiedam Centrum, Delft, Schiedam Centrum, Rotterdam Blaak, Rotterdam Alexander, Rotterdam Centraal, Rotterdam Alexander, Gouda, Den Haag HS, Delft]"
train_12,"[Hoorn, Alkmaar, Den Helder, Alkmaar, Castricum, Zaandam, Castricum, Beverwijk, Zaandam, Castricum]"
train_13,"[Deventer, Zwolle, Amersfoort, Utrecht Centraal, Amsterdam Centraal, Almere Centrum, Amsterdam Centraal, Utrecht Centraal]"
train_14,"[Zutphen, Dieren, Arnhem Centraal, Dieren, Zutphen, Dieren, Arnhem Centraal, Dieren, Zutphen, Apeldoorn, Zutphen, Dieren, Zutphen, Dieren, Zutphen, Apeldoorn]"
train_15,"[Lelystad Centrum, Almere Centrum, Hilversum, Almere Centrum, Hilversum, Amsterdam Amstel, Amsterdam Centraal, Amsterdam Amstel, Amsterdam Zuid, Amsterdam Sloterdijk, Haarlem]"
train_16,"[Etten-Leur, Roosendaal, Dordrecht, Rotterdam Blaak, Schiedam Centrum, Rotterdam Centraal, Dordrecht, Roosendaal, Vlissingen]"
train_17,"[Groningen, Assen, Groningen, Leeuwarden, Heerenveen, Steenwijk, Zwolle, Steenwijk, Zwolle]"
train_18,"[Gouda, Den Haag HS, Leiden Centraal, Heemstede-Aerdenhout, Leiden Centraal, Den Haag Laan v NOI, Gouda, Den Haag HS, Leiden Centraal, Den Haag Centraal, Delft, Den Haag HS]"
train_19,"[Gouda, Utrecht Centraal, Amersfoort, Apeldoorn, Amersfoort, Apeldoorn, Zutphen, Deventer, Apeldoorn, Deventer]"
train_20,"[Amsterdam Amstel, Hilversum, Almere Centrum, Amsterdam Centraal, Amsterdam Amstel, Amsterdam Centraal, Amsterdam Amstel, Amsterdam Centraal, Amsterdam Sloterdijk, Amsterdam Zuid, Schiphol Airport, Utrecht Centraal]"
score,3074.3258426966295
