train,stations
train_1,"[Rotterdam Blaak, Schiedam Centrum, Rotterdam Blaak, Schiedam Centrum, Delft, Schiedam Centrum, Rotterdam Blaak, Schiedam Centrum, Rotterdam Blaak, Schiedam Centrum, Delft, Den Haag Laan v NOI, Leiden Centraal, Den Haag HS, Leiden Centraal, Heemstede-Aerdenhout, Leiden Centraal]"
train_2,"[Schiedam Centrum, Rotterdam Blaak, Dordrecht, Rotterdam Centraal, Schiedam Centrum, Rotterdam Blaak, Dordrecht, Rotterdam Blaak, Dordrecht, Rotterdam Blaak, Schiedam Centrum, Rotterdam Centraal, Schiedam Centrum, Rotterdam Centraal, Rotterdam Alexander, Gouda, Den Haag Centraal]"
train_3,"[Zwolle, Almelo, Zwolle, Almelo, Zwolle]"
train_4,"[Lelystad Centrum, Almere Centrum, Hilversum, Almere Centrum, Amsterdam Amstel, Amsterdam Zuid, Amsterdam Sloterdijk, Haarlem, Amsterdam Sloterdijk, Haarlem, Beverwijk]"
train_5,"[Heerlen, Sittard, Maastricht, Sittard, Heerlen, Sittard, Roermond, Weert, Eindhoven, Weert, Roermond, Weert]"
train_6,"[Hengelo, Enschede, Hengelo, Enschede, Hengelo, Almelo, Deventer, Apeldoorn, Zutphen, Dieren, Arnhem Centraal, Ede-Wageningen, Arnhem Centraal, Nijmegen, Arnhem Centraal, Dieren, Zutphen]"
train_7,"[Vlissingen, Roosendaal, Dordrecht, Breda, Etten-Leur, Roosendaal, Dordrecht, Breda, Etten-Leur, Roosendaal]"
train_8,"[Arnhem Centraal, Dieren, Zutphen, Dieren, Zutphen, Deventer, Zwolle, Almelo, Hengelo, Almelo, Hengelo, Almelo, Deventer]"
train_9,"[Heemstede-Aerdenhout, Haarlem, Heemstede-Aerdenhout, Leiden Centraal, Den Haag HS, Delft, Schiedam Centrum, Rotterdam Centraal, Rotterdam Alexander, Rotterdam Centraal, Rotterdam Alexander, Rotterdam Blaak, Schiedam Centrum, Rotterdam Blaak, Schiedam Centrum, Rotterdam Blaak, Dordrecht, Rotterdam Blaak, Rotterdam Alexander, Rotterdam Centraal]"
train_10,"[Castricum, Zaandam, Beverwijk, Haarlem, Heemstede-Aerdenhout, Haarlem, Amsterdam Sloterdijk, Haarlem, Amsterdam Sloterdijk, Amsterdam Zuid, Amsterdam Sloterdijk, Amsterdam Centraal, Amsterdam Sloterdijk, Zaandam, Beverwijk]"
train_11,"[Leiden Centraal, Den Haag Laan v NOI, Leiden Centraal, Den Haag HS, Gouda, Den Haag HS, Leiden Centraal, Heemstede-Aerdenhout, Leiden Centraal, Alphen a/d Rijn, Utrecht Centraal, Amersfoort]"
train_12,"[Oss, Nijmegen, Oss, s-Hertogenbosch, Tilburg, Eindhoven, Tilburg, s-Hertogenbosch, Utrecht Centraal, Schiphol Airport]"
train_13,"[Helmond, Venlo, Helmond, Eindhoven, s-Hertogenbosch, Eindhoven, Tilburg, Eindhoven, s-Hertogenbosch, Oss]"
train_14,"[Schiphol Airport, Leiden Centraal, Den Haag Centraal, Delft, Den Haag HS, Delft, Schiedam Centrum, Rotterdam Centraal, Rotterdam Alexander, Gouda, Den Haag Laan v NOI, Gouda, Den Haag Centraal, Delft]"
train_15,"[Leeuwarden, Heerenveen, Leeuwarden, Heerenveen, Steenwijk, Heerenveen, Leeuwarden, Groningen, Assen, Groningen]"
train_16,"[Maastricht, Sittard, Maastricht, Sittard, Heerlen, Sittard, Maastricht, Sittard, Maastricht, Sittard, Roermond, Weert]"
train_17,"[Heerenveen, Leeuwarden, Groningen, Leeuwarden, Groningen, Leeuwarden, Heerenveen]"
train_18,"[Vlissingen, Roosendaal, Etten-Leur, Roosendaal, Vlissingen]"
train_19,"[Hengelo, Almelo, Hengelo, Almelo, Zwolle, Steenwijk, Zwolle, Almelo, Hengelo]"
train_20,"[Apeldoorn, Amersfoort, Zwolle, Steenwijk, Heerenveen, Leeuwarden, Groningen]"
score,2688.8876404494376
