train,stations
train_1,"[Eindhoven, Weert, Eindhoven, Helmond, Venlo, Helmond, Venlo, Helmond]"
train_2,"[Amsterdam Zuid, Schiphol Airport, Utrecht Centraal, Amersfoort, Apeldoorn, Amersfoort, Zwolle, Assen]"
train_3,"[Amsterdam Sloterdijk, Amsterdam Zuid, Amsterdam Amstel, Hilversum, Utrecht Centraal, Alphen a/d Rijn, Utrecht Centraal, Schiphol Airport, Leiden Centraal]"
train_4,"[Lelystad Centrum, Almere Centrum, Hilversum, Almere Centrum, Lelystad Centrum, Almere Centrum, Hilversum, Almere Centrum, Lelystad Centrum, Almere Centrum]"
train_5,"[Utrecht Centraal, Hilversum, Utrecht Centraal, Amersfoort, Apeldoorn, Zutphen, Apeldoorn, Amersfoort, Zwolle]"
train_6,"[Oss, Nijmegen, Arnhem Centraal, Dieren, Arnhem Centraal, Ede-Wageningen, Arnhem Centraal, Dieren, Arnhem Centraal, Ede-Wageningen, Arnhem Centraal, Nijmegen, Oss, Nijmegen, Oss]"
train_7,"[Etten-Leur, Breda, Dordrecht, Rotterdam Blaak, Rotterdam Alexander, Rotterdam Centraal, Schiedam Centrum, Delft, Den Haag Laan v NOI, Leiden Centraal, Den Haag Laan v NOI, Leiden Centraal, Den Haag Laan v NOI, Gouda, Rotterdam Alexander, Rotterdam Centraal, Dordrecht]"
train_8,"[Dieren, Arnhem Centraal, Nijmegen, Arnhem Centraal, Ede-Wageningen, Arnhem Centraal, Nijmegen, Oss, s-Hertogenbosch, Eindhoven, Helmond, Venlo]"
train_9,"[Amsterdam Centraal, Almere Centrum, Amsterdam Amstel, Amsterdam Centraal, Amsterdam Sloterdijk, Haarlem, Beverwijk, Haarlem, Heemstede-Aerdenhout, Leiden Centraal, Den Haag HS, Gouda, Rotterdam Alexander, Rotterdam Centraal]"
train_10,"[Oss, s-Hertogenbosch, Tilburg, Breda, Dordrecht, Rotterdam Centraal, Schiedam Centrum, Rotterdam Centraal, Rotterdam Alexander, Rotterdam Blaak, Schiedam Centrum, Rotterdam Centraal, Dordrecht, Rotterdam Blaak, Schiedam Centrum, Rotterdam Centraal]"
train_11,"[Tilburg, Eindhoven, Helmond, Venlo, Helmond, Eindhoven, Weert, Roermond, Weert, Eindhoven, Helmond]"
train_12,"[Arnhem Centraal, Dieren, Arnhem Centraal, Nijmegen, Oss, s-Hertogenbosch, Utrecht Centraal, Amsterdam Amstel, Amsterdam Centraal, Amsterdam Amstel, Amsterdam Zuid, Amsterdam Sloterdijk, Amsterdam Centraal, Amsterdam Amstel, Amsterdam Zuid]"
train_13,"[Utrecht Centraal, Amersfoort, Utrecht Centraal, Amsterdam Amstel, Utrecht Centraal, Gouda, Den Haag HS, Gouda, Den Haag Laan v NOI]"
train_14,"[s-Hertogenbosch, Tilburg, Breda, Tilburg, Eindhoven, Helmond, Venlo, Helmond, Eindhoven, Helmond, Venlo]"
train_15,"[Rotterdam Alexander, Rotterdam Centraal, Dordrecht, Rotterdam Blaak, Schiedam Centrum, Rotterdam Centraal, Schiedam Centrum, Rotterdam Centraal, Rotterdam Alexander, Rotterdam Blaak, Rotterdam Alexander, Rotterdam Centraal, Dordrecht, Breda, Dordrecht, Roosendaal]"
train_16,"[Nijmegen, Arnhem Centraal, Dieren, Zutphen, Dieren, Arnhem Centraal, Dieren, Zutphen, Deventer, Zwolle, Almelo, Deventer]"
train_17,"[s-Hertogenbosch, Utrecht Centraal, Schiphol Airport, Amsterdam Zuid, Amsterdam Amstel, Utrecht Centraal, Schiphol Airport, Utrecht Centraal]"
train_18,"[Den Haag Centraal, Delft, Den Haag HS, Delft, Den Haag Laan v NOI, Leiden Centraal, Heemstede-Aerdenhout, Leiden Centraal, Schiphol Airport, Leiden Centraal, Alphen a/d Rijn, Gouda, Den Haag Laan v NOI, Leiden Centraal]"
train_19,"[Schiphol Airport, Utrecht Centraal, s-Hertogenbosch, Oss, s-Hertogenbosch, Eindhoven, Weert, Eindhoven, Helmond, Eindhoven, s-Hertogenbosch]"
train_20,"[Heerenveen, Leeuwarden, Heerenveen, Leeuwarden, Groningen, Leeuwarden, Groningen, Assen]"
score,2127.089887640449
