train,stations
train_1,"[Amsterdam Amstel, Utrecht Centraal, Amsterdam Amstel, Utrecht Centraal, s-Hertogenbosch, Tilburg, s-Hertogenbosch, Oss, s-Hertogenbosch, Oss, s-Hertogenbosch]"
train_2,"[Eindhoven, Helmond, Venlo, Helmond, Venlo, Helmond, Venlo]"
train_3,"[Helmond, Venlo, Helmond, Eindhoven, Helmond, Venlo, Helmond, Eindhoven, Weert]"
train_4,"[Etten-Leur, Breda, Tilburg, Eindhoven, Weert, Roermond, Sittard, Heerlen, Sittard, Maastricht, Sittard, Roermond, Sittard]"
train_5,"[Leeuwarden, Groningen, Assen, Zwolle, Amersfoort, Zwolle]"
train_6,"[Assen, Groningen, Leeuwarden, Groningen, Assen, Zwolle]"
train_7,"[Castricum, Alkmaar, Den Helder, Alkmaar, Hoorn, Alkmaar, Hoorn, Zaandam]"
train_8,"[Groningen, Assen, Zwolle, Deventer, Zwolle, Deventer, Almelo, Deventer]"
train_9,"[Assen, Groningen, Assen, Zwolle, Assen, Groningen, Leeuwarden]"
train_10,"[Amsterdam Amstel, Almere Centrum, Amsterdam Amstel, Almere Centrum, Amsterdam Centraal, Amsterdam Sloterdijk, Amsterdam Centraal, Amsterdam Amstel, Amsterdam Zuid, Amsterdam Amstel, Almere Centrum]"
train_11,"[Maastricht, Sittard, Heerlen, Sittard, Roermond, Weert, Roermond, Weert, Eindhoven, s-Hertogenbosch, Eindhoven, Helmond]"
train_12,"[Etten-Leur, Breda, Tilburg, Breda, Tilburg, s-Hertogenbosch, Utrecht Centraal, Amsterdam Centraal, Amsterdam Amstel, Hilversum, Almere Centrum]"
train_13,"[Amersfoort, Zwolle, Amersfoort, Apeldoorn, Amersfoort, Zwolle]"
train_14,"[Zaandam, Castricum, Zaandam, Beverwijk, Zaandam, Amsterdam Sloterdijk, Amsterdam Centraal, Amsterdam Sloterdijk, Haarlem, Amsterdam Sloterdijk, Haarlem, Amsterdam Sloterdijk, Zaandam, Castricum, Beverwijk]"
train_15,"[Almere Centrum, Hilversum, Almere Centrum, Hilversum, Almere Centrum, Lelystad Centrum, Almere Centrum, Lelystad Centrum, Almere Centrum]"
train_16,"[Schiedam Centrum, Rotterdam Blaak, Dordrecht, Breda, Etten-Leur, Breda, Etten-Leur, Breda, Dordrecht, Breda, Etten-Leur, Roosendaal]"
train_17,"[Amsterdam Centraal, Almere Centrum, Amsterdam Centraal, Utrecht Centraal, Amsterdam Amstel, Amsterdam Centraal, Utrecht Centraal, Schiphol Airport, Leiden Centraal]"
train_18,"[Deventer, Zwolle, Amersfoort, Apeldoorn, Zutphen, Dieren, Zutphen, Dieren, Arnhem Centraal, Ede-Wageningen, Arnhem Centraal, Nijmegen]"
train_19,"[Roosendaal, Dordrecht, Breda, Etten-Leur, Breda, Etten-Leur, Roosendaal, Etten-Leur, Breda, Etten-Leur, Breda, Dordrecht, Rotterdam Centraal, Schiedam Centrum, Rotterdam Blaak, Dordrecht]"
train_20,"[Rotterdam Alexander, Rotterdam Centraal, Dordrecht, Rotterdam Blaak, Dordrecht, Roosendaal, Vlissingen]"
score,1012.1348314606739
