train,stations
train_1,"[Dieren, Arnhem Centraal, Ede-Wageningen, Utrecht Centraal, s-Hertogenbosch, Eindhoven, Weert, Eindhoven, Weert, Eindhoven, Helmond, Eindhoven]"
train_2,"[Leeuwarden, Heerenveen, Leeuwarden, Groningen, Assen, Zwolle, Amersfoort, Utrecht Centraal]"
train_3,"[Sittard, Maastricht, Sittard, Roermond, Sittard, Maastricht, Sittard, Maastricht, Sittard, Heerlen, Sittard, Roermond, Weert]"
train_4,"[Enschede, Hengelo, Enschede, Hengelo, Almelo, Zwolle, Deventer, Apeldoorn, Deventer, Zwolle]"
train_5,"[Vlissingen, Roosendaal, Etten-Leur, Breda, Etten-Leur, Roosendaal, Vlissingen]"
train_6,"[Castricum, Zaandam, Amsterdam Sloterdijk, Zaandam, Amsterdam Sloterdijk, Amsterdam Centraal, Almere Centrum, Hilversum, Almere Centrum, Amsterdam Amstel, Utrecht Centraal, Amsterdam Amstel]"
train_7,"[Amersfoort, Apeldoorn, Amersfoort, Apeldoorn, Amersfoort, Zwolle, Amersfoort]"
train_8,"[s-Hertogenbosch, Eindhoven, Weert, Roermond, Sittard, Heerlen, Sittard, Heerlen, Sittard, Heerlen, Sittard, Heerlen]"
train_9,"[Amersfoort, Zwolle, Assen, Groningen, Assen, Groningen, Assen]"
train_10,"[Zaandam, Castricum, Zaandam, Beverwijk, Castricum, Alkmaar, Den Helder, Alkmaar, Hoorn]"
train_11,"[Heemstede-Aerdenhout, Haarlem, Amsterdam Sloterdijk, Zaandam, Castricum, Alkmaar, Hoorn, Zaandam, Beverwijk, Haarlem, Beverwijk, Castricum, Alkmaar]"
train_12,"[Weert, Roermond, Sittard, Maastricht, Sittard, Maastricht, Sittard, Roermond, Weert, Roermond, Weert, Roermond, Sittard]"
train_13,"[Sittard, Heerlen, Sittard, Maastricht, Sittard, Maastricht, Sittard, Maastricht, Sittard, Roermond, Weert, Eindhoven]"
train_14,"[Steenwijk, Heerenveen, Leeuwarden, Groningen, Leeuwarden, Heerenveen, Leeuwarden, Heerenveen, Leeuwarden]"
train_15,"[Heemstede-Aerdenhout, Haarlem, Heemstede-Aerdenhout, Haarlem, Beverwijk, Zaandam, Castricum, Alkmaar, Den Helder, Alkmaar, Hoorn]"
train_16,"[Weert, Eindhoven, s-Hertogenbosch, Oss, s-Hertogenbosch, Eindhoven, s-Hertogenbosch, Tilburg, s-Hertogenbosch, Tilburg, Breda, Dordrecht]"
train_17,"[Groningen, Leeuwarden, Groningen, Leeuwarden, Groningen, Assen]"
train_18,"[Breda, Dordrecht, Roosendaal, Vlissingen, Roosendaal, Etten-Leur]"
train_19,"[Leeuwarden, Heerenveen, Leeuwarden, Groningen, Leeuwarden, Groningen, Assen, Groningen]"
train_20,"[Leeuwarden, Heerenveen, Steenwijk, Heerenveen, Steenwijk, Heerenveen, Steenwijk, Heerenveen, Leeuwarden, Groningen]"
score,50.25842696629206
