train,stations
train_1,"[Rotterdam Alexander, Rotterdam Centraal, Dordrecht, Roosendaal, Vlissingen, Roosendaal]"
train_2,"[Eindhoven, Helmond, Venlo, Helmond, Eindhoven, s-Hertogenbosch, Utrecht Centraal, Amsterdam Amstel, Amsterdam Zuid, Schiphol Airport]"
train_3,"[Utrecht Centraal, Hilversum, Almere Centrum, Lelystad Centrum, Almere Centrum, Lelystad Centrum, Almere Centrum, Amsterdam Centraal, Utrecht Centraal, Gouda]"
train_4,"[Hoorn, Zaandam, Hoorn, Alkmaar, Castricum, Alkmaar, Hoorn, Zaandam, Castricum, Beverwijk]"
train_5,"[Vlissingen, Roosendaal, Dordrecht, Roosendaal, Vlissingen]"
train_6,"[Groningen, Assen, Zwolle, Amersfoort, Apeldoorn, Deventer, Zwolle]"
train_7,"[Amersfoort, Utrecht Centraal, Schiphol Airport, Leiden Centraal, Schiphol Airport, Leiden Centraal, Alphen a/d Rijn, Utrecht Centraal, Ede-Wageningen]"
train_8,"[Almelo, Zwolle, Almelo, Hengelo, Enschede, Hengelo, Almelo, Deventer, Zwolle]"
train_9,"[Amsterdam Sloterdijk, Zaandam, Hoorn, Zaandam, Amsterdam Sloterdijk, Zaandam, Beverwijk, Zaandam, Beverwijk, Castricum, Alkmaar]"
train_10,"[Sittard, Maastricht, Sittard, Roermond, Weert, Eindhoven, s-Hertogenbosch, Oss, Nijmegen, Arnhem Centraal, Nijmegen, Oss, Nijmegen]"
train_11,"[Amsterdam Centraal, Utrecht Centraal, Ede-Wageningen, Arnhem Centraal, Nijmegen, Arnhem Centraal, Nijmegen, Arnhem Centraal, Nijmegen, Arnhem Centraal, Ede-Wageningen, Arnhem Centraal, Ede-Wageningen, Arnhem Centraal]"
train_12,"[Hoorn, Zaandam, Amsterdam Sloterdijk, Amsterdam Centraal, Almere Centrum, Amsterdam Amstel, Hilversum, Amsterdam Amstel, Utrecht Centraal]"
train_13,"[Maastricht, Sittard, Heerlen, Sittard, Heerlen, Sittard, Maastricht, Sittard, Roermond, Weert, Eindhoven, s-Hertogenbosch]"
train_14,"[Rotterdam Blaak, Schiedam Centrum, Rotterdam Centraal, Schiedam Centrum, Rotterdam Blaak, Rotterdam Alexander, Rotterdam Blaak, Dordrecht, Rotterdam Centraal, Dordrecht, Breda, Tilburg, Eindhoven, Weert]"
train_15,"[Beverwijk, Castricum, Alkmaar, Den Helder, Alkmaar, Castricum, Alkmaar, Hoorn, Alkmaar]"
train_16,"[Groningen, Assen, Zwolle, Deventer, Almelo, Deventer, Zwolle]"
train_17,"[Hoorn, Zaandam, Amsterdam Sloterdijk, Amsterdam Centraal, Utrecht Centraal, Amsterdam Amstel, Utrecht Centraal, Amsterdam Amstel, Utrecht Centraal, Hilversum]"
train_18,"[Dordrecht, Rotterdam Blaak, Dordrecht, Breda, Etten-Leur, Roosendaal, Etten-Leur, Roosendaal, Vlissingen]"
train_19,"[Delft, Schiedam Centrum, Rotterdam Centraal, Dordrecht, Rotterdam Centraal, Schiedam Centrum, Rotterdam Centraal, Schiedam Centrum, Rotterdam Centraal, Schiedam Centrum, Rotterdam Blaak, Dordrecht, Rotterdam Blaak, Schiedam Centrum, Rotterdam Centraal, Dordrecht, Rotterdam Blaak, Dordrecht]"
train_20,"[Weert, Eindhoven, Tilburg, s-Hertogenbosch, Oss, Nijmegen, Arnhem Centraal, Ede-Wageningen, Utrecht Centraal, Schiphol Airport, Amsterdam Zuid, Schiphol Airport]"
score,1912.0112359550558
