train,stations
train_1,"[Vlissingen, Roosendaal, Etten-Leur, Breda, Tilburg, Breda, Dordrecht, Rotterdam Centraal, Dordrecht, Rotterdam Centraal]"
train_2,"[Groningen, Assen, Zwolle, Assen, Groningen, Leeuwarden]"
train_3,"[Apeldoorn, Zutphen, Deventer, Zutphen, Dieren, Arnhem Centraal, Nijmegen, Oss, Nijmegen, Oss, s-Hertogenbosch, Utrecht Centraal, Hilversum]"
train_4,"[Hilversum, Almere Centrum, Amsterdam Centraal, Almere Centrum, Lelystad Centrum, Almere Centrum, Amsterdam Amstel, Hilversum, Amsterdam Amstel]"
train_5,"[Assen, Zwolle, Steenwijk, Heerenveen, Steenwijk, Zwolle, Steenwijk, Zwolle]"
train_6,"[Heerenveen, Leeuwarden, Heerenveen, Steenwijk, Heerenveen, Steenwijk, Zwolle, Steenwijk, Zwolle]"
train_7,"[Alkmaar, Castricum, Alkmaar, Castricum, Alkmaar, Den Helder, Alkmaar, Den Helder]"
train_8,"[Alphen a/d Rijn, Leiden Centraal, Schiphol Airport, Amsterdam Zuid, Amsterdam Amstel, Utrecht Centraal, Schiphol Airport, Utrecht Centraal, Amersfoort, Apeldoorn, Deventer]"
train_9,"[Rotterdam Alexander, Gouda, Den Haag Laan v NOI, Leiden Centraal, Heemstede-Aerdenhout, Haarlem, Beverwijk, Haarlem, Heemstede-Aerdenhout, Haarlem, Beverwijk, Castricum, Zaandam, Beverwijk]"
train_10,"[Den Haag Centraal, Leiden Centraal, Schiphol Airport, Leiden Centraal, Den Haag HS, Delft, Den Haag HS, Leiden Centraal, Alphen a/d Rijn, Leiden Centraal, Den Haag Laan v NOI, Leiden Centraal, Den Haag HS, Leiden Centraal, Den Haag Centraal, Delft]"
train_11,"[Dieren, Zutphen, Dieren, Arnhem Centraal, Dieren, Zutphen, Deventer, Almelo, Zwolle, Assen]"
train_12,"[Haarlem, Heemstede-Aerdenhout, Leiden Centraal, Heemstede-Aerdenhout, Leiden Centraal, Schiphol Airport, Amsterdam Zuid, Amsterdam Amstel, Utrecht Centraal, Alphen a/d Rijn, Gouda, Den Haag HS]"
train_13,"[Tilburg, Breda, Tilburg, s-Hertogenbosch, Eindhoven, Tilburg, Breda, Etten-Leur, Roosendaal, Dordrecht, Rotterdam Centraal, Dordrecht]"
train_14,"[Rotterdam Alexander, Rotterdam Centraal, Schiedam Centrum, Rotterdam Blaak, Schiedam Centrum, Delft, Den Haag Laan v NOI, Leiden Centraal, Alphen a/d Rijn, Utrecht Centraal, Alphen a/d Rijn, Leiden Centraal, Alphen a/d Rijn]"
train_15,"[Arnhem Centraal, Ede-Wageningen, Arnhem Centraal, Ede-Wageningen, Utrecht Centraal, Amsterdam Centraal, Amsterdam Amstel, Hilversum, Almere Centrum, Amsterdam Centraal, Amsterdam Amstel]"
train_16,"[Enschede, Hengelo, Almelo, Deventer, Zwolle, Assen, Zwolle]"
train_17,"[Tilburg, Breda, Dordrecht, Breda, Tilburg, s-Hertogenbosch, Utrecht Centraal, Amsterdam Amstel, Almere Centrum, Lelystad Centrum, Almere Centrum]"
train_18,"[Zaandam, Amsterdam Sloterdijk, Amsterdam Zuid, Amsterdam Sloterdijk, Zaandam, Hoorn, Alkmaar, Hoorn, Zaandam, Amsterdam Sloterdijk, Haarlem, Heemstede-Aerdenhout, Haarlem]"
train_19,"[Venlo, Helmond, Venlo, Helmond, Venlo, Helmond]"
train_20,"[Tilburg, s-Hertogenbosch, Oss, s-Hertogenbosch, Oss, s-Hertogenbosch, Utrecht Centraal, Amsterdam Centraal, Utrecht Centraal, Schiphol Airport]"
score,3352.044943820225
