train,stations
train_1,"[Groningen, Assen, Zwolle, Steenwijk, Heerenveen, Steenwijk, Zwolle, Steenwijk]"
train_2,"[Arnhem Centraal, Dieren, Arnhem Centraal, Ede-Wageningen, Utrecht Centraal, s-Hertogenbosch, Tilburg, Eindhoven, Weert, Eindhoven, Tilburg]"
train_3,"[Lelystad Centrum, Almere Centrum, Amsterdam Centraal, Amsterdam Sloterdijk, Haarlem, Amsterdam Sloterdijk, Zaandam, Beverwijk, Castricum, Alkmaar, Castricum, Alkmaar, Castricum, Beverwijk, Haarlem, Heemstede-Aerdenhout]"
train_4,"[Amersfoort, Utrecht Centraal, Hilversum, Amsterdam Amstel, Hilversum, Utrecht Centraal, Gouda, Den Haag Laan v NOI, Delft, Den Haag HS]"
train_5,"[Beverwijk, Haarlem, Heemstede-Aerdenhout, Leiden Centraal, Den Haag Laan v NOI, Delft, Schiedam Centrum, Delft, Schiedam Centrum, Rotterdam Blaak, Schiedam Centrum, Delft, Den Haag Laan v NOI, Delft, Den Haag HS, Delft, Schiedam Centrum, Rotterdam Blaak, Rotterdam Alexander]"
train_6,"[Steenwijk, Heerenveen, Steenwijk, Zwolle, Amersfoort, Utrecht Centraal, Alphen a/d Rijn, Utrecht Centraal]"
train_7,"[Weert, Roermond, Sittard, Heerlen, Sittard, Roermond, Weert, Roermond, Sittard, Heerlen, Sittard, Maastricht, Sittard]"
train_8,"[Venlo, Helmond, Eindhoven, Tilburg, s-Hertogenbosch, Oss, s-Hertogenbosch, Oss, s-Hertogenbosch, Eindhoven, Weert, Roermond]"
train_9,"[Almelo, Zwolle, Almelo, Hengelo, Almelo, Deventer, Almelo]"
train_10,"[Rotterdam Centraal, Schiedam Centrum, Rotterdam Blaak, Dordrecht, Roosendaal, Dordrecht, Rotterdam Blaak, Rotterdam Alexander, Rotterdam Centraal, Dordrecht, Roosendaal, Etten-Leur, Roosendaal]"
train_11,"[Hilversum, Amsterdam Amstel, Amsterdam Zuid, Amsterdam Amstel, Amsterdam Zuid, Amsterdam Amstel, Amsterdam Centraal, Almere Centrum, Lelystad Centrum, Almere Centrum, Lelystad Centrum, Almere Centrum, Hilversum]"
train_12,"[Oss, Nijmegen, Oss, Nijmegen, Arnhem Centraal, Ede-Wageningen, Arnhem Centraal, Ede-Wageningen, Utrecht Centraal, Amsterdam Amstel, Amsterdam Centraal, Utrecht Centraal]"
train_13,"[Gouda, Den Haag Centraal, Leiden Centraal, Den Haag HS, Gouda, Alphen a/d Rijn, Utrecht Centraal, Alphen a/d Rijn, Utrecht Centraal]"
train_14,"[Heerlen, Sittard, Maastricht, Sittard, Maastricht, Sittard, Heerlen, Sittard, Roermond, Sittard, Heerlen, Sittard]"
train_15,"[Ede-Wageningen, Utrecht Centraal, Alphen a/d Rijn, Leiden Centraal, Schiphol Airport, Leiden Centraal, Den Haag Centraal, Gouda, Utrecht Centraal, Amersfoort, Utrecht Centraal]"
train_16,"[Apeldoorn, Zutphen, Apeldoorn, Zutphen, Deventer, Zutphen, Deventer, Zwolle, Deventer, Almelo]"
train_17,"[Den Helder, Alkmaar, Den Helder, Alkmaar, Castricum, Zaandam, Beverwijk, Haarlem]"
train_18,"[Roosendaal, Vlissingen, Roosendaal, Dordrecht, Rotterdam Centraal, Rotterdam Alexander]"
train_19,"[Rotterdam Blaak, Rotterdam Alexander, Rotterdam Blaak, Rotterdam Alexander, Rotterdam Centraal, Dordrecht, Rotterdam Centraal, Schiedam Centrum, Delft, Den Haag Centraal, Leiden Centraal, Den Haag Laan v NOI, Gouda, Rotterdam Alexander, Gouda]"
train_20,"[Amersfoort, Apeldoorn, Deventer, Zwolle, Amersfoort, Zwolle, Assen]"
score,3164.3258426966295
