train,stations
train_1,"[Deventer, Zwolle, Deventer, Zutphen, Apeldoorn, Deventer, Zwolle, Deventer, Zwolle]"
train_2,"[Amsterdam Amstel, Amsterdam Centraal, Amsterdam Sloterdijk, Amsterdam Zuid, Schiphol Airport, Utrecht Centraal, Hilversum, Amsterdam Amstel, Almere Centrum, Amsterdam Amstel]"
train_3,"[Tilburg, Eindhoven, Helmond, Eindhoven, Helmond, Eindhoven, Tilburg, Eindhoven, s-Hertogenbosch, Eindhoven, Helmond, Eindhoven, s-Hertogenbosch]"
train_4,"[Etten-Leur, Roosendaal, Vlissingen, Roosendaal]"
train_5,"[Almelo, Deventer, Apeldoorn, Amersfoort, Apeldoorn, Zutphen, Apeldoorn, Amersfoort, Utrecht Centraal, Amersfoort]"
train_6,"[Amsterdam Amstel, Hilversum, Almere Centrum, Amsterdam Centraal, Amsterdam Sloterdijk, Haarlem, Amsterdam Sloterdijk, Amsterdam Zuid, Amsterdam Sloterdijk, Amsterdam Centraal, Almere Centrum]"
train_7,"[Alphen a/d Rijn, Leiden Centraal, Schiphol Airport, Utrecht Centraal, s-Hertogenbosch, Oss, s-Hertogenbosch, Oss, s-Hertogenbosch, Eindhoven, Tilburg]"
train_8,"[s-Hertogenbosch, Eindhoven, Helmond, Eindhoven, Tilburg, Eindhoven, Tilburg, Eindhoven, s-Hertogenbosch, Utrecht Centraal]"
train_9,"[Hilversum, Almere Centrum, Lelystad Centrum, Almere Centrum, Amsterdam Amstel, Hilversum, Amsterdam Amstel, Amsterdam Zuid, Amsterdam Sloterdijk, Zaandam, Amsterdam Sloterdijk]"
train_10,"[Heemstede-Aerdenhout, Leiden Centraal, Den Haag Centraal, Delft, Den Haag Centraal, Leiden Centraal, Alphen a/d Rijn, Utrecht Centraal, s-Hertogenbosch, Utrecht Centraal, Gouda]"
train_11,"[Oss, Nijmegen, Oss, s-Hertogenbosch, Oss, s-Hertogenbosch, Oss, Nijmegen, Oss, s-Hertogenbosch, Tilburg, Eindhoven, s-Hertogenbosch]"
train_12,"[Sittard, Roermond, Sittard, Roermond, Weert, Eindhoven, s-Hertogenbosch, Oss, Nijmegen, Arnhem Centraal, Nijmegen, Arnhem Centraal, Ede-Wageningen]"
train_13,"[Amersfoort, Utrecht Centraal, Amersfoort, Zwolle, Deventer, Zutphen, Apeldoorn, Zutphen, Deventer, Zutphen]"
train_14,"[s-Hertogenbosch, Eindhoven, Tilburg, s-Hertogenbosch, Oss, Nijmegen, Arnhem Centraal, Dieren, Zutphen, Dieren, Arnhem Centraal, Dieren, Zutphen, Apeldoorn]"
train_15,"[Eindhoven, s-Hertogenbosch, Eindhoven, s-Hertogenbosch, Tilburg, Breda, Etten-Leur, Breda, Dordrecht, Rotterdam Centraal, Schiedam Centrum, Rotterdam Centraal, Rotterdam Alexander, Rotterdam Blaak, Dordrecht]"
train_16,"[Amersfoort, Utrecht Centraal, Hilversum, Almere Centrum, Lelystad Centrum, Almere Centrum, Amsterdam Amstel, Amsterdam Zuid, Amsterdam Amstel, Almere Centrum, Lelystad Centrum]"
train_17,"[Rotterdam Alexander, Gouda, Utrecht Centraal, Hilversum, Utrecht Centraal, Amersfoort, Utrecht Centraal, Alphen a/d Rijn, Leiden Centraal, Alphen a/d Rijn, Utrecht Centraal]"
train_18,"[Den Haag Centraal, Delft, Den Haag Centraal, Gouda, Den Haag HS, Leiden Centraal, Den Haag Laan v NOI, Gouda, Rotterdam Alexander, Rotterdam Blaak, Rotterdam Alexander, Rotterdam Centraal, Rotterdam Alexander, Gouda, Rotterdam Alexander]"
train_19,"[Heerlen, Sittard, Maastricht, Sittard, Roermond, Sittard, Heerlen, Sittard, Maastricht, Sittard, Heerlen, Sittard]"
train_20,"[Schiphol Airport, Amsterdam Zuid, Amsterdam Sloterdijk, Haarlem, Beverwijk, Zaandam, Castricum, Zaandam, Castricum, Zaandam, Amsterdam Sloterdijk, Amsterdam Centraal, Amsterdam Sloterdijk, Zaandam, Castricum, Zaandam]"
score,1800.0112359550558
