train,stations
train_1,"[Deventer, Zwolle, Assen, Groningen, Leeuwarden, Heerenveen, Leeuwarden, Heerenveen, Steenwijk]"
train_2,"[Roosendaal, Vlissingen, Roosendaal]"
train_3,"[Deventer, Zutphen, Apeldoorn, Zutphen, Apeldoorn, Zutphen, Dieren, Zutphen, Deventer, Almelo]"
train_4,"[Amersfoort, Zwolle, Deventer, Apeldoorn, Amersfoort, Utrecht Centraal, Amsterdam Centraal, Amsterdam Amstel, Utrecht Centraal]"
train_5,"[Hengelo, Enschede, Hengelo, Enschede, Hengelo, Enschede, Hengelo, Enschede, Hengelo, Almelo, Zwolle, Almelo, Hengelo, Enschede, Hengelo]"
train_6,"[Venlo, Helmond, Venlo, Helmond, Eindhoven, Tilburg, Eindhoven, Helmond, Eindhoven, s-Hertogenbosch]"
train_7,"[Zaandam, Hoorn, Zaandam, Castricum, Zaandam, Beverwijk, Zaandam, Beverwijk, Haarlem, Heemstede-Aerdenhout]"
train_8,"[Alphen a/d Rijn, Utrecht Centraal, Amsterdam Amstel, Utrecht Centraal, Amsterdam Amstel, Almere Centrum, Amsterdam Centraal, Almere Centrum, Amsterdam Centraal]"
train_9,"[s-Hertogenbosch, Utrecht Centraal, Amsterdam Centraal, Utrecht Centraal, Amersfoort, Utrecht Centraal, Schiphol Airport, Utrecht Centraal]"
train_10,"[Steenwijk, Zwolle, Deventer, Apeldoorn, Amersfoort, Zwolle, Almelo]"
train_11,"[Amsterdam Amstel, Amsterdam Centraal, Almere Centrum, Amsterdam Amstel, Utrecht Centraal, s-Hertogenbosch, Utrecht Centraal, Schiphol Airport]"
train_12,"[Dordrecht, Roosendaal, Vlissingen, Roosendaal]"
train_13,"[Heerlen, Sittard, Maastricht, Sittard, Heerlen, Sittard, Roermond, Weert, Eindhoven, Tilburg, s-Hertogenbosch]"
train_14,"[Zwolle, Assen, Zwolle, Deventer, Almelo, Deventer, Zutphen, Dieren]"
train_15,"[Enschede, Hengelo, Enschede, Hengelo, Enschede, Hengelo, Almelo, Hengelo, Almelo, Hengelo, Almelo, Deventer, Apeldoorn, Zutphen, Deventer, Almelo]"
train_16,"[Etten-Leur, Roosendaal, Vlissingen, Roosendaal, Dordrecht, Rotterdam Centraal]"
train_17,"[Utrecht Centraal, Amsterdam Centraal, Amsterdam Sloterdijk, Amsterdam Centraal, Amsterdam Sloterdijk, Zaandam, Beverwijk, Haarlem, Amsterdam Sloterdijk, Amsterdam Centraal, Amsterdam Sloterdijk, Zaandam, Hoorn, Alkmaar]"
train_18,"[Steenwijk, Heerenveen, Steenwijk, Zwolle, Almelo, Zwolle, Almelo]"
train_19,"[Heemstede-Aerdenhout, Haarlem, Heemstede-Aerdenhout, Haarlem, Beverwijk, Zaandam, Amsterdam Sloterdijk, Amsterdam Centraal, Almere Centrum, Amsterdam Centraal, Amsterdam Amstel, Amsterdam Zuid, Amsterdam Amstel, Amsterdam Centraal, Amsterdam Amstel]"
train_20,"[Zwolle, Assen, Groningen, Assen, Zwolle, Amersfoort]"
score,336.97752808988844
