train,stations
train_1,"[Eindhoven, Tilburg, Breda, Dordrecht, Roosendaal, Vlissingen]"
train_2,"[Almere Centrum, Hilversum, Utrecht Centraal, Hilversum, Amsterdam Amstel, Amsterdam Zuid, Schiphol Airport, Utrecht Centraal, Schiphol Airport, Amsterdam Zuid]"
train_3,"[Ede-Wageningen, Utrecht Centraal, Amsterdam Amstel, Almere Centrum, Lelystad Centrum, Almere Centrum, Amsterdam Centraal, Almere Centrum, Amsterdam Amstel]"
train_4,"[Enschede, Hengelo, Enschede, Hengelo, Enschede, Hengelo, Enschede, Hengelo, Enschede, Hengelo, Almelo, Deventer, Almelo, Hengelo, Almelo, Deventer]"
train_5,"[Heerenveen, Steenwijk, Zwolle, Almelo, Hengelo, Almelo, Hengelo, Enschede, Hengelo, Almelo, Zwolle]"
train_6,"[Gouda, Den Haag Centraal, Gouda, Den Haag HS, Leiden Centraal, Heemstede-Aerdenhout, Haarlem, Beverwijk, Haarlem, Beverwijk, Zaandam]"
train_7,"[Heemstede-Aerdenhout, Leiden Centraal, Heemstede-Aerdenhout, Haarlem, Amsterdam Sloterdijk, Zaandam, Hoorn, Zaandam, Hoorn, Alkmaar]"
train_8,"[Almere Centrum, Lelystad Centrum, Almere Centrum, Hilversum, Amsterdam Amstel, Almere Centrum, Hilversum, Almere Centrum]"
train_9,"[Enschede, Hengelo, Almelo, Deventer, Almelo, Deventer, Apeldoorn, Zutphen, Dieren, Zutphen, Apeldoorn, Zutphen]"
train_10,"[Assen, Zwolle, Steenwijk, Zwolle, Amersfoort, Zwolle]"
train_11,"[Sittard, Maastricht, Sittard, Heerlen, Sittard, Heerlen, Sittard, Heerlen, Sittard, Maastricht, Sittard, Heerlen]"
train_12,"[Vlissingen, Roosendaal, Etten-Leur, Breda, Dordrecht, Roosendaal, Etten-Leur, Roosendaal, Etten-Leur, Breda, Etten-Leur, Roosendaal]"
train_13,"[Haarlem, Heemstede-Aerdenhout, Haarlem, Beverwijk, Haarlem, Amsterdam Sloterdijk, Amsterdam Centraal, Almere Centrum, Hilversum, Utrecht Centraal, Schiphol Airport]"
train_14,"[Dordrecht, Rotterdam Blaak, Rotterdam Alexander, Rotterdam Blaak, Rotterdam Alexander, Gouda, Rotterdam Alexander, Rotterdam Blaak, Rotterdam Alexander, Rotterdam Centraal, Schiedam Centrum, Rotterdam Blaak, Schiedam Centrum, Rotterdam Centraal, Rotterdam Alexander, Gouda, Den Haag Laan v NOI]"
train_15,"[Ede-Wageningen, Utrecht Centraal, Amersfoort, Utrecht Centraal, Schiphol Airport, Amsterdam Zuid, Schiphol Airport, Amsterdam Zuid, Amsterdam Sloterdijk, Amsterdam Centraal, Utrecht Centraal]"
train_16,"[Leiden Centraal, Den Haag Centraal, Delft, Den Haag Laan v NOI, Delft, Schiedam Centrum, Delft, Den Haag Centraal, Leiden Centraal, Den Haag Laan v NOI, Leiden Centraal, Heemstede-Aerdenhout, Haarlem, Beverwijk, Castricum, Alkmaar]"
train_17,"[Zutphen, Deventer, Almelo, Hengelo, Almelo, Hengelo, Almelo, Zwolle, Deventer, Zwolle]"
train_18,"[Rotterdam Centraal, Schiedam Centrum, Delft, Den Haag Laan v NOI, Gouda, Utrecht Centraal, Hilversum, Utrecht Centraal, s-Hertogenbosch, Utrecht Centraal, Gouda]"
train_19,"[Hilversum, Almere Centrum, Lelystad Centrum, Almere Centrum, Hilversum, Amsterdam Amstel, Almere Centrum, Amsterdam Centraal, Almere Centrum]"
train_20,"[Schiedam Centrum, Delft, Den Haag HS, Leiden Centraal, Schiphol Airport, Amsterdam Zuid, Schiphol Airport, Amsterdam Zuid, Amsterdam Sloterdijk, Amsterdam Zuid, Amsterdam Amstel, Utrecht Centraal, Amsterdam Amstel, Utrecht Centraal]"
score,2128.730337078652
