train,stations
train_1,"[s-Hertogenbosch, Oss, s-Hertogenbosch, Tilburg, s-Hertogenbosch, Utrecht Centraal, Gouda, Rotterdam Alexander, Rotterdam Centraal, Schiedam Centrum, Rotterdam Blaak, Dordrecht, Rotterdam Blaak, Rotterdam Alexander, Rotterdam Centraal]"
train_2,"[Amsterdam Zuid, Amsterdam Sloterdijk, Zaandam, Beverwijk, Haarlem, Heemstede-Aerdenhout, Haarlem, Beverwijk, Haarlem, Heemstede-Aerdenhout, Leiden Centraal, Schiphol Airport, Leiden Centraal, Heemstede-Aerdenhout, Haarlem]"
train_3,"[Roermond, Weert, Roermond, Weert, Eindhoven, Weert, Roermond, Sittard, Roermond, Sittard, Heerlen, Sittard]"
train_4,"[Rotterdam Alexander, Rotterdam Blaak, Dordrecht, Rotterdam Centraal, Dordrecht, Roosendaal, Dordrecht, Roosendaal]"
train_5,"[Zutphen, Deventer, Zwolle, Steenwijk, Zwolle, Assen, Zwolle]"
train_6,"[Hilversum, Almere Centrum, Hilversum, Amsterdam Amstel, Amsterdam Zuid, Amsterdam Sloterdijk, Zaandam, Amsterdam Sloterdijk, Amsterdam Centraal, Amsterdam Amstel, Hilversum]"
train_7,"[Zaandam, Castricum, Zaandam, Castricum, Zaandam, Hoorn, Alkmaar, Castricum, Beverwijk, Zaandam, Amsterdam Sloterdijk, Amsterdam Zuid, Schiphol Airport]"
train_8,"[Roosendaal, Vlissingen, Roosendaal, Etten-Leur, Breda, Etten-Leur, Breda, Etten-Leur, Breda]"
train_9,"[Arnhem Centraal, Ede-Wageningen, Utrecht Centraal, Amersfoort, Zwolle, Amersfoort, Apeldoorn, Amersfoort]"
train_10,"[Nijmegen, Oss, s-Hertogenbosch, Utrecht Centraal, Gouda, Alphen a/d Rijn, Leiden Centraal, Den Haag Laan v NOI, Gouda, Den Haag Centraal, Leiden Centraal]"
train_11,"[Sittard, Roermond, Sittard, Roermond, Sittard, Roermond, Weert, Roermond, Weert, Eindhoven, Weert, Roermond, Weert]"
train_12,"[Den Haag HS, Delft, Den Haag Centraal, Delft, Den Haag HS, Leiden Centraal, Alphen a/d Rijn, Leiden Centraal, Den Haag Centraal, Gouda, Den Haag Centraal, Delft, Schiedam Centrum, Rotterdam Centraal, Schiedam Centrum, Rotterdam Blaak]"
train_13,"[Lelystad Centrum, Almere Centrum, Hilversum, Utrecht Centraal, Amsterdam Amstel, Amsterdam Zuid, Amsterdam Sloterdijk, Amsterdam Centraal, Utrecht Centraal, Ede-Wageningen]"
train_14,"[Nijmegen, Oss, s-Hertogenbosch, Eindhoven, Weert, Roermond, Weert, Roermond, Sittard, Heerlen, Sittard, Roermond, Sittard]"
train_15,"[Maastricht, Sittard, Maastricht, Sittard, Maastricht, Sittard, Maastricht, Sittard, Roermond, Weert, Eindhoven, Weert]"
train_16,"[Rotterdam Centraal, Dordrecht, Rotterdam Centraal, Schiedam Centrum, Rotterdam Blaak, Rotterdam Alexander, Gouda, Den Haag HS, Leiden Centraal, Heemstede-Aerdenhout, Leiden Centraal, Den Haag HS, Delft, Den Haag Laan v NOI, Leiden Centraal]"
train_17,"[Dieren, Zutphen, Dieren, Arnhem Centraal, Ede-Wageningen, Utrecht Centraal, Schiphol Airport, Utrecht Centraal, Gouda, Alphen a/d Rijn]"
train_18,"[s-Hertogenbosch, Tilburg, Breda, Tilburg, s-Hertogenbosch, Oss, Nijmegen, Arnhem Centraal, Ede-Wageningen, Arnhem Centraal, Ede-Wageningen, Utrecht Centraal, s-Hertogenbosch]"
train_19,"[Hengelo, Almelo, Deventer, Apeldoorn, Zutphen, Deventer, Zwolle, Steenwijk, Heerenveen, Leeuwarden]"
train_20,"[Vlissingen, Roosendaal, Vlissingen]"
score,3234.3258426966295
