train,stations
train_1,"[Hoorn, Zaandam, Beverwijk, Zaandam, Hoorn, Alkmaar, Castricum, Zaandam, Beverwijk]"
train_2,"[Heemstede-Aerdenhout, Haarlem, Heemstede-Aerdenhout, Leiden Centraal, Den Haag Centraal, Gouda, Rotterdam Alexander, Rotterdam Centraal, Dordrecht, Breda, Etten-Leur, Roosendaal]"
train_3,"[Assen, Groningen, Assen, Zwolle, Amersfoort, Utrecht Centraal, Alphen a/d Rijn, Gouda]"
train_4,"[Nijmegen, Oss, Nijmegen, Arnhem Centraal, Nijmegen, Arnhem Centraal, Nijmegen, Oss, Nijmegen, Oss, Nijmegen, Arnhem Centraal, Nijmegen]"
train_5,"[Amsterdam Sloterdijk, Haarlem, Beverwijk, Zaandam, Castricum, Alkmaar, Castricum, Beverwijk, Zaandam, Hoorn, Zaandam]"
train_6,"[Schiedam Centrum, Delft, Den Haag Centraal, Leiden Centraal, Den Haag HS, Delft, Den Haag HS, Gouda, Den Haag Laan v NOI, Gouda, Den Haag Centraal, Delft]"
train_7,"[Roosendaal, Dordrecht, Rotterdam Blaak, Rotterdam Alexander, Rotterdam Centraal, Schiedam Centrum, Rotterdam Blaak, Schiedam Centrum, Rotterdam Blaak, Schiedam Centrum, Delft, Den Haag Centraal, Leiden Centraal, Den Haag HS, Leiden Centraal, Den Haag HS]"
train_8,"[Enschede, Hengelo, Enschede, Hengelo, Enschede, Hengelo, Enschede, Hengelo, Almelo, Deventer, Zutphen, Dieren, Arnhem Centraal, Ede-Wageningen, Utrecht Centraal, Amsterdam Amstel]"
train_9,"[Amsterdam Centraal, Almere Centrum, Hilversum, Almere Centrum, Amsterdam Amstel, Almere Centrum, Lelystad Centrum, Almere Centrum, Lelystad Centrum]"
train_10,"[Venlo, Helmond, Eindhoven, Weert, Eindhoven, Weert, Eindhoven, Weert, Eindhoven, Tilburg, s-Hertogenbosch]"
train_11,"[Leiden Centraal, Alphen a/d Rijn, Gouda, Utrecht Centraal, Schiphol Airport, Amsterdam Zuid, Amsterdam Amstel, Amsterdam Centraal, Utrecht Centraal, s-Hertogenbosch]"
train_12,"[Rotterdam Blaak, Dordrecht, Breda, Tilburg, Breda, Dordrecht, Breda, Etten-Leur, Breda, Etten-Leur, Roosendaal]"
train_13,"[Maastricht, Sittard, Heerlen, Sittard, Maastricht, Sittard, Roermond, Sittard, Roermond, Weert, Roermond, Weert, Eindhoven]"
train_14,"[Den Helder, Alkmaar, Hoorn, Alkmaar, Castricum, Zaandam, Hoorn, Zaandam]"
train_15,"[Amersfoort, Utrecht Centraal, Amsterdam Amstel, Amsterdam Zuid, Schiphol Airport, Leiden Centraal, Den Haag Laan v NOI, Leiden Centraal, Den Haag Centraal, Delft, Den Haag HS, Leiden Centraal, Schiphol Airport, Utrecht Centraal]"
train_16,"[Vlissingen, Roosendaal, Vlissingen]"
train_17,"[Eindhoven, Helmond, Venlo, Helmond, Venlo, Helmond, Eindhoven, Weert, Eindhoven]"
train_18,"[Haarlem, Heemstede-Aerdenhout, Leiden Centraal, Schiphol Airport, Amsterdam Zuid, Schiphol Airport, Leiden Centraal, Schiphol Airport, Amsterdam Zuid, Amsterdam Amstel, Amsterdam Centraal, Amsterdam Sloterdijk, Haarlem, Beverwijk, Castricum, Alkmaar, Castricum, Zaandam]"
train_19,"[Almere Centrum, Hilversum, Utrecht Centraal, Ede-Wageningen, Arnhem Centraal, Nijmegen, Arnhem Centraal, Dieren, Arnhem Centraal, Ede-Wageningen, Utrecht Centraal]"
train_20,"[Amsterdam Sloterdijk, Amsterdam Centraal, Utrecht Centraal, s-Hertogenbosch, Eindhoven, Helmond, Eindhoven, Tilburg, Breda, Dordrecht, Rotterdam Centraal, Schiedam Centrum]"
score,3167.9662921348317
