train,stations
train_1,"[Lelystad Centrum, Almere Centrum, Lelystad Centrum, Almere Centrum, Lelystad Centrum, Almere Centrum, Amsterdam Amstel, Amsterdam Zuid, Schiphol Airport, Leiden Centraal, Den Haag Centraal, Delft, Den Haag Centraal, Leiden Centraal]"
train_2,"[Almelo, Deventer, Zwolle, Steenwijk, Heerenveen, Leeuwarden, Groningen, Assen]"
train_3,"[Roosendaal, Dordrecht, Rotterdam Centraal, Schiedam Centrum, Delft, Den Haag HS, Delft, Den Haag Laan v NOI, Gouda, Den Haag Centraal, Delft, Den Haag Centraal, Delft, Den Haag Centraal]"
train_4,"[Hoorn, Zaandam, Beverwijk, Zaandam, Beverwijk, Castricum, Alkmaar, Castricum, Zaandam, Hoorn]"
train_5,"[Den Helder, Alkmaar, Den Helder, Alkmaar, Castricum, Zaandam, Castricum, Zaandam, Beverwijk]"
train_6,"[Alphen a/d Rijn, Utrecht Centraal, Gouda, Utrecht Centraal, Schiphol Airport, Amsterdam Zuid, Amsterdam Amstel, Utrecht Centraal, Gouda, Alphen a/d Rijn]"
train_7,"[Weert, Roermond, Sittard, Roermond, Sittard, Heerlen, Sittard, Roermond, Weert, Roermond, Weert, Roermond, Weert]"
train_8,"[Castricum, Beverwijk, Zaandam, Amsterdam Sloterdijk, Amsterdam Zuid, Amsterdam Amstel, Hilversum, Utrecht Centraal, Amsterdam Centraal, Almere Centrum]"
train_9,"[Heemstede-Aerdenhout, Haarlem, Beverwijk, Haarlem, Heemstede-Aerdenhout, Haarlem, Beverwijk, Castricum, Alkmaar, Den Helder, Alkmaar]"
train_10,"[Heerlen, Sittard, Roermond, Weert, Eindhoven, Weert, Roermond, Weert, Eindhoven, s-Hertogenbosch, Utrecht Centraal]"
train_11,"[Apeldoorn, Zutphen, Apeldoorn, Deventer, Almelo, Hengelo, Almelo, Zwolle, Amersfoort]"
train_12,"[Ede-Wageningen, Arnhem Centraal, Ede-Wageningen, Arnhem Centraal, Dieren, Zutphen, Dieren, Zutphen, Deventer, Apeldoorn, Amersfoort, Apeldoorn, Zutphen, Apeldoorn]"
train_13,"[Ede-Wageningen, Arnhem Centraal, Nijmegen, Arnhem Centraal, Ede-Wageningen, Utrecht Centraal, Hilversum, Utrecht Centraal, Schiphol Airport, Leiden Centraal, Heemstede-Aerdenhout, Haarlem, Heemstede-Aerdenhout, Haarlem]"
train_14,"[Utrecht Centraal, Amsterdam Centraal, Amsterdam Sloterdijk, Amsterdam Zuid, Amsterdam Sloterdijk, Zaandam, Hoorn, Alkmaar, Hoorn, Alkmaar]"
train_15,"[Rotterdam Blaak, Schiedam Centrum, Rotterdam Centraal, Dordrecht, Roosendaal, Etten-Leur, Breda, Dordrecht, Rotterdam Blaak, Rotterdam Alexander, Gouda, Rotterdam Alexander, Rotterdam Blaak, Dordrecht, Rotterdam Centraal]"
train_16,"[Tilburg, Breda, Tilburg, Breda, Tilburg, s-Hertogenbosch, Eindhoven, Weert, Eindhoven, Tilburg, s-Hertogenbosch, Tilburg]"
train_17,"[Delft, Den Haag Centraal, Gouda, Den Haag HS, Leiden Centraal, Den Haag HS, Leiden Centraal, Alphen a/d Rijn, Utrecht Centraal, Hilversum, Almere Centrum]"
train_18,"[Roosendaal, Dordrecht, Rotterdam Centraal, Schiedam Centrum, Rotterdam Centraal, Schiedam Centrum, Rotterdam Centraal, Schiedam Centrum, Rotterdam Blaak, Schiedam Centrum, Rotterdam Blaak, Schiedam Centrum, Delft, Schiedam Centrum, Delft, Schiedam Centrum, Rotterdam Blaak, Dordrecht, Rotterdam Blaak]"
train_19,"[Den Haag Laan v NOI, Leiden Centraal, Den Haag Laan v NOI, Leiden Centraal, Den Haag Laan v NOI, Leiden Centraal, Heemstede-Aerdenhout, Haarlem, Amsterdam Sloterdijk, Zaandam, Hoorn, Alkmaar, Hoorn]"
train_20,"[Amsterdam Zuid, Amsterdam Amstel, Hilversum, Almere Centrum, Hilversum, Amsterdam Amstel, Almere Centrum, Amsterdam Centraal]"
score,3353.044943820225
