train,stations
train_1,"[Leiden Centraal, Den Haag Centraal, Gouda, Utrecht Centraal, s-Hertogenbosch, Eindhoven, Helmond, Venlo, Helmond]"
train_2,"[Venlo, Helmond, Venlo, Helmond, Eindhoven, Tilburg, Breda, Dordrecht, Rotterdam Centraal]"
train_3,"[Heerenveen, Leeuwarden, Groningen, Leeuwarden, Groningen, Leeuwarden]"
train_4,"[Apeldoorn, Deventer, Zutphen, Deventer, Apeldoorn, Deventer, Zwolle, Almelo, Zwolle]"
train_5,"[Heerlen, Sittard, Roermond, Weert, Roermond, Weert, Eindhoven, Helmond, Venlo, Helmond]"
train_6,"[Arnhem Centraal, Nijmegen, Arnhem Centraal, Ede-Wageningen, Utrecht Centraal, Hilversum, Almere Centrum, Amsterdam Centraal, Utrecht Centraal, Schiphol Airport]"
train_7,"[Heerlen, Sittard, Heerlen, Sittard, Roermond, Sittard, Roermond, Weert, Eindhoven, Weert, Roermond, Weert]"
train_8,"[Leiden Centraal, Den Haag Centraal, Delft, Den Haag HS, Delft, Schiedam Centrum, Rotterdam Blaak, Rotterdam Alexander, Gouda, Rotterdam Alexander, Rotterdam Blaak, Schiedam Centrum, Delft, Schiedam Centrum, Rotterdam Centraal, Schiedam Centrum, Rotterdam Centraal, Schiedam Centrum, Rotterdam Centraal, Rotterdam Alexander, Rotterdam Blaak, Dordrecht]"
train_9,"[Zwolle, Almelo, Hengelo, Enschede, Hengelo, Almelo, Deventer, Almelo, Zwolle]"
train_10,"[Roermond, Weert, Roermond, Weert, Roermond, Sittard, Roermond, Weert, Roermond, Sittard, Maastricht, Sittard, Maastricht]"
train_11,"[Rotterdam Blaak, Schiedam Centrum, Rotterdam Blaak, Rotterdam Alexander, Rotterdam Centraal, Dordrecht, Rotterdam Centraal, Dordrecht, Rotterdam Centraal, Dordrecht, Breda, Tilburg, s-Hertogenbosch]"
train_12,"[Dordrecht, Rotterdam Blaak, Dordrecht, Rotterdam Blaak, Rotterdam Alexander, Rotterdam Centraal, Rotterdam Alexander, Gouda, Den Haag Laan v NOI, Gouda, Alphen a/d Rijn, Gouda]"
train_13,"[Den Haag Centraal, Delft, Den Haag Laan v NOI, Gouda, Rotterdam Alexander, Rotterdam Centraal, Rotterdam Alexander, Rotterdam Blaak, Schiedam Centrum, Rotterdam Centraal, Dordrecht, Rotterdam Centraal, Schiedam Centrum, Rotterdam Centraal, Schiedam Centrum, Rotterdam Centraal, Dordrecht]"
train_14,"[Heerlen, Sittard, Maastricht, Sittard, Maastricht, Sittard, Roermond, Sittard, Heerlen, Sittard, Roermond, Weert]"
train_15,"[Delft, Den Haag Laan v NOI, Leiden Centraal, Den Haag Laan v NOI, Gouda, Rotterdam Alexander, Rotterdam Blaak, Rotterdam Alexander, Rotterdam Centraal, Dordrecht, Rotterdam Centraal, Rotterdam Alexander, Gouda, Den Haag HS, Leiden Centraal]"
train_16,"[Leeuwarden, Heerenveen, Leeuwarden, Heerenveen, Steenwijk, Zwolle, Assen, Zwolle]"
train_17,"[Dordrecht, Breda, Dordrecht, Rotterdam Blaak, Dordrecht, Rotterdam Centraal, Schiedam Centrum, Rotterdam Centraal, Dordrecht, Breda, Tilburg, Breda, Etten-Leur, Roosendaal]"
train_18,"[Hilversum, Almere Centrum, Hilversum, Almere Centrum, Hilversum, Utrecht Centraal, Hilversum, Utrecht Centraal, Hilversum]"
train_19,"[Beverwijk, Castricum, Zaandam, Castricum, Zaandam, Amsterdam Sloterdijk, Haarlem, Heemstede-Aerdenhout, Haarlem, Amsterdam Sloterdijk, Haarlem, Heemstede-Aerdenhout, Haarlem, Heemstede-Aerdenhout, Leiden Centraal, Den Haag Centraal, Gouda, Rotterdam Alexander]"
train_20,"[Venlo, Helmond, Eindhoven, s-Hertogenbosch, Utrecht Centraal, Schiphol Airport, Utrecht Centraal, Ede-Wageningen]"
score,1368.5730337078649
