train,stations
train_1,"[Utrecht Centraal, Amersfoort, Zwolle, Amersfoort, Zwolle, Steenwijk, Zwolle]"
train_2,"[Amsterdam Sloterdijk, Haarlem, Beverwijk, Haarlem, Amsterdam Sloterdijk, Haarlem, Heemstede-Aerdenhout, Leiden Centraal, Heemstede-Aerdenhout, Haarlem, Heemstede-Aerdenhout, Leiden Centraal, Alphen a/d Rijn, Utrecht Centraal]"
train_3,"[Beverwijk, Castricum, Beverwijk, Castricum, Beverwijk, Castricum, Beverwijk, Castricum, Alkmaar, Castricum, Zaandam, Beverwijk, Castricum, Beverwijk]"
train_4,"[Heerlen, Sittard, Heerlen, Sittard, Roermond, Sittard, Roermond, Sittard, Roermond, Weert, Roermond, Sittard, Maastricht]"
train_5,"[Amsterdam Amstel, Hilversum, Amsterdam Amstel, Utrecht Centraal, Schiphol Airport, Utrecht Centraal, Hilversum]"
train_6,"[Amersfoort, Utrecht Centraal, Alphen a/d Rijn, Utrecht Centraal, Schiphol Airport, Utrecht Centraal, Amsterdam Amstel, Amsterdam Zuid, Schiphol Airport]"
train_7,"[Roermond, Weert, Eindhoven, Weert, Roermond, Sittard, Maastricht, Sittard, Heerlen, Sittard, Roermond, Weert]"
train_8,"[Amsterdam Zuid, Schiphol Airport, Amsterdam Zuid, Amsterdam Sloterdijk, Zaandam, Castricum, Zaandam, Castricum, Alkmaar, Den Helder, Alkmaar, Castricum, Alkmaar, Castricum]"
train_9,"[Heerlen, Sittard, Maastricht, Sittard, Maastricht, Sittard, Heerlen, Sittard, Maastricht, Sittard, Maastricht, Sittard]"
train_10,"[Venlo, Helmond, Eindhoven, s-Hertogenbosch, Oss, s-Hertogenbosch, Utrecht Centraal, Gouda, Den Haag Centraal, Leiden Centraal, Den Haag HS, Leiden Centraal]"
train_11,"[Amsterdam Zuid, Amsterdam Amstel, Amsterdam Zuid, Schiphol Airport, Leiden Centraal, Schiphol Airport, Amsterdam Zuid, Schiphol Airport, Amsterdam Zuid, Amsterdam Amstel, Amsterdam Zuid, Amsterdam Amstel, Amsterdam Centraal, Almere Centrum, Amsterdam Amstel]"
train_12,"[Maastricht, Sittard, Roermond, Weert, Roermond, Sittard, Roermond, Weert, Eindhoven, Tilburg, Breda, Etten-Leur, Breda]"
train_13,"[Venlo, Helmond, Eindhoven, Weert, Roermond, Weert, Eindhoven, Helmond, Venlo, Helmond, Eindhoven]"
train_14,"[Oss, s-Hertogenbosch, Tilburg, Breda, Tilburg, Eindhoven, Weert, Roermond, Weert, Eindhoven, Tilburg, Breda, Etten-Leur]"
train_15,"[Alphen a/d Rijn, Utrecht Centraal, Amersfoort, Zwolle, Almelo, Deventer, Zwolle]"
train_16,"[Gouda, Den Haag HS, Delft, Den Haag Laan v NOI, Leiden Centraal, Heemstede-Aerdenhout, Leiden Centraal, Den Haag Laan v NOI, Gouda, Utrecht Centraal, Amsterdam Centraal, Almere Centrum]"
train_17,"[Amsterdam Amstel, Amsterdam Zuid, Amsterdam Amstel, Hilversum, Almere Centrum, Hilversum, Almere Centrum, Hilversum, Almere Centrum]"
train_18,"[Beverwijk, Castricum, Zaandam, Beverwijk, Haarlem, Amsterdam Sloterdijk, Amsterdam Zuid, Amsterdam Amstel, Almere Centrum, Hilversum]"
train_19,"[Sittard, Maastricht, Sittard, Heerlen, Sittard, Maastricht, Sittard, Heerlen, Sittard, Roermond, Sittard, Heerlen]"
train_20,"[Schiphol Airport, Amsterdam Zuid, Amsterdam Amstel, Utrecht Centraal, s-Hertogenbosch, Oss, s-Hertogenbosch, Eindhoven, s-Hertogenbosch, Eindhoven, Helmond, Venlo]"
score,613.4157303370794
