train,stations
train_1,"[Den Haag Centraal, Gouda, Rotterdam Alexander, Rotterdam Centraal, Schiedam Centrum, Rotterdam Centraal, Schiedam Centrum, Rotterdam Centraal, Dordrecht, Roosendaal, Dordrecht, Rotterdam Centraal, Rotterdam Alexander, Rotterdam Centraal, Rotterdam Alexander, Rotterdam Centraal]"
train_2,"[Amersfoort, Utrecht Centraal, Hilversum, Almere Centrum, Lelystad Centrum, Almere Centrum, Lelystad Centrum, Almere Centrum, Amsterdam Centraal, Utrecht Centraal, Hilversum]"
train_3,"[Deventer, Zwolle, Assen, Groningen, Assen, Zwolle, Amersfoort]"
train_4,"[Heerlen, Sittard, Maastricht, Sittard, Roermond, Weert, Eindhoven, s-Hertogenbosch, Tilburg, Breda, Etten-Leur, Roosendaal, Dordrecht]"
train_5,"[Hilversum, Almere Centrum, Amsterdam Amstel, Amsterdam Zuid, Schiphol Airport, Amsterdam Zuid, Schiphol Airport, Utrecht Centraal, s-Hertogenbosch, Oss, s-Hertogenbosch]"
train_6,"[Dieren, Arnhem Centraal, Ede-Wageningen, Utrecht Centraal, Amsterdam Centraal, Amsterdam Amstel, Amsterdam Centraal, Utrecht Centraal, Amersfoort, Utrecht Centraal, Gouda]"
train_7,"[Castricum, Zaandam, Castricum, Alkmaar, Hoorn, Alkmaar, Castricum, Zaandam, Amsterdam Sloterdijk, Zaandam, Castricum, Beverwijk, Castricum, Beverwijk]"
train_8,"[Amsterdam Centraal, Amsterdam Sloterdijk, Haarlem, Heemstede-Aerdenhout, Haarlem, Amsterdam Sloterdijk, Haarlem, Beverwijk, Zaandam, Amsterdam Sloterdijk, Amsterdam Zuid, Amsterdam Sloterdijk, Zaandam, Castricum, Beverwijk, Castricum]"
train_9,"[Den Haag Laan v NOI, Gouda, Den Haag Laan v NOI, Delft, Den Haag Centraal, Gouda, Rotterdam Alexander, Gouda, Rotterdam Alexander, Gouda, Alphen a/d Rijn, Gouda]"
train_10,"[Breda, Dordrecht, Breda, Dordrecht, Rotterdam Blaak, Rotterdam Alexander, Rotterdam Blaak, Schiedam Centrum, Delft, Den Haag HS, Delft, Schiedam Centrum, Rotterdam Blaak, Schiedam Centrum, Delft, Den Haag Centraal]"
train_11,"[Schiphol Airport, Utrecht Centraal, Gouda, Utrecht Centraal, Ede-Wageningen, Arnhem Centraal, Dieren, Arnhem Centraal, Nijmegen, Arnhem Centraal, Dieren, Arnhem Centraal]"
train_12,"[Lelystad Centrum, Almere Centrum, Amsterdam Centraal, Almere Centrum, Hilversum, Almere Centrum, Amsterdam Centraal, Amsterdam Sloterdijk, Zaandam, Amsterdam Sloterdijk, Zaandam, Amsterdam Sloterdijk, Haarlem, Heemstede-Aerdenhout, Haarlem]"
train_13,"[Gouda, Alphen a/d Rijn, Leiden Centraal, Schiphol Airport, Amsterdam Zuid, Amsterdam Amstel, Amsterdam Zuid, Schiphol Airport, Utrecht Centraal, Schiphol Airport, Leiden Centraal, Schiphol Airport]"
train_14,"[Almelo, Deventer, Zutphen, Dieren, Arnhem Centraal, Dieren, Zutphen, Apeldoorn, Deventer, Zwolle, Almelo]"
train_15,"[Rotterdam Centraal, Rotterdam Alexander, Gouda, Den Haag HS, Delft, Den Haag Centraal, Gouda, Den Haag Laan v NOI, Leiden Centraal, Alphen a/d Rijn, Leiden Centraal, Alphen a/d Rijn, Leiden Centraal]"
train_16,"[Weert, Roermond, Sittard, Maastricht, Sittard, Roermond, Sittard, Maastricht, Sittard, Roermond, Sittard, Roermond, Sittard]"
train_17,"[Den Haag HS, Leiden Centraal, Schiphol Airport, Amsterdam Zuid, Schiphol Airport, Amsterdam Zuid, Schiphol Airport, Amsterdam Zuid, Amsterdam Sloterdijk, Amsterdam Zuid, Schiphol Airport, Amsterdam Zuid, Amsterdam Amstel, Amsterdam Centraal, Amsterdam Sloterdijk, Amsterdam Centraal, Amsterdam Amstel, Utrecht Centraal, Amersfoort]"
train_18,"[Haarlem, Heemstede-Aerdenhout, Leiden Centraal, Heemstede-Aerdenhout, Leiden Centraal, Den Haag Laan v NOI, Gouda, Alphen a/d Rijn, Leiden Centraal, Den Haag HS, Gouda, Utrecht Centraal]"
train_19,"[Tilburg, Eindhoven, Weert, Roermond, Sittard, Maastricht, Sittard, Roermond, Sittard, Heerlen, Sittard, Maastricht]"
train_20,"[Heemstede-Aerdenhout, Haarlem, Beverwijk, Haarlem, Beverwijk, Zaandam, Castricum, Zaandam, Hoorn, Zaandam]"
score,2866.606741573034
