train,stations
train_1,"[Almere Centrum, Hilversum, Amsterdam Amstel, Hilversum, Amsterdam Amstel, Utrecht Centraal, Amersfoort, Utrecht Centraal, Amsterdam Amstel]"
train_2,"[Dordrecht, Breda, Dordrecht, Rotterdam Blaak, Schiedam Centrum, Rotterdam Centraal, Schiedam Centrum, Rotterdam Blaak, Dordrecht, Breda, Etten-Leur, Roosendaal, Dordrecht, Breda, Etten-Leur]"
train_3,"[Assen, Groningen, Leeuwarden, Groningen, Assen, Groningen, Leeuwarden]"
train_4,"[Dieren, Zutphen, Dieren, Zutphen, Deventer, Zutphen, Deventer, Zutphen, Deventer, Zwolle, Steenwijk, Zwolle]"
train_5,"[Zutphen, Deventer, Apeldoorn, Deventer, Zwolle, Almelo, Zwolle, Amersfoort]"
train_6,"[Arnhem Centraal, Ede-Wageningen, Utrecht Centraal, Schiphol Airport, Utrecht Centraal, s-Hertogenbosch, Oss, Nijmegen, Oss]"
train_7,"[Tilburg, Breda, Etten-Leur, Roosendaal, Vlissingen, Roosendaal, Etten-Leur, Roosendaal]"
train_8,"[Roermond, Sittard, Roermond, Weert, Roermond, Weert, Roermond, Sittard, Roermond, Sittard, Maastricht, Sittard, Maastricht]"
train_9,"[Nijmegen, Arnhem Centraal, Nijmegen, Arnhem Centraal, Nijmegen, Oss, Nijmegen, Arnhem Centraal, Ede-Wageningen, Arnhem Centraal, Dieren, Zutphen, Dieren, Arnhem Centraal, Nijmegen, Arnhem Centraal]"
train_10,"[Groningen, Assen, Zwolle, Steenwijk, Heerenveen, Leeuwarden, Heerenveen, Steenwijk, Heerenveen, Leeuwarden]"
train_11,"[Vlissingen, Roosendaal, Dordrecht, Roosendaal, Vlissingen]"
train_12,"[Zutphen, Dieren, Arnhem Centraal, Nijmegen, Arnhem Centraal, Nijmegen, Arnhem Centraal, Nijmegen, Arnhem Centraal, Nijmegen, Oss, Nijmegen, Oss, Nijmegen]"
train_13,"[Zutphen, Apeldoorn, Amersfoort, Apeldoorn, Deventer, Almelo, Hengelo, Almelo, Zwolle]"
train_14,"[Steenwijk, Zwolle, Deventer, Zwolle, Deventer, Almelo, Hengelo, Enschede, Hengelo, Enschede, Hengelo, Almelo]"
train_15,"[Nijmegen, Arnhem Centraal, Ede-Wageningen, Arnhem Centraal, Dieren, Zutphen, Deventer, Almelo, Deventer, Almelo, Hengelo, Enschede, Hengelo, Enschede, Hengelo]"
train_16,"[Assen, Zwolle, Amersfoort, Apeldoorn, Amersfoort, Apeldoorn, Deventer, Apeldoorn]"
train_17,"[Lelystad Centrum, Almere Centrum, Lelystad Centrum, Almere Centrum, Lelystad Centrum, Almere Centrum, Amsterdam Amstel, Amsterdam Zuid, Amsterdam Sloterdijk, Amsterdam Zuid, Amsterdam Sloterdijk, Amsterdam Centraal]"
train_18,"[Assen, Groningen, Leeuwarden, Heerenveen, Leeuwarden, Heerenveen, Leeuwarden, Groningen, Assen]"
train_19,"[Nijmegen, Arnhem Centraal, Dieren, Arnhem Centraal, Nijmegen, Arnhem Centraal, Ede-Wageningen, Arnhem Centraal, Nijmegen, Oss, s-Hertogenbosch, Oss, Nijmegen, Arnhem Centraal, Nijmegen]"
train_20,"[Venlo, Helmond, Eindhoven, Tilburg, Breda, Tilburg, Eindhoven, Weert, Eindhoven, Tilburg]"
score,231.97752808988844
