train,stations
train_1,"[Steenwijk, Zwolle, Assen, Groningen, Assen, Zwolle, Assen]"
train_2,"[Sittard, Roermond, Weert, Roermond, Weert, Roermond, Sittard, Heerlen, Sittard, Roermond, Sittard, Roermond, Sittard]"
train_3,"[Enschede, Hengelo, Almelo, Zwolle, Deventer, Zwolle, Deventer, Apeldoorn, Amersfoort, Utrecht Centraal]"
train_4,"[Eindhoven, Weert, Roermond, Sittard, Maastricht, Sittard, Heerlen, Sittard, Roermond, Sittard, Maastricht, Sittard]"
train_5,"[Enschede, Hengelo, Enschede, Hengelo, Enschede, Hengelo, Enschede, Hengelo, Enschede, Hengelo, Enschede, Hengelo, Enschede, Hengelo, Almelo, Zwolle, Steenwijk]"
train_6,"[Alkmaar, Den Helder, Alkmaar, Den Helder, Alkmaar, Hoorn]"
train_7,"[Rotterdam Alexander, Rotterdam Centraal, Schiedam Centrum, Delft, Den Haag HS, Leiden Centraal, Den Haag Laan v NOI, Delft, Den Haag Centraal, Gouda, Den Haag Centraal, Leiden Centraal, Den Haag Laan v NOI, Gouda]"
train_8,"[Venlo, Helmond, Eindhoven, Weert, Eindhoven, s-Hertogenbosch, Oss, Nijmegen, Oss, Nijmegen, Oss]"
train_9,"[Heerlen, Sittard, Maastricht, Sittard, Maastricht, Sittard, Roermond, Sittard, Maastricht, Sittard, Maastricht, Sittard]"
train_10,"[Haarlem, Beverwijk, Castricum, Zaandam, Hoorn, Alkmaar, Hoorn, Zaandam, Castricum, Alkmaar]"
train_11,"[Utrecht Centraal, Amersfoort, Zwolle, Assen, Zwolle, Deventer, Apeldoorn]"
train_12,"[Den Haag Centraal, Leiden Centraal, Den Haag Laan v NOI, Delft, Den Haag Centraal, Leiden Centraal, Den Haag Laan v NOI, Delft, Den Haag HS, Leiden Centraal, Den Haag Laan v NOI, Gouda, Den Haag Centraal, Delft, Schiedam Centrum]"
train_13,"[Etten-Leur, Breda, Tilburg, Eindhoven, Tilburg, Breda, Tilburg, Eindhoven, Helmond, Eindhoven, Tilburg, Eindhoven, Helmond]"
train_14,"[Almere Centrum, Hilversum, Amsterdam Amstel, Hilversum, Utrecht Centraal, Gouda, Den Haag HS, Gouda, Den Haag Centraal]"
train_15,"[Gouda, Utrecht Centraal, Amersfoort, Apeldoorn, Amersfoort, Zwolle, Amersfoort]"
train_16,"[Amsterdam Centraal, Amsterdam Sloterdijk, Zaandam, Hoorn, Zaandam, Hoorn, Alkmaar, Hoorn, Alkmaar]"
train_17,"[Vlissingen, Roosendaal, Vlissingen]"
train_18,"[Heerlen, Sittard, Maastricht, Sittard, Maastricht, Sittard, Maastricht, Sittard, Heerlen, Sittard, Maastricht, Sittard]"
train_19,"[Weert, Eindhoven, Helmond, Eindhoven, Helmond, Eindhoven, Tilburg, Eindhoven, Tilburg, s-Hertogenbosch, Oss, s-Hertogenbosch, Oss, s-Hertogenbosch]"
train_20,"[Heerenveen, Leeuwarden, Heerenveen, Leeuwarden, Groningen, Leeuwarden, Groningen]"
score,597.0561797752807
