train,stations
train_1,"[Zaandam, Beverwijk, Zaandam, Beverwijk, Castricum, Beverwijk, Castricum, Zaandam, Beverwijk, Haarlem, Heemstede-Aerdenhout, Haarlem]"
train_2,"[Den Haag Centraal, Gouda, Rotterdam Alexander, Gouda, Alphen a/d Rijn, Leiden Centraal, Den Haag Centraal, Gouda, Utrecht Centraal, Alphen a/d Rijn, Utrecht Centraal]"
train_3,"[Sittard, Roermond, Sittard, Heerlen, Sittard, Maastricht, Sittard, Heerlen, Sittard, Heerlen, Sittard, Maastricht]"
train_4,"[Lelystad Centrum, Almere Centrum, Lelystad Centrum, Almere Centrum, Amsterdam Amstel, Hilversum, Almere Centrum, Hilversum, Amsterdam Amstel]"
train_5,"[Heerenveen, Leeuwarden, Groningen, Assen, Groningen, Assen, Zwolle, Amersfoort]"
train_6,"[Den Haag Centraal, Leiden Centraal, Schiphol Airport, Utrecht Centraal, Ede-Wageningen, Arnhem Centraal, Dieren, Zutphen, Apeldoorn, Zutphen, Apeldoorn]"
train_7,"[Den Haag HS, Leiden Centraal, Heemstede-Aerdenhout, Haarlem, Beverwijk, Castricum, Alkmaar, Hoorn, Zaandam, Castricum, Zaandam, Hoorn]"
train_8,"[Den Haag HS, Leiden Centraal, Schiphol Airport, Amsterdam Zuid, Schiphol Airport, Amsterdam Zuid, Amsterdam Amstel, Hilversum, Utrecht Centraal, Gouda, Rotterdam Alexander, Gouda, Rotterdam Alexander, Gouda, Utrecht Centraal]"
train_9,"[Utrecht Centraal, Hilversum, Almere Centrum, Hilversum, Utrecht Centraal, Hilversum, Almere Centrum, Amsterdam Centraal, Utrecht Centraal]"
train_10,"[Den Haag Centraal, Gouda, Den Haag HS, Gouda, Den Haag Laan v NOI, Gouda, Den Haag Centraal, Leiden Centraal, Alphen a/d Rijn, Gouda]"
train_11,"[Gouda, Utrecht Centraal, Schiphol Airport, Utrecht Centraal, Ede-Wageningen, Arnhem Centraal, Ede-Wageningen, Utrecht Centraal, Ede-Wageningen]"
train_12,"[Castricum, Alkmaar, Castricum, Alkmaar, Den Helder, Alkmaar, Castricum, Beverwijk, Zaandam, Amsterdam Sloterdijk, Amsterdam Zuid, Schiphol Airport]"
train_13,"[Zwolle, Deventer, Almelo, Deventer, Zwolle, Deventer, Almelo, Hengelo, Enschede, Hengelo, Almelo]"
train_14,"[Breda, Etten-Leur, Roosendaal, Dordrecht, Rotterdam Centraal, Schiedam Centrum, Delft, Den Haag HS, Leiden Centraal, Schiphol Airport, Amsterdam Zuid, Schiphol Airport, Leiden Centraal, Den Haag Laan v NOI, Gouda]"
train_15,"[Ede-Wageningen, Arnhem Centraal, Ede-Wageningen, Utrecht Centraal, s-Hertogenbosch, Eindhoven, Weert, Roermond, Sittard, Heerlen, Sittard]"
train_16,"[Rotterdam Alexander, Rotterdam Blaak, Schiedam Centrum, Rotterdam Centraal, Dordrecht, Roosendaal, Dordrecht, Breda, Etten-Leur, Breda, Dordrecht, Rotterdam Centraal, Dordrecht]"
train_17,"[Den Helder, Alkmaar, Hoorn, Alkmaar, Castricum, Alkmaar, Den Helder, Alkmaar]"
train_18,"[Maastricht, Sittard, Roermond, Sittard, Heerlen, Sittard, Heerlen, Sittard, Heerlen, Sittard, Heerlen, Sittard]"
train_19,"[Almelo, Hengelo, Almelo, Deventer, Apeldoorn, Zutphen, Dieren, Zutphen, Deventer, Zwolle, Deventer, Almelo]"
train_20,"[Lelystad Centrum, Almere Centrum, Hilversum, Amsterdam Amstel, Amsterdam Zuid, Amsterdam Sloterdijk, Haarlem, Beverwijk, Haarlem, Heemstede-Aerdenhout, Haarlem, Heemstede-Aerdenhout, Haarlem, Beverwijk]"
score,2135.4494382022467
