train,stations
train_1,"[Rotterdam Alexander, Rotterdam Centraal, Dordrecht, Rotterdam Centraal, Dordrecht, Breda, Dordrecht, Rotterdam Blaak, Dordrecht, Rotterdam Centraal, Schiedam Centrum, Rotterdam Centraal, Rotterdam Alexander, Rotterdam Blaak]"
train_2,"[Weert, Eindhoven, Weert, Roermond, Weert, Eindhoven, Weert, Roermond, Weert, Roermond, Sittard, Maastricht]"
train_3,"[Lelystad Centrum, Almere Centrum, Hilversum, Amsterdam Amstel, Utrecht Centraal, Schiphol Airport, Leiden Centraal, Den Haag Laan v NOI, Delft, Den Haag HS]"
train_4,"[Castricum, Alkmaar, Castricum, Beverwijk, Haarlem, Beverwijk, Haarlem, Beverwijk, Haarlem, Amsterdam Sloterdijk, Amsterdam Centraal, Almere Centrum, Amsterdam Amstel]"
train_5,"[Sittard, Roermond, Weert, Roermond, Sittard, Roermond, Weert, Roermond, Sittard, Roermond, Sittard, Maastricht, Sittard]"
train_6,"[Amsterdam Zuid, Amsterdam Amstel, Almere Centrum, Amsterdam Amstel, Utrecht Centraal, Hilversum, Almere Centrum, Hilversum, Utrecht Centraal]"
train_7,"[Den Haag Laan v NOI, Delft, Den Haag HS, Leiden Centraal, Schiphol Airport, Utrecht Centraal, Amsterdam Amstel, Hilversum, Almere Centrum, Lelystad Centrum]"
train_8,"[Tilburg, Eindhoven, s-Hertogenbosch, Utrecht Centraal, Gouda, Utrecht Centraal, Amsterdam Centraal, Almere Centrum, Amsterdam Amstel]"
train_9,"[Steenwijk, Heerenveen, Leeuwarden, Heerenveen, Steenwijk, Zwolle, Steenwijk, Zwolle, Amersfoort]"
train_10,"[Den Helder, Alkmaar, Den Helder, Alkmaar, Castricum, Zaandam, Hoorn]"
train_11,"[Schiedam Centrum, Rotterdam Blaak, Schiedam Centrum, Delft, Schiedam Centrum, Rotterdam Centraal, Schiedam Centrum, Delft, Den Haag HS, Leiden Centraal, Den Haag Centraal, Gouda, Den Haag Centraal, Delft, Den Haag Centraal, Leiden Centraal, Den Haag Centraal]"
train_12,"[Alphen a/d Rijn, Leiden Centraal, Heemstede-Aerdenhout, Leiden Centraal, Alphen a/d Rijn, Utrecht Centraal, Ede-Wageningen, Arnhem Centraal, Dieren, Zutphen, Dieren, Zutphen, Apeldoorn]"
train_13,"[s-Hertogenbosch, Utrecht Centraal, Schiphol Airport, Leiden Centraal, Heemstede-Aerdenhout, Leiden Centraal, Alphen a/d Rijn, Gouda, Den Haag HS, Gouda]"
train_14,"[Deventer, Almelo, Zwolle, Almelo, Zwolle, Steenwijk]"
train_15,"[Hoorn, Zaandam, Beverwijk, Haarlem, Beverwijk, Castricum, Beverwijk, Haarlem, Amsterdam Sloterdijk, Haarlem, Amsterdam Sloterdijk, Amsterdam Centraal]"
train_16,"[Utrecht Centraal, Amersfoort, Zwolle, Almelo, Hengelo, Enschede, Hengelo, Enschede, Hengelo, Almelo, Deventer, Zutphen]"
train_17,"[Leeuwarden, Groningen, Leeuwarden, Groningen, Leeuwarden, Heerenveen, Steenwijk]"
train_18,"[Oss, Nijmegen, Oss, s-Hertogenbosch, Utrecht Centraal, Alphen a/d Rijn, Leiden Centraal, Alphen a/d Rijn, Leiden Centraal, Heemstede-Aerdenhout, Haarlem, Beverwijk]"
train_19,"[Beverwijk, Castricum, Beverwijk, Haarlem, Heemstede-Aerdenhout, Haarlem, Amsterdam Sloterdijk, Haarlem, Amsterdam Sloterdijk, Amsterdam Centraal, Utrecht Centraal, s-Hertogenbosch, Eindhoven]"
train_20,"[Den Haag Centraal, Delft, Den Haag Laan v NOI, Gouda, Rotterdam Alexander, Gouda, Den Haag Centraal, Delft, Den Haag Laan v NOI, Delft, Den Haag Centraal, Leiden Centraal, Alphen a/d Rijn]"
score,2363.8089887640454
